Name,CMC,Colors,Color identity,Supertypes,Types,Subtypes,Rarity,Set,Power,Toughness,Loyalty,Text
Incremental Blight,5.0,['Black'],['B'],None,['Sorcery'],None,Uncommon,ARC,None,None,None,"Put a -1/-1 counter on target creature, two -1/-1 counters on another target creature, and three -1/-1 counters on a third target creature."
Mountain,0.0,None,['R'],['Basic'],['Land'],['Mountain'],Common,ARC,None,None,None,({T}: Add {R}.)
Metallurgeon,2.0,['White'],['W'],None,"['Artifact', 'Creature']","['Human', 'Artificer']",Uncommon,ARC,1,2,None,"{W}, {T}: Regenerate target artifact."
Khalni Garden,0.0,None,['G'],None,['Land'],None,Common,ARC,None,None,None,"Khalni Garden enters the battlefield tapped.\nWhen Khalni Garden enters the battlefield, create a 0/1 green Plant creature token.\n{T}: Add {G}."
Corpse Connoisseur,5.0,['Black'],['B'],None,['Creature'],"['Zombie', 'Wizard']",Uncommon,ARC,3,3,None,"When Corpse Connoisseur enters the battlefield, you may search your library for a creature card, put that card into your graveyard, then shuffle.\nUnearth {3}{B} ({3}{B}: Return this card from your graveyard to the battlefield. It gains haste. Exile it at the beginning of the next end step or if it would leave the battlefield. Unearth only as a sorcery.)"
Extractor Demon,6.0,['Black'],['B'],None,['Creature'],['Demon'],Rare,ARC,5,5,None,"Flying\nWhenever another creature leaves the battlefield, you may have target player mill two cards.\nUnearth {2}{B} ({2}{B}: Return this card from your graveyard to the battlefield. It gains haste. Exile it at the beginning of the next end step or if it would leave the battlefield. Unearth only as a sorcery.)"
Mountain,0.0,None,['R'],['Basic'],['Land'],['Mountain'],Common,ARC,None,None,None,({T}: Add {R}.)
Festering Goblin,1.0,['Black'],['B'],None,['Creature'],"['Zombie', 'Goblin']",Common,ARC,1,1,None,"When Festering Goblin dies, target creature gets -1/-1 until end of turn."
Kazandu Refuge,0.0,None,"['G', 'R']",None,['Land'],None,Uncommon,ARC,None,None,None,"Kazandu Refuge enters the battlefield tapped.\nWhen Kazandu Refuge enters the battlefield, you gain 1 life.\n{T}: Add {R} or {G}."
Dregscape Zombie,2.0,['Black'],['B'],None,['Creature'],['Zombie'],Common,ARC,2,1,None,Unearth {B} ({B}: Return this card from your graveyard to the battlefield. It gains haste. Exile it at the beginning of the next end step or if it would leave the battlefield. Unearth only as a sorcery.)
Graypelt Refuge,0.0,None,"['G', 'W']",None,['Land'],None,Uncommon,ARC,None,None,None,"Graypelt Refuge enters the battlefield tapped.\nWhen Graypelt Refuge enters the battlefield, you gain 1 life.\n{T}: Add {G} or {W}."
Cemetery Reaper,3.0,['Black'],['B'],None,['Creature'],['Zombie'],Rare,ARC,2,2,None,"Other Zombie creatures you control get +1/+1.\n{2}{B}, {T}: Exile target creature card from a graveyard. Create a 2/2 black Zombie creature token."
Barren Moor,0.0,None,['B'],None,['Land'],None,Common,ARC,None,None,None,"Barren Moor enters the battlefield tapped.\n{T}: Add {B}.\nCycling {B} ({B}, Discard this card: Draw a card.)"
Bog Witch,3.0,['Black'],['B'],None,['Creature'],"['Human', 'Spellshaper']",Common,ARC,1,1,None,"{B}, {T}, Discard a card: Add {B}{B}{B}."
Swamp,0.0,None,['B'],['Basic'],['Land'],['Swamp'],Common,ARC,None,None,None,({T}: Add {B}.)
Beacon of Unrest,5.0,['Black'],['B'],None,['Sorcery'],None,Rare,ARC,None,None,None,Put target artifact or creature card from a graveyard onto the battlefield under your control. Shuffle Beacon of Unrest into its owner's library.
Artisan of Kozilek,9.0,None,None,None,['Creature'],['Eldrazi'],Uncommon,ARC,10,9,None,"When you cast this spell, you may return target creature card from your graveyard to the battlefield.\nAnnihilator 2 (Whenever this creature attacks, defending player sacrifices two permanents.)"
Master Transmuter,4.0,['Blue'],['U'],None,"['Artifact', 'Creature']","['Human', 'Artificer']",Rare,ARC,1,2,None,"{U}, {T}, Return an artifact you control to its owner's hand: You may put an artifact card from your hand onto the battlefield."
Avatar of Woe,8.0,['Black'],['B'],None,['Creature'],['Avatar'],Rare,ARC,6,5,None,"If there are ten or more creature cards total in all graveyards, this spell costs {6} less to cast.\nFear (This creature can't be blocked except by artifact creatures and/or black creatures.)\n{T}: Destroy target creature. It can't be regenerated."
Spin into Myth,5.0,['Blue'],['U'],None,['Instant'],None,Uncommon,ARC,None,None,None,"Put target creature on top of its owner's library, then fateseal 2. (To fateseal 2, look at the top two cards of an opponent's library, then put any number of them on the bottom of that player's library and the rest on top in any order.)"
Oblivion Ring,3.0,['White'],['W'],None,['Enchantment'],None,Common,ARC,None,None,None,"When Oblivion Ring enters the battlefield, exile another target nonland permanent.\nWhen Oblivion Ring leaves the battlefield, return the exiled card to the battlefield under its owner's control."
Thunderstaff,3.0,None,None,None,['Artifact'],None,Uncommon,ARC,None,None,None,"As long as Thunderstaff is untapped, if a creature would deal combat damage to you, prevent 1 of that damage.\n{2}, {T}: Attacking creatures get +1/+0 until end of turn."
Leonin Abunas,4.0,['White'],['W'],None,['Creature'],"['Cat', 'Cleric']",Rare,ARC,2,5,None,Artifacts you control have hexproof. (They can't be the targets of spells or abilities your opponents control.)
Thran Dynamo,4.0,None,None,None,['Artifact'],None,Uncommon,ARC,None,None,None,{T}: Add {C}{C}{C}.
March of the Machines,4.0,['Blue'],['U'],None,['Enchantment'],None,Rare,ARC,None,None,None,Each noncreature artifact is an artifact creature with power and toughness each equal to its mana value. (Equipment that's a creature can't equip a creature.)
Synod Sanctum,1.0,None,None,None,['Artifact'],None,Uncommon,ARC,None,None,None,"{2}, {T}: Exile target permanent you control.\n{2}, Sacrifice Synod Sanctum: Return all cards exiled with Synod Sanctum to the battlefield under your control."
Sanctum Gargoyle,4.0,['White'],['W'],None,"['Artifact', 'Creature']",['Gargoyle'],Common,ARC,2,3,None,"Flying\nWhen Sanctum Gargoyle enters the battlefield, you may return target artifact card from your graveyard to your hand."
Synod Centurion,4.0,None,None,None,"['Artifact', 'Creature']",['Construct'],Uncommon,ARC,4,4,None,"When you control no other artifacts, sacrifice Synod Centurion."
Path to Exile,1.0,['White'],['W'],None,['Instant'],None,Uncommon,ARC,None,None,None,"Exile target creature. Its controller may search their library for a basic land card, put that card onto the battlefield tapped, then shuffle."
Sundering Titan,8.0,None,None,None,"['Artifact', 'Creature']",['Golem'],Rare,ARC,7,10,None,"When Sundering Titan enters or leaves the battlefield, choose a land of each basic land type, then destroy those lands."
Sun Droplet,2.0,None,None,None,['Artifact'],None,Uncommon,ARC,None,None,None,"Whenever you're dealt damage, put that many charge counters on Sun Droplet.\nAt the beginning of each upkeep, you may remove a charge counter from Sun Droplet. If you do, you gain 1 life."
Sorcerer's Strongbox,4.0,None,None,None,['Artifact'],None,Uncommon,ARC,None,None,None,"{2}, {T}: Flip a coin. If you win the flip, sacrifice Sorcerer's Strongbox and draw three cards."
Rakdos Signet,2.0,None,"['B', 'R']",None,['Artifact'],None,Common,ARC,None,None,None,"{1}, {T}: Add {B}{R}."
Skullcage,4.0,None,None,None,['Artifact'],None,Uncommon,ARC,None,None,None,"At the beginning of each opponent's upkeep, Skullcage deals 2 damage to that player unless they have exactly three or exactly four cards in hand."
Swamp,0.0,None,['B'],['Basic'],['Land'],['Swamp'],Common,ARC,None,None,None,({T}: Add {B}.)
