Name,CMC,Colors,Color identity,Supertypes,Types,Subtypes,Rarity,Set,Power,Toughness,Loyalty,Text
Grip of Phyresis,3.0,['Blue'],['U'],None,['Instant'],None,Uncommon,C16,None,None,None,"Gain control of target Equipment, then create a 0/0 black Phyrexian Germ creature token and attach that Equipment to it."
Necrogenesis,2.0,"['Black', 'Green']","['B', 'G']",None,['Enchantment'],None,Uncommon,C16,None,None,None,{2}: Exile target creature card from a graveyard. Create a 1/1 green Saproling creature token.
Shadowblood Ridge,0.0,None,"['B', 'R']",None,['Land'],None,Rare,C16,None,None,None,"{1}, {T}: Add {B}{R}."
Faerie Artisans,4.0,['Blue'],['U'],None,['Creature'],"['Faerie', 'Artificer']",Rare,C16,2,2,None,"Flying\nWhenever a nontoken creature enters the battlefield under an opponent's control, create a token that's a copy of that creature except it's an artifact in addition to its other types. Then exile all other tokens created with Faerie Artisans."
Progenitor Mimic,6.0,"['Green', 'Blue']","['G', 'U']",None,['Creature'],['Shapeshifter'],Mythic,C16,0,0,None,"You may have Progenitor Mimic enter the battlefield as a copy of any creature on the battlefield, except it has ""At the beginning of your upkeep, if this creature isn't a token, create a token that's a copy of this creature."""
Simic Growth Chamber,0.0,None,"['G', 'U']",None,['Land'],None,Uncommon,C16,None,None,None,"Simic Growth Chamber enters the battlefield tapped.\nWhen Simic Growth Chamber enters the battlefield, return a land you control to its owner's hand.\n{T}: Add {G}{U}."
Orzhov Advokist,3.0,['White'],['W'],None,['Creature'],"['Human', 'Advisor']",Uncommon,C16,1,4,None,"At the beginning of your upkeep, each player may put two +1/+1 counters on a creature they control. If a player does, creatures that player controls can't attack you or planeswalkers you control until your next turn."
Naya Charm,3.0,"['Green', 'Red', 'White']","['G', 'R', 'W']",None,['Instant'],None,Uncommon,C16,None,None,None,Choose one —\n• Naya Charm deals 3 damage to target creature.\n• Return target card from a graveyard to its owner's hand.\n• Tap all creatures target player controls.
Spinerock Knoll,0.0,None,['R'],None,['Land'],None,Rare,C16,None,None,None,"Hideaway (This land enters the battlefield tapped. When it does, look at the top four cards of your library, exile one face down, then put the rest on the bottom of your library.)\n{T}: Add {R}.\n{R}, {T}: You may play the exiled card without paying its mana cost if an opponent was dealt 7 or more damage this turn."
Duelist's Heritage,3.0,['White'],['W'],None,['Enchantment'],None,Rare,C16,None,None,None,"Whenever one or more creatures attack, you may have target attacking creature gain double strike until end of turn."
Mortify,3.0,"['Black', 'White']","['B', 'W']",None,['Instant'],None,Uncommon,C16,None,None,None,Destroy target creature or enchantment.
Sungrass Prairie,0.0,None,"['G', 'W']",None,['Land'],None,Rare,C16,None,None,None,"{1}, {T}: Add {G}{W}."
Coastal Breach,7.0,['Blue'],['U'],None,['Sorcery'],None,Rare,C16,None,None,None,Undaunted (This spell costs {1} less to cast for each opponent.)\nReturn all nonland permanents to their owners' hands.
Merciless Eviction,6.0,"['Black', 'White']","['B', 'W']",None,['Sorcery'],None,Rare,C16,None,None,None,Choose one —\n• Exile all artifacts.\n• Exile all creatures.\n• Exile all enchantments.\n• Exile all planeswalkers.
Sunpetal Grove,0.0,None,"['G', 'W']",None,['Land'],None,Rare,C16,None,None,None,Sunpetal Grove enters the battlefield tapped unless you control a Forest or a Plains.\n{T}: Add {G} or {W}.
Sublime Exhalation,7.0,['White'],['W'],None,['Sorcery'],None,Rare,C16,None,None,None,Undaunted (This spell costs {1} less to cast for each opponent.)\nDestroy all creatures.
Golgari Signet,2.0,None,"['B', 'G']",None,['Artifact'],None,Common,C16,None,None,None,"{1}, {T}: Add {B}{G}."
Swiftwater Cliffs,0.0,None,"['R', 'U']",None,['Land'],None,Common,C16,None,None,None,"Swiftwater Cliffs enters the battlefield tapped.\nWhen Swiftwater Cliffs enters the battlefield, you gain 1 life.\n{T}: Add {U} or {R}."
Selfless Squire,4.0,['White'],['W'],None,['Creature'],"['Human', 'Soldier']",Rare,C16,1,1,None,"Flash\nWhen Selfless Squire enters the battlefield, prevent all damage that would be dealt to you this turn.\nWhenever damage that would be dealt to you is prevented, put that many +1/+1 counters on Selfless Squire."
Fellwar Stone,2.0,None,None,None,['Artifact'],None,Uncommon,C16,None,None,None,{T}: Add one mana of any color that a land an opponent controls could produce.
Temple of the False God,0.0,None,None,None,['Land'],None,Uncommon,C16,None,None,None,{T}: Add {C}{C}. Activate only if you control five or more lands.
Everflowing Chalice,0.0,None,None,None,['Artifact'],None,Uncommon,C16,None,None,None,Multikicker {2}\nEverflowing Chalice enters the battlefield with a charge counter on it for each time it was kicked.\n{T}: Add {C} for each charge counter on Everflowing Chalice.
Terramorphic Expanse,0.0,None,None,None,['Land'],None,Common,C16,None,None,None,"{T}, Sacrifice Terramorphic Expanse: Search your library for a basic land card, put it onto the battlefield tapped, then shuffle."
Thornwood Falls,0.0,None,"['G', 'U']",None,['Land'],None,Common,C16,None,None,None,"Thornwood Falls enters the battlefield tapped.\nWhen Thornwood Falls enters the battlefield, you gain 1 life.\n{T}: Add {G} or {U}."
Transguild Promenade,0.0,None,None,None,['Land'],None,Common,C16,None,None,None,"Transguild Promenade enters the battlefield tapped.\nWhen Transguild Promenade enters the battlefield, sacrifice it unless you pay {1}.\n{T}: Add one mana of any color."
Underground River,0.0,None,"['B', 'U']",None,['Land'],None,Rare,C16,None,None,None,{T}: Add {C}.\n{T}: Add {U} or {B}. Underground River deals 1 damage to you.
Windbrisk Heights,0.0,None,['W'],None,['Land'],None,Rare,C16,None,None,None,"Hideaway (This land enters the battlefield tapped. When it does, look at the top four cards of your library, exile one face down, then put the rest on the bottom of your library.)\n{T}: Add {W}.\n{W}, {T}: You may play the exiled card without paying its mana cost if you attacked with three or more creatures this turn."
Etched Oracle,4.0,None,None,None,"['Artifact', 'Creature']",['Wizard'],Uncommon,C16,0,0,None,"Sunburst (This enters the battlefield with a +1/+1 counter on it for each color of mana spent to cast it.)\n{1}, Remove four +1/+1 counters from Etched Oracle: Target player draws three cards."
Plains,0.0,None,['W'],['Basic'],['Land'],['Plains'],Common,C16,None,None,None,({T}: Add {W}.)
Plains,0.0,None,['W'],['Basic'],['Land'],['Plains'],Common,C16,None,None,None,({T}: Add {W}.)
Plains,0.0,None,['W'],['Basic'],['Land'],['Plains'],Common,C16,None,None,None,({T}: Add {W}.)
Lavalanche,3.0,"['Black', 'Green', 'Red']","['B', 'G', 'R']",None,['Sorcery'],None,Rare,C16,None,None,None,Lavalanche deals X damage to target player or planeswalker and each creature that player or that planeswalker's controller controls.
"Jor Kadeen, the Prevailer",5.0,"['Red', 'White']","['R', 'W']",['Legendary'],['Creature'],"['Human', 'Warrior']",Rare,C16,5,4,None,First strike\nMetalcraft — Creatures you control get +3/+0 as long as you control three or more artifacts.
Juniper Order Ranger,5.0,"['Green', 'White']","['G', 'W']",None,['Creature'],"['Human', 'Knight', 'Ranger']",Uncommon,C16,2,4,None,"Whenever another creature enters the battlefield under your control, put a +1/+1 counter on that creature and a +1/+1 counter on Juniper Order Ranger."
Horizon Chimera,4.0,"['Green', 'Blue']","['G', 'U']",None,['Creature'],['Chimera'],Uncommon,C16,3,2,None,"Flash\nFlying, trample\nWhenever you draw a card, you gain 1 life."
"Hanna, Ship's Navigator",3.0,"['Blue', 'White']","['U', 'W']",['Legendary'],['Creature'],"['Human', 'Artificer']",Rare,C16,1,2,None,"{1}{W}{U}, {T}: Return target artifact or enchantment card from your graveyard to your hand."
"Iroas, God of Victory",4.0,"['Red', 'White']","['R', 'W']",['Legendary'],"['Enchantment', 'Creature']",['God'],Mythic,C16,7,4,None,"Indestructible\nAs long as your devotion to red and white is less than seven, Iroas isn't a creature.\nCreatures you control have menace.\nPrevent all damage that would be dealt to attacking creatures you control."
Korozda Guildmage,2.0,"['Black', 'Green']","['B', 'G']",None,['Creature'],"['Elf', 'Shaman']",Uncommon,C16,2,2,None,"{1}{B}{G}: Target creature gets +1/+1 and gains intimidate until end of turn. (It can't be blocked except by artifact creatures and/or creatures that share a color with it.)\n{2}{B}{G}, Sacrifice a nontoken creature: Create X 1/1 green Saproling creature tokens, where X is the sacrificed creature's toughness."
