Name,CMC,Colors,Color identity,Supertypes,Types,Subtypes,Rarity,Set,Power,Toughness,Loyalty,Text
"Silas Renn, Seeker Adept",3.0,"['Black', 'Blue']","['B', 'U']",['Legendary'],"['Artifact', 'Creature']",['Human'],Mythic,C16,2,2,None,"Deathtouch\nWhenever Silas Renn, Seeker Adept deals combat damage to a player, choose target artifact card in your graveyard. You may cast that card this turn.\nPartner (You can have two commanders if both have partner.)"
Darksteel Citadel,0.0,None,None,None,"['Artifact', 'Land']",None,Uncommon,C16,None,None,None,Indestructible\n{T}: Add {C}.
Sidar Kondo of Jamuraa,4.0,"['Green', 'White']","['G', 'W']",['Legendary'],['Creature'],"['Human', 'Knight']",Mythic,C16,2,5,None,"Flanking (Whenever a creature without flanking blocks this creature, the blocking creature gets -1/-1 until end of turn.)\nCreatures your opponents control without flying or reach can't block creatures with power 2 or less.\nPartner (You can have two commanders if both have partner.)"
Darkwater Catacombs,0.0,None,"['B', 'U']",None,['Land'],None,Rare,C16,None,None,None,"{1}, {T}: Add {U}{B}."
Saskia the Unyielding,4.0,"['Black', 'Green', 'Red', 'White']","['B', 'G', 'R', 'W']",['Legendary'],['Creature'],"['Human', 'Soldier']",Mythic,C16,3,4,None,"Vigilance, haste\nAs Saskia the Unyielding enters the battlefield, choose a player.\nWhenever a creature you control deals combat damage to a player, it deals that much damage to the chosen player."
Dimir Aqueduct,0.0,None,"['B', 'U']",None,['Land'],None,Uncommon,C16,None,None,None,"Dimir Aqueduct enters the battlefield tapped.\nWhen Dimir Aqueduct enters the battlefield, return a land you control to its owner's hand.\n{T}: Add {U}{B}."
"Reyhan, Last of the Abzan",3.0,"['Black', 'Green']","['B', 'G']",['Legendary'],['Creature'],"['Human', 'Warrior']",Rare,C16,0,0,None,"Reyhan, Last of the Abzan enters the battlefield with three +1/+1 counters on it.\nWhenever a creature you control dies or is put into the command zone, if it had one or more +1/+1 counters on it, you may put that many +1/+1 counters on target creature.\nPartner (You can have two commanders if both have partner.)"
Dismal Backwater,0.0,None,"['B', 'U']",None,['Land'],None,Common,C16,None,None,None,"Dismal Backwater enters the battlefield tapped.\nWhen Dismal Backwater enters the battlefield, you gain 1 life.\n{T}: Add {U} or {B}."
"Ravos, Soultender",5.0,"['Black', 'White']","['B', 'W']",['Legendary'],['Creature'],"['Human', 'Cleric']",Mythic,C16,2,2,None,"Flying\nOther creatures you control get +1/+1.\nAt the beginning of your upkeep, you may return target creature card from your graveyard to your hand.\nPartner (You can have two commanders if both have partner.)"
Dragonskull Summit,0.0,None,"['B', 'R']",None,['Land'],None,Rare,C16,None,None,None,Dragonskull Summit enters the battlefield tapped unless you control a Swamp or a Mountain.\n{T}: Add {B} or {R}.
Migratory Route,5.0,"['Blue', 'White']","['U', 'W']",None,['Sorcery'],None,Uncommon,C16,None,None,None,"Create four 1/1 white Bird creature tokens with flying.\nBasic landcycling {2} ({2}, Discard this card: Search your library for a basic land card, reveal it, put it into your hand, then shuffle.)"
Dreadship Reef,0.0,None,"['B', 'U']",None,['Land'],None,Uncommon,C16,None,None,None,"{T}: Add {C}.\n{1}, {T}: Put a storage counter on Dreadship Reef.\n{1}, Remove X storage counters from Dreadship Reef: Add X mana in any combination of {U} and/or {B}."
"Ludevic, Necro-Alchemist",3.0,"['Red', 'Blue']","['R', 'U']",['Legendary'],['Creature'],"['Human', 'Wizard']",Mythic,C16,1,4,None,"At the beginning of each player's end step, that player may draw a card if a player other than you lost life this turn.\nPartner (You can have two commanders if both have partner.)"
Assault Suit,4.0,None,None,None,['Artifact'],['Equipment'],Uncommon,C16,None,None,None,"Equipped creature gets +2/+2, has haste, can't attack you or planeswalkers you control, and can't be sacrificed.\nAt the beginning of each opponent's upkeep, you may have that player gain control of equipped creature until end of turn. If you do, untap it.\nEquip {3}"
Evolving Wilds,0.0,None,None,None,['Land'],None,Common,C16,None,None,None,"{T}, Sacrifice Evolving Wilds: Search your library for a basic land card, put it onto the battlefield tapped, then shuffle."
Kynaios and Tiro of Meletis,4.0,"['Green', 'Red', 'Blue', 'White']","['G', 'R', 'U', 'W']",['Legendary'],['Creature'],"['Human', 'Soldier']",Mythic,C16,2,8,None,"At the beginning of your end step, draw a card. Each player may put a land card from their hand onto the battlefield, then each opponent who didn't draws a card."
Akroan Horse,4.0,None,None,None,"['Artifact', 'Creature']",['Horse'],Rare,C16,0,4,None,"Defender\nWhen Akroan Horse enters the battlefield, an opponent gains control of it.\nAt the beginning of your upkeep, each opponent creates a 1/1 white Soldier creature token."
Exotic Orchard,0.0,None,None,None,['Land'],None,Rare,C16,None,None,None,{T}: Add one mana of any color that a land an opponent controls could produce.
"Kydele, Chosen of Kruphix",4.0,"['Green', 'Blue']","['G', 'U']",['Legendary'],['Creature'],"['Human', 'Wizard']",Mythic,C16,2,3,None,{T}: Add {C} for each card you've drawn this turn.\nPartner (You can have two commanders if both have partner.)
Forbidden Orchard,0.0,None,None,None,['Land'],None,Rare,C16,None,None,None,"{T}: Add one mana of any color.\nWhenever you tap Forbidden Orchard for mana, target opponent creates a 1/1 colorless Spirit creature token."
"Kraum, Ludevic's Opus",5.0,"['Red', 'Blue']","['R', 'U']",['Legendary'],['Creature'],"['Zombie', 'Horror']",Rare,C16,4,4,None,"Flying, haste\nWhenever an opponent casts their second spell each turn, draw a card.\nPartner (You can have two commanders if both have partner.)"
Order // Chaos,7.0,['White'],"['R', 'W']",None,['Instant'],None,Uncommon,C16,None,None,None,Exile target attacking creature.
Frontier Bivouac,0.0,None,"['G', 'R', 'U']",None,['Land'],None,Uncommon,C16,None,None,None,"Frontier Bivouac enters the battlefield tapped.\n{T}: Add {G}, {U}, or {R}."
"Ishai, Ojutai Dragonspeaker",4.0,"['Blue', 'White']","['U', 'W']",['Legendary'],['Creature'],"['Bird', 'Monk']",Mythic,C16,1,1,None,"Flying\nWhenever an opponent casts a spell, put a +1/+1 counter on Ishai, Ojutai Dragonspeaker.\nPartner (You can have two commanders if both have partner.)"
Golgari Rot Farm,0.0,None,"['B', 'G']",None,['Land'],None,Uncommon,C16,None,None,None,"Golgari Rot Farm enters the battlefield tapped.\nWhen Golgari Rot Farm enters the battlefield, return a land you control to its owner's hand.\n{T}: Add {B}{G}."
"Ikra Shidiqi, the Usurper",5.0,"['Black', 'Green']","['B', 'G']",['Legendary'],['Creature'],"['Naga', 'Wizard']",Mythic,C16,3,7,None,"Menace\nWhenever a creature you control deals combat damage to a player, you gain life equal to that creature's toughness.\nPartner (You can have two commanders if both have partner.)"
Trial // Error,4.0,"['White', 'Blue']","['B', 'U', 'W']",None,['Instant'],None,Uncommon,C16,None,None,None,Return all creatures blocking or blocked by target creature to their owner's hand.
Izzet Boilerworks,0.0,None,"['R', 'U']",None,['Land'],None,Uncommon,C16,None,None,None,"Izzet Boilerworks enters the battlefield tapped.\nWhen Izzet Boilerworks enters the battlefield, return a land you control to its owner's hand.\n{T}: Add {U}{R}."
Jungle Hollow,0.0,None,"['B', 'G']",None,['Land'],None,Common,C16,None,None,None,"Jungle Hollow enters the battlefield tapped.\nWhen Jungle Hollow enters the battlefield, you gain 1 life.\n{T}: Add {B} or {G}."
Grave Upheaval,6.0,"['Black', 'Red']","['B', 'R']",None,['Sorcery'],None,Uncommon,C16,None,None,None,"Put target creature card from a graveyard onto the battlefield under your control. It gains haste.\nBasic landcycling {2} ({2}, Discard this card: Search your library for a basic land card, reveal it, put it into your hand, then shuffle.)"
Worm Harvest,5.0,"['Black', 'Green']","['B', 'G']",None,['Sorcery'],None,Rare,C16,None,None,None,Create a 1/1 black and green Worm creature token for each land card in your graveyard.\nRetrace (You may cast this card from your graveyard by discarding a land card in addition to paying its other costs.)
Jungle Shrine,0.0,None,"['G', 'R', 'W']",None,['Land'],None,Uncommon,C16,None,None,None,"Jungle Shrine enters the battlefield tapped.\n{T}: Add {R}, {G}, or {W}."
"Bruse Tarl, Boorish Herder",4.0,"['Red', 'White']","['R', 'W']",['Legendary'],['Creature'],"['Human', 'Ally']",Mythic,C16,3,3,None,"Whenever Bruse Tarl, Boorish Herder enters the battlefield or attacks, target creature you control gains double strike and lifelink until end of turn.\nPartner (You can have two commanders if both have partner.)"
Thopter Foundry,2.0,"['Black', 'Blue', 'White']","['B', 'U', 'W']",None,['Artifact'],None,Uncommon,C16,None,None,None,"{1}, Sacrifice a nontoken artifact: Create a 1/1 blue Thopter artifact creature token with flying. You gain 1 life."
Grand Coliseum,0.0,None,None,None,['Land'],None,Rare,C16,None,None,None,Grand Coliseum enters the battlefield tapped.\n{T}: Add {C}.\n{T}: Add one mana of any color. Grand Coliseum deals 1 damage to you.
"Breya, Etherium Shaper",4.0,"['Black', 'Red', 'Blue', 'White']","['B', 'R', 'U', 'W']",['Legendary'],"['Artifact', 'Creature']",['Human'],Mythic,C16,4,4,None,"When Breya, Etherium Shaper enters the battlefield, create two 1/1 blue Thopter artifact creature tokens with flying.\n{2}, Sacrifice two artifacts: Choose one —\n• Breya deals 3 damage to target player or planeswalker.\n• Target creature gets -4/-4 until end of turn.\n• You gain 5 life."
Spitting Image,6.0,"['Green', 'Blue']","['G', 'U']",None,['Sorcery'],None,Rare,C16,None,None,None,Create a token that's a copy of target creature.\nRetrace (You may cast this card from your graveyard by discarding a land card in addition to paying its other costs.)
Homeward Path,0.0,None,None,None,['Land'],None,Rare,C16,None,None,None,{T}: Add {C}.\n{T}: Each player gains control of all creatures they own.
"Atraxa, Praetors' Voice",4.0,"['Black', 'Green', 'Blue', 'White']","['B', 'G', 'U', 'W']",['Legendary'],['Creature'],"['Phyrexian', 'Angel', 'Horror']",Mythic,C16,4,4,None,"Flying, vigilance, deathtouch, lifelink\nAt the beginning of your end step, proliferate. (Choose any number of permanents and/or players, then give each another counter of each kind already there.)"
Selesnya Guildmage,2.0,"['Green', 'White']","['G', 'W']",None,['Creature'],"['Elf', 'Wizard']",Uncommon,C16,2,2,None,{3}{G}: Create a 1/1 green Saproling creature token.\n{3}{W}: Creatures you control get +1/+1 until end of turn.
Krosan Verge,0.0,None,None,None,['Land'],None,Uncommon,C16,None,None,None,"Krosan Verge enters the battlefield tapped.\n{T}: Add {C}.\n{2}, {T}, Sacrifice Krosan Verge: Search your library for a Forest card and a Plains card, put them onto the battlefield tapped, then shuffle."
Ancient Excavation,4.0,"['Black', 'Blue']","['B', 'U']",None,['Instant'],None,Uncommon,C16,None,None,None,"Draw cards equal to the number of cards in your hand, then discard a card for each card drawn this way.\nBasic landcycling {2} ({2}, Discard this card: Search your library for a basic land card, reveal it, put it into your hand, then shuffle.)"
Mirrorweave,4.0,"['Blue', 'White']","['U', 'W']",None,['Instant'],None,Rare,C16,None,None,None,Each other creature becomes a copy of target nonlegendary creature until end of turn.
Mosswort Bridge,0.0,None,['G'],None,['Land'],None,Rare,C16,None,None,None,"Hideaway (This land enters the battlefield tapped. When it does, look at the top four cards of your library, exile one face down, then put the rest on the bottom of your library.)\n{T}: Add {G}.\n{G}, {T}: You may play the exiled card without paying its mana cost if creatures you control have total power 10 or greater."
"Akiri, Line-Slinger",2.0,"['Red', 'White']","['R', 'W']",['Legendary'],['Creature'],"['Kor', 'Soldier', 'Ally']",Rare,C16,0,3,None,"First strike, vigilance\nAkiri, Line-Slinger gets +1/+0 for each artifact you control.\nPartner (You can have two commanders if both have partner.)"
Everlasting Torment,3.0,"['Black', 'Red']","['B', 'R']",None,['Enchantment'],None,Rare,C16,None,None,None,Players can't gain life.\nDamage can't be prevented.\nAll damage is dealt as though its source had wither. (A source with wither deals damage to creatures in the form of -1/-1 counters.)
Karplusan Forest,0.0,None,"['G', 'R']",None,['Land'],None,Rare,C16,None,None,None,{T}: Add {C}.\n{T}: Add {R} or {G}. Karplusan Forest deals 1 damage to you.
Stonehoof Chieftain,8.0,['Green'],['G'],None,['Creature'],"['Centaur', 'Warrior']",Rare,C16,8,8,None,"Trample, indestructible\nWhenever another creature you control attacks, it gains trample and indestructible until end of turn."
Zhur-Taa Druid,2.0,"['Green', 'Red']","['G', 'R']",None,['Creature'],"['Human', 'Druid']",Common,C16,1,1,None,"{T}: Add {G}.\nWhenever you tap Zhur-Taa Druid for mana, it deals 1 damage to each opponent."
Seeds of Renewal,7.0,['Green'],['G'],None,['Sorcery'],None,Rare,C16,None,None,None,Undaunted (This spell costs {1} less to cast for each opponent.)\nReturn up to two target cards from your graveyard to your hand. Exile Seeds of Renewal.
Zedruu the Greathearted,4.0,"['Red', 'Blue', 'White']","['R', 'U', 'W']",['Legendary'],['Creature'],"['Minotaur', 'Monk']",Mythic,C16,2,4,None,"At the beginning of your upkeep, you gain X life and draw X cards, where X is the number of permanents you own that your opponents control.\n{U}{R}{W}: Target opponent gains control of target permanent you control."
Murmuring Bosk,0.0,None,"['B', 'G', 'W']",None,['Land'],['Forest'],Rare,C16,None,None,None,"({T}: Add {G}.)\nAs Murmuring Bosk enters the battlefield, you may reveal a Treefolk card from your hand. If you don't, Murmuring Bosk enters the battlefield tapped.\n{T}: Add {W} or {B}. Murmuring Bosk deals 1 damage to you."
Primeval Protector,11.0,['Green'],['G'],None,['Creature'],['Avatar'],Rare,C16,10,10,None,"This spell costs {1} less to cast for each creature your opponents control.\nWhen Primeval Protector enters the battlefield, put a +1/+1 counter on each other creature you control."
Wilderness Elemental,3.0,"['Green', 'Red']","['G', 'R']",None,['Creature'],['Elemental'],Uncommon,C16,*,3,None,Trample\nWilderness Elemental's power is equal to the number of nonbasic lands your opponents control.
Myriad Landscape,0.0,None,None,None,['Land'],None,Uncommon,C16,None,None,None,"Myriad Landscape enters the battlefield tapped.\n{T}: Add {C}.\n{2}, {T}, Sacrifice Myriad Landscape: Search your library for up to two basic land cards that share a land type, put them onto the battlefield tapped, then shuffle."
Evolutionary Escalation,2.0,['Green'],['G'],None,['Enchantment'],None,Uncommon,C16,None,None,None,"At the beginning of your upkeep, put three +1/+1 counters on target creature you control and three +1/+1 counters on target creature an opponent controls."
Whispering Madness,4.0,"['Black', 'Blue']","['B', 'U']",None,['Sorcery'],None,Rare,C16,None,None,None,"Each player discards their hand, then draws cards equal to the greatest number of cards a player discarded this way.\nCipher (Then you may exile this spell card encoded on a creature you control. Whenever that creature deals combat damage to a player, its controller may cast a copy of the encoded card without paying its mana cost.)"
Mystic Monastery,0.0,None,"['R', 'U', 'W']",None,['Land'],None,Uncommon,C16,None,None,None,"Mystic Monastery enters the battlefield tapped.\n{T}: Add {U}, {R}, or {W}."
Benefactor's Draught,2.0,['Green'],['G'],None,['Instant'],None,Rare,C16,None,None,None,"Untap all creatures. Until end of turn, whenever a creature an opponent controls blocks, draw a card.\nDraw a card."
Vulturous Zombie,5.0,"['Black', 'Green']","['B', 'G']",None,['Creature'],"['Plant', 'Zombie']",Rare,C16,3,3,None,"Flying\nWhenever a card is put into an opponent's graveyard from anywhere, put a +1/+1 counter on Vulturous Zombie."
Opal Palace,0.0,None,None,None,['Land'],None,Common,C16,None,None,None,"{T}: Add {C}.\n{1}, {T}: Add one mana of any color in your commander's color identity. If you spend this mana to cast your commander, it enters the battlefield with a number of additional +1/+1 counters on it equal to the number of times it's been cast from the command zone this game."
Runehorn Hellkite,6.0,['Red'],['R'],None,['Creature'],['Dragon'],Rare,C16,5,5,None,"Flying\n{5}{R}, Exile Runehorn Hellkite from your graveyard: Each player discards their hand, then draws seven cards."
Vorel of the Hull Clade,3.0,"['Green', 'Blue']","['G', 'U']",['Legendary'],['Creature'],"['Human', 'Merfolk']",Rare,C16,1,4,None,"{G}{U}, {T}: Double the number of each kind of counter on target artifact, creature, or land."
Orzhov Basilica,0.0,None,"['B', 'W']",None,['Land'],None,Uncommon,C16,None,None,None,"Orzhov Basilica enters the battlefield tapped.\nWhen Orzhov Basilica enters the battlefield, return a land you control to its owner's hand.\n{T}: Add {W}{B}."
Goblin Spymaster,3.0,['Red'],['R'],None,['Creature'],"['Goblin', 'Rogue']",Rare,C16,2,1,None,"First strike\nAt the beginning of each opponent's end step, that player creates a 1/1 red Goblin creature token with ""Creatures you control attack each combat if able."""
Utter End,4.0,"['Black', 'White']","['B', 'W']",None,['Instant'],None,Rare,C16,None,None,None,Exile target nonland permanent.
Opulent Palace,0.0,None,"['B', 'G', 'U']",None,['Land'],None,Uncommon,C16,None,None,None,"Opulent Palace enters the battlefield tapped.\n{T}: Add {B}, {G}, or {U}."
Frenzied Fugue,4.0,['Red'],['R'],None,['Enchantment'],['Aura'],Uncommon,C16,None,None,None,"Enchant permanent\nWhen Frenzied Fugue enters the battlefield or at the beginning of your upkeep, gain control of enchanted permanent until end of turn. Untap that permanent. It gains haste until end of turn."
Terminate,2.0,"['Black', 'Red']","['B', 'R']",None,['Instant'],None,Common,C16,None,None,None,Destroy target creature. It can't be regenerated.
Nomad Outpost,0.0,None,"['B', 'R', 'W']",None,['Land'],None,Uncommon,C16,None,None,None,"Nomad Outpost enters the battlefield tapped.\n{T}: Add {R}, {W}, or {B}."
Gruul Turf,0.0,None,"['G', 'R']",None,['Land'],None,Uncommon,C16,None,None,None,"Gruul Turf enters the battlefield tapped.\nWhen Gruul Turf enters the battlefield, return a land you control to its owner's hand.\n{T}: Add {R}{G}."
Divergent Transformations,7.0,['Red'],['R'],None,['Instant'],None,Rare,C16,None,None,None,"Undaunted (This spell costs {1} less to cast for each opponent.)\nExile two target creatures. For each of those creatures, its controller reveals cards from the top of their library until they reveal a creature card, puts that card onto the battlefield, then shuffles the rest into their library."
"Sydri, Galvanic Genius",3.0,"['Black', 'Blue', 'White']","['B', 'U', 'W']",['Legendary'],['Creature'],"['Human', 'Artificer']",Mythic,C16,2,2,None,{U}: Target noncreature artifact becomes an artifact creature with power and toughness each equal to its mana value until end of turn.\n{W}{B}: Target artifact creature gains deathtouch and lifelink until end of turn.
Entrapment Maneuver,4.0,['White'],['W'],None,['Instant'],None,Rare,C16,None,None,None,"Target player sacrifices an attacking creature. You create X 1/1 white Soldier creature tokens, where X is that creature's toughness."
Sphinx Summoner,5.0,"['Black', 'Blue']","['B', 'U']",None,"['Artifact', 'Creature']",['Sphinx'],Rare,C16,3,3,None,"Flying\nWhen Sphinx Summoner enters the battlefield, you may search your library for an artifact creature card, reveal it, put it into your hand, then shuffle."
Rakdos Carnarium,0.0,None,"['B', 'R']",None,['Land'],None,Uncommon,C16,None,None,None,"Rakdos Carnarium enters the battlefield tapped.\nWhen Rakdos Carnarium enters the battlefield, return a land you control to its owner's hand.\n{T}: Add {B}{R}."
Curtains' Call,6.0,['Black'],['B'],None,['Instant'],None,Rare,C16,None,None,None,Undaunted (This spell costs {1} less to cast for each opponent.)\nDestroy two target creatures.
Spellheart Chimera,3.0,"['Red', 'Blue']","['R', 'U']",None,['Creature'],['Chimera'],Uncommon,C16,*,3,None,"Flying, trample\nSpellheart Chimera's power is equal to the number of instant and sorcery cards in your graveyard."
Reliquary Tower,0.0,None,None,None,['Land'],None,Uncommon,C16,None,None,None,You have no maximum hand size.\n{T}: Add {C}.
Parting Thoughts,3.0,['Black'],['B'],None,['Sorcery'],None,Uncommon,C16,None,None,None,"Destroy target creature. You draw X cards and you lose X life, where X is the number of counters on that creature."
Sharuum the Hegemon,6.0,"['Black', 'Blue', 'White']","['B', 'U', 'W']",['Legendary'],"['Artifact', 'Creature']",['Sphinx'],Mythic,C16,5,5,None,"Flying\nWhen Sharuum the Hegemon enters the battlefield, you may return target artifact card from your graveyard to the battlefield."
Rootbound Crag,0.0,None,"['G', 'R']",None,['Land'],None,Rare,C16,None,None,None,Rootbound Crag enters the battlefield tapped unless you control a Mountain or a Forest.\n{T}: Add {R} or {G}.
Charging Cinderhorn,4.0,['Red'],['R'],None,['Creature'],"['Elemental', 'Ox']",Rare,C16,4,2,None,"Haste\nAt the beginning of each player's end step, if no creatures attacked this turn, put a fury counter on Charging Cinderhorn. Then Charging Cinderhorn deals damage equal to the number of fury counters on it to that player."
"Selvala, Explorer Returned",3.0,"['Green', 'White']","['G', 'W']",['Legendary'],['Creature'],"['Elf', 'Scout']",Rare,C16,2,4,None,"Parley — {T}: Each player reveals the top card of their library. For each nonland card revealed this way, add {G} and you gain 1 life. Then each player draws a card."
Rugged Highlands,0.0,None,"['G', 'R']",None,['Land'],None,Common,C16,None,None,None,"Rugged Highlands enters the battlefield tapped.\nWhen Rugged Highlands enters the battlefield, you gain 1 life.\n{T}: Add {R} or {G}."
Magus of the Will,3.0,['Black'],['B'],None,['Creature'],"['Human', 'Wizard']",Rare,C16,3,3,None,"{2}{B}, {T}, Exile Magus of the Will: Until end of turn, you may play lands and cast spells from your graveyard. If a card would be put into your graveyard from anywhere this turn, exile that card instead."
Rubblehulk,6.0,"['Green', 'Red']","['G', 'R']",None,['Creature'],['Elemental'],Rare,C16,*,*,None,"Rubblehulk's power and toughness are each equal to the number of lands you control.\nBloodrush — {1}{R}{G}, Discard Rubblehulk: Target attacking creature gets +X/+X until end of turn, where X is the number of lands you control."
Rupture Spire,0.0,None,None,None,['Land'],None,Common,C16,None,None,None,"Rupture Spire enters the battlefield tapped.\nWhen Rupture Spire enters the battlefield, sacrifice it unless you pay {1}.\n{T}: Add one mana of any color."
Curse of Vengeance,1.0,['Black'],['B'],None,['Enchantment'],"['Aura', 'Curse']",Rare,C16,None,None,None,"Enchant player\nWhenever enchanted player casts a spell, put a spite counter on Curse of Vengeance.\nWhen enchanted player loses the game, you gain X life and draw X cards, where X is the number of spite counters on Curse of Vengeance."
Rakdos Charm,2.0,"['Black', 'Red']","['B', 'R']",None,['Instant'],None,Uncommon,C16,None,None,None,Choose one —\n• Exile target player's graveyard.\n• Destroy target artifact.\n• Each creature deals 1 damage to its controller.
Sandsteppe Citadel,0.0,None,"['B', 'G', 'W']",None,['Land'],None,Uncommon,C16,None,None,None,"Sandsteppe Citadel enters the battlefield tapped.\n{T}: Add {W}, {B}, or {G}."
Cruel Entertainment,7.0,['Black'],['B'],None,['Sorcery'],None,Rare,C16,None,None,None,"Choose target player and another target player. The first player controls the second player during the second player's next turn, and the second player controls the first player during the first player's next turn."
Putrefy,3.0,"['Black', 'Green']","['B', 'G']",None,['Instant'],None,Uncommon,C16,None,None,None,Destroy target artifact or creature. It can't be regenerated.
Savage Lands,0.0,None,"['B', 'G', 'R']",None,['Land'],None,Uncommon,C16,None,None,None,"Savage Lands enters the battlefield tapped.\n{T}: Add {B}, {R}, or {G}."
Manifold Insights,3.0,['Blue'],['U'],None,['Sorcery'],None,Rare,C16,None,None,None,"Reveal the top ten cards of your library. Starting with the next opponent in turn order, each opponent chooses a different nonland card from among them. Put the chosen cards into your hand and the rest on the bottom of your library in a random order."
Seaside Citadel,0.0,None,"['G', 'U', 'W']",None,['Land'],None,Uncommon,C16,None,None,None,"Seaside Citadel enters the battlefield tapped.\n{T}: Add {G}, {W}, or {U}."
Master Biomancer,4.0,"['Green', 'Blue']","['G', 'U']",None,['Creature'],"['Elf', 'Wizard']",Mythic,C16,2,4,None,Each other creature you control enters the battlefield with a number of additional +1/+1 counters on it equal to Master Biomancer's power and as a Mutant in addition to its other types.
Seat of the Synod,0.0,None,['U'],None,"['Artifact', 'Land']",None,Common,C16,None,None,None,(Seat of the Synod isn't a spell.)\n{T}: Add {U}.
Deepglow Skate,5.0,['Blue'],['U'],None,['Creature'],['Fish'],Rare,C16,3,3,None,"When Deepglow Skate enters the battlefield, double the number of each kind of counter on any number of target permanents."
Nath of the Gilt-Leaf,5.0,"['Black', 'Green']","['B', 'G']",['Legendary'],['Creature'],"['Elf', 'Warrior']",Rare,C16,4,4,None,"At the beginning of your upkeep, you may have target opponent discard a card at random.\nWhenever an opponent discards a card, you may create a 1/1 green Elf Warrior creature token."
Selesnya Sanctuary,0.0,None,"['G', 'W']",None,['Land'],None,Uncommon,C16,None,None,None,"Selesnya Sanctuary enters the battlefield tapped.\nWhen Selesnya Sanctuary enters the battlefield, return a land you control to its owner's hand.\n{T}: Add {G}{W}."
