Name,CMC,Colors,Color identity,Supertypes,Types,Subtypes,Rarity,Set,Power,Toughness,Loyalty,Text
Guiltfeeder,5.0,['Black'],['B'],None,['Creature'],['Horror'],Rare,C16,0,4,None,"Fear (This creature can't be blocked except by artifact creatures and/or black creatures.)\nWhenever Guiltfeeder attacks and isn't blocked, defending player loses 1 life for each card in their graveyard."
Ghastly Conscription,7.0,['Black'],['B'],None,['Sorcery'],None,Mythic,C16,None,None,None,"Exile all creature cards from target player's graveyard in a face-down pile, shuffle that pile, then manifest those cards. (To manifest a card, put it onto the battlefield face down as a 2/2 creature. Turn it face up any time for its mana cost if it's a creature card.)"
Festercreep,2.0,['Black'],['B'],None,['Creature'],['Elemental'],Common,C16,0,0,None,"Festercreep enters the battlefield with a +1/+1 counter on it.\n{1}{B}, Remove a +1/+1 counter from Festercreep: All other creatures get -1/-1 until end of turn."
Beacon of Unrest,5.0,['Black'],['B'],None,['Sorcery'],None,Rare,C16,None,None,None,Put target artifact or creature card from a graveyard onto the battlefield under your control. Shuffle Beacon of Unrest into its owner's library.
Executioner's Capsule,1.0,['Black'],['B'],None,['Artifact'],None,Common,C16,None,None,None,"{1}{B}, {T}, Sacrifice Executioner's Capsule: Destroy target nonblack creature."
Brutal Hordechief,4.0,['Black'],"['B', 'R', 'W']",None,['Creature'],"['Orc', 'Warrior']",Mythic,C16,3,3,None,"Whenever a creature you control attacks, defending player loses 1 life and you gain 1 life.\n{3}{R/W}{R/W}: Creatures your opponents control block this turn if able, and you choose how those creatures block."
Vedalken Engineer,2.0,['Blue'],['U'],None,['Creature'],"['Vedalken', 'Artificer']",Common,C16,1,1,None,{T}: Add two mana of any one color. Spend this mana only to cast artifact spells or activate abilities of artifacts.
Treasure Cruise,8.0,['Blue'],['U'],None,['Sorcery'],None,Common,C16,None,None,None,Delve (Each card you exile from your graveyard while casting this spell pays for {1}.)\nDraw three cards.
Bane of the Living,4.0,['Black'],['B'],None,['Creature'],['Insect'],Rare,C16,4,3,None,"Morph {X}{B}{B} (You may cast this card face down as a 2/2 creature for {3}. Turn it face up any time for its morph cost.)\nWhen Bane of the Living is turned face up, all creatures get -X/-X until end of turn."
Army of the Damned,8.0,['Black'],['B'],None,['Sorcery'],None,Mythic,C16,None,None,None,Create thirteen tapped 2/2 black Zombie creature tokens.\nFlashback {7}{B}{B}{B} (You may cast this card from your graveyard for its flashback cost. Then exile it.)
Windfall,3.0,['Blue'],['U'],None,['Sorcery'],None,Uncommon,C16,None,None,None,"Each player discards their hand, then draws cards equal to the greatest number of cards a player discarded this way."
Thrummingbird,2.0,['Blue'],['U'],None,['Creature'],"['Phyrexian', 'Bird', 'Horror']",Uncommon,C16,1,1,None,"Flying\nWhenever Thrummingbird deals combat damage to a player, proliferate. (Choose any number of permanents and/or players, then give each another counter of each kind already there.)"
Tezzeret's Gambit,4.0,['Blue'],['U'],None,['Sorcery'],None,Uncommon,C16,None,None,None,"({U/P} can be paid with either {U} or 2 life.)\nDraw two cards, then proliferate. (Choose any number of permanents and/or players, then give each another counter of each kind already there.)"
Swan Song,1.0,['Blue'],['U'],None,['Instant'],None,Rare,C16,None,None,None,"Counter target enchantment, instant, or sorcery spell. Its controller creates a 2/2 blue Bird creature token with flying."
Spelltwine,6.0,['Blue'],['U'],None,['Sorcery'],None,Rare,C16,None,None,None,Exile target instant or sorcery card from your graveyard and target instant or sorcery card from an opponent's graveyard. Copy those cards. Cast the copies if able without paying their mana costs. Exile Spelltwine.
Reins of Power,4.0,['Blue'],['U'],None,['Instant'],None,Rare,C16,None,None,None,Untap all creatures you control and all creatures target opponent controls. You and that opponent each gain control of all creatures the other controls until end of turn. Those creatures gain haste until end of turn.
Read the Runes,1.0,['Blue'],['U'],None,['Instant'],None,Rare,C16,None,None,None,"Draw X cards. For each card drawn this way, discard a card unless you sacrifice a permanent."
Propaganda,3.0,['Blue'],['U'],None,['Enchantment'],None,Uncommon,C16,None,None,None,Creatures can't attack you unless their controller pays {2} for each creature they control that's attacking you.
Minds Aglow,1.0,['Blue'],['U'],None,['Sorcery'],None,Rare,C16,None,None,None,"Join forces — Starting with you, each player may pay any amount of mana. Each player draws X cards, where X is the total amount of mana paid this way."
Master of Etherium,3.0,['Blue'],['U'],None,"['Artifact', 'Creature']","['Vedalken', 'Wizard']",Rare,C16,*,*,None,Master of Etherium's power and toughness are each equal to the number of artifacts you control.\nOther artifact creatures you control get +1/+1.
Evacuation,5.0,['Blue'],['U'],None,['Instant'],None,Rare,C16,None,None,None,Return all creatures to their owners' hands.
Ethersworn Adjudicator,5.0,['Blue'],"['B', 'U', 'W']",None,"['Artifact', 'Creature']","['Vedalken', 'Knight']",Mythic,C16,4,4,None,"Flying\n{1}{W}{B}, {T}: Destroy target creature or enchantment.\n{2}{U}: Untap Ethersworn Adjudicator."
Etherium Sculptor,2.0,['Blue'],['U'],None,"['Artifact', 'Creature']","['Vedalken', 'Artificer']",Common,C16,1,2,None,Artifact spells you cast cost {1} less to cast.
Disdainful Stroke,2.0,['Blue'],['U'],None,['Instant'],None,Common,C16,None,None,None,Counter target spell with mana value 4 or greater.
Devastation Tide,5.0,['Blue'],['U'],None,['Sorcery'],None,Rare,C16,None,None,None,Return all nonland permanents to their owners' hands.\nMiracle {1}{U} (You may cast this card for its miracle cost when you draw it if it's the first card you drew this turn.)
Chief Engineer,2.0,['Blue'],['U'],None,['Creature'],"['Vedalken', 'Artificer']",Rare,C16,1,3,None,Artifact spells you cast have convoke. (Your creatures can help cast those spells. Each creature you tap while casting an artifact spell pays for {1} or one mana of that creature's color.)
Chasm Skulker,3.0,['Blue'],['U'],None,['Creature'],"['Squid', 'Horror']",Rare,C16,1,1,None,"Whenever you draw a card, put a +1/+1 counter on Chasm Skulker.\nWhen Chasm Skulker dies, create X 1/1 blue Squid creature tokens with islandwalk, where X is the number of +1/+1 counters on Chasm Skulker. (They can't be blocked as long as defending player controls an Island.)"
Chain of Vapor,1.0,['Blue'],['U'],None,['Instant'],None,Uncommon,C16,None,None,None,"Return target nonland permanent to its owner's hand. Then that permanent's controller may sacrifice a land. If the player does, they may copy this spell and may choose a new target for that copy."
Arcane Denial,2.0,['Blue'],['U'],None,['Instant'],None,Common,C16,None,None,None,Counter target spell. Its controller may draw up to two cards at the beginning of the next turn's upkeep.\nYou draw a card at the beginning of the next turn's upkeep.
Aeon Chronicler,5.0,['Blue'],['U'],None,['Creature'],['Avatar'],Rare,C16,*,*,None,"Aeon Chronicler's power and toughness are each equal to the number of cards in your hand.\nSuspend X—{X}{3}{U}. X can't be 0.\nWhenever a time counter is removed from Aeon Chronicler while it's exiled, draw a card."
Academy Elite,4.0,['Blue'],['U'],None,['Creature'],"['Human', 'Wizard']",Rare,C16,0,0,None,"Academy Elite enters the battlefield with X +1/+1 counters on it, where X is the number of instant and sorcery cards in all graveyards.\n{2}{U}, Remove a +1/+1 counter from Academy Elite: Draw a card, then discard a card."
Windborn Muse,4.0,['White'],['W'],None,['Creature'],['Spirit'],Rare,C16,2,3,None,Flying\nCreatures can't attack you unless their controller pays {2} for each creature they control that's attacking you.
Wave of Reckoning,5.0,['White'],['W'],None,['Sorcery'],None,Rare,C16,None,None,None,Each creature deals damage to itself equal to its power.
Swords to Plowshares,1.0,['White'],['W'],None,['Instant'],None,Uncommon,C16,None,None,None,Exile target creature. Its controller gains life equal to its power.
Sphere of Safety,5.0,['White'],['W'],None,['Enchantment'],None,Uncommon,C16,None,None,None,"Creatures can't attack you or planeswalkers you control unless their controller pays {X} for each of those creatures, where X is the number of enchantments you control."
Sanctum Gargoyle,4.0,['White'],['W'],None,"['Artifact', 'Creature']",['Gargoyle'],Common,C16,2,3,None,"Flying\nWhen Sanctum Gargoyle enters the battlefield, you may return target artifact card from your graveyard to your hand."
Reverse the Sands,8.0,['White'],['W'],None,['Sorcery'],None,Rare,C16,None,None,None,Redistribute any number of players' life totals. (Each of those players gets one life total back.)
Empyrial Plate,2.0,None,None,None,['Artifact'],['Equipment'],Rare,C16,None,None,None,Equipped creature gets +1/+1 for each card in your hand.\nEquip {2}
Gruul Signet,2.0,None,"['G', 'R']",None,['Artifact'],None,Common,C16,None,None,None,"{1}, {T}: Add {R}{G}."
Reveillark,5.0,['White'],['W'],None,['Creature'],['Elemental'],Rare,C16,4,3,None,"Flying\nWhen Reveillark leaves the battlefield, return up to two target creature cards with power 2 or less from your graveyard to the battlefield.\nEvoke {5}{W} (You may cast this spell for its evoke cost. If you do, it's sacrificed when it enters the battlefield.)"
Commander's Sphere,3.0,None,None,None,['Artifact'],None,Common,C16,None,None,None,{T}: Add one mana of any color in your commander's color identity.\nSacrifice Commander's Sphere: Draw a card.
Howling Mine,2.0,None,None,None,['Artifact'],None,Rare,C16,None,None,None,"At the beginning of each player's draw step, if Howling Mine is untapped, that player draws an additional card."
Phyrexian Rebirth,6.0,['White'],['W'],None,['Sorcery'],None,Rare,C16,None,None,None,"Destroy all creatures, then create an X/X colorless Phyrexian Horror artifact creature token, where X is the number of creatures destroyed this way."
Darksteel Ingot,3.0,None,None,None,['Artifact'],None,Uncommon,C16,None,None,None,Indestructible\n{T}: Add one mana of any color.
Ichor Wellspring,2.0,None,None,None,['Artifact'],None,Common,C16,None,None,None,"When Ichor Wellspring enters the battlefield or is put into a graveyard from the battlefield, draw a card."
Open the Vaults,6.0,['White'],['W'],None,['Sorcery'],None,Rare,C16,None,None,None,Return all artifact and enchantment cards from all graveyards to the battlefield under their owners' control. (Auras with nothing to enchant remain in graveyards.)
Cranial Plating,2.0,None,['B'],None,['Artifact'],['Equipment'],Uncommon,C16,None,None,None,Equipped creature gets +1/+0 for each artifact you control.\n{B}{B}: Attach Cranial Plating to target creature you control.\nEquip {1}
Keening Stone,6.0,None,None,None,['Artifact'],None,Rare,C16,None,None,None,"{5}, {T}: Target player mills X cards, where X is the number of cards in that player's graveyard."
Oblation,3.0,['White'],['W'],None,['Instant'],None,Rare,C16,None,None,None,"The owner of target nonland permanent shuffles it into their library, then draws two cards."
Bonehoard,4.0,None,None,None,['Artifact'],['Equipment'],Rare,C16,None,None,None,"Living weapon (When this Equipment enters the battlefield, create a 0/0 black Phyrexian Germ creature token, then attach this to it.)\nEquipped creature gets +X/+X, where X is the number of creature cards in all graveyards.\nEquip {2}"
Lightning Greaves,2.0,None,None,None,['Artifact'],['Equipment'],Uncommon,C16,None,None,None,Equipped creature has haste and shroud. (It can't be the target of spells or abilities.)\nEquip {0}
Mirror Entity,3.0,['White'],['W'],None,['Creature'],['Shapeshifter'],Rare,C16,1,1,None,"Changeling (This card is every creature type.)\n{X}: Until end of turn, creatures you control have base power and toughness X/X and gain all creature types."
Blinkmoth Urn,5.0,None,None,None,['Artifact'],None,Rare,C16,None,None,None,"At the beginning of each player's precombat main phase, if Blinkmoth Urn is untapped, that player adds {C} for each artifact they control."
Loxodon Warhammer,3.0,None,None,None,['Artifact'],['Equipment'],Uncommon,C16,None,None,None,Equipped creature gets +3/+0 and has trample and lifelink.\nEquip {3}
Mentor of the Meek,3.0,['White'],['W'],None,['Creature'],"['Human', 'Soldier']",Rare,C16,2,2,None,"Whenever another creature with power 2 or less enters the battlefield under your control, you may pay {1}. If you do, draw a card."
Chromatic Lantern,3.0,None,None,None,['Artifact'],None,Rare,C16,None,None,None,"Lands you control have ""{T}: Add one mana of any color.""\n{T}: Add one mana of any color."
Mycosynth Wellspring,2.0,None,None,None,['Artifact'],None,Common,C16,None,None,None,"When Mycosynth Wellspring enters the battlefield or is put into a graveyard from the battlefield, you may search your library for a basic land card, reveal it, put it into your hand, then shuffle."
Hushwing Gryff,3.0,['White'],['W'],None,['Creature'],['Hippogriff'],Rare,C16,2,1,None,Flash\nFlying\nCreatures entering the battlefield don't cause abilities to trigger.
Cauldron of Souls,5.0,None,None,None,['Artifact'],None,Rare,C16,None,None,None,"{T}: Choose any number of target creatures. Each of those creatures gains persist until end of turn. (When it dies, if it had no -1/-1 counters on it, return it to the battlefield under its owner's control with a -1/-1 counter on it.)"
Myr Battlesphere,7.0,None,None,None,"['Artifact', 'Creature']","['Myr', 'Construct']",Rare,C16,4,7,None,"When Myr Battlesphere enters the battlefield, create four 1/1 colorless Myr artifact creature tokens.\nWhenever Myr Battlesphere attacks, you may tap X untapped Myr you control. If you do, Myr Battlesphere gets +X/+0 until end of turn and deals X damage to the player or planeswalker it's attacking."
Hoofprints of the Stag,2.0,['White'],['W'],None,"['Tribal', 'Enchantment']",['Elemental'],Rare,C16,None,None,None,"Whenever you draw a card, you may put a hoofprint counter on Hoofprints of the Stag.\n{2}{W}, Remove four hoofprint counters from Hoofprints of the Stag: Create a 4/4 white Elemental creature token with flying. Activate only during your turn."
Astral Cornucopia,0.0,None,None,None,['Artifact'],None,Rare,C16,None,None,None,Astral Cornucopia enters the battlefield with X charge counters on it.\n{T}: Choose a color. Add one mana of that color for each charge counter on Astral Cornucopia.
Myr Retriever,2.0,None,None,None,"['Artifact', 'Creature']",['Myr'],Uncommon,C16,1,1,None,"When Myr Retriever dies, return another target artifact card from your graveyard to your hand."
Ghostly Prison,3.0,['White'],['W'],None,['Enchantment'],None,Uncommon,C16,None,None,None,Creatures can't attack you unless their controller pays {2} for each creature they control that's attacking you.
Nevinyrral's Disk,4.0,None,None,None,['Artifact'],None,Rare,C16,None,None,None,"Nevinyrral's Disk enters the battlefield tapped.\n{1}, {T}: Destroy all artifacts, creatures, and enchantments."
Elite Scaleguard,5.0,['White'],['W'],None,['Creature'],"['Human', 'Soldier']",Uncommon,C16,2,3,None,"When Elite Scaleguard enters the battlefield, bolster 2. (Choose a creature with the least toughness among creatures you control and put two +1/+1 counters on it.)\nWhenever a creature you control with a +1/+1 counter on it attacks, tap target creature defending player controls."
Orzhov Signet,2.0,None,"['B', 'W']",None,['Artifact'],None,Common,C16,None,None,None,"{1}, {T}: Add {W}{B}."
Dispeller's Capsule,1.0,['White'],['W'],None,['Artifact'],None,Common,C16,None,None,None,"{2}{W}, {T}, Sacrifice Dispeller's Capsule: Destroy target artifact or enchantment."
Psychosis Crawler,5.0,None,None,None,"['Artifact', 'Creature']","['Phyrexian', 'Horror']",Rare,C16,*,*,None,"Psychosis Crawler's power and toughness are each equal to the number of cards in your hand.\nWhenever you draw a card, each opponent loses 1 life."
Custodi Soulbinders,4.0,['White'],['W'],None,['Creature'],"['Human', 'Cleric']",Rare,C16,0,0,None,"Custodi Soulbinders enters the battlefield with X +1/+1 counters on it, where X is the number of other creatures on the battlefield.\n{2}{W}, Remove a +1/+1 counter from Custodi Soulbinders: Create a 1/1 white Spirit creature token with flying."
Rakdos Signet,2.0,None,"['B', 'R']",None,['Artifact'],None,Common,C16,None,None,None,"{1}, {T}: Add {B}{R}."
Citadel Siege,4.0,['White'],['W'],None,['Enchantment'],None,Rare,C16,None,None,None,"As Citadel Siege enters the battlefield, choose Khans or Dragons.\n• Khans — At the beginning of combat on your turn, put two +1/+1 counters on target creature you control.\n• Dragons — At the beginning of combat on each opponent's turn, tap target creature that player controls."
Shimmer Myr,3.0,None,None,None,"['Artifact', 'Creature']",['Myr'],Rare,C16,2,2,None,Flash\nYou may cast artifact spells as though they had flash.
Cathars' Crusade,5.0,['White'],['W'],None,['Enchantment'],None,Rare,C16,None,None,None,"Whenever a creature enters the battlefield under your control, put a +1/+1 counter on each creature you control."
Simic Signet,2.0,None,"['G', 'U']",None,['Artifact'],None,Common,C16,None,None,None,"{1}, {T}: Add {G}{U}."
Brave the Sands,2.0,['White'],['W'],None,['Enchantment'],None,Uncommon,C16,None,None,None,Creatures you control have vigilance.\nEach creature you control can block an additional creature each combat.
Skullclamp,1.0,None,None,None,['Artifact'],['Equipment'],Uncommon,C16,None,None,None,"Equipped creature gets +1/-1.\nWhenever equipped creature dies, draw two cards.\nEquip {1}"
Blind Obedience,2.0,['White'],['W'],None,['Enchantment'],None,Rare,C16,None,None,None,"Extort (Whenever you cast a spell, you may pay {W/B}. If you do, each opponent loses 1 life and you gain that much life.)\nArtifacts and creatures your opponents control enter the battlefield tapped."
Sol Ring,1.0,None,None,None,['Artifact'],None,Uncommon,C16,None,None,None,{T}: Add {C}{C}.
Blazing Archon,9.0,['White'],['W'],None,['Creature'],['Archon'],Rare,C16,5,6,None,Flying\nCreatures can't attack you.
Solemn Simulacrum,4.0,None,None,None,"['Artifact', 'Creature']",['Golem'],Rare,C16,2,2,None,"When Solemn Simulacrum enters the battlefield, you may search your library for a basic land card, put that card onto the battlefield tapped, then shuffle.\nWhen Solemn Simulacrum dies, you may draw a card."
Abzan Falconer,3.0,['White'],['W'],None,['Creature'],"['Human', 'Soldier']",Uncommon,C16,2,3,None,"Outlast {W} ({W}, {T}: Put a +1/+1 counter on this creature. Outlast only as a sorcery.)\nEach creature you control with a +1/+1 counter on it has flying."
Soul of New Phyrexia,6.0,None,None,None,"['Artifact', 'Creature']","['Phyrexian', 'Avatar']",Mythic,C16,6,6,None,"Trample\n{5}: Permanents you control gain indestructible until end of turn.\n{5}, Exile Soul of New Phyrexia from your graveyard: Permanents you control gain indestructible until end of turn."
Ash Barrens,0.0,None,None,None,['Land'],None,Common,C16,None,None,None,"{T}: Add {C}.\nBasic landcycling {1} ({1}, Discard this card: Search your library for a basic land card, reveal it, put it into your hand, then shuffle.)"
Sunforger,3.0,None,"['R', 'W']",None,['Artifact'],['Equipment'],Rare,C16,None,None,None,"Equipped creature gets +4/+0.\n{R}{W}, Unattach Sunforger: Search your library for a red or white instant card with mana value 4 or less and cast that card without paying its mana cost. Then shuffle.\nEquip {3}"
Prismatic Geoscope,5.0,None,None,None,['Artifact'],None,Rare,C16,None,None,None,"Prismatic Geoscope enters the battlefield tapped.\nDomain — {T}: Add X mana in any combination of colors, where X is the number of basic land types among lands you control."
Swiftfoot Boots,2.0,None,None,None,['Artifact'],['Equipment'],Uncommon,C16,None,None,None,Equipped creature has hexproof and haste.\nEquip {1}
Crystalline Crawler,4.0,None,None,None,"['Artifact', 'Creature']",['Construct'],Rare,C16,1,1,None,Converge — Crystalline Crawler enters the battlefield with a +1/+1 counter on it for each color of mana spent to cast it.\nRemove a +1/+1 counter from Crystalline Crawler: Add one mana of any color.\n{T}: Put a +1/+1 counter on Crystalline Crawler.
Temple Bell,3.0,None,None,None,['Artifact'],None,Rare,C16,None,None,None,{T}: Each player draws a card.
Conqueror's Flail,2.0,None,None,None,['Artifact'],['Equipment'],Rare,C16,None,None,None,"Equipped creature gets +1/+1 for each color among permanents you control.\nAs long as Conqueror's Flail is attached to a creature, your opponents can't cast spells during your turn.\nEquip {2}"
Trading Post,4.0,None,None,None,['Artifact'],None,Rare,C16,None,None,None,"{1}, {T}, Discard a card: You gain 4 life.\n{1}, {T}, Pay 1 life: Create a 0/1 white Goat creature token.\n{1}, {T}, Sacrifice a creature: Return target artifact card from your graveyard to your hand.\n{1}, {T}, Sacrifice an artifact: Draw a card."
Boompile,4.0,None,None,None,['Artifact'],None,Rare,C16,None,None,None,"{T}: Flip a coin. If you win the flip, destroy all nonland permanents."
Venser's Journal,5.0,None,None,None,['Artifact'],None,Rare,C16,None,None,None,"You have no maximum hand size.\nAt the beginning of your upkeep, you gain 1 life for each card in your hand."
Armory Automaton,3.0,None,None,None,"['Artifact', 'Creature']",['Construct'],Rare,C16,2,2,None,"Whenever Armory Automaton enters the battlefield or attacks, you may attach any number of target Equipment to it. (Control of the Equipment doesn't change.)"
Whispersilk Cloak,3.0,None,None,None,['Artifact'],['Equipment'],Uncommon,C16,None,None,None,Equipped creature can't be blocked and has shroud. (It can't be the target of spells or abilities.)\nEquip {2}
"Yidris, Maelstrom Wielder",4.0,"['Black', 'Green', 'Red', 'Blue']","['B', 'G', 'R', 'U']",['Legendary'],['Creature'],"['Ogre', 'Wizard']",Mythic,C16,5,4,None,"Trample\nWhenever Yidris, Maelstrom Wielder deals combat damage to a player, as you cast spells from your hand this turn, they gain cascade. (When you cast the spell, exile cards from the top of your library until you exile a nonland card that costs less. You may cast it without paying its mana cost. Put the exiled cards on the bottom of your library in a random order.)"
Arcane Sanctum,0.0,None,"['B', 'U', 'W']",None,['Land'],None,Uncommon,C16,None,None,None,"Arcane Sanctum enters the battlefield tapped.\n{T}: Add {W}, {U}, or {B}."
Vial Smasher the Fierce,3.0,"['Black', 'Red']","['B', 'R']",['Legendary'],['Creature'],"['Goblin', 'Berserker']",Mythic,C16,2,3,None,"Whenever you cast your first spell each turn, choose an opponent at random. Vial Smasher the Fierce deals damage equal to that spell's mana value to that player or a planeswalker that player controls.\nPartner (You can have two commanders if both have partner.)"
Azorius Chancery,0.0,None,"['U', 'W']",None,['Land'],None,Uncommon,C16,None,None,None,"Azorius Chancery enters the battlefield tapped.\nWhen Azorius Chancery enters the battlefield, return a land you control to its owner's hand.\n{T}: Add {W}{U}."
Tymna the Weaver,3.0,"['Black', 'White']","['B', 'W']",['Legendary'],['Creature'],"['Human', 'Cleric']",Rare,C16,2,2,None,"Lifelink\nAt the beginning of your postcombat main phase, you may pay X life, where X is the number of opponents that were dealt combat damage this turn. If you do, draw X cards.\nPartner (You can have two commanders if both have partner.)"
Boros Garrison,0.0,None,"['R', 'W']",None,['Land'],None,Uncommon,C16,None,None,None,"Boros Garrison enters the battlefield tapped.\nWhen Boros Garrison enters the battlefield, return a land you control to its owner's hand.\n{T}: Add {R}{W}."
Treacherous Terrain,8.0,"['Green', 'Red']","['G', 'R']",None,['Sorcery'],None,Uncommon,C16,None,None,None,"Treacherous Terrain deals damage to each opponent equal to the number of lands that player controls.\nBasic landcycling {2} ({2}, Discard this card: Search your library for a basic land card, reveal it, put it into your hand, then shuffle.)"
Buried Ruin,0.0,None,None,None,['Land'],None,Uncommon,C16,None,None,None,"{T}: Add {C}.\n{2}, {T}, Sacrifice Buried Ruin: Return target artifact card from your graveyard to your hand."
"Thrasios, Triton Hero",2.0,"['Green', 'Blue']","['G', 'U']",['Legendary'],['Creature'],"['Merfolk', 'Wizard']",Rare,C16,1,3,None,"{4}: Scry 1, then reveal the top card of your library. If it's a land card, put it onto the battlefield tapped. Otherwise, draw a card.\nPartner (You can have two commanders if both have partner.)"
Caves of Koilos,0.0,None,"['B', 'W']",None,['Land'],None,Rare,C16,None,None,None,{T}: Add {C}.\n{T}: Add {W} or {B}. Caves of Koilos deals 1 damage to you.
"Tana, the Bloodsower",4.0,"['Green', 'Red']","['G', 'R']",['Legendary'],['Creature'],"['Elf', 'Druid']",Mythic,C16,2,2,None,"Trample\nWhenever Tana, the Bloodsower deals combat damage to a player, create that many 1/1 green Saproling creature tokens.\nPartner (You can have two commanders if both have partner.)"
Command Tower,0.0,None,None,None,['Land'],None,Common,C16,None,None,None,{T}: Add one mana of any color in your commander's color identity.
Sylvan Reclamation,5.0,"['Green', 'White']","['G', 'W']",None,['Instant'],None,Uncommon,C16,None,None,None,"Exile up to two target artifacts and/or enchantments.\nBasic landcycling {2} ({2}, Discard this card: Search your library for a basic land card, reveal it, put it into your hand, then shuffle.)"
Crumbling Necropolis,0.0,None,"['B', 'R', 'U']",None,['Land'],None,Uncommon,C16,None,None,None,"Crumbling Necropolis enters the battlefield tapped.\n{T}: Add {U}, {B}, or {R}."
