Name,CMC,Colors,Color identity,Supertypes,Types,Subtypes,Rarity,Set,Power,Toughness,Loyalty,Text
Sengir Vampire,5.0,['Black'],['B'],None,['Creature'],['Vampire'],Uncommon,CED,4,4,None,"Flying (This creature can't be blocked except by creatures with flying or reach.)\nWhenever a creature dealt damage by Sengir Vampire this turn dies, put a +1/+1 counter on Sengir Vampire."
Scavenging Ghoul,4.0,['Black'],['B'],None,['Creature'],['Zombie'],Uncommon,CED,2,2,None,"At the beginning of each end step, put a corpse counter on Scavenging Ghoul for each creature that died this turn.\nRemove a corpse counter from Scavenging Ghoul: Regenerate Scavenging Ghoul."
Scathe Zombies,3.0,['Black'],['B'],None,['Creature'],['Zombie'],Common,CED,2,2,None,None
Sacrifice,1.0,['Black'],['B'],None,['Instant'],None,Uncommon,CED,None,None,None,"As an additional cost to cast this spell, sacrifice a creature.\nAdd an amount of {B} equal to the sacrificed creature's mana value."
Royal Assassin,3.0,['Black'],['B'],None,['Creature'],"['Human', 'Assassin']",Rare,CED,1,1,None,{T}: Destroy target tapped creature.
Raise Dead,1.0,['Black'],['B'],None,['Sorcery'],None,Common,CED,None,None,None,Return target creature card from your graveyard to your hand.
Plague Rats,3.0,['Black'],['B'],None,['Creature'],['Rat'],Common,CED,*,*,None,Plague Rats's power and toughness are each equal to the number of creatures named Plague Rats on the battlefield.
Pestilence,4.0,['Black'],['B'],None,['Enchantment'],None,Common,CED,None,None,None,"At the beginning of the end step, if no creatures are on the battlefield, sacrifice Pestilence.\n{B}: Pestilence deals 1 damage to each creature and each player."
Paralyze,1.0,['Black'],['B'],None,['Enchantment'],['Aura'],Common,CED,None,None,None,"Enchant creature\nWhen Paralyze enters the battlefield, tap enchanted creature.\nEnchanted creature doesn't untap during its controller's untap step.\nAt the beginning of the upkeep of enchanted creature's controller, that player may pay {4}. If the player does, untap the creature."
Nightmare,6.0,['Black'],['B'],None,['Creature'],"['Nightmare', 'Horse']",Rare,CED,*,*,None,Flying (This creature can't be blocked except by creatures with flying or reach.)\nNightmare's power and toughness are each equal to the number of Swamps you control.
Nettling Imp,3.0,['Black'],['B'],None,['Creature'],['Imp'],Uncommon,CED,1,1,None,"{T}: Choose target non-Wall creature the active player has controlled continuously since the beginning of the turn. That creature attacks this turn if able. Destroy it at the beginning of the next end step if it didn't attack this turn. Activate only during an opponent's turn, before attackers are declared."
Nether Shadow,2.0,['Black'],['B'],None,['Creature'],['Spirit'],Rare,CED,1,1,None,"Haste\nAt the beginning of your upkeep, if Nether Shadow is in your graveyard with three or more creature cards above it, you may put Nether Shadow onto the battlefield."
Deathlace,1.0,['Black'],['B'],None,['Instant'],None,Rare,CED,None,None,None,Target spell or permanent becomes black. (Mana symbols on that permanent remain unchanged.)
Hypnotic Specter,3.0,['Black'],['B'],None,['Creature'],['Specter'],Uncommon,CED,2,2,None,"Flying\nWhenever Hypnotic Specter deals damage to an opponent, that player discards a card at random."
Lord of the Pit,7.0,['Black'],['B'],None,['Creature'],['Demon'],Rare,CED,7,7,None,"Flying, trample\nAt the beginning of your upkeep, sacrifice a creature other than Lord of the Pit. If you can't, Lord of the Pit deals 7 damage to you."
Mind Twist,1.0,['Black'],['B'],None,['Sorcery'],None,Rare,CED,None,None,None,Target player discards X cards at random.
Lich,4.0,['Black'],['B'],None,['Enchantment'],None,Rare,CED,None,None,None,"As Lich enters the battlefield, you lose life equal to your life total.\nYou don't lose the game for having 0 or less life.\nIf you would gain life, draw that many cards instead.\nWhenever you're dealt damage, sacrifice that many nontoken permanents. If you can't, you lose the game.\nWhen Lich is put into a graveyard from the battlefield, you lose the game."
Howl from Beyond,1.0,['Black'],['B'],None,['Instant'],None,Common,CED,None,None,None,Target creature gets +X/+0 until end of turn.
Gloom,3.0,['Black'],['B'],None,['Enchantment'],None,Uncommon,CED,None,None,None,White spells cost {3} more to cast.\nActivated abilities of white enchantments cost {3} more to activate.
Frozen Shade,3.0,['Black'],['B'],None,['Creature'],['Shade'],Common,CED,0,1,None,{B}: Frozen Shade gets +1/+1 until end of turn.
Drudge Skeletons,2.0,['Black'],['B'],None,['Creature'],['Skeleton'],Common,CED,1,1,None,"{B}: Regenerate Drudge Skeletons. (The next time this creature would be destroyed this turn, it isn't. Instead tap it, remove all damage from it, and remove it from combat.)"
Fear,2.0,['Black'],['B'],None,['Enchantment'],['Aura'],Common,CED,None,None,None,Enchant creature (Target a creature as you cast this. This card enters the battlefield attached to that creature.)\nEnchanted creature has fear. (It can't be blocked except by artifact creatures and/or black creatures.)
Forest,0.0,None,['G'],['Basic'],['Land'],['Forest'],Common,CED,None,None,None,({T}: Add {G}.)
Evil Presence,1.0,['Black'],['B'],None,['Enchantment'],['Aura'],Uncommon,CED,None,None,None,Enchant land\nEnchanted land is a Swamp.
Demonic Attorney,3.0,['Black'],['B'],None,['Sorcery'],None,Rare,CED,None,None,None,Remove Demonic Attorney from your deck before playing if you're not playing for ante.\nEach player antes the top card of their library.
Deathgrip,2.0,['Black'],['B'],None,['Enchantment'],None,Uncommon,CED,None,None,None,{B}{B}: Counter target green spell.
Drain Life,2.0,['Black'],['B'],None,['Sorcery'],None,Common,CED,None,None,None,"Spend only black mana on X.\nDrain Life deals X damage to any target. You gain life equal to the damage dealt, but not more life than the player's life total before the damage was dealt, the planeswalker's loyalty before the damage was dealt, or the creature's toughness."
Demonic Tutor,2.0,['Black'],['B'],None,['Sorcery'],None,Uncommon,CED,None,None,None,"Search your library for a card, put that card into your hand, then shuffle."
Demonic Hordes,6.0,['Black'],['B'],None,['Creature'],['Demon'],Rare,CED,5,5,None,"{T}: Destroy target land.\nAt the beginning of your upkeep, unless you pay {B}{B}{B}, tap Demonic Hordes and sacrifice a land of an opponent's choice."
Darkpact,3.0,['Black'],['B'],None,['Sorcery'],None,Rare,CED,None,None,None,Remove Darkpact from your deck before playing if you're not playing for ante.\nYou own target card in the ante. Exchange that card with the top card of your library.
Dark Ritual,1.0,['Black'],['B'],None,['Instant'],None,Common,CED,None,None,None,Add {B}{B}{B}.
Cursed Land,4.0,['Black'],['B'],None,['Enchantment'],['Aura'],Uncommon,CED,None,None,None,"Enchant land\nAt the beginning of the upkeep of enchanted land's controller, Cursed Land deals 1 damage to that player."
Contract from Below,1.0,['Black'],['B'],None,['Sorcery'],None,Rare,CED,None,None,None,"Remove Contract from Below from your deck before playing if you're not playing for ante.\nDiscard your hand, ante the top card of your library, then draw seven cards."
Bog Wraith,4.0,['Black'],['B'],None,['Creature'],['Wraith'],Uncommon,CED,3,3,None,Swampwalk (This creature can't be blocked as long as defending player controls a Swamp.)
Black Knight,2.0,['Black'],['B'],None,['Creature'],"['Human', 'Knight']",Uncommon,CED,2,2,None,"First strike (This creature deals combat damage before creatures without first strike.)\nProtection from white (This creature can't be blocked, targeted, dealt damage, or enchanted by anything white.)"
Bad Moon,2.0,['Black'],['B'],None,['Enchantment'],None,Rare,CED,None,None,None,Black creatures get +1/+1.
Animate Dead,2.0,['Black'],['B'],None,['Enchantment'],['Aura'],Uncommon,CED,None,None,None,"Enchant creature card in a graveyard\nWhen Animate Dead enters the battlefield, if it's on the battlefield, it loses ""enchant creature card in a graveyard"" and gains ""enchant creature put onto the battlefield with Animate Dead."" Return enchanted creature card to the battlefield under your control and attach Animate Dead to it. When Animate Dead leaves the battlefield, that creature's controller sacrifices it.\nEnchanted creature gets -1/-0."
Sinkhole,2.0,['Black'],['B'],None,['Sorcery'],None,Common,CED,None,None,None,Destroy target land.
Water Elemental,5.0,['Blue'],['U'],None,['Creature'],['Elemental'],Uncommon,CED,5,4,None,None
Wall of Water,3.0,['Blue'],['U'],None,['Creature'],['Wall'],Uncommon,CED,0,5,None,Defender (This creature can't attack.)\n{U}: Wall of Water gets +1/+0 until end of turn.
Wall of Air,3.0,['Blue'],['U'],None,['Creature'],['Wall'],Uncommon,CED,1,5,None,"Defender, flying (This creature can't attack, and it can block creatures with flying.)"
Simulacrum,2.0,['Black'],['B'],None,['Instant'],None,Uncommon,CED,None,None,None,You gain life equal to the damage dealt to you this turn. Simulacrum deals damage to target creature you control equal to the damage dealt to you this turn.
Volcanic Eruption,3.0,['Blue'],['U'],None,['Sorcery'],None,Rare,CED,None,None,None,Destroy X target Mountains. Volcanic Eruption deals damage to each creature and each player equal to the number of Mountains put into a graveyard this way.
Vesuvan Doppelganger,5.0,['Blue'],['U'],None,['Creature'],['Shapeshifter'],Rare,CED,0,0,None,"You may have Vesuvan Doppelganger enter the battlefield as a copy of any creature on the battlefield, except it doesn't copy that creature's color and it has ""At the beginning of your upkeep, you may have this creature become a copy of target creature, except it doesn't copy that creature's color and it has this ability."""
Unsummon,1.0,['Blue'],['U'],None,['Instant'],None,Common,CED,None,None,None,Return target creature to its owner's hand.
Twiddle,1.0,['Blue'],['U'],None,['Instant'],None,Common,CED,None,None,None,"You may tap or untap target artifact, creature, or land."
Timetwister,3.0,['Blue'],['U'],None,['Sorcery'],None,Rare,CED,None,None,None,"Each player shuffles their hand and graveyard into their library, then draws seven cards. (Then put Timetwister into its owner's graveyard.)"
Time Walk,2.0,['Blue'],['U'],None,['Sorcery'],None,Rare,CED,None,None,None,Take an extra turn after this one.
Thoughtlace,1.0,['Blue'],['U'],None,['Instant'],None,Rare,CED,None,None,None,Target spell or permanent becomes blue. (Mana symbols on that permanent remain unchanged.)
Steal Artifact,4.0,['Blue'],['U'],None,['Enchantment'],['Aura'],Uncommon,CED,None,None,None,Enchant artifact\nYou control enchanted artifact.
Stasis,2.0,['Blue'],['U'],None,['Enchantment'],None,Rare,CED,None,None,None,"Players skip their untap steps.\nAt the beginning of your upkeep, sacrifice Stasis unless you pay {U}."
Spell Blast,1.0,['Blue'],['U'],None,['Instant'],None,Common,CED,None,None,None,"Counter target spell with mana value X. (For example, if that spell's mana cost is {3}{U}{U}, X is 5.)"
Sleight of Mind,1.0,['Blue'],['U'],None,['Instant'],None,Rare,CED,None,None,None,"Change the text of target spell or permanent by replacing all instances of one color word with another. (For example, you may change ""target black spell"" to ""target blue spell."" This effect lasts indefinitely.)"
Siren's Call,1.0,['Blue'],['U'],None,['Instant'],None,Uncommon,CED,None,None,None,"Cast this spell only during an opponent's turn, before attackers are declared.\nCreatures the active player controls attack this turn if able.\nAt the beginning of the next end step, destroy all non-Wall creatures that player controls that didn't attack this turn. Ignore this effect for each creature the player didn't control continuously since the beginning of the turn."
Sea Serpent,6.0,['Blue'],['U'],None,['Creature'],['Serpent'],Common,CED,5,5,None,"Sea Serpent can't attack unless defending player controls an Island.\nWhen you control no Islands, sacrifice Sea Serpent."
Psychic Venom,2.0,['Blue'],['U'],None,['Enchantment'],['Aura'],Common,CED,None,None,None,"Enchant land\nWhenever enchanted land becomes tapped, Psychic Venom deals 2 damage to that land's controller."
Psionic Blast,3.0,['Blue'],['U'],None,['Instant'],None,Uncommon,CED,None,None,None,Psionic Blast deals 4 damage to any target and 2 damage to you.
Prodigal Sorcerer,3.0,['Blue'],['U'],None,['Creature'],"['Human', 'Wizard']",Common,CED,1,1,None,{T}: Prodigal Sorcerer deals 1 damage to any target.
Power Sink,1.0,['Blue'],['U'],None,['Instant'],None,Common,CED,None,None,None,"Counter target spell unless its controller pays {X}. If that player doesn't, they tap all lands with mana abilities they control and lose all unspent mana."
Power Leak,2.0,['Blue'],['U'],None,['Enchantment'],['Aura'],Common,CED,None,None,None,"Enchant enchantment\nAt the beginning of the upkeep of enchanted enchantment's controller, that player may pay any amount of mana. Power Leak deals 2 damage to that player. Prevent X of that damage, where X is the amount of mana that player paid this way."
Pirate Ship,5.0,['Blue'],['U'],None,['Creature'],"['Human', 'Pirate']",Rare,CED,4,3,None,"Pirate Ship can't attack unless defending player controls an Island.\n{T}: Pirate Ship deals 1 damage to any target.\nWhen you control no Islands, sacrifice Pirate Ship."
Phantom Monster,4.0,['Blue'],['U'],None,['Creature'],['Illusion'],Uncommon,CED,3,3,None,Flying
Phantasmal Terrain,2.0,['Blue'],['U'],None,['Enchantment'],['Aura'],Common,CED,None,None,None,"Enchant land\nAs Phantasmal Terrain enters the battlefield, choose a basic land type.\nEnchanted land is the chosen type."
Phantasmal Forces,4.0,['Blue'],['U'],None,['Creature'],['Illusion'],Uncommon,CED,4,1,None,"Flying\nAt the beginning of your upkeep, sacrifice Phantasmal Forces unless you pay {U}."
Merfolk of the Pearl Trident,1.0,['Blue'],['U'],None,['Creature'],['Merfolk'],Common,CED,1,1,None,None
Mana Short,3.0,['Blue'],['U'],None,['Instant'],None,Rare,CED,None,None,None,Tap all lands target player controls and that player loses all unspent mana.
Mahamoti Djinn,6.0,['Blue'],['U'],None,['Creature'],['Djinn'],Rare,CED,5,6,None,Flying (This creature can't be blocked except by creatures with flying or reach.)
Drain Power,2.0,['Blue'],['U'],None,['Sorcery'],None,Rare,CED,None,None,None,Target player activates a mana ability of each land they control. Then that player loses all unspent mana and you add the mana lost this way.
Magical Hack,1.0,['Blue'],['U'],None,['Instant'],None,Rare,CED,None,None,None,"Change the text of target spell or permanent by replacing all instances of one basic land type with another. (For example, you may change ""swampwalk"" to ""plainswalk."" This effect lasts indefinitely.)"
Lord of Atlantis,2.0,['Blue'],['U'],None,['Creature'],['Merfolk'],Rare,CED,2,2,None,Other Merfolk get +1/+1 and have islandwalk. (They can't be blocked as long as defending player controls an Island.)
Forest,0.0,None,['G'],['Basic'],['Land'],['Forest'],Common,CED,None,None,None,({T}: Add {G}.)
Lifetap,2.0,['Blue'],['U'],None,['Enchantment'],None,Uncommon,CED,None,None,None,"Whenever a Forest an opponent controls becomes tapped, you gain 1 life."
Jump,1.0,['Blue'],['U'],None,['Instant'],None,Common,CED,None,None,None,Target creature gains flying until end of turn.
Invisibility,2.0,['Blue'],['U'],None,['Enchantment'],['Aura'],Common,CED,None,None,None,Enchant creature\nEnchanted creature can't be blocked except by Walls.
Flight,1.0,['Blue'],['U'],None,['Enchantment'],['Aura'],Common,CED,None,None,None,Enchant creature\nEnchanted creature has flying.
Feedback,3.0,['Blue'],['U'],None,['Enchantment'],['Aura'],Uncommon,CED,None,None,None,"Enchant enchantment\nAt the beginning of the upkeep of enchanted enchantment's controller, Feedback deals 1 damage to that player."
Gaea's Liege,6.0,['Green'],['G'],None,['Creature'],['Avatar'],Rare,CED,*,*,None,"As long as Gaea's Liege isn't attacking, its power and toughness are each equal to the number of Forests you control. As long as Gaea's Liege is attacking, its power and toughness are each equal to the number of Forests defending player controls.\n{T}: Target land becomes a Forest until Gaea's Liege leaves the battlefield."
Savannah,0.0,None,"['G', 'W']",None,['Land'],"['Forest', 'Plains']",Rare,CED,None,None,None,({T}: Add {G} or {W}.)
Creature Bond,2.0,['Blue'],['U'],None,['Enchantment'],['Aura'],Common,CED,None,None,None,"Enchant creature\nWhen enchanted creature dies, Creature Bond deals damage equal to that creature's toughness to the creature's controller."
Fungusaur,4.0,['Green'],['G'],None,['Creature'],"['Fungus', 'Dinosaur']",Rare,CED,2,2,None,"Whenever Fungusaur is dealt damage, put a +1/+1 counter on it."
Plateau,0.0,None,"['R', 'W']",None,['Land'],"['Mountain', 'Plains']",Rare,CED,None,None,None,({T}: Add {R} or {W}.)
Counterspell,2.0,['Blue'],['U'],None,['Instant'],None,Uncommon,CED,None,None,None,Counter target spell.
Force of Nature,6.0,['Green'],['G'],None,['Creature'],['Elemental'],Rare,CED,8,8,None,"Trample (This creature can deal excess combat damage to the player or planeswalker it's attacking.)\nAt the beginning of your upkeep, Force of Nature deals 8 damage to you unless you pay {G}{G}{G}{G}."
Bayou,0.0,None,"['B', 'G']",None,['Land'],"['Swamp', 'Forest']",Rare,CED,None,None,None,({T}: Add {B} or {G}.)
Copy Artifact,2.0,['Blue'],['U'],None,['Enchantment'],None,Rare,CED,None,None,None,"You may have Copy Artifact enter the battlefield as a copy of any artifact on the battlefield, except it's an enchantment in addition to its other types."
Fog,1.0,['Green'],['G'],None,['Instant'],None,Common,CED,None,None,None,Prevent all combat damage that would be dealt this turn.
Badlands,0.0,None,"['B', 'R']",None,['Land'],"['Swamp', 'Mountain']",Rare,CED,None,None,None,({T}: Add {B} or {R}.)
Control Magic,4.0,['Blue'],['U'],None,['Enchantment'],['Aura'],Uncommon,CED,None,None,None,Enchant creature\nYou control enchanted creature.
Ley Druid,3.0,['Green'],['G'],None,['Creature'],"['Human', 'Druid']",Uncommon,CED,1,1,None,{T}: Untap target land.
Wooden Sphere,1.0,None,None,None,['Artifact'],None,Uncommon,CED,None,None,None,"Whenever a player casts a green spell, you may pay {1}. If you do, you gain 1 life."
Clone,4.0,['Blue'],['U'],None,['Creature'],['Shapeshifter'],Uncommon,CED,0,0,None,You may have Clone enter the battlefield as a copy of any creature on the battlefield.
Fastbond,1.0,['Green'],['G'],None,['Enchantment'],None,Rare,CED,None,None,None,"You may play any number of lands on each of your turns.\nWhenever you play a land, if it wasn't the first land you played this turn, Fastbond deals 1 damage to you."
Winter Orb,2.0,None,None,None,['Artifact'],None,Rare,CED,None,None,None,"As long as Winter Orb is untapped, players can't untap more than one land during their untap steps."
Braingeyser,2.0,['Blue'],['U'],None,['Sorcery'],None,Rare,CED,None,None,None,Target player draws X cards.
Elvish Archers,2.0,['Green'],['G'],None,['Creature'],"['Elf', 'Archer']",Rare,CED,2,1,None,First strike
Time Vault,2.0,None,None,None,['Artifact'],None,Rare,CED,None,None,None,"Time Vault enters the battlefield tapped.\nTime Vault doesn't untap during your untap step.\nIf you would begin your turn while Time Vault is tapped, you may skip that turn instead. If you do, untap Time Vault.\n{T}: Take an extra turn after this one."
Blue Elemental Blast,1.0,['Blue'],['U'],None,['Instant'],None,Common,CED,None,None,None,Choose one —\n• Counter target red spell.\n• Destroy target red permanent.
Craw Wurm,6.0,['Green'],['G'],None,['Creature'],['Wurm'],Common,CED,6,4,None,None
Throne of Bone,1.0,None,None,None,['Artifact'],None,Uncommon,CED,None,None,None,"Whenever a player casts a black spell, you may pay {1}. If you do, you gain 1 life."
Animate Artifact,4.0,['Blue'],['U'],None,['Enchantment'],['Aura'],Uncommon,CED,None,None,None,"Enchant artifact\nAs long as enchanted artifact isn't a creature, it's an artifact creature with power and toughness each equal to its mana value."
Cockatrice,5.0,['Green'],['G'],None,['Creature'],['Cockatrice'],Rare,CED,2,4,None,"Flying\nWhenever Cockatrice blocks or becomes blocked by a non-Wall creature, destroy that creature at end of combat."
The Hive,5.0,None,None,None,['Artifact'],None,Rare,CED,None,None,None,"{5}, {T}: Create a 1/1 colorless Insect artifact creature token with flying named Wasp. (It can't be blocked except by creatures with flying or reach.)"
Ancestral Recall,1.0,['Blue'],['U'],None,['Instant'],None,Rare,CED,None,None,None,Target player draws three cards.
Channel,2.0,['Green'],['G'],None,['Sorcery'],None,Uncommon,CED,None,None,None,"Until end of turn, any time you could activate a mana ability, you may pay 1 life. If you do, add {C}."
Sunglasses of Urza,3.0,None,None,None,['Artifact'],None,Rare,CED,None,None,None,You may spend white mana as though it were red mana.
Air Elemental,5.0,['Blue'],['U'],None,['Creature'],['Elemental'],Uncommon,CED,4,4,None,Flying
Weakness,1.0,['Black'],['B'],None,['Enchantment'],['Aura'],Common,CED,None,None,None,Enchant creature\nEnchanted creature gets -2/-1.
Soul Net,1.0,None,None,None,['Artifact'],None,Uncommon,CED,None,None,None,"Whenever a creature dies, you may pay {1}. If you do, you gain 1 life."
Wrath of God,4.0,['White'],['W'],None,['Sorcery'],None,Rare,CED,None,None,None,Destroy all creatures. They can't be regenerated.
Camouflage,1.0,['Green'],['G'],None,['Instant'],None,Uncommon,CED,None,None,None,"Cast this spell only during your declare attackers step.\nThis turn, instead of declaring blockers, each defending player chooses any number of creatures they control and divides them into a number of piles equal to the number of attacking creatures for whom that player is the defending player. Creatures those players control that can block additional creatures may likewise be put into additional piles. Assign each pile to a different one of those attacking creatures at random. Each creature in a pile that can block the creature that pile is assigned to does so. (Piles can be empty.)"
Sol Ring,1.0,None,None,None,['Artifact'],None,Uncommon,CED,None,None,None,{T}: Add {C}{C}.
White Ward,1.0,['White'],['W'],None,['Enchantment'],['Aura'],Uncommon,CED,None,None,None,Enchant creature\nEnchanted creature has protection from white. This effect doesn't remove White Ward.
Birds of Paradise,1.0,['Green'],['G'],None,['Creature'],['Bird'],Rare,CED,0,1,None,Flying\n{T}: Add one mana of any color.
Rod of Ruin,4.0,None,None,None,['Artifact'],None,Uncommon,CED,None,None,None,"{3}, {T}: Rod of Ruin deals 1 damage to any target."
White Knight,2.0,['White'],['W'],None,['Creature'],"['Human', 'Knight']",Uncommon,CED,2,2,None,"First strike (This creature deals combat damage before creatures without first strike.)\nProtection from black (This creature can't be blocked, targeted, dealt damage, or enchanted by anything black.)"
Berserk,1.0,['Green'],['G'],None,['Instant'],None,Uncommon,CED,None,None,None,"Cast this spell only before the combat damage step.\nTarget creature gains trample and gets +X/+0 until end of turn, where X is its power. At the beginning of the next end step, destroy that creature if it attacked this turn."
Obsianus Golem,6.0,None,None,None,"['Artifact', 'Creature']",['Golem'],Uncommon,CED,4,6,None,None
Wall of Swords,4.0,['White'],['W'],None,['Creature'],['Wall'],Uncommon,CED,3,5,None,Defender (This creature can't attack.)\nFlying
Aspect of Wolf,2.0,['Green'],['G'],None,['Enchantment'],['Aura'],Rare,CED,None,None,None,"Enchant creature\nEnchanted creature gets +X/+Y, where X is half the number of Forests you control, rounded down, and Y is half the number of Forests you control, rounded up."
Nevinyrral's Disk,4.0,None,None,None,['Artifact'],None,Rare,CED,None,None,None,"Nevinyrral's Disk enters the battlefield tapped.\n{1}, {T}: Destroy all artifacts, creatures, and enchantments."
Veteran Bodyguard,5.0,['White'],['W'],None,['Creature'],['Human'],Rare,CED,2,5,None,"As long as Veteran Bodyguard is untapped, all damage that would be dealt to you by unblocked creatures is dealt to Veteran Bodyguard instead."
Wheel of Fortune,3.0,['Red'],['R'],None,['Sorcery'],None,Rare,CED,None,None,None,"Each player discards their hand, then draws seven cards."
Mox Sapphire,0.0,None,['U'],None,['Artifact'],None,Rare,CED,None,None,None,{T}: Add {U}.
Swords to Plowshares,1.0,['White'],['W'],None,['Instant'],None,Uncommon,CED,None,None,None,Exile target creature. Its controller gains life equal to its power.
Wall of Stone,3.0,['Red'],['R'],None,['Creature'],['Wall'],Uncommon,CED,0,8,None,Defender (This creature can't attack.)
Mox Ruby,0.0,None,['R'],None,['Artifact'],None,Rare,CED,None,None,None,{T}: Add {R}.
Serra Angel,5.0,['White'],['W'],None,['Creature'],['Angel'],Uncommon,CED,4,4,None,"Flying, vigilance"
Wall of Fire,3.0,['Red'],['R'],None,['Creature'],['Wall'],Uncommon,CED,0,5,None,Defender (This creature can't attack.)\n{R}: Wall of Fire gets +1/+0 until end of turn.
Savannah Lions,1.0,['White'],['W'],None,['Creature'],['Cat'],Rare,CED,2,1,None,None
Uthden Troll,3.0,['Red'],['R'],None,['Creature'],['Troll'],Uncommon,CED,2,2,None,{R}: Regenerate Uthden Troll.
Mox Pearl,0.0,None,['W'],None,['Artifact'],None,Rare,CED,None,None,None,{T}: Add {W}.
Samite Healer,2.0,['White'],['W'],None,['Creature'],"['Human', 'Cleric']",Common,CED,1,1,None,{T}: Prevent the next 1 damage that would be dealt to any target this turn.
Two-Headed Giant of Foriys,5.0,['Red'],['R'],None,['Creature'],['Giant'],Rare,CED,4,4,None,Trample\nTwo-Headed Giant of Foriys can block an additional creature each combat.
Mox Jet,0.0,None,['B'],None,['Artifact'],None,Rare,CED,None,None,None,{T}: Add {B}.
Righteousness,1.0,['White'],['W'],None,['Instant'],None,Rare,CED,None,None,None,Target blocking creature gets +7/+7 until end of turn.
Tunnel,1.0,['Red'],['R'],None,['Instant'],None,Uncommon,CED,None,None,None,Destroy target Wall. It can't be regenerated.
