Name,CMC,Colors,Color identity,Supertypes,Types,Subtypes,Rarity,Set,Power,Toughness,Loyalty,Text
Altar of Dementia,2.0,None,None,None,['Artifact'],None,Rare,CNS,None,None,None,Sacrifice a creature: Target player mills cards equal to the sacrificed creature's power.
Wood Sage,2.0,"['Green', 'Blue']","['G', 'U']",None,['Creature'],"['Human', 'Druid']",Uncommon,CNS,1,1,None,{T}: Choose a creature card name. Reveal the top four cards of your library and put all of them with that name into your hand. Put the rest into your graveyard.
Spontaneous Combustion,3.0,"['Black', 'Red']","['B', 'R']",None,['Instant'],None,Uncommon,CNS,None,None,None,"As an additional cost to cast this spell, sacrifice a creature.\nSpontaneous Combustion deals 3 damage to each creature."
Spiritmonger,5.0,"['Black', 'Green']","['B', 'G']",None,['Creature'],['Beast'],Rare,CNS,6,6,None,"Whenever Spiritmonger deals damage to a creature, put a +1/+1 counter on Spiritmonger.\n{B}: Regenerate Spiritmonger.\n{G}: Spiritmonger becomes the color of your choice until end of turn."
Galvanic Juggernaut,4.0,None,None,None,"['Artifact', 'Creature']",['Juggernaut'],Uncommon,CNS,5,5,None,"Galvanic Juggernaut attacks each combat if able.\nGalvanic Juggernaut doesn't untap during your untap step.\nWhenever another creature dies, untap Galvanic Juggernaut."
Sky Spirit,3.0,"['Blue', 'White']","['U', 'W']",None,['Creature'],['Spirit'],Uncommon,CNS,2,2,None,"Flying, first strike"
Pernicious Deed,3.0,"['Black', 'Green']","['B', 'G']",None,['Enchantment'],None,Mythic,CNS,None,None,None,"{X}, Sacrifice Pernicious Deed: Destroy each artifact, creature, and enchantment with mana value X or less."
Reckless Spite,3.0,['Black'],['B'],None,['Instant'],None,Uncommon,CNS,None,None,None,Destroy two target nonblack creatures. You lose 5 life.
Mortify,3.0,"['Black', 'White']","['B', 'W']",None,['Instant'],None,Uncommon,CNS,None,None,None,Destroy target creature or enchantment.
Quag Vampires,1.0,['Black'],['B'],None,['Creature'],"['Vampire', 'Rogue']",Common,CNS,1,1,None,Multikicker {1}{B} (You may pay an additional {1}{B} any number of times as you cast this spell.)\nSwampwalk (This creature can't be blocked as long as defending player controls a Swamp.)\nQuag Vampires enters the battlefield with a +1/+1 counter on it for each time it was kicked.
Mirari's Wake,5.0,"['Green', 'White']","['G', 'W']",None,['Enchantment'],None,Mythic,CNS,None,None,None,"Creatures you control get +1/+1.\nWhenever you tap a land for mana, add one mana of any type that land produced."
Plagued Rusalka,1.0,['Black'],['B'],None,['Creature'],['Spirit'],Uncommon,CNS,1,1,None,"{B}, Sacrifice a creature: Target creature gets -1/-1 until end of turn."
Fires of Yavimaya,3.0,"['Green', 'Red']","['G', 'R']",None,['Enchantment'],None,Uncommon,CNS,None,None,None,Creatures you control have haste.\nSacrifice Fires of Yavimaya: Target creature gets +2/+2 until end of turn.
Peace Strider,4.0,None,None,None,"['Artifact', 'Creature']",['Construct'],Uncommon,CNS,3,3,None,"When Peace Strider enters the battlefield, you gain 3 life."
Phage the Untouchable,7.0,['Black'],['B'],['Legendary'],['Creature'],"['Avatar', 'Minion']",Mythic,CNS,4,4,None,"When Phage the Untouchable enters the battlefield, if you didn't cast it from your hand, you lose the game.\nWhenever Phage deals combat damage to a creature, destroy that creature. It can't be regenerated.\nWhenever Phage deals combat damage to a player, that player loses the game."
"Edric, Spymaster of Trest",3.0,"['Green', 'Blue']","['G', 'U']",['Legendary'],['Creature'],"['Elf', 'Rogue']",Rare,CNS,2,2,None,"Whenever a creature deals combat damage to one of your opponents, its controller may draw a card."
Necromantic Thirst,4.0,['Black'],['B'],None,['Enchantment'],['Aura'],Common,CNS,None,None,None,"Enchant creature\nWhenever enchanted creature deals combat damage to a player, you may return target creature card from your graveyard to your hand."
Dimir Doppelganger,3.0,"['Black', 'Blue']","['B', 'U']",None,['Creature'],['Shapeshifter'],Rare,CNS,0,2,None,"{1}{U}{B}: Exile target creature card from a graveyard. Dimir Doppelganger becomes a copy of that card, except it has this ability."
Reito Lantern,2.0,None,None,None,['Artifact'],None,Uncommon,CNS,None,None,None,{3}: Put target card from a graveyard on the bottom of its owner's library.
Morkrut Banshee,5.0,['Black'],['B'],None,['Creature'],['Spirit'],Uncommon,CNS,4,4,None,"Morbid — When Morkrut Banshee enters the battlefield, if a creature died this turn, target creature gets -4/-4 until end of turn."
Decimate,4.0,"['Green', 'Red']","['G', 'R']",None,['Sorcery'],None,Rare,CNS,None,None,None,"Destroy target artifact, target creature, target enchantment, and target land."
Magus of the Mirror,6.0,['Black'],['B'],None,['Creature'],"['Human', 'Wizard']",Rare,CNS,4,2,None,"{T}, Sacrifice Magus of the Mirror: Exchange life totals with target opponent. Activate only during your upkeep."
"Basandra, Battle Seraph",5.0,"['Red', 'White']","['R', 'W']",['Legendary'],['Creature'],['Angel'],Rare,CNS,4,4,None,Flying\nPlayers can't cast spells during combat.\n{R}: Target creature attacks this turn if able.
Misdirection,5.0,['Blue'],['U'],None,['Instant'],None,Rare,CNS,None,None,None,You may exile a blue card from your hand rather than pay this spell's mana cost.\nChange the target of target spell with a single target.
Wrap in Vigor,2.0,['Green'],['G'],None,['Instant'],None,Common,CNS,None,None,None,Regenerate each creature you control.
Assassinate,3.0,['Black'],['B'],None,['Sorcery'],None,Common,CNS,None,None,None,Destroy target tapped creature.
Wolfbriar Elemental,4.0,['Green'],['G'],None,['Creature'],['Elemental'],Rare,CNS,4,4,None,"Multikicker {G} (You may pay an additional {G} any number of times as you cast this spell.)\nWhen Wolfbriar Elemental enters the battlefield, create a 2/2 green Wolf creature token for each time it was kicked."
Terastodon,8.0,['Green'],['G'],None,['Creature'],['Elephant'],Rare,CNS,9,9,None,"When Terastodon enters the battlefield, you may destroy up to three target noncreature permanents. For each permanent put into a graveyard this way, its controller creates a 3/3 green Elephant creature token."
Infectious Horror,4.0,['Black'],['B'],None,['Creature'],"['Zombie', 'Horror']",Common,CNS,2,2,None,"Whenever Infectious Horror attacks, each opponent loses 2 life."
Squirrel Nest,3.0,['Green'],['G'],None,['Enchantment'],['Aura'],Uncommon,CNS,None,None,None,"Enchant land\nEnchanted land has ""{T}: Create a 1/1 green Squirrel creature token."""
Warmonger's Chariot,2.0,None,None,None,['Artifact'],['Equipment'],Uncommon,CNS,None,None,None,"Equipped creature gets +2/+2.\nAs long as equipped creature has defender, it can attack as though it didn't have defender.\nEquip {3} ({3}: Attach to target creature you control. Equip only as a sorcery.)"
Liliana's Specter,3.0,['Black'],['B'],None,['Creature'],['Specter'],Common,CNS,2,1,None,"Flying\nWhen Liliana's Specter enters the battlefield, each opponent discards a card."
Sporecap Spider,3.0,['Green'],['G'],None,['Creature'],['Spider'],Common,CNS,1,5,None,Reach
Ill-Gotten Gains,4.0,['Black'],['B'],None,['Sorcery'],None,Rare,CNS,None,None,None,"Exile Ill-Gotten Gains. Each player discards their hand, then returns up to three cards from their graveyard to their hand."
Scaled Wurm,8.0,['Green'],['G'],None,['Creature'],['Wurm'],Common,CNS,7,6,None,None
Reflecting Pool,0.0,None,None,None,['Land'],None,Rare,CNS,None,None,None,{T}: Add one mana of any type that a land you control could produce.
Altar's Reap,2.0,['Black'],['B'],None,['Instant'],None,Common,CNS,None,None,None,"As an additional cost to cast this spell, sacrifice a creature.\nDraw two cards."
Sakura-Tribe Elder,2.0,['Green'],['G'],None,['Creature'],"['Snake', 'Shaman']",Common,CNS,1,1,None,"Sacrifice Sakura-Tribe Elder: Search your library for a basic land card, put that card onto the battlefield tapped, then shuffle."
Runed Servitor,2.0,None,None,None,"['Artifact', 'Creature']",['Construct'],Uncommon,CNS,2,2,None,"When Runed Servitor dies, each player draws a card."
Wind Dancer,2.0,['Blue'],['U'],None,['Creature'],['Faerie'],Uncommon,CNS,1,1,None,Flying\n{T}: Target creature gains flying until end of turn.
Respite,2.0,['Green'],['G'],None,['Instant'],None,Common,CNS,None,None,None,Prevent all combat damage that would be dealt this turn. You gain 1 life for each attacking creature.
Vedalken Orrery,4.0,None,None,None,['Artifact'],None,Rare,CNS,None,None,None,You may cast spells as though they had flash.
Turn the Tide,2.0,['Blue'],['U'],None,['Instant'],None,Common,CNS,None,None,None,Creatures your opponents control get -2/-0 until end of turn.
Relic Crush,5.0,['Green'],['G'],None,['Instant'],None,Uncommon,CNS,None,None,None,Destroy target artifact or enchantment and up to one other target artifact or enchantment.
Quicksand,0.0,None,None,None,['Land'],None,Uncommon,CNS,None,None,None,"{T}: Add {C}.\n{T}, Sacrifice Quicksand: Target attacking creature without flying gets -1/-2 until end of turn."
Stasis Cell,5.0,['Blue'],['U'],None,['Enchantment'],['Aura'],Common,CNS,None,None,None,Enchant creature\nEnchanted creature doesn't untap during its controller's untap step.\n{3}{U}: Attach Stasis Cell to target creature.
Provoke,2.0,['Green'],['G'],None,['Instant'],None,Common,CNS,None,None,None,Untap target creature you don't control. That creature blocks this turn if able.\nDraw a card.
Mirrodin's Core,0.0,None,None,None,['Land'],None,Uncommon,CNS,None,None,None,"{T}: Add {C}.\n{T}: Put a charge counter on Mirrodin's Core.\n{T}, Remove a charge counter from Mirrodin's Core: Add one mana of any color."
Traveler's Cloak,3.0,['Blue'],['U'],None,['Enchantment'],['Aura'],Common,CNS,None,None,None,"Enchant creature\nAs Traveler's Cloak enters the battlefield, choose a land type.\nWhen Traveler's Cloak enters the battlefield, draw a card.\nEnchanted creature has landwalk of the chosen type. (It can't be blocked as long as defending player controls a land of that type.)"
Plummet,2.0,['Green'],['G'],None,['Instant'],None,Common,CNS,None,None,None,Destroy target creature with flying.
Spectral Searchlight,3.0,None,None,None,['Artifact'],None,Uncommon,CNS,None,None,None,{T}: Choose a player. That player adds one mana of any color they choose.
Stifle,1.0,['Blue'],['U'],None,['Instant'],None,Rare,CNS,None,None,None,Counter target activated or triggered ability. (Mana abilities can't be targeted.)
Pelakka Wurm,7.0,['Green'],['G'],None,['Creature'],['Wurm'],Uncommon,CNS,7,7,None,"Trample\nWhen Pelakka Wurm enters the battlefield, you gain 7 life.\nWhen Pelakka Wurm dies, draw a card."
Silent Arbiter,4.0,None,None,None,"['Artifact', 'Creature']",['Construct'],Rare,CNS,1,5,None,No more than one creature can attack each combat.\nNo more than one creature can block each combat.
Plated Seastrider,2.0,['Blue'],['U'],None,['Creature'],['Beast'],Common,CNS,1,4,None,None
Nature's Claim,1.0,['Green'],['G'],None,['Instant'],None,Common,CNS,None,None,None,Destroy target artifact or enchantment. Its controller gains 4 life.
Lead the Stampede,3.0,['Green'],['G'],None,['Sorcery'],None,Uncommon,CNS,None,None,None,Look at the top five cards of your library. You may reveal any number of creature cards from among them and put the revealed cards into your hand. Put the rest on the bottom of your library in any order.
Minamo Scrollkeeper,2.0,['Blue'],['U'],None,['Creature'],"['Human', 'Wizard']",Common,CNS,2,3,None,Defender\nYour maximum hand size is increased by one.
Hydra Omnivore,6.0,['Green'],['G'],None,['Creature'],['Hydra'],Mythic,CNS,8,8,None,"Whenever Hydra Omnivore deals combat damage to an opponent, it deals that much damage to each other opponent."
Shoreline Ranger,6.0,['Blue'],['U'],None,['Creature'],"['Bird', 'Soldier', 'Ranger']",Common,CNS,3,4,None,"Flying\nIslandcycling {2} ({2}, Discard this card: Search your library for an Island card, reveal it, put it into your hand, then shuffle.)"
Hunger of the Howlpack,1.0,['Green'],['G'],None,['Instant'],None,Common,CNS,None,None,None,Put a +1/+1 counter on target creature.\nMorbid — Put three +1/+1 counters on that creature instead if a creature died this turn.
Howling Wolf,4.0,['Green'],['G'],None,['Creature'],['Wolf'],Common,CNS,2,2,None,"When Howling Wolf enters the battlefield, you may search your library for up to three cards named Howling Wolf, reveal them, put them into your hand, then shuffle."
Screaming Seahawk,5.0,['Blue'],['U'],None,['Creature'],['Bird'],Common,CNS,2,2,None,"Flying\nWhen Screaming Seahawk enters the battlefield, you may search your library for a card named Screaming Seahawk, reveal it, put it into your hand, then shuffle."
Gnarlid Pack,2.0,['Green'],['G'],None,['Creature'],['Beast'],Common,CNS,2,2,None,Multikicker {1}{G} (You may pay an additional {1}{G} any number of times as you cast this spell.)\nGnarlid Pack enters the battlefield with a +1/+1 counter on it for each time it was kicked.
Reckless Scholar,3.0,['Blue'],['U'],None,['Creature'],"['Human', 'Wizard']",Common,CNS,2,1,None,"{T}: Target player draws a card, then discards a card."
Gamekeeper,4.0,['Green'],['G'],None,['Creature'],['Elf'],Uncommon,CNS,2,2,None,"When Gamekeeper dies, you may exile it. If you do, reveal cards from the top of your library until you reveal a creature card. Put that card onto the battlefield and put all other cards revealed this way into your graveyard."
Jetting Glasskite,6.0,['Blue'],['U'],None,['Creature'],['Spirit'],Uncommon,CNS,4,4,None,"Flying\nWhenever Jetting Glasskite becomes the target of a spell or ability for the first time each turn, counter that spell or ability."
Exploration,1.0,['Green'],['G'],None,['Enchantment'],None,Rare,CNS,None,None,None,You may play an additional land on each of your turns.
Grixis Illusionist,1.0,['Blue'],['U'],None,['Creature'],"['Human', 'Wizard']",Common,CNS,1,1,None,{T}: Target land you control becomes the basic land type of your choice until end of turn.
Elvish Aberration,6.0,['Green'],['G'],None,['Creature'],"['Elf', 'Mutant']",Common,CNS,4,5,None,"{T}: Add {G}{G}{G}.\nForestcycling {2} ({2}, Discard this card: Search your library for a Forest card, reveal it, put it into your hand, then shuffle.)"
Favorable Winds,2.0,['Blue'],['U'],None,['Enchantment'],None,Uncommon,CNS,None,None,None,Creatures you control with flying get +1/+1.
Elephant Guide,3.0,['Green'],['G'],None,['Enchantment'],['Aura'],Uncommon,CNS,None,None,None,"Enchant creature\nEnchanted creature gets +3/+3.\nWhen enchanted creature dies, create a 3/3 green Elephant creature token."
Fact or Fiction,4.0,['Blue'],['U'],None,['Instant'],None,Uncommon,CNS,None,None,None,Reveal the top five cards of your library. An opponent separates those cards into two piles. Put one pile into your hand and the other into your graveyard.
Echoing Courage,2.0,['Green'],['G'],None,['Instant'],None,Common,CNS,None,None,None,Target creature and all other creatures with the same name as that creature get +2/+2 until end of turn.
Enclave Elite,3.0,['Blue'],['U'],None,['Creature'],"['Merfolk', 'Soldier']",Common,CNS,2,2,None,Multikicker {1}{U} (You may pay an additional {1}{U} any number of times as you cast this spell.)\nIslandwalk (This creature can't be blocked as long as defending player controls an Island.)\nEnclave Elite enters the battlefield with a +1/+1 counter on it for each time it was kicked.
Copperhorn Scout,1.0,['Green'],['G'],None,['Creature'],"['Elf', 'Scout']",Common,CNS,1,1,None,"Whenever Copperhorn Scout attacks, untap each other creature you control."
Dream Fracture,3.0,['Blue'],['U'],None,['Instant'],None,Common,CNS,None,None,None,Counter target spell. Its controller draws a card.\nDraw a card.
Charging Rhino,5.0,['Green'],['G'],None,['Creature'],['Rhino'],Common,CNS,4,4,None,Charging Rhino can't be blocked by more than one creature.
Crookclaw Transmuter,4.0,['Blue'],['U'],None,['Creature'],"['Bird', 'Wizard']",Common,CNS,3,1,None,"Flash\nFlying\nWhen Crookclaw Transmuter enters the battlefield, switch target creature's power and toughness until end of turn."
Wrap in Flames,4.0,['Red'],['R'],None,['Sorcery'],None,Common,CNS,None,None,None,Wrap in Flames deals 1 damage to each of up to three target creatures. Those creatures can't block this turn.
Compulsive Research,3.0,['Blue'],['U'],None,['Sorcery'],None,Common,CNS,None,None,None,Target player draws three cards. Then that player discards two cards unless they discard a land card.
Breakthrough,1.0,['Blue'],['U'],None,['Sorcery'],None,Uncommon,CNS,None,None,None,"Draw four cards, then choose X cards in your hand and discard the rest."
Volcanic Fallout,3.0,['Red'],['R'],None,['Instant'],None,Uncommon,CNS,None,None,None,This spell can't be countered.\nVolcanic Fallout deals 2 damage to each creature and each player.
Brainstorm,1.0,['Blue'],['U'],None,['Instant'],None,Common,CNS,None,None,None,"Draw three cards, then put two cards from your hand on top of your library in any order."
Vent Sentinel,4.0,['Red'],['R'],None,['Creature'],['Elemental'],Common,CNS,2,4,None,"Defender\n{1}{R}, {T}: Vent Sentinel deals damage to target player or planeswalker equal to the number of creatures with defender you control."
Air Servant,5.0,['Blue'],['U'],None,['Creature'],['Elemental'],Uncommon,CNS,4,3,None,Flying\n{2}{U}: Tap target creature with flying.
Uncontrollable Anger,4.0,['Red'],['R'],None,['Enchantment'],['Aura'],Uncommon,CNS,None,None,None,Flash (You may cast this spell any time you could cast an instant.)\nEnchant creature\nEnchanted creature gets +2/+2 and attacks each combat if able.
Aether Tradewinds,3.0,['Blue'],['U'],None,['Instant'],None,Common,CNS,None,None,None,Return target permanent you control and target permanent you don't control to their owners' hands.
Trumpet Blast,3.0,['Red'],['R'],None,['Instant'],None,Common,CNS,None,None,None,Attacking creatures get +2/+0 until end of turn.
Wakestone Gargoyle,4.0,['White'],['W'],None,['Creature'],['Gargoyle'],Uncommon,CNS,3,4,None,"Defender, flying\n{1}{W}: Creatures you control with defender can attack this turn as though they didn't have defender."
Torch Fiend,2.0,['Red'],['R'],None,['Creature'],['Devil'],Common,CNS,2,1,None,"{R}, Sacrifice Torch Fiend: Destroy target artifact."
Vow of Duty,3.0,['White'],['W'],None,['Enchantment'],['Aura'],Uncommon,CNS,None,None,None,"Enchant creature\nEnchanted creature gets +2/+2, has vigilance, and can't attack you or planeswalkers you control."
Sulfuric Vortex,3.0,['Red'],['R'],None,['Enchantment'],None,Rare,CNS,None,None,None,"At the beginning of each player's upkeep, Sulfuric Vortex deals 2 damage to that player.\nIf a player would gain life, that player gains no life instead."
Valor Made Real,1.0,['White'],['W'],None,['Instant'],None,Common,CNS,None,None,None,Target creature can block any number of creatures this turn.
Skitter of Lizards,1.0,['Red'],['R'],None,['Creature'],['Lizard'],Common,CNS,1,1,None,Multikicker {1}{R} (You may pay an additional {1}{R} any number of times as you cast this spell.)\nHaste\nSkitter of Lizards enters the battlefield with a +1/+1 counter on it for each time it was kicked.
Unquestioned Authority,3.0,['White'],['W'],None,['Enchantment'],['Aura'],Uncommon,CNS,None,None,None,"Enchant creature\nWhen Unquestioned Authority enters the battlefield, draw a card.\nEnchanted creature has protection from creatures."
Power of Fire,2.0,['Red'],['R'],None,['Enchantment'],['Aura'],Common,CNS,None,None,None,"Enchant creature\nEnchanted creature has ""{T}: This creature deals 1 damage to any target."""
Swords to Plowshares,1.0,['White'],['W'],None,['Instant'],None,Uncommon,CNS,None,None,None,Exile target creature. Its controller gains life equal to its power.
Pitchburn Devils,5.0,['Red'],['R'],None,['Creature'],['Devil'],Common,CNS,3,3,None,"When Pitchburn Devils dies, it deals 3 damage to any target."
Stave Off,1.0,['White'],['W'],None,['Instant'],None,Common,CNS,None,None,None,Target creature gains protection from the color of your choice until end of turn.
Fireshrieker,3.0,None,None,None,['Artifact'],['Equipment'],Uncommon,CNS,None,None,None,Equipped creature has double strike. (It deals both first-strike and regular combat damage.)\nEquip {2} ({2}: Attach to target creature you control. Equip only as a sorcery.)
Soulcatcher,2.0,['White'],['W'],None,['Creature'],"['Bird', 'Soldier']",Uncommon,CNS,1,1,None,"Flying\nWhenever a creature with flying dies, put a +1/+1 counter on Soulcatcher."
Orcish Cannonade,3.0,['Red'],['R'],None,['Instant'],None,Common,CNS,None,None,None,Orcish Cannonade deals 2 damage to any target and 3 damage to you.\nDraw a card.
Silverchase Fox,2.0,['White'],['W'],None,['Creature'],['Fox'],Common,CNS,2,2,None,"{1}{W}, Sacrifice Silverchase Fox: Exile target enchantment."
Mana Geyser,5.0,['Red'],['R'],None,['Sorcery'],None,Common,CNS,None,None,None,Add {R} for each tapped land your opponents control.
Rout,5.0,['White'],['W'],None,['Sorcery'],None,Rare,CNS,None,None,None,You may cast Rout as though it had flash if you pay {2} more to cast it. (You may cast it any time you could cast an instant.)\nDestroy all creatures. They can't be regenerated.
Lizard Warrior,4.0,['Red'],['R'],None,['Creature'],"['Lizard', 'Warrior']",Common,CNS,4,2,None,None
Reya Dawnbringer,9.0,['White'],['W'],['Legendary'],['Creature'],['Angel'],Rare,CNS,4,6,None,"Flying\nAt the beginning of your upkeep, you may return target creature card from your graveyard to the battlefield."
Heckling Fiends,3.0,['Red'],['R'],None,['Creature'],['Devil'],Uncommon,CNS,2,2,None,{2}{R}: Target creature attacks this turn if able.
Pristine Angel,6.0,['White'],['W'],None,['Creature'],['Angel'],Mythic,CNS,4,4,None,"Flying\nAs long as Pristine Angel is untapped, it has protection from artifacts and from all colors.\nWhenever you cast a spell, you may untap Pristine Angel."
Heartless Hidetsugu,5.0,['Red'],['R'],['Legendary'],['Creature'],"['Ogre', 'Shaman']",Rare,CNS,4,3,None,"{T}: Heartless Hidetsugu deals damage to each player equal to half that player's life total, rounded down."
Pride Guardian,1.0,['White'],['W'],None,['Creature'],"['Cat', 'Monk']",Common,CNS,0,3,None,"Defender\nWhenever Pride Guardian blocks, you gain 3 life."
Flowstone Blade,1.0,['Red'],['R'],None,['Enchantment'],['Aura'],Common,CNS,None,None,None,Enchant creature\n{R}: Enchanted creature gets +1/-1 until end of turn.
Pillarfield Ox,4.0,['White'],['W'],None,['Creature'],['Ox'],Common,CNS,2,4,None,None
Flaring Flame-Kin,3.0,['Red'],['R'],None,['Creature'],"['Elemental', 'Warrior']",Uncommon,CNS,2,2,None,"As long as Flaring Flame-Kin is enchanted, it gets +2/+2, has trample, and has ""{R}: Flaring Flame-Kin gets +1/+0 until end of turn."""
Noble Templar,6.0,['White'],['W'],None,['Creature'],"['Human', 'Cleric', 'Soldier']",Common,CNS,3,6,None,"Vigilance\nPlainscycling {2} ({2}, Discard this card: Search your library for a Plains card, reveal it, put it into your hand, then shuffle.)"
Deathforge Shaman,5.0,['Red'],['R'],None,['Creature'],"['Ogre', 'Shaman']",Uncommon,CNS,4,3,None,"Multikicker {R} (You may pay an additional {R} any number of times as you cast this spell.)\nWhen Deathforge Shaman enters the battlefield, it deals damage to target player or planeswalker equal to twice the number of times it was kicked."
Moment of Heroism,2.0,['White'],['W'],None,['Instant'],None,Common,CNS,None,None,None,Target creature gets +2/+2 and gains lifelink until end of turn. (Damage dealt by the creature also causes its controller to gain that much life.)
Cinder Wall,1.0,['Red'],['R'],None,['Creature'],['Wall'],Common,CNS,3,3,None,"Defender\nWhen Cinder Wall blocks, destroy it at end of combat."
Kor Chant,3.0,['White'],['W'],None,['Instant'],None,Common,CNS,None,None,None,All damage that would be dealt this turn to target creature you control by a source of your choice is dealt to another target creature instead.
Chartooth Cougar,6.0,['Red'],['R'],None,['Creature'],"['Cat', 'Beast']",Common,CNS,4,4,None,"{R}: Chartooth Cougar gets +1/+0 until end of turn.\nMountaincycling {2} ({2}, Discard this card: Search your library for a Mountain card, reveal it, put it into your hand, then shuffle.)"
Intangible Virtue,2.0,['White'],['W'],None,['Enchantment'],None,Uncommon,CNS,None,None,None,Creature tokens you control get +1/+1 and have vigilance.
Brimstone Volley,3.0,['Red'],['R'],None,['Instant'],None,Common,CNS,None,None,None,Brimstone Volley deals 3 damage to any target.\nMorbid — Brimstone Volley deals 5 damage instead if a creature died this turn.
Guardian Zendikon,3.0,['White'],['W'],None,['Enchantment'],['Aura'],Common,CNS,None,None,None,"Enchant land\nEnchanted land is a 2/6 white Wall creature with defender. It's still a land.\nWhen enchanted land dies, return that card to its owner's hand."
Boldwyr Intimidator,7.0,['Red'],['R'],None,['Creature'],"['Giant', 'Warrior']",Uncommon,CNS,5,5,None,Cowards can't block Warriors.\n{R}: Target creature becomes a Coward until end of turn.\n{2}{R}: Target creature becomes a Warrior until end of turn.
Glimmerpoint Stag,4.0,['White'],['W'],None,['Creature'],['Elk'],Uncommon,CNS,3,3,None,"Vigilance\nWhen Glimmerpoint Stag enters the battlefield, exile another target permanent. Return that card to the battlefield under its owner's control at the beginning of the next end step."
Barbed Shocker,4.0,['Red'],['R'],None,['Creature'],['Insect'],Uncommon,CNS,2,2,None,"Trample, haste\nWhenever Barbed Shocker deals damage to a player, that player discards all the cards in their hand, then draws that many cards."
Doomed Traveler,1.0,['White'],['W'],None,['Creature'],"['Human', 'Soldier']",Common,CNS,1,1,None,"When Doomed Traveler dies, create a 1/1 white Spirit creature token with flying."
Zombie Goliath,5.0,['Black'],['B'],None,['Creature'],"['Zombie', 'Giant']",Common,CNS,4,3,None,None
