Name,CMC,Colors,Color identity,Supertypes,Types,Subtypes,Rarity,Set,Power,Toughness,Loyalty,Text
Wakedancer,3.0,['Black'],['B'],None,['Creature'],"['Human', 'Shaman']",Common,CNS,2,2,None,"Morbid — When Wakedancer enters the battlefield, if a creature died this turn, create a 2/2 black Zombie creature token."
Victimize,3.0,['Black'],['B'],None,['Sorcery'],None,Uncommon,CNS,None,None,None,"Choose two target creature cards in your graveyard. Sacrifice a creature. If you do, return the chosen cards to the battlefield tapped."
Vampire Hexmage,2.0,['Black'],['B'],None,['Creature'],"['Vampire', 'Shaman']",Uncommon,CNS,2,1,None,First strike\nSacrifice Vampire Hexmage: Remove all counters from target permanent.
Courier Hawk,2.0,['White'],['W'],None,['Creature'],['Bird'],Common,CNS,1,2,None,"Flying, vigilance"
Unhallowed Pact,3.0,['Black'],['B'],None,['Enchantment'],['Aura'],Common,CNS,None,None,None,"Enchant creature\nWhen enchanted creature dies, return that card to the battlefield under your control."
Apex Hawks,3.0,['White'],['W'],None,['Creature'],['Bird'],Common,CNS,2,2,None,Multikicker {1}{W} (You may pay an additional {1}{W} any number of times as you cast this spell.)\nFlying\nApex Hawks enters the battlefield with a +1/+1 counter on it for each time it was kicked.
Typhoid Rats,1.0,['Black'],['B'],None,['Creature'],['Rat'],Common,CNS,1,1,None,Deathtouch (Any amount of damage this deals to a creature is enough to destroy it.)
Ajani's Sunstriker,2.0,['White'],['W'],None,['Creature'],"['Cat', 'Cleric']",Common,CNS,2,2,None,Lifelink (Damage dealt by this creature also causes you to gain that much life.)
Twisted Abomination,6.0,['Black'],['B'],None,['Creature'],"['Zombie', 'Mutant']",Common,CNS,5,3,None,"{B}: Regenerate Twisted Abomination.\nSwampcycling {2} ({2}, Discard this card: Search your library for a Swamp card, reveal it, put it into your hand, then shuffle.)"
"Paliano, the High City",0.0,None,None,['Legendary'],['Land'],None,Rare,CNS,None,None,None,"Reveal Paliano, the High City as you draft it. The player to your right chooses a color, you choose another color, then the player to your left chooses a third color.\n{T}: Add one mana of any color chosen as you drafted cards named Paliano, the High City."
Tragic Slip,1.0,['Black'],['B'],None,['Instant'],None,Common,CNS,None,None,None,Target creature gets -1/-1 until end of turn.\nMorbid — That creature gets -13/-13 until end of turn instead if a creature died this turn.
Syphon Soul,3.0,['Black'],['B'],None,['Sorcery'],None,Common,CNS,None,None,None,Syphon Soul deals 2 damage to each other player. You gain life equal to the damage dealt this way.
Whispergear Sneak,1.0,None,None,None,"['Artifact', 'Creature']",['Construct'],Common,CNS,1,1,None,"Draft Whispergear Sneak face up.\nDuring the draft, you may turn Whispergear Sneak face down. If you do, look at any unopened booster pack in the draft or any booster pack not being looked at by another player."
Deathrender,4.0,None,None,None,['Artifact'],['Equipment'],Rare,CNS,None,None,None,"Equipped creature gets +2/+2.\nWhenever equipped creature dies, you may put a creature card from your hand onto the battlefield and attach Deathrender to it.\nEquip {2}"
Stronghold Discipline,4.0,['Black'],['B'],None,['Sorcery'],None,Common,CNS,None,None,None,Each player loses 1 life for each creature they control.
Smallpox,2.0,['Black'],['B'],None,['Sorcery'],None,Uncommon,CNS,None,None,None,"Each player loses 1 life, discards a card, sacrifices a creature, then sacrifices a land."
Skeletal Scrying,1.0,['Black'],['B'],None,['Instant'],None,Uncommon,CNS,None,None,None,"As an additional cost to cast this spell, exile X cards from your graveyard.\nYou draw X cards and you lose X life."
Explorer's Scope,1.0,None,None,None,['Artifact'],['Equipment'],Uncommon,CNS,None,None,None,"Whenever equipped creature attacks, look at the top card of your library. If it's a land card, you may put it onto the battlefield tapped.\nEquip {1} ({1}: Attach to target creature you control. Equip only as a sorcery.)"
Lurking Automaton,5.0,None,None,None,"['Artifact', 'Creature']",['Construct'],Common,CNS,0,0,None,"Reveal Lurking Automaton as you draft it and note how many cards you've drafted this draft round, including Lurking Automaton.\nLurking Automaton enters the battlefield with X +1/+1 counters on it, where X is the highest number you noted for cards named Lurking Automaton."
Lore Seeker,2.0,None,None,None,"['Artifact', 'Creature']",['Construct'],Rare,CNS,2,2,None,"Reveal Lore Seeker as you draft it. After you draft Lore Seeker, you may add a booster pack to the draft. (Your next pick is from that booster pack. Pass it to the next player and it's drafted this draft round.)"
Deal Broker,3.0,None,None,None,"['Artifact', 'Creature']",['Construct'],Rare,CNS,2,3,None,"Draft Deal Broker face up.\nImmediately after the draft, you may reveal a card in your card pool. Each other player may offer you one card in their card pool in exchange. You may accept any one offer.\n{T}: Draw a card, then discard a card."
Cogwork Tracker,4.0,None,None,None,"['Artifact', 'Creature']","['Dog', 'Construct']",Uncommon,CNS,4,4,None,Reveal Cogwork Tracker as you draft it and note the player who passed it to you.\nCogwork Tracker attacks each combat if able.\nCogwork Tracker attacks a player you noted for cards named Cogwork Tracker each combat if able.
Cogwork Spy,3.0,None,None,None,"['Artifact', 'Creature']","['Bird', 'Construct']",Common,CNS,2,1,None,Reveal Cogwork Spy as you draft it. You may look at the next card drafted from this booster pack.\nFlying
Cogwork Librarian,4.0,None,None,None,"['Artifact', 'Creature']",['Construct'],Common,CNS,3,3,None,"Draft Cogwork Librarian face up.\nAs you draft a card, you may draft an additional card from that booster pack. If you do, put Cogwork Librarian into that booster pack."
Cogwork Grinder,6.0,None,None,None,"['Artifact', 'Creature']",['Construct'],Rare,CNS,0,0,None,"Draft Cogwork Grinder face up.\nAs you draft a card, you may remove it from the draft face down. (Those cards aren't in your card pool.)\nCogwork Grinder enters the battlefield with X +1/+1 counters on it, where X is the number of cards you removed from the draft with cards named Cogwork Grinder."
Coercive Portal,4.0,None,None,None,['Artifact'],None,Mythic,CNS,None,None,None,"Will of the council — At the beginning of your upkeep, starting with you, each player votes for carnage or homage. If carnage gets more votes, sacrifice Coercive Portal and destroy all nonland permanents. If homage gets more votes or the vote is tied, draw a card."
Canal Dredger,4.0,None,None,None,"['Artifact', 'Creature']",['Construct'],Rare,CNS,1,5,None,Draft Canal Dredger face up.\nEach player passes the last card from each booster pack to a player who drafted a card named Canal Dredger.\n{T}: Put target card from your graveyard on the bottom of your library.
Agent of Acquisitions,2.0,None,None,None,"['Artifact', 'Creature']",['Construct'],Uncommon,CNS,2,1,None,"Draft Agent of Acquisitions face up.\nInstead of drafting a card from a booster pack, you may draft each card in that booster pack, one at a time. If you do, turn Agent of Acquisitions face down and you can't draft cards for the rest of this draft round. (You may look at booster packs passed to you.)"
Aether Searcher,7.0,None,None,None,"['Artifact', 'Creature']",['Construct'],Rare,CNS,6,4,None,"Reveal Aether Searcher as you draft it. Reveal the next card you draft and note its name.\nWhen Aether Searcher enters the battlefield, you may search your hand and/or library for a card with a name noted as you drafted cards named Aether Searcher. You may cast it without paying its mana cost. If you searched your library this way, shuffle."
Woodvine Elemental,6.0,"['Green', 'White']","['G', 'W']",None,['Creature'],['Elemental'],Uncommon,CNS,4,4,None,"Trample\nParley — Whenever Woodvine Elemental attacks, each player reveals the top card of their library. For each nonland card revealed this way, attacking creatures you control get +1/+1 until end of turn. Then each player draws a card."
"Selvala, Explorer Returned",3.0,"['Green', 'White']","['G', 'W']",['Legendary'],['Creature'],"['Elf', 'Scout']",Rare,CNS,2,4,None,"Parley — {T}: Each player reveals the top card of their library. For each nonland card revealed this way, add {G} and you gain 1 life. Then each player draws a card."
Marchesa's Smuggler,2.0,"['Red', 'Blue']","['R', 'U']",None,['Creature'],"['Human', 'Rogue']",Uncommon,CNS,1,1,None,"Dethrone (Whenever this creature attacks the player with the most life or tied for most life, put a +1/+1 counter on it.)\n{1}{U}{R}: Target creature you control gains haste until end of turn and can't be blocked this turn."
"Marchesa, the Black Rose",4.0,"['Black', 'Red', 'Blue']","['B', 'R', 'U']",['Legendary'],['Creature'],"['Human', 'Wizard']",Mythic,CNS,3,3,None,"Dethrone (Whenever this creature attacks the player with the most life or tied for most life, put a +1/+1 counter on it.)\nOther creatures you control have dethrone.\nWhenever a creature you control with a +1/+1 counter on it dies, return that card to the battlefield under your control at the beginning of the next end step."
Magister of Worth,6.0,"['Black', 'White']","['B', 'W']",None,['Creature'],['Angel'],Rare,CNS,4,4,None,"Flying\nWill of the council — When Magister of Worth enters the battlefield, starting with you, each player votes for grace or condemnation. If grace gets more votes, each player returns each creature card from their graveyard to the battlefield. If condemnation gets more votes or the vote is tied, destroy all creatures other than Magister of Worth."
"Grenzo, Dungeon Warden",2.0,"['Black', 'Red']","['B', 'R']",['Legendary'],['Creature'],"['Goblin', 'Rogue']",Rare,CNS,2,2,None,"Grenzo, Dungeon Warden enters the battlefield with X +1/+1 counters on it.\n{2}: Put the bottom card of your library into your graveyard. If it's a creature card with power less than or equal to Grenzo's power, put it onto the battlefield."
Flamewright,2.0,"['Red', 'White']","['R', 'W']",None,['Creature'],"['Human', 'Artificer']",Uncommon,CNS,1,1,None,"{1}, {T}: Create a 1/1 colorless Construct artifact creature token with defender.\n{T}, Sacrifice a creature with defender: Flamewright deals 1 damage to any target."
Extract from Darkness,5.0,"['Black', 'Blue']","['B', 'U']",None,['Sorcery'],None,Uncommon,CNS,None,None,None,Each player mills two cards. Then you put a creature card from a graveyard onto the battlefield under your control.
Deathreap Ritual,4.0,"['Black', 'Green']","['B', 'G']",None,['Enchantment'],None,Uncommon,CNS,None,None,None,"Morbid — At the beginning of each end step, if a creature died this turn, you may draw a card."
Dack's Duplicate,4.0,"['Red', 'Blue']","['R', 'U']",None,['Creature'],['Shapeshifter'],Rare,CNS,0,0,None,"You may have Dack's Duplicate enter the battlefield as a copy of any creature on the battlefield, except it has haste and dethrone. (Whenever it attacks the player with the most life or tied for most life, put a +1/+1 counter on it.)"
Dack Fayden,3.0,"['Red', 'Blue']","['R', 'U']",['Legendary'],['Planeswalker'],['Dack'],Mythic,CNS,None,None,3,"[+1]: Target player draws two cards, then discards two cards.\n[−2]: Gain control of target artifact.\n[−6]: You get an emblem with ""Whenever you cast a spell that targets one or more permanents, gain control of those permanents."""
"Brago, King Eternal",4.0,"['Blue', 'White']","['U', 'W']",['Legendary'],['Creature'],"['Spirit', 'Noble']",Rare,CNS,2,4,None,"Flying\nWhenever Brago, King Eternal deals combat damage to a player, exile any number of target nonland permanents you control, then return those cards to the battlefield under their owner's control."
Selvala's Enforcer,4.0,['Green'],['G'],None,['Creature'],"['Elf', 'Warrior']",Common,CNS,2,2,None,"Parley — When Selvala's Enforcer enters the battlefield, each player reveals the top card of their library. For each nonland card revealed this way, put a +1/+1 counter on Selvala's Enforcer. Then each player draws a card."
Selvala's Charge,5.0,['Green'],['G'],None,['Sorcery'],None,Uncommon,CNS,None,None,None,"Parley — Each player reveals the top card of their library. For each nonland card revealed this way, you create a 3/3 green Elephant creature token. Then each player draws a card."
Realm Seekers,6.0,['Green'],['G'],None,['Creature'],"['Elf', 'Scout']",Rare,CNS,0,0,None,"Realm Seekers enters the battlefield with X +1/+1 counters on it, where X is the total number of cards in all players' hands.\n{2}{G}, Remove a +1/+1 counter from Realm Seekers: Search your library for a land card, reveal it, put it into your hand, then shuffle."
Predator's Howl,4.0,['Green'],['G'],None,['Instant'],None,Uncommon,CNS,None,None,None,Create a 2/2 green Wolf creature token.\nMorbid — Create three 2/2 green Wolf creature tokens instead if a creature died this turn.
Treasonous Ogre,4.0,['Red'],['R'],None,['Creature'],"['Ogre', 'Shaman']",Uncommon,CNS,2,3,None,"Dethrone (Whenever this creature attacks the player with the most life or tied for most life, put a +1/+1 counter on it.)\nPay 3 life: Add {R}."
Scourge of the Throne,6.0,['Red'],['R'],None,['Creature'],['Dragon'],Mythic,CNS,5,5,None,"Flying\nDethrone (Whenever this creature attacks the player with the most life or tied for most life, put a +1/+1 counter on it.)\nWhenever Scourge of the Throne attacks for the first time each turn, if it's attacking the player with the most life or tied for most life, untap all attacking creatures. After this phase, there is an additional combat phase."
Ignition Team,7.0,['Red'],['R'],None,['Creature'],"['Goblin', 'Warrior']",Rare,CNS,0,0,None,"Ignition Team enters the battlefield with X +1/+1 counters on it, where X is the number of tapped lands on the battlefield.\n{2}{R}, Remove a +1/+1 counter from Ignition Team: Target land becomes a 4/4 red Elemental creature until end of turn. It's still a land."
Grenzo's Rebuttal,6.0,['Red'],['R'],None,['Sorcery'],None,Rare,CNS,None,None,None,"Create a 4/4 red Ogre creature token. Starting with you, each player chooses an artifact, a creature, and a land from among the permanents controlled by the player to their left. Destroy each permanent chosen this way."
Grenzo's Cutthroat,2.0,['Red'],['R'],None,['Creature'],"['Goblin', 'Rogue']",Common,CNS,1,1,None,"First strike\nDethrone (Whenever this creature attacks the player with the most life or tied for most life, put a +1/+1 counter on it.)"
Enraged Revolutionary,3.0,['Red'],['R'],None,['Creature'],"['Human', 'Warrior']",Common,CNS,2,1,None,"Dethrone (Whenever this creature attacks the player with the most life or tied for most life, put a +1/+1 counter on it.)"
Tyrant's Choice,2.0,['Black'],['B'],None,['Sorcery'],None,Common,CNS,None,None,None,"Will of the council — Starting with you, each player votes for death or torture. If death gets more votes, each opponent sacrifices a creature. If torture gets more votes or the vote is tied, each opponent loses 4 life."
Reign of the Pit,6.0,['Black'],['B'],None,['Sorcery'],None,Rare,CNS,None,None,None,"Each player sacrifices a creature. Create an X/X black Demon creature token with flying, where X is the total power of the creatures sacrificed this way."
Grudge Keeper,2.0,['Black'],['B'],None,['Creature'],"['Zombie', 'Wizard']",Common,CNS,2,1,None,"Whenever players finish voting, each opponent who voted for a choice you didn't vote for loses 2 life."
Drakestown Forgotten,5.0,['Black'],['B'],None,['Creature'],['Zombie'],Rare,CNS,0,0,None,"Drakestown Forgotten enters the battlefield with X +1/+1 counters on it, where X is the number of creature cards in all graveyards.\n{2}{B}, Remove a +1/+1 counter from Drakestown Forgotten: Target creature gets -1/-1 until end of turn."
Bite of the Black Rose,4.0,['Black'],['B'],None,['Sorcery'],None,Uncommon,CNS,None,None,None,"Will of the council — Starting with you, each player votes for sickness or psychosis. If sickness gets more votes, creatures your opponents control get -2/-2 until end of turn. If psychosis gets more votes or the vote is tied, each opponent discards two cards."
Split Decision,2.0,['Blue'],['U'],None,['Instant'],None,Uncommon,CNS,None,None,None,"Will of the council — Choose target instant or sorcery spell. Starting with you, each player votes for denial or duplication. If denial gets more votes, counter the spell. If duplication gets more votes or the vote is tied, copy the spell. You may choose new targets for the copy."
Plea for Power,4.0,['Blue'],['U'],None,['Sorcery'],None,Rare,CNS,None,None,None,"Will of the council — Starting with you, each player votes for time or knowledge. If time gets more votes, take an extra turn after this one. If knowledge gets more votes or the vote is tied, draw three cards."
"Muzzio, Visionary Architect",3.0,['Blue'],['U'],['Legendary'],['Creature'],"['Human', 'Artificer']",Mythic,CNS,1,3,None,"{3}{U}, {T}: Look at the top X cards of your library, where X is the highest mana value among artifacts you control. You may put an artifact card from among them onto the battlefield. Put the rest on the bottom of your library in any order."
Marchesa's Infiltrator,3.0,['Blue'],['U'],None,['Creature'],"['Human', 'Rogue']",Uncommon,CNS,1,1,None,"Dethrone (Whenever this creature attacks the player with the most life or tied for most life, put a +1/+1 counter on it.)\nWhenever Marchesa's Infiltrator deals combat damage to a player, draw a card."
Marchesa's Emissary,4.0,['Blue'],['U'],None,['Creature'],"['Human', 'Rogue']",Common,CNS,2,2,None,"Hexproof (This creature can't be the target of spells or abilities your opponents control.)\nDethrone (Whenever this creature attacks the player with the most life or tied for most life, put a +1/+1 counter on it.)"
Academy Elite,4.0,['Blue'],['U'],None,['Creature'],"['Human', 'Wizard']",Rare,CNS,0,0,None,"Academy Elite enters the battlefield with X +1/+1 counters on it, where X is the number of instant and sorcery cards in all graveyards.\n{2}{U}, Remove a +1/+1 counter from Academy Elite: Draw a card, then discard a card."
Rousing of Souls,3.0,['White'],['W'],None,['Sorcery'],None,Common,CNS,None,None,None,"Parley — Each player reveals the top card of their library. For each nonland card revealed this way, you create a 1/1 white Spirit creature token with flying. Then each player draws a card."
Custodi Squire,5.0,['White'],['W'],None,['Creature'],"['Spirit', 'Cleric']",Common,CNS,3,3,None,"Flying\nWill of the council — When Custodi Squire enters the battlefield, starting with you, each player votes for an artifact, creature, or enchantment card in your graveyard. Return each card with the most votes or tied for most votes to your hand."
Custodi Soulbinders,4.0,['White'],['W'],None,['Creature'],"['Human', 'Cleric']",Rare,CNS,0,0,None,"Custodi Soulbinders enters the battlefield with X +1/+1 counters on it, where X is the number of other creatures on the battlefield.\n{2}{W}, Remove a +1/+1 counter from Custodi Soulbinders: Create a 1/1 white Spirit creature token with flying."
Backup Plan,0.0,None,None,None,['Conspiracy'],None,Rare,CNS,None,None,None,"(Start the game with this conspiracy face up in the command zone.)\nDraw an additional hand of seven cards as the game begins. Before taking mulligans, shuffle all but one of your hands into your library."
Worldknit,0.0,None,None,None,['Conspiracy'],None,Rare,CNS,None,None,None,"(Start the game with this conspiracy face up in the command zone.)\nAs long as every card in your card pool started the game in your library or in the command zone, lands you control have ""{T}: Add one mana of any color."""
Council Guardian,6.0,['White'],['W'],None,['Creature'],"['Giant', 'Soldier']",Uncommon,CNS,5,5,None,"Will of the council — When Council Guardian enters the battlefield, starting with you, each player votes for blue, black, red, or green. Council Guardian gains protection from each color with the most votes or tied for most votes."
Council's Judgment,3.0,['White'],['W'],None,['Sorcery'],None,Rare,CNS,None,None,None,"Will of the council — Starting with you, each player votes for a nonland permanent you don't control. Exile each permanent with the most votes or tied for most votes."
Brago's Representative,3.0,['White'],['W'],None,['Creature'],"['Human', 'Advisor']",Common,CNS,1,4,None,"While voting, you get an additional vote. (The votes can be for different choices or for the same choice.)"
Unexpected Potential,0.0,None,None,None,['Conspiracy'],None,Uncommon,CNS,None,None,None,Hidden agenda (Start the game with this conspiracy face down in the command zone and secretly choose a card name. You may turn this conspiracy face up any time and reveal that name.)\nYou may spend mana as though it were mana of any color to cast spells with the chosen name.
Sentinel Dispatch,0.0,None,None,None,['Conspiracy'],None,Common,CNS,None,None,None,"(Start the game with this conspiracy face up in the command zone.)\nAt the beginning of the first upkeep, create a 1/1 colorless Construct artifact creature token with defender."
Secrets of Paradise,0.0,None,None,None,['Conspiracy'],None,Common,CNS,None,None,None,"Hidden agenda (Start the game with this conspiracy face down in the command zone and secretly choose a card name. You may turn this conspiracy face up any time and reveal that name.)\nCreatures you control with the chosen name have ""{T}: Add one mana of any color."""
Muzzio's Preparations,0.0,None,None,None,['Conspiracy'],None,Common,CNS,None,None,None,Hidden agenda (Start the game with this conspiracy face down in the command zone and secretly choose a card name. You may turn this conspiracy face up any time and reveal that name.)\nEach creature you control with the chosen name enters the battlefield with an additional +1/+1 counter on it.
Secret Summoning,0.0,None,None,None,['Conspiracy'],None,Uncommon,CNS,None,None,None,"Hidden agenda (Start the game with this conspiracy face down in the command zone and secretly choose a card name. You may turn this conspiracy face up any time and reveal that name.)\nWhenever a creature with the chosen name enters the battlefield under your control, you may search your library for any number of cards with that name, reveal them, put them into your hand, then shuffle."
Power Play,0.0,None,None,None,['Conspiracy'],None,Uncommon,CNS,None,None,None,"(Start the game with this conspiracy face up in the command zone.)\nYou are the starting player. If multiple players would be the starting player, one of those players is chosen at random."
Brago's Favor,0.0,None,None,None,['Conspiracy'],None,Common,CNS,None,None,None,Hidden agenda (Start the game with this conspiracy face down in the command zone and secretly choose a card name. You may turn this conspiracy face up any time and reveal that name.)\nSpells with the chosen name you cast cost {1} less to cast.
Advantageous Proclamation,0.0,None,None,None,['Conspiracy'],None,Uncommon,CNS,None,None,None,(Start the game with this conspiracy face up in the command zone.)\nYour minimum deck size is reduced by five.
Iterative Analysis,0.0,None,None,None,['Conspiracy'],None,Uncommon,CNS,None,None,None,"Hidden agenda (Start the game with this conspiracy face down in the command zone and secretly choose a card name. You may turn this conspiracy face up any time and reveal that name.)\nWhenever you cast an instant or sorcery spell with the chosen name, you may draw a card."
Immediate Action,0.0,None,None,None,['Conspiracy'],None,Common,CNS,None,None,None,Hidden agenda (Start the game with this conspiracy face down in the command zone and secretly choose a card name. You may turn this conspiracy face up any time and reveal that name.)\nCreatures you control with the chosen name have haste.
Double Stroke,0.0,None,None,None,['Conspiracy'],None,Uncommon,CNS,None,None,None,"Hidden agenda (Start the game with this conspiracy face down in the command zone and secretly choose a card name. You may turn this conspiracy face up any time and reveal that name.)\nWhenever you cast an instant or sorcery spell with the chosen name, you may copy it. You may choose new targets for the copy."
