Name,CMC,Colors,Color identity,Supertypes,Types,Subtypes,Rarity,Set,Power,Toughness,Loyalty,Text
Demonmail Hauberk,4.0,None,None,None,['Artifact'],['Equipment'],Uncommon,ISD,None,None,None,Equipped creature gets +4/+2.\nEquip—Sacrifice a creature.
Creepy Doll,5.0,None,None,None,"['Artifact', 'Creature']",['Construct'],Rare,ISD,1,1,None,"Indestructible\nWhenever Creepy Doll deals combat damage to a creature, flip a coin. If you win the flip, destroy that creature."
Cobbled Wings,2.0,None,None,None,['Artifact'],['Equipment'],Common,ISD,None,None,None,Equipped creature has flying.\nEquip {1} ({1}: Attach to target creature you control. Equip only as a sorcery.)
Cellar Door,2.0,None,None,None,['Artifact'],None,Uncommon,ISD,None,None,None,"{3}, {T}: Target player puts the bottom card of their library into their graveyard. If it's a creature card, you create a 2/2 black Zombie creature token."
Butcher's Cleaver,3.0,None,None,None,['Artifact'],['Equipment'],Uncommon,ISD,None,None,None,"Equipped creature gets +3/+0.\nAs long as equipped creature is a Human, it has lifelink.\nEquip {3}"
Blazing Torch,1.0,None,None,None,['Artifact'],['Equipment'],Common,ISD,None,None,None,"Equipped creature can't be blocked by Vampires or Zombies.\nEquipped creature has ""{T}, Sacrifice Blazing Torch: Blazing Torch deals 2 damage to any target.""\nEquip {1} ({1}: Attach to target creature you control. Equip only as a sorcery.)"
Olivia Voldaren,4.0,"['Black', 'Red']","['B', 'R']",['Legendary'],['Creature'],['Vampire'],Mythic,ISD,3,3,None,Flying\n{1}{R}: Olivia Voldaren deals 1 damage to another target creature. That creature becomes a Vampire in addition to its other types. Put a +1/+1 counter on Olivia Voldaren.\n{3}{B}{B}: Gain control of target Vampire for as long as you control Olivia Voldaren.
"Grimgrin, Corpse-Born",5.0,"['Black', 'Blue']","['B', 'U']",['Legendary'],['Creature'],"['Zombie', 'Warrior']",Mythic,ISD,5,5,None,"Grimgrin, Corpse-Born enters the battlefield tapped and doesn't untap during your untap step.\nSacrifice another creature: Untap Grimgrin and put a +1/+1 counter on it.\nWhenever Grimgrin attacks, destroy target creature defending player controls, then put a +1/+1 counter on Grimgrin."
Geist of Saint Traft,3.0,"['Blue', 'White']","['U', 'W']",['Legendary'],['Creature'],"['Spirit', 'Cleric']",Mythic,ISD,2,2,None,"Hexproof (This creature can't be the target of spells or abilities your opponents control.)\nWhenever Geist of Saint Traft attacks, create a 4/4 white Angel creature token with flying that's tapped and attacking. Exile that token at end of combat."
Evil Twin,4.0,"['Black', 'Blue']","['B', 'U']",None,['Creature'],['Shapeshifter'],Rare,ISD,0,0,None,"You may have Evil Twin enter the battlefield as a copy of any creature on the battlefield, except it has ""{U}{B}, {T}: Destroy target creature with the same name as this creature."""
Wreath of Geists,1.0,['Green'],['G'],None,['Enchantment'],['Aura'],Uncommon,ISD,None,None,None,"Enchant creature\nEnchanted creature gets +X/+X, where X is the number of creature cards in your graveyard."
Woodland Sleuth,4.0,['Green'],['G'],None,['Creature'],"['Human', 'Scout']",Common,ISD,2,3,None,"Morbid — When Woodland Sleuth enters the battlefield, if a creature died this turn, return a creature card at random from your graveyard to your hand."
Villagers of Estwald // Howlpack of Estwald,3.0,['Green'],['G'],None,['Creature'],"['Human', 'Werewolf']",Common,ISD,2,3,None,"At the beginning of each upkeep, if no spells were cast last turn, transform Villagers of Estwald."
Ulvenwald Mystics // Ulvenwald Primordials,4.0,['Green'],['G'],None,['Creature'],"['Human', 'Shaman', 'Werewolf']",Uncommon,ISD,3,3,None,"At the beginning of each upkeep, if no spells were cast last turn, transform Ulvenwald Mystics."
Tree of Redemption,4.0,['Green'],['G'],None,['Creature'],['Plant'],Mythic,ISD,0,13,None,Defender\n{T}: Exchange your life total with Tree of Redemption's toughness.
Travel Preparations,2.0,['Green'],"['G', 'W']",None,['Sorcery'],None,Common,ISD,None,None,None,Put a +1/+1 counter on each of up to two target creatures.\nFlashback {1}{W} (You may cast this card from your graveyard for its flashback cost. Then exile it.)
Splinterfright,3.0,['Green'],['G'],None,['Creature'],['Elemental'],Rare,ISD,*,*,None,"Trample\nSplinterfright's power and toughness are each equal to the number of creature cards in your graveyard.\nAt the beginning of your upkeep, mill two cards."
Forest,0.0,None,['G'],['Basic'],['Land'],['Forest'],Common,ISD,None,None,None,({T}: Add {G}.)
Spidery Grasp,3.0,['Green'],['G'],None,['Instant'],None,Common,ISD,None,None,None,Untap target creature. It gets +2/+4 and gains reach until end of turn. (It can block creatures with flying.)
Spider Spawning,5.0,['Green'],"['B', 'G']",None,['Sorcery'],None,Uncommon,ISD,None,None,None,Create a 1/2 green Spider creature token with reach for each creature card in your graveyard.\nFlashback {6}{B} (You may cast this card from your graveyard for its flashback cost. Then exile it.)
Somberwald Spider,5.0,['Green'],['G'],None,['Creature'],['Spider'],Common,ISD,2,4,None,Reach (This creature can block creatures with flying.)\nMorbid — Somberwald Spider enters the battlefield with two +1/+1 counters on it if a creature died this turn.
Ranger's Guile,1.0,['Green'],['G'],None,['Instant'],None,Common,ISD,None,None,None,Target creature you control gets +1/+1 and gains hexproof until end of turn. (It can't be the target of spells or abilities your opponents control.)
Prey Upon,1.0,['Green'],['G'],None,['Sorcery'],None,Common,ISD,None,None,None,Target creature you control fights target creature you don't control. (Each deals damage equal to its power to the other.)
Parallel Lives,4.0,['Green'],['G'],None,['Enchantment'],None,Rare,ISD,None,None,None,"If an effect would create one or more tokens under your control, it creates twice that many of those tokens instead."
Moonmist,2.0,['Green'],['G'],None,['Instant'],None,Common,ISD,None,None,None,Transform all Humans. Prevent all combat damage that would be dealt this turn by creatures other than Werewolves and Wolves. (Only double-faced cards can be transformed.)
Naturalize,2.0,['Green'],['G'],None,['Instant'],None,Common,ISD,None,None,None,Destroy target artifact or enchantment.
Orchard Spirit,3.0,['Green'],['G'],None,['Creature'],['Spirit'],Common,ISD,2,2,None,Orchard Spirit can't be blocked except by creatures with flying or reach.
Mulch,2.0,['Green'],['G'],None,['Sorcery'],None,Common,ISD,None,None,None,Reveal the top four cards of your library. Put all land cards revealed this way into your hand and the rest into your graveyard.
Moldgraf Monstrosity,7.0,['Green'],['G'],None,['Creature'],['Insect'],Rare,ISD,8,8,None,"Trample\nWhen Moldgraf Monstrosity dies, exile it, then return two creature cards at random from your graveyard to the battlefield."
Moorland Haunt,0.0,None,"['U', 'W']",None,['Land'],None,Rare,ISD,None,None,None,"{T}: Add {C}.\n{W}{U}, {T}, Exile a creature card from your graveyard: Create a 1/1 white Spirit creature token with flying."
Mayor of Avabruck // Howlpack Alpha,2.0,['Green'],['G'],None,['Creature'],"['Human', 'Advisor', 'Werewolf']",Rare,ISD,1,1,None,"Other Human creatures you control get +1/+1.\nAt the beginning of each upkeep, if no spells were cast last turn, transform Mayor of Avabruck."
Kindercatch,6.0,['Green'],['G'],None,['Creature'],['Spirit'],Common,ISD,6,6,None,None
Make a Wish,4.0,['Green'],['G'],None,['Sorcery'],None,Uncommon,ISD,None,None,None,Return two cards at random from your graveyard to your hand.
Lumberknot,4.0,['Green'],['G'],None,['Creature'],['Treefolk'],Uncommon,ISD,1,1,None,"Hexproof (This creature can't be the target of spells or abilities your opponents control.)\nWhenever a creature dies, put a +1/+1 counter on Lumberknot."
Gutter Grime,5.0,['Green'],['G'],None,['Enchantment'],None,Rare,ISD,None,None,None,"Whenever a nontoken creature you control dies, put a slime counter on Gutter Grime, then create a green Ooze creature token with ""This creature's power and toughness are each equal to the number of slime counters on Gutter Grime."""
Grizzled Outcasts // Krallenhorde Wantons,5.0,['Green'],['G'],None,['Creature'],"['Human', 'Werewolf']",Common,ISD,4,4,None,"At the beginning of each upkeep, if no spells were cast last turn, transform Grizzled Outcasts."
Island,0.0,None,['U'],['Basic'],['Land'],['Island'],Common,ISD,None,None,None,({T}: Add {U}.)
Kessig Cagebreakers,5.0,['Green'],['G'],None,['Creature'],"['Human', 'Rogue']",Rare,ISD,3,4,None,"Whenever Kessig Cagebreakers attacks, create a 2/2 green Wolf creature token that's tapped and attacking for each creature card in your graveyard."
Hollowhenge Scavenger,5.0,['Green'],['G'],None,['Creature'],['Elemental'],Uncommon,ISD,4,5,None,"Morbid — When Hollowhenge Scavenger enters the battlefield, if a creature died this turn, you gain 5 life."
Hamlet Captain,2.0,['Green'],['G'],None,['Creature'],"['Human', 'Warrior']",Uncommon,ISD,2,2,None,"Whenever Hamlet Captain attacks or blocks, other Humans you control get +1/+1 until end of turn."
Grave Bramble,3.0,['Green'],['G'],None,['Creature'],['Plant'],Common,ISD,3,4,None,"Defender, protection from Zombies"
Gnaw to the Bone,3.0,['Green'],['G'],None,['Instant'],None,Common,ISD,None,None,None,You gain 2 life for each creature card in your graveyard.\nFlashback {2}{G} (You may cast this card from your graveyard for its flashback cost. Then exile it.)
Island,0.0,None,['U'],['Basic'],['Land'],['Island'],Common,ISD,None,None,None,({T}: Add {U}.)
Forest,0.0,None,['G'],['Basic'],['Land'],['Forest'],Common,ISD,None,None,None,({T}: Add {G}.)
Gatstaf Shepherd // Gatstaf Howler,2.0,['Green'],['G'],None,['Creature'],"['Human', 'Werewolf']",Uncommon,ISD,2,2,None,"At the beginning of each upkeep, if no spells were cast last turn, transform Gatstaf Shepherd."
Riot Devils,3.0,['Red'],['R'],None,['Creature'],['Devil'],Common,ISD,2,3,None,None
"Garruk Relentless // Garruk, the Veil-Cursed",4.0,['Green'],"['B', 'G']",['Legendary'],['Planeswalker'],['Garruk'],Mythic,ISD,None,None,3,"When Garruk Relentless has two or fewer loyalty counters on him, transform him.\n[0]: Garruk Relentless deals 3 damage to target creature. That creature deals damage equal to its power to him.\n[0]: Create a 2/2 green Wolf creature token."
Reckless Waif // Merciless Predator,1.0,['Red'],['R'],None,['Creature'],"['Human', 'Rogue', 'Werewolf']",Uncommon,ISD,1,1,None,"At the beginning of each upkeep, if no spells were cast last turn, transform Reckless Waif."
Full Moon's Rise,2.0,['Green'],['G'],None,['Enchantment'],None,Uncommon,ISD,None,None,None,Werewolf creatures you control get +1/+0 and have trample.\nSacrifice Full Moon's Rise: Regenerate all Werewolf creatures you control.
Island,0.0,None,['U'],['Basic'],['Land'],['Island'],Common,ISD,None,None,None,({T}: Add {U}.)
Rakish Heir,3.0,['Red'],['R'],None,['Creature'],['Vampire'],Uncommon,ISD,2,2,None,"Whenever a Vampire you control deals combat damage to a player, put a +1/+1 counter on it."
Festerhide Boar,4.0,['Green'],['G'],None,['Creature'],['Boar'],Common,ISD,3,3,None,Trample\nMorbid — Festerhide Boar enters the battlefield with two +1/+1 counters on it if a creature died this turn.
Rage Thrower,6.0,['Red'],['R'],None,['Creature'],"['Human', 'Shaman']",Uncommon,ISD,4,2,None,"Whenever another creature dies, Rage Thrower deals 2 damage to target player or planeswalker."
Essence of the Wild,6.0,['Green'],['G'],None,['Creature'],['Avatar'],Mythic,ISD,6,6,None,Creatures you control enter the battlefield as a copy of Essence of the Wild.
Pitchburn Devils,5.0,['Red'],['R'],None,['Creature'],['Devil'],Common,ISD,3,3,None,"When Pitchburn Devils dies, it deals 3 damage to any target."
Elder of Laurels,3.0,['Green'],['G'],None,['Creature'],"['Human', 'Advisor']",Rare,ISD,2,3,None,"{3}{G}: Target creature gets +X/+X until end of turn, where X is the number of creatures you control."
Past in Flames,4.0,['Red'],['R'],None,['Sorcery'],None,Mythic,ISD,None,None,None,Each instant and sorcery card in your graveyard gains flashback until end of turn. The flashback cost is equal to its mana cost.\nFlashback {4}{R} (You may cast this card from your graveyard for its flashback cost. Then exile it.)
Nightbird's Clutches,2.0,['Red'],['R'],None,['Sorcery'],None,Common,ISD,None,None,None,Up to two target creatures can't block this turn.\nFlashback {3}{R} (You may cast this card from your graveyard for its flashback cost. Then exile it.)
Daybreak Ranger // Nightfall Predator,3.0,['Green'],"['G', 'R']",None,['Creature'],"['Human', 'Archer', 'Ranger', 'Werewolf']",Rare,ISD,2,2,None,"{T}: Daybreak Ranger deals 2 damage to target creature with flying.\nAt the beginning of each upkeep, if no spells were cast last turn, transform Daybreak Ranger."
Swamp,0.0,None,['B'],['Basic'],['Land'],['Swamp'],Common,ISD,None,None,None,({T}: Add {B}.)
Night Revelers,5.0,['Red'],['R'],None,['Creature'],['Vampire'],Common,ISD,4,4,None,Night Revelers has haste as long as an opponent controls a Human.
Darkthicket Wolf,2.0,['Green'],['G'],None,['Creature'],['Wolf'],Common,ISD,2,2,None,{2}{G}: Darkthicket Wolf gets +2/+2 until end of turn. Activate only once each turn.
Creeping Renaissance,5.0,['Green'],['G'],None,['Sorcery'],None,Rare,ISD,None,None,None,Choose a permanent type. Return all cards of the chosen type from your graveyard to your hand.\nFlashback {5}{G}{G} (You may cast this card from your graveyard for its flashback cost. Then exile it.)
Kruin Outlaw // Terror of Kruin Pass,3.0,['Red'],['R'],None,['Creature'],"['Human', 'Rogue', 'Werewolf']",Rare,ISD,2,2,None,"First strike\nAt the beginning of each upkeep, if no spells were cast last turn, transform Kruin Outlaw."
Caravan Vigil,1.0,['Green'],['G'],None,['Sorcery'],None,Common,ISD,None,None,None,"Search your library for a basic land card, reveal it, put it into your hand, then shuffle.\nMorbid — You may put that card onto the battlefield instead of putting it into your hand if a creature died this turn."
Kessig Wolf,3.0,['Red'],['R'],None,['Creature'],['Wolf'],Common,ISD,3,1,None,{1}{R}: Kessig Wolf gains first strike until end of turn.
Bramblecrush,4.0,['Green'],['G'],None,['Sorcery'],None,Uncommon,ISD,None,None,None,Destroy target noncreature permanent.
Into the Maw of Hell,6.0,['Red'],['R'],None,['Sorcery'],None,Uncommon,ISD,None,None,None,Destroy target land. Into the Maw of Hell deals 13 damage to target creature.
Boneyard Wurm,2.0,['Green'],['G'],None,['Creature'],['Wurm'],Uncommon,ISD,*,*,None,Boneyard Wurm's power and toughness are each equal to the number of creature cards in your graveyard.
Swamp,0.0,None,['B'],['Basic'],['Land'],['Swamp'],Common,ISD,None,None,None,({T}: Add {B}.)
Instigator Gang // Wildblood Pack,4.0,['Red'],['R'],None,['Creature'],"['Human', 'Werewolf']",Rare,ISD,2,3,None,"Attacking creatures you control get +1/+0.\nAt the beginning of each upkeep, if no spells were cast last turn, transform Instigator Gang."
Avacyn's Pilgrim,1.0,['Green'],"['G', 'W']",None,['Creature'],"['Human', 'Monk']",Common,ISD,1,1,None,{T}: Add {W}.
Infernal Plunge,1.0,['Red'],['R'],None,['Sorcery'],None,Common,ISD,None,None,None,"As an additional cost to cast this spell, sacrifice a creature.\nAdd {R}{R}{R}."
Ambush Viper,2.0,['Green'],['G'],None,['Creature'],['Snake'],Common,ISD,2,1,None,Flash\nDeathtouch
Heretic's Punishment,5.0,['Red'],['R'],None,['Enchantment'],None,Rare,ISD,None,None,None,"{3}{R}: Choose any target, then mill three cards. Heretic's Punishment deals damage to that permanent or player equal to the highest mana value among the milled cards."
Harvest Pyre,2.0,['Red'],['R'],None,['Instant'],None,Common,ISD,None,None,None,"As an additional cost to cast this spell, exile X cards from your graveyard.\nHarvest Pyre deals X damage to target creature."
Village Ironsmith // Ironfang,2.0,['Red'],['R'],None,['Creature'],"['Human', 'Werewolf']",Common,ISD,1,1,None,"First strike\nAt the beginning of each upkeep, if no spells were cast last turn, transform Village Ironsmith."
Swamp,0.0,None,['B'],['Basic'],['Land'],['Swamp'],Common,ISD,None,None,None,({T}: Add {B}.)
Vampiric Fury,2.0,['Red'],['R'],None,['Instant'],None,Common,ISD,None,None,None,Vampire creatures you control get +2/+0 and gain first strike until end of turn.
Hanweir Watchkeep // Bane of Hanweir,3.0,['Red'],['R'],None,['Creature'],"['Human', 'Warrior', 'Werewolf']",Uncommon,ISD,1,5,None,"Defender\nAt the beginning of each upkeep, if no spells were cast last turn, transform Hanweir Watchkeep."
Traitorous Blood,3.0,['Red'],['R'],None,['Sorcery'],None,Common,ISD,None,None,None,Gain control of target creature until end of turn. Untap it. It gains trample and haste until end of turn.
Geistflame,1.0,['Red'],['R'],None,['Instant'],None,Common,ISD,None,None,None,Geistflame deals 1 damage to any target.\nFlashback {3}{R} (You may cast this card from your graveyard for its flashback cost. Then exile it.)
Furor of the Bitten,1.0,['Red'],['R'],None,['Enchantment'],['Aura'],Common,ISD,None,None,None,Enchant creature\nEnchanted creature gets +2/+2 and attacks each combat if able.
Feral Ridgewolf,3.0,['Red'],['R'],None,['Creature'],['Wolf'],Common,ISD,1,2,None,Trample\n{1}{R}: Feral Ridgewolf gets +2/+0 until end of turn.
Mountain,0.0,None,['R'],['Basic'],['Land'],['Mountain'],Common,ISD,None,None,None,({T}: Add {R}.)
Falkenrath Marauders,5.0,['Red'],['R'],None,['Creature'],"['Vampire', 'Warrior']",Rare,ISD,2,2,None,"Flying, haste\nWhenever Falkenrath Marauders deals combat damage to a player, put two +1/+1 counters on it."
Devil's Play,1.0,['Red'],['R'],None,['Sorcery'],None,Rare,ISD,None,None,None,Devil's Play deals X damage to any target.\nFlashback {X}{R}{R}{R} (You may cast this card from your graveyard for its flashback cost. Then exile it.)
Tormented Pariah // Rampaging Werewolf,4.0,['Red'],['R'],None,['Creature'],"['Human', 'Warrior', 'Werewolf']",Common,ISD,3,2,None,"At the beginning of each upkeep, if no spells were cast last turn, transform Tormented Pariah."
Desperate Ravings,2.0,['Red'],"['R', 'U']",None,['Instant'],None,Uncommon,ISD,None,None,None,"Draw two cards, then discard a card at random.\nFlashback {2}{U} (You may cast this card from your graveyard for its flashback cost. Then exile it.)"
Stromkirk Noble,1.0,['Red'],['R'],None,['Creature'],"['Vampire', 'Noble']",Rare,ISD,1,1,None,"Stromkirk Noble can't be blocked by Humans.\nWhenever Stromkirk Noble deals combat damage to a player, put a +1/+1 counter on it."
Curse of the Pierced Heart,2.0,['Red'],['R'],None,['Enchantment'],"['Aura', 'Curse']",Common,ISD,None,None,None,"Enchant player\nAt the beginning of enchanted player's upkeep, Curse of the Pierced Heart deals 1 damage to that player or a planeswalker that player controls."
Skirsdag Cultist,4.0,['Red'],['R'],None,['Creature'],"['Human', 'Shaman']",Uncommon,ISD,2,2,None,"{R}, {T}, Sacrifice a creature: Skirsdag Cultist deals 2 damage to any target."
Curse of the Nightly Hunt,3.0,['Red'],['R'],None,['Enchantment'],"['Aura', 'Curse']",Uncommon,ISD,None,None,None,Enchant player\nCreatures enchanted player controls attack each combat if able.
Scourge of Geier Reach,5.0,['Red'],['R'],None,['Creature'],['Elemental'],Uncommon,ISD,3,3,None,Scourge of Geier Reach gets +1/+1 for each creature your opponents control.
Mountain,0.0,None,['R'],['Basic'],['Land'],['Mountain'],Common,ISD,None,None,None,({T}: Add {R}.)
Curse of Stalked Prey,2.0,['Red'],['R'],None,['Enchantment'],"['Aura', 'Curse']",Rare,ISD,None,None,None,"Enchant player\nWhenever a creature deals combat damage to enchanted player, put a +1/+1 counter on that creature."
Rolling Temblor,3.0,['Red'],['R'],None,['Sorcery'],None,Uncommon,ISD,None,None,None,Rolling Temblor deals 2 damage to each creature without flying.\nFlashback {4}{R}{R} (You may cast this card from your graveyard for its flashback cost. Then exile it.)
Sulfur Falls,0.0,None,"['R', 'U']",None,['Land'],None,Rare,ISD,None,None,None,Sulfur Falls enters the battlefield tapped unless you control an Island or a Mountain.\n{T}: Add {U} or {R}.
Crossway Vampire,3.0,['Red'],['R'],None,['Creature'],['Vampire'],Common,ISD,3,2,None,"When Crossway Vampire enters the battlefield, target creature can't block this turn."
Charmbreaker Devils,6.0,['Red'],['R'],None,['Creature'],['Devil'],Rare,ISD,4,4,None,"At the beginning of your upkeep, return an instant or sorcery card at random from your graveyard to your hand.\nWhenever you cast an instant or sorcery spell, Charmbreaker Devils gets +4/+0 until end of turn."
Mountain,0.0,None,['R'],['Basic'],['Land'],['Mountain'],Common,ISD,None,None,None,({T}: Add {R}.)
Burning Vengeance,3.0,['Red'],['R'],None,['Enchantment'],None,Uncommon,ISD,None,None,None,"Whenever you cast a spell from your graveyard, Burning Vengeance deals 2 damage to any target."
Shimmering Grotto,0.0,None,None,None,['Land'],None,Common,ISD,None,None,None,"{T}: Add {C}.\n{1}, {T}: Add one mana of any color."
Frightful Delusion,3.0,['Blue'],['U'],None,['Instant'],None,Common,ISD,None,None,None,Counter target spell unless its controller pays {1}. That player discards a card.
Brimstone Volley,3.0,['Red'],['R'],None,['Instant'],None,Common,ISD,None,None,None,Brimstone Volley deals 3 damage to any target.\nMorbid — Brimstone Volley deals 5 damage instead if a creature died this turn.
Woodland Cemetery,0.0,None,"['B', 'G']",None,['Land'],None,Rare,ISD,None,None,None,Woodland Cemetery enters the battlefield tapped unless you control a Swamp or a Forest.\n{T}: Add {B} or {G}.
Fortress Crab,4.0,['Blue'],['U'],None,['Creature'],['Crab'],Common,ISD,1,6,None,None
Bloodcrazed Neonate,2.0,['Red'],['R'],None,['Creature'],['Vampire'],Common,ISD,2,1,None,"Bloodcrazed Neonate attacks each combat if able.\nWhenever Bloodcrazed Neonate deals combat damage to a player, put a +1/+1 counter on it."
Plains,0.0,None,['W'],['Basic'],['Land'],['Plains'],Common,ISD,None,None,None,({T}: Add {W}.)
Slayer of the Wicked,4.0,['White'],['W'],None,['Creature'],"['Human', 'Soldier']",Uncommon,ISD,3,2,None,"When Slayer of the Wicked enters the battlefield, you may destroy target Vampire, Werewolf, or Zombie."
Forbidden Alchemy,3.0,['Blue'],"['B', 'U']",None,['Instant'],None,Common,ISD,None,None,None,Look at the top four cards of your library. Put one of them into your hand and the rest into your graveyard.\nFlashback {6}{B} (You may cast this card from your graveyard for its flashback cost. Then exile it.)
Blasphemous Act,9.0,['Red'],['R'],None,['Sorcery'],None,Rare,ISD,None,None,None,This spell costs {1} less to cast for each creature on the battlefield.\nBlasphemous Act deals 13 damage to each creature.
Silverchase Fox,2.0,['White'],['W'],None,['Creature'],['Fox'],Common,ISD,2,2,None,"{1}{W}, Sacrifice Silverchase Fox: Exile target enchantment."
Dream Twist,1.0,['Blue'],['U'],None,['Instant'],None,Common,ISD,None,None,None,Target player mills three cards.\nFlashback {1}{U} (You may cast this card from your graveyard for its flashback cost. Then exile it.)
Balefire Dragon,7.0,['Red'],['R'],None,['Creature'],['Dragon'],Mythic,ISD,6,6,None,"Flying\nWhenever Balefire Dragon deals combat damage to a player, it deals that much damage to each creature that player controls."
Dissipate,3.0,['Blue'],['U'],None,['Instant'],None,Uncommon,ISD,None,None,None,"Counter target spell. If that spell is countered this way, exile it instead of putting it into its owner's graveyard."
Ashmouth Hound,2.0,['Red'],['R'],None,['Creature'],"['Elemental', 'Dog']",Common,ISD,2,1,None,"Whenever Ashmouth Hound blocks or becomes blocked by a creature, Ashmouth Hound deals 1 damage to that creature."
Nephalia Drownyard,0.0,None,"['B', 'U']",None,['Land'],None,Rare,ISD,None,None,None,"{T}: Add {C}.\n{1}{U}{B}, {T}: Target player mills three cards."
Selfless Cathar,1.0,['White'],['W'],None,['Creature'],"['Human', 'Cleric']",Common,ISD,1,1,None,"{1}{W}, Sacrifice Selfless Cathar: Creatures you control get +1/+1 until end of turn."
Deranged Assistant,2.0,['Blue'],['U'],None,['Creature'],"['Human', 'Wizard']",Common,ISD,1,1,None,"{T}, Mill a card: Add {C}. (To mill a card, put the top card of your library into your graveyard.)"
Ancient Grudge,2.0,['Red'],"['G', 'R']",None,['Instant'],None,Common,ISD,None,None,None,Destroy target artifact.\nFlashback {G} (You may cast this card from your graveyard for its flashback cost. Then exile it.)
Rebuke,3.0,['White'],['W'],None,['Instant'],None,Common,ISD,None,None,None,Destroy target attacking creature.
Walking Corpse,2.0,['Black'],['B'],None,['Creature'],['Zombie'],Common,ISD,2,2,None,None
Hinterland Harbor,0.0,None,"['G', 'U']",None,['Land'],None,Rare,ISD,None,None,None,Hinterland Harbor enters the battlefield tapped unless you control a Forest or an Island.\n{T}: Add {G} or {U}.
Rally the Peasants,3.0,['White'],"['R', 'W']",None,['Instant'],None,Uncommon,ISD,None,None,None,Creatures you control get +2/+0 until end of turn.\nFlashback {2}{R} (You may cast this card from your graveyard for its flashback cost. Then exile it.)
Delver of Secrets // Insectile Aberration,1.0,['Blue'],['U'],None,['Creature'],"['Human', 'Wizard']",Common,ISD,1,1,None,"At the beginning of your upkeep, look at the top card of your library. You may reveal that card. If an instant or sorcery card is revealed this way, transform Delver of Secrets."
Village Cannibals,3.0,['Black'],['B'],None,['Creature'],['Human'],Uncommon,ISD,2,2,None,"Whenever another Human creature dies, put a +1/+1 counter on Village Cannibals."
Purify the Grave,1.0,['White'],['W'],None,['Instant'],None,Uncommon,ISD,None,None,None,Exile target card from a graveyard.\nFlashback {W} (You may cast this card from your graveyard for its flashback cost. Then exile it.)
Curse of the Bloody Tome,3.0,['Blue'],['U'],None,['Enchantment'],"['Aura', 'Curse']",Common,ISD,None,None,None,"Enchant player\nAt the beginning of enchanted player's upkeep, that player mills two cards."
