Name,CMC,Colors,Color identity,Supertypes,Types,Subtypes,Rarity,Set,Power,Toughness,Loyalty,Text
Victim of Night,2.0,['Black'],['B'],None,['Instant'],None,Common,ISD,None,None,None,"Destroy target non-Vampire, non-Werewolf, non-Zombie creature."
Paraselene,3.0,['White'],['W'],None,['Sorcery'],None,Uncommon,ISD,None,None,None,Destroy all enchantments. You gain 1 life for each enchantment destroyed this way.
Curiosity,1.0,['Blue'],['U'],None,['Enchantment'],['Aura'],Uncommon,ISD,None,None,None,"Enchant creature\nWhenever enchanted creature deals damage to an opponent, you may draw a card."
Vampire Interloper,2.0,['Black'],['B'],None,['Creature'],"['Vampire', 'Scout']",Common,ISD,2,1,None,Flying\nVampire Interloper can't block.
Nevermore,3.0,['White'],['W'],None,['Enchantment'],None,Rare,ISD,None,None,None,"As Nevermore enters the battlefield, choose a nonland card name.\nSpells with the chosen name can't be cast."
Claustrophobia,3.0,['Blue'],['U'],None,['Enchantment'],['Aura'],Common,ISD,None,None,None,"Enchant creature\nWhen Claustrophobia enters the battlefield, tap enchanted creature.\nEnchanted creature doesn't untap during its controller's untap step."
Unburial Rites,5.0,['Black'],"['B', 'W']",None,['Sorcery'],None,Uncommon,ISD,None,None,None,Return target creature card from your graveyard to the battlefield.\nFlashback {3}{W} (You may cast this card from your graveyard for its flashback cost. Then exile it.)
Moment of Heroism,2.0,['White'],['W'],None,['Instant'],None,Common,ISD,None,None,None,Target creature gets +2/+2 and gains lifelink until end of turn. (Damage dealt by the creature also causes its controller to gain that much life.)
Unbreathing Horde,3.0,['Black'],['B'],None,['Creature'],['Zombie'],Rare,ISD,0,0,None,"Unbreathing Horde enters the battlefield with a +1/+1 counter on it for each other Zombie you control and each Zombie card in your graveyard.\nIf Unbreathing Horde would be dealt damage, prevent that damage and remove a +1/+1 counter from it."
Witchbane Orb,4.0,None,None,None,['Artifact'],None,Rare,ISD,None,None,None,"When Witchbane Orb enters the battlefield, destroy all Curses attached to you.\nYou have hexproof. (You can't be the target of spells or abilities your opponents control, including Aura spells.)"
"Mikaeus, the Lunarch",1.0,['White'],['W'],['Legendary'],['Creature'],"['Human', 'Cleric']",Mythic,ISD,0,0,None,"Mikaeus, the Lunarch enters the battlefield with X +1/+1 counters on it.\n{T}: Put a +1/+1 counter on Mikaeus.\n{T}, Remove a +1/+1 counter from Mikaeus: Put a +1/+1 counter on each other creature you control."
Civilized Scholar // Homicidal Brute,3.0,['Blue'],"['R', 'U']",None,['Creature'],"['Human', 'Advisor']",Uncommon,ISD,0,1,None,"{T}: Draw a card, then discard a card. If a creature card is discarded this way, untap Civilized Scholar, then transform it."
Typhoid Rats,1.0,['Black'],['B'],None,['Creature'],['Rat'],Common,ISD,1,1,None,Deathtouch (Any amount of damage this deals to a creature is enough to destroy it.)
Midnight Haunting,3.0,['White'],['W'],None,['Instant'],None,Uncommon,ISD,None,None,None,Create two 1/1 white Spirit creature tokens with flying.
Cackling Counterpart,3.0,['Blue'],['U'],None,['Instant'],None,Rare,ISD,None,None,None,Create a token that's a copy of target creature you control.\nFlashback {5}{U}{U} (You may cast this card from your graveyard for its flashback cost. Then exile it.)
Tribute to Hunger,3.0,['Black'],['B'],None,['Instant'],None,Uncommon,ISD,None,None,None,Target opponent sacrifices a creature. You gain life equal to that creature's toughness.
Mentor of the Meek,3.0,['White'],['W'],None,['Creature'],"['Human', 'Soldier']",Rare,ISD,2,2,None,"Whenever another creature with power 2 or less enters the battlefield under your control, you may pay {1}. If you do, draw a card."
Battleground Geist,5.0,['Blue'],['U'],None,['Creature'],['Spirit'],Uncommon,ISD,3,3,None,Flying\nOther Spirit creatures you control get +1/+0.
Stromkirk Patrol,5.0,['Black'],['B'],None,['Creature'],"['Vampire', 'Soldier']",Common,ISD,4,3,None,"Whenever Stromkirk Patrol deals combat damage to a player, put a +1/+1 counter on it."
Mausoleum Guard,4.0,['White'],['W'],None,['Creature'],"['Human', 'Scout']",Uncommon,ISD,2,2,None,"When Mausoleum Guard dies, create two 1/1 white Spirit creature tokens with flying."
Back from the Brink,6.0,['Blue'],['U'],None,['Enchantment'],None,Rare,ISD,None,None,None,Exile a creature card from your graveyard and pay its mana cost: Create a token that's a copy of that card. Activate only as a sorcery.
Skirsdag High Priest,2.0,['Black'],['B'],None,['Creature'],"['Human', 'Cleric']",Rare,ISD,1,2,None,"Morbid — {T}, Tap two untapped creatures you control: Create a 5/5 black Demon creature token with flying. Activate only if a creature died this turn."
Intangible Virtue,2.0,['White'],['W'],None,['Enchantment'],None,Uncommon,ISD,None,None,None,Creature tokens you control get +1/+1 and have vigilance.
Skeletal Grimace,2.0,['Black'],['B'],None,['Enchantment'],['Aura'],Common,ISD,None,None,None,"Enchant creature\nEnchanted creature gets +1/+1 and has ""{B}: Regenerate this creature."""
Galvanic Juggernaut,4.0,None,None,None,"['Artifact', 'Creature']",['Juggernaut'],Uncommon,ISD,5,5,None,"Galvanic Juggernaut attacks each combat if able.\nGalvanic Juggernaut doesn't untap during your untap step.\nWhenever another creature dies, untap Galvanic Juggernaut."
Ghostly Possession,3.0,['White'],['W'],None,['Enchantment'],['Aura'],Common,ISD,None,None,None,Enchant creature\nEnchanted creature has flying.\nPrevent all combat damage that would be dealt to and dealt by enchanted creature.
Kessig Wolf Run,0.0,None,"['G', 'R']",None,['Land'],None,Rare,ISD,None,None,None,"{T}: Add {C}.\n{X}{R}{G}, {T}: Target creature gets +X/+0 and gains trample until end of turn."
Geist-Honored Monk,5.0,['White'],['W'],None,['Creature'],"['Human', 'Monk']",Rare,ISD,*,*,None,"Vigilance\nGeist-Honored Monk's power and toughness are each equal to the number of creatures you control.\nWhen Geist-Honored Monk enters the battlefield, create two 1/1 white Spirit creature tokens with flying."
Sever the Bloodline,4.0,['Black'],['B'],None,['Sorcery'],None,Rare,ISD,None,None,None,Exile target creature and all other creatures with the same name as that creature.\nFlashback {5}{B}{B} (You may cast this card from your graveyard for its flashback cost. Then exile it.)
Gallows Warden,5.0,['White'],['W'],None,['Creature'],['Spirit'],Uncommon,ISD,3,3,None,Flying\nOther Spirit creatures you control get +0/+1.
Angel of Flight Alabaster,5.0,['White'],['W'],None,['Creature'],['Angel'],Rare,ISD,4,4,None,"Flying\nAt the beginning of your upkeep, return target Spirit card from your graveyard to your hand."
Armored Skaab,3.0,['Blue'],['U'],None,['Creature'],"['Zombie', 'Warrior']",Common,ISD,1,4,None,"When Armored Skaab enters the battlefield, mill four cards."
Screeching Bat // Stalking Vampire,3.0,['Black'],['B'],None,['Creature'],['Bat'],Uncommon,ISD,2,2,None,"Flying\nAt the beginning of your upkeep, you may pay {2}{B}{B}. If you do, transform Screeching Bat."
Elder Cathar,3.0,['White'],['W'],None,['Creature'],"['Human', 'Soldier']",Common,ISD,2,2,None,"When Elder Cathar dies, put a +1/+1 counter on target creature you control. If that creature is a Human, put two +1/+1 counters on it instead."
Rotting Fensnake,4.0,['Black'],['B'],None,['Creature'],"['Zombie', 'Snake']",Common,ISD,5,1,None,None
Inquisitor's Flail,2.0,None,None,None,['Artifact'],['Equipment'],Uncommon,ISD,None,None,None,"If equipped creature would deal combat damage, it deals double that damage instead.\nIf another creature would deal combat damage to equipped creature, it deals double that damage to equipped creature instead.\nEquip {2}"
Feeling of Dread,2.0,['White'],"['U', 'W']",None,['Instant'],None,Common,ISD,None,None,None,Tap up to two target creatures.\nFlashback {1}{U} (You may cast this card from your graveyard for its flashback cost. Then exile it.)
Voiceless Spirit,3.0,['White'],['W'],None,['Creature'],['Spirit'],Common,ISD,2,1,None,"Flying, first strike"
Reaper from the Abyss,6.0,['Black'],['B'],None,['Creature'],['Demon'],Mythic,ISD,6,6,None,"Flying\nMorbid — At the beginning of each end step, if a creature died this turn, destroy target non-Demon creature."
Fiend Hunter,3.0,['White'],['W'],None,['Creature'],"['Human', 'Cleric']",Uncommon,ISD,1,3,None,"When Fiend Hunter enters the battlefield, you may exile another target creature.\nWhen Fiend Hunter leaves the battlefield, return the exiled card to the battlefield under its owner's control."
Night Terrors,3.0,['Black'],['B'],None,['Sorcery'],None,Common,ISD,None,None,None,Target player reveals their hand. You choose a nonland card from it. Exile that card.
Isolated Chapel,0.0,None,"['B', 'W']",None,['Land'],None,Rare,ISD,None,None,None,Isolated Chapel enters the battlefield tapped unless you control a Plains or a Swamp.\n{T}: Add {W} or {B}.
Elite Inquisitor,2.0,['White'],['W'],None,['Creature'],"['Human', 'Soldier']",Rare,ISD,2,2,None,"First strike, vigilance\nProtection from Vampires, from Werewolves, and from Zombies"
Dead Weight,1.0,['Black'],['B'],None,['Enchantment'],['Aura'],Common,ISD,None,None,None,Enchant creature\nEnchanted creature gets -2/-2.
Doomed Traveler,1.0,['White'],['W'],None,['Creature'],"['Human', 'Soldier']",Common,ISD,1,1,None,"When Doomed Traveler dies, create a 1/1 white Spirit creature token with flying."
Markov Patrician,3.0,['Black'],['B'],None,['Creature'],['Vampire'],Common,ISD,3,1,None,Lifelink (Damage dealt by this creature also causes you to gain that much life.)
Divine Reckoning,4.0,['White'],['W'],None,['Sorcery'],None,Rare,ISD,None,None,None,Each player chooses a creature they control. Destroy the rest.\nFlashback {5}{W}{W} (You may cast this card from your graveyard for its flashback cost. Then exile it.)
Moan of the Unhallowed,4.0,['Black'],['B'],None,['Sorcery'],None,Uncommon,ISD,None,None,None,Create two 2/2 black Zombie creature tokens.\nFlashback {5}{B}{B} (You may cast this card from your graveyard for its flashback cost. Then exile it.)
Clifftop Retreat,0.0,None,"['R', 'W']",None,['Land'],None,Rare,ISD,None,None,None,Clifftop Retreat enters the battlefield tapped unless you control a Mountain or a Plains.\n{T}: Add {R} or {W}.
Dearly Departed,6.0,['White'],['W'],None,['Creature'],['Spirit'],Rare,ISD,5,5,None,"Flying\nAs long as Dearly Departed is in your graveyard, each Human creature you control enters the battlefield with an additional +1/+1 counter on it."
Morkrut Banshee,5.0,['Black'],['B'],None,['Creature'],['Spirit'],Uncommon,ISD,4,4,None,"Morbid — When Morkrut Banshee enters the battlefield, if a creature died this turn, target creature gets -4/-4 until end of turn."
Chapel Geist,3.0,['White'],['W'],None,['Creature'],['Spirit'],Common,ISD,2,3,None,Flying
Maw of the Mire,5.0,['Black'],['B'],None,['Sorcery'],None,Common,ISD,None,None,None,Destroy target land. You gain 4 life.
Village Bell-Ringer,3.0,['White'],['W'],None,['Creature'],"['Human', 'Scout']",Common,ISD,1,4,None,"Flash (You may cast this spell any time you could cast an instant.)\nWhen Village Bell-Ringer enters the battlefield, untap all creatures you control."
Manor Skeleton,2.0,['Black'],['B'],None,['Creature'],['Skeleton'],Common,ISD,1,1,None,Haste\n{1}{B}: Regenerate Manor Skeleton.
Cloistered Youth // Unholy Fiend,2.0,['White'],"['B', 'W']",None,['Creature'],['Human'],Uncommon,ISD,1,1,None,"At the beginning of your upkeep, you may transform Cloistered Youth."
Liliana of the Veil,3.0,['Black'],['B'],['Legendary'],['Planeswalker'],['Liliana'],Mythic,ISD,None,None,3,[+1]: Each player discards a card.\n[−2]: Target player sacrifices a creature.\n[−6]: Separate all permanents target player controls into two piles. That player sacrifices all permanents in the pile of their choice.
Angelic Overseer,5.0,['White'],['W'],None,['Creature'],['Angel'],Mythic,ISD,5,3,None,"Flying\nAs long as you control a Human, Angelic Overseer has hexproof and indestructible."
Heartless Summoning,2.0,['Black'],['B'],None,['Enchantment'],None,Rare,ISD,None,None,None,Creature spells you cast cost {2} less to cast.\nCreatures you control get -1/-1.
Abbey Griffin,4.0,['White'],['W'],None,['Creature'],['Griffin'],Common,ISD,2,2,None,"Flying, vigilance"
Ghoulcaller's Chant,1.0,['Black'],['B'],None,['Sorcery'],None,Common,ISD,None,None,None,Choose one —\n• Return target creature card from your graveyard to your hand.\n• Return two target Zombie cards from your graveyard to your hand.
Champion of the Parish,1.0,['White'],['W'],None,['Creature'],"['Human', 'Soldier']",Rare,ISD,1,1,None,"Whenever another Human enters the battlefield under your control, put a +1/+1 counter on Champion of the Parish."
Gruesome Deformity,1.0,['Black'],['B'],None,['Enchantment'],['Aura'],Common,ISD,None,None,None,Enchant creature\nEnchanted creature has intimidate. (It can't be blocked except by artifact creatures and/or creatures that share a color with it.)
Bonds of Faith,2.0,['White'],['W'],None,['Enchantment'],['Aura'],Common,ISD,None,None,None,"Enchant creature\nEnchanted creature gets +2/+2 as long as it's a Human. Otherwise, it can't attack or block."
Ghoulraiser,3.0,['Black'],['B'],None,['Creature'],['Zombie'],Common,ISD,2,2,None,"When Ghoulraiser enters the battlefield, return a Zombie card at random from your graveyard to your hand."
Avacynian Priest,2.0,['White'],['W'],None,['Creature'],"['Human', 'Cleric']",Common,ISD,1,2,None,"{1}, {T}: Tap target non-Human creature."
Diregraf Ghoul,1.0,['Black'],['B'],None,['Creature'],['Zombie'],Uncommon,ISD,2,2,None,Diregraf Ghoul enters the battlefield tapped.
Curse of Oblivion,4.0,['Black'],['B'],None,['Enchantment'],"['Aura', 'Curse']",Common,ISD,None,None,None,"Enchant player\nAt the beginning of enchanted player's upkeep, that player exiles two cards from their graveyard."
Falkenrath Noble,4.0,['Black'],['B'],None,['Creature'],"['Vampire', 'Noble']",Uncommon,ISD,2,2,None,"Flying\nWhenever Falkenrath Noble or another creature dies, target player loses 1 life and you gain 1 life."
Ghost Quarter,0.0,None,None,None,['Land'],None,Uncommon,ISD,None,None,None,"{T}: Add {C}.\n{T}, Sacrifice Ghost Quarter: Destroy target land. Its controller may search their library for a basic land card, put it onto the battlefield, then shuffle."
Endless Ranks of the Dead,4.0,['Black'],['B'],None,['Enchantment'],None,Rare,ISD,None,None,None,"At the beginning of your upkeep, create X 2/2 black Zombie creature tokens, where X is half the number of Zombies you control, rounded down."
Disciple of Griselbrand,2.0,['Black'],['B'],None,['Creature'],"['Human', 'Cleric']",Uncommon,ISD,1,1,None,"{1}, Sacrifice a creature: You gain life equal to the sacrificed creature's toughness."
Urgent Exorcism,2.0,['White'],['W'],None,['Instant'],None,Common,ISD,None,None,None,Destroy target Spirit or enchantment.
Curse of Death's Hold,5.0,['Black'],['B'],None,['Enchantment'],"['Aura', 'Curse']",Rare,ISD,None,None,None,Enchant player\nCreatures enchanted player controls get -1/-1.
Unruly Mob,2.0,['White'],['W'],None,['Creature'],['Human'],Common,ISD,1,1,None,"Whenever another creature you control dies, put a +1/+1 counter on Unruly Mob."
Corpse Lunge,3.0,['Black'],['B'],None,['Instant'],None,Common,ISD,None,None,None,"As an additional cost to cast this spell, exile a creature card from your graveyard.\nCorpse Lunge deals damage equal to the exiled card's power to target creature."
Gavony Township,0.0,None,"['G', 'W']",None,['Land'],None,Rare,ISD,None,None,None,"{T}: Add {C}.\n{2}{G}{W}, {T}: Put a +1/+1 counter on each creature you control."
Bump in the Night,1.0,['Black'],"['B', 'R']",None,['Sorcery'],None,Common,ISD,None,None,None,Target opponent loses 3 life.\nFlashback {5}{R} (You may cast this card from your graveyard for its flashback cost. Then exile it.)
Thraben Sentry // Thraben Militia,4.0,['White'],['W'],None,['Creature'],"['Human', 'Soldier']",Common,ISD,2,2,None,"Vigilance\nWhenever another creature you control dies, you may transform Thraben Sentry."
Brain Weevil,4.0,['Black'],['B'],None,['Creature'],['Insect'],Common,ISD,1,1,None,Intimidate (This creature can't be blocked except by artifact creatures and/or creatures that share a color with it.)\nSacrifice Brain Weevil: Target player discards two cards. Activate only as a sorcery.
Grimoire of the Dead,4.0,None,None,['Legendary'],['Artifact'],None,Mythic,ISD,None,None,None,"{1}, {T}, Discard a card: Put a study counter on Grimoire of the Dead.\n{T}, Remove three study counters from Grimoire of the Dead and sacrifice it: Put all creature cards from all graveyards onto the battlefield under your control. They're black Zombies in addition to their other colors and types."
Bloodline Keeper // Lord of Lineage,4.0,['Black'],['B'],None,['Creature'],['Vampire'],Rare,ISD,3,3,None,Flying\n{T}: Create a 2/2 black Vampire creature token with flying.\n{B}: Transform Bloodline Keeper. Activate only if you control five or more Vampires.
Thraben Purebloods,5.0,['White'],['W'],None,['Creature'],['Dog'],Common,ISD,3,5,None,None
Bloodgift Demon,5.0,['Black'],['B'],None,['Creature'],['Demon'],Rare,ISD,5,4,None,"Flying\nAt the beginning of your upkeep, target player draws a card and loses 1 life."
Trepanation Blade,3.0,None,None,None,['Artifact'],['Equipment'],Uncommon,ISD,None,None,None,"Whenever equipped creature attacks, defending player reveals cards from the top of their library until they reveal a land card. The creature gets +1/+0 until end of turn for each card revealed this way. That player puts the revealed cards into their graveyard.\nEquip {2}"
Bitterheart Witch,5.0,['Black'],['B'],None,['Creature'],"['Human', 'Shaman']",Uncommon,ISD,1,2,None,"Deathtouch\nWhen Bitterheart Witch dies, you may search your library for a Curse card, put it onto the battlefield attached to target player, then shuffle."
Graveyard Shovel,2.0,None,None,None,['Artifact'],None,Uncommon,ISD,None,None,None,"{2}, {T}: Target player exiles a card from their graveyard. If it's a creature card, you gain 2 life."
Army of the Damned,8.0,['Black'],['B'],None,['Sorcery'],None,Mythic,ISD,None,None,None,Create thirteen tapped 2/2 black Zombie creature tokens.\nFlashback {7}{B}{B}{B} (You may cast this card from your graveyard for its flashback cost. Then exile it.)
Altar's Reap,2.0,['Black'],['B'],None,['Instant'],None,Common,ISD,None,None,None,"As an additional cost to cast this spell, sacrifice a creature.\nDraw two cards."
Abattoir Ghoul,4.0,['Black'],['B'],None,['Creature'],['Zombie'],Uncommon,ISD,3,2,None,"First strike\nWhenever a creature dealt damage by Abattoir Ghoul this turn dies, you gain life equal to that creature's toughness."
Undead Alchemist,4.0,['Blue'],['U'],None,['Creature'],['Zombie'],Rare,ISD,4,2,None,"If a Zombie you control would deal combat damage to a player, instead that player mills that many cards.\nWhenever a creature card is put into an opponent's graveyard from their library, exile that card and create a 2/2 black Zombie creature token."
Stony Silence,2.0,['White'],['W'],None,['Enchantment'],None,Rare,ISD,None,None,None,Activated abilities of artifacts can't be activated.
Think Twice,2.0,['Blue'],['U'],None,['Instant'],None,Common,ISD,None,None,None,Draw a card.\nFlashback {2}{U} (You may cast this card from your graveyard for its flashback cost. Then exile it.)
Ghoulcaller's Bell,1.0,None,None,None,['Artifact'],None,Common,ISD,None,None,None,{T}: Each player mills a card.
Spectral Rider,2.0,['White'],['W'],None,['Creature'],"['Spirit', 'Knight']",Uncommon,ISD,2,2,None,Intimidate (This creature can't be blocked except by artifact creatures and/or creatures that share a color with it.)
Sturmgeist,5.0,['Blue'],['U'],None,['Creature'],['Spirit'],Rare,ISD,*,*,None,"Flying\nSturmgeist's power and toughness are each equal to the number of cards in your hand.\nWhenever Sturmgeist deals combat damage to a player, draw a card."
Plains,0.0,None,['W'],['Basic'],['Land'],['Plains'],Common,ISD,None,None,None,({T}: Add {W}.)
Stitcher's Apprentice,2.0,['Blue'],['U'],None,['Creature'],['Homunculus'],Common,ISD,1,2,None,"{1}{U}, {T}: Create a 2/2 blue Homunculus creature token, then sacrifice a creature."
Geistcatcher's Rig,6.0,None,None,None,"['Artifact', 'Creature']",['Construct'],Uncommon,ISD,4,5,None,"When Geistcatcher's Rig enters the battlefield, you may have it deal 4 damage to target creature with flying."
Spare from Evil,2.0,['White'],['W'],None,['Instant'],None,Common,ISD,None,None,None,Creatures you control gain protection from non-Human creatures until end of turn.
Stitched Drake,3.0,['Blue'],['U'],None,['Creature'],"['Zombie', 'Drake']",Common,ISD,3,4,None,"As an additional cost to cast this spell, exile a creature card from your graveyard.\nFlying"
Spectral Flight,2.0,['Blue'],['U'],None,['Enchantment'],['Aura'],Common,ISD,None,None,None,Enchant creature\nEnchanted creature gets +2/+2 and has flying.
Snapcaster Mage,2.0,['Blue'],['U'],None,['Creature'],"['Human', 'Wizard']",Rare,ISD,2,1,None,"Flash\nWhen Snapcaster Mage enters the battlefield, target instant or sorcery card in your graveyard gains flashback until end of turn. The flashback cost is equal to its mana cost. (You may cast that card from your graveyard for its flashback cost. Then exile it.)"
Skaab Ruinator,3.0,['Blue'],['U'],None,['Creature'],"['Zombie', 'Horror']",Mythic,ISD,5,6,None,"As an additional cost to cast this spell, exile three creature cards from your graveyard.\nFlying\nYou may cast Skaab Ruinator from your graveyard."
Skaab Goliath,6.0,['Blue'],['U'],None,['Creature'],"['Zombie', 'Giant']",Uncommon,ISD,6,9,None,"As an additional cost to cast this spell, exile two creature cards from your graveyard.\nTrample"
Silent Departure,1.0,['Blue'],['U'],None,['Sorcery'],None,Common,ISD,None,None,None,Return target creature to its owner's hand.\nFlashback {4}{U} (You may cast this card from your graveyard for its flashback cost. Then exile it.)
Sensory Deprivation,1.0,['Blue'],['U'],None,['Enchantment'],['Aura'],Common,ISD,None,None,None,Enchant creature\nEnchanted creature gets -3/-0.
Wooden Stake,2.0,None,None,None,['Artifact'],['Equipment'],Common,ISD,None,None,None,"Equipped creature gets +1/+0.\nWhenever equipped creature blocks or becomes blocked by a Vampire, destroy that creature. It can't be regenerated.\nEquip {1} ({1}: Attach to target creature you control. Equip only as a sorcery.)"
Selhoff Occultist,3.0,['Blue'],['U'],None,['Creature'],"['Human', 'Rogue']",Common,ISD,2,3,None,"Whenever Selhoff Occultist or another creature dies, target player mills a card."
Smite the Monstrous,4.0,['White'],['W'],None,['Instant'],None,Common,ISD,None,None,None,Destroy target creature with power 4 or greater.
Runic Repetition,3.0,['Blue'],['U'],None,['Sorcery'],None,Uncommon,ISD,None,None,None,Return target exiled card with flashback you own to your hand.
Rooftop Storm,6.0,['Blue'],['U'],None,['Enchantment'],None,Rare,ISD,None,None,None,You may pay {0} rather than pay the mana cost for Zombie creature spells you cast.
Plains,0.0,None,['W'],['Basic'],['Land'],['Plains'],Common,ISD,None,None,None,({T}: Add {W}.)
Murder of Crows,5.0,['Blue'],['U'],None,['Creature'],['Bird'],Uncommon,ISD,4,4,None,"Flying\nWhenever another creature dies, you may draw a card. If you do, discard a card."
Moon Heron,4.0,['Blue'],['U'],None,['Creature'],"['Spirit', 'Bird']",Common,ISD,3,2,None,Flying
Mirror-Mad Phantasm,5.0,['Blue'],['U'],None,['Creature'],['Spirit'],Mythic,ISD,5,1,None,"Flying\n{1}{U}: Mirror-Mad Phantasm's owner shuffles it into their library. If that player does, they reveal cards from the top of that library until a card named Mirror-Mad Phantasm is revealed. The player puts that card onto the battlefield and all other cards revealed this way into their graveyard."
Stensia Bloodhall,0.0,None,"['B', 'R']",None,['Land'],None,Rare,ISD,None,None,None,"{T}: Add {C}.\n{3}{B}{R}, {T}: Stensia Bloodhall deals 2 damage to target player or planeswalker."
Mindshrieker,2.0,['Blue'],['U'],None,['Creature'],"['Spirit', 'Bird']",Rare,ISD,1,1,None,"Flying\n{2}: Target player mills a card. Mindshrieker gets +X/+X until end of turn, where X is the milled card's mana value."
Memory's Journey,2.0,['Blue'],"['G', 'U']",None,['Instant'],None,Uncommon,ISD,None,None,None,Target player shuffles up to three target cards from their graveyard into their library.\nFlashback {G} (You may cast this card from your graveyard for its flashback cost. Then exile it.)
Makeshift Mauler,4.0,['Blue'],['U'],None,['Creature'],"['Zombie', 'Horror']",Common,ISD,4,5,None,"As an additional cost to cast this spell, exile a creature card from your graveyard."
Ludevic's Test Subject // Ludevic's Abomination,2.0,['Blue'],['U'],None,['Creature'],"['Lizard', 'Egg']",Rare,ISD,0,3,None,"Defender\n{1}{U}: Put a hatchling counter on Ludevic's Test Subject. Then if there are five or more hatchling counters on it, remove all of them and transform it."
Lost in the Mist,5.0,['Blue'],['U'],None,['Instant'],None,Common,ISD,None,None,None,Counter target spell. Return target permanent to its owner's hand.
Lantern Spirit,3.0,['Blue'],['U'],None,['Creature'],['Spirit'],Uncommon,ISD,2,1,None,Flying\n{U}: Return Lantern Spirit to its owner's hand.
Laboratory Maniac,3.0,['Blue'],['U'],None,['Creature'],"['Human', 'Wizard']",Rare,ISD,2,2,None,"If you would draw a card while your library has no cards in it, you win the game instead."
Traveler's Amulet,1.0,None,None,None,['Artifact'],None,Common,ISD,None,None,None,"{1}, Sacrifice Traveler's Amulet: Search your library for a basic land card, reveal it, put it into your hand, then shuffle."
Invisible Stalker,2.0,['Blue'],['U'],None,['Creature'],"['Human', 'Rogue']",Uncommon,ISD,1,1,None,Hexproof (This creature can't be the target of spells or abilities your opponents control.)\nInvisible Stalker can't be blocked.
