Name,CMC,Colors,Color identity,Supertypes,Types,Subtypes,Rarity,Set,Power,Toughness,Loyalty,Text
Silver-Inlaid Dagger,1.0,None,None,None,['Artifact'],['Equipment'],Uncommon,ISD,None,None,None,"Equipped creature gets +2/+0.\nAs long as equipped creature is a Human, it gets an additional +1/+0.\nEquip {2}"
Hysterical Blindness,3.0,['Blue'],['U'],None,['Instant'],None,Common,ISD,None,None,None,Creatures your opponents control get -4/-0 until end of turn.
Runechanter's Pike,2.0,None,None,None,['Artifact'],['Equipment'],Rare,ISD,None,None,None,"Equipped creature has first strike and gets +X/+0, where X is the number of instant and sorcery cards in your graveyard.\nEquip {2}"
Forest,0.0,None,['G'],['Basic'],['Land'],['Forest'],Common,ISD,None,None,None,({T}: Add {G}.)
Grasp of Phantoms,4.0,['Blue'],['U'],None,['Sorcery'],None,Uncommon,ISD,None,None,None,Put target creature on top of its owner's library.\nFlashback {7}{U} (You may cast this card from your graveyard for its flashback cost. Then exile it.)
One-Eyed Scarecrow,3.0,None,None,None,"['Artifact', 'Creature']",['Scarecrow'],Common,ISD,2,3,None,Defender\nCreatures with flying your opponents control get -1/-0.
Mask of Avacyn,2.0,None,None,None,['Artifact'],['Equipment'],Uncommon,ISD,None,None,None,Equipped creature gets +1/+2 and has hexproof. (It can't be the target of spells or abilities your opponents control.)\nEquip {3}
Manor Gargoyle,5.0,None,None,None,"['Artifact', 'Creature']",['Gargoyle'],Rare,ISD,4,4,None,"Defender\nManor Gargoyle has indestructible as long as it has defender.\n{1}: Until end of turn, Manor Gargoyle loses defender and gains flying."
Sharpened Pitchfork,2.0,None,None,None,['Artifact'],['Equipment'],Uncommon,ISD,None,None,None,"Equipped creature has first strike.\nAs long as equipped creature is a Human, it gets +1/+1.\nEquip {1}"
