Name,CMC,Colors,Color identity,Supertypes,Types,Subtypes,Rarity,Set,Power,Toughness,Loyalty,Text
Gravewaker,6.0,['Black'],['B'],None,['Creature'],"['Bird', 'Spirit']",Rare,JMP,5,5,None,Flying (This creature can't be blocked except by creatures with flying or reach.)\n{5}{B}{B}: Return target creature card from your graveyard to the battlefield tapped.
Oneirophage,4.0,['Blue'],['U'],None,['Creature'],"['Squid', 'Illusion']",Uncommon,JMP,1,2,None,"Flying\nWhenever you draw a card, put a +1/+1 counter on Oneirophage."
"Gonti, Lord of Luxury",4.0,['Black'],['B'],['Legendary'],['Creature'],"['Aetherborn', 'Rogue']",Rare,JMP,2,3,None,"Deathtouch\nWhen Gonti, Lord of Luxury enters the battlefield, look at the top four cards of target opponent's library, exile one of them face down, then put the rest on the bottom of that library in a random order. You may look at and cast that card for as long as it remains exiled, and you may spend mana as though it were mana of any type to cast that spell."
Octoprophet,4.0,['Blue'],['U'],None,['Creature'],['Octopus'],Common,JMP,3,3,None,"When Octoprophet enters the battlefield, scry 2. (Look at the top two cards of your library, then put any number of them on the bottom of your library and the rest on top in any order.)"
Gifted Aetherborn,2.0,['Black'],['B'],None,['Creature'],"['Aetherborn', 'Vampire']",Uncommon,JMP,2,3,None,"Deathtouch, lifelink"
Nebelgast Herald,3.0,['Blue'],['U'],None,['Creature'],['Spirit'],Uncommon,JMP,2,1,None,"Flash (You may cast this spell any time you could cast an instant.)\nFlying\nWhenever Nebelgast Herald or another Spirit enters the battlefield under your control, tap target creature an opponent controls."
Ghoulraiser,3.0,['Black'],['B'],None,['Creature'],['Zombie'],Common,JMP,2,2,None,"When Ghoulraiser enters the battlefield, return a Zombie card at random from your graveyard to your hand."
Narcolepsy,2.0,['Blue'],['U'],None,['Enchantment'],['Aura'],Common,JMP,None,None,None,"Enchant creature\nAt the beginning of each upkeep, if enchanted creature is untapped, tap it."
Ghoulcaller's Accomplice,2.0,['Black'],['B'],None,['Creature'],"['Human', 'Rogue']",Common,JMP,2,2,None,"{3}{B}, Exile Ghoulcaller's Accomplice from your graveyard: Create a 2/2 black Zombie creature token. Activate only as a sorcery."
Mystic Archaeologist,2.0,['Blue'],['U'],None,['Creature'],"['Human', 'Wizard']",Rare,JMP,2,1,None,{3}{U}{U}: Draw two cards.
Ghoulcaller Gisa,5.0,['Black'],['B'],['Legendary'],['Creature'],"['Human', 'Wizard']",Mythic,JMP,3,4,None,"{B}, {T}, Sacrifice another creature: Create X 2/2 black Zombie creature tokens, where X is the sacrificed creature's power."
Murmuring Phantasm,2.0,['Blue'],['U'],None,['Creature'],['Spirit'],Common,JMP,0,5,None,Defender
Funeral Rites,3.0,['Black'],['B'],None,['Sorcery'],None,Common,JMP,None,None,None,"You draw two cards, lose 2 life, then mill two cards."
Leave in the Dust,4.0,['Blue'],['U'],None,['Instant'],None,Common,JMP,None,None,None,Return target nonland permanent to its owner's hand.\nDraw a card.
Festering Newt,1.0,['Black'],['B'],None,['Creature'],['Salamander'],Common,JMP,1,1,None,"When Festering Newt dies, target creature an opponent controls gets -1/-1 until end of turn. That creature gets -4/-4 instead if you control a creature named Bogbrew Witch."
Kitesail Corsair,2.0,['Blue'],['U'],None,['Creature'],"['Human', 'Pirate']",Common,JMP,2,1,None,Kitesail Corsair has flying as long as it's attacking.
Fell Specter,4.0,['Black'],['B'],None,['Creature'],['Specter'],Uncommon,JMP,1,3,None,"Flying\nWhen Fell Specter enters the battlefield, target opponent discards a card.\nWhenever an opponent discards a card, that player loses 2 life."
"Kira, Great Glass-Spinner",3.0,['Blue'],['U'],['Legendary'],['Creature'],['Spirit'],Rare,JMP,2,2,None,"Flying\nCreatures you control have ""Whenever this creature becomes the target of a spell or ability for the first time each turn, counter that spell or ability."""
Falkenrath Noble,4.0,['Black'],['B'],None,['Creature'],"['Vampire', 'Noble']",Uncommon,JMP,2,2,None,"Flying\nWhenever Falkenrath Noble or another creature dies, target player loses 1 life and you gain 1 life."
Exclusion Mage,3.0,['Blue'],['U'],None,['Creature'],"['Human', 'Wizard']",Uncommon,JMP,2,2,None,"When Exclusion Mage enters the battlefield, return target creature an opponent controls to its owner's hand."
Exquisite Blood,5.0,['Black'],['B'],None,['Enchantment'],None,Rare,JMP,None,None,None,"Whenever an opponent loses life, you gain that much life."
Exhume,2.0,['Black'],['B'],None,['Sorcery'],None,Uncommon,JMP,None,None,None,Each player puts a creature card from their graveyard onto the battlefield.
Eternal Thirst,2.0,['Black'],['B'],None,['Enchantment'],['Aura'],Common,JMP,None,None,None,"Enchant creature\nEnchanted creature has lifelink and ""Whenever a creature an opponent controls dies, put a +1/+1 counter on this creature."" (Damage dealt by a creature with lifelink also causes its controller to gain that much life.)"
Eternal Taskmaster,2.0,['Black'],['B'],None,['Creature'],['Zombie'],Uncommon,JMP,2,3,None,"Eternal Taskmaster enters the battlefield tapped.\nWhenever Eternal Taskmaster attacks, you may pay {2}{B}. If you do, return target creature card from your graveyard to your hand."
Entomber Exarch,4.0,['Black'],['B'],None,['Creature'],"['Phyrexian', 'Cleric']",Uncommon,JMP,2,2,None,"When Entomber Exarch enters the battlefield, choose one —\n• Return target creature card from your graveyard to your hand.\n• Target opponent reveals their hand. You choose a noncreature card from it. That player discards that card."
Exclude,3.0,['Blue'],['U'],None,['Instant'],None,Uncommon,JMP,None,None,None,Counter target creature spell.\nDraw a card.
Dutiful Attendant,3.0,['Black'],['B'],None,['Creature'],"['Human', 'Warrior']",Common,JMP,1,2,None,"When Dutiful Attendant dies, return another target creature card from your graveyard to your hand."
"Drana, Liberator of Malakir",3.0,['Black'],['B'],['Legendary'],['Creature'],"['Vampire', 'Ally']",Mythic,JMP,2,3,None,"Flying, first strike\nWhenever Drana, Liberator of Malakir deals combat damage to a player, put a +1/+1 counter on each attacking creature you control."
Essence Flux,1.0,['Blue'],['U'],None,['Instant'],None,Uncommon,JMP,None,None,None,"Exile target creature you control, then return that card to the battlefield under its owner's control. If it's a Spirit, put a +1/+1 counter on it."
Drainpipe Vermin,1.0,['Black'],['B'],None,['Creature'],['Rat'],Common,JMP,1,1,None,"When Drainpipe Vermin dies, you may pay {B}. If you do, target player discards a card."
Douse in Gloom,3.0,['Black'],['B'],None,['Instant'],None,Common,JMP,None,None,None,Douse in Gloom deals 2 damage to target creature and you gain 2 life.
Death's Approach,1.0,['Black'],['B'],None,['Enchantment'],['Aura'],Common,JMP,None,None,None,"Enchant creature\nEnchanted creature gets -X/-X, where X is the number of creature cards in its controller's graveyard."
Crow of Dark Tidings,3.0,['Black'],['B'],None,['Creature'],"['Zombie', 'Bird']",Common,JMP,2,1,None,"Flying\nWhen Crow of Dark Tidings enters the battlefield or dies, mill two cards. (Put the top two cards of your library into your graveyard.)"
Corpse Traders,4.0,['Black'],['B'],None,['Creature'],"['Human', 'Rogue']",Uncommon,JMP,3,3,None,"{2}{B}, Sacrifice a creature: Target opponent reveals their hand. You choose a card from it. That player discards that card. Activate only as a sorcery."
Corpse Hauler,2.0,['Black'],['B'],None,['Creature'],"['Human', 'Rogue']",Common,JMP,2,1,None,"{2}{B}, Sacrifice Corpse Hauler: Return another target creature card from your graveyard to your hand."
Child of Night,2.0,['Black'],['B'],None,['Creature'],['Vampire'],Common,JMP,2,1,None,Lifelink
Erratic Visionary,2.0,['Blue'],['U'],None,['Creature'],"['Human', 'Wizard']",Common,JMP,1,3,None,"{1}{U}, {T}: Draw a card, then discard a card."
Cemetery Recruitment,2.0,['Black'],['B'],None,['Sorcery'],None,Common,JMP,None,None,None,"Return target creature card from your graveyard to your hand. If it's a Zombie card, draw a card."
Barter in Blood,4.0,['Black'],['B'],None,['Sorcery'],None,Uncommon,JMP,None,None,None,Each player sacrifices two creatures.
Bone Splinters,1.0,['Black'],['B'],None,['Sorcery'],None,Common,JMP,None,None,None,"As an additional cost to cast this spell, sacrifice a creature.\nDestroy target creature."
Cadaver Imp,3.0,['Black'],['B'],None,['Creature'],['Imp'],Common,JMP,1,1,None,"Flying\nWhen Cadaver Imp enters the battlefield, you may return target creature card from your graveyard to your hand."
Cauldron Familiar,1.0,['Black'],['B'],None,['Creature'],['Cat'],Common,JMP,1,1,None,"When Cauldron Familiar enters the battlefield, each opponent loses 1 life and you gain 1 life.\nSacrifice a Food: Return Cauldron Familiar from your graveyard to the battlefield."
Burglar Rat,2.0,['Black'],['B'],None,['Creature'],['Rat'],Common,JMP,1,1,None,"When Burglar Rat enters the battlefield, each opponent discards a card."
Bone Picker,4.0,['Black'],['B'],None,['Creature'],['Bird'],Uncommon,JMP,3,2,None,"This spell costs {3} less to cast if a creature died this turn.\nFlying, deathtouch"
Bogbrew Witch,4.0,['Black'],['B'],None,['Creature'],"['Human', 'Wizard']",Rare,JMP,1,3,None,"{2}, {T}: Search your library for a card named Festering Newt or Bubbling Cauldron, put it onto the battlefield tapped, then shuffle."
Bloodhunter Bat,4.0,['Black'],['B'],None,['Creature'],['Bat'],Common,JMP,2,2,None,"Flying\nWhen Bloodhunter Bat enters the battlefield, target player loses 2 life and you gain 2 life."
Blood Divination,4.0,['Black'],['B'],None,['Sorcery'],None,Uncommon,JMP,None,None,None,"As an additional cost to cast this spell, sacrifice a creature.\nDraw three cards."
Bloodbond Vampire,4.0,['Black'],['B'],None,['Creature'],"['Vampire', 'Shaman', 'Ally']",Uncommon,JMP,3,3,None,"Whenever you gain life, put a +1/+1 counter on Bloodbond Vampire."
Blood Host,5.0,['Black'],['B'],None,['Creature'],['Vampire'],Uncommon,JMP,3,3,None,"{1}{B}, Sacrifice another creature: Put a +1/+1 counter on Blood Host and you gain 2 life."
Departed Deckhand,2.0,['Blue'],['U'],None,['Creature'],"['Spirit', 'Pirate']",Uncommon,JMP,2,2,None,"When Departed Deckhand becomes the target of a spell, sacrifice it.\nDeparted Deckhand can't be blocked except by Spirits.\n{3}{U}: Another target creature you control can't be blocked this turn except by Spirits."
Black Cat,2.0,['Black'],['B'],None,['Creature'],"['Zombie', 'Cat']",Common,JMP,1,1,None,"When Black Cat dies, target opponent discards a card at random."
Curious Obsession,1.0,['Blue'],['U'],None,['Enchantment'],['Aura'],Uncommon,JMP,None,None,None,"Enchant creature\nEnchanted creature gets +1/+1 and has ""Whenever this creature deals combat damage to a player, you may draw a card.""\nAt the beginning of your end step, if you didn't attack with a creature this turn, sacrifice Curious Obsession."
Bake into a Pie,4.0,['Black'],['B'],None,['Instant'],None,Common,JMP,None,None,None,"Destroy target creature. Create a Food token. (It's an artifact with ""{2}, {T}, Sacrifice this artifact: You gain 3 life."")"
Curiosity,1.0,['Blue'],['U'],None,['Enchantment'],['Aura'],Uncommon,JMP,None,None,None,"Enchant creature\nWhenever enchanted creature deals damage to an opponent, you may draw a card."
Blood Artist,2.0,['Black'],['B'],None,['Creature'],['Vampire'],Uncommon,JMP,0,1,None,"Whenever Blood Artist or another creature dies, target player loses 1 life and you gain 1 life."
Cryptic Serpent,7.0,['Blue'],['U'],None,['Creature'],['Serpent'],Uncommon,JMP,6,5,None,This spell costs {1} less to cast for each instant and sorcery card in your graveyard.
Blighted Bat,3.0,['Black'],['B'],None,['Creature'],"['Zombie', 'Bat']",Common,JMP,2,1,None,Flying\n{1}: Blighted Bat gains haste until end of turn.
Black Market,5.0,['Black'],['B'],None,['Enchantment'],None,Rare,JMP,None,None,None,"Whenever a creature dies, put a charge counter on Black Market.\nAt the beginning of your precombat main phase, add {B} for each charge counter on Black Market."
Assassin's Strike,6.0,['Black'],['B'],None,['Sorcery'],None,Uncommon,JMP,None,None,None,Destroy target creature. Its controller discards a card.
Crookclaw Transmuter,4.0,['Blue'],['U'],None,['Creature'],"['Bird', 'Wizard']",Common,JMP,3,1,None,"Flash\nFlying\nWhen Crookclaw Transmuter enters the battlefield, switch target creature's power and toughness until end of turn."
Agonizing Syphon,4.0,['Black'],['B'],None,['Sorcery'],None,Common,JMP,None,None,None,Agonizing Syphon deals 3 damage to any target and you gain 3 life.
Wizard's Retort,3.0,['Blue'],['U'],None,['Instant'],None,Uncommon,JMP,None,None,None,This spell costs {1} less to cast if you control a Wizard.\nCounter target spell.
Wishful Merfolk,2.0,['Blue'],['U'],None,['Creature'],['Merfolk'],Common,JMP,3,2,None,Defender\n{1}{U}: Wishful Merfolk loses defender and becomes a Human until end of turn.
Winged Words,3.0,['Blue'],['U'],None,['Sorcery'],None,Common,JMP,None,None,None,This spell costs {1} less to cast if you control a creature with flying.\nDraw two cards.
Windstorm Drake,5.0,['Blue'],['U'],None,['Creature'],['Drake'],Uncommon,JMP,3,3,None,Flying\nOther creatures you control with flying get +1/+0.
Windreader Sphinx,7.0,['Blue'],['U'],None,['Creature'],['Sphinx'],Rare,JMP,3,7,None,"Flying\nWhenever a creature with flying attacks, you may draw a card."
Coastal Piracy,4.0,['Blue'],['U'],None,['Enchantment'],None,Uncommon,JMP,None,None,None,"Whenever a creature you control deals combat damage to an opponent, you may draw a card."
Whelming Wave,4.0,['Blue'],['U'],None,['Sorcery'],None,Rare,JMP,None,None,None,"Return all creatures to their owners' hands except for Krakens, Leviathans, Octopuses, and Serpents."
Cloudreader Sphinx,5.0,['Blue'],['U'],None,['Creature'],['Sphinx'],Common,JMP,3,4,None,"Flying\nWhen Cloudreader Sphinx enters the battlefield, scry 2. (Look at the top two cards of your library, then put any number of them on the bottom of your library and the rest on top in any order.)"
Waterknot,3.0,['Blue'],['U'],None,['Enchantment'],['Aura'],Common,JMP,None,None,None,"Enchant creature\nWhen Waterknot enters the battlefield, tap enchanted creature.\nEnchanted creature doesn't untap during its controller's untap step."
Warden of Evos Isle,3.0,['Blue'],['U'],None,['Creature'],"['Bird', 'Wizard']",Uncommon,JMP,2,2,None,Flying\nCreature spells with flying you cast cost {1} less to cast.
Chart a Course,2.0,['Blue'],['U'],None,['Sorcery'],None,Uncommon,JMP,None,None,None,Draw two cards. Then discard a card unless you attacked this turn.
Wall of Lost Thoughts,2.0,['Blue'],['U'],None,['Creature'],['Wall'],Uncommon,JMP,0,4,None,"Defender\nWhen Wall of Lost Thoughts enters the battlefield, target player mills four cards."
Voyage's End,2.0,['Blue'],['U'],None,['Instant'],None,Common,JMP,None,None,None,Return target creature to its owner's hand. Scry 1. (Look at the top card of your library. You may put that card on the bottom of your library.)
Vedalken Entrancer,4.0,['Blue'],['U'],None,['Creature'],"['Vedalken', 'Wizard']",Common,JMP,1,4,None,"{U}, {T}: Target player mills two cards."
Vedalken Archmage,4.0,['Blue'],['U'],None,['Creature'],"['Vedalken', 'Wizard']",Rare,JMP,0,2,None,"Whenever you cast an artifact spell, draw a card."
Towering-Wave Mystic,2.0,['Blue'],['U'],None,['Creature'],"['Merfolk', 'Wizard']",Common,JMP,2,1,None,"Whenever Towering-Wave Mystic deals damage, target player mills that many cards."
Thought Scour,1.0,['Blue'],['U'],None,['Instant'],None,Common,JMP,None,None,None,Target player mills two cards.\nDraw a card.
Thought Collapse,3.0,['Blue'],['U'],None,['Instant'],None,Common,JMP,None,None,None,Counter target spell. Its controller mills three cards.
Thirst for Knowledge,3.0,['Blue'],['U'],None,['Instant'],None,Uncommon,JMP,None,None,None,Draw three cards. Then discard two cards unless you discard an artifact card.
Belltower Sphinx,5.0,['Blue'],['U'],None,['Creature'],['Sphinx'],Uncommon,JMP,2,5,None,"Flying\nWhenever a source deals damage to Belltower Sphinx, that source's controller mills that many cards."
Talrand's Invocation,4.0,['Blue'],['U'],None,['Sorcery'],None,Uncommon,JMP,None,None,None,Create two 2/2 blue Drake creature tokens with flying.
"Talrand, Sky Summoner",4.0,['Blue'],['U'],['Legendary'],['Creature'],"['Merfolk', 'Wizard']",Rare,JMP,2,2,None,"Whenever you cast an instant or sorcery spell, create a 2/2 blue Drake creature token with flying."
Sweep Away,3.0,['Blue'],['U'],None,['Instant'],None,Common,JMP,None,None,None,"Return target creature to its owner's hand. If that creature is attacking, you may put it on top of its owner's library instead."
Storm Sculptor,4.0,['Blue'],['U'],None,['Creature'],"['Merfolk', 'Wizard']",Common,JMP,3,2,None,"Storm Sculptor can't be blocked.\nWhen Storm Sculptor enters the battlefield, return a creature you control to its owner's hand."
Spectral Sailor,1.0,['Blue'],['U'],None,['Creature'],"['Spirit', 'Pirate']",Uncommon,JMP,1,1,None,Flash (You may cast this spell any time you could cast an instant.)\nFlying\n{3}{U}: Draw a card.
Sigiled Starfish,2.0,['Blue'],['U'],None,['Creature'],['Starfish'],Uncommon,JMP,0,3,None,{T}: Scry 1. (Look at the top card of your library. You may put that card on the bottom of your library.)
Sharding Sphinx,6.0,['Blue'],['U'],None,"['Artifact', 'Creature']",['Sphinx'],Rare,JMP,4,4,None,"Flying\nWhenever an artifact creature you control deals combat damage to a player, you may create a 1/1 blue Thopter artifact creature token with flying."
Serendib Efreet,3.0,['Blue'],['U'],None,['Creature'],['Efreet'],Rare,JMP,3,4,None,"Flying\nAt the beginning of your upkeep, Serendib Efreet deals 1 damage to you."
Selhoff Occultist,3.0,['Blue'],['U'],None,['Creature'],"['Human', 'Rogue']",Common,JMP,2,3,None,"Whenever Selhoff Occultist or another creature dies, target player mills a card."
Sea Gate Oracle,3.0,['Blue'],['U'],None,['Creature'],"['Human', 'Wizard']",Common,JMP,1,3,None,"When Sea Gate Oracle enters the battlefield, look at the top two cards of your library. Put one of them into your hand and the other on the bottom of your library."
Sailor of Means,3.0,['Blue'],['U'],None,['Creature'],"['Human', 'Pirate']",Common,JMP,1,4,None,"When Sailor of Means enters the battlefield, create a Treasure token. (It's an artifact with ""{T}, Sacrifice this artifact: Add one mana of any color."")"
Sage's Row Savant,2.0,['Blue'],['U'],None,['Creature'],"['Vedalken', 'Wizard']",Common,JMP,2,1,None,"When Sage's Row Savant enters the battlefield, scry 2."
Rishadan Airship,3.0,['Blue'],['U'],None,['Creature'],"['Human', 'Pirate']",Common,JMP,3,1,None,Flying\nRishadan Airship can block only creatures with flying.
Rhystic Study,3.0,['Blue'],['U'],None,['Enchantment'],None,Rare,JMP,None,None,None,"Whenever an opponent casts a spell, you may draw a card unless that player pays {1}."
Befuddle,3.0,['Blue'],['U'],None,['Instant'],None,Common,JMP,None,None,None,Target creature gets -4/-0 until end of turn.\nDraw a card.
Fertilid,3.0,['Green'],['G'],None,['Creature'],['Elemental'],Common,JMP,0,0,None,"Fertilid enters the battlefield with two +1/+1 counters on it.\n{1}{G}, Remove a +1/+1 counter from Fertilid: Target player searches their library for a basic land card, puts it onto the battlefield tapped, then shuffles."
Battleground Geist,5.0,['Blue'],['U'],None,['Creature'],['Spirit'],Uncommon,JMP,3,3,None,Flying\nOther Spirit creatures you control get +1/+0.
"Ghalta, Primal Hunger",12.0,['Green'],['G'],['Legendary'],['Creature'],"['Elder', 'Dinosaur']",Rare,JMP,12,12,None,"This spell costs {X} less to cast, where X is the total power of creatures you control.\nTrample"
Aegis Turtle,1.0,['Blue'],['U'],None,['Creature'],['Turtle'],Common,JMP,0,5,None,None
Feral Hydra,1.0,['Green'],['G'],None,['Creature'],"['Hydra', 'Beast']",Uncommon,JMP,0,0,None,Feral Hydra enters the battlefield with X +1/+1 counters on it.\n{3}: Put a +1/+1 counter on Feral Hydra. Any player may activate this ability.
Voice of the Provinces,6.0,['White'],['W'],None,['Creature'],['Angel'],Common,JMP,3,3,None,"Flying\nWhen Voice of the Provinces enters the battlefield, create a 1/1 white Human creature token."
Fa'adiyah Seer,2.0,['Green'],['G'],None,['Creature'],"['Human', 'Shaman']",Common,JMP,1,1,None,"{T}: Draw a card and reveal it. If it isn't a land card, discard it."
Valorous Stance,2.0,['White'],['W'],None,['Instant'],None,Uncommon,JMP,None,None,None,"Choose one —\n• Target creature gains indestructible until end of turn. (Damage and effects that say ""destroy"" don't destroy it.)\n• Destroy target creature with toughness 4 or greater."
Explore,2.0,['Green'],['G'],None,['Sorcery'],None,Common,JMP,None,None,None,You may play an additional land this turn.\nDraw a card.
Tandem Tactics,2.0,['White'],['W'],None,['Instant'],None,Common,JMP,None,None,None,Up to two target creatures each get +1/+2 until end of turn. You gain 2 life.
Enlarge,5.0,['Green'],['G'],None,['Sorcery'],None,Uncommon,JMP,None,None,None,Target creature gets +7/+7 and gains trample until end of turn. It must be blocked this turn if able. (A creature with trample can deal excess combat damage to the player or planeswalker it's attacking.)
Take Heart,1.0,['White'],['W'],None,['Instant'],None,Common,JMP,None,None,None,Target creature gets +2/+2 until end of turn. You gain 1 life for each attacking creature you control.
Elvish Archdruid,3.0,['Green'],['G'],None,['Creature'],"['Elf', 'Druid']",Rare,JMP,2,2,None,Other Elf creatures you control get +1/+1.\n{T}: Add {G} for each Elf you control.
Sky Tether,1.0,['White'],['W'],None,['Enchantment'],['Aura'],Uncommon,JMP,None,None,None,Enchant creature\nEnchanted creature has defender and loses flying.
Elemental Uprising,2.0,['Green'],['G'],None,['Instant'],None,Common,JMP,None,None,None,Target land you control becomes a 4/4 Elemental creature with haste until end of turn. It's still a land. It must be blocked this turn if able.
Serra Angel,5.0,['White'],['W'],None,['Creature'],['Angel'],Uncommon,JMP,4,4,None,"Flying, vigilance"
Dwynen's Elite,2.0,['Green'],['G'],None,['Creature'],"['Elf', 'Warrior']",Uncommon,JMP,2,2,None,"When Dwynen's Elite enters the battlefield, if you control another Elf, create a 1/1 green Elf Warrior creature token."
Swamp,0.0,None,['B'],['Basic'],['Land'],['Swamp'],Common,JMP,None,None,None,({T}: Add {B}.)
Drover of the Mighty,2.0,['Green'],['G'],None,['Creature'],"['Human', 'Druid']",Uncommon,JMP,1,1,None,Drover of the Mighty gets +2/+2 as long as you control a Dinosaur.\n{T}: Add one mana of any color.
Ronom Unicorn,2.0,['White'],['W'],None,['Creature'],['Unicorn'],Common,JMP,2,2,None,Sacrifice Ronom Unicorn: Destroy target enchantment.
Dawntreader Elk,2.0,['Green'],['G'],None,['Creature'],['Elk'],Common,JMP,2,2,None,"{G}, Sacrifice Dawntreader Elk: Search your library for a basic land card, put it onto the battlefield tapped, then shuffle."
Rhox Faithmender,4.0,['White'],['W'],None,['Creature'],"['Rhino', 'Monk']",Rare,JMP,1,5,None,"Lifelink (Damage dealt by this creature also causes you to gain that much life.)\nIf you would gain life, you gain twice that much life instead."
Crushing Canopy,3.0,['Green'],['G'],None,['Instant'],None,Common,JMP,None,None,None,Choose one —\n• Destroy target creature with flying.\n• Destroy target enchantment.
Raise the Alarm,2.0,['White'],['W'],None,['Instant'],None,Common,JMP,None,None,None,Create two 1/1 white Soldier creature tokens.
Craterhoof Behemoth,8.0,['Green'],['G'],None,['Creature'],['Beast'],Mythic,JMP,5,5,None,"Haste\nWhen Craterhoof Behemoth enters the battlefield, creatures you control gain trample and get +X/+X until end of turn, where X is the number of creatures you control."
Patron of the Valiant,5.0,['White'],['W'],None,['Creature'],['Angel'],Uncommon,JMP,4,4,None,"Flying\nWhen Patron of the Valiant enters the battlefield, put a +1/+1 counter on each creature you control with a +1/+1 counter on it."
Commune with Dinosaurs,1.0,['Green'],['G'],None,['Sorcery'],None,Common,JMP,None,None,None,Look at the top five cards of your library. You may reveal a Dinosaur or land card from among them and put it into your hand. Put the rest on the bottom of your library in any order.
Path to Exile,1.0,['White'],['W'],None,['Instant'],None,Uncommon,JMP,None,None,None,"Exile target creature. Its controller may search their library for a basic land card, put that card onto the battlefield tapped, then shuffle."
Champion of Lambholt,3.0,['Green'],['G'],None,['Creature'],"['Human', 'Warrior']",Rare,JMP,1,1,None,"Creatures with power less than Champion of Lambholt's power can't block creatures you control.\nWhenever another creature enters the battlefield under your control, put a +1/+1 counter on Champion of Lambholt."
Path of Bravery,3.0,['White'],['W'],None,['Enchantment'],None,Rare,JMP,None,None,None,"As long as your life total is greater than or equal to your starting life total, creatures you control get +1/+1.\nWhenever one or more creatures you control attack, you gain life equal to the number of attacking creatures."
Carven Caryatid,3.0,['Green'],['G'],None,['Creature'],['Spirit'],Uncommon,JMP,2,5,None,"Defender (This creature can't attack.)\nWhen Carven Caryatid enters the battlefield, draw a card."
Pacifism,2.0,['White'],['W'],None,['Enchantment'],['Aura'],Common,JMP,None,None,None,Enchant creature\nEnchanted creature can't attack or block.
Brushstrider,2.0,['Green'],['G'],None,['Creature'],['Beast'],Uncommon,JMP,3,1,None,Vigilance
Moment of Heroism,2.0,['White'],['W'],None,['Instant'],None,Common,JMP,None,None,None,Target creature gets +2/+2 and gains lifelink until end of turn. (Damage dealt by the creature also causes its controller to gain that much life.)
