Name,CMC,Colors,Color identity,Supertypes,Types,Subtypes,Rarity,Set,Power,Toughness,Loyalty,Text
Swarm of Bloodflies,5.0,['Black'],['B'],None,['Creature'],['Insect'],Uncommon,JMP,0,0,None,"Flying\nSwarm of Bloodflies enters the battlefield with two +1/+1 counters on it.\nWhenever another creature dies, put a +1/+1 counter on Swarm of Bloodflies."
Stab Wound,3.0,['Black'],['B'],None,['Enchantment'],['Aura'],Uncommon,JMP,None,None,None,"Enchant creature\nEnchanted creature gets -2/-2.\nAt the beginning of the upkeep of enchanted creature's controller, that player loses 2 life."
Soul Salvage,3.0,['Black'],['B'],None,['Sorcery'],None,Common,JMP,None,None,None,Return up to two target creature cards from your graveyard to your hand.
Slate Street Ruffian,3.0,['Black'],['B'],None,['Creature'],"['Human', 'Warrior']",Common,JMP,2,2,None,"Whenever Slate Street Ruffian becomes blocked, defending player discards a card."
"Sheoldred, Whispering One",7.0,['Black'],['B'],['Legendary'],['Creature'],"['Phyrexian', 'Praetor']",Mythic,JMP,6,6,None,"Swampwalk (This creature can't be blocked as long as defending player controls a Swamp.)\nAt the beginning of your upkeep, return target creature card from your graveyard to the battlefield.\nAt the beginning of each opponent's upkeep, that player sacrifices a creature."
Shambling Goblin,1.0,['Black'],['B'],None,['Creature'],"['Zombie', 'Goblin']",Common,JMP,1,1,None,"When Shambling Goblin dies, target creature an opponent controls gets -1/-1 until end of turn."
Settle the Score,4.0,['Black'],['B'],None,['Sorcery'],None,Uncommon,JMP,None,None,None,Exile target creature. Put two loyalty counters on a planeswalker you control.
Sengir Vampire,5.0,['Black'],['B'],None,['Creature'],['Vampire'],Uncommon,JMP,4,4,None,"Flying (This creature can't be blocked except by creatures with flying or reach.)\nWhenever a creature dealt damage by Sengir Vampire this turn dies, put a +1/+1 counter on Sengir Vampire."
Scourge of Nel Toth,7.0,['Black'],['B'],None,['Creature'],"['Zombie', 'Dragon']",Rare,JMP,6,6,None,Flying\nYou may cast Scourge of Nel Toth from your graveyard by paying {B}{B} and sacrificing two creatures rather than paying its mana cost.
Sanitarium Skeleton,1.0,['Black'],['B'],None,['Creature'],['Skeleton'],Common,JMP,1,2,None,{2}{B}: Return Sanitarium Skeleton from your graveyard to your hand.
Sangromancer,4.0,['Black'],['B'],None,['Creature'],"['Vampire', 'Shaman']",Rare,JMP,3,3,None,"Flying\nWhenever a creature an opponent controls dies, you may gain 3 life.\nWhenever an opponent discards a card, you may gain 3 life."
Rise of the Dark Realms,9.0,['Black'],['B'],None,['Sorcery'],None,Mythic,JMP,None,None,None,Put all creature cards from all graveyards onto the battlefield under your control.
Reanimate,1.0,['Black'],['B'],None,['Sorcery'],None,Rare,JMP,None,None,None,Put target creature card from a graveyard onto the battlefield under your control. You lose life equal to its mana value.
Ravenous Chupacabra,4.0,['Black'],['B'],None,['Creature'],"['Beast', 'Horror']",Uncommon,JMP,2,2,None,"When Ravenous Chupacabra enters the battlefield, destroy target creature an opponent controls."
Plagued Rusalka,1.0,['Black'],['B'],None,['Creature'],['Spirit'],Common,JMP,1,1,None,"{B}, Sacrifice a creature: Target creature gets -1/-1 until end of turn."
Phyrexian Reclamation,1.0,['Black'],['B'],None,['Enchantment'],None,Uncommon,JMP,None,None,None,"{1}{B}, Pay 2 life: Return target creature card from your graveyard to your hand."
Phyrexian Rager,3.0,['Black'],['B'],None,['Creature'],"['Phyrexian', 'Horror']",Common,JMP,2,2,None,"When Phyrexian Rager enters the battlefield, you draw a card and you lose 1 life."
Phyrexian Gargantua,6.0,['Black'],['B'],None,['Creature'],"['Phyrexian', 'Horror']",Uncommon,JMP,4,4,None,"When Phyrexian Gargantua enters the battlefield, you draw two cards and you lose 2 life."
Phyrexian Debaser,4.0,['Black'],['B'],None,['Creature'],"['Phyrexian', 'Carrier']",Common,JMP,2,2,None,"Flying\n{T}, Sacrifice Phyrexian Debaser: Target creature gets -2/-2 until end of turn."
Phyrexian Broodlings,3.0,['Black'],['B'],None,['Creature'],"['Phyrexian', 'Minion']",Common,JMP,2,2,None,"{1}, Sacrifice a creature: Put a +1/+1 counter on Phyrexian Broodlings."
Parasitic Implant,4.0,['Black'],['B'],None,['Enchantment'],['Aura'],Common,JMP,None,None,None,"Enchant creature\nAt the beginning of your upkeep, enchanted creature's controller sacrifices it and you create a 1/1 colorless Phyrexian Myr artifact creature token."
Oona's Blackguard,2.0,['Black'],['B'],None,['Creature'],"['Faerie', 'Rogue']",Uncommon,JMP,1,1,None,"Flying\nEach other Rogue creature you control enters the battlefield with an additional +1/+1 counter on it.\nWhenever a creature you control with a +1/+1 counter on it deals combat damage to a player, that player discards a card."
Ogre Slumlord,5.0,['Black'],['B'],None,['Creature'],"['Ogre', 'Rogue']",Rare,JMP,3,3,None,"Whenever another nontoken creature dies, you may create a 1/1 black Rat creature token.\nRats you control have deathtouch."
Nyxathid,3.0,['Black'],['B'],None,['Creature'],['Elemental'],Rare,JMP,7,7,None,"As Nyxathid enters the battlefield, choose an opponent.\nNyxathid gets -1/-1 for each card in the chosen player's hand."
Nightshade Stinger,1.0,['Black'],['B'],None,['Creature'],"['Faerie', 'Rogue']",Common,JMP,1,1,None,Flying\nNightshade Stinger can't block.
Mire Triton,2.0,['Black'],['B'],None,['Creature'],"['Zombie', 'Merfolk']",Uncommon,JMP,2,1,None,"Deathtouch\nWhen Mire Triton enters the battlefield, mill two cards and you gain 2 life."
Miasmic Mummy,2.0,['Black'],['B'],None,['Creature'],"['Zombie', 'Jackal']",Common,JMP,2,2,None,"When Miasmic Mummy enters the battlefield, each player discards a card."
Mausoleum Turnkey,4.0,['Black'],['B'],None,['Creature'],"['Ogre', 'Rogue']",Uncommon,JMP,3,2,None,"When Mausoleum Turnkey enters the battlefield, return target creature card of an opponent's choice from your graveyard to your hand."
Mark of the Vampire,4.0,['Black'],['B'],None,['Enchantment'],['Aura'],Common,JMP,None,None,None,Enchant creature\nEnchanted creature gets +2/+2 and has lifelink.
Malakir Familiar,3.0,['Black'],['B'],None,['Creature'],['Bat'],Uncommon,JMP,2,1,None,"Flying, deathtouch\nWhenever you gain life, Malakir Familiar gets +1/+1 until end of turn."
Macabre Waltz,2.0,['Black'],['B'],None,['Sorcery'],None,Common,JMP,None,None,None,"Return up to two target creature cards from your graveyard to your hand, then discard a card."
Liliana's Reaver,4.0,['Black'],['B'],None,['Creature'],['Zombie'],Rare,JMP,4,3,None,"Deathtouch\nWhenever Liliana's Reaver deals combat damage to a player, that player discards a card and you create a tapped 2/2 black Zombie creature token."
Liliana's Elite,3.0,['Black'],['B'],None,['Creature'],['Zombie'],Uncommon,JMP,1,1,None,Liliana's Elite gets +1/+1 for each creature card in your graveyard.
Lawless Broker,3.0,['Black'],['B'],None,['Creature'],"['Aetherborn', 'Rogue']",Common,JMP,3,2,None,"When Lawless Broker dies, put a +1/+1 counter on target creature you control."
Launch Party,4.0,['Black'],['B'],None,['Instant'],None,Common,JMP,None,None,None,"As an additional cost to cast this spell, sacrifice a creature.\nDestroy target creature. Its controller loses 2 life."
Last Gasp,2.0,['Black'],['B'],None,['Instant'],None,Common,JMP,None,None,None,Target creature gets -3/-3 until end of turn.
Myr Sire,2.0,None,None,None,"['Artifact', 'Creature']","['Phyrexian', 'Myr']",Common,JMP,1,1,None,"When Myr Sire dies, create a 1/1 colorless Phyrexian Myr artifact creature token."
Meteor Golem,7.0,None,None,None,"['Artifact', 'Creature']",['Golem'],Uncommon,JMP,3,3,None,"When Meteor Golem enters the battlefield, destroy target nonland permanent an opponent controls."
Marauder's Axe,2.0,None,None,None,['Artifact'],['Equipment'],Common,JMP,None,None,None,Equipped creature gets +2/+0.\nEquip {2} ({2}: Attach to target creature you control. Equip only as a sorcery.)
Mana Geode,3.0,None,None,None,['Artifact'],None,Common,JMP,None,None,None,"When Mana Geode enters the battlefield, scry 1.\n{T}: Add one mana of any color."
Juggernaut,4.0,None,None,None,"['Artifact', 'Creature']",['Juggernaut'],Uncommon,JMP,5,3,None,Juggernaut attacks each combat if able.\nJuggernaut can't be blocked by Walls.
Jousting Dummy,2.0,None,None,None,"['Artifact', 'Creature']","['Scarecrow', 'Knight']",Common,JMP,2,1,None,{3}: Jousting Dummy gets +1/+0 until end of turn.
Herald's Horn,3.0,None,None,None,['Artifact'],None,Uncommon,JMP,None,None,None,"As Herald's Horn enters the battlefield, choose a creature type.\nCreature spells you cast of the chosen type cost {1} less to cast.\nAt the beginning of your upkeep, look at the top card of your library. If it's a creature card of the chosen type, you may reveal it and put it into your hand."
Hedron Archive,4.0,None,None,None,['Artifact'],None,Uncommon,JMP,None,None,None,"{T}: Add {C}{C}.\n{2}, {T}, Sacrifice Hedron Archive: Draw two cards."
Guardian Idol,2.0,None,None,None,['Artifact'],None,Uncommon,JMP,None,None,None,Guardian Idol enters the battlefield tapped.\n{T}: Add {C}.\n{2}: Guardian Idol becomes a 2/2 Golem artifact creature until end of turn.
Gingerbrute,1.0,None,None,None,"['Artifact', 'Creature']","['Food', 'Golem']",Common,JMP,1,1,None,"Haste\n{1}: Gingerbrute can't be blocked this turn except by creatures with haste.\n{2}, {T}, Sacrifice Gingerbrute: You gain 3 life."
Gargoyle Sentinel,3.0,None,None,None,"['Artifact', 'Creature']",['Gargoyle'],Uncommon,JMP,3,3,None,"Defender (This creature can't attack.)\n{3}: Until end of turn, Gargoyle Sentinel loses defender and gains flying."
Dreamstone Hedron,6.0,None,None,None,['Artifact'],None,Uncommon,JMP,None,None,None,"{T}: Add {C}{C}{C}.\n{3}, {T}, Sacrifice Dreamstone Hedron: Draw three cards."
Dragonloft Idol,4.0,None,None,None,"['Artifact', 'Creature']",['Gargoyle'],Uncommon,JMP,3,3,None,"As long as you control a Dragon, Dragonloft Idol gets +1/+1 and has flying and trample."
Chromatic Sphere,1.0,None,None,None,['Artifact'],None,Common,JMP,None,None,None,"{1}, {T}, Sacrifice Chromatic Sphere: Add one mana of any color. Draw a card."
Chamber Sentry,0.0,None,"['B', 'G', 'R', 'U', 'W']",None,"['Artifact', 'Creature']",['Construct'],Rare,JMP,0,0,None,"Chamber Sentry enters the battlefield with a +1/+1 counter on it for each color of mana spent to cast it.\n{X}, {T}, Remove X +1/+1 counters from Chamber Sentry: It deals X damage to any target.\n{W}{U}{B}{R}{G}: Return Chamber Sentry from your graveyard to your hand."
Bubbling Cauldron,2.0,None,None,None,['Artifact'],None,Uncommon,JMP,None,None,None,"{1}, {T}, Sacrifice a creature: You gain 4 life.\n{1}, {T}, Sacrifice a creature named Festering Newt: Each opponent loses 4 life. You gain life equal to the life lost this way."
Arcane Encyclopedia,3.0,None,None,None,['Artifact'],None,Uncommon,JMP,None,None,None,"{3}, {T}: Draw a card."
Ancestral Statue,4.0,None,None,None,"['Artifact', 'Creature']",['Golem'],Common,JMP,3,4,None,"When Ancestral Statue enters the battlefield, return a nonland permanent you control to its owner's hand."
Alloy Myr,3.0,None,None,None,"['Artifact', 'Creature']",['Myr'],Common,JMP,2,2,None,{T}: Add one mana of any color.
Aether Spellbomb,1.0,None,['U'],None,['Artifact'],None,Common,JMP,None,None,None,"{U}, Sacrifice Aether Spellbomb: Return target creature to its owner's hand.\n{1}, Sacrifice Aether Spellbomb: Draw a card."
Raging Regisaur,4.0,"['Green', 'Red']","['G', 'R']",None,['Creature'],['Dinosaur'],Uncommon,JMP,4,4,None,"Whenever Raging Regisaur attacks, it deals 1 damage to any target."
Maelstrom Archangel,5.0,"['Black', 'Green', 'Red', 'Blue', 'White']","['B', 'G', 'R', 'U', 'W']",None,['Creature'],['Angel'],Mythic,JMP,5,5,None,"Flying\nWhenever Maelstrom Archangel deals combat damage to a player, you may cast a spell from your hand without paying its mana cost."
Lawmage's Binding,3.0,"['Blue', 'White']","['U', 'W']",None,['Enchantment'],['Aura'],Common,JMP,None,None,None,"Flash\nEnchant creature\nEnchanted creature can't attack or block, and its activated abilities can't be activated."
Ironroot Warlord,3.0,"['Green', 'White']","['G', 'W']",None,['Creature'],"['Treefolk', 'Soldier']",Uncommon,JMP,*,5,None,Ironroot Warlord's power is equal to the number of creatures you control.\n{3}{G}{W}: Create a 1/1 white Soldier creature token.
Fusion Elemental,5.0,"['Black', 'Green', 'Red', 'Blue', 'White']","['B', 'G', 'R', 'U', 'W']",None,['Creature'],['Elemental'],Uncommon,JMP,8,8,None,None
Dinrova Horror,6.0,"['Black', 'Blue']","['B', 'U']",None,['Creature'],['Horror'],Uncommon,JMP,4,4,None,"When Dinrova Horror enters the battlefield, return target permanent to its owner's hand, then that player discards a card."
Auger Spree,3.0,"['Black', 'Red']","['B', 'R']",None,['Instant'],None,Common,JMP,None,None,None,Target creature gets +4/-4 until end of turn.
Zendikar's Roil,5.0,['Green'],['G'],None,['Enchantment'],None,Uncommon,JMP,None,None,None,"Landfall — Whenever a land enters the battlefield under your control, create a 2/2 green Elemental creature token."
Wren's Run Vanquisher,2.0,['Green'],['G'],None,['Creature'],"['Elf', 'Warrior']",Uncommon,JMP,3,3,None,"As an additional cost to cast this spell, reveal an Elf card from your hand or pay {3}.\nDeathtouch (Any amount of damage this deals to a creature is enough to destroy it.)"
Woodborn Behemoth,5.0,['Green'],['G'],None,['Creature'],['Elemental'],Uncommon,JMP,4,4,None,"As long as you control eight or more lands, Woodborn Behemoth gets +4/+4 and has trample. (It can deal excess combat damage to the player or planeswalker it's attacking.)"
Wildsize,3.0,['Green'],['G'],None,['Instant'],None,Common,JMP,None,None,None,Target creature gets +2/+2 and gains trample until end of turn.\nDraw a card.
Wildheart Invoker,4.0,['Green'],['G'],None,['Creature'],"['Elf', 'Shaman']",Common,JMP,4,3,None,{8}: Target creature gets +5/+5 and gains trample until end of turn.
Wall of Vines,1.0,['Green'],['G'],None,['Creature'],"['Plant', 'Wall']",Common,JMP,0,3,None,Defender (This creature can't attack.)\nReach (This creature can block creatures with flying.)
Wall of Blossoms,2.0,['Green'],['G'],None,['Creature'],"['Plant', 'Wall']",Uncommon,JMP,0,4,None,"Defender\nWhen Wall of Blossoms enters the battlefield, draw a card."
Verdant Embrace,5.0,['Green'],['G'],None,['Enchantment'],['Aura'],Rare,JMP,None,None,None,"Enchant creature\nEnchanted creature gets +3/+3 and has ""At the beginning of each upkeep, create a 1/1 green Saproling creature token."""
Vastwood Zendikon,5.0,['Green'],['G'],None,['Enchantment'],['Aura'],Common,JMP,None,None,None,"Enchant land\nEnchanted land is a 6/4 green Elemental creature. It's still a land.\nWhen enchanted land dies, return that card to its owner's hand."
Ulvenwald Hydra,6.0,['Green'],['G'],None,['Creature'],['Hydra'],Mythic,JMP,*,*,None,"Reach\nUlvenwald Hydra's power and toughness are each equal to the number of lands you control.\nWhen Ulvenwald Hydra enters the battlefield, you may search your library for a land card, put it onto the battlefield tapped, then shuffle."
Time to Feed,3.0,['Green'],['G'],None,['Sorcery'],None,Common,JMP,None,None,None,"Choose target creature an opponent controls. When that creature dies this turn, you gain 3 life. Target creature you control fights that creature. (Each deals damage equal to its power to the other.)"
Thundering Spineback,7.0,['Green'],['G'],None,['Creature'],['Dinosaur'],Uncommon,JMP,5,5,None,Other Dinosaurs you control get +1/+1.\n{5}{G}: Create a 3/3 green Dinosaur creature token with trample.
Thragtusk,5.0,['Green'],['G'],None,['Creature'],['Beast'],Rare,JMP,5,3,None,"When Thragtusk enters the battlefield, you gain 5 life.\nWhen Thragtusk leaves the battlefield, create a 3/3 green Beast creature token."
Sylvan Ranger,2.0,['Green'],['G'],None,['Creature'],"['Elf', 'Scout', 'Ranger']",Common,JMP,1,1,None,"When Sylvan Ranger enters the battlefield, you may search your library for a basic land card, reveal it, put it into your hand, then shuffle."
Sylvan Brushstrider,3.0,['Green'],['G'],None,['Creature'],['Beast'],Common,JMP,3,2,None,"When Sylvan Brushstrider enters the battlefield, you gain 2 life."
Sporemound,5.0,['Green'],['G'],None,['Creature'],['Fungus'],Common,JMP,3,3,None,"Landfall — Whenever a land enters the battlefield under your control, create a 1/1 green Saproling creature token."
Soul of the Harvest,6.0,['Green'],['G'],None,['Creature'],['Elemental'],Rare,JMP,6,6,None,"Trample\nWhenever another nontoken creature enters the battlefield under your control, you may draw a card."
Somberwald Stag,5.0,['Green'],['G'],None,['Creature'],['Elk'],Uncommon,JMP,4,3,None,"When Somberwald Stag enters the battlefield, you may have it fight target creature you don't control."
Silhana Wayfinder,2.0,['Green'],['G'],None,['Creature'],"['Elf', 'Scout']",Uncommon,JMP,2,1,None,"When Silhana Wayfinder enters the battlefield, look at the top four cards of your library. You may reveal a creature or land card from among them and put it on top of your library. Put the rest on the bottom of your library in a random order."
"Selvala, Heart of the Wilds",3.0,['Green'],['G'],['Legendary'],['Creature'],"['Elf', 'Scout']",Mythic,JMP,2,3,None,"Whenever another creature enters the battlefield, its controller may draw a card if its power is greater than each other creature's power.\n{G}, {T}: Add X mana in any combination of colors, where X is the greatest power among creatures you control."
Rogue's Gloves,2.0,None,None,None,['Artifact'],['Equipment'],Uncommon,JMP,None,None,None,"Whenever equipped creature deals combat damage to a player, you may draw a card.\nEquip {2} ({2}: Attach to target creature you control. Equip only as a sorcery.)"
Scrounging Bandar,2.0,['Green'],['G'],None,['Creature'],"['Cat', 'Monkey']",Common,JMP,0,0,None,"Scrounging Bandar enters the battlefield with two +1/+1 counters on it.\nAt the beginning of your upkeep, you may move any number of +1/+1 counters from Scrounging Bandar onto another target creature."
Savage Stomp,3.0,['Green'],['G'],None,['Sorcery'],None,Uncommon,JMP,None,None,None,This spell costs {2} less to cast if it targets a Dinosaur you control.\nPut a +1/+1 counter on target creature you control. Then that creature fights target creature you don't control. (Each deals damage equal to its power to the other.)
Rumbling Baloth,4.0,['Green'],['G'],None,['Creature'],['Beast'],Common,JMP,4,4,None,None
"Rishkar, Peema Renegade",3.0,['Green'],['G'],['Legendary'],['Creature'],"['Elf', 'Druid']",Rare,JMP,2,2,None,"When Rishkar, Peema Renegade enters the battlefield, put a +1/+1 counter on each of up to two target creatures.\nEach creature you control with a counter on it has ""{T}: Add {G}."""
Ravenous Baloth,4.0,['Green'],['G'],None,['Creature'],['Beast'],Rare,JMP,4,4,None,Sacrifice a Beast: You gain 4 life.
Rampaging Brontodon,7.0,['Green'],['G'],None,['Creature'],['Dinosaur'],Rare,JMP,7,7,None,"Trample\nWhenever Rampaging Brontodon attacks, it gets +1/+1 until end of turn for each land you control."
Primordial Sage,6.0,['Green'],['G'],None,['Creature'],['Spirit'],Rare,JMP,4,5,None,"Whenever you cast a creature spell, you may draw a card."
Prophetic Prism,2.0,None,None,None,['Artifact'],None,Common,JMP,None,None,None,"When Prophetic Prism enters the battlefield, draw a card.\n{1}, {T}: Add one mana of any color."
Primeval Bounty,6.0,['Green'],['G'],None,['Enchantment'],None,Mythic,JMP,None,None,None,"Whenever you cast a creature spell, create a 3/3 green Beast creature token.\nWhenever you cast a noncreature spell, put three +1/+1 counters on target creature you control.\nWhenever a land enters the battlefield under your control, you gain 3 life."
Presence of Gond,3.0,['Green'],['G'],None,['Enchantment'],['Aura'],Common,JMP,None,None,None,"Enchant creature\nEnchanted creature has ""{T}: Create a 1/1 green Elf Warrior creature token."""
Pouncing Cheetah,3.0,['Green'],['G'],None,['Creature'],['Cat'],Common,JMP,3,2,None,Flash
Pirate's Cutlass,3.0,None,None,None,['Artifact'],['Equipment'],Common,JMP,None,None,None,"When Pirate's Cutlass enters the battlefield, attach it to target Pirate you control.\nEquipped creature gets +2/+1.\nEquip {2} ({2}: Attach to target creature you control. Equip only as a sorcery.)"
Penumbra Bobcat,3.0,['Green'],['G'],None,['Creature'],['Cat'],Common,JMP,2,1,None,"When Penumbra Bobcat dies, create a 2/1 black Cat creature token."
Overgrown Battlement,2.0,['Green'],['G'],None,['Creature'],['Wall'],Uncommon,JMP,0,4,None,Defender\n{T}: Add {G} for each creature with defender you control.
Initiate's Companion,2.0,['Green'],['G'],None,['Creature'],['Cat'],Common,JMP,3,1,None,"Whenever Initiate's Companion deals combat damage to a player, untap target creature or land."
Nessian Hornbeetle,2.0,['Green'],['G'],None,['Creature'],['Insect'],Uncommon,JMP,2,2,None,"At the beginning of combat on your turn, if you control another creature with power 4 or greater, put a +1/+1 counter on Nessian Hornbeetle."
Perilous Myr,2.0,None,None,None,"['Artifact', 'Creature']","['Phyrexian', 'Myr']",Common,JMP,1,1,None,"When Perilous Myr dies, it deals 2 damage to any target."
Oracle of Mul Daya,4.0,['Green'],['G'],None,['Creature'],"['Elf', 'Shaman']",Rare,JMP,2,2,None,You may play an additional land on each of your turns.\nPlay with the top card of your library revealed.\nYou may play lands from the top of your library.
Orazca Frillback,3.0,['Green'],['G'],None,['Creature'],['Dinosaur'],Common,JMP,4,2,None,None
Irresistible Prey,1.0,['Green'],['G'],None,['Sorcery'],None,Uncommon,JMP,None,None,None,Target creature must be blocked this turn if able.\nDraw a card.
Lurking Predators,6.0,['Green'],['G'],None,['Enchantment'],None,Rare,JMP,None,None,None,"Whenever an opponent casts a spell, reveal the top card of your library. If it's a creature card, put it onto the battlefield. Otherwise, you may put that card on the bottom of your library."
Nature's Way,2.0,['Green'],['G'],None,['Sorcery'],None,Uncommon,JMP,None,None,None,Target creature you control gains vigilance and trample until end of turn. It deals damage equal to its power to target creature you don't control.
New Horizons,3.0,['Green'],['G'],None,['Enchantment'],['Aura'],Common,JMP,None,None,None,"Enchant land\nWhen New Horizons enters the battlefield, put a +1/+1 counter on target creature you control.\nEnchanted land has ""{T}: Add two mana of any one color."""
Momentous Fall,4.0,['Green'],['G'],None,['Instant'],None,Rare,JMP,None,None,None,"As an additional cost to cast this spell, sacrifice a creature.\nYou draw cards equal to the sacrificed creature's power, then you gain life equal to its toughness."
Keeper of Fables,5.0,['Green'],['G'],None,['Creature'],['Cat'],Uncommon,JMP,4,5,None,"Whenever one or more non-Human creatures you control deal combat damage to a player, draw a card."
Lifecrafter's Gift,4.0,['Green'],['G'],None,['Instant'],None,Uncommon,JMP,None,None,None,"Put a +1/+1 counter on target creature, then put a +1/+1 counter on each creature you control with a +1/+1 counter on it."
Leaf Gilder,2.0,['Green'],['G'],None,['Creature'],"['Elf', 'Druid']",Common,JMP,2,1,None,{T}: Add {G}.
Ironshell Beetle,2.0,['Green'],['G'],None,['Creature'],['Insect'],Common,JMP,1,1,None,"When Ironshell Beetle enters the battlefield, put a +1/+1 counter on target creature."
Inspiring Call,3.0,['Green'],['G'],None,['Instant'],None,Uncommon,JMP,None,None,None,Draw a card for each creature you control with a +1/+1 counter on it. Those creatures gain indestructible until end of turn.
Hunter's Insight,3.0,['Green'],['G'],None,['Instant'],None,Uncommon,JMP,None,None,None,"Choose target creature you control. Whenever that creature deals combat damage to a player or planeswalker this turn, draw that many cards."
Reckless Scholar,3.0,['Blue'],['U'],None,['Creature'],"['Human', 'Wizard']",Uncommon,JMP,2,1,None,"{T}: Target player draws a card, then discards a card."
Languish,4.0,['Black'],['B'],None,['Sorcery'],None,Rare,JMP,None,None,None,All creatures get -4/-4 until end of turn.
Read the Runes,1.0,['Blue'],['U'],None,['Instant'],None,Rare,JMP,None,None,None,"Draw X cards. For each card drawn this way, discard a card unless you sacrifice a permanent."
Kalastria Nightwatch,5.0,['Black'],['B'],None,['Creature'],"['Vampire', 'Warrior', 'Ally']",Common,JMP,4,5,None,"Whenever you gain life, Kalastria Nightwatch gains flying until end of turn."
Rattlechains,2.0,['Blue'],['U'],None,['Creature'],['Spirit'],Rare,JMP,2,1,None,"Flash\nFlying\nWhen Rattlechains enters the battlefield, target Spirit gains hexproof until end of turn.\nYou may cast Spirit spells as though they had flash."
Innocent Blood,1.0,['Black'],['B'],None,['Sorcery'],None,Common,JMP,None,None,None,Each player sacrifices a creature.
Prosperous Pirates,5.0,['Blue'],['U'],None,['Creature'],"['Human', 'Pirate']",Common,JMP,3,4,None,"When Prosperous Pirates enters the battlefield, create two Treasure tokens. (They're artifacts with ""{T}, Sacrifice this artifact: Add one mana of any color."")"
Harvester of Souls,6.0,['Black'],['B'],None,['Creature'],['Demon'],Rare,JMP,5,5,None,"Deathtouch\nWhenever another nontoken creature dies, you may draw a card."
Prescient Chimera,5.0,['Blue'],['U'],None,['Creature'],['Chimera'],Common,JMP,3,4,None,"Flying\nWhenever you cast an instant or sorcery spell, scry 1. (Look at the top card of your library. You may put that card on the bottom of your library.)"
Gristle Grinner,5.0,['Black'],['B'],None,['Creature'],['Zombie'],Uncommon,JMP,3,3,None,"Whenever a creature dies, Gristle Grinner gets +2/+2 until end of turn."
Peel from Reality,2.0,['Blue'],['U'],None,['Instant'],None,Common,JMP,None,None,None,Return target creature you control and target creature you don't control to their owners' hands.
