Name,CMC,Colors,Color identity,Supertypes,Types,Subtypes,Rarity,Set,Power,Toughness,Loyalty,Text
"Mikaeus, the Lunarch",1.0,['White'],['W'],['Legendary'],['Creature'],"['Human', 'Cleric']",Mythic,JMP,0,0,None,"Mikaeus, the Lunarch enters the battlefield with X +1/+1 counters on it.\n{T}: Put a +1/+1 counter on Mikaeus.\n{T}, Remove a +1/+1 counter from Mikaeus: Put a +1/+1 counter on each other creature you control."
Brindle Shoat,2.0,['Green'],['G'],None,['Creature'],['Boar'],Uncommon,JMP,1,1,None,"When Brindle Shoat dies, create a 3/3 green Boar creature token."
Mesa Unicorn,2.0,['White'],['W'],None,['Creature'],['Unicorn'],Common,JMP,2,2,None,Lifelink
Grave Bramble,3.0,['Green'],['G'],None,['Creature'],['Plant'],Common,JMP,3,4,None,"Defender, protection from Zombies"
Mentor of the Meek,3.0,['White'],['W'],None,['Creature'],"['Human', 'Soldier']",Rare,JMP,2,2,None,"Whenever another creature with power 2 or less enters the battlefield under your control, you may pay {1}. If you do, draw a card."
Awakener Druid,3.0,['Green'],['G'],None,['Creature'],"['Human', 'Druid']",Uncommon,JMP,1,1,None,"When Awakener Druid enters the battlefield, target Forest becomes a 4/5 green Treefolk creature for as long as Awakener Druid remains on the battlefield. It's still a land."
Long Road Home,2.0,['White'],['W'],None,['Instant'],None,Uncommon,JMP,None,None,None,"Exile target creature. At the beginning of the next end step, return that card to the battlefield under its owner's control with a +1/+1 counter on it."
Assault Formation,2.0,['Green'],['G'],None,['Enchantment'],None,Rare,JMP,None,None,None,Each creature you control assigns combat damage equal to its toughness rather than its power.\n{G}: Target creature with defender can attack this turn as though it didn't have defender.\n{2}{G}: Creatures you control get +0/+1 until end of turn.
"Linvala, Keeper of Silence",4.0,['White'],['W'],['Legendary'],['Creature'],['Angel'],Mythic,JMP,3,4,None,Flying\nActivated abilities of creatures your opponents control can't be activated.
Armorcraft Judge,4.0,['Green'],['G'],None,['Creature'],"['Elf', 'Artificer']",Uncommon,JMP,3,3,None,"When Armorcraft Judge enters the battlefield, draw a card for each creature you control with a +1/+1 counter on it."
Lightwalker,2.0,['White'],['W'],None,['Creature'],"['Human', 'Warrior']",Common,JMP,2,1,None,Lightwalker has flying as long as it has a +1/+1 counter on it.
Arbor Armament,1.0,['Green'],['G'],None,['Instant'],None,Common,JMP,None,None,None,Put a +1/+1 counter on target creature. That creature gains reach until end of turn.
"Lena, Selfless Champion",6.0,['White'],['W'],['Legendary'],['Creature'],"['Human', 'Knight']",Rare,JMP,3,3,None,"When Lena, Selfless Champion enters the battlefield, create a 1/1 white Soldier creature token for each nontoken creature you control.\nSacrifice Lena: Creatures you control with power less than Lena's power gain indestructible until end of turn."
Ambassador Oak,4.0,['Green'],['G'],None,['Creature'],"['Treefolk', 'Warrior']",Common,JMP,3,3,None,"When Ambassador Oak enters the battlefield, create a 1/1 green Elf Warrior creature token."
Emancipation Angel,3.0,['White'],['W'],None,['Creature'],['Angel'],Uncommon,JMP,3,3,None,"Flying\nWhen Emancipation Angel enters the battlefield, return a permanent you control to its owner's hand."
Aggressive Urge,2.0,['Green'],['G'],None,['Instant'],None,Common,JMP,None,None,None,Target creature gets +1/+1 until end of turn.\nDraw a card.
"Isamaru, Hound of Konda",1.0,['White'],['W'],['Legendary'],['Creature'],['Dog'],Rare,JMP,2,2,None,None
Affectionate Indrik,6.0,['Green'],['G'],None,['Creature'],['Beast'],Uncommon,JMP,4,4,None,"When Affectionate Indrik enters the battlefield, you may have it fight target creature you don't control. (Each deals damage equal to its power to the other.)"
Knightly Valor,5.0,['White'],['W'],None,['Enchantment'],['Aura'],Common,JMP,None,None,None,"Enchant creature\nWhen Knightly Valor enters the battlefield, create a 2/2 white Knight creature token with vigilance. (Attacking doesn't cause it to tap.)\nEnchanted creature gets +2/+2 and has vigilance."
Young Pyromancer,2.0,['Red'],['R'],None,['Creature'],"['Human', 'Shaman']",Uncommon,JMP,2,1,None,"Whenever you cast an instant or sorcery spell, create a 1/1 red Elemental creature token."
Kor Spiritdancer,2.0,['White'],['W'],None,['Creature'],"['Kor', 'Wizard']",Rare,JMP,0,2,None,"Kor Spiritdancer gets +2/+2 for each Aura attached to it.\nWhenever you cast an Aura spell, you may draw a card."
Weaver of Lightning,3.0,['Red'],['R'],None,['Creature'],"['Human', 'Shaman']",Uncommon,JMP,1,4,None,"Reach\nWhenever you cast an instant or sorcery spell, Weaver of Lightning deals 1 damage to target creature an opponent controls."
Knight of the Tusk,6.0,['White'],['W'],None,['Creature'],"['Human', 'Knight']",Common,JMP,3,7,None,Vigilance (Attacking doesn't cause this creature to tap.)
Warfire Javelineer,4.0,['Red'],['R'],None,['Creature'],"['Minotaur', 'Warrior']",Uncommon,JMP,2,3,None,"When Warfire Javelineer enters the battlefield, it deals X damage to target creature an opponent controls, where X is the number of instant and sorcery cards in your graveyard."
Inspiring Unicorn,4.0,['White'],['W'],None,['Creature'],['Unicorn'],Uncommon,JMP,2,2,None,"Whenever Inspiring Unicorn attacks, creatures you control get +1/+1 until end of turn."
Volley Veteran,4.0,['Red'],['R'],None,['Creature'],"['Goblin', 'Warrior']",Uncommon,JMP,4,2,None,"When Volley Veteran enters the battlefield, it deals damage to target creature an opponent controls equal to the number of Goblins you control."
Inspiring Captain,4.0,['White'],['W'],None,['Creature'],"['Human', 'Knight']",Common,JMP,3,3,None,"When Inspiring Captain enters the battlefield, creatures you control get +1/+1 until end of turn."
Volcanic Fallout,3.0,['Red'],['R'],None,['Instant'],None,Uncommon,JMP,None,None,None,This spell can't be countered.\nVolcanic Fallout deals 2 damage to each creature and each player.
Inspired Charge,4.0,['White'],['W'],None,['Instant'],None,Common,JMP,None,None,None,Creatures you control get +2/+1 until end of turn.
Torch Fiend,2.0,['Red'],['R'],None,['Creature'],['Devil'],Common,JMP,2,1,None,"{R}, Sacrifice Torch Fiend: Destroy target artifact."
Healer's Hawk,1.0,['White'],['W'],None,['Creature'],['Bird'],Common,JMP,1,1,None,"Flying, lifelink"
Tibalt's Rager,2.0,['Red'],['R'],None,['Creature'],['Devil'],Uncommon,JMP,1,2,None,"When Tibalt's Rager dies, it deals 1 damage to any target.\n{1}{R}: Tibalt's Rager gets +2/+0 until end of turn."
Indomitable Will,2.0,['White'],['W'],None,['Enchantment'],['Aura'],Common,JMP,None,None,None,Flash\nEnchant creature\nEnchanted creature gets +1/+2.
Thermo-Alchemist,2.0,['Red'],['R'],None,['Creature'],"['Human', 'Shaman']",Common,JMP,0,3,None,"Defender\n{T}: Thermo-Alchemist deals 1 damage to each opponent.\nWhenever you cast an instant or sorcery spell, untap Thermo-Alchemist."
High Sentinels of Arashin,4.0,['White'],['W'],None,['Creature'],"['Bird', 'Soldier']",Rare,JMP,3,4,None,Flying\nHigh Sentinels of Arashin gets +1/+1 for each other creature you control with a +1/+1 counter on it.\n{3}{W}: Put a +1/+1 counter on target creature.
Spitting Earth,2.0,['Red'],['R'],None,['Sorcery'],None,Common,JMP,None,None,None,Spitting Earth deals damage to target creature equal to the number of Mountains you control.
Face of Divinity,3.0,['White'],['W'],None,['Enchantment'],['Aura'],Uncommon,JMP,None,None,None,"Enchant creature\nEnchanted creature gets +2/+2.\nAs long as another Aura is attached to enchanted creature, it has first strike and lifelink."
Sin Prodder,3.0,['Red'],['R'],None,['Creature'],['Devil'],Rare,JMP,3,2,None,"Menace\nAt the beginning of your upkeep, reveal the top card of your library. Any opponent may have you put that card into your graveyard. If a player does, Sin Prodder deals damage to that player equal to that card's mana value. Otherwise, put that card into your hand."
Duelist's Heritage,3.0,['White'],['W'],None,['Enchantment'],None,Rare,JMP,None,None,None,"Whenever one or more creatures attack, you may have target attacking creature gain double strike until end of turn."
Feral Prowler,2.0,['Green'],['G'],None,['Creature'],['Cat'],Common,JMP,1,3,None,"When Feral Prowler dies, draw a card."
Gird for Battle,1.0,['White'],['W'],None,['Sorcery'],None,Uncommon,JMP,None,None,None,Put a +1/+1 counter on each of up to two target creatures.
Seismic Elemental,5.0,['Red'],['R'],None,['Creature'],['Elemental'],Uncommon,JMP,4,4,None,"When Seismic Elemental enters the battlefield, creatures without flying can't block this turn."
Sarkhan's Unsealing,4.0,['Red'],['R'],None,['Enchantment'],None,Rare,JMP,None,None,None,"Whenever you cast a creature spell with power 4, 5, or 6, Sarkhan's Unsealing deals 4 damage to any target.\nWhenever you cast a creature spell with power 7 or greater, Sarkhan's Unsealing deals 4 damage to each opponent and each creature and planeswalker they control."
Fortify,3.0,['White'],['W'],None,['Instant'],None,Common,JMP,None,None,None,Choose one —\n• Creatures you control get +2/+0 until end of turn.\n• Creatures you control get +0/+2 until end of turn.
Sarkhan's Rage,5.0,['Red'],['R'],None,['Instant'],None,Common,JMP,None,None,None,"Sarkhan's Rage deals 5 damage to any target. If you control no Dragons, Sarkhan's Rage deals 2 damage to you."
Forced Worship,2.0,['White'],['W'],None,['Enchantment'],['Aura'],Common,JMP,None,None,None,Enchant creature\nEnchanted creature can't attack.\n{2}{W}: Return Forced Worship to its owner's hand.
Riddle of Lightning,5.0,['Red'],['R'],None,['Instant'],None,Uncommon,JMP,None,None,None,"Choose any target. Scry 3, then reveal the top card of your library. Riddle of Lightning deals damage equal to that card's mana value to that permanent or player."
Divine Arrow,2.0,['White'],['W'],None,['Instant'],None,Common,JMP,None,None,None,Divine Arrow deals 4 damage to target attacking or blocking creature.
Rapacious Dragon,5.0,['Red'],['R'],None,['Creature'],['Dragon'],Uncommon,JMP,3,3,None,"Flying\nWhen Rapacious Dragon enters the battlefield, create two Treasure tokens. (They're artifacts with ""{T}, Sacrifice this artifact: Add one mana of any color."")"
Dauntless Onslaught,3.0,['White'],['W'],None,['Instant'],None,Uncommon,JMP,None,None,None,Up to two target creatures each get +2/+2 until end of turn.
Rageblood Shaman,3.0,['Red'],['R'],None,['Creature'],"['Minotaur', 'Shaman']",Rare,JMP,2,3,None,Trample\nOther Minotaur creatures you control get +1/+1 and have trample.
Ghirapur Guide,3.0,['Green'],['G'],None,['Creature'],"['Elf', 'Scout']",Uncommon,JMP,3,2,None,{2}{G}: Target creature you control can't be blocked by creatures with power 2 or less this turn.
Cradle of Vitality,4.0,['White'],['W'],None,['Enchantment'],None,Rare,JMP,None,None,None,"Whenever you gain life, you may pay {1}{W}. If you do, put a +1/+1 counter on target creature for each 1 life you gained."
Pyroclastic Elemental,5.0,['Red'],['R'],None,['Creature'],['Elemental'],Uncommon,JMP,5,4,None,{1}{R}{R}: Pyroclastic Elemental deals 1 damage to target player.
Cloudshift,1.0,['White'],['W'],None,['Instant'],None,Common,JMP,None,None,None,"Exile target creature you control, then return that card to the battlefield under your control."
Pillar of Flame,1.0,['Red'],['R'],None,['Sorcery'],None,Common,JMP,None,None,None,"Pillar of Flame deals 2 damage to any target. If a creature dealt damage this way would die this turn, exile it instead."
Celestial Mantle,6.0,['White'],['W'],None,['Enchantment'],['Aura'],Rare,JMP,None,None,None,"Enchant creature\nEnchanted creature gets +3/+3.\nWhenever enchanted creature deals combat damage to a player, double its controller's life total."
Outnumber,1.0,['Red'],['R'],None,['Instant'],None,Common,JMP,None,None,None,Outnumber deals damage to target creature equal to the number of creatures you control.
Cathars' Crusade,5.0,['White'],['W'],None,['Enchantment'],None,Rare,JMP,None,None,None,"Whenever a creature enters the battlefield under your control, put a +1/+1 counter on each creature you control."
Ornery Goblin,2.0,['Red'],['R'],None,['Creature'],"['Goblin', 'Warrior']",Common,JMP,2,1,None,"Whenever Ornery Goblin blocks or becomes blocked by a creature, Ornery Goblin deals 1 damage to that creature."
Cathar's Companion,3.0,['White'],['W'],None,['Creature'],['Dog'],Common,JMP,3,1,None,"Whenever you cast a noncreature spell, Cathar's Companion gains indestructible until end of turn. (Damage and effects that say ""destroy"" don't destroy it.)"
Mugging,1.0,['Red'],['R'],None,['Sorcery'],None,Common,JMP,None,None,None,Mugging deals 2 damage to target creature. That creature can't block this turn.
Bulwark Giant,6.0,['White'],['W'],None,['Creature'],"['Giant', 'Soldier']",Common,JMP,3,6,None,"When Bulwark Giant enters the battlefield, you gain 5 life."
Molten Ravager,3.0,['Red'],['R'],None,['Creature'],['Elemental'],Common,JMP,0,4,None,{R}: Molten Ravager gets +1/+0 until end of turn.
Blessed Spirits,3.0,['White'],['W'],None,['Creature'],['Spirit'],Uncommon,JMP,2,2,None,"Flying\nWhenever you cast an enchantment spell, put a +1/+1 counter on Blessed Spirits."
Minotaur Sureshot,3.0,['Red'],['R'],None,['Creature'],"['Minotaur', 'Archer']",Common,JMP,2,3,None,Reach (This creature can block creatures with flying.)\n{1}{R}: Minotaur Sureshot gets +1/+0 until end of turn.
Battlefield Promotion,2.0,['White'],['W'],None,['Instant'],None,Common,JMP,None,None,None,Put a +1/+1 counter on target creature. That creature gains first strike until end of turn. You gain 2 life.
Minotaur Skullcleaver,3.0,['Red'],['R'],None,['Creature'],"['Minotaur', 'Berserker']",Common,JMP,2,2,None,"Haste\nWhen Minotaur Skullcleaver enters the battlefield, it gets +2/+0 until end of turn."
Archon of Redemption,5.0,['White'],['W'],None,['Creature'],['Archon'],Rare,JMP,3,4,None,"Flying\nWhenever Archon of Redemption or another creature with flying enters the battlefield under your control, you may gain life equal to that creature's power."
Makeshift Munitions,2.0,['Red'],['R'],None,['Enchantment'],None,Uncommon,JMP,None,None,None,"{1}, Sacrifice an artifact or creature: Makeshift Munitions deals 1 damage to any target."
Archon of Justice,5.0,['White'],['W'],None,['Creature'],['Archon'],Rare,JMP,4,4,None,"Flying\nWhen Archon of Justice dies, exile target permanent."
Magmaquake,2.0,['Red'],['R'],None,['Instant'],None,Rare,JMP,None,None,None,Magmaquake deals X damage to each creature without flying and each planeswalker.
Angelic Page,2.0,['White'],['W'],None,['Creature'],"['Angel', 'Spirit']",Common,JMP,1,1,None,Flying\n{T}: Target attacking or blocking creature gets +1/+1 until end of turn.
Magma Jet,2.0,['Red'],['R'],None,['Instant'],None,Uncommon,JMP,None,None,None,Magma Jet deals 2 damage to any target. Scry 2.
Angelic Edict,5.0,['White'],['W'],None,['Sorcery'],None,Common,JMP,None,None,None,Exile target creature or enchantment.
Lightning Shrieker,5.0,['Red'],['R'],None,['Creature'],['Dragon'],Common,JMP,5,5,None,"Flying, trample, haste\nAt the beginning of the end step, Lightning Shrieker's owner shuffles it into their library."
Angelic Arbiter,7.0,['White'],['W'],None,['Creature'],['Angel'],Rare,JMP,5,6,None,Flying\nEach opponent who cast a spell this turn can't attack with creatures.\nEach opponent who attacked with a creature this turn can't cast spells.
Lightning Elemental,4.0,['Red'],['R'],None,['Creature'],['Elemental'],Common,JMP,4,1,None,Haste (This creature can attack and {T} as soon as it comes under your control.)
Angel of the Dire Hour,7.0,['White'],['W'],None,['Creature'],['Angel'],Rare,JMP,5,4,None,"Flash\nFlying\nWhen Angel of the Dire Hour enters the battlefield, if you cast it from your hand, exile all attacking creatures."
Lightning Diadem,6.0,['Red'],['R'],None,['Enchantment'],['Aura'],Common,JMP,None,None,None,"Enchant creature\nWhen Lightning Diadem enters the battlefield, it deals 2 damage to any target.\nEnchanted creature gets +2/+2."
Angel of Mercy,5.0,['White'],['W'],None,['Creature'],['Angel'],Common,JMP,3,3,None,"Flying\nWhen Angel of Mercy enters the battlefield, you gain 3 life."
Lightning Bolt,1.0,['Red'],['R'],None,['Instant'],None,Uncommon,JMP,None,None,None,Lightning Bolt deals 3 damage to any target.
Alabaster Mage,2.0,['White'],['W'],None,['Creature'],"['Human', 'Wizard']",Uncommon,JMP,2,1,None,{1}{W}: Target creature you control gains lifelink until end of turn. (Damage dealt by the creature also causes its controller to gain that much life.)
Lightning Axe,1.0,['Red'],['R'],None,['Instant'],None,Uncommon,JMP,None,None,None,"As an additional cost to cast this spell, discard a card or pay {5}.\nLightning Axe deals 5 damage to target creature."
Ajani's Chosen,4.0,['White'],['W'],None,['Creature'],"['Cat', 'Soldier']",Rare,JMP,3,3,None,"Whenever an enchantment enters the battlefield under your control, create a 2/2 white Cat creature token. If that enchantment is an Aura, you may attach it to the token."
"Lathliss, Dragon Queen",6.0,['Red'],['R'],['Legendary'],['Creature'],['Dragon'],Rare,JMP,6,6,None,"Flying\nWhenever another nontoken Dragon enters the battlefield under your control, create a 5/5 red Dragon creature token with flying.\n{1}{R}: Dragons you control get +1/+0 until end of turn."
Affa Guard Hound,3.0,['White'],['W'],None,['Creature'],['Dog'],Uncommon,JMP,2,2,None,"Flash (You may cast this spell any time you could cast an instant.)\nWhen Affa Guard Hound enters the battlefield, target creature gets +0/+3 until end of turn."
"Krenko, Mob Boss",4.0,['Red'],['R'],['Legendary'],['Creature'],"['Goblin', 'Warrior']",Rare,JMP,3,3,None,"{T}: Create X 1/1 red Goblin creature tokens, where X is the number of Goblins you control."
Aerial Assault,3.0,['White'],['W'],None,['Sorcery'],None,Common,JMP,None,None,None,Destroy target tapped creature. You gain 1 life for each creature you control with flying.
Kiln Fiend,2.0,['Red'],['R'],None,['Creature'],"['Elemental', 'Beast']",Common,JMP,1,2,None,"Whenever you cast an instant or sorcery spell, Kiln Fiend gets +3/+0 until end of turn."
Aegis of the Heavens,2.0,['White'],['W'],None,['Instant'],None,Uncommon,JMP,None,None,None,Target creature gets +1/+7 until end of turn.
Inferno Hellion,4.0,['Red'],['R'],None,['Creature'],['Hellion'],Uncommon,JMP,7,3,None,"Trample (This creature can deal excess combat damage to the player or planeswalker it's attacking.)\nAt the beginning of each end step, if Inferno Hellion attacked or blocked this turn, its owner shuffles it into their library."
Terramorphic Expanse,0.0,None,None,None,['Land'],None,Common,JMP,None,None,None,"{T}, Sacrifice Terramorphic Expanse: Search your library for a basic land card, put it onto the battlefield tapped, then shuffle."
Hungry Flames,3.0,['Red'],['R'],None,['Instant'],None,Common,JMP,None,None,None,Hungry Flames deals 3 damage to target creature and 2 damage to target player or planeswalker.
Forest,0.0,None,['G'],['Basic'],['Land'],['Forest'],Common,JMP,None,None,None,({T}: Add {G}.)
Homing Lightning,4.0,['Red'],['R'],None,['Instant'],None,Uncommon,JMP,None,None,None,Homing Lightning deals 4 damage to target creature and each other creature with the same name as that creature.
Forest,0.0,None,['G'],['Basic'],['Land'],['Forest'],Common,JMP,None,None,None,({T}: Add {G}.)
Hellrider,4.0,['Red'],['R'],None,['Creature'],['Devil'],Rare,JMP,3,3,None,"Haste\nWhenever a creature you control attacks, Hellrider deals 1 damage to the player or planeswalker it's attacking."
Forest,0.0,None,['G'],['Basic'],['Land'],['Forest'],Common,JMP,None,None,None,({T}: Add {G}.)
Heartfire,2.0,['Red'],['R'],None,['Instant'],None,Common,JMP,None,None,None,"As an additional cost to cast this spell, sacrifice a creature or planeswalker.\nHeartfire deals 4 damage to any target."
Forest,0.0,None,['G'],['Basic'],['Land'],['Forest'],Common,JMP,None,None,None,({T}: Add {G}.)
Hamletback Goliath,7.0,['Red'],['R'],None,['Creature'],"['Giant', 'Warrior']",Rare,JMP,6,6,None,"Whenever another creature enters the battlefield, you may put X +1/+1 counters on Hamletback Goliath, where X is that creature's power."
Forest,0.0,None,['G'],['Basic'],['Land'],['Forest'],Common,JMP,None,None,None,({T}: Add {G}.)
Grim Lavamancer,1.0,['Red'],['R'],None,['Creature'],"['Human', 'Wizard']",Rare,JMP,1,1,None,"{R}, {T}, Exile two cards from your graveyard: Grim Lavamancer deals 2 damage to any target."
Forest,0.0,None,['G'],['Basic'],['Land'],['Forest'],Common,JMP,None,None,None,({T}: Add {G}.)
Feral Invocation,3.0,['Green'],['G'],None,['Enchantment'],['Aura'],Common,JMP,None,None,None,Flash (You may cast this spell any time you could cast an instant.)\nEnchant creature\nEnchanted creature gets +2/+2.
Forest,0.0,None,['G'],['Basic'],['Land'],['Forest'],Common,JMP,None,None,None,({T}: Add {G}.)
Goblin Shortcutter,2.0,['Red'],['R'],None,['Creature'],"['Goblin', 'Scout']",Common,JMP,2,1,None,"When Goblin Shortcutter enters the battlefield, target creature can't block this turn."
Forest,0.0,None,['G'],['Basic'],['Land'],['Forest'],Common,JMP,None,None,None,({T}: Add {G}.)
Goblin Rally,5.0,['Red'],['R'],None,['Sorcery'],None,Uncommon,JMP,None,None,None,Create four 1/1 red Goblin creature tokens.
Mountain,0.0,None,['R'],['Basic'],['Land'],['Mountain'],Common,JMP,None,None,None,({T}: Add {R}.)
Goblin Lore,2.0,['Red'],['R'],None,['Sorcery'],None,Uncommon,JMP,None,None,None,"Draw four cards, then discard three cards at random."
Mountain,0.0,None,['R'],['Basic'],['Land'],['Mountain'],Common,JMP,None,None,None,({T}: Add {R}.)
Goblin Instigator,2.0,['Red'],['R'],None,['Creature'],"['Goblin', 'Rogue']",Common,JMP,1,1,None,"When Goblin Instigator enters the battlefield, create a 1/1 red Goblin creature token."
Mountain,0.0,None,['R'],['Basic'],['Land'],['Mountain'],Common,JMP,None,None,None,({T}: Add {R}.)
Goblin Goon,4.0,['Red'],['R'],None,['Creature'],"['Goblin', 'Mutant']",Rare,JMP,6,6,None,Goblin Goon can't attack unless you control more creatures than defending player.\nGoblin Goon can't block unless you control more creatures than attacking player.
Mountain,0.0,None,['R'],['Basic'],['Land'],['Mountain'],Common,JMP,None,None,None,({T}: Add {R}.)
Goblin Commando,5.0,['Red'],['R'],None,['Creature'],['Goblin'],Uncommon,JMP,2,2,None,"When Goblin Commando enters the battlefield, it deals 2 damage to target creature."
Mountain,0.0,None,['R'],['Basic'],['Land'],['Mountain'],Common,JMP,None,None,None,({T}: Add {R}.)
Goblin Chieftain,3.0,['Red'],['R'],None,['Creature'],['Goblin'],Rare,JMP,2,2,None,Haste (This creature can attack and {T} as soon as it comes under your control.)\nOther Goblin creatures you control get +1/+1 and have haste.
Mountain,0.0,None,['R'],['Basic'],['Land'],['Mountain'],Common,JMP,None,None,None,({T}: Add {R}.)
Mountain,0.0,None,['R'],['Basic'],['Land'],['Mountain'],Common,JMP,None,None,None,({T}: Add {R}.)
Mountain,0.0,None,['R'],['Basic'],['Land'],['Mountain'],Common,JMP,None,None,None,({T}: Add {R}.)
Swamp,0.0,None,['B'],['Basic'],['Land'],['Swamp'],Common,JMP,None,None,None,({T}: Add {B}.)
Swamp,0.0,None,['B'],['Basic'],['Land'],['Swamp'],Common,JMP,None,None,None,({T}: Add {B}.)
Swamp,0.0,None,['B'],['Basic'],['Land'],['Swamp'],Common,JMP,None,None,None,({T}: Add {B}.)
Swamp,0.0,None,['B'],['Basic'],['Land'],['Swamp'],Common,JMP,None,None,None,({T}: Add {B}.)
Swamp,0.0,None,['B'],['Basic'],['Land'],['Swamp'],Common,JMP,None,None,None,({T}: Add {B}.)
Swamp,0.0,None,['B'],['Basic'],['Land'],['Swamp'],Common,JMP,None,None,None,({T}: Add {B}.)
Swamp,0.0,None,['B'],['Basic'],['Land'],['Swamp'],Common,JMP,None,None,None,({T}: Add {B}.)
Island,0.0,None,['U'],['Basic'],['Land'],['Island'],Common,JMP,None,None,None,({T}: Add {U}.)
Island,0.0,None,['U'],['Basic'],['Land'],['Island'],Common,JMP,None,None,None,({T}: Add {U}.)
Island,0.0,None,['U'],['Basic'],['Land'],['Island'],Common,JMP,None,None,None,({T}: Add {U}.)
Island,0.0,None,['U'],['Basic'],['Land'],['Island'],Common,JMP,None,None,None,({T}: Add {U}.)
Island,0.0,None,['U'],['Basic'],['Land'],['Island'],Common,JMP,None,None,None,({T}: Add {U}.)
Island,0.0,None,['U'],['Basic'],['Land'],['Island'],Common,JMP,None,None,None,({T}: Add {U}.)
Island,0.0,None,['U'],['Basic'],['Land'],['Island'],Common,JMP,None,None,None,({T}: Add {U}.)
Island,0.0,None,['U'],['Basic'],['Land'],['Island'],Common,JMP,None,None,None,({T}: Add {U}.)
Plains,0.0,None,['W'],['Basic'],['Land'],['Plains'],Common,JMP,None,None,None,({T}: Add {W}.)
Plains,0.0,None,['W'],['Basic'],['Land'],['Plains'],Common,JMP,None,None,None,({T}: Add {W}.)
Plains,0.0,None,['W'],['Basic'],['Land'],['Plains'],Common,JMP,None,None,None,({T}: Add {W}.)
Plains,0.0,None,['W'],['Basic'],['Land'],['Plains'],Common,JMP,None,None,None,({T}: Add {W}.)
Plains,0.0,None,['W'],['Basic'],['Land'],['Plains'],Common,JMP,None,None,None,({T}: Add {W}.)
Plains,0.0,None,['W'],['Basic'],['Land'],['Plains'],Common,JMP,None,None,None,({T}: Add {W}.)
Plains,0.0,None,['W'],['Basic'],['Land'],['Plains'],Common,JMP,None,None,None,({T}: Add {W}.)
Plains,0.0,None,['W'],['Basic'],['Land'],['Plains'],Common,JMP,None,None,None,({T}: Add {W}.)
Thriving Moor,0.0,None,['B'],None,['Land'],None,Common,JMP,None,None,None,"Thriving Moor enters the battlefield tapped.\nAs Thriving Moor enters the battlefield, choose a color other than black.\n{T}: Add {B} or one mana of the chosen color."
Thriving Isle,0.0,None,['U'],None,['Land'],None,Common,JMP,None,None,None,"Thriving Isle enters the battlefield tapped.\nAs Thriving Isle enters the battlefield, choose a color other than blue.\n{T}: Add {U} or one mana of the chosen color."
Thriving Heath,0.0,None,['W'],None,['Land'],None,Common,JMP,None,None,None,"Thriving Heath enters the battlefield tapped.\nAs Thriving Heath enters the battlefield, choose a color other than white.\n{T}: Add {W} or one mana of the chosen color."
