Name,CMC,Colors,Color identity,Supertypes,Types,Subtypes,Rarity,Set,Power,Toughness,Loyalty,Text
Thriving Grove,0.0,None,['G'],None,['Land'],None,Common,JMP,None,None,None,"Thriving Grove enters the battlefield tapped.\nAs Thriving Grove enters the battlefield, choose a color other than green.\n{T}: Add {G} or one mana of the chosen color."
Thriving Bluff,0.0,None,['R'],None,['Land'],None,Common,JMP,None,None,None,"Thriving Bluff enters the battlefield tapped.\nAs Thriving Bluff enters the battlefield, choose a color other than red.\n{T}: Add {R} or one mana of the chosen color."
Lightning-Core Excavator,1.0,None,None,None,"['Artifact', 'Creature']",['Golem'],Common,JMP,0,3,None,"{5}, {T}, Sacrifice Lightning-Core Excavator: It deals 3 damage to any target."
Towering Titan,6.0,['Green'],['G'],None,['Creature'],['Giant'],Mythic,JMP,0,0,None,"Towering Titan enters the battlefield with X +1/+1 counters on it, where X is the total toughness of other creatures you control.\nSacrifice a creature with defender: All creatures gain trample until end of turn."
Neyith of the Dire Hunt,4.0,['Green'],"['G', 'R']",['Legendary'],['Creature'],"['Human', 'Warrior']",Rare,JMP,3,3,None,"Whenever one or more creatures you control fight or become blocked, draw a card.\nAt the beginning of combat on your turn, you may pay {2}{R/G}. If you do, double target creature's power until end of turn. That creature must be blocked this combat if able. ({R/G} can be paid with either {R} or {G}.)"
Branching Evolution,3.0,['Green'],['G'],None,['Enchantment'],None,Rare,JMP,None,None,None,"If one or more +1/+1 counters would be put on a creature you control, twice that many +1/+1 counters are put on that creature instead."
Allosaurus Shepherd,1.0,['Green'],['G'],None,['Creature'],"['Elf', 'Shaman']",Mythic,JMP,1,1,None,"Allosaurus Shepherd can't be countered.\nGreen spells you control can't be countered.\n{4}{G}{G}: Until end of turn, each Elf creature you control has base power and toughness 5/5 and becomes a Dinosaur in addition to its other creature types."
"Zurzoth, Chaos Rider",3.0,['Red'],['R'],['Legendary'],['Creature'],['Devil'],Rare,JMP,2,3,None,"Whenever an opponent draws their first card each turn, if it's not their turn, you create a 1/1 red Devil creature token with ""When this creature dies, it deals 1 damage to any target.""\nWhenever one or more Devils you control attack one or more players, you and those players each draw a card, then discard a card at random."
Spiteful Prankster,3.0,['Red'],['R'],None,['Creature'],['Devil'],Uncommon,JMP,3,2,None,"As long as it's your turn, Spiteful Prankster has first strike.\nWhenever another creature dies, Spiteful Prankster deals 1 damage to target player or planeswalker."
"Sethron, Hurloon General",5.0,['Red'],"['B', 'R']",['Legendary'],['Creature'],"['Minotaur', 'Warrior']",Rare,JMP,4,4,None,"Whenever Sethron, Hurloon General or another nontoken Minotaur enters the battlefield under your control, create a 2/3 red Minotaur creature token.\n{2}{B/R}: Minotaurs you control get +1/+0 and gain menace and haste until end of turn. ({B/R} can be paid with either {B} or {R}.)"
"Muxus, Goblin Grandee",6.0,['Red'],['R'],['Legendary'],['Creature'],"['Goblin', 'Noble']",Rare,JMP,4,4,None,"When Muxus, Goblin Grandee enters the battlefield, reveal the top six cards of your library. Put all Goblin creature cards with mana value 5 or less from among them onto the battlefield and the rest on the bottom of your library in a random order.\nWhenever Muxus attacks, it gets +1/+1 until end of turn for each other Goblin you control."
Living Lightning,4.0,['Red'],['R'],None,['Creature'],"['Elemental', 'Shaman']",Uncommon,JMP,3,2,None,"When Living Lightning dies, return target instant or sorcery card from your graveyard to your hand."
Lightning Visionary,2.0,['Red'],['R'],None,['Creature'],"['Minotaur', 'Shaman']",Common,JMP,2,1,None,"Prowess (Whenever you cast a noncreature spell, this creature gets +1/+1 until end of turn.)"
Lightning Phoenix,3.0,['Red'],['R'],None,['Creature'],['Phoenix'],Rare,JMP,2,2,None,"Flying, haste\nLightning Phoenix can't block.\nAt the beginning of your end step, if an opponent was dealt 3 or more damage this turn, you may pay {R}. If you do, return Lightning Phoenix from your graveyard to the battlefield."
Immolating Gyre,6.0,['Red'],['R'],None,['Sorcery'],None,Mythic,JMP,None,None,None,"Immolating Gyre deals X damage to each creature and planeswalker you don't control, where X is the number of instant and sorcery cards in your graveyard."
Chained Brute,2.0,['Red'],['R'],None,['Creature'],['Devil'],Uncommon,JMP,4,3,None,"Chained Brute doesn't untap during your untap step.\n{1}, Sacrifice another creature: Untap Chained Brute. Activate only during your turn."
Witch of the Moors,5.0,['Black'],['B'],None,['Creature'],"['Human', 'Warlock']",Rare,JMP,4,4,None,"Deathtouch\nAt the beginning of your end step, if you gained life this turn, each opponent sacrifices a creature and you return up to one target creature card from your graveyard to your hand."
"Tinybones, Trinket Thief",2.0,['Black'],['B'],['Legendary'],['Creature'],"['Skeleton', 'Rogue']",Mythic,JMP,1,2,None,"At the beginning of each end step, if an opponent discarded a card this turn, you draw a card and you lose 1 life.\n{4}{B}{B}: Each opponent with no cards in hand loses 10 life."
Brightmare,3.0,['White'],['W'],None,['Creature'],['Unicorn'],Uncommon,JMP,2,3,None,"When Brightmare enters the battlefield, tap up to one target creature. You gain life equal to that creature's power."
"Ormos, Archive Keeper",6.0,['Blue'],['U'],['Legendary'],['Creature'],['Sphinx'],Rare,JMP,5,5,None,"Flying\nIf you would draw a card while your library has no cards in it, instead put five +1/+1 counters on Ormos, Archive Keeper.\n{1}{U}{U}, Discard three cards with different names: Draw five cards."
Rupture Spire,0.0,None,None,None,['Land'],None,Common,JMP,None,None,None,"Rupture Spire enters the battlefield tapped.\nWhen Rupture Spire enters the battlefield, sacrifice it unless you pay {1}.\n{T}: Add one mana of any color."
"Kels, Fight Fixer",4.0,['Black'],"['B', 'U']",['Legendary'],['Creature'],"['Azra', 'Warlock']",Rare,JMP,4,3,None,"Menace\nWhenever you sacrifice a creature, you may pay {U/B}. If you do, draw a card. ({U/B} can be paid with either {U} or {B}.)\n{1}, Sacrifice a creature: Kels, Fight Fixer gains indestructible until end of turn."
Riptide Laboratory,0.0,None,['U'],None,['Land'],None,Rare,JMP,None,None,None,"{T}: Add {C}.\n{1}{U}, {T}: Return target Wizard you control to its owner's hand."
Nocturnal Feeder,3.0,['Black'],['B'],None,['Creature'],"['Vampire', 'Rogue']",Common,JMP,2,1,None,"Flying\nWhen Nocturnal Feeder dies, each opponent loses 2 life and you gain 2 life."
Phyrexian Tower,0.0,None,['B'],['Legendary'],['Land'],None,Rare,JMP,None,None,None,"{T}: Add {C}.\n{T}, Sacrifice a creature: Add {B}{B}."
Scholar of the Lost Trove,7.0,['Blue'],['U'],None,['Creature'],['Sphinx'],Rare,JMP,5,5,None,"Flying\nWhen Scholar of the Lost Trove enters the battlefield, you may cast target instant, sorcery, or artifact card from your graveyard without paying its mana cost. If an instant or sorcery spell cast this way would be put into your graveyard this turn, exile it instead."
Mirrodin's Core,0.0,None,None,None,['Land'],None,Uncommon,JMP,None,None,None,"{T}: Add {C}.\n{T}: Put a charge counter on Mirrodin's Core.\n{T}, Remove a charge counter from Mirrodin's Core: Add one mana of any color."
"Inniaz, the Gale Force",5.0,['Blue'],"['U', 'W']",['Legendary'],['Creature'],['Djinn'],Rare,JMP,4,4,None,"Flying\n{2}{W/U}: Attacking creatures with flying get +1/+1 until end of turn. ({W/U} can be paid with either {W} or {U}.)\nWhenever three or more creatures you control with flying attack, each player gains control of a nonland permanent of your choice controlled by the player to their right."
Buried Ruin,0.0,None,None,None,['Land'],None,Uncommon,JMP,None,None,None,"{T}: Add {C}.\n{2}, {T}, Sacrifice Buried Ruin: Return target artifact card from your graveyard to your hand."
Warmonger's Chariot,2.0,None,None,None,['Artifact'],['Equipment'],Uncommon,JMP,None,None,None,"Equipped creature gets +2/+2.\nAs long as equipped creature has defender, it can attack as though it didn't have defender.\nEquip {3} ({3}: Attach to target creature you control. Equip only as a sorcery.)"
Corsair Captain,3.0,['Blue'],['U'],None,['Creature'],"['Human', 'Pirate']",Rare,JMP,2,2,None,"When Corsair Captain enters the battlefield, create a Treasure token. (It's an artifact with ""{T}, Sacrifice this artifact: Add one mana of any color."")\nOther Pirates you control get +1/+1."
Bruvac the Grandiloquent,3.0,['Blue'],['U'],['Legendary'],['Creature'],"['Human', 'Advisor']",Mythic,JMP,1,4,None,"If an opponent would mill one or more cards, they mill twice that many cards instead. (To mill a card, a player puts the top card of their library into their graveyard.)"
Unstable Obelisk,3.0,None,None,None,['Artifact'],None,Uncommon,JMP,None,None,None,"{T}: Add {C}.\n{7}, {T}, Sacrifice Unstable Obelisk: Destroy target permanent."
Supply Runners,5.0,['White'],['W'],None,['Creature'],['Dog'],Uncommon,JMP,2,2,None,"When Supply Runners enters the battlefield, put a +1/+1 counter on each other creature you control."
Terrarion,1.0,None,None,None,['Artifact'],None,Common,JMP,None,None,None,"Terrarion enters the battlefield tapped.\n{2}, {T}, Sacrifice Terrarion: Add two mana in any combination of colors.\nWhen Terrarion is put into a graveyard from the battlefield, draw a card."
Archaeomender,3.0,['Blue'],['U'],None,['Creature'],"['Human', 'Wizard']",Common,JMP,2,3,None,"When Archaeomender enters the battlefield, return target artifact card from your graveyard to your hand."
Trusty Retriever,4.0,['White'],['W'],None,['Creature'],['Dog'],Common,JMP,2,3,None,"When Trusty Retriever enters the battlefield, choose one —\n• Put a +1/+1 counter on Trusty Retriever.\n• Return target artifact or enchantment card from your graveyard to your hand."
Suspicious Bookcase,2.0,None,None,None,"['Artifact', 'Creature']",['Wall'],Uncommon,JMP,0,4,None,"Defender (This creature can't attack.)\n{3}, {T}: Target creature can't be blocked this turn."
Emiel the Blessed,4.0,['White'],"['G', 'W']",['Legendary'],['Creature'],['Unicorn'],Mythic,JMP,4,4,None,"{3}: Exile another target creature you control, then return it to the battlefield under its owner's control.\nWhenever another creature enters the battlefield under your control, you may pay {G/W}. If you do, put a +1/+1 counter on it. If it's a Unicorn, put two +1/+1 counters on it instead. ({G/W} can be paid with either {G} or {W}.)"
Skittering Surveyor,3.0,None,None,None,"['Artifact', 'Creature']",['Construct'],Common,JMP,1,2,None,"When Skittering Surveyor enters the battlefield, you may search your library for a basic land card, reveal it, put it into your hand, then shuffle."
Signpost Scarecrow,4.0,None,None,None,"['Artifact', 'Creature']",['Scarecrow'],Common,JMP,2,4,None,Vigilance\n{2}: Add one mana of any color.
Blessed Sanctuary,5.0,['White'],['W'],None,['Enchantment'],None,Rare,JMP,None,None,None,"Prevent all noncombat damage that would be dealt to you and creatures you control.\nWhenever a nontoken creature enters the battlefield under your control, create a 2/2 white Unicorn creature token."
Stone Haven Pilgrim,2.0,['White'],['W'],None,['Creature'],"['Kor', 'Cleric']",Uncommon,JMP,2,2,None,"Whenever Stone Haven Pilgrim attacks, if you control an artifact or enchantment, Stone Haven Pilgrim gets +1/+1 and gains lifelink until end of turn."
Steel-Plume Marshal,5.0,['White'],['W'],None,['Creature'],"['Bird', 'Soldier']",Rare,JMP,3,3,None,"Flying\nWhenever Steel-Plume Marshal attacks, other attacking creatures you control with flying get +2/+2 until end of turn."
Release the Dogs,4.0,['White'],['W'],None,['Sorcery'],None,Uncommon,JMP,None,None,None,Create four 1/1 white Dog creature tokens.
Scuttlemutt,3.0,None,None,None,"['Artifact', 'Creature']",['Scarecrow'],Uncommon,JMP,2,2,None,{T}: Add one mana of any color.\n{T}: Target creature becomes the color or colors of your choice until end of turn.
Scroll of Avacyn,1.0,None,None,None,['Artifact'],None,Common,JMP,None,None,None,"{1}, Sacrifice Scroll of Avacyn: Draw a card. If you control an Angel, you gain 5 life."
Scarecrone,3.0,None,None,None,"['Artifact', 'Creature']",['Scarecrow'],Rare,JMP,1,2,None,"{1}, Sacrifice a Scarecrow: Draw a card.\n{4}, {T}: Return target artifact creature card from your graveyard to the battlefield."
Runed Servitor,2.0,None,None,None,"['Artifact', 'Creature']",['Construct'],Common,JMP,2,2,None,"When Runed Servitor dies, each player draws a card."
Roving Keep,7.0,None,None,None,"['Artifact', 'Creature']",['Wall'],Common,JMP,5,7,None,Defender\n{7}: Roving Keep gets +2/+0 and gains trample until end of turn. It can attack this turn as though it didn't have defender.
Dragonspeaker Shaman,3.0,['Red'],['R'],None,['Creature'],"['Human', 'Barbarian', 'Shaman']",Uncommon,JMP,2,2,None,Dragon spells you cast cost {2} less to cast.
Dragonlord's Servant,2.0,['Red'],['R'],None,['Creature'],"['Goblin', 'Shaman']",Uncommon,JMP,1,3,None,Dragon spells you cast cost {1} less to cast.
Vampire Neonate,1.0,['Black'],['B'],None,['Creature'],['Vampire'],Common,JMP,0,3,None,"{2}, {T}: Each opponent loses 1 life and you gain 1 life."
Dragon Hatchling,2.0,['Red'],['R'],None,['Creature'],['Dragon'],Common,JMP,0,1,None,Flying\n{R}: Dragon Hatchling gets +1/+0 until end of turn.
Doublecast,2.0,['Red'],['R'],None,['Sorcery'],None,Uncommon,JMP,None,None,None,"When you cast your next instant or sorcery spell this turn, copy that spell. You may choose new targets for the copy."
Dragon Fodder,2.0,['Red'],['R'],None,['Sorcery'],None,Common,JMP,None,None,None,Create two 1/1 red Goblin creature tokens.
Draconic Roar,2.0,['Red'],['R'],None,['Instant'],None,Uncommon,JMP,None,None,None,"As an additional cost to cast this spell, you may reveal a Dragon card from your hand.\nDraconic Roar deals 3 damage to target creature. If you revealed a Dragon card or controlled a Dragon as you cast this spell, Draconic Roar deals 3 damage to that creature's controller."
Flames of the Raze-Boar,6.0,['Red'],['R'],None,['Instant'],None,Uncommon,JMP,None,None,None,Flames of the Raze-Boar deals 4 damage to target creature an opponent controls. Then Flames of the Raze-Boar deals 2 damage to each other creature that player controls if you control a creature with power 4 or greater.
Charmbreaker Devils,6.0,['Red'],['R'],None,['Creature'],['Devil'],Rare,JMP,4,4,None,"At the beginning of your upkeep, return an instant or sorcery card at random from your graveyard to your hand.\nWhenever you cast an instant or sorcery spell, Charmbreaker Devils gets +4/+0 until end of turn."
Borderland Minotaur,4.0,['Red'],['R'],None,['Creature'],"['Minotaur', 'Warrior']",Common,JMP,4,3,None,None
Fanatical Firebrand,1.0,['Red'],['R'],None,['Creature'],"['Goblin', 'Pirate']",Common,JMP,1,1,None,"Haste\n{T}, Sacrifice Fanatical Firebrand: It deals 1 damage to any target."
Forge Devil,1.0,['Red'],['R'],None,['Creature'],['Devil'],Common,JMP,1,1,None,"When Forge Devil enters the battlefield, it deals 1 damage to target creature and 1 damage to you."
Furnace Whelp,4.0,['Red'],['R'],None,['Creature'],['Dragon'],Uncommon,JMP,2,2,None,Flying (This creature can't be blocked except by creatures with flying or reach.)\n{R}: Furnace Whelp gets +1/+0 until end of turn.
Fling,2.0,['Red'],['R'],None,['Instant'],None,Common,JMP,None,None,None,"As an additional cost to cast this spell, sacrifice a creature.\nFling deals damage equal to the sacrificed creature's power to any target."
Dance with Devils,4.0,['Red'],['R'],None,['Instant'],None,Uncommon,JMP,None,None,None,"Create two 1/1 red Devil creature tokens. They have ""When this creature dies, it deals 1 damage to any target."""
Flames of the Firebrand,3.0,['Red'],['R'],None,['Sorcery'],None,Uncommon,JMP,None,None,None,"Flames of the Firebrand deals 3 damage divided as you choose among one, two, or three targets."
Collateral Damage,1.0,['Red'],['R'],None,['Instant'],None,Common,JMP,None,None,None,"As an additional cost to cast this spell, sacrifice a creature.\nCollateral Damage deals 3 damage to any target."
Cinder Elemental,4.0,['Red'],['R'],None,['Creature'],['Elemental'],Uncommon,JMP,2,2,None,"{X}{R}, {T}, Sacrifice Cinder Elemental: It deals X damage to any target."
Borderland Marauder,2.0,['Red'],['R'],None,['Creature'],"['Human', 'Warrior']",Common,JMP,1,2,None,"Whenever Borderland Marauder attacks, it gets +2/+0 until end of turn."
Boggart Brute,3.0,['Red'],['R'],None,['Creature'],"['Goblin', 'Warrior']",Common,JMP,3,2,None,Menace (This creature can't be blocked except by two or more creatures.)
Dualcaster Mage,3.0,['Red'],['R'],None,['Creature'],"['Human', 'Wizard']",Rare,JMP,2,2,None,"Flash\nWhen Dualcaster Mage enters the battlefield, copy target instant or sorcery spell. You may choose new targets for the copy."
Bloodshot Trainee,4.0,['Red'],['R'],None,['Creature'],"['Goblin', 'Warrior']",Uncommon,JMP,2,3,None,{T}: Bloodshot Trainee deals 4 damage to target creature. Activate only if Bloodshot Trainee's power is 4 or greater.
Tithebearer Giant,6.0,['Black'],['B'],None,['Creature'],"['Giant', 'Warrior']",Common,JMP,4,5,None,"When Tithebearer Giant enters the battlefield, you draw a card and you lose 1 life."
"Etali, Primal Storm",6.0,['Red'],['R'],['Legendary'],['Creature'],"['Elder', 'Dinosaur']",Rare,JMP,6,6,None,"Whenever Etali, Primal Storm attacks, exile the top card of each player's library, then you may cast any number of spells from among those cards without paying their mana costs."
Flametongue Kavu,4.0,['Red'],['R'],None,['Creature'],['Kavu'],Uncommon,JMP,4,2,None,"When Flametongue Kavu enters the battlefield, it deals 4 damage to target creature."
Bloodrock Cyclops,3.0,['Red'],['R'],None,['Creature'],['Cyclops'],Common,JMP,3,3,None,Bloodrock Cyclops attacks each combat if able.
Bloodrage Brawler,2.0,['Red'],['R'],None,['Creature'],"['Minotaur', 'Warrior']",Uncommon,JMP,4,3,None,"When Bloodrage Brawler enters the battlefield, discard a card."
Blindblast,3.0,['Red'],['R'],None,['Instant'],None,Common,JMP,None,None,None,Blindblast deals 1 damage to target creature. That creature can't block this turn.\nDraw a card.
Beetleback Chief,4.0,['Red'],['R'],None,['Creature'],"['Goblin', 'Warrior']",Uncommon,JMP,2,2,None,"When Beetleback Chief enters the battlefield, create two 1/1 red Goblin creature tokens."
Bathe in Dragonfire,3.0,['Red'],['R'],None,['Sorcery'],None,Common,JMP,None,None,None,Bathe in Dragonfire deals 4 damage to target creature.
Barrage of Expendables,1.0,['Red'],['R'],None,['Enchantment'],None,Uncommon,JMP,None,None,None,"{R}, Sacrifice a creature: Barrage of Expendables deals 1 damage to any target."
Chain Lightning,1.0,['Red'],['R'],None,['Sorcery'],None,Uncommon,JMP,None,None,None,"Chain Lightning deals 3 damage to any target. Then that player or that permanent's controller may pay {R}{R}. If the player does, they may copy this spell and may choose a new target for that copy."
Ball Lightning,3.0,['Red'],['R'],None,['Creature'],['Elemental'],Rare,JMP,6,1,None,"Trample (This creature can deal excess combat damage to the player or planeswalker it's attacking.)\nHaste (This creature can attack and {T} as soon as it comes under your control.)\nAt the beginning of the end step, sacrifice Ball Lightning."
Flame Lash,4.0,['Red'],['R'],None,['Instant'],None,Common,JMP,None,None,None,Flame Lash deals 4 damage to any target.
Ashmouth Hound,2.0,['Red'],['R'],None,['Creature'],"['Elemental', 'Dog']",Common,JMP,2,1,None,"Whenever Ashmouth Hound blocks or becomes blocked by a creature, Ashmouth Hound deals 1 damage to that creature."
Act of Treason,3.0,['Red'],['R'],None,['Sorcery'],None,Common,JMP,None,None,None,Gain control of target creature until end of turn. Untap that creature. It gains haste until end of turn. (It can attack and {T} this turn.)
Zombie Infestation,2.0,['Black'],['B'],None,['Enchantment'],None,Uncommon,JMP,None,None,None,Discard two cards: Create a 2/2 black Zombie creature token.
Wight of Precinct Six,2.0,['Black'],['B'],None,['Creature'],['Zombie'],Common,JMP,1,1,None,Wight of Precinct Six gets +1/+1 for each creature card in your opponents' graveyards.
Flurry of Horns,5.0,['Red'],['R'],None,['Sorcery'],None,Common,JMP,None,None,None,Create two 2/3 red Minotaur creature tokens with haste.
Wailing Ghoul,2.0,['Black'],['B'],None,['Creature'],['Zombie'],Common,JMP,1,3,None,"When Wailing Ghoul enters the battlefield, mill two cards."
Tempting Witch,3.0,['Black'],['B'],None,['Creature'],"['Human', 'Warlock']",Uncommon,JMP,1,3,None,"When Tempting Witch enters the battlefield, create a Food token. (It's an artifact with ""{2}, {T}, Sacrifice this artifact: You gain 3 life."")\n{2}, {T}, Sacrifice a Food: Target player loses 3 life."
