Name,CMC,Colors,Color identity,Supertypes,Types,Subtypes,Rarity,Set,Power,Toughness,Loyalty,Text
Wolfrider's Saddle,4.0,['Green'],['G'],None,['Artifact'],['Equipment'],Uncommon,M20,None,None,None,"When Wolfrider's Saddle enters the battlefield, create a 2/2 green Wolf creature token, then attach Wolfrider's Saddle to it.\nEquipped creature gets +1/+1 and can't be blocked by more than one creature.\nEquip {3} ({3}: Attach to target creature you control. Equip only as a sorcery.)"
Woodland Champion,2.0,['Green'],['G'],None,['Creature'],"['Elf', 'Scout']",Uncommon,M20,2,2,None,"Whenever one or more tokens enter the battlefield under your control, put that many +1/+1 counters on Woodland Champion."
Take Vengeance,2.0,['White'],['W'],None,['Sorcery'],None,Common,M20,None,None,None,Destroy target tapped creature.
Show of Valor,2.0,['White'],['W'],None,['Instant'],None,Common,M20,None,None,None,Target creature gets +2/+4 until end of turn.
Serra's Guardian,6.0,['White'],['W'],None,['Creature'],['Angel'],Rare,M20,5,5,None,Flying (This creature can't be blocked except by creatures with flying or reach.)\nVigilance (Attacking doesn't cause this creature to tap.)\nOther creatures you control have vigilance.
Prowling Caracal,2.0,['White'],['W'],None,['Creature'],['Cat'],Common,M20,3,1,None,None
Impassioned Orator,2.0,['White'],['W'],None,['Creature'],"['Human', 'Cleric']",Common,M20,2,2,None,"Whenever another creature enters the battlefield under your control, you gain 1 life."
Ironclad Krovod,4.0,['White'],['W'],None,['Creature'],['Beast'],Common,M20,2,5,None,None
Imperial Outrider,4.0,['White'],['W'],None,['Creature'],"['Human', 'Knight']",Common,M20,1,5,None,None
Twinblade Paladin,4.0,['White'],['W'],None,['Creature'],"['Human', 'Knight']",Uncommon,M20,3,3,None,"Whenever you gain life, put a +1/+1 counter on Twinblade Paladin.\nAs long as you have 25 or more life, Twinblade Paladin has double strike. (It deals both first-strike and regular combat damage.)"
Angelic Guardian,6.0,['White'],['W'],None,['Creature'],['Angel'],Rare,M20,5,5,None,"Flying (This creature can't be blocked except by creatures with flying or reach.)\nWhenever one or more creatures you control attack, they gain indestructible until end of turn. (Damage and effects that say ""destroy"" don't destroy them.)"
Sorin's Guide,5.0,['Black'],['B'],None,['Creature'],['Vampire'],Rare,M20,4,2,None,"When Sorin's Guide enters the battlefield, you may search your library and/or graveyard for a card named Sorin, Vampire Lord, reveal it, and put it into your hand. If you search your library this way, shuffle."
Yanling's Harbinger,5.0,['Blue'],['U'],None,['Creature'],['Bird'],Rare,M20,2,4,None,"Flying\nWhen Yanling's Harbinger enters the battlefield, you may search your library and/or graveyard for a card named Mu Yanling, Celestial Wind, reveal it, and put it into your hand. If you search your library this way, shuffle."
Gnarlback Rhino,4.0,['Green'],['G'],None,['Creature'],['Rhino'],Uncommon,M20,4,4,None,"Trample (This creature can deal excess combat damage to the player or planeswalker it's attacking.)\nWhenever you cast a spell that targets Gnarlback Rhino, draw a card."
Haazda Officer,3.0,['White'],['W'],None,['Creature'],"['Human', 'Soldier']",Common,M20,3,2,None,"When Haazda Officer enters the battlefield, target creature you control gets +1/+1 until end of turn."
Concordia Pegasus,2.0,['White'],['W'],None,['Creature'],['Pegasus'],Common,M20,1,3,None,Flying
Bastion Enforcer,3.0,['White'],['W'],None,['Creature'],"['Dwarf', 'Soldier']",Common,M20,3,2,None,None
"Mu Yanling, Celestial Wind",6.0,['Blue'],['U'],['Legendary'],['Planeswalker'],['Yanling'],Mythic,M20,None,None,5,"[+1]: Until your next turn, up to one target creature gets -5/-0.\n[−3]: Return up to two target creatures to their owners' hands.\n[−7]: Creatures you control with flying get +5/+5 until end of turn."
"Chandra, Flame's Fury",6.0,['Red'],['R'],['Legendary'],['Planeswalker'],['Chandra'],Mythic,M20,None,None,4,"[+1]: Chandra, Flame's Fury deals 2 damage to any target.\n[−2]: Chandra, Flame's Fury deals 4 damage to target creature and 2 damage to that creature's controller.\n[−8]: Chandra, Flame's Fury deals 10 damage to target player and each creature that player controls."
Chandra's Flame Wave,5.0,['Red'],['R'],None,['Sorcery'],None,Rare,M20,None,None,None,"Chandra's Flame Wave deals 2 damage to target player and each creature that player controls. Search your library and/or graveyard for a card named Chandra, Flame's Fury, reveal it, and put it into your hand. If you search your library this way, shuffle."
Pyroclastic Elemental,5.0,['Red'],['R'],None,['Creature'],['Elemental'],Uncommon,M20,5,4,None,{1}{R}{R}: Pyroclastic Elemental deals 1 damage to target player.
Wildfire Elemental,4.0,['Red'],['R'],None,['Creature'],['Elemental'],Common,M20,3,3,None,"Whenever an opponent is dealt noncombat damage, creatures you control get +1/+0 until end of turn."
"Vivien, Nature's Avenger",6.0,['Green'],['G'],['Legendary'],['Planeswalker'],['Vivien'],Mythic,M20,None,None,3,[+1]: Put three +1/+1 counters on up to one target creature.\n[−1]: Reveal cards from the top of your library until you reveal a creature card. Put that card into your hand and the rest on the bottom of your library in a random order.\n[−6]: Target creature gets +10/+10 and gains trample until end of turn.
Ethereal Elk,5.0,['Green'],['G'],None,['Creature'],"['Elk', 'Spirit']",Rare,M20,3,3,None,"Trample\nWhen Ethereal Elk enters the battlefield, you may search your library and/or graveyard for a card named Vivien, Nature's Avenger, reveal it, and put it into your hand. If you search your library this way, shuffle."
Vampire Opportunist,2.0,['Black'],['B'],None,['Creature'],['Vampire'],Common,M20,2,1,None,{6}{B}: Each opponent loses 2 life and you gain 2 life.
Sorin's Thirst,2.0,['Black'],['B'],None,['Instant'],None,Common,M20,None,None,None,Sorin's Thirst deals 2 damage to target creature and you gain 2 life.
Gravewaker,6.0,['Black'],['B'],None,['Creature'],"['Bird', 'Spirit']",Rare,M20,5,5,None,Flying (This creature can't be blocked except by creatures with flying or reach.)\n{5}{B}{B}: Return target creature card from your graveyard to the battlefield tapped.
Skeleton Archer,4.0,['Black'],['B'],None,['Creature'],"['Skeleton', 'Archer']",Common,M20,3,3,None,"When Skeleton Archer enters the battlefield, it deals 1 damage to any target."
Phantom Warrior,3.0,['Blue'],['U'],None,['Creature'],"['Illusion', 'Warrior']",Common,M20,2,2,None,Phantom Warrior can't be blocked.
Vivien's Crocodile,3.0,['Green'],['G'],None,['Creature'],"['Crocodile', 'Spirit']",Common,M20,3,3,None,Vivien's Crocodile gets +1/+1 as long as you control a Vivien planeswalker.
Siege Mastodon,5.0,['White'],['W'],None,['Creature'],['Elephant'],Common,M20,3,5,None,None
Trusted Pegasus,3.0,['White'],['W'],None,['Creature'],['Pegasus'],Common,M20,2,2,None,"Flying (This creature can't be blocked except by creatures with flying or reach.)\nWhenever Trusted Pegasus attacks, target attacking creature without flying gains flying until end of turn."
Savage Gorger,3.0,['Black'],['B'],None,['Creature'],['Vampire'],Common,M20,1,1,None,"Flying\nAt the beginning of your end step, if an opponent lost life this turn, put a +1/+1 counter on Savage Gorger. (Damage causes loss of life.)"
Thirsting Bloodlord,4.0,['Black'],['B'],None,['Creature'],['Vampire'],Uncommon,M20,3,3,None,Other Vampires you control get +1/+1.
Savannah Sage,2.0,['White'],['W'],None,['Creature'],"['Cat', 'Cleric']",Common,M20,2,2,None,"When Savannah Sage enters the battlefield, you gain 2 life."
Disentomb,1.0,['Black'],['B'],None,['Sorcery'],None,Common,M20,None,None,None,Return target creature card from your graveyard to your hand.
Dark Remedy,2.0,['Black'],['B'],None,['Instant'],None,Common,M20,None,None,None,Target creature gets +1/+3 until end of turn.
Bartizan Bats,4.0,['Black'],['B'],None,['Creature'],['Bat'],Common,M20,3,1,None,Flying (This creature can't be blocked except by creatures with flying or reach.)
Bogstomper,6.0,['Black'],['B'],None,['Creature'],['Beast'],Common,M20,6,5,None,None
Snapping Drake,4.0,['Blue'],['U'],None,['Creature'],['Drake'],Common,M20,3,2,None,Flying (This creature can't be blocked except by creatures with flying or reach.)
Celestial Messenger,4.0,['Blue'],['U'],None,['Creature'],"['Bird', 'Spirit']",Common,M20,3,2,None,Flash (You may cast this card any time you could cast an instant.)\nFlying\nCelestial Messenger gets +1/+1 as long as you control a Yanling planeswalker.
Waterkin Shaman,2.0,['Blue'],['U'],None,['Creature'],"['Elemental', 'Shaman']",Uncommon,M20,2,1,None,"Whenever a creature with flying enters the battlefield under your control, Waterkin Shaman gets +1/+1 until end of turn."
Riddlemaster Sphinx,6.0,['Blue'],['U'],None,['Creature'],['Sphinx'],Rare,M20,5,5,None,"Flying (This creature can't be blocked except by creatures with flying or reach.)\nWhen Riddlemaster Sphinx enters the battlefield, you may return target creature an opponent controls to its owner's hand."
"Sorin, Vampire Lord",6.0,['Black'],['B'],['Legendary'],['Planeswalker'],['Sorin'],Mythic,M20,None,None,4,"[+1]: Up to one target creature gets +2/+0 until end of turn.\n[−2]: Sorin, Vampire Lord deals 4 damage to any target. You gain 4 life.\n[−8]: Until end of turn, each Vampire you control gains ""{T}: Gain control of target creature."""
Coral Merfolk,2.0,['Blue'],['U'],None,['Creature'],['Merfolk'],Common,M20,2,1,None,None
Vorstclaw,6.0,['Green'],['G'],None,['Creature'],"['Elemental', 'Horror']",Common,M20,7,7,None,None
Goblin Ringleader,4.0,['Red'],['R'],None,['Creature'],['Goblin'],Uncommon,M20,2,2,None,"Haste (This creature can attack and {T} as soon as it comes under your control.)\nWhen Goblin Ringleader enters the battlefield, reveal the top four cards of your library. Put all Goblin cards revealed this way into your hand and the rest on the bottom of your library in any order."
Goblin Bird-Grabber,2.0,['Red'],['R'],None,['Creature'],['Goblin'],Common,M20,2,1,None,{R}: Goblin Bird-Grabber gains flying until end of turn. Activate only if you control a creature with flying.
Glint-Horn Buccaneer,3.0,['Red'],['R'],None,['Creature'],"['Minotaur', 'Pirate']",Rare,M20,2,4,None,"Haste\nWhenever you discard a card, Glint-Horn Buccaneer deals 1 damage to each opponent.\n{1}{R}, Discard a card: Draw a card. Activate only if Glint-Horn Buccaneer is attacking."
Fry,2.0,['Red'],['R'],None,['Instant'],None,Uncommon,M20,None,None,None,This spell can't be countered.\nFry deals 5 damage to target creature or planeswalker that's white or blue.
Ember Hauler,2.0,['Red'],['R'],None,['Creature'],['Goblin'],Uncommon,M20,2,2,None,"{1}, Sacrifice Ember Hauler: It deals 2 damage to any target."
"Drakuseth, Maw of Flames",7.0,['Red'],['R'],['Legendary'],['Creature'],['Dragon'],Rare,M20,7,7,None,"Flying\nWhenever Drakuseth, Maw of Flames attacks, it deals 4 damage to any target and 3 damage to each of up to two other targets."
Dragon Mage,7.0,['Red'],['R'],None,['Creature'],"['Dragon', 'Wizard']",Uncommon,M20,5,5,None,"Flying\nWhenever Dragon Mage deals combat damage to a player, each player discards their hand, then draws seven cards."
Destructive Digger,3.0,['Red'],['R'],None,['Creature'],['Goblin'],Common,M20,3,2,None,"{3}, {T}, Sacrifice an artifact or land: Draw a card."
Chandra's Spitfire,3.0,['Red'],['R'],None,['Creature'],['Elemental'],Uncommon,M20,1,3,None,"Flying\nWhenever an opponent is dealt noncombat damage, Chandra's Spitfire gets +3/+0 until end of turn."
Chandra's Regulator,2.0,['Red'],['R'],['Legendary'],['Artifact'],None,Rare,M20,None,None,None,"Whenever you activate a loyalty ability of a Chandra planeswalker, you may pay {1}. If you do, copy that ability. You may choose new targets for the copy.\n{1}, {T}, Discard a Mountain card or a red card: Draw a card."
Chandra's Outrage,4.0,['Red'],['R'],None,['Instant'],None,Common,M20,None,None,None,Chandra's Outrage deals 4 damage to target creature and 2 damage to that creature's controller.
Chandra's Embercat,2.0,['Red'],['R'],None,['Creature'],"['Elemental', 'Cat']",Common,M20,2,2,None,{T}: Add {R}. Spend this mana only to cast an Elemental spell or a Chandra planeswalker spell.
"Chandra, Novice Pyromancer",4.0,['Red'],['R'],['Legendary'],['Planeswalker'],['Chandra'],Uncommon,M20,None,None,5,"[+1]: Elementals you control get +2/+0 until end of turn.\n[−1]: Add {R}{R}.\n[−2]: Chandra, Novice Pyromancer deals 2 damage to any target."
"Chandra, Awakened Inferno",6.0,['Red'],['R'],['Legendary'],['Planeswalker'],['Chandra'],Mythic,M20,None,None,6,"This spell can't be countered.\n[+2]: Each opponent gets an emblem with ""At the beginning of your upkeep, this emblem deals 1 damage to you.""\n[−3]: Chandra, Awakened Inferno deals 3 damage to each non-Elemental creature.\n[−X]: Chandra, Awakened Inferno deals X damage to target creature or planeswalker. If a permanent dealt damage this way would die this turn, exile it instead."
"Chandra, Acolyte of Flame",3.0,['Red'],['R'],['Legendary'],['Planeswalker'],['Chandra'],Rare,M20,None,None,4,"[0]: Put a loyalty counter on each red planeswalker you control.\n[0]: Create two 1/1 red Elemental creature tokens. They gain haste. Sacrifice them at the beginning of the next end step.\n[−2]: You may cast target instant or sorcery card with mana value 3 or less from your graveyard. If that spell would be put into your graveyard this turn, exile it instead."
Cavalier of Flame,5.0,['Red'],['R'],None,['Creature'],"['Elemental', 'Knight']",Mythic,M20,6,5,None,"{1}{R}: Creatures you control get +1/+0 and gain haste until end of turn.\nWhen Cavalier of Flame enters the battlefield, discard any number of cards, then draw that many cards.\nWhen Cavalier of Flame dies, it deals X damage to each opponent and each planeswalker they control, where X is the number of land cards in your graveyard."
Act of Treason,3.0,['Red'],['R'],None,['Sorcery'],None,Common,M20,None,None,None,Gain control of target creature until end of turn. Untap that creature. It gains haste until end of turn. (It can attack and {T} this turn.)
Yarok's Fenlurker,2.0,['Black'],['B'],None,['Creature'],['Horror'],Uncommon,M20,1,1,None,"When Yarok's Fenlurker enters the battlefield, each opponent exiles a card from their hand.\n{2}{B}: Yarok's Fenlurker gets +1/+1 until end of turn."
"Vilis, Broker of Blood",8.0,['Black'],['B'],['Legendary'],['Creature'],['Demon'],Rare,M20,8,8,None,"Flying\n{B}, Pay 2 life: Target creature gets -1/-1 until end of turn.\nWhenever you lose life, draw that many cards. (Damage causes loss of life.)"
Vengeful Warchief,5.0,['Black'],['B'],None,['Creature'],"['Orc', 'Warrior']",Uncommon,M20,4,4,None,"Whenever you lose life for the first time each turn, put a +1/+1 counter on Vengeful Warchief. (Damage causes loss of life.)"
Vampire of the Dire Moon,1.0,['Black'],['B'],None,['Creature'],['Vampire'],Uncommon,M20,1,1,None,Deathtouch (Any amount of damage this deals to a creature is enough to destroy it.)\nLifelink (Damage dealt by this creature also causes you to gain that much life.)
Cloudkin Seer,3.0,['Blue'],['U'],None,['Creature'],"['Elemental', 'Wizard']",Common,M20,2,1,None,"Flying\nWhen Cloudkin Seer enters the battlefield, draw a card."
Unholy Indenture,3.0,['Black'],['B'],None,['Enchantment'],['Aura'],Common,M20,None,None,None,"Enchant creature\nWhen enchanted creature dies, return that card to the battlefield under your control with a +1/+1 counter on it."
Cerulean Drake,2.0,['Blue'],['U'],None,['Creature'],['Drake'],Uncommon,M20,1,1,None,"Flying\nProtection from red (This creature can't be blocked, targeted, dealt damage, enchanted, or equipped by anything red.)\nSacrifice Cerulean Drake: Counter target spell that targets you."
Undead Servant,4.0,['Black'],['B'],None,['Creature'],['Zombie'],Common,M20,3,2,None,"When Undead Servant enters the battlefield, create a 2/2 black Zombie creature token for each card named Undead Servant in your graveyard."
Thought Distortion,6.0,['Black'],['B'],None,['Sorcery'],None,Uncommon,M20,None,None,None,"This spell can't be countered.\nTarget opponent reveals their hand. Exile all noncreature, nonland cards from that player's hand and graveyard."
Cavalier of Gales,5.0,['Blue'],['U'],None,['Creature'],"['Elemental', 'Knight']",Mythic,M20,5,5,None,"Flying\nWhen Cavalier of Gales enters the battlefield, draw three cards, then put two cards from your hand on top of your library in any order.\nWhen Cavalier of Gales dies, shuffle it into its owner's library, then scry 2."
Gorging Vulture,3.0,['Black'],['B'],None,['Creature'],['Bird'],Common,M20,2,2,None,"Flying\nWhen Gorging Vulture enters the battlefield, mill four cards. You gain 1 life for each creature card put into your graveyard this way."
Captivating Gyre,6.0,['Blue'],['U'],None,['Sorcery'],None,Uncommon,M20,None,None,None,Return up to three target creatures to their owners' hands.
Scheming Symmetry,1.0,['Black'],['B'],None,['Sorcery'],None,Rare,M20,None,None,None,"Choose two target players. Each of them searches their library for a card, then shuffles and puts that card on top."
Brineborn Cutthroat,2.0,['Blue'],['U'],None,['Creature'],"['Merfolk', 'Pirate']",Uncommon,M20,2,1,None,"Flash (You may cast this spell any time you could cast an instant.)\nWhenever you cast a spell during an opponent's turn, put a +1/+1 counter on Brineborn Cutthroat."
"Sorin, Imperious Bloodlord",3.0,['Black'],['B'],['Legendary'],['Planeswalker'],['Sorin'],Mythic,M20,None,None,4,"[+1]: Target creature you control gains deathtouch and lifelink until end of turn. If it's a Vampire, put a +1/+1 counter on it.\n[+1]: You may sacrifice a Vampire. When you do, Sorin, Imperious Bloodlord deals 3 damage to any target and you gain 3 life.\n[−3]: You may put a Vampire creature card from your hand onto the battlefield."
Boreal Elemental,5.0,['Blue'],['U'],None,['Creature'],['Elemental'],Common,M20,3,4,None,Flying\nSpells your opponents cast that target Boreal Elemental cost {2} more to cast.
Bone to Ash,4.0,['Blue'],['U'],None,['Instant'],None,Common,M20,None,None,None,Counter target creature spell.\nDraw a card.
Soul Salvage,3.0,['Black'],['B'],None,['Sorcery'],None,Common,M20,None,None,None,Return up to two target creature cards from your graveyard to your hand.
Befuddle,3.0,['Blue'],['U'],None,['Instant'],None,Common,M20,None,None,None,Target creature gets -4/-0 until end of turn.\nDraw a card.
Sorcerer of the Fang,2.0,['Black'],['B'],None,['Creature'],"['Human', 'Wizard']",Common,M20,1,3,None,"{5}{B}, {T}: Sorcerer of the Fang deals 2 damage to target opponent or planeswalker."
"Atemsis, All-Seeing",6.0,['Blue'],['U'],['Legendary'],['Creature'],['Sphinx'],Rare,M20,4,5,None,"Flying\n{2}{U}, {T}: Draw two cards, then discard a card.\nWhenever Atemsis, All-Seeing deals damage to an opponent, you may reveal your hand. If cards with at least six different mana values are revealed this way, that player loses the game."
Sanitarium Skeleton,1.0,['Black'],['B'],None,['Creature'],['Skeleton'],Common,M20,1,2,None,{2}{B}: Return Sanitarium Skeleton from your graveyard to your hand.
Anticipate,2.0,['Blue'],['U'],None,['Instant'],None,Common,M20,None,None,None,Look at the top three cards of your library. Put one of them into your hand and the rest on the bottom of your library in any order.
Rotting Regisaur,3.0,['Black'],['B'],None,['Creature'],"['Zombie', 'Dinosaur']",Rare,M20,7,6,None,"At the beginning of your upkeep, discard a card."
Air Elemental,5.0,['Blue'],['U'],None,['Creature'],['Elemental'],Uncommon,M20,4,4,None,Flying
Noxious Grasp,2.0,['Black'],['B'],None,['Instant'],None,Uncommon,M20,None,None,None,Destroy target creature or planeswalker that's green or white. You gain 1 life.
Agent of Treachery,7.0,['Blue'],['U'],None,['Creature'],"['Human', 'Rogue']",Rare,M20,2,3,None,"When Agent of Treachery enters the battlefield, gain control of target permanent.\nAt the beginning of your end step, if you control three or more permanents you don't own, draw three cards."
Leyline of the Void,4.0,['Black'],['B'],None,['Enchantment'],None,Rare,M20,None,None,None,"If Leyline of the Void is in your opening hand, you may begin the game with it on the battlefield.\nIf a card would be put into an opponent's graveyard from anywhere, exile it instead."
Aether Gust,2.0,['Blue'],['U'],None,['Instant'],None,Uncommon,M20,None,None,None,Choose target spell or permanent that's red or green. Its owner puts it on the top or bottom of their library.
Murder,3.0,['Black'],['B'],None,['Instant'],None,Common,M20,None,None,None,Destroy target creature.
Yoked Ox,1.0,['White'],['W'],None,['Creature'],['Ox'],Common,M20,0,4,None,None
Mind Rot,3.0,['Black'],['B'],None,['Sorcery'],None,Common,M20,None,None,None,Target player discards two cards.
Steadfast Sentry,3.0,['White'],['W'],None,['Creature'],"['Human', 'Soldier']",Common,M20,3,2,None,"Vigilance (Attacking doesn't cause this creature to tap.)\nWhen Steadfast Sentry dies, put a +1/+1 counter on target creature you control."
Gravedigger,4.0,['Black'],['B'],None,['Creature'],['Zombie'],Uncommon,M20,2,2,None,"When Gravedigger enters the battlefield, you may return target creature card from your graveyard to your hand."
Starfield Mystic,2.0,['White'],['W'],None,['Creature'],"['Human', 'Cleric']",Rare,M20,2,2,None,"Enchantment spells you cast cost {1} less to cast.\nWhenever an enchantment you control is put into a graveyard from the battlefield, put a +1/+1 counter on Starfield Mystic."
Feral Abomination,6.0,['Black'],['B'],None,['Creature'],['Thrull'],Common,M20,5,5,None,Deathtouch (Any amount of damage this deals to a creature is enough to destroy it.)
Squad Captain,5.0,['White'],['W'],None,['Creature'],"['Human', 'Soldier']",Common,M20,2,2,None,Vigilance\nSquad Captain enters the battlefield with a +1/+1 counter on it for each other creature you control.
Legion's End,2.0,['Black'],['B'],None,['Sorcery'],None,Rare,M20,None,None,None,Exile target creature an opponent controls with mana value 2 or less and all other creatures that player controls with the same name as that creature. Then that player reveals their hand and exiles all cards with that name from their hand and graveyard.
Soulmender,1.0,['White'],['W'],None,['Creature'],"['Human', 'Cleric']",Common,M20,1,1,None,{T}: You gain 1 life.
Knight of the Ebon Legion,1.0,['Black'],['B'],None,['Creature'],"['Vampire', 'Knight']",Rare,M20,1,2,None,"{2}{B}: Knight of the Ebon Legion gets +3/+3 and gains deathtouch until end of turn.\nAt the beginning of your end step, if a player lost 4 or more life this turn, put a +1/+1 counter on Knight of the Ebon Legion. (Damage causes loss of life.)"
"Sephara, Sky's Blade",7.0,['White'],['W'],['Legendary'],['Creature'],['Angel'],Rare,M20,7,7,None,"You may pay {W} and tap four untapped creatures you control with flying rather than pay this spell's mana cost.\nFlying, lifelink\nOther creatures you control with flying have indestructible. (Damage and effects that say ""destroy"" don't destroy them.)"
Gruesome Scourger,5.0,['Black'],['B'],None,['Creature'],"['Orc', 'Warrior']",Uncommon,M20,3,3,None,"When Gruesome Scourger enters the battlefield, it deals damage to target opponent or planeswalker equal to the number of creatures you control."
Rule of Law,3.0,['White'],['W'],None,['Enchantment'],None,Uncommon,M20,None,None,None,Each player can't cast more than one spell each turn.
Fathom Fleet Cutthroat,4.0,['Black'],['B'],None,['Creature'],"['Human', 'Pirate']",Common,M20,3,3,None,"When Fathom Fleet Cutthroat enters the battlefield, destroy target creature an opponent controls that was dealt damage this turn."
Raise the Alarm,2.0,['White'],['W'],None,['Instant'],None,Common,M20,None,None,None,Create two 1/1 white Soldier creature tokens.
Epicure of Blood,5.0,['Black'],['B'],None,['Creature'],['Vampire'],Common,M20,4,4,None,"Whenever you gain life, each opponent loses 1 life."
Planar Cleansing,6.0,['White'],['W'],None,['Sorcery'],None,Rare,M20,None,None,None,Destroy all nonland permanents.
Embodiment of Agonies,3.0,['Black'],['B'],None,['Creature'],['Demon'],Rare,M20,0,0,None,"Flying, deathtouch\nEmbodiment of Agonies enters the battlefield with a +1/+1 counter on it for each different mana cost among nonland cards in your graveyard. (For example, {2}{B} and {1}{B}{B} are different mana costs.)"
Pacifism,2.0,['White'],['W'],None,['Enchantment'],['Aura'],Common,M20,None,None,None,Enchant creature\nEnchanted creature can't attack or block.
Duress,1.0,['Black'],['B'],None,['Sorcery'],None,Common,M20,None,None,None,"Target opponent reveals their hand. You choose a noncreature, nonland card from it. That player discards that card."
Moorland Inquisitor,2.0,['White'],['W'],None,['Creature'],"['Human', 'Soldier']",Common,M20,2,2,None,{2}{W}: Moorland Inquisitor gains first strike until end of turn. (It deals combat damage before creatures without first strike.)
Dread Presence,4.0,['Black'],['B'],None,['Creature'],['Nightmare'],Rare,M20,3,3,None,"Whenever a Swamp enters the battlefield under your control, choose one —\n• You draw a card and you lose 1 life.\n• Dread Presence deals 2 damage to any target and you gain 2 life."
Moment of Heroism,2.0,['White'],['W'],None,['Instant'],None,Common,M20,None,None,None,Target creature gets +2/+2 and gains lifelink until end of turn. (Damage dealt by the creature also causes its controller to gain that much life.)
Disfigure,1.0,['Black'],['B'],None,['Instant'],None,Uncommon,M20,None,None,None,Target creature gets -2/-2 until end of turn.
Master Splicer,4.0,['White'],['W'],None,['Creature'],"['Phyrexian', 'Human', 'Artificer']",Uncommon,M20,1,1,None,"When Master Splicer enters the battlefield, create a 3/3 colorless Phyrexian Golem artifact creature token.\nGolems you control get +1/+1."
