Name,CMC,Colors,Color identity,Supertypes,Types,Subtypes,Rarity,Set,Power,Toughness,Loyalty,Text
Cavalier of Night,5.0,['Black'],['B'],None,['Creature'],"['Elemental', 'Knight']",Mythic,M20,4,5,None,"Lifelink\nWhen Cavalier of Night enters the battlefield, you may sacrifice another creature. When you do, destroy target creature an opponent controls.\nWhen Cavalier of Night dies, return target creature card with mana value 3 or less from your graveyard to the battlefield."
Loyal Pegasus,1.0,['White'],['W'],None,['Creature'],['Pegasus'],Uncommon,M20,2,1,None,Flying\nLoyal Pegasus can't attack or block alone.
Boneclad Necromancer,5.0,['Black'],['B'],None,['Creature'],"['Human', 'Wizard']",Common,M20,3,3,None,"When Boneclad Necromancer enters the battlefield, you may exile target creature card from a graveyard. If you do, create a 2/2 black Zombie creature token."
Loxodon Lifechanter,6.0,['White'],['W'],None,['Creature'],"['Elephant', 'Cleric']",Rare,M20,4,6,None,"When Loxodon Lifechanter enters the battlefield, you may have your life total become the total toughness of creatures you control.\n{5}{W}: Loxodon Lifechanter gets +X/+X until end of turn, where X is your life total."
Bone Splinters,1.0,['Black'],['B'],None,['Sorcery'],None,Common,M20,None,None,None,"As an additional cost to cast this spell, sacrifice a creature.\nDestroy target creature."
Leyline of Sanctity,4.0,['White'],['W'],None,['Enchantment'],None,Rare,M20,None,None,None,"If Leyline of Sanctity is in your opening hand, you may begin the game with it on the battlefield.\nYou have hexproof. (You can't be the target of spells or abilities your opponents control.)"
Bloodthirsty Aerialist,3.0,['Black'],['B'],None,['Creature'],"['Vampire', 'Rogue']",Uncommon,M20,2,3,None,"Flying\nWhenever you gain life, put a +1/+1 counter on Bloodthirsty Aerialist."
Inspiring Captain,4.0,['White'],['W'],None,['Creature'],"['Human', 'Knight']",Common,M20,3,3,None,"When Inspiring Captain enters the battlefield, creatures you control get +1/+1 until end of turn."
Bloodsoaked Altar,6.0,['Black'],['B'],None,['Artifact'],None,Uncommon,M20,None,None,None,"{T}, Pay 2 life, Discard a card, Sacrifice a creature: Create a 5/5 black Demon creature token with flying. Activate only as a sorcery."
Inspired Charge,4.0,['White'],['W'],None,['Instant'],None,Common,M20,None,None,None,Creatures you control get +2/+1 until end of turn.
Blood for Bones,4.0,['Black'],['B'],None,['Sorcery'],None,Uncommon,M20,None,None,None,"As an additional cost to cast this spell, sacrifice a creature.\nReturn a creature card from your graveyard to the battlefield, then return another creature card from your graveyard to your hand."
Herald of the Sun,6.0,['White'],['W'],None,['Creature'],['Angel'],Uncommon,M20,4,4,None,Flying\n{3}{W}: Put a +1/+1 counter on another target creature with flying.
Blood Burglar,2.0,['Black'],['B'],None,['Creature'],"['Vampire', 'Rogue']",Common,M20,2,2,None,"As long as it's your turn, Blood Burglar has lifelink. (Damage dealt by this creature also causes you to gain that much life.)"
Hanged Executioner,3.0,['White'],['W'],None,['Creature'],['Spirit'],Rare,M20,1,1,None,"Flying\nWhen Hanged Executioner enters the battlefield, create a 1/1 white Spirit creature token with flying.\n{3}{W}, Exile Hanged Executioner: Exile target creature."
Blightbeetle,2.0,['Black'],['B'],None,['Creature'],['Insect'],Uncommon,M20,1,1,None,"Protection from green (This creature can't be blocked, targeted, dealt damage, enchanted, or equipped by anything green.)\nCreatures your opponents control can't have +1/+1 counters put on them."
Griffin Sentinel,3.0,['White'],['W'],None,['Creature'],['Griffin'],Common,M20,1,3,None,Flying\nVigilance (Attacking doesn't cause this creature to tap.)
Bladebrand,2.0,['Black'],['B'],None,['Instant'],None,Common,M20,None,None,None,Target creature gains deathtouch until end of turn.\nDraw a card.
Griffin Protector,4.0,['White'],['W'],None,['Creature'],['Griffin'],Common,M20,2,3,None,"Flying\nWhenever another creature enters the battlefield under your control, Griffin Protector gets +1/+1 until end of turn."
Barony Vampire,3.0,['Black'],['B'],None,['Creature'],['Vampire'],Common,M20,3,2,None,None
Gods Willing,1.0,['White'],['W'],None,['Instant'],None,Uncommon,M20,None,None,None,"Target creature you control gains protection from the color of your choice until end of turn. (It can't be blocked, targeted, dealt damage, enchanted, or equipped by anything of that color.)\nScry 1."
Audacious Thief,3.0,['Black'],['B'],None,['Creature'],"['Human', 'Rogue']",Common,M20,2,2,None,"Whenever Audacious Thief attacks, you draw a card and you lose 1 life."
Glaring Aegis,1.0,['White'],['W'],None,['Enchantment'],['Aura'],Common,M20,None,None,None,"Enchant creature\nWhen Glaring Aegis enters the battlefield, tap target creature an opponent controls.\nEnchanted creature gets +1/+3."
Agonizing Syphon,4.0,['Black'],['B'],None,['Sorcery'],None,Common,M20,None,None,None,Agonizing Syphon deals 3 damage to any target and you gain 3 life.
Gauntlets of Light,3.0,['White'],['W'],None,['Enchantment'],['Aura'],Uncommon,M20,None,None,None,"Enchant creature\nEnchanted creature gets +0/+2 and assigns combat damage equal to its toughness rather than its power.\nEnchanted creature has ""{2}{W}: Untap this creature."""
Zephyr Charge,2.0,['Blue'],['U'],None,['Enchantment'],None,Common,M20,None,None,None,{1}{U}: Target creature gains flying until end of turn.
"Ajani, Strength of the Pride",4.0,['White'],['W'],['Legendary'],['Planeswalker'],['Ajani'],Mythic,M20,None,None,5,"[+1]: You gain life equal to the number of creatures you control plus the number of planeswalkers you control.\n[−2]: Create a 2/2 white Cat Soldier creature token named Ajani's Pridemate with ""Whenever you gain life, put a +1/+1 counter on Ajani's Pridemate.""\n[0]: If you have at least 15 life more than your starting life total, exile Ajani, Strength of the Pride and each artifact and creature your opponents control."
Yarok's Wavecrasher,4.0,['Blue'],['U'],None,['Creature'],['Elemental'],Uncommon,M20,4,4,None,"When Yarok's Wavecrasher enters the battlefield, return another creature you control to its owner's hand."
Devout Decree,2.0,['White'],['W'],None,['Sorcery'],None,Uncommon,M20,None,None,None,Exile target creature or planeswalker that's black or red. Scry 1. (Look at the top card of your library. You may put that card on the bottom of your library.)
Winged Words,3.0,['Blue'],['U'],None,['Sorcery'],None,Common,M20,None,None,None,This spell costs {1} less to cast if you control a creature with flying.\nDraw two cards.
Eternal Isolation,2.0,['White'],['W'],None,['Sorcery'],None,Uncommon,M20,None,None,None,Put target creature with power 4 or greater on the bottom of its owner's library.
Warden of Evos Isle,3.0,['Blue'],['U'],None,['Creature'],"['Bird', 'Wizard']",Uncommon,M20,2,2,None,Flying\nCreature spells with flying you cast cost {1} less to cast.
Fencing Ace,2.0,['White'],['W'],None,['Creature'],"['Human', 'Soldier']",Uncommon,M20,1,1,None,Double strike
Unsummon,1.0,['Blue'],['U'],None,['Instant'],None,Common,M20,None,None,None,Return target creature to its owner's hand.
Disenchant,2.0,['White'],['W'],None,['Instant'],None,Common,M20,None,None,None,Destroy target artifact or enchantment.
Tale's End,2.0,['Blue'],['U'],None,['Instant'],None,Rare,M20,None,None,None,"Counter target activated ability, triggered ability, or legendary spell."
Daybreak Chaplain,2.0,['White'],['W'],None,['Creature'],"['Human', 'Cleric']",Common,M20,1,3,None,Lifelink (Damage dealt by this creature also causes you to gain that much life.)
Spectral Sailor,1.0,['Blue'],['U'],None,['Creature'],"['Spirit', 'Pirate']",Uncommon,M20,1,1,None,Flash (You may cast this spell any time you could cast an instant.)\nFlying\n{3}{U}: Draw a card.
Dawning Angel,5.0,['White'],['W'],None,['Creature'],['Angel'],Common,M20,3,2,None,"Flying\nWhen Dawning Angel enters the battlefield, you gain 4 life."
Sleep Paralysis,4.0,['Blue'],['U'],None,['Enchantment'],['Aura'],Common,M20,None,None,None,"Enchant creature\nWhen Sleep Paralysis enters the battlefield, tap enchanted creature.\nEnchanted creature doesn't untap during its controller's untap step."
Cavalier of Dawn,5.0,['White'],['W'],None,['Creature'],"['Elemental', 'Knight']",Mythic,M20,4,6,None,"Vigilance\nWhen Cavalier of Dawn enters the battlefield, destroy up to one target nonland permanent. Its controller creates a 3/3 colorless Golem artifact creature token.\nWhen Cavalier of Dawn dies, return target artifact or enchantment card from your graveyard to your hand."
Scholar of the Ages,7.0,['Blue'],['U'],None,['Creature'],"['Human', 'Wizard']",Uncommon,M20,3,3,None,"When Scholar of the Ages enters the battlefield, return up to two target instant and/or sorcery cards from your graveyard to your hand."
Battalion Foot Soldier,3.0,['White'],['W'],None,['Creature'],"['Human', 'Soldier']",Common,M20,2,2,None,"When Battalion Foot Soldier enters the battlefield, you may search your library for any number of cards named Battalion Foot Soldier, reveal them, put them into your hand, then shuffle."
Sage's Row Denizen,3.0,['Blue'],['U'],None,['Creature'],"['Vedalken', 'Wizard']",Common,M20,2,3,None,"Whenever another blue creature enters the battlefield under your control, target player mills two cards."
Brought Back,2.0,['White'],['W'],None,['Instant'],None,Rare,M20,None,None,None,Choose up to two target permanent cards in your graveyard that were put there from the battlefield this turn. Return them to the battlefield tapped.
Renowned Weaponsmith,2.0,['Blue'],['U'],None,['Creature'],"['Human', 'Artificer']",Uncommon,M20,1,3,None,"{T}: Add {C}{C}. Spend this mana only to cast artifact spells or activate abilities of artifacts.\n{U}, {T}: Search your library for a card named Heart-Piercer Bow or Vial of Dragonfire, reveal it, put it into your hand, then shuffle."
Portal of Sanctuary,3.0,['Blue'],['U'],None,['Artifact'],None,Uncommon,M20,None,None,None,"{1}, {T}: Return target creature you control and each Aura attached to it to their owners' hands. Activate only during your turn."
Bishop of Wings,2.0,['White'],['W'],None,['Creature'],"['Human', 'Cleric']",Rare,M20,1,4,None,"Whenever an Angel enters the battlefield under your control, you gain 4 life.\nWhenever an Angel you control dies, create a 1/1 white Spirit creature token with flying."
Octoprophet,4.0,['Blue'],['U'],None,['Creature'],['Octopus'],Common,M20,3,3,None,"When Octoprophet enters the battlefield, scry 2. (Look at the top two cards of your library, then put any number of them on the bottom of your library and the rest on top in any order.)"
Ancestral Blade,2.0,['White'],['W'],None,['Artifact'],['Equipment'],Uncommon,M20,None,None,None,"When Ancestral Blade enters the battlefield, create a 1/1 white Soldier creature token, then attach Ancestral Blade to it.\nEquipped creature gets +1/+1.\nEquip {1} ({1}: Attach to target creature you control. Equip only as a sorcery.)"
Negate,2.0,['Blue'],['U'],None,['Instant'],None,Common,M20,None,None,None,Counter target noncreature spell.
Aerial Assault,3.0,['White'],['W'],None,['Sorcery'],None,Common,M20,None,None,None,Destroy target tapped creature. You gain 1 life for each creature you control with flying.
"Mu Yanling, Sky Dancer",3.0,['Blue'],['U'],['Legendary'],['Planeswalker'],['Yanling'],Mythic,M20,None,None,2,"[+2]: Until your next turn, up to one target creature gets -2/-0 and loses flying.\n[−3]: Create a 4/4 blue Elemental Bird creature token with flying.\n[−8]: You get an emblem with ""Islands you control have '{T}: Draw a card.'"""
Apostle of Purifying Light,2.0,['White'],['W'],None,['Creature'],"['Human', 'Cleric']",Uncommon,M20,2,1,None,"Protection from black (This creature can't be blocked, targeted, dealt damage, enchanted, or equipped by anything black.)\n{2}: Exile target card from a graveyard."
Moat Piranhas,2.0,['Blue'],['U'],None,['Creature'],['Fish'],Common,M20,3,3,None,Defender (This creature can't attack.)
Angelic Gift,2.0,['White'],['W'],None,['Enchantment'],['Aura'],Common,M20,None,None,None,"Enchant creature\nWhen Angelic Gift enters the battlefield, draw a card.\nEnchanted creature has flying."
Metropolis Sprite,2.0,['Blue'],['U'],None,['Creature'],"['Faerie', 'Rogue']",Common,M20,1,2,None,Flying\n{U}: Metropolis Sprite gets +1/-1 until end of turn.
Angel of Vitality,3.0,['White'],['W'],None,['Creature'],['Angel'],Uncommon,M20,2,2,None,"Flying\nIf you would gain life, you gain that much life plus 1 instead.\nAngel of Vitality gets +2/+2 as long as you have 25 or more life."
Masterful Replication,6.0,['Blue'],['U'],None,['Instant'],None,Rare,M20,None,None,None,Choose one —\n• Create two 3/3 colorless Golem artifact creature tokens.\n• Choose target artifact you control. Each other artifact you control becomes a copy of that artifact until end of turn.
Leyline of Anticipation,4.0,['Blue'],['U'],None,['Enchantment'],None,Rare,M20,None,None,None,"If Leyline of Anticipation is in your opening hand, you may begin the game with it on the battlefield.\nYou may cast spells as though they had flash."
Hard Cover,1.0,['Blue'],['U'],None,['Enchantment'],['Aura'],Uncommon,M20,None,None,None,"Enchant creature\nEnchanted creature gets +0/+2 and has ""{T}: Draw a card, then discard a card."""
Frost Lynx,3.0,['Blue'],['U'],None,['Creature'],"['Elemental', 'Cat']",Common,M20,2,2,None,"When Frost Lynx enters the battlefield, tap target creature an opponent controls. That creature doesn't untap during its controller's next untap step."
Frilled Sea Serpent,6.0,['Blue'],['U'],None,['Creature'],['Serpent'],Common,M20,4,6,None,{5}{U}{U}: Frilled Sea Serpent can't be blocked this turn.
Fortress Crab,4.0,['Blue'],['U'],None,['Creature'],['Crab'],Common,M20,1,6,None,None
Flood of Tears,6.0,['Blue'],['U'],None,['Sorcery'],None,Rare,M20,None,None,None,"Return all nonland permanents to their owners' hands. If you return four or more nontoken permanents you control this way, you may put a permanent card from your hand onto the battlefield."
Faerie Miscreant,1.0,['Blue'],['U'],None,['Creature'],"['Faerie', 'Rogue']",Common,M20,1,1,None,"Flying\nWhen Faerie Miscreant enters the battlefield, if you control another creature named Faerie Miscreant, draw a card."
Flame Sweep,3.0,['Red'],['R'],None,['Instant'],None,Uncommon,M20,None,None,None,Flame Sweep deals 2 damage to each creature except for creatures you control with flying.
Dungeon Geists,4.0,['Blue'],['U'],None,['Creature'],['Spirit'],Rare,M20,3,3,None,"Flying\nWhen Dungeon Geists enters the battlefield, tap target creature an opponent controls. That creature doesn't untap during its controller's untap step for as long as you control Dungeon Geists."
Fire Elemental,5.0,['Red'],['R'],None,['Creature'],['Elemental'],Common,M20,5,4,None,None
Drawn from Dreams,4.0,['Blue'],['U'],None,['Sorcery'],None,Rare,M20,None,None,None,Look at the top seven cards of your library. Put two of them into your hand and the rest on the bottom of your library in a random order.
Daggersail Aeronaut,4.0,['Red'],['R'],None,['Creature'],['Goblin'],Common,M20,3,2,None,"As long as it's your turn, Daggersail Aeronaut has flying."
Convolute,3.0,['Blue'],['U'],None,['Instant'],None,Common,M20,None,None,None,Counter target spell unless its controller pays {4}.
"Rienne, Angel of Rebirth",5.0,"['Green', 'Red', 'White']","['G', 'R', 'W']",['Legendary'],['Creature'],['Angel'],Mythic,M20,5,4,None,"Flying\nOther multicolored creatures you control get +1/+0.\nWhenever another multicolored creature you control dies, return it to its owner's hand at the beginning of the next end step."
Forest,0.0,None,['G'],['Basic'],['Land'],['Forest'],Common,M20,None,None,None,({T}: Add {G}.)
Forest,0.0,None,['G'],['Basic'],['Land'],['Forest'],Common,M20,None,None,None,({T}: Add {G}.)
Forest,0.0,None,['G'],['Basic'],['Land'],['Forest'],Common,M20,None,None,None,({T}: Add {G}.)
Forest,0.0,None,['G'],['Basic'],['Land'],['Forest'],Common,M20,None,None,None,({T}: Add {G}.)
Mountain,0.0,None,['R'],['Basic'],['Land'],['Mountain'],Common,M20,None,None,None,({T}: Add {R}.)
Mountain,0.0,None,['R'],['Basic'],['Land'],['Mountain'],Common,M20,None,None,None,({T}: Add {R}.)
Mountain,0.0,None,['R'],['Basic'],['Land'],['Mountain'],Common,M20,None,None,None,({T}: Add {R}.)
Mountain,0.0,None,['R'],['Basic'],['Land'],['Mountain'],Common,M20,None,None,None,({T}: Add {R}.)
Swamp,0.0,None,['B'],['Basic'],['Land'],['Swamp'],Common,M20,None,None,None,({T}: Add {B}.)
Swamp,0.0,None,['B'],['Basic'],['Land'],['Swamp'],Common,M20,None,None,None,({T}: Add {B}.)
Swamp,0.0,None,['B'],['Basic'],['Land'],['Swamp'],Common,M20,None,None,None,({T}: Add {B}.)
Swamp,0.0,None,['B'],['Basic'],['Land'],['Swamp'],Common,M20,None,None,None,({T}: Add {B}.)
Island,0.0,None,['U'],['Basic'],['Land'],['Island'],Common,M20,None,None,None,({T}: Add {U}.)
Island,0.0,None,['U'],['Basic'],['Land'],['Island'],Common,M20,None,None,None,({T}: Add {U}.)
Island,0.0,None,['U'],['Basic'],['Land'],['Island'],Common,M20,None,None,None,({T}: Add {U}.)
Island,0.0,None,['U'],['Basic'],['Land'],['Island'],Common,M20,None,None,None,({T}: Add {U}.)
Plains,0.0,None,['W'],['Basic'],['Land'],['Plains'],Common,M20,None,None,None,({T}: Add {W}.)
Plains,0.0,None,['W'],['Basic'],['Land'],['Plains'],Common,M20,None,None,None,({T}: Add {W}.)
Plains,0.0,None,['W'],['Basic'],['Land'],['Plains'],Common,M20,None,None,None,({T}: Add {W}.)
Plains,0.0,None,['W'],['Basic'],['Land'],['Plains'],Common,M20,None,None,None,({T}: Add {W}.)
Wind-Scarred Crag,0.0,None,"['R', 'W']",None,['Land'],None,Common,M20,None,None,None,"Wind-Scarred Crag enters the battlefield tapped.\nWhen Wind-Scarred Crag enters the battlefield, you gain 1 life.\n{T}: Add {R} or {W}."
Tranquil Cove,0.0,None,"['U', 'W']",None,['Land'],None,Common,M20,None,None,None,"Tranquil Cove enters the battlefield tapped.\nWhen Tranquil Cove enters the battlefield, you gain 1 life.\n{T}: Add {W} or {U}."
Thornwood Falls,0.0,None,"['G', 'U']",None,['Land'],None,Common,M20,None,None,None,"Thornwood Falls enters the battlefield tapped.\nWhen Thornwood Falls enters the battlefield, you gain 1 life.\n{T}: Add {G} or {U}."
Temple of Triumph,0.0,None,"['R', 'W']",None,['Land'],None,Rare,M20,None,None,None,"Temple of Triumph enters the battlefield tapped.\nWhen Temple of Triumph enters the battlefield, scry 1.\n{T}: Add {R} or {W}."
Temple of Silence,0.0,None,"['B', 'W']",None,['Land'],None,Rare,M20,None,None,None,"Temple of Silence enters the battlefield tapped.\nWhen Temple of Silence enters the battlefield, scry 1.\n{T}: Add {W} or {B}."
Temple of Mystery,0.0,None,"['G', 'U']",None,['Land'],None,Rare,M20,None,None,None,"Temple of Mystery enters the battlefield tapped.\nWhen Temple of Mystery enters the battlefield, scry 1.\n{T}: Add {G} or {U}."
Temple of Malady,0.0,None,"['B', 'G']",None,['Land'],None,Rare,M20,None,None,None,"Temple of Malady enters the battlefield tapped.\nWhen Temple of Malady enters the battlefield, scry 1.\n{T}: Add {B} or {G}."
Temple of Epiphany,0.0,None,"['R', 'U']",None,['Land'],None,Rare,M20,None,None,None,"Temple of Epiphany enters the battlefield tapped.\nWhen Temple of Epiphany enters the battlefield, scry 1.\n{T}: Add {U} or {R}."
Swiftwater Cliffs,0.0,None,"['R', 'U']",None,['Land'],None,Common,M20,None,None,None,"Swiftwater Cliffs enters the battlefield tapped.\nWhen Swiftwater Cliffs enters the battlefield, you gain 1 life.\n{T}: Add {U} or {R}."
Scoured Barrens,0.0,None,"['B', 'W']",None,['Land'],None,Common,M20,None,None,None,"Scoured Barrens enters the battlefield tapped.\nWhen Scoured Barrens enters the battlefield, you gain 1 life.\n{T}: Add {W} or {B}."
Rugged Highlands,0.0,None,"['G', 'R']",None,['Land'],None,Common,M20,None,None,None,"Rugged Highlands enters the battlefield tapped.\nWhen Rugged Highlands enters the battlefield, you gain 1 life.\n{T}: Add {R} or {G}."
Lotus Field,0.0,None,None,None,['Land'],None,Rare,M20,None,None,None,"Hexproof\nLotus Field enters the battlefield tapped.\nWhen Lotus Field enters the battlefield, sacrifice two lands.\n{T}: Add three mana of any one color."
Jungle Hollow,0.0,None,"['B', 'G']",None,['Land'],None,Common,M20,None,None,None,"Jungle Hollow enters the battlefield tapped.\nWhen Jungle Hollow enters the battlefield, you gain 1 life.\n{T}: Add {B} or {G}."
Field of the Dead,0.0,None,None,None,['Land'],None,Rare,M20,None,None,None,"Field of the Dead enters the battlefield tapped.\n{T}: Add {C}.\nWhenever Field of the Dead or another land enters the battlefield under your control, if you control seven or more lands with different names, create a 2/2 black Zombie creature token."
Evolving Wilds,0.0,None,None,None,['Land'],None,Common,M20,None,None,None,"{T}, Sacrifice Evolving Wilds: Search your library for a basic land card, put it onto the battlefield tapped, then shuffle."
Dismal Backwater,0.0,None,"['B', 'U']",None,['Land'],None,Common,M20,None,None,None,"Dismal Backwater enters the battlefield tapped.\nWhen Dismal Backwater enters the battlefield, you gain 1 life.\n{T}: Add {U} or {B}."
Cryptic Caves,0.0,None,None,None,['Land'],None,Uncommon,M20,None,None,None,"{T}: Add {C}.\n{1}, {T}, Sacrifice Cryptic Caves: Draw a card. Activate only if you control five or more lands."
Blossoming Sands,0.0,None,"['G', 'W']",None,['Land'],None,Common,M20,None,None,None,"Blossoming Sands enters the battlefield tapped.\nWhen Blossoming Sands enters the battlefield, you gain 1 life.\n{T}: Add {G} or {W}."
Bloodfell Caves,0.0,None,"['B', 'R']",None,['Land'],None,Common,M20,None,None,None,"Bloodfell Caves enters the battlefield tapped.\nWhen Bloodfell Caves enters the battlefield, you gain 1 life.\n{T}: Add {B} or {R}."
Vial of Dragonfire,2.0,None,None,None,['Artifact'],None,Common,M20,None,None,None,"{2}, {T}, Sacrifice Vial of Dragonfire: It deals 2 damage to target creature."
Stone Golem,5.0,None,None,None,"['Artifact', 'Creature']",['Golem'],Common,M20,4,4,None,None
Steel Overseer,2.0,None,None,None,"['Artifact', 'Creature']",['Construct'],Rare,M20,1,1,None,{T}: Put a +1/+1 counter on each artifact creature you control.
Scuttlemutt,3.0,None,None,None,"['Artifact', 'Creature']",['Scarecrow'],Uncommon,M20,2,2,None,{T}: Add one mana of any color.\n{T}: Target creature becomes the color or colors of your choice until end of turn.
Salvager of Ruin,3.0,None,None,None,"['Artifact', 'Creature']",['Construct'],Uncommon,M20,2,1,None,Sacrifice Salvager of Ruin: Choose target permanent card in your graveyard that was put there from the battlefield this turn. Return it to your hand.
Retributive Wand,3.0,None,None,None,['Artifact'],None,Uncommon,M20,None,None,None,"{3}, {T}: Retributive Wand deals 1 damage to any target.\nWhen Retributive Wand is put into a graveyard from the battlefield, it deals 5 damage to any target."
Prismite,2.0,None,None,None,"['Artifact', 'Creature']",['Golem'],Common,M20,2,1,None,{2}: Add one mana of any color.
Pattern Matcher,4.0,None,None,None,"['Artifact', 'Creature']",['Golem'],Uncommon,M20,3,3,None,"When Pattern Matcher enters the battlefield, you may search your library for a card with the same name as another creature you control, reveal it, put it into your hand, then shuffle."
Mystic Forge,4.0,None,None,None,['Artifact'],None,Rare,M20,None,None,None,"You may look at the top card of your library any time.\nYou may cast artifact spells and colorless spells from the top of your library.\n{T}, Pay 1 life: Exile the top card of your library."
Meteor Golem,7.0,None,None,None,"['Artifact', 'Creature']",['Golem'],Uncommon,M20,3,3,None,"When Meteor Golem enters the battlefield, destroy target nonland permanent an opponent controls."
Marauder's Axe,2.0,None,None,None,['Artifact'],['Equipment'],Common,M20,None,None,None,Equipped creature gets +2/+0.\nEquip {2} ({2}: Attach to target creature you control. Equip only as a sorcery.)
Manifold Key,1.0,None,None,None,['Artifact'],None,Uncommon,M20,None,None,None,"{1}, {T}: Untap another target artifact.\n{3}, {T}: Target creature can't be blocked this turn."
Icon of Ancestry,3.0,None,None,None,['Artifact'],None,Rare,M20,None,None,None,"As Icon of Ancestry enters the battlefield, choose a creature type.\nCreatures you control of the chosen type get +1/+1.\n{3}, {T}: Look at the top three cards of your library. You may reveal a creature card of the chosen type from among them and put it into your hand. Put the rest on the bottom of your library in a random order."
Heart-Piercer Bow,2.0,None,None,None,['Artifact'],['Equipment'],Common,M20,None,None,None,"Whenever equipped creature attacks, Heart-Piercer Bow deals 1 damage to target creature defending player controls.\nEquip {1} ({1}: Attach to target creature you control. Equip only as a sorcery.)"
Grafdigger's Cage,1.0,None,None,None,['Artifact'],None,Rare,M20,None,None,None,Creature cards in graveyards and libraries can't enter the battlefield.\nPlayers can't cast spells from graveyards or libraries.
"Golos, Tireless Pilgrim",5.0,None,"['B', 'G', 'R', 'U', 'W']",['Legendary'],"['Artifact', 'Creature']",['Scout'],Rare,M20,3,5,None,"When Golos, Tireless Pilgrim enters the battlefield, you may search your library for a land card, put that card onto the battlefield tapped, then shuffle.\n{2}{W}{U}{B}{R}{G}: Exile the top three cards of your library. You may play them this turn without paying their mana costs."
Diviner's Lockbox,4.0,None,None,None,['Artifact'],None,Uncommon,M20,None,None,None,"{1}, {T}: Choose a card name, then reveal the top card of your library. If that card has the chosen name, sacrifice Diviner's Lockbox and draw three cards. Activate only as a sorcery."
Diamond Knight,3.0,None,None,None,"['Artifact', 'Creature']",['Knight'],Uncommon,M20,1,1,None,"Vigilance (Attacking doesn't cause this creature to tap.)\nAs Diamond Knight enters the battlefield, choose a color.\nWhenever you cast a spell of the chosen color, put a +1/+1 counter on Diamond Knight."
