Name,CMC,Colors,Color identity,Supertypes,Types,Subtypes,Rarity,Set,Power,Toughness,Loyalty,Text
Colossus Hammer,1.0,None,None,None,['Artifact'],['Equipment'],Uncommon,M20,None,None,None,Equipped creature gets +10/+10 and loses flying.\nEquip {8} ({8}: Attach to target creature you control. Equip only as a sorcery.)
Bag of Holding,1.0,None,None,None,['Artifact'],None,Rare,M20,None,None,None,"Whenever you discard a card, exile that card from your graveyard.\n{2}, {T}: Draw a card, then discard a card.\n{4}, {T}, Sacrifice Bag of Holding: Return all cards exiled with Bag of Holding to their owner's hand."
Anvilwrought Raptor,4.0,None,None,None,"['Artifact', 'Creature']",['Bird'],Common,M20,2,1,None,Flying\nFirst strike (This creature deals combat damage before creatures without first strike.)
"Yarok, the Desecrated",5.0,"['Black', 'Green', 'Blue']","['B', 'G', 'U']",['Legendary'],['Creature'],"['Elemental', 'Horror']",Mythic,M20,3,5,None,"Deathtouch, lifelink\nIf a permanent entering the battlefield causes a triggered ability of a permanent you control to trigger, that ability triggers an additional time."
Tomebound Lich,3.0,"['Black', 'Blue']","['B', 'U']",None,['Creature'],"['Zombie', 'Wizard']",Uncommon,M20,1,3,None,"Deathtouch (Any amount of damage this deals to a creature is enough to destroy it.)\nLifelink (Damage dealt by this creature also causes you to gain that much life.)\nWhenever Tomebound Lich enters the battlefield or deals combat damage to a player, draw a card, then discard a card."
Skyknight Vanguard,2.0,"['Red', 'White']","['R', 'W']",None,['Creature'],"['Human', 'Knight']",Uncommon,M20,1,2,None,"Flying\nWhenever Skyknight Vanguard attacks, create a 1/1 white Soldier creature token that's tapped and attacking."
Risen Reef,3.0,"['Green', 'Blue']","['G', 'U']",None,['Creature'],['Elemental'],Uncommon,M20,1,1,None,"Whenever Risen Reef or another Elemental enters the battlefield under your control, look at the top card of your library. If it's a land card, you may put it onto the battlefield tapped. If you don't put the card onto the battlefield, put it into your hand."
"Omnath, Locus of the Roil",4.0,"['Green', 'Red', 'Blue']","['G', 'R', 'U']",['Legendary'],['Creature'],['Elemental'],Mythic,M20,3,3,None,"When Omnath, Locus of the Roil enters the battlefield, it deals damage to any target equal to the number of Elementals you control.\nWhenever a land enters the battlefield under your control, put a +1/+1 counter on target Elemental you control. If you control eight or more lands, draw a card."
Corpse Knight,2.0,"['Black', 'White']","['B', 'W']",None,['Creature'],"['Zombie', 'Knight']",Uncommon,M20,2,2,None,"Whenever another creature enters the battlefield under your control, each opponent loses 1 life."
"Kykar, Wind's Fury",4.0,"['Red', 'Blue', 'White']","['R', 'U', 'W']",['Legendary'],['Creature'],"['Bird', 'Wizard']",Mythic,M20,3,3,None,"Flying\nWhenever you cast a noncreature spell, create a 1/1 white Spirit creature token with flying.\nSacrifice a Spirit: Add {R}."
Moldervine Reclamation,5.0,"['Black', 'Green']","['B', 'G']",None,['Enchantment'],None,Uncommon,M20,None,None,None,"Whenever a creature you control dies, you gain 1 life and draw a card."
Goldmane Griffin,5.0,['White'],['W'],None,['Creature'],['Griffin'],Rare,M20,3,2,None,"Flying, vigilance\nWhen Goldmane Griffin enters the battlefield, you may search your library and/or graveyard for a card named Ajani, Inspiring Leader, reveal it, and put it into your hand. If you search your library this way, shuffle."
Ironroot Warlord,3.0,"['Green', 'White']","['G', 'W']",None,['Creature'],"['Treefolk', 'Soldier']",Uncommon,M20,*,5,None,Ironroot Warlord's power is equal to the number of creatures you control.\n{3}{G}{W}: Create a 1/1 white Soldier creature token.
Empyrean Eagle,3.0,"['Blue', 'White']","['U', 'W']",None,['Creature'],"['Bird', 'Spirit']",Uncommon,M20,2,3,None,Flying\nOther creatures you control with flying get +1/+1.
Ogre Siegebreaker,4.0,"['Black', 'Red']","['B', 'R']",None,['Creature'],"['Ogre', 'Berserker']",Uncommon,M20,4,3,None,{2}{B}{R}: Destroy target creature that was dealt damage this turn.
Lightning Stormkin,2.0,"['Red', 'Blue']","['R', 'U']",None,['Creature'],"['Elemental', 'Wizard']",Uncommon,M20,2,2,None,Flying\nHaste (This creature can attack and {T} as soon as it comes under your control.)
"Kethis, the Hidden Hand",3.0,"['Black', 'Green', 'White']","['B', 'G', 'W']",['Legendary'],['Creature'],"['Elf', 'Advisor']",Mythic,M20,3,4,None,"Legendary spells you cast cost {1} less to cast.\nExile two legendary cards from your graveyard: Until end of turn, each legendary card in your graveyard gains ""You may play this card from your graveyard."""
"Kaalia, Zenith Seeker",3.0,"['Black', 'Red', 'White']","['B', 'R', 'W']",['Legendary'],['Creature'],"['Human', 'Cleric']",Mythic,M20,3,3,None,"Flying, vigilance\nWhen Kaalia, Zenith Seeker enters the battlefield, look at the top six cards of your library. You may reveal an Angel card, a Demon card, and/or a Dragon card from among them and put them into your hand. Put the rest on the bottom of your library in a random order."
"Ajani, Inspiring Leader",6.0,['White'],['W'],['Legendary'],['Planeswalker'],['Ajani'],Mythic,M20,None,None,5,[+2]: You gain 2 life. Put two +1/+1 counters on up to one target creature.\n[−3]: Exile target creature. Its controller gains 2 life.\n[−10]: Creatures you control gain flying and double strike until end of turn.
Creeping Trailblazer,2.0,"['Green', 'Red']","['G', 'R']",None,['Creature'],['Elemental'],Uncommon,M20,2,2,None,Other Elementals you control get +1/+0.\n{2}{R}{G}: Creeping Trailblazer gets +1/+1 until end of turn for each Elemental you control.
Wakeroot Elemental,6.0,['Green'],['G'],None,['Creature'],['Elemental'],Rare,M20,5,5,None,{G}{G}{G}{G}{G}: Untap target land you control. It becomes a 5/5 Elemental creature with haste. It's still a land. (This effect lasts as long as that land remains on the battlefield.)
Voracious Hydra,2.0,['Green'],['G'],None,['Creature'],['Hydra'],Rare,M20,0,1,None,"Trample\nVoracious Hydra enters the battlefield with X +1/+1 counters on it.\nWhen Voracious Hydra enters the battlefield, choose one —\n• Double the number of +1/+1 counters on Voracious Hydra.\n• Voracious Hydra fights target creature you don't control."
"Vivien, Arkbow Ranger",4.0,['Green'],['G'],['Legendary'],['Planeswalker'],['Vivien'],Mythic,M20,None,None,4,[+1]: Distribute two +1/+1 counters among up to two target creatures. They gain trample until end of turn.\n[−3]: Target creature you control deals damage equal to its power to target creature or planeswalker.\n[−5]: You may reveal a creature card you own from outside the game and put it into your hand.
Veil of Summer,1.0,['Green'],['G'],None,['Instant'],None,Uncommon,M20,None,None,None,Draw a card if an opponent has cast a blue or black spell this turn. Spells you control can't be countered this turn. You and permanents you control gain hexproof from blue and from black until end of turn. (You and they can't be the targets of blue or black spells or abilities your opponents control.)
Thrashing Brontodon,3.0,['Green'],['G'],None,['Creature'],['Dinosaur'],Uncommon,M20,3,4,None,"{1}, Sacrifice Thrashing Brontodon: Destroy target artifact or enchantment."
Thicket Crasher,4.0,['Green'],['G'],None,['Creature'],"['Elemental', 'Rhino']",Common,M20,4,3,None,Trample (This creature can deal excess combat damage to the player or planeswalker it's attacking.)\nOther Elementals you control have trample.
Silverback Shaman,5.0,['Green'],['G'],None,['Creature'],"['Ape', 'Shaman']",Common,M20,5,4,None,"Trample\nWhen Silverback Shaman dies, draw a card."
Shifting Ceratops,4.0,['Green'],['G'],None,['Creature'],['Dinosaur'],Rare,M20,5,4,None,"This spell can't be countered.\nProtection from blue (This creature can't be blocked, targeted, dealt damage, enchanted, or equipped by anything blue.)\n{G}: Shifting Ceratops gains your choice of reach, trample, or haste until end of turn."
Shared Summons,5.0,['Green'],['G'],None,['Instant'],None,Rare,M20,None,None,None,"Search your library for up to two creature cards with different names, reveal them, put them into your hand, then shuffle."
Sedge Scorpion,1.0,['Green'],['G'],None,['Creature'],['Scorpion'],Common,M20,1,1,None,Deathtouch (Any amount of damage this deals to a creature is enough to destroy it.)
Season of Growth,2.0,['Green'],['G'],None,['Enchantment'],None,Uncommon,M20,None,None,None,"Whenever a creature enters the battlefield under your control, scry 1. (Look at the top card of your library. You may put that card on the bottom of your library.)\nWhenever you cast a spell that targets a creature you control, draw a card."
Rabid Bite,2.0,['Green'],['G'],None,['Sorcery'],None,Common,M20,None,None,None,Target creature you control deals damage equal to its power to target creature you don't control.
Pulse of Murasa,3.0,['Green'],['G'],None,['Instant'],None,Uncommon,M20,None,None,None,Return target creature or land card from a graveyard to its owner's hand. You gain 6 life.
Plummet,2.0,['Green'],['G'],None,['Instant'],None,Common,M20,None,None,None,Destroy target creature with flying.
Overgrowth Elemental,3.0,['Green'],['G'],None,['Creature'],['Elemental'],Uncommon,M20,3,2,None,"When Overgrowth Elemental enters the battlefield, put a +1/+1 counter on another target Elemental you control.\nWhenever another creature you control dies, you gain 1 life. If that creature was an Elemental, put a +1/+1 counter on Overgrowth Elemental."
Overcome,5.0,['Green'],['G'],None,['Sorcery'],None,Uncommon,M20,None,None,None,Creatures you control get +2/+2 and gain trample until end of turn. (They can deal excess combat damage to the player or planeswalker they're attacking.)
Nightpack Ambusher,4.0,['Green'],['G'],None,['Creature'],['Wolf'],Rare,M20,4,4,None,"Flash\nOther Wolves and Werewolves you control get +1/+1.\nAt the beginning of your end step, if you didn't cast a spell this turn, create a 2/2 green Wolf creature token."
Netcaster Spider,3.0,['Green'],['G'],None,['Creature'],['Spider'],Common,M20,2,3,None,"Reach (This creature can block creatures with flying.)\nWhenever Netcaster Spider blocks a creature with flying, Netcaster Spider gets +2/+0 until end of turn."
Natural End,3.0,['Green'],['G'],None,['Instant'],None,Common,M20,None,None,None,Destroy target artifact or enchantment. You gain 3 life.
Might of the Masses,1.0,['Green'],['G'],None,['Instant'],None,Uncommon,M20,None,None,None,Target creature gets +1/+1 until end of turn for each creature you control.
Mammoth Spider,5.0,['Green'],['G'],None,['Creature'],['Spider'],Common,M20,3,5,None,Reach (This creature can block creatures with flying.)
Loaming Shaman,3.0,['Green'],['G'],None,['Creature'],"['Centaur', 'Shaman']",Uncommon,M20,3,2,None,"When Loaming Shaman enters the battlefield, target player shuffles any number of target cards from their graveyard into their library."
Leyline of Abundance,4.0,['Green'],['G'],None,['Enchantment'],None,Rare,M20,None,None,None,"If Leyline of Abundance is in your opening hand, you may begin the game with it on the battlefield.\nWhenever you tap a creature for mana, add an additional {G}.\n{6}{G}{G}: Put a +1/+1 counter on each creature you control."
Leafkin Druid,2.0,['Green'],['G'],None,['Creature'],"['Elemental', 'Druid']",Common,M20,0,3,None,"{T}: Add {G}. If you control four or more creatures, add {G}{G} instead."
Howling Giant,7.0,['Green'],['G'],None,['Creature'],"['Giant', 'Druid']",Uncommon,M20,5,5,None,"Reach (This creature can block creatures with flying.)\nWhen Howling Giant enters the battlefield, create two 2/2 green Wolf creature tokens."
Healer of the Glade,1.0,['Green'],['G'],None,['Creature'],['Elemental'],Common,M20,1,2,None,"When Healer of the Glade enters the battlefield, you gain 3 life."
Growth Cycle,2.0,['Green'],['G'],None,['Instant'],None,Common,M20,None,None,None,Target creature gets +3/+3 until end of turn. It gets an additional +2/+2 until end of turn for each card named Growth Cycle in your graveyard.
Greenwood Sentinel,2.0,['Green'],['G'],None,['Creature'],"['Elf', 'Scout']",Common,M20,2,2,None,Vigilance (Attacking doesn't cause this creature to tap.)
Gift of Paradise,3.0,['Green'],['G'],None,['Enchantment'],['Aura'],Common,M20,None,None,None,"Enchant land\nWhen Gift of Paradise enters the battlefield, you gain 3 life.\nEnchanted land has ""{T}: Add two mana of any one color."""
"Gargos, Vicious Watcher",6.0,['Green'],['G'],['Legendary'],['Creature'],['Hydra'],Rare,M20,8,7,None,"Vigilance\nHydra spells you cast cost {4} less to cast.\nWhenever a creature you control becomes the target of a spell, Gargos, Vicious Watcher fights up to one target creature you don't control."
Ferocious Pup,3.0,['Green'],['G'],None,['Creature'],['Wolf'],Common,M20,0,1,None,"When Ferocious Pup enters the battlefield, create a 2/2 green Wolf creature token."
Feral Invocation,3.0,['Green'],['G'],None,['Enchantment'],['Aura'],Common,M20,None,None,None,Flash (You may cast this spell any time you could cast an instant.)\nEnchant creature\nEnchanted creature gets +2/+2.
Elvish Reclaimer,1.0,['Green'],['G'],None,['Creature'],"['Elf', 'Warrior']",Rare,M20,1,2,None,"Elvish Reclaimer gets +2/+2 as long as there are three or more land cards in your graveyard.\n{2}, {T}, Sacrifice a land: Search your library for a land card, put it onto the battlefield tapped, then shuffle."
Centaur Courser,3.0,['Green'],['G'],None,['Creature'],"['Centaur', 'Warrior']",Common,M20,3,3,None,None
Cavalier of Thorns,5.0,['Green'],['G'],None,['Creature'],"['Elemental', 'Knight']",Mythic,M20,5,6,None,"Reach\nWhen Cavalier of Thorns enters the battlefield, reveal the top five cards of your library. Put a land card from among them onto the battlefield and the rest into your graveyard.\nWhen Cavalier of Thorns dies, you may exile it. If you do, put another target card from your graveyard on top of your library."
Wolfkin Bond,5.0,['Green'],['G'],None,['Enchantment'],['Aura'],Common,M20,None,None,None,"Enchant creature\nWhen Wolfkin Bond enters the battlefield, create a 2/2 green Wolf creature token.\nEnchanted creature gets +2/+2."
Brightwood Tracker,4.0,['Green'],['G'],None,['Creature'],"['Elf', 'Scout']",Common,M20,2,4,None,"{5}{G}, {T}: Look at the top four cards of your library. You may reveal a creature card from among them and put it into your hand. Put the rest on the bottom of your library in a random order."
Barkhide Troll,2.0,['Green'],['G'],None,['Creature'],['Troll'],Uncommon,M20,2,2,None,"Barkhide Troll enters the battlefield with a +1/+1 counter on it.\n{1}, Remove a +1/+1 counter from Barkhide Troll: Barkhide Troll gains hexproof until end of turn. (It can't be the target of spells or abilities your opponents control.)"
Unchained Berserker,2.0,['Red'],['R'],None,['Creature'],"['Human', 'Berserker']",Uncommon,M20,1,1,None,"Protection from white (This creature can't be blocked, targeted, dealt damage, enchanted, or equipped by anything white.)\nUnchained Berserker gets +2/+0 as long as it's attacking."
Uncaged Fury,3.0,['Red'],['R'],None,['Instant'],None,Uncommon,M20,None,None,None,Target creature gets +1/+1 and gains double strike until end of turn. (It deals both first-strike and regular combat damage.)
Thunderkin Awakener,2.0,['Red'],['R'],None,['Creature'],"['Elemental', 'Shaman']",Rare,M20,1,2,None,"Haste\nWhenever Thunderkin Awakener attacks, choose target Elemental creature card in your graveyard with toughness less than Thunderkin Awakener's toughness. Return that card to the battlefield tapped and attacking. Sacrifice it at the beginning of the next end step."
Tectonic Rift,4.0,['Red'],['R'],None,['Sorcery'],None,Common,M20,None,None,None,Destroy target land. Creatures without flying can't block this turn.
Shock,1.0,['Red'],['R'],None,['Instant'],None,Common,M20,None,None,None,Shock deals 2 damage to any target.
Scorch Spitter,1.0,['Red'],['R'],None,['Creature'],"['Elemental', 'Lizard']",Common,M20,1,1,None,"Whenever Scorch Spitter attacks, it deals 1 damage to the player or planeswalker it's attacking."
Scampering Scorcher,4.0,['Red'],['R'],None,['Creature'],['Elemental'],Uncommon,M20,1,1,None,"When Scampering Scorcher enters the battlefield, create two 1/1 red Elemental creature tokens. Elementals you control gain haste until end of turn. (They can attack and {T} this turn.)"
Ripscale Predator,6.0,['Red'],['R'],None,['Creature'],['Dinosaur'],Common,M20,6,5,None,Menace (This creature can't be blocked except by two or more creatures.)
Repeated Reverberation,4.0,['Red'],['R'],None,['Instant'],None,Rare,M20,None,None,None,"When you next cast an instant spell, cast a sorcery spell, or activate a loyalty ability this turn, copy that spell or ability twice. You may choose new targets for the copies."
Reduce to Ashes,5.0,['Red'],['R'],None,['Sorcery'],None,Common,M20,None,None,None,"Reduce to Ashes deals 5 damage to target creature. If that creature would die this turn, exile it instead."
Reckless Air Strike,1.0,['Red'],['R'],None,['Sorcery'],None,Common,M20,None,None,None,Choose one —\n• Reckless Air Strike deals 3 damage to target creature with flying.\n• Destroy target artifact.
Rapacious Dragon,5.0,['Red'],['R'],None,['Creature'],['Dragon'],Uncommon,M20,3,3,None,"Flying\nWhen Rapacious Dragon enters the battlefield, create two Treasure tokens. (They're artifacts with ""{T}, Sacrifice this artifact: Add one mana of any color."")"
Pack Mastiff,2.0,['Red'],['R'],None,['Creature'],['Dog'],Common,M20,2,2,None,{1}{R}: Each creature you control named Pack Mastiff gets +1/+0 until end of turn.
Mask of Immolation,2.0,['Red'],['R'],None,['Artifact'],['Equipment'],Uncommon,M20,None,None,None,"When Mask of Immolation enters the battlefield, create a 1/1 red Elemental creature token, then attach Mask of Immolation to it.\nEquipped creature has ""Sacrifice this creature: It deals 1 damage to any target.""\nEquip {2} ({2}: Attach to target creature you control. Equip only as a sorcery.)"
Marauding Raptor,2.0,['Red'],['R'],None,['Creature'],['Dinosaur'],Rare,M20,2,3,None,"Creature spells you cast cost {1} less to cast.\nWhenever another creature enters the battlefield under your control, Marauding Raptor deals 2 damage to it. If a Dinosaur is dealt damage this way, Marauding Raptor gets +2/+0 until end of turn."
Maniacal Rage,2.0,['Red'],['R'],None,['Enchantment'],['Aura'],Common,M20,None,None,None,Enchant creature\nEnchanted creature gets +2/+2 and can't block.
Leyline of Combustion,4.0,['Red'],['R'],None,['Enchantment'],None,Rare,M20,None,None,None,"If Leyline of Combustion is in your opening hand, you may begin the game with it on the battlefield.\nWhenever you and/or at least one permanent you control becomes the target of a spell or ability an opponent controls, Leyline of Combustion deals 2 damage to that player."
Lavakin Brawler,4.0,['Red'],['R'],None,['Creature'],"['Elemental', 'Warrior']",Common,M20,2,4,None,"Whenever Lavakin Brawler attacks, it gets +1/+0 until end of turn for each Elemental you control."
Keldon Raider,4.0,['Red'],['R'],None,['Creature'],"['Human', 'Warrior']",Common,M20,4,3,None,"When Keldon Raider enters the battlefield, you may discard a card. If you do, draw a card."
Infuriate,1.0,['Red'],['R'],None,['Instant'],None,Common,M20,None,None,None,Target creature gets +3/+2 until end of turn.
Goblin Smuggler,3.0,['Red'],['R'],None,['Creature'],"['Goblin', 'Rogue']",Common,M20,2,2,None,Haste (This creature can attack and {T} as soon as it comes under your control.)\n{T}: Another target creature with power 2 or less can't be blocked this turn.
Hostile Minotaur,4.0,['Red'],['R'],None,['Creature'],['Minotaur'],Common,M20,3,3,None,Haste (This creature can attack and {T} as soon as it comes under your control.)
Prized Unicorn,4.0,['Green'],['G'],None,['Creature'],['Unicorn'],Common,M20,2,2,None,All creatures able to block Prized Unicorn do so.
Engulfing Eruption,4.0,['Red'],['R'],None,['Sorcery'],None,Common,M20,None,None,None,Engulfing Eruption deals 5 damage to target creature.
Oakenform,3.0,['Green'],['G'],None,['Enchantment'],['Aura'],Common,M20,None,None,None,Enchant creature\nEnchanted creature gets +3/+3.
Walking Corpse,2.0,['Black'],['B'],None,['Creature'],['Zombie'],Common,M20,2,2,None,None
Goblin Assailant,2.0,['Red'],['R'],None,['Creature'],"['Goblin', 'Warrior']",Common,M20,2,2,None,None
Bristling Boar,4.0,['Green'],['G'],None,['Creature'],['Boar'],Common,M20,4,3,None,Bristling Boar can't be blocked by more than one creature.
Frilled Sandwalla,1.0,['Green'],['G'],None,['Creature'],['Lizard'],Common,M20,1,1,None,{1}{G}: Frilled Sandwalla gets +2/+2 until end of turn. Activate only once each turn.
Woodland Mystic,2.0,['Green'],['G'],None,['Creature'],"['Elf', 'Druid']",Common,M20,1,1,None,{T}: Add {G}.
Canopy Spider,2.0,['Green'],['G'],None,['Creature'],['Spider'],Common,M20,1,3,None,Reach (This creature can block creatures with flying.)
Titanic Growth,2.0,['Green'],['G'],None,['Instant'],None,Common,M20,None,None,None,Target creature gets +4/+4 until end of turn.
Volcanic Dragon,6.0,['Red'],['R'],None,['Creature'],['Dragon'],Uncommon,M20,4,4,None,"Flying, haste"
Shivan Dragon,6.0,['Red'],['R'],None,['Creature'],['Dragon'],Rare,M20,5,5,None,Flying (This creature can't be blocked except by creatures with flying or reach.)\n{R}: Shivan Dragon gets +1/+0 until end of turn.
Rubblebelt Recluse,5.0,['Red'],['R'],None,['Creature'],"['Ogre', 'Berserker']",Common,M20,6,5,None,Rubblebelt Recluse attacks each combat if able.
Nimble Birdsticker,3.0,['Red'],['R'],None,['Creature'],['Goblin'],Common,M20,2,3,None,Reach (This creature can block creatures with flying.)
Immortal Phoenix,6.0,['Red'],['R'],None,['Creature'],['Phoenix'],Rare,M20,5,3,None,"Flying (This creature can't be blocked except by creatures with flying or reach.)\nWhen Immortal Phoenix dies, return it to its owner's hand."
Fearless Halberdier,3.0,['Red'],['R'],None,['Creature'],"['Human', 'Warrior']",Common,M20,3,2,None,None
Aggressive Mammoth,6.0,['Green'],['G'],None,['Creature'],['Elephant'],Rare,M20,8,8,None,Trample (This creature can deal excess combat damage to the player or planeswalker it's attacking.)\nOther creatures you control have trample.
