Name,CMC,Colors,Color identity,Supertypes,Types,Subtypes,Rarity,Set,Power,Toughness,Loyalty,Text
Mountain Yeti,4.0,['Red'],['R'],None,['Creature'],['Yeti'],Common,ME1,3,3,None,Mountainwalk (This creature can't be blocked as long as defending player controls a Mountain.)\nProtection from white
Polar Kraken,11.0,['Blue'],['U'],None,['Creature'],['Kraken'],Rare,ME1,11,11,None,"Trample\nPolar Kraken enters the battlefield tapped.\nCumulative upkeep—Sacrifice a land. (At the beginning of your upkeep, put an age counter on this permanent, then sacrifice it unless you pay its upkeep cost for each age counter on it.)"
Márton Stromgald,4.0,['Red'],['R'],['Legendary'],['Creature'],"['Human', 'Knight']",Rare,ME1,1,1,None,"Whenever Márton Stromgald attacks, other attacking creatures get +1/+1 until end of turn for each attacking creature other than Márton Stromgald.\nWhenever Márton Stromgald blocks, other blocking creatures get +1/+1 until end of turn for each blocking creature other than Márton Stromgald."
Phantom Monster,4.0,['Blue'],['U'],None,['Creature'],['Illusion'],Common,ME1,3,3,None,Flying
Jokulhaups,6.0,['Red'],['R'],None,['Sorcery'],None,Rare,ME1,None,None,None,"Destroy all artifacts, creatures, and lands. They can't be regenerated."
Mystic Remora,1.0,['Blue'],['U'],None,['Enchantment'],None,Uncommon,ME1,None,None,None,"Cumulative upkeep {1} (At the beginning of your upkeep, put an age counter on this permanent, then sacrifice it unless you pay its upkeep cost for each age counter on it.)\nWhenever an opponent casts a noncreature spell, you may draw a card unless that player pays {4}."
Balduvian Horde,4.0,['Red'],['R'],None,['Creature'],"['Human', 'Barbarian']",Rare,ME1,5,5,None,"When Balduvian Horde enters the battlefield, sacrifice it unless you discard a card at random."
Juxtapose,4.0,['Blue'],['U'],None,['Sorcery'],None,Uncommon,ME1,None,None,None,"You and target player exchange control of the creature you each control with the highest mana value. Then exchange control of artifacts the same way. If two or more permanents a player controls are tied for highest, their controller chooses one of them."
Goblin Mutant,4.0,['Red'],['R'],None,['Creature'],"['Goblin', 'Mutant']",Uncommon,ME1,5,3,None,Trample\nGoblin Mutant can't attack if defending player controls an untapped creature with power 3 or greater.\nGoblin Mutant can't block creatures with power 3 or greater.
Illusions of Grandeur,4.0,['Blue'],['U'],None,['Enchantment'],None,Rare,ME1,None,None,None,"Cumulative upkeep {2} (At the beginning of your upkeep, put an age counter on this permanent, then sacrifice it unless you pay its upkeep cost for each age counter on it.)\nWhen Illusions of Grandeur enters the battlefield, you gain 20 life.\nWhen Illusions of Grandeur leaves the battlefield, you lose 20 life."
Goblins of the Flarg,1.0,['Red'],['R'],None,['Creature'],"['Goblin', 'Warrior']",Common,ME1,1,1,None,"Mountainwalk (This creature can't be blocked as long as defending player controls a Mountain.)\nWhen you control a Dwarf, sacrifice Goblins of the Flarg."
Illusionary Wall,5.0,['Blue'],['U'],None,['Creature'],"['Illusion', 'Wall']",Common,ME1,7,4,None,"Defender, flying, first strike\nCumulative upkeep {U} (At the beginning of your upkeep, put an age counter on this permanent, then sacrifice it unless you pay its upkeep cost for each age counter on it.)"
Granite Gargoyle,3.0,['Red'],['R'],None,['Creature'],['Gargoyle'],Uncommon,ME1,2,2,None,Flying\n{R}: Granite Gargoyle gets +0/+1 until end of turn.
Illusionary Forces,4.0,['Blue'],['U'],None,['Creature'],['Illusion'],Uncommon,ME1,4,4,None,"Flying\nCumulative upkeep {U} (At the beginning of your upkeep, put an age counter on this permanent, then sacrifice it unless you pay its upkeep cost for each age counter on it.)"
Goblin Wizard,4.0,['Red'],['R'],None,['Creature'],"['Goblin', 'Wizard']",Rare,ME1,1,1,None,{T}: You may put a Goblin permanent card from your hand onto the battlefield.\n{R}: Target Goblin gains protection from white until end of turn.
Hydroblast,1.0,['Blue'],['U'],None,['Instant'],None,Common,ME1,None,None,None,Choose one —\n• Counter target spell if it's red.\n• Destroy target permanent if it's red.
Goblin Grenade,1.0,['Red'],['R'],None,['Sorcery'],None,Uncommon,ME1,None,None,None,"As an additional cost to cast this spell, sacrifice a Goblin.\nGoblin Grenade deals 5 damage to any target."
Homarid Spawning Bed,2.0,['Blue'],['U'],None,['Enchantment'],None,Uncommon,ME1,None,None,None,"{1}{U}{U}, Sacrifice a blue creature: Create X 1/1 blue Camarid creature tokens, where X is the sacrificed creature's mana value."
Goblin Chirurgeon,1.0,['Red'],['R'],None,['Creature'],"['Goblin', 'Shaman']",Common,ME1,0,2,None,Sacrifice a Goblin: Regenerate target creature.
High Tide,1.0,['Blue'],['U'],None,['Instant'],None,Uncommon,ME1,None,None,None,"Until end of turn, whenever a player taps an Island for mana, that player adds an additional {U}."
Fissure,5.0,['Red'],['R'],None,['Instant'],None,Common,ME1,None,None,None,Destroy target creature or land. It can't be regenerated.
Giant Tortoise,2.0,['Blue'],['U'],None,['Creature'],['Turtle'],Common,ME1,1,1,None,Giant Tortoise gets +0/+3 as long as it's untapped.
Crookshank Kobolds,0.0,['Red'],['R'],None,['Creature'],['Kobold'],Common,ME1,0,1,None,None
Force of Will,5.0,['Blue'],['U'],None,['Instant'],None,Rare,ME1,None,None,None,You may pay 1 life and exile a blue card from your hand rather than pay this spell's mana cost.\nCounter target spell.
Dwarven Soldier,2.0,['Red'],['R'],None,['Creature'],"['Dwarf', 'Soldier']",Common,ME1,2,1,None,"Whenever Dwarven Soldier blocks or becomes blocked by one or more Orcs, Dwarven Soldier gets +0/+2 until end of turn."
Diminishing Returns,4.0,['Blue'],['U'],None,['Sorcery'],None,Rare,ME1,None,None,None,Each player shuffles their hand and graveyard into their library. You exile the top ten cards of your library. Then each player draws up to seven cards.
Dwarven Catapult,1.0,['Red'],['R'],None,['Instant'],None,Uncommon,ME1,None,None,None,"Dwarven Catapult deals X damage divided evenly, rounded down, among all creatures target opponent controls."
Arcane Denial,2.0,['Blue'],['U'],None,['Instant'],None,Common,ME1,None,None,None,Counter target spell. Its controller may draw up to two cards at the beginning of the next turn's upkeep.\nYou draw a card at the beginning of the next turn's upkeep.
Ball Lightning,3.0,['Red'],['R'],None,['Creature'],['Elemental'],Rare,ME1,6,1,None,"Trample (This creature can deal excess combat damage to the player or planeswalker it's attacking.)\nHaste (This creature can attack and {T} as soon as it comes under your control.)\nAt the beginning of the end step, sacrifice Ball Lightning."
Apprentice Wizard,3.0,['Blue'],['U'],None,['Creature'],"['Human', 'Wizard']",Common,ME1,0,1,None,"{U}, {T}: Add {C}{C}{C}."
Artifact Blast,1.0,['Red'],['R'],None,['Instant'],None,Common,ME1,None,None,None,Counter target artifact spell.
Amnesia,6.0,['Blue'],['U'],None,['Sorcery'],None,Rare,ME1,None,None,None,Target player reveals their hand and discards all nonland cards.
Brothers of Fire,3.0,['Red'],['R'],None,['Creature'],"['Human', 'Shaman']",Common,ME1,2,2,None,{1}{R}{R}: Brothers of Fire deals 1 damage to any target and 1 damage to you.
Tivadar's Crusade,3.0,['White'],['W'],None,['Sorcery'],None,Uncommon,ME1,None,None,None,Destroy all Goblins.
Bestial Fury,3.0,['Red'],['R'],None,['Enchantment'],['Aura'],Common,ME1,None,None,None,"Enchant creature\nWhen Bestial Fury enters the battlefield, draw a card at the beginning of the next turn's upkeep.\nWhenever enchanted creature becomes blocked, it gets +4/+0 and gains trample until end of turn."
Thunder Spirit,3.0,['White'],['W'],None,['Creature'],"['Elemental', 'Spirit']",Uncommon,ME1,2,2,None,"Flying, first strike"
Thrull Retainer,1.0,['Black'],['B'],None,['Enchantment'],['Aura'],Common,ME1,None,None,None,Enchant creature\nEnchanted creature gets +1/+1.\nSacrifice Thrull Retainer: Regenerate enchanted creature.
Seraph,7.0,['White'],['W'],None,['Creature'],['Angel'],Rare,ME1,4,4,None,"Flying\nWhenever a creature dealt damage by Seraph this turn dies, put that card onto the battlefield under your control at the beginning of the next end step. Sacrifice the creature when you lose control of Seraph."
Righteous Avengers,5.0,['White'],['W'],None,['Creature'],"['Human', 'Soldier']",Common,ME1,3,1,None,Plainswalk (This creature can't be blocked as long as defending player controls a Plains.)
Preacher,3.0,['White'],['W'],None,['Creature'],"['Human', 'Cleric']",Rare,ME1,1,1,None,"You may choose not to untap Preacher during your untap step.\n{T}: For as long as Preacher remains tapped, gain control of target creature of an opponent's choice they control."
Petra Sphinx,5.0,['White'],['W'],None,['Creature'],['Sphinx'],Rare,ME1,3,4,None,"{T}: Target player chooses a card name, then reveals the top card of their library. If that card has the chosen name, that player puts it into their hand. If it doesn't, the player puts it into their graveyard."
Order of Leitbur,2.0,['White'],['W'],None,['Creature'],"['Human', 'Cleric', 'Knight']",Common,ME1,2,1,None,Protection from black\n{W}: Order of Leitbur gains first strike until end of turn.\n{W}{W}: Order of Leitbur gets +1/+0 until end of turn.
Moat,4.0,['White'],['W'],None,['Enchantment'],None,Rare,ME1,None,None,None,Creatures without flying can't attack.
Mesa Pegasus,2.0,['White'],['W'],None,['Creature'],['Pegasus'],Common,ME1,1,1,None,"Flying; banding (Any creatures with banding, and up to one without, can attack in a band. Bands are blocked as a group. If any creatures with banding you control are blocking or being blocked by a creature, you divide that creature's combat damage, not its controller, among any of the creatures it's being blocked by or is blocking.)"
Knights of Thorn,4.0,['White'],['W'],None,['Creature'],"['Human', 'Knight']",Common,ME1,2,2,None,"Protection from red; banding (Any creatures with banding, and up to one without, can attack in a band. Bands are blocked as a group. If any creatures with banding you control are blocking or being blocked by a creature, you divide that creature's combat damage, not its controller, among any of the creatures it's being blocked by or is blocking.)"
Icatian Town,6.0,['White'],['W'],None,['Sorcery'],None,Uncommon,ME1,None,None,None,Create four 1/1 white Citizen creature tokens.
Icatian Lieutenant,2.0,['White'],['W'],None,['Creature'],"['Human', 'Soldier']",Common,ME1,1,2,None,{1}{W}: Target Soldier creature gets +1/+0 until end of turn.
Animate Wall,1.0,['White'],['W'],None,['Enchantment'],['Aura'],Uncommon,ME1,None,None,None,Enchant Wall\nEnchanted Wall can attack as though it didn't have defender.
Greater Realm of Preservation,2.0,['White'],['W'],None,['Enchantment'],None,Uncommon,ME1,None,None,None,"{1}{W}: The next time a black or red source of your choice would deal damage to you this turn, prevent that damage."
Hand of Justice,6.0,['White'],['W'],None,['Creature'],['Avatar'],Rare,ME1,2,6,None,"{T}, Tap three untapped white creatures you control: Destroy target creature."
Holy Light,3.0,['White'],['W'],None,['Instant'],None,Common,ME1,None,None,None,Nonwhite creatures get -1/-1 until end of turn.
Hallowed Ground,2.0,['White'],['W'],None,['Enchantment'],None,Uncommon,ME1,None,None,None,{W}{W}: Return target nonsnow land you control to its owner's hand.
Exile,3.0,['White'],['W'],None,['Instant'],None,Common,ME1,None,None,None,Exile target nonwhite attacking creature. You gain life equal to its toughness.
Elder Land Wurm,7.0,['White'],['W'],None,['Creature'],"['Dragon', 'Wurm']",Uncommon,ME1,5,5,None,"Defender, trample\nWhen Elder Land Wurm blocks, it loses defender."
Dust to Dust,3.0,['White'],['W'],None,['Sorcery'],None,Common,ME1,None,None,None,Exile two target artifacts.
Death Speakers,1.0,['White'],['W'],None,['Creature'],"['Human', 'Cleric']",Common,ME1,1,1,None,Protection from black
Divine Transformation,4.0,['White'],['W'],None,['Enchantment'],['Aura'],Uncommon,ME1,None,None,None,Enchant creature\nEnchanted creature gets +3/+3.
Death Ward,1.0,['White'],['W'],None,['Instant'],None,Common,ME1,None,None,None,Regenerate target creature.
Argivian Archaeologist,3.0,['White'],['W'],None,['Creature'],"['Human', 'Artificer']",Rare,ME1,1,1,None,"{W}{W}, {T}: Return target artifact card from your graveyard to your hand."
Angry Mob,4.0,['White'],['W'],None,['Creature'],['Human'],Uncommon,ME1,2+*,2+*,None,"Trample\nAs long as it's your turn, Angry Mob's power and toughness are each equal to 2 plus the number of Swamps your opponents control. As long as it's not your turn, Angry Mob's power and toughness are each 2."
Crusade,2.0,['White'],['W'],None,['Enchantment'],None,Rare,ME1,None,None,None,White creatures get +1/+1.
Paralyze,1.0,['Black'],['B'],None,['Enchantment'],['Aura'],Common,ME1,None,None,None,"Enchant creature\nWhen Paralyze enters the battlefield, tap enchanted creature.\nEnchanted creature doesn't untap during its controller's untap step.\nAt the beginning of the upkeep of enchanted creature's controller, that player may pay {4}. If the player does, untap the creature."
Benalish Hero,1.0,['White'],['W'],None,['Creature'],"['Human', 'Soldier']",Common,ME1,1,1,None,"Banding (Any creatures with banding, and up to one without, can attack in a band. Bands are blocked as a group. If any creatures with banding you control are blocking or being blocked by a creature, you divide that creature's combat damage, not its controller, among any of the creatures it's being blocked by or is blocking.)"
Armageddon,4.0,['White'],['W'],None,['Sorcery'],None,Rare,ME1,None,None,None,Destroy all lands.
Thrull Champion,5.0,['Black'],['B'],None,['Creature'],['Thrull'],Rare,ME1,2,2,None,Thrull creatures get +1/+1.\n{T}: Gain control of target Thrull for as long as you control Thrull Champion.
Pox,3.0,['Black'],['B'],None,['Sorcery'],None,Rare,ME1,None,None,None,"Each player loses a third of their life, then discards a third of the cards in their hand, then sacrifices a third of the creatures they control, then sacrifices a third of the lands they control. Round up each time."
Oubliette,3.0,['Black'],['B'],None,['Enchantment'],None,Common,ME1,None,None,None,"When Oubliette enters the battlefield, target creature phases out until Oubliette leaves the battlefield. Tap that creature as it phases in this way. (Auras and Equipment phase out with it. While permanents are phased out, they're treated as though they don't exist.)"
Order of the Ebon Hand,2.0,['Black'],['B'],None,['Creature'],"['Cleric', 'Knight']",Common,ME1,2,1,None,Protection from white\n{B}: Order of the Ebon Hand gains first strike until end of turn.\n{B}{B}: Order of the Ebon Hand gets +1/+0 until end of turn.
Nether Shadow,2.0,['Black'],['B'],None,['Creature'],['Spirit'],Uncommon,ME1,1,1,None,"Haste\nAt the beginning of your upkeep, if Nether Shadow is in your graveyard with three or more creature cards above it, you may put Nether Shadow onto the battlefield."
Phyrexian Boon,3.0,['Black'],['B'],None,['Enchantment'],['Aura'],Common,ME1,None,None,None,"Enchant creature\nEnchanted creature gets +2/+1 as long as it's black. Otherwise, it gets -1/-2."
