Name,CMC,Colors,Color identity,Supertypes,Types,Subtypes,Rarity,Set,Power,Toughness,Loyalty,Text
Forest,0.0,None,['G'],['Basic'],['Land'],['Forest'],Common,ME1,None,None,None,({T}: Add {G}.)
Forest,0.0,None,['G'],['Basic'],['Land'],['Forest'],Common,ME1,None,None,None,({T}: Add {G}.)
Forest,0.0,None,['G'],['Basic'],['Land'],['Forest'],Common,ME1,None,None,None,({T}: Add {G}.)
Mountain,0.0,None,['R'],['Basic'],['Land'],['Mountain'],Common,ME1,None,None,None,({T}: Add {R}.)
Mountain,0.0,None,['R'],['Basic'],['Land'],['Mountain'],Common,ME1,None,None,None,({T}: Add {R}.)
Mountain,0.0,None,['R'],['Basic'],['Land'],['Mountain'],Common,ME1,None,None,None,({T}: Add {R}.)
Swamp,0.0,None,['B'],['Basic'],['Land'],['Swamp'],Common,ME1,None,None,None,({T}: Add {B}.)
Swamp,0.0,None,['B'],['Basic'],['Land'],['Swamp'],Common,ME1,None,None,None,({T}: Add {B}.)
Swamp,0.0,None,['B'],['Basic'],['Land'],['Swamp'],Common,ME1,None,None,None,({T}: Add {B}.)
Island,0.0,None,['U'],['Basic'],['Land'],['Island'],Common,ME1,None,None,None,({T}: Add {U}.)
Island,0.0,None,['U'],['Basic'],['Land'],['Island'],Common,ME1,None,None,None,({T}: Add {U}.)
Island,0.0,None,['U'],['Basic'],['Land'],['Island'],Common,ME1,None,None,None,({T}: Add {U}.)
Plains,0.0,None,['W'],['Basic'],['Land'],['Plains'],Common,ME1,None,None,None,({T}: Add {W}.)
Plains,0.0,None,['W'],['Basic'],['Land'],['Plains'],Common,ME1,None,None,None,({T}: Add {W}.)
Plains,0.0,None,['W'],['Basic'],['Land'],['Plains'],Common,ME1,None,None,None,({T}: Add {W}.)
Thawing Glaciers,0.0,None,None,None,['Land'],None,Rare,ME1,None,None,None,"Thawing Glaciers enters the battlefield tapped.\n{1}, {T}: Search your library for a basic land card, put that card onto the battlefield tapped, then shuffle. Return Thawing Glaciers to its owner's hand at the beginning of the next cleanup step."
Rainbow Vale,0.0,None,None,None,['Land'],None,Rare,ME1,None,None,None,{T}: Add one mana of any color. An opponent gains control of Rainbow Vale at the beginning of the next end step.
Mishra's Factory,0.0,None,None,None,['Land'],None,Uncommon,ME1,None,None,None,{T}: Add {C}.\n{1}: Mishra's Factory becomes a 2/2 Assembly-Worker artifact creature until end of turn. It's still a land.\n{T}: Target Assembly-Worker creature gets +1/+1 until end of turn.
Lake of the Dead,0.0,None,['B'],None,['Land'],None,Rare,ME1,None,None,None,"If Lake of the Dead would enter the battlefield, sacrifice a Swamp instead. If you do, put Lake of the Dead onto the battlefield. If you don't, put it into its owner's graveyard.\n{T}: Add {B}.\n{T}, Sacrifice a Swamp: Add {B}{B}{B}{B}."
Island of Wak-Wak,0.0,None,None,None,['Land'],None,Rare,ME1,None,None,None,{T}: Target creature with flying has base power 0 until end of turn.
Diamond Valley,0.0,None,None,None,['Land'],None,Rare,ME1,None,None,None,"{T}, Sacrifice a creature: You gain life equal to the sacrificed creature's toughness."
Zuran Orb,0.0,None,None,None,['Artifact'],None,Uncommon,ME1,None,None,None,Sacrifice a land: You gain 2 life.
Winter Orb,2.0,None,None,None,['Artifact'],None,Rare,ME1,None,None,None,"As long as Winter Orb is untapped, players can't untap more than one land during their untap steps."
Walking Wall,4.0,None,None,None,"['Artifact', 'Creature']",['Wall'],Uncommon,ME1,0,6,None,Defender\n{3}: Walking Wall gets +3/-1 until end of turn and can attack this turn as though it didn't have defender. Activate only once each turn.
Urza's Chalice,1.0,None,None,None,['Artifact'],None,Common,ME1,None,None,None,"Whenever a player casts an artifact spell, you may pay {1}. If you do, you gain 1 life."
Urza's Bauble,0.0,None,None,None,['Artifact'],None,Uncommon,ME1,None,None,None,"{T}, Sacrifice Urza's Bauble: Look at a card at random in target player's hand. You draw a card at the beginning of the next turn's upkeep."
Tawnos's Coffin,4.0,None,None,None,['Artifact'],None,Rare,ME1,None,None,None,"You may choose not to untap Tawnos's Coffin during your untap step.\n{3}, {T}: Exile target creature and all Auras attached to it. Note the number and kind of counters that were on that creature. When Tawnos's Coffin leaves the battlefield or becomes untapped, return that exiled card to the battlefield under its owner's control tapped with the noted number and kind of counters on it. If you do, return the other exiled cards to the battlefield under their owner's control attached to that permanent."
Su-Chi,4.0,None,None,None,"['Artifact', 'Creature']",['Construct'],Rare,ME1,4,4,None,"When Su-Chi dies, add {C}{C}{C}{C}."
Stone Calendar,5.0,None,None,None,['Artifact'],None,Uncommon,ME1,None,None,None,Spells you cast cost up to {1} less to cast.
Shield Sphere,0.0,None,None,None,"['Artifact', 'Creature']",['Wall'],Common,ME1,0,6,None,"Defender\nWhenever Shield Sphere blocks, put a -0/-1 counter on it."
Shield of the Ages,2.0,None,None,None,['Artifact'],None,Uncommon,ME1,None,None,None,{2}: Prevent the next 1 damage that would be dealt to you this turn.
Serpent Generator,6.0,None,None,None,['Artifact'],None,Rare,ME1,None,None,None,"{4}, {T}: Create a 1/1 colorless Snake artifact creature token. It has ""Whenever this creature deals damage to a player, that player gets a poison counter."" (A player with ten or more poison counters loses the game.)"
Ring of Ma'rûf,5.0,None,None,None,['Artifact'],None,Rare,ME1,None,None,None,"{5}, {T}, Exile Ring of Ma'rûf: The next time you would draw a card this turn, instead put a card you own from outside the game into your hand."
Phyrexian War Beast,3.0,None,None,None,"['Artifact', 'Creature']","['Phyrexian', 'Beast']",Uncommon,ME1,3,4,None,"When Phyrexian War Beast leaves the battlefield, sacrifice a land and Phyrexian War Beast deals 1 damage to you."
Onulet,3.0,None,None,None,"['Artifact', 'Creature']",['Construct'],Common,ME1,2,2,None,"When Onulet dies, you gain 2 life."
Nevinyrral's Disk,4.0,None,None,None,['Artifact'],None,Rare,ME1,None,None,None,"Nevinyrral's Disk enters the battlefield tapped.\n{1}, {T}: Destroy all artifacts, creatures, and enchantments."
Mirror Universe,6.0,None,None,None,['Artifact'],None,Rare,ME1,None,None,None,"{T}, Sacrifice Mirror Universe: Exchange life totals with target opponent. Activate only during your upkeep."
Ivory Tower,1.0,None,None,None,['Artifact'],None,Rare,ME1,None,None,None,"At the beginning of your upkeep, you gain X life, where X is the number of cards in your hand minus 4."
Forcefield,3.0,None,None,None,['Artifact'],None,Rare,ME1,None,None,None,"{1}: The next time an unblocked creature of your choice would deal combat damage to you this turn, prevent all but 1 of that damage."
Dragon Engine,3.0,None,None,None,"['Artifact', 'Creature']",['Construct'],Common,ME1,1,3,None,{2}: Dragon Engine gets +1/+0 until end of turn.
Cursed Rack,4.0,None,None,None,['Artifact'],None,Uncommon,ME1,None,None,None,"As Cursed Rack enters the battlefield, choose an opponent.\nThe chosen player's maximum hand size is four."
Copper Tablet,2.0,None,None,None,['Artifact'],None,Uncommon,ME1,None,None,None,"At the beginning of each player's upkeep, Copper Tablet deals 1 damage to that player."
Clockwork Beast,6.0,None,None,None,"['Artifact', 'Creature']",['Beast'],Uncommon,ME1,0,4,None,"Clockwork Beast enters the battlefield with seven +1/+0 counters on it.\nAt end of combat, if Clockwork Beast attacked or blocked this combat, remove a +1/+0 counter from it.\n{X}, {T}: Put up to X +1/+0 counters on Clockwork Beast. This ability can't cause the total number of +1/+0 counters on Clockwork Beast to be greater than seven. Activate only during your upkeep."
Ashnod's Transmogrant,1.0,None,None,None,['Artifact'],None,Common,ME1,None,None,None,"{T}, Sacrifice Ashnod's Transmogrant: Put a +1/+1 counter on target nonartifact creature. That creature becomes an artifact in addition to its other types."
Ankh of Mishra,2.0,None,None,None,['Artifact'],None,Rare,ME1,None,None,None,"Whenever a land enters the battlefield, Ankh of Mishra deals 2 damage to that land's controller."
Phelddagrif,4.0,"['Green', 'Blue', 'White']","['G', 'U', 'W']",['Legendary'],['Creature'],['Phelddagrif'],Rare,ME1,4,4,None,{G}: Phelddagrif gains trample until end of turn. Target opponent creates a 1/1 green Hippo creature token.\n{W}: Phelddagrif gains flying until end of turn. Target opponent gains 2 life.\n{U}: Return Phelddagrif to its owner's hand. Target opponent may draw a card.
Lord of Tresserhorn,4.0,"['Black', 'Red', 'Blue']","['B', 'R', 'U']",['Legendary'],['Creature'],['Zombie'],Rare,ME1,10,4,None,"When Lord of Tresserhorn enters the battlefield, you lose 2 life, you sacrifice two creatures, and target opponent draws two cards.\n{B}: Regenerate Lord of Tresserhorn."
Lim-Dûl's Vault,2.0,"['Black', 'Blue']","['B', 'U']",None,['Instant'],None,Uncommon,ME1,None,None,None,"Look at the top five cards of your library. As many times as you choose, you may pay 1 life, put those cards on the bottom of your library in any order, then look at the top five cards of your library. Then shuffle and put the last cards you looked at this way on top in any order."
Jacques le Vert,4.0,"['Green', 'Red', 'White']","['G', 'R', 'W']",['Legendary'],['Creature'],"['Human', 'Warrior']",Rare,ME1,3,2,None,Green creatures you control get +0/+2.
Hymn of Rebirth,5.0,"['Green', 'White']","['G', 'W']",None,['Sorcery'],None,Uncommon,ME1,None,None,None,Put target creature card from a graveyard onto the battlefield under your control.
Fire Covenant,3.0,"['Black', 'Red']","['B', 'R']",None,['Instant'],None,Uncommon,ME1,None,None,None,"As an additional cost to cast this spell, pay X life.\nFire Covenant deals X damage divided as you choose among any number of target creatures."
Energy Arc,2.0,"['Blue', 'White']","['U', 'W']",None,['Instant'],None,Uncommon,ME1,None,None,None,Untap any number of target creatures. Prevent all combat damage that would be dealt to and dealt by those creatures this turn.
Dakkon Blackblade,6.0,"['Black', 'Blue', 'White']","['B', 'U', 'W']",['Legendary'],['Creature'],"['Human', 'Warrior']",Rare,ME1,*,*,None,Dakkon Blackblade's power and toughness are each equal to the number of lands you control.
Centaur Archer,3.0,"['Green', 'Red']","['G', 'R']",None,['Creature'],"['Centaur', 'Archer']",Uncommon,ME1,3,2,None,{T}: Centaur Archer deals 1 damage to target creature with flying.
Adun Oakenshield,3.0,"['Black', 'Green', 'Red']","['B', 'G', 'R']",['Legendary'],['Creature'],"['Human', 'Knight']",Rare,ME1,1,2,None,"{B}{R}{G}, {T}: Return target creature card from your graveyard to your hand."
Yavimaya Ants,4.0,['Green'],['G'],None,['Creature'],['Insect'],Uncommon,ME1,5,1,None,"Trample, haste\nCumulative upkeep {G}{G} (At the beginning of your upkeep, put an age counter on this permanent, then sacrifice it unless you pay its upkeep cost for each age counter on it.)"
Wyluli Wolf,2.0,['Green'],['G'],None,['Creature'],['Wolf'],Common,ME1,1,1,None,{T}: Target creature gets +1/+1 until end of turn.
Winter Blast,1.0,['Green'],['G'],None,['Sorcery'],None,Uncommon,ME1,None,None,None,Tap X target creatures. Winter Blast deals 2 damage to each of those creatures with flying.
Wanderlust,3.0,['Green'],['G'],None,['Enchantment'],['Aura'],Common,ME1,None,None,None,"Enchant creature\nAt the beginning of the upkeep of enchanted creature's controller, Wanderlust deals 1 damage to that player."
Tornado,5.0,['Green'],['G'],None,['Enchantment'],None,Rare,ME1,None,None,None,"Cumulative upkeep {G} (At the beginning of your upkeep, put an age counter on this permanent, then sacrifice it unless you pay its upkeep cost for each age counter on it.)\n{2}{G}, Pay 3 life for each velocity counter on Tornado: Destroy target permanent and put a velocity counter on Tornado. Activate only once each turn."
Thorn Thallid,3.0,['Green'],['G'],None,['Creature'],['Fungus'],Common,ME1,2,2,None,"At the beginning of your upkeep, put a spore counter on Thorn Thallid.\nRemove three spore counters from Thorn Thallid: It deals 1 damage to any target."
Thicket Basilisk,5.0,['Green'],['G'],None,['Creature'],['Basilisk'],Uncommon,ME1,2,4,None,"Whenever Thicket Basilisk blocks or becomes blocked by a non-Wall creature, destroy that creature at end of combat."
Mindstab Thrull,3.0,['Black'],['B'],None,['Creature'],['Thrull'],Common,ME1,2,2,None,"Whenever Mindstab Thrull attacks and isn't blocked, you may sacrifice it. If you do, defending player discards three cards."
Sylvan Library,2.0,['Green'],['G'],None,['Enchantment'],None,Rare,ME1,None,None,None,"At the beginning of your draw step, you may draw two additional cards. If you do, choose two cards in your hand drawn this turn. For each of those cards, pay 4 life or put the card on top of your library."
Khabál Ghoul,3.0,['Black'],['B'],None,['Creature'],['Zombie'],Rare,ME1,1,1,None,"At the beginning of each end step, put a +1/+1 counter on Khabál Ghoul for each creature that died this turn."
Storm Seeker,4.0,['Green'],['G'],None,['Instant'],None,Uncommon,ME1,None,None,None,Storm Seeker deals damage to target player equal to the number of cards in that player's hand.
Juzám Djinn,4.0,['Black'],['B'],None,['Creature'],['Djinn'],Rare,ME1,5,5,None,"At the beginning of your upkeep, Juzám Djinn deals 1 damage to you."
Spectral Bears,2.0,['Green'],['G'],None,['Creature'],"['Bear', 'Spirit']",Uncommon,ME1,3,3,None,"Whenever Spectral Bears attacks, if defending player controls no black nontoken permanents, it doesn't untap during your next untap step."
Hymn to Tourach,2.0,['Black'],['B'],None,['Sorcery'],None,Uncommon,ME1,None,None,None,Target player discards two cards at random.
Singing Tree,4.0,['Green'],['G'],None,['Creature'],['Plant'],Uncommon,ME1,0,3,None,{T}: Target attacking creature has base power 0 until end of turn.
Hyalopterous Lemure,5.0,['Black'],['B'],None,['Creature'],['Spirit'],Common,ME1,4,3,None,{0}: Hyalopterous Lemure gets -1/-0 and gains flying until end of turn.
Shambling Strider,6.0,['Green'],"['G', 'R']",None,['Creature'],['Yeti'],Common,ME1,5,5,None,{R}{G}: Shambling Strider gets +1/-1 until end of turn.
Hecatomb,3.0,['Black'],['B'],None,['Enchantment'],None,Rare,ME1,None,None,None,"When Hecatomb enters the battlefield, sacrifice Hecatomb unless you sacrifice four creatures.\nTap an untapped Swamp you control: Hecatomb deals 1 damage to any target."
Scryb Sprites,1.0,['Green'],['G'],None,['Creature'],['Faerie'],Common,ME1,1,1,None,Flying
Feast or Famine,4.0,['Black'],['B'],None,['Instant'],None,Common,ME1,None,None,None,"Choose one —\n• Create a 2/2 black Zombie creature token.\n• Destroy target nonartifact, nonblack creature. It can't be regenerated."
Roots,4.0,['Green'],['G'],None,['Enchantment'],['Aura'],Common,ME1,None,None,None,"Enchant creature without flying\nWhen Roots enters the battlefield, tap enchanted creature.\nEnchanted creature doesn't untap during its controller's untap step."
The Fallen,4.0,['Black'],['B'],None,['Creature'],['Zombie'],Uncommon,ME1,2,3,None,"At the beginning of your upkeep, The Fallen deals 1 damage to each opponent and planeswalker it has dealt damage to this game."
Rabid Wombat,4.0,['Green'],['G'],None,['Creature'],['Wombat'],Uncommon,ME1,0,1,None,Vigilance\nRabid Wombat gets +2/+2 for each Aura attached to it.
Erg Raiders,2.0,['Black'],['B'],None,['Creature'],"['Human', 'Warrior']",Common,ME1,2,3,None,"At the beginning of your end step, if Erg Raiders didn't attack this turn, Erg Raiders deals 2 damage to you unless it came under your control this turn."
Primal Order,4.0,['Green'],['G'],None,['Enchantment'],None,Rare,ME1,None,None,None,"At the beginning of each player's upkeep, Primal Order deals damage to that player equal to the number of nonbasic lands they control."
Eater of the Dead,5.0,['Black'],['B'],None,['Creature'],['Horror'],Uncommon,ME1,3,4,None,"{0}: If Eater of the Dead is tapped, exile target creature card from a graveyard and untap Eater of the Dead."
Nature's Lore,2.0,['Green'],['G'],None,['Sorcery'],None,Common,ME1,None,None,None,"Search your library for a Forest card, put that card onto the battlefield, then shuffle."
Derelor,4.0,['Black'],['B'],None,['Creature'],['Thrull'],Uncommon,ME1,4,4,None,Black spells you cast cost {B} more to cast.
Ifh-Bíff Efreet,4.0,['Green'],['G'],None,['Creature'],['Efreet'],Rare,ME1,3,3,None,Flying\n{G}: Ifh-Bíff Efreet deals 1 damage to each creature with flying and each player. Any player may activate this ability.
Cuombajj Witches,2.0,['Black'],['B'],None,['Creature'],"['Human', 'Wizard']",Common,ME1,1,3,None,{T}: Cuombajj Witches deals 1 damage to any target and 1 damage to any target of an opponent's choice.
Ice Storm,3.0,['Green'],['G'],None,['Sorcery'],None,Uncommon,ME1,None,None,None,Destroy target land.
Contagion,5.0,['Black'],['B'],None,['Instant'],None,Rare,ME1,None,None,None,You may pay 1 life and exile a black card from your hand rather than pay this spell's mana cost.\nDistribute two -2/-1 counters among one or two target creatures.
Hungry Mist,4.0,['Green'],['G'],None,['Creature'],['Elemental'],Common,ME1,6,2,None,"At the beginning of your upkeep, sacrifice Hungry Mist unless you pay {G}{G}."
Chains of Mephistopheles,2.0,['Black'],['B'],None,['Enchantment'],None,Rare,ME1,None,None,None,"If a player would draw a card except the first one they draw in each of their draw steps, that player discards a card instead. If the player discards a card this way, they draw a card. If the player doesn't discard a card this way, they mill a card."
Ghazbán Ogre,1.0,['Green'],['G'],None,['Creature'],['Ogre'],Common,ME1,2,2,None,"At the beginning of your upkeep, if a player has more life than each other player, the player with the most life gains control of Ghazbán Ogre."
Breeding Pit,4.0,['Black'],['B'],None,['Enchantment'],None,Uncommon,ME1,None,None,None,"At the beginning of your upkeep, sacrifice Breeding Pit unless you pay {B}{B}.\nAt the beginning of your end step, create a 0/1 black Thrull creature token."
Gargantuan Gorilla,7.0,['Green'],['G'],None,['Creature'],['Ape'],Rare,ME1,7,7,None,"At the beginning of your upkeep, you may sacrifice a Forest. If you sacrifice a snow Forest this way, Gargantuan Gorilla gains trample until end of turn. If you don't sacrifice a Forest, sacrifice Gargantuan Gorilla and it deals 7 damage to you.\n{T}: Gargantuan Gorilla deals damage equal to its power to another target creature. That creature deals damage equal to its power to Gargantuan Gorilla."
Blight,2.0,['Black'],['B'],None,['Enchantment'],['Aura'],Uncommon,ME1,None,None,None,"Enchant land\nWhen enchanted land becomes tapped, destroy it."
Fyndhorn Elves,1.0,['Green'],['G'],None,['Creature'],"['Elf', 'Druid']",Common,ME1,1,1,None,{T}: Add {G}.
Black Knight,2.0,['Black'],['B'],None,['Creature'],"['Human', 'Knight']",Uncommon,ME1,2,2,None,"First strike (This creature deals combat damage before creatures without first strike.)\nProtection from white (This creature can't be blocked, targeted, dealt damage, or enchanted by anything white.)"
Eureka,4.0,['Green'],['G'],None,['Sorcery'],None,Rare,ME1,None,None,None,"Starting with you, each player may put a permanent card from their hand onto the battlefield. Repeat this process until no one puts a card onto the battlefield."
Basal Thrull,2.0,['Black'],['B'],None,['Creature'],['Thrull'],Common,ME1,1,2,None,"{T}, Sacrifice Basal Thrull: Add {B}{B}."
Lightning Bolt,1.0,['Red'],['R'],None,['Instant'],None,Common,ME1,None,None,None,Lightning Bolt deals 3 damage to any target.
Baron Sengir,8.0,['Black'],['B'],['Legendary'],['Creature'],"['Vampire', 'Noble']",Rare,ME1,5,5,None,"Flying\nWhenever a creature dealt damage by Baron Sengir this turn dies, put a +2/+2 counter on Baron Sengir.\n{T}: Regenerate another target Vampire."
Autumn Willow,6.0,['Green'],['G'],['Legendary'],['Creature'],['Avatar'],Rare,ME1,4,4,None,"Shroud (This creature can't be the target of spells or abilities.)\n{G}: Until end of turn, Autumn Willow can be the target of spells and abilities controlled by target player as though it didn't have shroud."
Animate Dead,2.0,['Black'],['B'],None,['Enchantment'],['Aura'],Uncommon,ME1,None,None,None,"Enchant creature card in a graveyard\nWhen Animate Dead enters the battlefield, if it's on the battlefield, it loses ""enchant creature card in a graveyard"" and gains ""enchant creature put onto the battlefield with Animate Dead."" Return enchanted creature card to the battlefield under your control and attach Animate Dead to it. When Animate Dead leaves the battlefield, that creature's controller sacrifices it.\nEnchanted creature gets -1/-0."
Carnivorous Plant,4.0,['Green'],['G'],None,['Creature'],"['Plant', 'Wall']",Uncommon,ME1,4,5,None,Defender
Word of Undoing,1.0,['Blue'],['U'],None,['Instant'],None,Common,ME1,None,None,None,Return target creature and all white Auras you own attached to it to their owners' hands.
Chub Toad,3.0,['Green'],['G'],None,['Creature'],['Frog'],Common,ME1,1,1,None,"Whenever Chub Toad blocks or becomes blocked, it gets +2/+2 until end of turn."
Vodalian Knights,3.0,['Blue'],['U'],None,['Creature'],"['Merfolk', 'Knight']",Uncommon,ME1,2,2,None,"First strike\nVodalian Knights can't attack unless defending player controls an Island.\nWhen you control no Islands, sacrifice Vodalian Knights.\n{U}: Vodalian Knights gains flying until end of turn."
Berserk,1.0,['Green'],['G'],None,['Instant'],None,Rare,ME1,None,None,None,"Cast this spell only before the combat damage step.\nTarget creature gains trample and gets +X/+0 until end of turn, where X is its power. At the beginning of the next end step, destroy that creature if it attacked this turn."
Vesuvan Doppelganger,5.0,['Blue'],['U'],None,['Creature'],['Shapeshifter'],Rare,ME1,0,0,None,"You may have Vesuvan Doppelganger enter the battlefield as a copy of any creature on the battlefield, except it doesn't copy that creature's color and it has ""At the beginning of your upkeep, you may have this creature become a copy of target creature, except it doesn't copy that creature's color and it has this ability."""
Ydwen Efreet,3.0,['Red'],['R'],None,['Creature'],['Efreet'],Rare,ME1,3,6,None,"Whenever Ydwen Efreet blocks, flip a coin. If you lose the flip, remove Ydwen Efreet from combat and it can't block this turn. Creatures it was blocking that had become blocked by only Ydwen Efreet this combat become unblocked."
Time Elemental,3.0,['Blue'],['U'],None,['Creature'],['Elemental'],Rare,ME1,0,2,None,"When Time Elemental attacks or blocks, at end of combat, sacrifice it and it deals 5 damage to you.\n{2}{U}{U}, {T}: Return target permanent that isn't enchanted to its owner's hand."
Winds of Change,1.0,['Red'],['R'],None,['Sorcery'],None,Uncommon,ME1,None,None,None,"Each player shuffles the cards from their hand into their library, then draws that many cards."
Telekinesis,2.0,['Blue'],['U'],None,['Instant'],None,Common,ME1,None,None,None,Tap target creature. Prevent all combat damage that would be dealt by that creature this turn. It doesn't untap during its controller's next two untap steps.
Varchild's War-Riders,2.0,['Red'],['R'],None,['Creature'],"['Human', 'Warrior']",Rare,ME1,3,4,None,"Cumulative upkeep—Have an opponent create a 1/1 red Survivor creature token. (At the beginning of your upkeep, put an age counter on this permanent, then sacrifice it unless you pay its upkeep cost for each age counter on it.)\nTrample; rampage 1 (Whenever this creature becomes blocked, it gets +1/+1 until end of turn for each creature blocking it beyond the first.)"
Sunken City,2.0,['Blue'],['U'],None,['Enchantment'],None,Uncommon,ME1,None,None,None,"At the beginning of your upkeep, sacrifice Sunken City unless you pay {U}{U}.\nBlue creatures get +1/+1."
Pyroblast,1.0,['Red'],['R'],None,['Instant'],None,Common,ME1,None,None,None,Choose one —\n• Counter target spell if it's blue.\n• Destroy target permanent if it's blue.
Serendib Efreet,3.0,['Blue'],['U'],None,['Creature'],['Efreet'],Rare,ME1,3,4,None,"Flying\nAt the beginning of your upkeep, Serendib Efreet deals 1 damage to you."
Stone Giant,4.0,['Red'],['R'],None,['Creature'],['Giant'],Uncommon,ME1,3,4,None,{T}: Target creature you control with toughness less than Stone Giant's power gains flying until end of turn. Destroy that creature at the beginning of the next end step.
Seasinger,3.0,['Blue'],['U'],None,['Creature'],['Merfolk'],Uncommon,ME1,0,1,None,"When you control no Islands, sacrifice Seasinger.\nYou may choose not to untap Seasinger during your untap step.\n{T}: Gain control of target creature whose controller controls an Island for as long as you control Seasinger and Seasinger remains tapped."
Spinal Villain,3.0,['Red'],['R'],None,['Creature'],['Beast'],Uncommon,ME1,1,2,None,{T}: Destroy target blue creature.
Sea Sprite,2.0,['Blue'],['U'],None,['Creature'],['Faerie'],Common,ME1,1,1,None,"Flying, protection from red"
Mana Flare,3.0,['Red'],['R'],None,['Enchantment'],None,Rare,ME1,None,None,None,"Whenever a player taps a land for mana, that player adds one mana of any type that land produced."
River Merfolk,2.0,['Blue'],['U'],None,['Creature'],['Merfolk'],Common,ME1,2,1,None,{U}: River Merfolk gains mountainwalk until end of turn. (It can't be blocked as long as defending player controls a Mountain.)
Keldon Warlord,4.0,['Red'],['R'],None,['Creature'],"['Human', 'Barbarian']",Uncommon,ME1,*,*,None,Keldon Warlord's power and toughness are each equal to the number of non-Wall creatures you control.
Psychic Venom,2.0,['Blue'],['U'],None,['Enchantment'],['Aura'],Common,ME1,None,None,None,"Enchant land\nWhenever enchanted land becomes tapped, Psychic Venom deals 2 damage to that land's controller."
Orcish Mechanics,3.0,['Red'],['R'],None,['Creature'],['Orc'],Uncommon,ME1,1,1,None,"{T}, Sacrifice an artifact: Orcish Mechanics deals 2 damage to any target."
Psychic Purge,1.0,['Blue'],['U'],None,['Sorcery'],None,Uncommon,ME1,None,None,None,"Psychic Purge deals 1 damage to any target.\nWhen a spell or ability an opponent controls causes you to discard Psychic Purge, that player loses 5 life."
