Name,CMC,Colors,Color identity,Supertypes,Types,Subtypes,Rarity,Set,Power,Toughness,Loyalty,Text
Spinehorn Minotaur,3.0,['Red'],['R'],None,['Creature'],"['Minotaur', 'Berserker']",Common,MH1,2,3,None,"As long as you've drawn two or more cards this turn, Spinehorn Minotaur has double strike."
Shenanigans,2.0,['Red'],['R'],None,['Sorcery'],None,Common,MH1,None,None,None,"Destroy target artifact.\nDredge 1 (If you would draw a card, you may mill a card instead. If you do, return this card from your graveyard to your hand.)"
Sword of Sinew and Steel,3.0,None,None,None,['Artifact'],['Equipment'],Mythic,MH1,None,None,None,"Equipped creature gets +2/+2 and has protection from black and from red.\nWhenever equipped creature deals combat damage to a player, destroy up to one target planeswalker and up to one target artifact.\nEquip {2}"
Seasoned Pyromancer,3.0,['Red'],['R'],None,['Creature'],"['Human', 'Shaman']",Mythic,MH1,2,2,None,"When Seasoned Pyromancer enters the battlefield, discard two cards, then draw two cards. For each nonland card discarded this way, create a 1/1 red Elemental creature token.\n{3}{R}{R}, Exile Seasoned Pyromancer from your graveyard: Create two 1/1 red Elemental creature tokens."
Scrapyard Recombiner,3.0,None,None,None,"['Artifact', 'Creature']",['Construct'],Rare,MH1,0,0,None,"Modular 2 (This creature enters the battlefield with two +1/+1 counters on it. When it dies, you may put its +1/+1 counters on target artifact creature.)\n{T}, Sacrifice an artifact: Search your library for a Construct card, reveal it, put it into your hand, then shuffle."
Reckless Charge,1.0,['Red'],['R'],None,['Sorcery'],None,Common,MH1,None,None,None,Target creature gets +3/+0 and gains haste until end of turn.\nFlashback {2}{R} (You may cast this card from your graveyard for its flashback cost. Then exile it.)
Mox Tantalite,0.0,None,None,None,['Artifact'],None,Mythic,MH1,None,None,None,"Suspend 3—{0} (Rather than cast this card from your hand, pay {0} and exile it with three time counters on it. At the beginning of your upkeep, remove a time counter. When the last is removed, cast it without paying its mana cost.)\n{T}: Add one mana of any color."
Ravenous Giant,4.0,['Red'],['R'],None,['Creature'],['Giant'],Uncommon,MH1,5,5,None,"At the beginning of your upkeep, Ravenous Giant deals 1 damage to you."
Lesser Masticore,2.0,None,None,None,"['Artifact', 'Creature']",['Masticore'],Uncommon,MH1,2,2,None,"As an additional cost to cast this spell, discard a card.\n{4}: Lesser Masticore deals 1 damage to target creature.\nPersist (When this creature dies, if it had no -1/-1 counters on it, return it to the battlefield under its owner's control with a -1/-1 counter on it.)"
Quakefoot Cyclops,5.0,['Red'],['R'],None,['Creature'],['Cyclops'],Common,MH1,4,4,None,"When Quakefoot Cyclops enters the battlefield, up to two target creatures can't block this turn.\nCycling {1}{R} ({1}{R}, Discard this card: Draw a card.)\nWhen you cycle Quakefoot Cyclops, target creature can't block this turn."
Icehide Golem,1.0,None,None,['Snow'],"['Artifact', 'Creature']",['Golem'],Uncommon,MH1,2,2,None,({S} can be paid with one mana from a snow source.)
Pyrophobia,2.0,['Red'],['R'],None,['Sorcery'],None,Common,MH1,None,None,None,Pyrophobia deals 3 damage to target creature. Cowards can't block this turn.
Fountain of Ichor,3.0,None,None,None,['Artifact'],None,Common,MH1,None,None,None,{T}: Add one mana of any color.\n{3}: Fountain of Ichor becomes a 3/3 Dinosaur artifact creature until end of turn.
Planebound Accomplice,3.0,['Red'],['R'],None,['Creature'],"['Human', 'Wizard']",Rare,MH1,1,3,None,{R}: You may put a planeswalker card from your hand onto the battlefield. Sacrifice it at the beginning of the next end step.
Farmstead Gleaner,3.0,None,None,None,"['Artifact', 'Creature']",['Scarecrow'],Uncommon,MH1,2,2,None,"Farmstead Gleaner doesn't untap during your untap step.\n{2}, {Q}: Put a +1/+1 counter on Farmstead Gleaner. ({Q} is the untap symbol.)"
Pillage,3.0,['Red'],['R'],None,['Sorcery'],None,Uncommon,MH1,None,None,None,Destroy target artifact or land. It can't be regenerated.
Birthing Boughs,3.0,None,None,None,['Artifact'],None,Uncommon,MH1,None,None,None,"{4}, {T}: Create a 2/2 colorless Shapeshifter creature token with changeling. (It has every creature type.)"
Pashalik Mons,3.0,['Red'],['R'],['Legendary'],['Creature'],"['Goblin', 'Warrior']",Rare,MH1,2,2,None,"Whenever Pashalik Mons or another Goblin you control dies, Pashalik Mons deals 1 damage to any target.\n{3}{R}, Sacrifice a Goblin: Create two 1/1 red Goblin creature tokens."
Arcum's Astrolabe,1.0,None,None,['Snow'],['Artifact'],None,Common,MH1,None,None,None,"({S} can be paid with one mana from a snow source.)\nWhen Arcum's Astrolabe enters the battlefield, draw a card.\n{1}, {T}: Add one mana of any color."
Ore-Scale Guardian,7.0,['Red'],['R'],None,['Creature'],['Dragon'],Uncommon,MH1,4,4,None,"This spell costs {1} less to cast for each land card in your graveyard.\nFlying, haste"
Amorphous Axe,2.0,None,None,None,['Artifact'],['Equipment'],Common,MH1,None,None,None,Equipped creature gets +3/+0 and is every creature type.\nEquip {3} ({3}: Attach to target creature you control. Equip only as a sorcery.)
Orcish Hellraiser,2.0,['Red'],['R'],None,['Creature'],"['Orc', 'Warrior']",Common,MH1,3,2,None,"Echo {R} (At the beginning of your upkeep, if this came under your control since the beginning of your last upkeep, sacrifice it unless you pay its echo cost.)\nWhen Orcish Hellraiser dies, it deals 2 damage to target player or planeswalker."
Altar of Dementia,2.0,None,None,None,['Artifact'],None,Rare,MH1,None,None,None,Sacrifice a creature: Target player mills cards equal to the sacrificed creature's power.
Magmatic Sinkhole,6.0,['Red'],['R'],None,['Instant'],None,Common,MH1,None,None,None,Delve (Each card you exile from your graveyard while casting this spell pays for {1}.)\nMagmatic Sinkhole deals 5 damage to target creature or planeswalker.
Wrenn and Six,2.0,"['Green', 'Red']","['G', 'R']",['Legendary'],['Planeswalker'],['Wrenn'],Mythic,MH1,None,None,3,"[+1]: Return up to one target land card from your graveyard to your hand.\n[−1]: Wrenn and Six deals 1 damage to any target.\n[−7]: You get an emblem with ""Instant and sorcery cards in your graveyard have retrace."" (You may cast instant and sorcery cards from your graveyard by discarding a land card in addition to paying their other costs.)"
Lava Dart,1.0,['Red'],['R'],None,['Instant'],None,Common,MH1,None,None,None,Lava Dart deals 1 damage to any target.\nFlashback—Sacrifice a Mountain. (You may cast this card from your graveyard for its flashback cost. Then exile it.)
"Hogaak, Arisen Necropolis",7.0,"['Black', 'Green']","['B', 'G']",['Legendary'],['Creature'],['Avatar'],Rare,MH1,8,8,None,"You can't spend mana to cast this spell.\nConvoke, delve (Each creature you tap while casting this spell pays for {1} or one mana of that creature's color. Each card you exile from your graveyard pays for {1}.)\nYou may cast Hogaak, Arisen Necropolis from your graveyard.\nTrample"
Igneous Elemental,6.0,['Red'],['R'],None,['Creature'],['Elemental'],Common,MH1,4,3,None,"This spell costs {2} less to cast if there is a land card in your graveyard.\nWhen Igneous Elemental enters the battlefield, you may have it deal 2 damage to target creature."
Ruination Rioter,2.0,"['Green', 'Red']","['G', 'R']",None,['Creature'],"['Human', 'Berserker']",Uncommon,MH1,2,2,None,"When Ruination Rioter dies, you may have it deal damage to any target equal to the number of land cards in your graveyard."
Hollowhead Sliver,3.0,['Red'],['R'],None,['Creature'],['Sliver'],Uncommon,MH1,2,2,None,"Sliver creatures you control have ""{T}, Discard a card: Draw a card."""
Thundering Djinn,5.0,"['Red', 'Blue']","['R', 'U']",None,['Creature'],['Djinn'],Uncommon,MH1,3,4,None,"Flying\nWhenever Thundering Djinn attacks, it deals damage to any target equal to the number of cards you've drawn this turn."
Goblin War Party,4.0,['Red'],['R'],None,['Sorcery'],None,Common,MH1,None,None,None,Choose one —\n• Create three 1/1 red Goblin creature tokens.\n• Creatures you control get +1/+1 and gain haste until end of turn.\nEntwine {2}{R} (Choose both if you pay the entwine cost.)
Unsettled Mariner,2.0,"['Blue', 'White']","['U', 'W']",None,['Creature'],['Shapeshifter'],Rare,MH1,2,2,None,"Changeling (This card is every creature type.)\nWhenever you or a permanent you control becomes the target of a spell or ability an opponent controls, counter that spell or ability unless its controller pays {1}."
Goblin Oriflamme,2.0,['Red'],['R'],None,['Enchantment'],None,Uncommon,MH1,None,None,None,Attacking creatures you control get +1/+0.
Soulherder,3.0,"['Blue', 'White']","['U', 'W']",None,['Creature'],['Spirit'],Uncommon,MH1,1,1,None,"Whenever a creature is exiled from the battlefield, put a +1/+1 counter on Soulherder.\nAt the beginning of your end step, you may exile another target creature you control, then return that card to the battlefield under its owner's control."
Goblin Matron,3.0,['Red'],['R'],None,['Creature'],['Goblin'],Uncommon,MH1,1,1,None,"When Goblin Matron enters the battlefield, you may search your library for a Goblin card, reveal that card, put it into your hand, then shuffle."
Rotwidow Pack,4.0,"['Black', 'Green']","['B', 'G']",None,['Creature'],['Spider'],Uncommon,MH1,2,4,None,"Reach\n{3}{B}{G}, Exile a creature card from your graveyard: Create a 1/2 green Spider creature token with reach, then each opponent loses 1 life for each Spider you control."
Goblin Engineer,2.0,['Red'],['R'],None,['Creature'],"['Goblin', 'Artificer']",Rare,MH1,1,2,None,"When Goblin Engineer enters the battlefield, you may search your library for an artifact card, put it into your graveyard, then shuffle.\n{R}, {T}, Sacrifice an artifact: Return target artifact card with mana value 3 or less from your graveyard to the battlefield."
Reap the Past,2.0,"['Green', 'Red']","['G', 'R']",None,['Sorcery'],None,Rare,MH1,None,None,None,Return X cards at random from your graveyard to your hand. Exile Reap the Past.
Goblin Champion,1.0,['Red'],['R'],None,['Creature'],"['Goblin', 'Warrior']",Common,MH1,0,1,None,"Haste\nExalted (Whenever a creature you control attacks alone, that creature gets +1/+1 until end of turn.)"
Nature's Chant,2.0,"['Green', 'White']","['G', 'W']",None,['Instant'],None,Common,MH1,None,None,None,Destroy target artifact or enchantment.
Goatnap,3.0,['Red'],['R'],None,['Sorcery'],None,Common,MH1,None,None,None,"Gain control of target creature until end of turn. Untap that creature. It gains haste until end of turn. If that creature is a Goat, it also gets +3/+0 until end of turn."
Lavabelly Sliver,3.0,"['Red', 'White']","['R', 'W']",None,['Creature'],['Sliver'],Uncommon,MH1,2,2,None,"Sliver creatures you control have ""When this creature enters the battlefield, it deals 1 damage to target player or planeswalker and you gain 1 life."""
Geomancer's Gambit,3.0,['Red'],['R'],None,['Sorcery'],None,Common,MH1,None,None,None,"Destroy target land. Its controller may search their library for a basic land card, put it onto the battlefield, then shuffle.\nDraw a card."
Munitions Expert,2.0,"['Black', 'Red']","['B', 'R']",None,['Creature'],['Goblin'],Uncommon,MH1,1,1,None,"Flash\nWhen Munitions Expert enters the battlefield, you may have it deal damage to target creature or planeswalker equal to the number of Goblins you control."
Force of Rage,3.0,['Red'],['R'],None,['Instant'],None,Rare,MH1,None,None,None,"If it's not your turn, you may exile a red card from your hand rather than pay this spell's mana cost.\nCreate two 3/1 red Elemental creature tokens with trample and haste. Sacrifice those tokens at the beginning of your next upkeep."
Lightning Skelemental,3.0,"['Black', 'Red']","['B', 'R']",None,['Creature'],"['Elemental', 'Skeleton']",Rare,MH1,6,1,None,"Trample, haste\nWhenever Lightning Skelemental deals combat damage to a player, that player discards two cards.\nAt the beginning of the end step, sacrifice Lightning Skelemental."
Fists of Flame,2.0,['Red'],['R'],None,['Instant'],None,Common,MH1,None,None,None,"Draw a card. Until end of turn, target creature gains trample and gets +1/+0 for each card you've drawn this turn."
Ice-Fang Coatl,2.0,"['Green', 'Blue']","['G', 'U']",['Snow'],['Creature'],['Snake'],Rare,MH1,1,1,None,"Flash\nFlying\nWhen Ice-Fang Coatl enters the battlefield, draw a card.\nIce-Fang Coatl has deathtouch as long as you control at least three other snow permanents."
Firebolt,1.0,['Red'],['R'],None,['Sorcery'],None,Uncommon,MH1,None,None,None,Firebolt deals 2 damage to any target.\nFlashback {4}{R} (You may cast this card from your graveyard for its flashback cost. Then exile it.)
Good-Fortune Unicorn,3.0,"['Green', 'White']","['G', 'W']",None,['Creature'],['Unicorn'],Uncommon,MH1,2,2,None,"Whenever another creature enters the battlefield under your control, put a +1/+1 counter on that creature."
Cleaving Sliver,4.0,['Red'],['R'],None,['Creature'],['Sliver'],Common,MH1,2,2,None,Sliver creatures you control get +2/+0.
"Kess, Dissident Mage",4.0,"['Black', 'Red', 'Blue']","['B', 'R', 'U']",['Legendary'],['Creature'],"['Human', 'Wizard']",Mythic,MH1,3,4,None,"Flying\nOnce during each of your turns, you may cast an instant or sorcery spell from your graveyard. If a spell cast this way would be put into your graveyard, exile it instead."
Bogardan Dragonheart,3.0,['Red'],['R'],None,['Creature'],"['Human', 'Shaman']",Common,MH1,2,2,None,"Sacrifice another creature: Until end of turn, Bogardan Dragonheart becomes a Dragon with base power and toughness 4/4, flying, and haste."
Kaya's Guile,3.0,"['Black', 'White']","['B', 'W']",None,['Instant'],None,Rare,MH1,None,None,None,Choose two —\n• Each opponent sacrifices a creature.\n• Exile all opponents' graveyards.\n• Create a 1/1 white and black Spirit creature token with flying.\n• You gain 4 life.\nEntwine {3} (Choose all if you pay the entwine cost.)
Bladeback Sliver,2.0,['Red'],['R'],None,['Creature'],['Sliver'],Common,MH1,2,2,None,"Hellbent — As long as you have no cards in hand, Sliver creatures you control have ""{T}: This creature deals 1 damage to target player or planeswalker."""
Ingenious Infiltrator,4.0,"['Black', 'Blue']","['B', 'U']",None,['Creature'],"['Vedalken', 'Ninja']",Uncommon,MH1,2,3,None,"Ninjutsu {U}{B} ({U}{B}, Return an unblocked attacker you control to hand: Put this card onto the battlefield from your hand tapped and attacking.)\nWhenever a Ninja you control deals combat damage to a player, draw a card."
Aria of Flame,3.0,['Red'],['R'],None,['Enchantment'],None,Rare,MH1,None,None,None,"When Aria of Flame enters the battlefield, each opponent gains 10 life.\nWhenever you cast an instant or sorcery spell, put a verse counter on Aria of Flame, then it deals damage equal to the number of verse counters on it to target player or planeswalker."
The First Sliver,5.0,"['Black', 'Green', 'Red', 'Blue', 'White']","['B', 'G', 'R', 'U', 'W']",['Legendary'],['Creature'],['Sliver'],Mythic,MH1,7,7,None,"Cascade (When you cast this spell, exile cards from the top of your library until you exile a nonland card that costs less. You may cast it without paying its mana cost. Put the exiled cards on the bottom of your library in a random order.)\nSliver spells you cast have cascade."
Alpine Guide,3.0,['Red'],['R'],['Snow'],['Creature'],"['Human', 'Scout']",Uncommon,MH1,3,3,None,"When Alpine Guide enters the battlefield, you may search your library for a Mountain card, put that card onto the battlefield tapped, then shuffle.\nAlpine Guide attacks each combat if able.\nWhen Alpine Guide leaves the battlefield, sacrifice a Mountain."
Fallen Shinobi,5.0,"['Black', 'Blue']","['B', 'U']",None,['Creature'],"['Zombie', 'Ninja']",Rare,MH1,5,4,None,"Ninjutsu {2}{U}{B} ({2}{U}{B}, Return an unblocked attacker you control to hand: Put this card onto the battlefield from your hand tapped and attacking.)\nWhenever Fallen Shinobi deals combat damage to a player, that player exiles the top two cards of their library. Until end of turn, you may play those cards without paying their mana costs."
Rank Officer,4.0,['Black'],['B'],None,['Creature'],"['Zombie', 'Soldier']",Common,MH1,3,1,None,"When Rank Officer enters the battlefield, you may discard a card. If you do, create a 2/2 black Zombie creature token.\n{1}{B}, {T}, Exile a creature card from your graveyard: Each opponent loses 2 life."
Etchings of the Chosen,3.0,"['Black', 'White']","['B', 'W']",None,['Enchantment'],None,Uncommon,MH1,None,None,None,"As Etchings of the Chosen enters the battlefield, choose a creature type.\nCreatures you control of the chosen type get +1/+1.\n{1}, Sacrifice a creature of the chosen type: Target creature you control gains indestructible until end of turn."
Unearth,1.0,['Black'],['B'],None,['Sorcery'],None,Common,MH1,None,None,None,"Return target creature card with mana value 3 or less from your graveyard to the battlefield.\nCycling {2} ({2}, Discard this card: Draw a card.)"
Eladamri's Call,2.0,"['Green', 'White']","['G', 'W']",None,['Instant'],None,Rare,MH1,None,None,None,"Search your library for a creature card, reveal that card, put it into your hand, then shuffle."
Warteye Witch,3.0,['Black'],['B'],None,['Creature'],"['Goblin', 'Shaman']",Common,MH1,3,2,None,"Whenever Warteye Witch or another creature you control dies, scry 1."
Collected Conjuring,4.0,"['Red', 'Blue']","['R', 'U']",None,['Sorcery'],None,Rare,MH1,None,None,None,Exile the top six cards of your library. You may cast up to two sorcery spells with mana value 3 or less from among them without paying their mana costs. Put the exiled cards not cast this way on the bottom of your library in a random order.
"Yawgmoth, Thran Physician",4.0,['Black'],['B'],['Legendary'],['Creature'],"['Human', 'Cleric']",Mythic,MH1,2,4,None,"Protection from Humans\nPay 1 life, Sacrifice another creature: Put a -1/-1 counter on up to one target creature and draw a card.\n{B}{B}, Discard a card: Proliferate. (Choose any number of permanents and/or players, then give each another counter of each kind already there.)"
Cloudshredder Sliver,2.0,"['Red', 'White']","['R', 'W']",None,['Creature'],['Sliver'],Rare,MH1,1,1,None,Sliver creatures you control have flying and haste.
Abominable Treefolk,4.0,"['Green', 'Blue']","['G', 'U']",['Snow'],['Creature'],['Treefolk'],Uncommon,MH1,*,*,None,"Trample\nAbominable Treefolk's power and toughness are each equal to the number of snow permanents you control.\nWhen Abominable Treefolk enters the battlefield, tap target creature an opponent controls. That creature doesn't untap during its controller's next untap step."
Venomous Changeling,3.0,['Black'],['B'],None,['Creature'],['Shapeshifter'],Common,MH1,1,3,None,Changeling (This card is every creature type.)\nDeathtouch
Winding Way,2.0,['Green'],['G'],None,['Sorcery'],None,Common,MH1,None,None,None,Choose creature or land. Reveal the top four cards of your library. Put all cards of the chosen type revealed this way into your hand and the rest into your graveyard.
Undead Augur,2.0,['Black'],['B'],None,['Creature'],"['Zombie', 'Wizard']",Uncommon,MH1,2,2,None,"Whenever Undead Augur or another Zombie you control dies, you draw a card and you lose 1 life."
Scale Up,1.0,['Green'],['G'],None,['Sorcery'],None,Uncommon,MH1,None,None,None,"Until end of turn, target creature you control becomes a green Wurm with base power and toughness 6/4.\nOverload {4}{G}{G} (You may cast this spell for its overload cost. If you do, change its text by replacing all instances of ""target"" with ""each."")"
Umezawa's Charm,2.0,['Black'],['B'],None,['Instant'],None,Common,MH1,None,None,None,Choose one —\n• Target creature gets +2/+2 until end of turn.\n• Target creature gets -1/-1 until end of turn.\n• You gain 2 life.
Unbound Flourishing,3.0,['Green'],['G'],None,['Enchantment'],None,Mythic,MH1,None,None,None,"Whenever you cast a permanent spell with a mana cost that contains {X}, double the value of X.\nWhenever you cast an instant or sorcery spell or activate an ability, if that spell's mana cost or that ability's activation cost contains {X}, copy that spell or ability. You may choose new targets for the copy."
Throatseeker,3.0,['Black'],['B'],None,['Creature'],"['Vampire', 'Ninja']",Uncommon,MH1,3,2,None,Unblocked attacking Ninjas you control have lifelink.
Weather the Storm,2.0,['Green'],['G'],None,['Instant'],None,Common,MH1,None,None,None,"You gain 3 life.\nStorm (When you cast this spell, copy it for each spell cast before it this turn.)"
Silumgar Scavenger,5.0,['Black'],['B'],None,['Creature'],"['Zombie', 'Bird']",Common,MH1,2,3,None,"Flying\nExploit (When this creature enters the battlefield, you may sacrifice a creature.)\nWhenever another creature you control dies, put a +1/+1 counter on Silumgar Scavenger. It gains haste until end of turn if it exploited that creature."
Webweaver Changeling,5.0,['Green'],['G'],None,['Creature'],['Shapeshifter'],Uncommon,MH1,3,5,None,"Changeling (This card is every creature type.)\nReach\nWhen Webweaver Changeling enters the battlefield, if there are three or more creature cards in your graveyard, you gain 5 life."
Wall of Blossoms,2.0,['Green'],['G'],None,['Creature'],"['Plant', 'Wall']",Uncommon,MH1,0,4,None,"Defender\nWhen Wall of Blossoms enters the battlefield, draw a card."
Smiting Helix,4.0,['Black'],"['B', 'R', 'W']",None,['Sorcery'],None,Uncommon,MH1,None,None,None,Smiting Helix deals 3 damage to any target and you gain 3 life.\nFlashback {R}{W} (You may cast this card from your graveyard for its flashback cost. Then exile it.)
Twin-Silk Spider,3.0,['Green'],['G'],None,['Creature'],['Spider'],Common,MH1,1,2,None,"Reach\nWhen Twin-Silk Spider enters the battlefield, create a 1/2 green Spider creature token with reach."
Sling-Gang Lieutenant,4.0,['Black'],['B'],None,['Creature'],['Goblin'],Uncommon,MH1,1,1,None,"When Sling-Gang Lieutenant enters the battlefield, create two 1/1 red Goblin creature tokens.\nSacrifice a Goblin: Target player loses 1 life and you gain 1 life."
Trumpeting Herd,4.0,['Green'],['G'],None,['Sorcery'],None,Common,MH1,None,None,None,"Create a 3/3 green Elephant creature token.\nRebound (If you cast this spell from your hand, exile it as it resolves. At the beginning of your next upkeep, you may cast this card from exile without paying its mana cost.)"
Ransack the Lab,2.0,['Black'],['B'],None,['Sorcery'],None,Common,MH1,None,None,None,Look at the top three cards of your library. Put one of them into your hand and the rest into your graveyard.
Treetop Ambusher,2.0,['Green'],['G'],None,['Creature'],"['Elf', 'Berserker']",Common,MH1,2,1,None,"Dash {1}{G} (You may cast this spell for its dash cost. If you do, it gains haste, and it's returned from the battlefield to its owner's hand at the beginning of the next end step.)\nWhenever Treetop Ambusher attacks, target creature you control gets +1/+1 until end of turn."
Putrid Goblin,2.0,['Black'],['B'],None,['Creature'],"['Zombie', 'Goblin']",Common,MH1,2,2,None,"Persist (When this creature dies, if it had no -1/-1 counters on it, return it to the battlefield under its owner's control with a -1/-1 counter on it.)"
Tempered Sliver,3.0,['Green'],['G'],None,['Creature'],['Sliver'],Uncommon,MH1,2,2,None,"Sliver creatures you control have ""Whenever this creature deals combat damage to a player, put a +1/+1 counter on it."""
Shatter Assumptions,3.0,['Black'],['B'],None,['Sorcery'],None,Uncommon,MH1,None,None,None,Choose one —\n• Target opponent reveals their hand and discards all colorless nonland cards.\n• Target opponent reveals their hand and discards all multicolored cards.
Treefolk Umbra,3.0,['Green'],['G'],None,['Enchantment'],['Aura'],Common,MH1,None,None,None,"Enchant creature\nEnchanted creature gets +0/+2 and assigns combat damage equal to its toughness rather than its power.\nTotem armor (If enchanted creature would be destroyed, instead remove all damage from it and destroy this Aura.)"
Sadistic Obsession,4.0,['Black'],['B'],None,['Enchantment'],['Aura'],Uncommon,MH1,None,None,None,"Enchant creature\nEnchanted creature has ""{B}, {T}: Put a -1/-1 counter on target creature."""
Thornado,3.0,['Green'],['G'],None,['Instant'],None,Common,MH1,None,None,None,"Destroy target creature with flying.\nCycling {1}{G} ({1}{G}, Discard this card: Draw a card.)"
Return from Extinction,2.0,['Black'],['B'],None,['Sorcery'],None,Common,MH1,None,None,None,Choose one —\n• Return target creature card from your graveyard to your hand.\n• Return two target creature cards that share a creature type from your graveyard to your hand.
Spore Frog,1.0,['Green'],['G'],None,['Creature'],['Frog'],Common,MH1,1,1,None,Sacrifice Spore Frog: Prevent all combat damage that would be dealt this turn.
Plague Engineer,3.0,['Black'],['B'],None,['Creature'],"['Phyrexian', 'Carrier']",Rare,MH1,2,2,None,"Deathtouch\nAs Plague Engineer enters the battlefield, choose a creature type.\nCreatures of the chosen type your opponents control get -1/-1."
Savage Swipe,1.0,['Green'],['G'],None,['Sorcery'],None,Common,MH1,None,None,None,Target creature you control gets +2/+2 until end of turn if its power is 2. Then it fights target creature you don't control. (Each deals damage equal to its power to the other.)
Ninja of the New Moon,5.0,['Black'],['B'],None,['Creature'],"['Spirit', 'Ninja']",Common,MH1,6,3,None,"Ninjutsu {3}{B} ({3}{B}, Return an unblocked attacker you control to hand: Put this card onto the battlefield from your hand tapped and attacking.)"
Squirrel Nest,3.0,['Green'],['G'],None,['Enchantment'],['Aura'],Uncommon,MH1,None,None,None,"Enchant land\nEnchanted land has ""{T}: Create a 1/1 green Squirrel creature token."""
