Name,CMC,Colors,Color identity,Supertypes,Types,Subtypes,Rarity,Set,Power,Toughness,Loyalty,Text
Nether Spirit,3.0,['Black'],['B'],None,['Creature'],['Spirit'],Rare,MH1,2,2,None,"At the beginning of your upkeep, if Nether Spirit is the only creature card in your graveyard, you may return Nether Spirit to the battlefield."
Springbloom Druid,3.0,['Green'],['G'],None,['Creature'],"['Elf', 'Druid']",Common,MH1,1,1,None,"When Springbloom Druid enters the battlefield, you may sacrifice a land. If you do, search your library for up to two basic land cards, put them onto the battlefield tapped, then shuffle."
Mob,5.0,['Black'],['B'],None,['Instant'],None,Common,MH1,None,None,None,Convoke (Your creatures can help cast this spell. Each creature you tap while casting this spell pays for {1} or one mana of that creature's color.)\nDestroy target creature.
Saddled Rimestag,2.0,['Green'],['G'],['Snow'],['Creature'],['Elk'],Uncommon,MH1,2,2,None,Saddled Rimestag gets +2/+2 as long as you had another creature enter the battlefield under your control this turn.
Mind Rake,3.0,['Black'],['B'],None,['Sorcery'],None,Common,MH1,None,None,None,"Target player discards two cards.\nOverload {1}{B} (You may cast this spell for its overload cost. If you do, change its text by replacing all instances of ""target"" with ""each."")"
Mother Bear,2.0,['Green'],['G'],None,['Creature'],['Bear'],Common,MH1,2,2,None,"{3}{G}{G}, Exile Mother Bear from your graveyard: Create two 2/2 green Bear creature tokens. Activate only as a sorcery."
Headless Specter,3.0,['Black'],['B'],None,['Creature'],['Specter'],Common,MH1,2,2,None,"Flying\nHellbent — Whenever Headless Specter deals combat damage to a player, if you have no cards in hand, that player discards a card at random."
Llanowar Tribe,3.0,['Green'],['G'],None,['Creature'],"['Elf', 'Druid']",Uncommon,MH1,3,3,None,{T}: Add {G}{G}{G}.
Graveshifter,4.0,['Black'],['B'],None,['Creature'],['Shapeshifter'],Uncommon,MH1,2,2,None,"Changeling (This card is every creature type.)\nWhen Graveshifter enters the battlefield, you may return target creature card from your graveyard to your hand."
Krosan Tusker,7.0,['Green'],['G'],None,['Creature'],"['Boar', 'Beast']",Common,MH1,6,5,None,"Cycling {2}{G} ({2}{G}, Discard this card: Draw a card.)\nWhen you cycle Krosan Tusker, you may search your library for a basic land card, reveal that card, put it into your hand, then shuffle. (Do this before you draw.)"
Gluttonous Slug,2.0,['Black'],['B'],None,['Creature'],"['Slug', 'Horror']",Common,MH1,0,3,None,"Menace\nEvolve (Whenever a creature enters the battlefield under your control, if that creature has greater power or toughness than this creature, put a +1/+1 counter on this creature.)"
Hexdrinker,1.0,['Green'],['G'],None,['Creature'],['Snake'],Mythic,MH1,2,1,None,Level up {1} ({1}: Put a level counter on this. Level up only as a sorcery.)\nLEVEL 3-7\n4/4\nProtection from instants\nLEVEL 8+\n6/6\nProtection from everything
Flusterstorm,1.0,['Blue'],['U'],None,['Instant'],None,Rare,MH1,None,None,None,"Counter target instant or sorcery spell unless its controller pays {1}.\nStorm (When you cast this spell, copy it for each spell cast before it this turn. You may choose new targets for the copies.)"
Force of Despair,3.0,['Black'],['B'],None,['Instant'],None,Rare,MH1,None,None,None,"If it's not your turn, you may exile a black card from your hand rather than pay this spell's mana cost.\nDestroy all creatures that entered the battlefield this turn."
Glacial Revelation,3.0,['Green'],['G'],None,['Sorcery'],None,Uncommon,MH1,None,None,None,Reveal the top six cards of your library. You may put any number of snow permanent cards from among them into your hand. Put the rest into your graveyard.
Snow-Covered Forest,0.0,None,['G'],"['Basic', 'Snow']",['Land'],['Forest'],Common,MH1,None,None,None,({T}: Add {G}.)
First-Sphere Gargantua,6.0,['Black'],['B'],None,['Creature'],"['Phyrexian', 'Horror']",Common,MH1,5,4,None,"When First-Sphere Gargantua enters the battlefield, you draw a card and you lose 1 life.\nUnearth {2}{B} ({2}{B}: Return this card from your graveyard to the battlefield. It gains haste. Exile it at the beginning of the next end step or if it would leave the battlefield. Unearth only as a sorcery.)"
Genesis,5.0,['Green'],['G'],None,['Creature'],['Incarnation'],Rare,MH1,4,4,None,"At the beginning of your upkeep, if Genesis is in your graveyard, you may pay {2}{G}. If you do, return target creature card from your graveyard to your hand."
Snow-Covered Mountain,0.0,None,['R'],"['Basic', 'Snow']",['Land'],['Mountain'],Common,MH1,None,None,None,({T}: Add {R}.)
Feaster of Fools,6.0,['Black'],['B'],None,['Creature'],['Demon'],Uncommon,MH1,3,3,None,"Convoke (Your creatures can help cast this spell. Each creature you tap while casting this spell pays for {1} or one mana of that creature's color.)\nFlying\nDevour 2 (As this enters the battlefield, you may sacrifice any number of creatures. This creature enters the battlefield with twice that many +1/+1 counters on it.)"
Frostwalla,3.0,['Green'],['G'],['Snow'],['Creature'],['Lizard'],Common,MH1,2,2,None,{S}: Frostwalla gets +2/+2 until end of turn. Activate only once each turn. ({S} can be paid with one mana from a snow source.)
Snow-Covered Swamp,0.0,None,['B'],"['Basic', 'Snow']",['Land'],['Swamp'],Common,MH1,None,None,None,({T}: Add {B}.)
Endling,4.0,['Black'],['B'],None,['Creature'],"['Zombie', 'Shapeshifter']",Rare,MH1,3,3,None,"{B}: Endling gains menace until end of turn.\n{B}: Endling gains deathtouch until end of turn.\n{B}: Endling gains undying until end of turn. (When this creature dies, if it had no +1/+1 counters on it, return it to the battlefield under its owner's control with a +1/+1 counter on it.)\n{1}: Endling gets +1/-1 or -1/+1 until end of turn."
Force of Vigor,4.0,['Green'],['G'],None,['Instant'],None,Rare,MH1,None,None,None,"If it's not your turn, you may exile a green card from your hand rather than pay this spell's mana cost.\nDestroy up to two target artifacts and/or enchantments."
Snow-Covered Island,0.0,None,['U'],"['Basic', 'Snow']",['Land'],['Island'],Common,MH1,None,None,None,({T}: Add {U}.)
Dregscape Sliver,2.0,['Black'],['B'],None,['Creature'],['Sliver'],Uncommon,MH1,2,2,None,Each Sliver creature card in your graveyard has unearth {2}.\nUnearth {2} ({2}: Return this card from your graveyard to the battlefield. It gains haste. Exile it at the beginning of the next end step or if it would leave the battlefield. Unearth only as a sorcery.)
Excavating Anurid,5.0,['Green'],['G'],None,['Creature'],"['Frog', 'Beast']",Common,MH1,4,4,None,"When Excavating Anurid enters the battlefield, you may sacrifice a land. If you do, draw a card.\nThreshold — As long as seven or more cards are in your graveyard, Excavating Anurid gets +1/+1 and has vigilance."
Snow-Covered Plains,0.0,None,['W'],"['Basic', 'Snow']",['Land'],['Plains'],Common,MH1,None,None,None,({T}: Add {W}.)
Diabolic Edict,2.0,['Black'],['B'],None,['Instant'],None,Common,MH1,None,None,None,Target player sacrifices a creature.
Elvish Fury,1.0,['Green'],['G'],None,['Instant'],None,Common,MH1,None,None,None,"Buyback {4} (You may pay an additional {4} as you cast this spell. If you do, put this card into your hand as it resolves.)\nTarget creature gets +2/+2 until end of turn."
Waterlogged Grove,0.0,None,"['G', 'U']",None,['Land'],None,Rare,MH1,None,None,None,"{T}, Pay 1 life: Add {G} or {U}.\n{1}, {T}, Sacrifice Waterlogged Grove: Draw a card."
Defile,1.0,['Black'],['B'],None,['Instant'],None,Common,MH1,None,None,None,Target creature gets -1/-1 until end of turn for each Swamp you control.
Deep Forest Hermit,5.0,['Green'],['G'],None,['Creature'],"['Elf', 'Druid']",Rare,MH1,1,1,None,"Vanishing 3 (This creature enters the battlefield with three time counters on it. At the beginning of your upkeep, remove a time counter from it. When the last is removed, sacrifice it.)\nWhen Deep Forest Hermit enters the battlefield, create four 1/1 green Squirrel creature tokens.\nSquirrels you control get +1/+1."
Tranquil Thicket,0.0,None,['G'],None,['Land'],None,Uncommon,MH1,None,None,None,"Tranquil Thicket enters the battlefield tapped.\n{T}: Add {G}.\nCycling {G} ({G}, Discard this card: Draw a card.)"
Dead of Winter,3.0,['Black'],['B'],None,['Sorcery'],None,Rare,MH1,None,None,None,"All nonsnow creatures get -X/-X until end of turn, where X is the number of snow permanents you control."
Crashing Footfalls,0.0,['Green'],['G'],None,['Sorcery'],None,Rare,MH1,None,None,None,"Suspend 4—{G} (Rather than cast this card from your hand, pay {G} and exile it with four time counters on it. At the beginning of your upkeep, remove a time counter. When the last is removed, cast it without paying its mana cost.)\nCreate two 4/4 green Rhino creature tokens with trample."
Sunbaked Canyon,0.0,None,"['R', 'W']",None,['Land'],None,Rare,MH1,None,None,None,"{T}, Pay 1 life: Add {R} or {W}.\n{1}, {T}, Sacrifice Sunbaked Canyon: Draw a card."
Crypt Rats,3.0,['Black'],['B'],None,['Creature'],['Rat'],Uncommon,MH1,1,1,None,{X}: Crypt Rats deals X damage to each creature and each player. Spend only black mana on X.
Conifer Wurm,5.0,['Green'],['G'],['Snow'],['Creature'],['Wurm'],Uncommon,MH1,4,4,None,"Trample\n{3}{G}: Conifer Wurm gets +X/+X until end of turn, where X is the number of snow permanents you control."
Silent Clearing,0.0,None,"['B', 'W']",None,['Land'],None,Rare,MH1,None,None,None,"{T}, Pay 1 life: Add {W} or {B}.\n{1}, {T}, Sacrifice Silent Clearing: Draw a card."
Cordial Vampire,2.0,['Black'],['B'],None,['Creature'],['Vampire'],Rare,MH1,1,1,None,"Whenever Cordial Vampire or another creature dies, put a +1/+1 counter on each Vampire you control."
Collector Ouphe,2.0,['Green'],['G'],None,['Creature'],['Ouphe'],Rare,MH1,2,2,None,Activated abilities of artifacts can't be activated.
Secluded Steppe,0.0,None,['W'],None,['Land'],None,Uncommon,MH1,None,None,None,"Secluded Steppe enters the battlefield tapped.\n{T}: Add {W}.\nCycling {W} ({W}, Discard this card: Draw a card.)"
Changeling Outcast,1.0,['Black'],['B'],None,['Creature'],['Shapeshifter'],Common,MH1,1,1,None,Changeling (This card is every creature type.)\nChangeling Outcast can't block and can't be blocked.
Bellowing Elk,4.0,['Green'],['G'],None,['Creature'],['Elk'],Common,MH1,4,2,None,"As long as you had another creature enter the battlefield under your control this turn, Bellowing Elk has trample and indestructible."
Prismatic Vista,0.0,None,None,None,['Land'],None,Rare,MH1,None,None,None,"{T}, Pay 1 life, Sacrifice Prismatic Vista: Search your library for a basic land card, put it onto the battlefield, then shuffle."
Carrion Feeder,1.0,['Black'],['B'],None,['Creature'],['Zombie'],Uncommon,MH1,1,1,None,Carrion Feeder can't block.\nSacrifice a creature: Put a +1/+1 counter on Carrion Feeder.
Ayula's Influence,3.0,['Green'],['G'],None,['Enchantment'],None,Rare,MH1,None,None,None,Discard a land card: Create a 2/2 green Bear creature token.
Nurturing Peatland,0.0,None,"['B', 'G']",None,['Land'],None,Rare,MH1,None,None,None,"{T}, Pay 1 life: Add {B} or {G}.\n{1}, {T}, Sacrifice Nurturing Peatland: Draw a card."
Cabal Therapist,1.0,['Black'],['B'],None,['Creature'],['Horror'],Rare,MH1,1,1,None,"Menace\nAt the beginning of your precombat main phase, you may sacrifice a creature. When you do, choose a nonland card name, then target player reveals their hand and discards all cards with that name."
"Ayula, Queen Among Bears",2.0,['Green'],['G'],['Legendary'],['Creature'],['Bear'],Rare,MH1,2,2,None,"Whenever another Bear enters the battlefield under your control, choose one —\n• Put two +1/+1 counters on target Bear.\n• Target Bear you control fights target creature you don't control."
Lonely Sandbar,0.0,None,['U'],None,['Land'],None,Uncommon,MH1,None,None,None,"Lonely Sandbar enters the battlefield tapped.\n{T}: Add {U}.\nCycling {U} ({U}, Discard this card: Draw a card.)"
Azra Smokeshaper,4.0,['Black'],['B'],None,['Creature'],"['Azra', 'Ninja']",Common,MH1,3,3,None,"Ninjutsu {1}{B} ({1}{B}, Return an unblocked attacker you control to hand: Put this card onto the battlefield from your hand tapped and attacking.)\nWhen Azra Smokeshaper enters the battlefield, target creature you control gains indestructible until end of turn."
Volatile Claws,3.0,['Red'],['R'],None,['Instant'],None,Common,MH1,None,None,None,"Until end of turn, creatures you control get +2/+0 and gain all creature types."
Hall of Heliod's Generosity,0.0,None,['W'],['Legendary'],['Land'],None,Rare,MH1,None,None,None,"{T}: Add {C}.\n{1}{W}, {T}: Put target enchantment card from your graveyard on top of your library."
Winter's Rest,2.0,['Blue'],['U'],['Snow'],['Enchantment'],['Aura'],Common,MH1,None,None,None,"Enchant creature\nWhen Winter's Rest enters the battlefield, tap enchanted creature.\nAs long as you control another snow permanent, enchanted creature doesn't untap during its controller's untap step."
Viashino Sandsprinter,3.0,['Red'],['R'],None,['Creature'],"['Viashino', 'Warrior']",Common,MH1,4,1,None,"Trample, haste\nAt the beginning of the end step, return Viashino Sandsprinter to its owner's hand. (Return it only if it's on the battlefield.)\nCycling {R} ({R}, Discard this card: Draw a card.)"
Frostwalk Bastion,0.0,None,None,['Snow'],['Land'],None,Uncommon,MH1,None,None,None,"{T}: Add {C}.\n{1}{S}: Until end of turn, Frostwalk Bastion becomes a 2/3 Construct artifact creature. It's still a land. ({S} can be paid with one mana from a snow source.)\nWhenever Frostwalk Bastion deals combat damage to a creature, tap that creature and it doesn't untap during its controller's next untap step."
Windcaller Aven,6.0,['Blue'],['U'],None,['Creature'],"['Bird', 'Wizard']",Common,MH1,4,3,None,"Flying\nCycling {U} ({U}, Discard this card: Draw a card.)\nWhen you cycle Windcaller Aven, target creature gains flying until end of turn."
Forgotten Cave,0.0,None,['R'],None,['Land'],None,Uncommon,MH1,None,None,None,"Forgotten Cave enters the battlefield tapped.\n{T}: Add {R}.\nCycling {R} ({R}, Discard this card: Draw a card.)"
Watcher for Tomorrow,2.0,['Blue'],['U'],None,['Creature'],"['Human', 'Wizard']",Uncommon,MH1,2,1,None,"Hideaway (This creature enters the battlefield tapped. When it does, look at the top four cards of your library, exile one face down, then put the rest on the bottom of your library.)\nWhen Watcher for Tomorrow leaves the battlefield, put the exiled card into its owner's hand."
Vengeful Devil,2.0,['Red'],['R'],None,['Creature'],['Devil'],Uncommon,MH1,1,1,None,Haste\nMorbid — {T}: Vengeful Devil deals 1 damage to any target. Activate only if a creature died this turn.
Fiery Islet,0.0,None,"['R', 'U']",None,['Land'],None,Rare,MH1,None,None,None,"{T}, Pay 1 life: Add {U} or {R}.\n{1}, {T}, Sacrifice Fiery Islet: Draw a card."
"Urza, Lord High Artificer",4.0,['Blue'],['U'],['Legendary'],['Creature'],"['Human', 'Artificer']",Mythic,MH1,1,4,None,"When Urza, Lord High Artificer enters the battlefield, create a 0/0 colorless Construct artifact creature token with ""This creature gets +1/+1 for each artifact you control.""\nTap an untapped artifact you control: Add {U}.\n{5}: Shuffle your library, then exile the top card. Until end of turn, you may play that card without paying its mana cost."
Urza's Rage,3.0,['Red'],['R'],None,['Instant'],None,Uncommon,MH1,None,None,None,"Kicker {8}{R} (You may pay an additional {8}{R} as you cast this spell.)\nThis spell can't be countered.\nUrza's Rage deals 3 damage to any target. If this spell was kicked, instead it deals 10 damage to that permanent or player and the damage can't be prevented."
Cave of Temptation,0.0,None,None,None,['Land'],None,Common,MH1,None,None,None,"{T}: Add {C}.\n{1}, {T}: Add one mana of any color.\n{4}, {T}, Sacrifice Cave of Temptation: Put two +1/+1 counters on target creature. Activate only as a sorcery."
Twisted Reflection,2.0,['Blue'],"['B', 'U']",None,['Instant'],None,Uncommon,MH1,None,None,None,Choose one —\n• Target creature gets -6/-0 until end of turn.\n• Switch target creature's power and toughness until end of turn.\nEntwine {B} (Choose both if you pay the entwine cost.)
Throes of Chaos,4.0,['Red'],['R'],None,['Sorcery'],None,Uncommon,MH1,None,None,None,"Cascade (When you cast this spell, exile cards from the top of your library until you exile a nonland card that costs less. You may cast it without paying its mana cost. Put the exiled cards on the bottom of your library in a random order.)\nRetrace (You may cast this card from your graveyard by discarding a land card in addition to paying its other costs.)"
Barren Moor,0.0,None,['B'],None,['Land'],None,Uncommon,MH1,None,None,None,"Barren Moor enters the battlefield tapped.\n{T}: Add {B}.\nCycling {B} ({B}, Discard this card: Draw a card.)"
Tribute Mage,3.0,['Blue'],['U'],None,['Creature'],"['Human', 'Wizard']",Uncommon,MH1,2,2,None,"When Tribute Mage enters the battlefield, you may search your library for an artifact card with mana value 2, reveal that card, put it into your hand, then shuffle."
Tectonic Reformation,2.0,['Red'],['R'],None,['Enchantment'],None,Rare,MH1,None,None,None,"Each land card in your hand has cycling {R}.\nCycling {2} ({2}, Discard this card: Draw a card.)"
Universal Automaton,1.0,None,None,None,"['Artifact', 'Creature']",['Shapeshifter'],Common,MH1,1,1,None,Changeling (This card is every creature type.)
String of Disappearances,1.0,['Blue'],['U'],None,['Instant'],None,Common,MH1,None,None,None,"Return target creature to its owner's hand. Then that creature's controller may pay {U}{U}. If the player does, they may copy this spell and may choose a new target for that copy."
Spiteful Sliver,3.0,['Red'],['R'],None,['Creature'],['Sliver'],Rare,MH1,2,2,None,"Sliver creatures you control have ""Whenever this creature is dealt damage, it deals that much damage to target player or planeswalker."""
Talisman of Resilience,2.0,None,"['B', 'G']",None,['Artifact'],None,Uncommon,MH1,None,None,None,{T}: Add {C}.\n{T}: Add {B} or {G}. Talisman of Resilience deals 1 damage to you.
Stream of Thought,1.0,['Blue'],['U'],None,['Sorcery'],None,Common,MH1,None,None,None,"Target player mills four cards. You shuffle up to four cards from your graveyard into your library.\nReplicate {2}{U}{U} (When you cast this spell, copy it for each time you paid its replicate cost. You may choose new targets for the copies.)"
Rime Tender,2.0,['Green'],['G'],['Snow'],['Creature'],"['Human', 'Druid']",Common,MH1,2,2,None,{T}: Untap another target snow permanent.
Talisman of Hierarchy,2.0,None,"['B', 'W']",None,['Artifact'],None,Uncommon,MH1,None,None,None,{T}: Add {C}.\n{T}: Add {W} or {B}. Talisman of Hierarchy deals 1 damage to you.
Spell Snuff,3.0,['Blue'],['U'],None,['Instant'],None,Common,MH1,None,None,None,"Counter target spell.\nFateful hour — If you have 5 or less life, draw a card."
Regrowth,2.0,['Green'],['G'],None,['Sorcery'],None,Uncommon,MH1,None,None,None,Return target card from your graveyard to your hand.
Talisman of Curiosity,2.0,None,"['G', 'U']",None,['Artifact'],None,Uncommon,MH1,None,None,None,{T}: Add {C}.\n{T}: Add {G} or {U}. Talisman of Curiosity deals 1 damage to you.
Smoke Shroud,2.0,['Blue'],['U'],None,['Enchantment'],['Aura'],Common,MH1,None,None,None,"Enchant creature\nEnchanted creature gets +1/+1 and has flying.\nWhen a Ninja enters the battlefield under your control, you may return Smoke Shroud from your graveyard to the battlefield attached to that creature."
Nimble Mongoose,1.0,['Green'],['G'],None,['Creature'],['Mongoose'],Common,MH1,1,1,None,Shroud (This creature can't be the target of spells or abilities.)\nThreshold — Nimble Mongoose gets +2/+2 as long as seven or more cards are in your graveyard.
Talisman of Creativity,2.0,None,"['R', 'U']",None,['Artifact'],None,Uncommon,MH1,None,None,None,{T}: Add {C}.\n{T}: Add {U} or {R}. Talisman of Creativity deals 1 damage to you.
Scuttling Sliver,3.0,['Blue'],['U'],None,['Creature'],"['Sliver', 'Trilobite']",Uncommon,MH1,2,2,None,"Sliver creatures you control have ""{2}: Untap this creature."""
Nantuko Cultivator,4.0,['Green'],['G'],None,['Creature'],"['Insect', 'Druid']",Uncommon,MH1,2,2,None,"When Nantuko Cultivator enters the battlefield, you may discard any number of land cards. Put that many +1/+1 counters on Nantuko Cultivator and draw that many cards."
Talisman of Conviction,2.0,None,"['R', 'W']",None,['Artifact'],None,Uncommon,MH1,None,None,None,{T}: Add {C}.\n{T}: Add {R} or {W}. Talisman of Conviction deals 1 damage to you.
Scour All Possibilities,2.0,['Blue'],['U'],None,['Sorcery'],None,Common,MH1,None,None,None,"Scry 2, then draw a card.\nFlashback {4}{U} (You may cast this card from your graveyard for its flashback cost. Then exile it.)"
Sword of Truth and Justice,3.0,None,None,None,['Artifact'],['Equipment'],Mythic,MH1,None,None,None,"Equipped creature gets +2/+2 and has protection from white and from blue.\nWhenever equipped creature deals combat damage to a player, put a +1/+1 counter on a creature you control, then proliferate. (Choose any number of permanents and/or players, then give each another counter of each kind already there.)\nEquip {2}"
Rebuild,3.0,['Blue'],['U'],None,['Instant'],None,Uncommon,MH1,None,None,None,"Return all artifacts to their owners' hands.\nCycling {2} ({2}, Discard this card: Draw a card.)"
Murasa Behemoth,6.0,['Green'],['G'],None,['Creature'],['Beast'],Common,MH1,5,5,None,Trample\nMurasa Behemoth gets +3/+3 as long as there is a land card in your graveyard.
Rain of Revelation,4.0,['Blue'],['U'],None,['Instant'],None,Common,MH1,None,None,None,"Draw three cards, then discard a card."
Prohibit,2.0,['Blue'],['U'],None,['Instant'],None,Common,MH1,None,None,None,"Kicker {2} (You may pay an additional {2} as you cast this spell.)\nCounter target spell if its mana value is 2 or less. If this spell was kicked, counter that spell if its mana value is 4 or less instead."
Pondering Mage,5.0,['Blue'],['U'],None,['Creature'],"['Human', 'Wizard']",Common,MH1,3,4,None,"When Pondering Mage enters the battlefield, look at the top three cards of your library, then put them back in any order. You may shuffle. Draw a card."
Phantom Ninja,3.0,['Blue'],['U'],None,['Creature'],"['Illusion', 'Ninja']",Common,MH1,2,2,None,Phantom Ninja can't be blocked.
Phantasmal Form,3.0,['Blue'],['U'],None,['Instant'],None,Common,MH1,None,None,None,"Until end of turn, up to two target creatures each have base power and toughness 3/3, gain flying, and become blue Illusions in addition to their other colors and types.\nDraw a card."
Oneirophage,4.0,['Blue'],['U'],None,['Creature'],"['Squid', 'Illusion']",Uncommon,MH1,1,2,None,"Flying\nWhenever you draw a card, put a +1/+1 counter on Oneirophage."
Moonblade Shinobi,4.0,['Blue'],['U'],None,['Creature'],"['Human', 'Ninja']",Common,MH1,3,2,None,"Ninjutsu {2}{U} ({2}{U}, Return an unblocked attacker you control to hand: Put this card onto the battlefield from your hand tapped and attacking.)\nWhenever Moonblade Shinobi deals combat damage to a player, create a 1/1 blue Illusion creature token with flying."
Mist-Syndicate Naga,3.0,['Blue'],['U'],None,['Creature'],"['Naga', 'Ninja']",Rare,MH1,3,1,None,"Ninjutsu {2}{U} ({2}{U}, Return an unblocked attacker you control to hand: Put this card onto the battlefield from your hand tapped and attacking.)\nWhenever Mist-Syndicate Naga deals combat damage to a player, create a token that's a copy of Mist-Syndicate Naga."
Mirrodin Besieged,3.0,['Blue'],['U'],None,['Enchantment'],None,Rare,MH1,None,None,None,"As Mirrodin Besieged enters the battlefield, choose Mirran or Phyrexian.\n• Mirran — Whenever you cast an artifact spell, create a 1/1 colorless Myr artifact creature token.\n• Phyrexian — At the beginning of your end step, draw a card, then discard a card. Then if there are fifteen or more artifact cards in your graveyard, target opponent loses the game."
Marit Lage's Slumber,2.0,['Blue'],['U'],"['Legendary', 'Snow']",['Enchantment'],None,Rare,MH1,None,None,None,"Whenever Marit Lage's Slumber or another snow permanent enters the battlefield under your control, scry 1.\nAt the beginning of your upkeep, if you control ten or more snow permanents, sacrifice Marit Lage's Slumber. If you do, create Marit Lage, a legendary 20/20 black Avatar creature token with flying and indestructible."
Man-o'-War,3.0,['Blue'],['U'],None,['Creature'],['Jellyfish'],Common,MH1,2,2,None,"When Man-o'-War enters the battlefield, return target creature to its owner's hand."
Iceberg Cancrix,2.0,['Blue'],['U'],['Snow'],['Creature'],['Crab'],Common,MH1,0,4,None,"Whenever another snow permanent enters the battlefield under your control, you may have target player mill two cards."
Future Sight,5.0,['Blue'],['U'],None,['Enchantment'],None,Rare,MH1,None,None,None,Play with the top card of your library revealed.\nYou may play lands and cast spells from the top of your library.
Force of Negation,3.0,['Blue'],['U'],None,['Instant'],None,Rare,MH1,None,None,None,"If it's not your turn, you may exile a blue card from your hand rather than pay this spell's mana cost.\nCounter target noncreature spell. If that spell is countered this way, exile it instead of putting it into its owner's graveyard."
Faerie Seer,1.0,['Blue'],['U'],None,['Creature'],"['Faerie', 'Wizard']",Common,MH1,1,1,None,"Flying\nWhen Faerie Seer enters the battlefield, scry 2."
Fact or Fiction,4.0,['Blue'],['U'],None,['Instant'],None,Uncommon,MH1,None,None,None,Reveal the top five cards of your library. An opponent separates those cards into two piles. Put one pile into your hand and the other into your graveyard.
Eyekite,2.0,['Blue'],['U'],None,['Creature'],['Drake'],Common,MH1,1,2,None,Flying\nEyekite gets +2/+0 as long as you've drawn two or more cards this turn.
Exclude,3.0,['Blue'],['U'],None,['Instant'],None,Uncommon,MH1,None,None,None,Counter target creature spell.\nDraw a card.
