Name,CMC,Colors,Color identity,Supertypes,Types,Subtypes,Rarity,Set,Power,Toughness,Loyalty,Text
Everdream,2.0,['Blue'],['U'],None,['Instant'],None,Uncommon,MH1,None,None,None,"Draw a card.\nSplice onto instant or sorcery {2}{U} (As you cast an instant or sorcery spell, you may reveal this card from your hand and pay its splice cost. If you do, add this card's effects to that spell.)"
Echo of Eons,6.0,['Blue'],['U'],None,['Sorcery'],None,Mythic,MH1,None,None,None,"Each player shuffles their hand and graveyard into their library, then draws seven cards.\nFlashback {2}{U} (You may cast this card from your graveyard for its flashback cost. Then exile it.)"
Cunning Evasion,2.0,['Blue'],['U'],None,['Enchantment'],None,Uncommon,MH1,None,None,None,"Whenever a creature you control becomes blocked, you may return it to its owner's hand."
Choking Tethers,4.0,['Blue'],['U'],None,['Instant'],None,Common,MH1,None,None,None,"Tap up to four target creatures.\nCycling {1}{U} ({1}{U}, Discard this card: Draw a card.)\nWhen you cycle Choking Tethers, you may tap target creature."
Chillerpillar,4.0,['Blue'],['U'],['Snow'],['Creature'],['Insect'],Common,MH1,3,3,None,"{4}{S}{S}: Monstrosity 2. (If this creature isn't monstrous, put two +1/+1 counters on it and it becomes monstrous. {S} can be paid with one mana from a snow source.)\nAs long as Chillerpillar is monstrous, it has flying."
Blizzard Strix,5.0,['Blue'],['U'],['Snow'],['Creature'],['Bird'],Uncommon,MH1,3,2,None,"Flash\nFlying\nWhen Blizzard Strix enters the battlefield, if you control another snow permanent, exile target permanent other than Blizzard Strix. Return that card to the battlefield under its owner's control at the beginning of the next end step."
Bazaar Trademage,3.0,['Blue'],['U'],None,['Creature'],"['Human', 'Wizard']",Rare,MH1,3,4,None,"Flying\nWhen Bazaar Trademage enters the battlefield, draw two cards, then discard three cards."
Archmage's Charm,3.0,['Blue'],['U'],None,['Instant'],None,Rare,MH1,None,None,None,Choose one —\n• Counter target spell.\n• Target player draws two cards.\n• Gain control of target nonland permanent with mana value 1 or less.
Zhalfirin Decoy,2.0,['White'],['W'],None,['Creature'],"['Human', 'Soldier']",Uncommon,MH1,1,3,None,{T}: Tap target creature. Activate only if you had a creature enter the battlefield under your control this turn.
Wing Shards,3.0,['White'],['W'],None,['Instant'],None,Uncommon,MH1,None,None,None,"Target player sacrifices an attacking creature.\nStorm (When you cast this spell, copy it for each spell cast before it this turn. You may choose new targets for the copies.)"
Winds of Abandon,2.0,['White'],['W'],None,['Sorcery'],None,Rare,MH1,None,None,None,"Exile target creature you don't control. For each creature exiled this way, its controller searches their library for a basic land card. Those players put those cards onto the battlefield tapped, then shuffle.\nOverload {4}{W}{W} (You may cast this spell for its overload cost. If you do, change its text by replacing all instances of ""target"" with ""each."")"
Wall of One Thousand Cuts,5.0,['White'],['W'],None,['Creature'],['Wall'],Common,MH1,3,5,None,"Defender, flying\n{W}: Wall of One Thousand Cuts can attack this turn as though it didn't have defender."
Vesperlark,3.0,['White'],['W'],None,['Creature'],['Elemental'],Uncommon,MH1,2,1,None,"Flying\nWhen Vesperlark leaves the battlefield, return target creature card with power 1 or less from your graveyard to the battlefield.\nEvoke {1}{W} (You may cast this spell for its evoke cost. If you do, it's sacrificed when it enters the battlefield.)"
Valiant Changeling,7.0,['White'],['W'],None,['Creature'],['Shapeshifter'],Uncommon,MH1,3,3,None,This spell costs {1} less to cast for each creature type among creatures you control. This effect can't reduce the amount of mana this spell costs by more than {5}.\nChangeling (This card is every creature type.)\nDouble strike
Trustworthy Scout,2.0,['White'],['W'],None,['Creature'],"['Human', 'Scout']",Common,MH1,2,2,None,"{1}{W}, Exile Trustworthy Scout from your graveyard: Search your library for a card named Trustworthy Scout, reveal it, put it into your hand, then shuffle."
Stirring Address,2.0,['White'],['W'],None,['Instant'],None,Common,MH1,None,None,None,"Target creature you control gets +2/+2 until end of turn.\nOverload {5}{W} (You may cast this spell for its overload cost. If you do, change its text by replacing all instances of ""target"" with ""each."")"
Splicer's Skill,3.0,['White'],['W'],None,['Sorcery'],None,Uncommon,MH1,None,None,None,"Create a 3/3 colorless Phyrexian Golem artifact creature token.\nSplice onto instant or sorcery {3}{W} (As you cast an instant or sorcery spell, you may reveal this card from your hand and pay its splice cost. If you do, add this card's effects to that spell.)"
Soul-Strike Technique,2.0,['White'],['W'],None,['Enchantment'],['Aura'],Common,MH1,None,None,None,"Enchant creature\nEnchanted creature gets +1/+1 and has vigilance.\nWhen enchanted creature dies, manifest the top card of your library. (Put it onto the battlefield face down as a 2/2 creature. Turn it face up any time for its mana cost if it's a creature card.)"
"Sisay, Weatherlight Captain",3.0,['White'],"['B', 'G', 'R', 'U', 'W']",['Legendary'],['Creature'],"['Human', 'Soldier']",Rare,MH1,2,2,None,"Sisay, Weatherlight Captain gets +1/+1 for each color among other legendary permanents you control.\n{W}{U}{B}{R}{G}: Search your library for a legendary permanent card with mana value less than Sisay's power, put that card onto the battlefield, then shuffle."
Shelter,2.0,['White'],['W'],None,['Instant'],None,Common,MH1,None,None,None,Target creature you control gains protection from the color of your choice until end of turn.\nDraw a card.
Settle Beyond Reality,5.0,['White'],['W'],None,['Sorcery'],None,Common,MH1,None,None,None,"Choose one or both —\n• Exile target creature you don't control.\n• Exile target creature you control, then return it to the battlefield under its owner's control."
Serra the Benevolent,4.0,['White'],['W'],['Legendary'],['Planeswalker'],['Serra'],Mythic,MH1,None,None,4,"[+2]: Creatures you control with flying get +1/+1 until end of turn.\n[−3]: Create a 4/4 white Angel creature token with flying and vigilance.\n[−6]: You get an emblem with ""If you control a creature, damage that would reduce your life total to less than 1 reduces it to 1 instead."""
Segovian Angel,1.0,['White'],['W'],None,['Creature'],['Angel'],Common,MH1,1,1,None,"Flying, vigilance"
Rhox Veteran,4.0,['White'],['W'],None,['Creature'],"['Rhino', 'Soldier']",Common,MH1,2,4,None,"Battle cry (Whenever this creature attacks, each other attacking creature gets +1/+0 until end of turn.)\nWhenever Rhox Veteran attacks, tap target creature an opponent controls."
Reprobation,2.0,['White'],['W'],None,['Enchantment'],['Aura'],Common,MH1,None,None,None,Enchant creature\nEnchanted creature loses all abilities and is a Coward creature with base power and toughness 0/1. (It keeps all supertypes but loses all other types and creature types.)
Recruit the Worthy,1.0,['White'],['W'],None,['Instant'],None,Common,MH1,None,None,None,"Buyback {3} (You may pay an additional {3} as you cast this spell. If you do, put this card into your hand as it resolves.)\nCreate a 1/1 white Soldier creature token."
Ranger-Captain of Eos,3.0,['White'],['W'],None,['Creature'],"['Human', 'Soldier', 'Ranger']",Mythic,MH1,3,3,None,"When Ranger-Captain of Eos enters the battlefield, you may search your library for a creature card with mana value 1 or less, reveal it, put it into your hand, then shuffle.\nSacrifice Ranger-Captain of Eos: Your opponents can't cast noncreature spells this turn."
On Thin Ice,1.0,['White'],['W'],['Snow'],['Enchantment'],['Aura'],Rare,MH1,None,None,None,"Enchant snow land you control\nWhen On Thin Ice enters the battlefield, exile target creature an opponent controls until On Thin Ice leaves the battlefield."
Martyr's Soul,3.0,['White'],['W'],None,['Creature'],"['Spirit', 'Soldier']",Common,MH1,3,2,None,"Convoke (Your creatures can help cast this spell. Each creature you tap while casting this spell pays for {1} or one mana of that creature's color.)\nWhen Martyr's Soul enters the battlefield, if you control no tapped lands, put two +1/+1 counters on it."
Lancer Sliver,3.0,['White'],['W'],None,['Creature'],['Sliver'],Common,MH1,2,2,None,Sliver creatures you control have first strike.
Knight of Old Benalia,5.0,['White'],['W'],None,['Creature'],"['Human', 'Knight']",Common,MH1,3,3,None,"Suspend 5—{W} (Rather than cast this card from your hand, you may pay {W} and exile it with five time counters on it. At the beginning of your upkeep, remove a time counter. When the last is removed, cast it without paying its mana cost. It has haste.)\nWhen Knight of Old Benalia enters the battlefield, other creatures you control get +1/+1 until end of turn."
Answered Prayers,3.0,['White'],['W'],None,['Enchantment'],None,Common,MH1,None,None,None,"Whenever a creature enters the battlefield under your control, you gain 1 life. If Answered Prayers isn't a creature, it becomes a 3/3 Angel creature with flying in addition to its other types until end of turn."
Dismantling Blow,3.0,['White'],"['U', 'W']",None,['Instant'],None,Uncommon,MH1,None,None,None,"Kicker {2}{U} (You may pay an additional {2}{U} as you cast this spell.)\nDestroy target artifact or enchantment. If this spell was kicked, draw two cards."
Impostor of the Sixth Pride,2.0,['White'],['W'],None,['Creature'],['Shapeshifter'],Common,MH1,3,1,None,Changeling (This card is every creature type.)
Irregular Cohort,4.0,['White'],['W'],None,['Creature'],['Shapeshifter'],Common,MH1,2,2,None,"Changeling (This card is every creature type.)\nWhen Irregular Cohort enters the battlefield, create a 2/2 colorless Shapeshifter creature token with changeling."
Giver of Runes,1.0,['White'],['W'],None,['Creature'],"['Kor', 'Cleric']",Rare,MH1,1,2,None,{T}: Another target creature you control gains protection from colorless or from the color of your choice until end of turn.
King of the Pride,3.0,['White'],['W'],None,['Creature'],['Cat'],Uncommon,MH1,2,1,None,Other Cats you control get +2/+1.
Gilded Light,2.0,['White'],['W'],None,['Instant'],None,Common,MH1,None,None,None,"You gain shroud until end of turn. (You can't be the target of spells or abilities.)\nCycling {2} ({2}, Discard this card: Draw a card.)"
Generous Gift,3.0,['White'],['W'],None,['Instant'],None,Uncommon,MH1,None,None,None,Destroy target permanent. Its controller creates a 3/3 green Elephant creature token.
Force of Virtue,4.0,['White'],['W'],None,['Enchantment'],None,Rare,MH1,None,None,None,"If it's not your turn, you may exile a white card from your hand rather than pay this spell's mana cost.\nFlash\nCreatures you control get +1/+1."
Face of Divinity,3.0,['White'],['W'],None,['Enchantment'],['Aura'],Uncommon,MH1,None,None,None,"Enchant creature\nEnchanted creature gets +2/+2.\nAs long as another Aura is attached to enchanted creature, it has first strike and lifelink."
Battle Screech,4.0,['White'],['W'],None,['Sorcery'],None,Uncommon,MH1,None,None,None,Create two 1/1 white Bird creature tokens with flying.\nFlashback—Tap three untapped white creatures you control. (You may cast this card from your graveyard for its flashback cost. Then exile it.)
First Sliver's Chosen,5.0,['White'],['W'],None,['Creature'],['Sliver'],Uncommon,MH1,3,3,None,"Sliver creatures you control have exalted. (Whenever a creature you control attacks alone, it gets +1/+1 until end of turn for each instance of exalted among permanents you control.)"
Ephemerate,1.0,['White'],['W'],None,['Instant'],None,Common,MH1,None,None,None,"Exile target creature you control, then return it to the battlefield under its owner's control.\nRebound (If you cast this spell from your hand, exile it as it resolves. At the beginning of your next upkeep, you may cast this card from exile without paying its mana cost.)"
Enduring Sliver,2.0,['White'],['W'],None,['Creature'],['Sliver'],Common,MH1,2,2,None,"Outlast {2} ({2}, {T}: Put a +1/+1 counter on this creature. Outlast only as a sorcery.)\nOther Sliver creatures you control have outlast {2}."
Astral Drift,3.0,['White'],['W'],None,['Enchantment'],None,Rare,MH1,None,None,None,"Whenever you cycle Astral Drift or cycle another card while Astral Drift is on the battlefield, you may exile target creature. If you do, return that card to the battlefield under its owner's control at the beginning of the next end step.\nCycling {2}{W} ({2}{W}, Discard this card: Draw a card.)"
"Morophon, the Boundless",7.0,None,"['B', 'G', 'R', 'U', 'W']",['Legendary'],['Creature'],['Shapeshifter'],Mythic,MH1,6,6,None,"Changeling (This card is every creature type.)\nAs Morophon, the Boundless enters the battlefield, choose a creature type.\nSpells of the chosen type you cast cost {W}{U}{B}{R}{G} less to cast. This effect reduces only the amount of colored mana you pay.\nOther creatures you control of the chosen type get +1/+1."
