Name,CMC,Colors,Color identity,Supertypes,Types,Subtypes,Rarity,Set,Power,Toughness,Loyalty,Text
"Emrakul, the Aeons Torn",15.0,None,None,['Legendary'],['Creature'],['Eldrazi'],Mythic,PUMA,15,15,None,"This spell can't be countered.\nWhen you cast this spell, take an extra turn after this one.\nFlying, protection from spells that are one or more colors, annihilator 6\nWhen Emrakul, the Aeons Torn is put into a graveyard from anywhere, its owner shuffles their graveyard into their library."
Life from the Loam,2.0,['Green'],['G'],None,['Sorcery'],None,Mythic,PUMA,None,None,None,"Return up to three target land cards from your graveyard to your hand.\nDredge 3 (If you would draw a card, you may mill three cards instead. If you do, return this card from your graveyard to your hand.)"
Tarmogoyf,2.0,['Green'],['G'],None,['Creature'],['Lhurgoyf'],Mythic,PUMA,*,1+*,None,Tarmogoyf's power is equal to the number of card types among cards in all graveyards and its toughness is equal to that number plus 1.
Maelstrom Pulse,3.0,"['Black', 'Green']","['B', 'G']",None,['Sorcery'],None,Mythic,PUMA,None,None,None,Destroy target nonland permanent and all other permanents with the same name as that permanent.
Lord of Extinction,5.0,"['Black', 'Green']","['B', 'G']",None,['Creature'],['Elemental'],Mythic,PUMA,*,*,None,Lord of Extinction's power and toughness are each equal to the number of cards in all graveyards.
Karn Liberated,7.0,None,None,['Legendary'],['Planeswalker'],['Karn'],Mythic,PUMA,None,None,6,"[+4]: Target player exiles a card from their hand.\n[−3]: Exile target permanent.\n[−14]: Restart the game, leaving in exile all non-Aura permanent cards exiled with Karn Liberated. Then put those cards onto the battlefield under your control."
"Tasigur, the Golden Fang",6.0,['Black'],"['B', 'G', 'U']",['Legendary'],['Creature'],"['Human', 'Shaman']",Mythic,PUMA,4,5,None,"Delve (Each card you exile from your graveyard while casting this spell pays for {1}.)\n{2}{G/U}{G/U}: Mill two cards, then return a nonland card of an opponent's choice from your graveyard to your hand."
"Mikaeus, the Unhallowed",6.0,['Black'],['B'],['Legendary'],['Creature'],"['Zombie', 'Cleric']",Mythic,PUMA,5,5,None,"Intimidate (This creature can't be blocked except by artifact creatures and/or creatures that share a color with it.)\nWhenever a Human deals damage to you, destroy it.\nOther non-Human creatures you control get +1/+1 and have undying. (When a creature with undying dies, if it had no +1/+1 counters on it, return it to the battlefield under its owner's control with a +1/+1 counter on it.)"
Gaddock Teeg,2.0,"['Green', 'White']","['G', 'W']",['Legendary'],['Creature'],"['Kithkin', 'Advisor']",Mythic,PUMA,2,2,None,Noncreature spells with mana value 4 or greater can't be cast.\nNoncreature spells with {X} in their mana costs can't be cast.
Goryo's Vengeance,2.0,['Black'],['B'],None,['Instant'],['Arcane'],Mythic,PUMA,None,None,None,"Return target legendary creature card from your graveyard to the battlefield. That creature gains haste. Exile it at the beginning of the next end step.\nSplice onto Arcane {2}{B} (As you cast an Arcane spell, you may reveal this card from your hand and pay its splice cost. If you do, add this card's effects to that spell.)"
"Leovold, Emissary of Trest",3.0,"['Black', 'Green', 'Blue']","['B', 'G', 'U']",['Legendary'],['Creature'],"['Elf', 'Advisor']",Mythic,PUMA,3,3,None,"Each opponent can't draw more than one card each turn.\nWhenever you or a permanent you control becomes the target of a spell or ability an opponent controls, you may draw a card."
Demonic Tutor,2.0,['Black'],['B'],None,['Sorcery'],None,Mythic,PUMA,None,None,None,"Search your library for a card, put that card into your hand, then shuffle."
Bitterblossom,2.0,['Black'],['B'],None,"['Tribal', 'Enchantment']",['Faerie'],Mythic,PUMA,None,None,None,"At the beginning of your upkeep, you lose 1 life and create a 1/1 black Faerie Rogue creature token with flying."
Vengevine,4.0,['Green'],['G'],None,['Creature'],['Elemental'],Mythic,PUMA,4,3,None,"Haste\nWhenever you cast a spell, if it's the second creature spell you cast this turn, you may return Vengevine from your graveyard to the battlefield."
Temporal Manipulation,5.0,['Blue'],['U'],None,['Sorcery'],None,Mythic,PUMA,None,None,None,Take an extra turn after this one.
Snapcaster Mage,2.0,['Blue'],['U'],None,['Creature'],"['Human', 'Wizard']",Mythic,PUMA,2,1,None,"Flash\nWhen Snapcaster Mage enters the battlefield, target instant or sorcery card in your graveyard gains flashback until end of turn. The flashback cost is equal to its mana cost. (You may cast that card from your graveyard for its flashback cost. Then exile it.)"
Liliana of the Veil,3.0,['Black'],['B'],['Legendary'],['Planeswalker'],['Liliana'],Mythic,PUMA,None,None,3,[+1]: Each player discards a card.\n[−2]: Target player sacrifices a creature.\n[−6]: Separate all permanents target player controls into two piles. That player sacrifices all permanents in the pile of their choice.
"Urborg, Tomb of Yawgmoth",0.0,None,None,['Legendary'],['Land'],None,Mythic,PUMA,None,None,None,Each land is a Swamp in addition to its other land types.
Noble Hierarch,1.0,['Green'],"['G', 'U', 'W']",None,['Creature'],"['Human', 'Druid']",Mythic,PUMA,0,1,None,"Exalted (Whenever a creature you control attacks alone, that creature gets +1/+1 until end of turn.)\n{T}: Add {G}, {W}, or {U}."
"Ulamog, the Infinite Gyre",11.0,None,None,['Legendary'],['Creature'],['Eldrazi'],Mythic,PUMA,10,10,None,"When you cast this spell, destroy target permanent.\nIndestructible\nAnnihilator 4 (Whenever this creature attacks, defending player sacrifices four permanents.)\nWhen Ulamog, the Infinite Gyre is put into a graveyard from anywhere, its owner shuffles their graveyard into their library."
Balefire Dragon,7.0,['Red'],['R'],None,['Creature'],['Dragon'],Mythic,PUMA,6,6,None,"Flying\nWhenever Balefire Dragon deals combat damage to a player, it deals that much damage to each creature that player controls."
Stirring Wildwood,0.0,None,"['G', 'W']",None,['Land'],None,Mythic,PUMA,None,None,None,"Stirring Wildwood enters the battlefield tapped.\n{T}: Add {G} or {W}.\n{1}{G}{W}: Until end of turn, Stirring Wildwood becomes a 3/4 green and white Elemental creature with reach. It's still a land."
Raging Ravine,0.0,None,"['G', 'R']",None,['Land'],None,Mythic,PUMA,None,None,None,"Raging Ravine enters the battlefield tapped.\n{T}: Add {R} or {G}.\n{2}{R}{G}: Until end of turn, Raging Ravine becomes a 3/3 red and green Elemental creature with ""Whenever this creature attacks, put a +1/+1 counter on it."" It's still a land."
Reanimate,1.0,['Black'],['B'],None,['Sorcery'],None,Mythic,PUMA,None,None,None,Put target creature card from a graveyard onto the battlefield under your control. You lose life equal to its mana value.
Lavaclaw Reaches,0.0,None,"['B', 'R']",None,['Land'],None,Mythic,PUMA,None,None,None,"Lavaclaw Reaches enters the battlefield tapped.\n{T}: Add {B} or {R}.\n{1}{B}{R}: Until end of turn, Lavaclaw Reaches becomes a 2/2 black and red Elemental creature with ""{X}: This creature gets +X/+0 until end of turn."" It's still a land."
Karakas,0.0,None,['W'],['Legendary'],['Land'],None,Mythic,PUMA,None,None,None,{T}: Add {W}.\n{T}: Return target legendary creature to its owner's hand.
Dark Depths,0.0,None,None,"['Legendary', 'Snow']",['Land'],None,Mythic,PUMA,None,None,None,"Dark Depths enters the battlefield with ten ice counters on it.\n{3}: Remove an ice counter from Dark Depths.\nWhen Dark Depths has no ice counters on it, sacrifice it. If you do, create Marit Lage, a legendary 20/20 black Avatar creature token with flying and indestructible."
Creeping Tar Pit,0.0,None,"['B', 'U']",None,['Land'],None,Mythic,PUMA,None,None,None,Creeping Tar Pit enters the battlefield tapped.\n{T}: Add {U} or {B}.\n{1}{U}{B}: Creeping Tar Pit becomes a 3/2 blue and black Elemental creature until end of turn and can't be blocked this turn. It's still a land.
Celestial Colonnade,0.0,None,"['U', 'W']",None,['Land'],None,Mythic,PUMA,None,None,None,"Celestial Colonnade enters the battlefield tapped.\n{T}: Add {W} or {U}.\n{3}{W}{U}: Until end of turn, Celestial Colonnade becomes a 4/4 white and blue Elemental creature with flying and vigilance. It's still a land."
Cavern of Souls,0.0,None,None,None,['Land'],None,Mythic,PUMA,None,None,None,"As Cavern of Souls enters the battlefield, choose a creature type.\n{T}: Add {C}.\n{T}: Add one mana of any color. Spend this mana only to cast a creature spell of the chosen type, and that spell can't be countered."
Through the Breach,5.0,['Red'],['R'],None,['Instant'],['Arcane'],Mythic,PUMA,None,None,None,"You may put a creature card from your hand onto the battlefield. That creature gains haste. Sacrifice that creature at the beginning of the next end step.\nSplice onto Arcane {2}{R}{R} (As you cast an Arcane spell, you may reveal this card from your hand and pay its splice cost. If you do, add this card's effects to that spell.)"
Ancient Tomb,0.0,None,None,None,['Land'],None,Mythic,PUMA,None,None,None,{T}: Add {C}{C}. Ancient Tomb deals 2 damage to you.
Platinum Emperion,8.0,None,None,None,"['Artifact', 'Creature']",['Golem'],Mythic,PUMA,8,8,None,Your life total can't change. (You can't gain or lose life. You can't pay any amount of life except 0.)
"Kozilek, Butcher of Truth",10.0,None,None,['Legendary'],['Creature'],['Eldrazi'],Mythic,PUMA,12,12,None,"When you cast this spell, draw four cards.\nAnnihilator 4 (Whenever this creature attacks, defending player sacrifices four permanents.)\nWhen Kozilek, Butcher of Truth is put into a graveyard from anywhere, its owner shuffles their graveyard into their library."
Eternal Witness,3.0,['Green'],['G'],None,['Creature'],"['Human', 'Shaman']",Mythic,PUMA,2,1,None,"When Eternal Witness enters the battlefield, you may return target card from your graveyard to your hand."
Mana Vault,1.0,None,None,None,['Artifact'],None,Mythic,PUMA,None,None,None,"Mana Vault doesn't untap during your untap step.\nAt the beginning of your upkeep, you may pay {4}. If you do, untap Mana Vault.\nAt the beginning of your draw step, if Mana Vault is tapped, it deals 1 damage to you.\n{T}: Add {C}{C}{C}."
Engineered Explosives,0.0,None,None,None,['Artifact'],None,Mythic,PUMA,None,None,None,"Sunburst (This enters the battlefield with a charge counter on it for each color of mana spent to cast it.)\n{2}, Sacrifice Engineered Explosives: Destroy each nonland permanent with mana value equal to the number of charge counters on Engineered Explosives."
Kitchen Finks,3.0,"['Green', 'White']","['G', 'W']",None,['Creature'],['Ouphe'],Mythic,PUMA,3,2,None,"When Kitchen Finks enters the battlefield, you gain 2 life.\nPersist (When this creature dies, if it had no -1/-1 counters on it, return it to the battlefield under its owner's control with a -1/-1 counter on it.)"
Fulminator Mage,3.0,"['Black', 'Red']","['B', 'R']",None,['Creature'],"['Elemental', 'Shaman']",Mythic,PUMA,2,2,None,Sacrifice Fulminator Mage: Destroy target nonbasic land.
"Sigarda, Host of Herons",5.0,"['Green', 'White']","['G', 'W']",['Legendary'],['Creature'],['Angel'],Mythic,PUMA,5,5,None,"Flying, hexproof\nSpells and abilities your opponents control can't cause you to sacrifice permanents."
