Name,CMC,Colors,Color identity,Supertypes,Types,Subtypes,Rarity,Set,Power,Toughness,Loyalty,Text
Rebound,2.0,['Blue'],['U'],None,['Instant'],None,Uncommon,STH,None,None,None,Change the target of target spell that targets only a player. The new target must be a player.
Cannibalize,2.0,['Black'],['B'],None,['Sorcery'],None,Common,STH,None,None,None,Choose two target creatures controlled by the same player. Exile one of those creatures and put two +1/+1 counters on the other.
Ransack,4.0,['Blue'],['U'],None,['Sorcery'],None,Uncommon,STH,None,None,None,Look at the top five cards of target player's library. Put any number of them on the bottom of that library in any order and the rest on top of the library in any order.
Mana Leak,2.0,['Blue'],['U'],None,['Instant'],None,Common,STH,None,None,None,Counter target spell unless its controller pays {3}.
Mind Games,1.0,['Blue'],['U'],None,['Instant'],None,Common,STH,None,None,None,"Buyback {2}{U} (You may pay an additional {2}{U} as you cast this spell. If you do, put this card into your hand as it resolves.)\nTap target artifact, creature, or land."
Mask of the Mimic,1.0,['Blue'],['U'],None,['Instant'],None,Uncommon,STH,None,None,None,"As an additional cost to cast this spell, sacrifice a creature.\nSearch your library for a card with the same name as target nontoken creature, put that card onto the battlefield, then shuffle."
Hammerhead Shark,2.0,['Blue'],['U'],None,['Creature'],['Shark'],Common,STH,2,3,None,Hammerhead Shark can't attack unless defending player controls an Island.
Evacuation,5.0,['Blue'],['U'],None,['Instant'],None,Rare,STH,None,None,None,Return all creatures to their owners' hands.
Leap,1.0,['Blue'],['U'],None,['Instant'],None,Common,STH,None,None,None,Target creature gains flying until end of turn.\nDraw a card.
Crovax the Cursed,4.0,['Black'],['B'],['Legendary'],['Creature'],"['Vampire', 'Noble']",Rare,STH,0,0,None,"Crovax the Cursed enters the battlefield with four +1/+1 counters on it.\nAt the beginning of your upkeep, you may sacrifice a creature. If you do, put a +1/+1 counter on Crovax. If you don't, remove a +1/+1 counter from Crovax.\n{B}: Crovax gains flying until end of turn."
Dungeon Shade,4.0,['Black'],['B'],None,['Creature'],"['Shade', 'Spirit']",Common,STH,1,1,None,Flying\n{B}: Dungeon Shade gets +1/+1 until end of turn.
Intruder Alarm,3.0,['Blue'],['U'],None,['Enchantment'],None,Rare,STH,None,None,None,"Creatures don't untap during their controllers' untap steps.\nWhenever a creature enters the battlefield, untap all creatures."
Hesitation,2.0,['Blue'],['U'],None,['Enchantment'],None,Uncommon,STH,None,None,None,"When a player casts a spell, sacrifice Hesitation and counter that spell."
Brush with Death,3.0,['Black'],['B'],None,['Sorcery'],None,Common,STH,None,None,None,"Buyback {2}{B}{B} (You may pay an additional {2}{B}{B} as you cast this spell. If you do, put this card into your hand as it resolves.)\nTarget opponent loses 2 life. You gain 2 life."
Dream Prowler,4.0,['Blue'],['U'],None,['Creature'],['Illusion'],Common,STH,1,5,None,Dream Prowler can't be blocked as long as it's attacking alone.
