Name,CMC,Colors,Color identity,Supertypes,Types,Subtypes,Rarity,Set,Power,Toughness,Loyalty,Text
Mogg Maniac,2.0,['Red'],['R'],None,['Creature'],['Goblin'],Uncommon,STH,1,1,None,"Whenever Mogg Maniac is dealt damage, it deals that much damage to target opponent or planeswalker."
Mogg Infestation,5.0,['Red'],['R'],None,['Sorcery'],None,Rare,STH,None,None,None,"Destroy all creatures target player controls. For each creature that died this way, that player creates two 1/1 red Goblin creature tokens."
Mogg Flunkies,2.0,['Red'],['R'],None,['Creature'],['Goblin'],Common,STH,3,3,None,Mogg Flunkies can't attack or block alone.
Mogg Bombers,4.0,['Red'],['R'],None,['Creature'],['Goblin'],Common,STH,3,4,None,"When another creature enters the battlefield, sacrifice Mogg Bombers and it deals 3 damage to target player or planeswalker."
Mob Justice,2.0,['Red'],['R'],None,['Sorcery'],None,Common,STH,None,None,None,Mob Justice deals damage to target player or planeswalker equal to the number of creatures you control.
Invasion Plans,3.0,['Red'],['R'],None,['Enchantment'],None,Rare,STH,None,None,None,All creatures block each combat if able.\nThe attacking player chooses how each creature blocks each combat.
Heat of Battle,2.0,['Red'],['R'],None,['Enchantment'],None,Uncommon,STH,None,None,None,"Whenever a creature blocks, Heat of Battle deals 1 damage to that creature's controller."
Furnace Spirit,3.0,['Red'],['R'],None,['Creature'],['Spirit'],Common,STH,1,1,None,Haste\n{R}: Furnace Spirit gets +1/+0 until end of turn.
Flowstone Shambler,3.0,['Red'],['R'],None,['Creature'],['Beast'],Common,STH,2,2,None,{R}: Flowstone Shambler gets +1/-1 until end of turn.
Flowstone Mauler,6.0,['Red'],['R'],None,['Creature'],['Beast'],Rare,STH,4,5,None,Trample\n{R}: Flowstone Mauler gets +1/-1 until end of turn.
Flowstone Hellion,5.0,['Red'],['R'],None,['Creature'],"['Hellion', 'Beast']",Uncommon,STH,3,3,None,Haste\n{0}: Flowstone Hellion gets +1/-1 until end of turn.
Flowstone Blade,1.0,['Red'],['R'],None,['Enchantment'],['Aura'],Common,STH,None,None,None,Enchant creature\n{R}: Enchanted creature gets +1/-1 until end of turn.
Fling,2.0,['Red'],['R'],None,['Instant'],None,Common,STH,None,None,None,"As an additional cost to cast this spell, sacrifice a creature.\nFling deals damage equal to the sacrificed creature's power to any target."
Carnassid,6.0,['Green'],['G'],None,['Creature'],['Beast'],Rare,STH,5,4,None,Trample\n{1}{G}: Regenerate Carnassid.
Flame Wave,7.0,['Red'],['R'],None,['Sorcery'],None,Uncommon,STH,None,None,None,Flame Wave deals 4 damage to target player or planeswalker and each creature that player or that planeswalker's controller controls.
Fanning the Flames,2.0,['Red'],['R'],None,['Sorcery'],None,Uncommon,STH,None,None,None,"Buyback {3} (You may pay an additional {3} as you cast this spell. If you do, put this card into your hand as it resolves.)\nFanning the Flames deals X damage to any target."
Mortuary,4.0,['Black'],['B'],None,['Enchantment'],None,Rare,STH,None,None,None,"Whenever a creature is put into your graveyard from the battlefield, put that card on top of your library."
Amok,2.0,['Red'],['R'],None,['Enchantment'],None,Rare,STH,None,None,None,"{1}, Discard a card at random: Put a +1/+1 counter on target creature."
Craven Giant,3.0,['Red'],['R'],None,['Creature'],['Giant'],Common,STH,4,1,None,Craven Giant can't block.
Duct Crawler,1.0,['Red'],['R'],None,['Creature'],['Insect'],Common,STH,1,1,None,{1}{R}: Target creature can't block Duct Crawler this turn.
Convulsing Licid,3.0,['Red'],['R'],None,['Creature'],['Licid'],Uncommon,STH,2,2,None,"{R}, {T}: Convulsing Licid loses this ability and becomes an Aura enchantment with enchant creature. Attach it to target creature. You may pay {R} to end this effect.\nEnchanted creature can't block."
Wall of Souls,2.0,['Black'],['B'],None,['Creature'],['Wall'],Uncommon,STH,0,4,None,"Defender (This creature can't attack.)\nWhenever Wall of Souls is dealt combat damage, it deals that much damage to target opponent or planeswalker."
Tortured Existence,1.0,['Black'],['B'],None,['Enchantment'],None,Common,STH,None,None,None,"{B}, Discard a creature card: Return target creature card from your graveyard to your hand."
Torment,2.0,['Black'],['B'],None,['Enchantment'],['Aura'],Common,STH,None,None,None,Enchant creature\nEnchanted creature gets -3/-0.
Skeleton Scavengers,3.0,['Black'],['B'],None,['Creature'],['Skeleton'],Rare,STH,0,0,None,"Skeleton Scavengers enters the battlefield with a +1/+1 counter on it.\nPay {1} for each +1/+1 counter on Skeleton Scavengers: Regenerate Skeleton Scavengers. When it regenerates this way, put a +1/+1 counter on it."
Stronghold Taskmaster,4.0,['Black'],['B'],None,['Creature'],"['Giant', 'Minion']",Uncommon,STH,4,3,None,Other black creatures get -1/-1.
Stronghold Assassin,3.0,['Black'],['B'],None,['Creature'],"['Phyrexian', 'Zombie', 'Assassin']",Rare,STH,2,1,None,"{T}, Sacrifice a creature: Destroy target nonblack creature."
Volrath's Stronghold,0.0,None,['B'],['Legendary'],['Land'],None,Rare,STH,None,None,None,"{T}: Add {C}.\n{1}{B}, {T}: Put target creature card from your graveyard on top of your library."
Volrath's Laboratory,5.0,None,None,None,['Artifact'],None,Rare,STH,None,None,None,"As Volrath's Laboratory enters the battlefield, choose a color and a creature type.\n{5}, {T}: Create a 2/2 creature token of the chosen color and type."
Sword of the Chosen,2.0,None,None,['Legendary'],['Artifact'],None,Rare,STH,None,None,None,{T}: Target legendary creature gets +2/+2 until end of turn.
Rabid Rats,2.0,['Black'],['B'],None,['Creature'],['Rat'],Common,STH,1,1,None,{T}: Target blocking creature gets -1/-1 until end of turn.
Shifting Wall,0.0,None,None,None,"['Artifact', 'Creature']",['Wall'],Uncommon,STH,0,0,None,Defender (This creature can't attack.)\nShifting Wall enters the battlefield with X +1/+1 counters on it.
Morgue Thrull,3.0,['Black'],['B'],None,['Creature'],['Thrull'],Common,STH,2,2,None,Sacrifice Morgue Thrull: Mill three cards.
Portcullis,4.0,None,None,None,['Artifact'],None,Rare,STH,None,None,None,"Whenever a creature enters the battlefield, if there are two or more other creatures on the battlefield, exile that creature. Return that card to the battlefield under its owner's control when Portcullis leaves the battlefield."
Mox Diamond,0.0,None,None,None,['Artifact'],None,Rare,STH,None,None,None,"If Mox Diamond would enter the battlefield, you may discard a land card instead. If you do, put Mox Diamond onto the battlefield. If you don't, put it into its owner's graveyard.\n{T}: Add one mana of any color."
Serpent Warrior,3.0,['Black'],['B'],None,['Creature'],"['Snake', 'Warrior']",Common,STH,3,3,None,"When Serpent Warrior enters the battlefield, you lose 3 life."
Jinxed Ring,2.0,None,None,None,['Artifact'],None,Rare,STH,None,None,None,"Whenever a nontoken permanent is put into your graveyard from the battlefield, Jinxed Ring deals 1 damage to you.\nSacrifice a creature: Target opponent gains control of Jinxed Ring. (This effect lasts indefinitely.)"
Burgeoning,1.0,['Green'],['G'],None,['Enchantment'],None,Rare,STH,None,None,None,"Whenever an opponent plays a land, you may put a land card from your hand onto the battlefield."
Hornet Cannon,4.0,None,None,None,['Artifact'],None,Uncommon,STH,None,None,None,"{3}, {T}: Create a 1/1 colorless Insect artifact creature token with flying and haste named Hornet. Destroy it at the beginning of the next end step."
Revenant,5.0,['Black'],['B'],None,['Creature'],['Spirit'],Rare,STH,*,*,None,Flying\nRevenant's power and toughness are each equal to the number of creature cards in your graveyard.
Horn of Greed,3.0,None,None,None,['Artifact'],None,Rare,STH,None,None,None,"Whenever a player plays a land, that player draws a card."
Mindwarper,4.0,['Black'],['B'],None,['Creature'],['Spirit'],Rare,STH,0,0,None,"Mindwarper enters the battlefield with three +1/+1 counters on it.\n{2}{B}, Remove a +1/+1 counter from Mindwarper: Target player discards a card. Activate only as a sorcery."
Heartstone,3.0,None,None,None,['Artifact'],None,Uncommon,STH,None,None,None,Activated abilities of creatures cost {1} less to activate. This effect can't reduce the mana in that cost to less than one mana.
Awakening,4.0,['Green'],['G'],None,['Enchantment'],None,Rare,STH,None,None,None,"At the beginning of each upkeep, untap all creatures and lands."
Ensnaring Bridge,3.0,None,None,None,['Artifact'],None,Rare,STH,None,None,None,Creatures with power greater than the number of cards in your hand can't attack.
Grave Pact,4.0,['Black'],['B'],None,['Enchantment'],None,Rare,STH,None,None,None,"Whenever a creature you control dies, each other player sacrifices a creature."
Bullwhip,4.0,None,None,None,['Artifact'],None,Uncommon,STH,None,None,None,"{2}, {T}: Bullwhip deals 1 damage to target creature. That creature attacks this turn if able."
Mind Peel,1.0,['Black'],['B'],None,['Sorcery'],None,Uncommon,STH,None,None,None,"Buyback {2}{B}{B} (You may pay an additional {2}{B}{B} as you cast this spell. If you do, put this card into your hand as it resolves.)\nTarget player discards a card."
Victual Sliver,2.0,"['Green', 'White']","['G', 'W']",None,['Creature'],['Sliver'],Uncommon,STH,2,2,None,"All Slivers have ""{2}, Sacrifice this permanent: You gain 4 life."""
Spined Sliver,2.0,"['Green', 'Red']","['G', 'R']",None,['Creature'],['Sliver'],Uncommon,STH,2,2,None,"Whenever a Sliver becomes blocked, that Sliver gets +1/+1 until end of turn for each creature blocking it."
Sliver Queen,5.0,"['Black', 'Green', 'Red', 'Blue', 'White']","['B', 'G', 'R', 'U', 'W']",['Legendary'],['Creature'],['Sliver'],Rare,STH,7,7,None,{2}: Create a 1/1 colorless Sliver creature token.
Megrim,3.0,['Black'],['B'],None,['Enchantment'],None,Uncommon,STH,None,None,None,"Whenever an opponent discards a card, Megrim deals 2 damage to that player."
Hibernation Sliver,2.0,"['Black', 'Blue']","['B', 'U']",None,['Creature'],['Sliver'],Uncommon,STH,2,2,None,"All Slivers have ""Pay 2 life: Return this permanent to its owner's hand."""
Crystalline Sliver,2.0,"['Blue', 'White']","['U', 'W']",None,['Creature'],['Sliver'],Uncommon,STH,2,2,None,All Slivers have shroud. (They can't be the targets of spells or abilities.)
Acidic Sliver,2.0,"['Black', 'Red']","['B', 'R']",None,['Creature'],['Sliver'],Uncommon,STH,2,2,None,"All Slivers have ""{2}, Sacrifice this permanent: This permanent deals 2 damage to any target."""
Wall of Razors,2.0,['Red'],['R'],None,['Creature'],['Wall'],Uncommon,STH,4,1,None,Defender (This creature can't attack.)\nFirst strike
Wall of Blossoms,2.0,['Green'],['G'],None,['Creature'],"['Plant', 'Wall']",Uncommon,STH,0,4,None,"Defender\nWhen Wall of Blossoms enters the battlefield, draw a card."
Spitting Hydra,5.0,['Red'],['R'],None,['Creature'],['Hydra'],Rare,STH,0,0,None,"Spitting Hydra enters the battlefield with four +1/+1 counters on it.\n{1}{R}, Remove a +1/+1 counter from Spitting Hydra: It deals 1 damage to target creature."
Volrath's Gardens,2.0,['Green'],['G'],None,['Enchantment'],None,Rare,STH,None,None,None,"{2}, Tap an untapped creature you control: You gain 2 life. Activate only as a sorcery."
Shock,1.0,['Red'],['R'],None,['Instant'],None,Common,STH,None,None,None,Shock deals 2 damage to any target.
Verdant Touch,2.0,['Green'],['G'],None,['Sorcery'],None,Rare,STH,None,None,None,"Buyback {3} (You may pay an additional {3} as you cast this spell. If you do, put this card into your hand as it resolves.)\nTarget land becomes a 2/2 creature that's still a land. (This effect lasts indefinitely.)"
Tempting Licid,3.0,['Green'],['G'],None,['Creature'],['Licid'],Uncommon,STH,2,2,None,"{G}, {T}: Tempting Licid loses this ability and becomes an Aura enchantment with enchant creature. Attach it to target creature. You may pay {G} to end this effect.\nAll creatures able to block enchanted creature do so."
Shard Phoenix,5.0,['Red'],['R'],None,['Creature'],['Phoenix'],Rare,STH,2,2,None,Flying (This creature can't be blocked except by creatures with flying or reach.)\nSacrifice Shard Phoenix: It deals 2 damage to each creature without flying.\n{R}{R}{R}: Return Shard Phoenix from your graveyard to your hand. Activate only during your upkeep.
Spined Wurm,5.0,['Green'],['G'],None,['Creature'],['Wurm'],Common,STH,5,4,None,None
Spike Worker,3.0,['Green'],['G'],None,['Creature'],['Spike'],Common,STH,0,0,None,"Spike Worker enters the battlefield with two +1/+1 counters on it.\n{2}, Remove a +1/+1 counter from Spike Worker: Put a +1/+1 counter on target creature."
Spike Soldier,4.0,['Green'],['G'],None,['Creature'],"['Spike', 'Soldier']",Uncommon,STH,0,0,None,"Spike Soldier enters the battlefield with three +1/+1 counters on it.\n{2}, Remove a +1/+1 counter from Spike Soldier: Put a +1/+1 counter on target creature.\nRemove a +1/+1 counter from Spike Soldier: Spike Soldier gets +2/+2 until end of turn."
Lab Rats,1.0,['Black'],['B'],None,['Sorcery'],None,Common,STH,None,None,None,"Buyback {4} (You may pay an additional {4} as you cast this spell. If you do, put this card into your hand as it resolves.)\nCreate a 1/1 black Rat creature token."
Spike Feeder,3.0,['Green'],['G'],None,['Creature'],['Spike'],Uncommon,STH,0,0,None,"Spike Feeder enters the battlefield with two +1/+1 counters on it.\n{2}, Remove a +1/+1 counter from Spike Feeder: Put a +1/+1 counter on target creature.\nRemove a +1/+1 counter from Spike Feeder: You gain 2 life."
Seething Anger,1.0,['Red'],['R'],None,['Sorcery'],None,Common,STH,None,None,None,"Buyback {3} (You may pay an additional {3} as you cast this spell. If you do, put this card into your hand as it resolves.)\nTarget creature gets +3/+0 until end of turn."
Spike Colony,5.0,['Green'],['G'],None,['Creature'],['Spike'],Common,STH,0,0,None,"Spike Colony enters the battlefield with four +1/+1 counters on it.\n{2}, Remove a +1/+1 counter from Spike Colony: Put a +1/+1 counter on target creature."
Ruination,4.0,['Red'],['R'],None,['Sorcery'],None,Rare,STH,None,None,None,Destroy all nonbasic lands.
Crossbow Ambush,1.0,['Green'],['G'],None,['Instant'],None,Common,STH,None,None,None,Creatures you control gain reach until end of turn. (They can block creatures with flying.)
Provoke,2.0,['Green'],['G'],None,['Instant'],None,Common,STH,None,None,None,Untap target creature you don't control. That creature blocks this turn if able.\nDraw a card.
Skyshroud Troopers,4.0,['Green'],['G'],None,['Creature'],"['Elf', 'Druid', 'Warrior']",Common,STH,3,3,None,{T}: Add {G}.
Spike Breeder,4.0,['Green'],['G'],None,['Creature'],['Spike'],Rare,STH,0,0,None,"Spike Breeder enters the battlefield with three +1/+1 counters on it.\n{2}, Remove a +1/+1 counter from Spike Breeder: Put a +1/+1 counter on target creature.\n{2}, Remove a +1/+1 counter from Spike Breeder: Create a 1/1 green Spike creature token."
Skyshroud Archer,1.0,['Green'],['G'],None,['Creature'],"['Elf', 'Archer']",Common,STH,1,1,None,{T}: Target creature with flying gets -1/-1 until end of turn.
Primal Rage,2.0,['Green'],['G'],None,['Enchantment'],None,Uncommon,STH,None,None,None,Creatures you control have trample. (A creature with trample can deal excess combat damage to the player or planeswalker it's attacking.)
Overgrowth,3.0,['Green'],['G'],None,['Enchantment'],['Aura'],Common,STH,None,None,None,"Enchant land\nWhenever enchanted land is tapped for mana, its controller adds an additional {G}{G}."
Mulch,2.0,['Green'],['G'],None,['Sorcery'],None,Common,STH,None,None,None,Reveal the top four cards of your library. Put all land cards revealed this way into your hand and the rest into your graveyard.
Endangered Armodon,4.0,['Green'],['G'],None,['Creature'],['Elephant'],Common,STH,4,5,None,"When you control a creature with toughness 2 or less, sacrifice Endangered Armodon."
Lowland Basilisk,3.0,['Green'],['G'],None,['Creature'],['Basilisk'],Common,STH,1,3,None,"Whenever Lowland Basilisk deals damage to a creature, destroy that creature at end of combat."
Hermit Druid,2.0,['Green'],['G'],None,['Creature'],"['Human', 'Druid']",Rare,STH,1,1,None,"{G}, {T}: Reveal cards from the top of your library until you reveal a basic land card. Put that card into your hand and all other cards revealed this way into your graveyard."
Elven Rite,2.0,['Green'],['G'],None,['Sorcery'],None,Uncommon,STH,None,None,None,Distribute two +1/+1 counters among one or two target creatures.
Constant Mists,2.0,['Green'],['G'],None,['Instant'],None,Uncommon,STH,None,None,None,"Buyback—Sacrifice a land. (You may sacrifice a land in addition to any other costs as you cast this spell. If you do, put this card into your hand as it resolves.)\nPrevent all combat damage that would be dealt this turn."
Bottomless Pit,3.0,['Black'],['B'],None,['Enchantment'],None,Uncommon,STH,None,None,None,"At the beginning of each player's upkeep, that player discards a card at random."
Wall of Tears,2.0,['Blue'],['U'],None,['Creature'],['Wall'],Uncommon,STH,0,4,None,"Defender (This creature can't attack.)\nWhenever Wall of Tears blocks a creature, return that creature to its owner's hand at end of combat."
Walking Dream,4.0,['Blue'],['U'],None,['Creature'],['Illusion'],Uncommon,STH,3,3,None,Walking Dream can't be blocked.\nWalking Dream doesn't untap during your untap step if an opponent controls two or more creatures.
Volrath's Shapeshifter,3.0,['Blue'],['U'],None,['Creature'],"['Phyrexian', 'Shapeshifter']",Rare,STH,0,1,None,"As long as the top card of your graveyard is a creature card, Volrath's Shapeshifter has the full text of that card and has the text ""{2}: Discard a card."" (Volrath's Shapeshifter has that card's name, mana cost, color, types, abilities, power, and toughness.)\n{2}: Discard a card."
Tidal Warrior,1.0,['Blue'],['U'],None,['Creature'],"['Merfolk', 'Warrior']",Common,STH,1,1,None,{T}: Target land becomes an Island until end of turn.
Tidal Surge,2.0,['Blue'],['U'],None,['Sorcery'],None,Common,STH,None,None,None,Tap up to three target creatures without flying.
Gliding Licid,3.0,['Blue'],['U'],None,['Creature'],['Licid'],Uncommon,STH,2,2,None,"{U}, {T}: Gliding Licid loses this ability and becomes an Aura enchantment with enchant creature. Attach it to target creature. You may pay {U} to end this effect.\nEnchanted creature has flying."
Sift,4.0,['Blue'],['U'],None,['Sorcery'],None,Common,STH,None,None,None,"Draw three cards, then discard a card."
Spindrift Drake,1.0,['Blue'],['U'],None,['Creature'],['Drake'],Common,STH,2,1,None,"Flying\nAt the beginning of your upkeep, sacrifice Spindrift Drake unless you pay {U}."
Thalakos Deceiver,4.0,['Blue'],['U'],None,['Creature'],"['Thalakos', 'Wizard']",Rare,STH,1,1,None,"Shadow (This creature can block or be blocked by only creatures with shadow.)\nWhenever Thalakos Deceiver attacks and isn't blocked, you may sacrifice it. If you do, gain control of target creature. (This effect lasts indefinitely.)"
Silver Wyvern,5.0,['Blue'],['U'],None,['Creature'],['Drake'],Rare,STH,4,3,None,Flying\n{U}: Change the target of target spell or ability that targets only Silver Wyvern. The new target must be a creature.
Dream Halls,5.0,['Blue'],['U'],None,['Enchantment'],None,Rare,STH,None,None,None,"Rather than pay the mana cost for a spell, its controller may discard a card that shares a color with that spell."
Contempt,2.0,['Blue'],['U'],None,['Enchantment'],['Aura'],Common,STH,None,None,None,"Enchant creature\nWhen enchanted creature attacks, return it and Contempt to their owners' hands at end of combat."
Cloud Spirit,3.0,['Blue'],['U'],None,['Creature'],['Spirit'],Common,STH,3,1,None,Flying\nCloud Spirit can block only creatures with flying.
Youthful Knight,2.0,['White'],['W'],None,['Creature'],"['Human', 'Knight']",Common,STH,2,1,None,First strike
Warrior Angel,6.0,['White'],['W'],None,['Creature'],"['Angel', 'Warrior']",Rare,STH,3,4,None,"Flying\nWhenever Warrior Angel deals damage, you gain that much life."
Warrior en-Kor,2.0,['White'],['W'],None,['Creature'],"['Kor', 'Warrior', 'Knight']",Uncommon,STH,2,2,None,{0}: The next 1 damage that would be dealt to Warrior en-Kor this turn is dealt to target creature you control instead.
Wall of Essence,2.0,['White'],['W'],None,['Creature'],['Wall'],Uncommon,STH,0,4,None,"Defender (This creature can't attack.)\nWhenever Wall of Essence is dealt combat damage, you gain that much life."
Venerable Monk,3.0,['White'],['W'],None,['Creature'],"['Human', 'Monk', 'Cleric']",Common,STH,2,2,None,"When Venerable Monk enters the battlefield, you gain 2 life."
Temper,2.0,['White'],['W'],None,['Instant'],None,Uncommon,STH,None,None,None,"Prevent the next X damage that would be dealt to target creature this turn. For each 1 damage prevented this way, put a +1/+1 counter on that creature."
Spirit en-Kor,4.0,['White'],['W'],None,['Creature'],"['Kor', 'Spirit']",Common,STH,2,2,None,Flying\n{0}: The next 1 damage that would be dealt to Spirit en-Kor this turn is dealt to target creature you control instead.
Soltari Champion,3.0,['White'],['W'],None,['Creature'],"['Soltari', 'Soldier']",Rare,STH,2,2,None,"Shadow (This creature can block or be blocked by only creatures with shadow.)\nWhenever Soltari Champion attacks, other creatures you control get +1/+1 until end of turn."
Smite,1.0,['White'],['W'],None,['Instant'],None,Common,STH,None,None,None,Destroy target blocked creature.
Calming Licid,3.0,['White'],['W'],None,['Creature'],['Licid'],Uncommon,STH,2,2,None,"{W}, {T}: Calming Licid loses this ability and becomes an Aura enchantment with enchant creature. Attach it to target creature. You may pay {W} to end this effect.\nEnchanted creature can't attack."
Samite Blessing,1.0,['White'],['W'],None,['Enchantment'],['Aura'],Common,STH,None,None,None,"Enchant creature\nEnchanted creature has ""{T}: The next time a source of your choice would deal damage to target creature this turn, prevent that damage."""
Shaman en-Kor,2.0,['White'],['W'],None,['Creature'],"['Kor', 'Cleric', 'Shaman']",Rare,STH,1,2,None,"{0}: The next 1 damage that would be dealt to Shaman en-Kor this turn is dealt to target creature you control instead.\n{1}{W}: The next time a source of your choice would deal damage to target creature this turn, that damage is dealt to Shaman en-Kor instead."
Skyshroud Falcon,2.0,['White'],['W'],None,['Creature'],['Bird'],Common,STH,1,1,None,"Flying, vigilance"
Reins of Power,4.0,['Blue'],['U'],None,['Instant'],None,Rare,STH,None,None,None,Untap all creatures you control and all creatures target opponent controls. You and that opponent each gain control of all creatures the other controls until end of turn. Those creatures gain haste until end of turn.
Scapegoat,1.0,['White'],['W'],None,['Instant'],None,Uncommon,STH,None,None,None,"As an additional cost to cast this spell, sacrifice a creature.\nReturn any number of target creatures you control to their owner's hand."
Sacred Ground,2.0,['White'],['W'],None,['Enchantment'],None,Rare,STH,None,None,None,"Whenever a spell or ability an opponent controls causes a land to be put into your graveyard from the battlefield, return that card to the battlefield."
Rolling Stones,2.0,['White'],['W'],None,['Enchantment'],None,Rare,STH,None,None,None,Wall creatures can attack as though they didn't have defender.
Pursuit of Knowledge,4.0,['White'],['W'],None,['Enchantment'],None,Rare,STH,None,None,None,"If you would draw a card, you may put a study counter on Pursuit of Knowledge instead.\nRemove three study counters from Pursuit of Knowledge, Sacrifice Pursuit of Knowledge: Draw seven cards."
Honor Guard,1.0,['White'],['W'],None,['Creature'],"['Human', 'Soldier']",Common,STH,1,1,None,{W}: Honor Guard gets +0/+1 until end of turn.
Nomads en-Kor,1.0,['White'],['W'],None,['Creature'],"['Kor', 'Nomad', 'Soldier']",Common,STH,1,1,None,{0}: The next 1 damage that would be dealt to Nomads en-Kor this turn is dealt to target creature you control instead.
Death Stroke,2.0,['Black'],['B'],None,['Sorcery'],None,Common,STH,None,None,None,Destroy target tapped creature.
Lancers en-Kor,5.0,['White'],['W'],None,['Creature'],"['Kor', 'Soldier']",Uncommon,STH,3,3,None,Trample\n{0}: The next 1 damage that would be dealt to Lancers en-Kor this turn is dealt to target creature you control instead.
Corrupting Licid,3.0,['Black'],['B'],None,['Creature'],['Licid'],Uncommon,STH,2,2,None,"{B}, {T}: Corrupting Licid loses this ability and becomes an Aura enchantment with enchant creature. Attach it to target creature. You may pay {B} to end this effect.\nEnchanted creature has fear. (It can't be blocked except by artifact creatures and/or black creatures.)"
Change of Heart,1.0,['White'],['W'],None,['Instant'],None,Common,STH,None,None,None,"Buyback {3} (You may pay an additional {3} as you cast this spell. If you do, put this card into your hand as it resolves.)\nTarget creature can't attack this turn."
Bandage,1.0,['White'],['W'],None,['Instant'],None,Common,STH,None,None,None,Prevent the next 1 damage that would be dealt to any target this turn.\nDraw a card.
Dauthi Trapper,3.0,['Black'],['B'],None,['Creature'],"['Dauthi', 'Minion']",Uncommon,STH,1,1,None,{T}: Target creature gains shadow until end of turn. (It can block or be blocked by only creatures with shadow.)
Hidden Retreat,3.0,['White'],['W'],None,['Enchantment'],None,Rare,STH,None,None,None,Put a card from your hand on top of your library: Prevent all damage that would be dealt by target instant or sorcery spell this turn.
Conviction,2.0,['White'],['W'],None,['Enchantment'],['Aura'],Common,STH,None,None,None,Enchant creature\nEnchanted creature gets +1/+3.\n{W}: Return Conviction to its owner's hand.
Contemplation,3.0,['White'],['W'],None,['Enchantment'],None,Uncommon,STH,None,None,None,"Whenever you cast a spell, you gain 1 life."
Foul Imp,2.0,['Black'],['B'],None,['Creature'],['Imp'],Common,STH,2,2,None,"Flying\nWhen Foul Imp enters the battlefield, you lose 2 life."
