Name,CMC,Colors,Color identity,Supertypes,Types,Subtypes,Rarity,Set,Power,Toughness,Loyalty,Text
Scathe Zombies,3.0,['Black'],['B'],None,['Creature'],['Zombie'],Common,SUM,2,2,None,None
Mountain,0.0,None,['R'],['Basic'],['Land'],['Mountain'],Common,SUM,None,None,None,({T}: Add {R}.)
Sacrifice,1.0,['Black'],['B'],None,['Instant'],None,Uncommon,SUM,None,None,None,"As an additional cost to cast this spell, sacrifice a creature.\nAdd an amount of {B} equal to the sacrificed creature's mana value."
Royal Assassin,3.0,['Black'],['B'],None,['Creature'],"['Human', 'Assassin']",Rare,SUM,1,1,None,{T}: Destroy target tapped creature.
Clockwork Beast,6.0,None,None,None,"['Artifact', 'Creature']",['Beast'],Rare,SUM,0,4,None,"Clockwork Beast enters the battlefield with seven +1/+0 counters on it.\nAt end of combat, if Clockwork Beast attacked or blocked this combat, remove a +1/+0 counter from it.\n{X}, {T}: Put up to X +1/+0 counters on Clockwork Beast. This ability can't cause the total number of +1/+0 counters on Clockwork Beast to be greater than seven. Activate only during your upkeep."
Raise Dead,1.0,['Black'],['B'],None,['Sorcery'],None,Common,SUM,None,None,None,Return target creature card from your graveyard to your hand.
Plague Rats,3.0,['Black'],['B'],None,['Creature'],['Rat'],Common,SUM,*,*,None,Plague Rats's power and toughness are each equal to the number of creatures named Plague Rats on the battlefield.
Forest,0.0,None,['G'],['Basic'],['Land'],['Forest'],Common,SUM,None,None,None,({T}: Add {G}.)
Pestilence,4.0,['Black'],['B'],None,['Enchantment'],None,Common,SUM,None,None,None,"At the beginning of the end step, if no creatures are on the battlefield, sacrifice Pestilence.\n{B}: Pestilence deals 1 damage to each creature and each player."
Paralyze,1.0,['Black'],['B'],None,['Enchantment'],['Aura'],Common,SUM,None,None,None,"Enchant creature\nWhen Paralyze enters the battlefield, tap enchanted creature.\nEnchanted creature doesn't untap during its controller's untap step.\nAt the beginning of the upkeep of enchanted creature's controller, that player may pay {4}. If the player does, untap the creature."
Nightmare,6.0,['Black'],['B'],None,['Creature'],"['Nightmare', 'Horse']",Rare,SUM,*,*,None,Flying (This creature can't be blocked except by creatures with flying or reach.)\nNightmare's power and toughness are each equal to the number of Swamps you control.
Nettling Imp,3.0,['Black'],['B'],None,['Creature'],['Imp'],Uncommon,SUM,1,1,None,"{T}: Choose target non-Wall creature the active player has controlled continuously since the beginning of the turn. That creature attacks this turn if able. Destroy it at the beginning of the next end step if it didn't attack this turn. Activate only during an opponent's turn, before attackers are declared."
Nether Shadow,2.0,['Black'],['B'],None,['Creature'],['Spirit'],Rare,SUM,1,1,None,"Haste\nAt the beginning of your upkeep, if Nether Shadow is in your graveyard with three or more creature cards above it, you may put Nether Shadow onto the battlefield."
Forest,0.0,None,['G'],['Basic'],['Land'],['Forest'],Common,SUM,None,None,None,({T}: Add {G}.)
Mind Twist,1.0,['Black'],['B'],None,['Sorcery'],None,Rare,SUM,None,None,None,Target player discards X cards at random.
Deathlace,1.0,['Black'],['B'],None,['Instant'],None,Rare,SUM,None,None,None,Target spell or permanent becomes black. (Mana symbols on that permanent remain unchanged.)
Gloom,3.0,['Black'],['B'],None,['Enchantment'],None,Uncommon,SUM,None,None,None,White spells cost {3} more to cast.\nActivated abilities of white enchantments cost {3} more to activate.
Hypnotic Specter,3.0,['Black'],['B'],None,['Creature'],['Specter'],Uncommon,SUM,2,2,None,"Flying\nWhenever Hypnotic Specter deals damage to an opponent, that player discards a card at random."
Lord of the Pit,7.0,['Black'],['B'],None,['Creature'],['Demon'],Rare,SUM,7,7,None,"Flying, trample\nAt the beginning of your upkeep, sacrifice a creature other than Lord of the Pit. If you can't, Lord of the Pit deals 7 damage to you."
Forest,0.0,None,['G'],['Basic'],['Land'],['Forest'],Common,SUM,None,None,None,({T}: Add {G}.)
Howl from Beyond,1.0,['Black'],['B'],None,['Instant'],None,Common,SUM,None,None,None,Target creature gets +X/+0 until end of turn.
Frozen Shade,3.0,['Black'],['B'],None,['Creature'],['Shade'],Common,SUM,0,1,None,{B}: Frozen Shade gets +1/+1 until end of turn.
Fear,2.0,['Black'],['B'],None,['Enchantment'],['Aura'],Common,SUM,None,None,None,Enchant creature (Target a creature as you cast this. This card enters the battlefield attached to that creature.)\nEnchanted creature has fear. (It can't be blocked except by artifact creatures and/or black creatures.)
Evil Presence,1.0,['Black'],['B'],None,['Enchantment'],['Aura'],Uncommon,SUM,None,None,None,Enchant land\nEnchanted land is a Swamp.
Drudge Skeletons,2.0,['Black'],['B'],None,['Creature'],['Skeleton'],Common,SUM,1,1,None,"{B}: Regenerate Drudge Skeletons. (The next time this creature would be destroyed this turn, it isn't. Instead tap it, remove all damage from it, and remove it from combat.)"
Black Vise,1.0,None,None,None,['Artifact'],None,Uncommon,SUM,None,None,None,"As Black Vise enters the battlefield, choose an opponent.\nAt the beginning of the chosen player's upkeep, Black Vise deals X damage to that player, where X is the number of cards in their hand minus 4."
Erg Raiders,2.0,['Black'],['B'],None,['Creature'],"['Human', 'Warrior']",Common,SUM,2,3,None,"At the beginning of your end step, if Erg Raiders didn't attack this turn, Erg Raiders deals 2 damage to you unless it came under your control this turn."
El-Hajjâj,3.0,['Black'],['B'],None,['Creature'],"['Human', 'Wizard']",Rare,SUM,1,1,None,"Whenever El-Hajjâj deals damage, you gain that much life."
Demonic Attorney,3.0,['Black'],['B'],None,['Sorcery'],None,Rare,SUM,None,None,None,Remove Demonic Attorney from your deck before playing if you're not playing for ante.\nEach player antes the top card of their library.
Deathgrip,2.0,['Black'],['B'],None,['Enchantment'],None,Uncommon,SUM,None,None,None,{B}{B}: Counter target green spell.
Ley Druid,3.0,['Green'],['G'],None,['Creature'],"['Human', 'Druid']",Uncommon,SUM,1,1,None,{T}: Untap target land.
Drain Life,2.0,['Black'],['B'],None,['Sorcery'],None,Common,SUM,None,None,None,"Spend only black mana on X.\nDrain Life deals X damage to any target. You gain life equal to the damage dealt, but not more life than the player's life total before the damage was dealt, the planeswalker's loyalty before the damage was dealt, or the creature's toughness."
Demonic Tutor,2.0,['Black'],['B'],None,['Sorcery'],None,Uncommon,SUM,None,None,None,"Search your library for a card, put that card into your hand, then shuffle."
Demonic Hordes,6.0,['Black'],['B'],None,['Creature'],['Demon'],Rare,SUM,5,5,None,"{T}: Destroy target land.\nAt the beginning of your upkeep, unless you pay {B}{B}{B}, tap Demonic Hordes and sacrifice a land of an opponent's choice."
Stasis,2.0,['Blue'],['U'],None,['Enchantment'],None,Rare,SUM,None,None,None,"Players skip their untap steps.\nAt the beginning of your upkeep, sacrifice Stasis unless you pay {U}."
Spell Blast,1.0,['Blue'],['U'],None,['Instant'],None,Common,SUM,None,None,None,"Counter target spell with mana value X. (For example, if that spell's mana cost is {3}{U}{U}, X is 5.)"
Sleight of Mind,1.0,['Blue'],['U'],None,['Instant'],None,Rare,SUM,None,None,None,"Change the text of target spell or permanent by replacing all instances of one color word with another. (For example, you may change ""target black spell"" to ""target blue spell."" This effect lasts indefinitely.)"
Siren's Call,1.0,['Blue'],['U'],None,['Instant'],None,Uncommon,SUM,None,None,None,"Cast this spell only during an opponent's turn, before attackers are declared.\nCreatures the active player controls attack this turn if able.\nAt the beginning of the next end step, destroy all non-Wall creatures that player controls that didn't attack this turn. Ignore this effect for each creature the player didn't control continuously since the beginning of the turn."
Darkpact,3.0,['Black'],['B'],None,['Sorcery'],None,Rare,SUM,None,None,None,Remove Darkpact from your deck before playing if you're not playing for ante.\nYou own target card in the ante. Exchange that card with the top card of your library.
Swamp,0.0,None,['B'],['Basic'],['Land'],['Swamp'],Common,SUM,None,None,None,({T}: Add {B}.)
Serendib Efreet,3.0,['Blue'],['U'],None,['Creature'],['Efreet'],Rare,SUM,3,4,None,"Flying\nAt the beginning of your upkeep, Serendib Efreet deals 1 damage to you."
Dark Ritual,1.0,['Black'],['B'],None,['Instant'],None,Common,SUM,None,None,None,Add {B}{B}{B}.
Millstone,2.0,None,None,None,['Artifact'],None,Rare,SUM,None,None,None,"{2}, {T}: Target player mills two cards."
Sea Serpent,6.0,['Blue'],['U'],None,['Creature'],['Serpent'],Common,SUM,5,5,None,"Sea Serpent can't attack unless defending player controls an Island.\nWhen you control no Islands, sacrifice Sea Serpent."
Reconstruction,1.0,['Blue'],['U'],None,['Sorcery'],None,Common,SUM,None,None,None,Return target artifact card from your graveyard to your hand.
Cursed Land,4.0,['Black'],['B'],None,['Enchantment'],['Aura'],Uncommon,SUM,None,None,None,"Enchant land\nAt the beginning of the upkeep of enchanted land's controller, Cursed Land deals 1 damage to that player."
Psychic Venom,2.0,['Blue'],['U'],None,['Enchantment'],['Aura'],Common,SUM,None,None,None,"Enchant land\nWhenever enchanted land becomes tapped, Psychic Venom deals 2 damage to that land's controller."
Contract from Below,1.0,['Black'],['B'],None,['Sorcery'],None,Rare,SUM,None,None,None,"Remove Contract from Below from your deck before playing if you're not playing for ante.\nDiscard your hand, ante the top card of your library, then draw seven cards."
Prodigal Sorcerer,3.0,['Blue'],['U'],None,['Creature'],"['Human', 'Wizard']",Common,SUM,1,1,None,{T}: Prodigal Sorcerer deals 1 damage to any target.
Bog Wraith,4.0,['Black'],['B'],None,['Creature'],['Wraith'],Uncommon,SUM,3,3,None,Swampwalk (This creature can't be blocked as long as defending player controls a Swamp.)
Swamp,0.0,None,['B'],['Basic'],['Land'],['Swamp'],Common,SUM,None,None,None,({T}: Add {B}.)
Power Sink,1.0,['Blue'],['U'],None,['Instant'],None,Common,SUM,None,None,None,"Counter target spell unless its controller pays {X}. If that player doesn't, they tap all lands with mana abilities they control and lose all unspent mana."
Black Knight,2.0,['Black'],['B'],None,['Creature'],"['Human', 'Knight']",Uncommon,SUM,2,2,None,"First strike (This creature deals combat damage before creatures without first strike.)\nProtection from white (This creature can't be blocked, targeted, dealt damage, or enchanted by anything white.)"
Power Leak,2.0,['Blue'],['U'],None,['Enchantment'],['Aura'],Common,SUM,None,None,None,"Enchant enchantment\nAt the beginning of the upkeep of enchanted enchantment's controller, that player may pay any amount of mana. Power Leak deals 2 damage to that player. Prevent X of that damage, where X is the amount of mana that player paid this way."
Bad Moon,2.0,['Black'],['B'],None,['Enchantment'],None,Rare,SUM,None,None,None,Black creatures get +1/+1.
Pirate Ship,5.0,['Blue'],['U'],None,['Creature'],"['Human', 'Pirate']",Rare,SUM,4,3,None,"Pirate Ship can't attack unless defending player controls an Island.\n{T}: Pirate Ship deals 1 damage to any target.\nWhen you control no Islands, sacrifice Pirate Ship."
Animate Dead,2.0,['Black'],['B'],None,['Enchantment'],['Aura'],Uncommon,SUM,None,None,None,"Enchant creature card in a graveyard\nWhen Animate Dead enters the battlefield, if it's on the battlefield, it loses ""enchant creature card in a graveyard"" and gains ""enchant creature put onto the battlefield with Animate Dead."" Return enchanted creature card to the battlefield under your control and attach Animate Dead to it. When Animate Dead leaves the battlefield, that creature's controller sacrifices it.\nEnchanted creature gets -1/-0."
Phantom Monster,4.0,['Blue'],['U'],None,['Creature'],['Illusion'],Uncommon,SUM,3,3,None,Flying
Water Elemental,5.0,['Blue'],['U'],None,['Creature'],['Elemental'],Uncommon,SUM,5,4,None,None
Phantasmal Terrain,2.0,['Blue'],['U'],None,['Enchantment'],['Aura'],Common,SUM,None,None,None,"Enchant land\nAs Phantasmal Terrain enters the battlefield, choose a basic land type.\nEnchanted land is the chosen type."
Phantasmal Forces,4.0,['Blue'],['U'],None,['Creature'],['Illusion'],Uncommon,SUM,4,1,None,"Flying\nAt the beginning of your upkeep, sacrifice Phantasmal Forces unless you pay {U}."
Merfolk of the Pearl Trident,1.0,['Blue'],['U'],None,['Creature'],['Merfolk'],Common,SUM,1,1,None,None
Wall of Water,3.0,['Blue'],['U'],None,['Creature'],['Wall'],Uncommon,SUM,0,5,None,Defender (This creature can't attack.)\n{U}: Wall of Water gets +1/+0 until end of turn.
Nevinyrral's Disk,4.0,None,None,None,['Artifact'],None,Rare,SUM,None,None,None,"Nevinyrral's Disk enters the battlefield tapped.\n{1}, {T}: Destroy all artifacts, creatures, and enchantments."
Mana Short,3.0,['Blue'],['U'],None,['Instant'],None,Rare,SUM,None,None,None,Tap all lands target player controls and that player loses all unspent mana.
Mahamoti Djinn,6.0,['Blue'],['U'],None,['Creature'],['Djinn'],Rare,SUM,5,6,None,Flying (This creature can't be blocked except by creatures with flying or reach.)
Magical Hack,1.0,['Blue'],['U'],None,['Instant'],None,Rare,SUM,None,None,None,"Change the text of target spell or permanent by replacing all instances of one basic land type with another. (For example, you may change ""swampwalk"" to ""plainswalk."" This effect lasts indefinitely.)"
Wall of Air,3.0,['Blue'],['U'],None,['Creature'],['Wall'],Uncommon,SUM,1,5,None,"Defender, flying (This creature can't attack, and it can block creatures with flying.)"
Lord of Atlantis,2.0,['Blue'],['U'],None,['Creature'],['Merfolk'],Rare,SUM,2,2,None,Other Merfolk get +1/+1 and have islandwalk. (They can't be blocked as long as defending player controls an Island.)
Volcanic Eruption,3.0,['Blue'],['U'],None,['Sorcery'],None,Rare,SUM,None,None,None,Destroy X target Mountains. Volcanic Eruption deals damage to each creature and each player equal to the number of Mountains put into a graveyard this way.
Lifetap,2.0,['Blue'],['U'],None,['Enchantment'],None,Uncommon,SUM,None,None,None,"Whenever a Forest an opponent controls becomes tapped, you gain 1 life."
Vesuvan Doppelganger,5.0,['Blue'],['U'],None,['Creature'],['Shapeshifter'],Rare,SUM,0,0,None,"You may have Vesuvan Doppelganger enter the battlefield as a copy of any creature on the battlefield, except it doesn't copy that creature's color and it has ""At the beginning of your upkeep, you may have this creature become a copy of target creature, except it doesn't copy that creature's color and it has this ability."""
Jump,1.0,['Blue'],['U'],None,['Instant'],None,Common,SUM,None,None,None,Target creature gains flying until end of turn.
Island Fish Jasconius,7.0,['Blue'],['U'],None,['Creature'],['Fish'],Rare,SUM,6,8,None,"Island Fish Jasconius doesn't untap during your untap step.\nAt the beginning of your upkeep, you may pay {U}{U}{U}. If you do, untap Island Fish Jasconius.\nIsland Fish Jasconius can't attack unless defending player controls an Island.\nWhen you control no Islands, sacrifice Island Fish Jasconius."
Unsummon,1.0,['Blue'],['U'],None,['Instant'],None,Common,SUM,None,None,None,Return target creature to its owner's hand.
Hurkyl's Recall,2.0,['Blue'],['U'],None,['Instant'],None,Rare,SUM,None,None,None,Return all artifacts target player owns to their hand.
Flight,1.0,['Blue'],['U'],None,['Enchantment'],['Aura'],Common,SUM,None,None,None,Enchant creature\nEnchanted creature has flying.
Feedback,3.0,['Blue'],['U'],None,['Enchantment'],['Aura'],Uncommon,SUM,None,None,None,"Enchant enchantment\nAt the beginning of the upkeep of enchanted enchantment's controller, Feedback deals 1 damage to that player."
Unstable Mutation,1.0,['Blue'],['U'],None,['Enchantment'],['Aura'],Common,SUM,None,None,None,"Enchant creature\nEnchanted creature gets +3/+3.\nAt the beginning of the upkeep of enchanted creature's controller, put a -1/-1 counter on that creature."
Energy Flux,3.0,['Blue'],['U'],None,['Enchantment'],None,Uncommon,SUM,None,None,None,"All artifacts have ""At the beginning of your upkeep, sacrifice this artifact unless you pay {2}."""
Thoughtlace,1.0,['Blue'],['U'],None,['Instant'],None,Rare,SUM,None,None,None,Target spell or permanent becomes blue. (Mana symbols on that permanent remain unchanged.)
Drain Power,2.0,['Blue'],['U'],None,['Sorcery'],None,Rare,SUM,None,None,None,Target player activates a mana ability of each land they control. Then that player loses all unspent mana and you add the mana lost this way.
Steal Artifact,4.0,['Blue'],['U'],None,['Enchantment'],['Aura'],Uncommon,SUM,None,None,None,Enchant artifact\nYou control enchanted artifact.
Island,0.0,None,['U'],['Basic'],['Land'],['Island'],Common,SUM,None,None,None,({T}: Add {U}.)
Creature Bond,2.0,['Blue'],['U'],None,['Enchantment'],['Aura'],Common,SUM,None,None,None,"Enchant creature\nWhen enchanted creature dies, Creature Bond deals damage equal to that creature's toughness to the creature's controller."
Counterspell,2.0,['Blue'],['U'],None,['Instant'],None,Uncommon,SUM,None,None,None,Counter target spell.
Copy Artifact,2.0,['Blue'],['U'],None,['Enchantment'],None,Rare,SUM,None,None,None,"You may have Copy Artifact enter the battlefield as a copy of any artifact on the battlefield, except it's an enchantment in addition to its other types."
Control Magic,4.0,['Blue'],['U'],None,['Enchantment'],['Aura'],Uncommon,SUM,None,None,None,Enchant creature\nYou control enchanted creature.
Island,0.0,None,['U'],['Basic'],['Land'],['Island'],Common,SUM,None,None,None,({T}: Add {U}.)
Clone,4.0,['Blue'],['U'],None,['Creature'],['Shapeshifter'],Uncommon,SUM,0,0,None,You may have Clone enter the battlefield as a copy of any creature on the battlefield.
Braingeyser,2.0,['Blue'],['U'],None,['Sorcery'],None,Rare,SUM,None,None,None,Target player draws X cards.
Blue Elemental Blast,1.0,['Blue'],['U'],None,['Instant'],None,Common,SUM,None,None,None,Choose one —\n• Counter target red spell.\n• Destroy target red permanent.
Animate Artifact,4.0,['Blue'],['U'],None,['Enchantment'],['Aura'],Uncommon,SUM,None,None,None,"Enchant artifact\nAs long as enchanted artifact isn't a creature, it's an artifact creature with power and toughness each equal to its mana value."
Island,0.0,None,['U'],['Basic'],['Land'],['Island'],Common,SUM,None,None,None,({T}: Add {U}.)
Air Elemental,5.0,['Blue'],['U'],None,['Creature'],['Elemental'],Uncommon,SUM,4,4,None,Flying
Wrath of God,4.0,['White'],['W'],None,['Sorcery'],None,Rare,SUM,None,None,None,Destroy all creatures. They can't be regenerated.
Ornithopter,0.0,None,None,None,"['Artifact', 'Creature']",['Thopter'],Uncommon,SUM,0,2,None,Flying
White Ward,1.0,['White'],['W'],None,['Enchantment'],['Aura'],Uncommon,SUM,None,None,None,Enchant creature\nEnchanted creature has protection from white. This effect doesn't remove White Ward.
White Knight,2.0,['White'],['W'],None,['Creature'],"['Human', 'Knight']",Uncommon,SUM,2,2,None,"First strike (This creature deals combat damage before creatures without first strike.)\nProtection from black (This creature can't be blocked, targeted, dealt damage, or enchanted by anything black.)"
Plains,0.0,None,['W'],['Basic'],['Land'],['Plains'],Common,SUM,None,None,None,({T}: Add {W}.)
Onulet,3.0,None,None,None,"['Artifact', 'Creature']",['Construct'],Rare,SUM,2,2,None,"When Onulet dies, you gain 2 life."
Wall of Swords,4.0,['White'],['W'],None,['Creature'],['Wall'],Uncommon,SUM,3,5,None,Defender (This creature can't attack.)\nFlying
Weakness,1.0,['Black'],['B'],None,['Enchantment'],['Aura'],Common,SUM,None,None,None,Enchant creature\nEnchanted creature gets -2/-1.
Sedge Troll,3.0,['Red'],"['B', 'R']",None,['Creature'],['Troll'],Rare,SUM,2,2,None,Sedge Troll gets +1/+1 as long as you control a Swamp.\n{B}: Regenerate Sedge Troll.
Veteran Bodyguard,5.0,['White'],['W'],None,['Creature'],['Human'],Rare,SUM,2,5,None,"As long as Veteran Bodyguard is untapped, all damage that would be dealt to you by unblocked creatures is dealt to Veteran Bodyguard instead."
Power Surge,2.0,['Red'],['R'],None,['Enchantment'],None,Rare,SUM,None,None,None,"At the beginning of each player's upkeep, Power Surge deals X damage to that player, where X is the number of untapped lands they controlled at the beginning of this turn."
Dragon Engine,3.0,None,None,None,"['Artifact', 'Creature']",['Construct'],Rare,SUM,1,3,None,{2}: Dragon Engine gets +1/+0 until end of turn.
Swords to Plowshares,1.0,['White'],['W'],None,['Instant'],None,Uncommon,SUM,None,None,None,Exile target creature. Its controller gains life equal to its power.
Warp Artifact,2.0,['Black'],['B'],None,['Enchantment'],['Aura'],Rare,SUM,None,None,None,"Enchant artifact\nAt the beginning of the upkeep of enchanted artifact's controller, Warp Artifact deals 1 damage to that player."
Orcish Oriflamme,4.0,['Red'],['R'],None,['Enchantment'],None,Uncommon,SUM,None,None,None,Attacking creatures you control get +1/+0.
Serra Angel,5.0,['White'],['W'],None,['Creature'],['Angel'],Uncommon,SUM,4,4,None,"Flying, vigilance"
Roc of Kher Ridges,4.0,['Red'],['R'],None,['Creature'],['Bird'],Rare,SUM,3,3,None,Flying
Disrupting Scepter,3.0,None,None,None,['Artifact'],None,Rare,SUM,None,None,None,"{3}, {T}: Target player discards a card. Activate only during your turn."
Savannah Lions,1.0,['White'],['W'],None,['Creature'],['Cat'],Rare,SUM,2,1,None,None
Wall of Bone,3.0,['Black'],['B'],None,['Creature'],"['Skeleton', 'Wall']",Uncommon,SUM,1,4,None,"Defender (This creature can't attack.)\n{B}: Regenerate Wall of Bone. (The next time this creature would be destroyed this turn, it isn't. Instead tap it, remove all damage from it, and remove it from combat.)"
Red Elemental Blast,1.0,['Red'],['R'],None,['Instant'],None,Common,SUM,None,None,None,Choose one —\n• Counter target blue spell.\n• Destroy target blue permanent.
Samite Healer,2.0,['White'],['W'],None,['Creature'],"['Human', 'Cleric']",Common,SUM,1,1,None,{T}: Prevent the next 1 damage that would be dealt to any target this turn.
Orcish Artillery,3.0,['Red'],['R'],None,['Creature'],"['Orc', 'Warrior']",Uncommon,SUM,1,3,None,{T}: Orcish Artillery deals 2 damage to any target and 3 damage to you.
Dingus Egg,4.0,None,None,None,['Artifact'],None,Rare,SUM,None,None,None,"Whenever a land is put into a graveyard from the battlefield, Dingus Egg deals 2 damage to that land's controller."
Righteousness,1.0,['White'],['W'],None,['Instant'],None,Rare,SUM,None,None,None,Target blocking creature gets +7/+7 until end of turn.
Unholy Strength,1.0,['Black'],['B'],None,['Enchantment'],['Aura'],Common,SUM,None,None,None,Enchant creature\nEnchanted creature gets +2/+1.
Mijae Djinn,3.0,['Red'],['R'],None,['Creature'],['Djinn'],Rare,SUM,6,3,None,"Whenever Mijae Djinn attacks, flip a coin. If you lose the flip, remove Mijae Djinn from combat and tap it."
Reverse Polarity,2.0,['White'],['W'],None,['Instant'],None,Uncommon,SUM,None,None,None,"You gain X life, where X is twice the damage dealt to you so far this turn by artifacts."
Mons's Goblin Raiders,1.0,['Red'],['R'],None,['Creature'],['Goblin'],Common,SUM,1,1,None,None
Dancing Scimitar,4.0,None,None,None,"['Artifact', 'Creature']",['Spirit'],Rare,SUM,1,5,None,Flying (This creature can't be blocked except by creatures with flying or reach.)
Reverse Damage,3.0,['White'],['W'],None,['Instant'],None,Rare,SUM,None,None,None,"The next time a source of your choice would deal damage to you this turn, prevent that damage. You gain life equal to the damage prevented this way."
Terror,2.0,['Black'],['B'],None,['Instant'],None,Common,SUM,None,None,None,"Destroy target nonartifact, nonblack creature. It can't be regenerated."
Manabarbs,4.0,['Red'],['R'],None,['Enchantment'],None,Rare,SUM,None,None,None,"Whenever a player taps a land for mana, Manabarbs deals 1 damage to that player."
Resurrection,4.0,['White'],['W'],None,['Sorcery'],None,Uncommon,SUM,None,None,None,Return target creature card from your graveyard to the battlefield.
Magnetic Mountain,3.0,['Red'],['R'],None,['Enchantment'],None,Rare,SUM,None,None,None,"Blue creatures don't untap during their controllers' untap steps.\nAt the beginning of each player's upkeep, that player may choose any number of tapped blue creatures they control and pay {4} for each creature chosen this way. If the player does, untap those creatures."
Conservator,4.0,None,None,None,['Artifact'],None,Uncommon,SUM,None,None,None,"{3}, {T}: Prevent the next 2 damage that would be dealt to you this turn."
Red Ward,1.0,['White'],['W'],None,['Enchantment'],['Aura'],Uncommon,SUM,None,None,None,Enchant creature\nEnchanted creature has protection from red. This effect doesn't remove Red Ward.
Sorceress Queen,3.0,['Black'],['B'],None,['Creature'],"['Human', 'Wizard']",Rare,SUM,1,1,None,{T}: Target creature other than Sorceress Queen has base power and toughness 0/2 until end of turn.
Lightning Bolt,1.0,['Red'],['R'],None,['Instant'],None,Common,SUM,None,None,None,Lightning Bolt deals 3 damage to any target.
Purelace,1.0,['White'],['W'],None,['Instant'],None,Rare,SUM,None,None,None,Target spell or permanent becomes white. (Mana symbols on that permanent remain unchanged.)
Kird Ape,1.0,['Red'],['R'],None,['Creature'],['Ape'],Common,SUM,1,1,None,Kird Ape gets +1/+2 as long as you control a Forest.
Celestial Prism,3.0,None,None,None,['Artifact'],None,Uncommon,SUM,None,None,None,"{2}, {T}: Add one mana of any color."
