Name,CMC,Colors,Color identity,Supertypes,Types,Subtypes,Rarity,Set,Power,Toughness,Loyalty,Text
Flying Carpet,4.0,None,None,None,['Artifact'],None,Rare,SUM,None,None,None,"{2}, {T}: Target creature gains flying until end of turn."
Craw Wurm,6.0,['Green'],['G'],None,['Creature'],['Wurm'],Common,SUM,6,4,None,None
Cockatrice,5.0,['Green'],['G'],None,['Creature'],['Cockatrice'],Rare,SUM,2,4,None,"Flying\nWhenever Cockatrice blocks or becomes blocked by a non-Wall creature, destroy that creature at end of combat."
Jayemdae Tome,4.0,None,None,None,['Artifact'],None,Rare,SUM,None,None,None,"{4}, {T}: Draw a card."
Primal Clay,4.0,None,None,None,"['Artifact', 'Creature']",['Shapeshifter'],Rare,SUM,*,*,None,"As Primal Clay enters the battlefield, it becomes your choice of a 3/3 artifact creature, a 2/2 artifact creature with flying, or a 1/6 Wall artifact creature with defender in addition to its other types. (A creature with defender can't attack.)"
Fog,1.0,['Green'],['G'],None,['Instant'],None,Common,SUM,None,None,None,Prevent all combat damage that would be dealt this turn.
Mishra's War Machine,7.0,None,None,None,"['Artifact', 'Creature']",['Juggernaut'],Rare,SUM,5,5,None,"Banding (Any creatures with banding, and up to one without, can attack in a band. Bands are blocked as a group. If any creatures with banding you control are blocking or being blocked by a creature, you divide that creature's combat damage, not its controller, among any of the creatures it's being blocked by or is blocking.)\nAt the beginning of your upkeep, Mishra's War Machine deals 3 damage to you unless you discard a card. If Mishra's War Machine deals damage to you this way, tap it."
Shatter,2.0,['Red'],['R'],None,['Instant'],None,Common,SUM,None,None,None,Destroy target artifact.
Channel,2.0,['Green'],['G'],None,['Sorcery'],None,Uncommon,SUM,None,None,None,"Until end of turn, any time you could activate a mana ability, you may pay 1 life. If you do, add {C}."
Iron Star,1.0,None,None,None,['Artifact'],None,Uncommon,SUM,None,None,None,"Whenever a player casts a red spell, you may pay {1}. If you do, you gain 1 life."
Shivan Dragon,6.0,['Red'],['R'],None,['Creature'],['Dragon'],Rare,SUM,5,5,None,Flying (This creature can't be blocked except by creatures with flying or reach.)\n{R}: Shivan Dragon gets +1/+0 until end of turn.
Birds of Paradise,1.0,['Green'],['G'],None,['Creature'],['Bird'],Rare,SUM,0,1,None,Flying\n{T}: Add one mana of any color.
Shatterstorm,4.0,['Red'],['R'],None,['Sorcery'],None,Uncommon,SUM,None,None,None,Destroy all artifacts. They can't be regenerated.
Aspect of Wolf,2.0,['Green'],['G'],None,['Enchantment'],['Aura'],Rare,SUM,None,None,None,"Enchant creature\nEnchanted creature gets +X/+Y, where X is half the number of Forests you control, rounded down, and Y is half the number of Forests you control, rounded up."
Rock Hydra,2.0,['Red'],['R'],None,['Creature'],['Hydra'],Rare,SUM,0,0,None,"Rock Hydra enters the battlefield with X +1/+1 counters on it.\nFor each 1 damage that would be dealt to Rock Hydra, if it has a +1/+1 counter on it, remove a +1/+1 counter from it and prevent that 1 damage.\n{R}: Prevent the next 1 damage that would be dealt to Rock Hydra this turn.\n{R}{R}{R}: Put a +1/+1 counter on Rock Hydra. Activate only during your upkeep."
Fastbond,1.0,['Green'],['G'],None,['Enchantment'],None,Rare,SUM,None,None,None,"You may play any number of lands on each of your turns.\nWhenever you play a land, if it wasn't the first land you played this turn, Fastbond deals 1 damage to you."
Rocket Launcher,4.0,None,None,None,['Artifact'],None,Rare,SUM,None,None,None,{2}: Rocket Launcher deals 1 damage to any target. Destroy Rocket Launcher at the beginning of the next end step. Activate only if you've controlled Rocket Launcher continuously since the beginning of your most recent turn.
Will-o'-the-Wisp,1.0,['Black'],['B'],None,['Creature'],['Spirit'],Rare,SUM,0,1,None,"Flying (This creature can't be blocked except by creatures with flying or reach.)\n{B}: Regenerate Will-o'-the-Wisp. (The next time this creature would be destroyed this turn, it isn't. Instead tap it, remove all damage from it, and remove it from combat.)"
Wheel of Fortune,3.0,['Red'],['R'],None,['Sorcery'],None,Rare,SUM,None,None,None,"Each player discards their hand, then draws seven cards."
Jandor's Saddlebags,2.0,None,None,None,['Artifact'],None,Rare,SUM,None,None,None,"{3}, {T}: Untap target creature."
Wall of Stone,3.0,['Red'],['R'],None,['Creature'],['Wall'],Uncommon,SUM,0,8,None,Defender (This creature can't attack.)
Crystal Rod,1.0,None,None,None,['Artifact'],None,Uncommon,SUM,None,None,None,"Whenever a player casts a blue spell, you may pay {1}. If you do, you gain 1 life."
Mountain,0.0,None,['R'],['Basic'],['Land'],['Mountain'],Common,SUM,None,None,None,({T}: Add {R}.)
Wall of Fire,3.0,['Red'],['R'],None,['Creature'],['Wall'],Uncommon,SUM,0,5,None,Defender (This creature can't attack.)\n{R}: Wall of Fire gets +1/+0 until end of turn.
Elvish Archers,2.0,['Green'],['G'],None,['Creature'],"['Elf', 'Archer']",Rare,SUM,2,1,None,First strike
Mountain,0.0,None,['R'],['Basic'],['Land'],['Mountain'],Common,SUM,None,None,None,({T}: Add {R}.)
Mana Flare,3.0,['Red'],['R'],None,['Enchantment'],None,Rare,SUM,None,None,None,"Whenever a player taps a land for mana, that player adds one mana of any type that land produced."
