Name,CMC,Colors,Color identity,Supertypes,Types,Subtypes,Rarity,Set,Power,Toughness,Loyalty,Text
Stern Judge,3.0,['White'],['W'],None,['Creature'],"['Human', 'Cleric']",Uncommon,TOR,2,2,None,{T}: Each player loses 1 life for each Swamp they control.
Hydromorph Gull,5.0,['Blue'],['U'],None,['Creature'],"['Elemental', 'Bird']",Uncommon,TOR,3,3,None,"Flying\n{U}, Sacrifice Hydromorph Gull: Counter target spell that targets a creature you control."
Reborn Hero,3.0,['White'],['W'],None,['Creature'],"['Human', 'Soldier']",Rare,TOR,2,2,None,"Vigilance\nThreshold — As long as seven or more cards are in your graveyard, Reborn Hero has ""When Reborn Hero dies, you may pay {W}{W}. If you do, return Reborn Hero to the battlefield under your control."""
Pay No Heed,1.0,['White'],['W'],None,['Instant'],None,Common,TOR,None,None,None,Prevent all damage a source of your choice would deal this turn.
Hydromorph Guardian,3.0,['Blue'],['U'],None,['Creature'],['Elemental'],Common,TOR,2,2,None,"{U}, Sacrifice Hydromorph Guardian: Counter target spell that targets a creature you control."
Mystic Familiar,2.0,['White'],['W'],None,['Creature'],['Bird'],Common,TOR,1,2,None,"Flying\nThreshold — As long as seven or more cards are in your graveyard, Mystic Familiar gets +1/+1 and has protection from black."
Ghostly Wings,2.0,['Blue'],['U'],None,['Enchantment'],['Aura'],Common,TOR,None,None,None,Enchant creature\nEnchanted creature gets +1/+1 and has flying.\nDiscard a card: Return enchanted creature to its owner's hand.
Morningtide,2.0,['White'],['W'],None,['Sorcery'],None,Rare,TOR,None,None,None,Exile all graveyards.
False Memories,2.0,['Blue'],['U'],None,['Instant'],None,Rare,TOR,None,None,None,"Mill seven cards. At the beginning of the next end step, exile seven cards from your graveyard."
Hypochondria,2.0,['White'],['W'],None,['Enchantment'],None,Uncommon,TOR,None,None,None,"{W}, Discard a card: Prevent the next 3 damage that would be dealt to any target this turn.\n{W}, Sacrifice Hypochondria: Prevent the next 3 damage that would be dealt to any target this turn."
Deep Analysis,4.0,['Blue'],['U'],None,['Sorcery'],None,Common,TOR,None,None,None,"Target player draws two cards.\nFlashback—{1}{U}, Pay 3 life. (You may cast this card from your graveyard for its flashback cost. Then exile it.)"
Coral Net,1.0,['Blue'],['U'],None,['Enchantment'],['Aura'],Common,TOR,None,None,None,"Enchant green or white creature\nEnchanted creature has ""At the beginning of your upkeep, sacrifice this creature unless you discard a card."""
Militant Monk,3.0,['White'],['W'],None,['Creature'],"['Human', 'Monk', 'Cleric']",Common,TOR,2,1,None,Vigilance\n{T}: Prevent the next 1 damage that would be dealt to any target this turn.
Compulsion,2.0,['Blue'],['U'],None,['Enchantment'],None,Uncommon,TOR,None,None,None,"{1}{U}, Discard a card: Draw a card.\n{1}{U}, Sacrifice Compulsion: Draw a card."
Major Teroh,4.0,['White'],['W'],['Legendary'],['Creature'],"['Bird', 'Soldier']",Rare,TOR,2,3,None,"Flying\n{3}{W}{W}, Sacrifice Major Teroh: Exile all black creatures."
Cleansing Meditation,3.0,['White'],['W'],None,['Sorcery'],None,Uncommon,TOR,None,None,None,"Destroy all enchantments.\nThreshold — If seven or more cards are in your graveyard, instead destroy all enchantments, then return all cards in your graveyard destroyed this way to the battlefield."
Circular Logic,3.0,['Blue'],['U'],None,['Instant'],None,Uncommon,TOR,None,None,None,"Counter target spell unless its controller pays {1} for each card in your graveyard.\nMadness {U} (If you discard this card, discard it into exile. When you do, cast it for its madness cost or put it into your graveyard.)"
Angel of Retribution,7.0,['White'],['W'],None,['Creature'],['Angel'],Rare,TOR,5,5,None,"Flying, first strike"
Churning Eddy,4.0,['Blue'],['U'],None,['Sorcery'],None,Common,TOR,None,None,None,Return target creature and target land to their owners' hands.
Frantic Purification,3.0,['White'],['W'],None,['Instant'],None,Common,TOR,None,None,None,"Destroy target enchantment.\nMadness {W} (If you discard this card, discard it into exile. When you do, cast it for its madness cost or put it into your graveyard.)"
Floating Shield,3.0,['White'],['W'],None,['Enchantment'],['Aura'],Common,TOR,None,None,None,"Enchant creature\nAs Floating Shield enters the battlefield, choose a color.\nEnchanted creature has protection from the chosen color. This effect doesn't remove Floating Shield.\nSacrifice Floating Shield: Target creature gains protection from the chosen color until end of turn."
Equal Treatment,2.0,['White'],['W'],None,['Instant'],None,Uncommon,TOR,None,None,None,"If any source would deal 1 or more damage to a permanent or player this turn, it deals 2 damage to that permanent or player instead.\nDraw a card."
Cephalid Vandal,2.0,['Blue'],['U'],None,['Creature'],"['Cephalid', 'Rogue']",Rare,TOR,1,1,None,"At the beginning of your upkeep, put a shred counter on Cephalid Vandal. Then mill a card for each shred counter on Cephalid Vandal."
Cephalid Snitch,2.0,['Blue'],['U'],None,['Creature'],"['Cephalid', 'Wizard']",Common,TOR,1,1,None,Sacrifice Cephalid Snitch: Target creature loses protection from black until end of turn.
Cephalid Sage,4.0,['Blue'],['U'],None,['Creature'],['Cephalid'],Uncommon,TOR,2,3,None,"Threshold — As long as seven or more cards are in your graveyard, Cephalid Sage has ""When Cephalid Sage enters the battlefield, draw three cards, then discard two cards."""
Cephalid Illusionist,2.0,['Blue'],['U'],None,['Creature'],"['Cephalid', 'Wizard']",Uncommon,TOR,1,1,None,"Whenever Cephalid Illusionist becomes the target of a spell or ability, mill three cards.\n{2}{U}, {T}: Prevent all combat damage that would be dealt to and dealt by target creature you control this turn."
Cephalid Aristocrat,5.0,['Blue'],['U'],None,['Creature'],"['Cephalid', 'Noble']",Common,TOR,3,3,None,"Whenever Cephalid Aristocrat becomes the target of a spell or ability, mill two cards."
Breakthrough,1.0,['Blue'],['U'],None,['Sorcery'],None,Uncommon,TOR,None,None,None,"Draw four cards, then choose X cards in your hand and discard the rest."
Balshan Collaborator,4.0,['Blue'],"['B', 'U']",None,['Creature'],"['Bird', 'Soldier']",Uncommon,TOR,2,2,None,Flying\n{B}: Balshan Collaborator gets +1/+1 until end of turn.
Aquamoeba,2.0,['Blue'],['U'],None,['Creature'],"['Elemental', 'Beast']",Common,TOR,1,3,None,Discard a card: Switch Aquamoeba's power and toughness until end of turn.
Ambassador Laquatus,3.0,['Blue'],['U'],['Legendary'],['Creature'],"['Merfolk', 'Wizard']",Rare,TOR,1,3,None,{3}: Target player mills three cards.
Alter Reality,2.0,['Blue'],['U'],None,['Instant'],None,Rare,TOR,None,None,None,Change the text of target spell or permanent by replacing all instances of one color word with another. (This effect lasts indefinitely.)\nFlashback {1}{U} (You may cast this card from your graveyard for its flashback cost. Then exile it.)
Vengeful Dreams,2.0,['White'],['W'],None,['Instant'],None,Rare,TOR,None,None,None,"As an additional cost to cast this spell, discard X cards.\nExile X target attacking creatures."
Transcendence,6.0,['White'],['W'],None,['Enchantment'],None,Rare,TOR,None,None,None,"You don't lose the game for having 0 or less life.\nWhen you have 20 or more life, you lose the game.\nWhenever you lose life, you gain 2 life for each 1 life you lost. (Damage dealt to you causes you to lose life.)"
Teroh's Vanguard,4.0,['White'],['W'],None,['Creature'],"['Human', 'Nomad']",Uncommon,TOR,2,3,None,"Flash\nThreshold — As long as seven or more cards are in your graveyard, Teroh's Vanguard has ""When Teroh's Vanguard enters the battlefield, creatures you control gain protection from black until end of turn."""
Teroh's Faithful,4.0,['White'],['W'],None,['Creature'],"['Human', 'Cleric']",Common,TOR,1,4,None,"When Teroh's Faithful enters the battlefield, you gain 4 life."
Strength of Isolation,2.0,['White'],['W'],None,['Enchantment'],['Aura'],Uncommon,TOR,None,None,None,"Enchant creature\nEnchanted creature gets +1/+2 and has protection from black.\nMadness {W} (If you discard this card, discard it into exile. When you do, cast it for its madness cost or put it into your graveyard.)"
