Name,CMC,Colors,Color identity,Supertypes,Types,Subtypes,Rarity,Set,Power,Toughness,Loyalty,Text
Meandering River,0.0,None,"['U', 'W']",None,['Land'],None,Common,AKH,None,None,None,Meandering River enters the battlefield tapped.\n{T}: Add {W} or {U}.
Island,0.0,None,['U'],['Basic'],['Land'],['Island'],Common,AKH,None,None,None,({T}: Add {U}.)
Swamp,0.0,None,['B'],['Basic'],['Land'],['Swamp'],Common,AKH,None,None,None,({T}: Add {B}.)
Forsaken Sanctuary,0.0,None,"['B', 'W']",None,['Land'],None,Common,AKH,None,None,None,Forsaken Sanctuary enters the battlefield tapped.\n{T}: Add {W} or {B}.
Plains,0.0,None,['W'],['Basic'],['Land'],['Plains'],Common,AKH,None,None,None,({T}: Add {W}.)
Cinder Barrens,0.0,None,"['B', 'R']",None,['Land'],None,Common,AKH,None,None,None,Cinder Barrens enters the battlefield tapped.\n{T}: Add {B} or {R}.
Sunscorched Desert,0.0,None,None,None,['Land'],['Desert'],Common,AKH,None,None,None,"When Sunscorched Desert enters the battlefield, it deals 1 damage to target player or planeswalker.\n{T}: Add {C}."
Foul Orchard,0.0,None,"['B', 'G']",None,['Land'],None,Common,AKH,None,None,None,Foul Orchard enters the battlefield tapped.\n{T}: Add {B} or {G}.
Sheltered Thicket,0.0,None,"['G', 'R']",None,['Land'],"['Mountain', 'Forest']",Rare,AKH,None,None,None,"({T}: Add {R} or {G}.)\nSheltered Thicket enters the battlefield tapped.\nCycling {2} ({2}, Discard this card: Draw a card.)"
Mountain,0.0,None,['R'],['Basic'],['Land'],['Mountain'],Common,AKH,None,None,None,({T}: Add {R}.)
Kefnet's Monument,3.0,None,None,['Legendary'],['Artifact'],None,Uncommon,AKH,None,None,None,"Blue creature spells you cast cost {1} less to cast.\nWhenever you cast a creature spell, target creature an opponent controls doesn't untap during its controller's next untap step."
Island,0.0,None,['U'],['Basic'],['Land'],['Island'],Common,AKH,None,None,None,({T}: Add {U}.)
Tattered Mummy,2.0,['Black'],['B'],None,['Creature'],"['Zombie', 'Jackal']",Common,AKH,1,2,None,"When Tattered Mummy dies, each opponent loses 2 life."
Scattered Groves,0.0,None,"['G', 'W']",None,['Land'],"['Forest', 'Plains']",Rare,AKH,None,None,None,"({T}: Add {G} or {W}.)\nScattered Groves enters the battlefield tapped.\nCycling {2} ({2}, Discard this card: Draw a card.)"
Painted Bluffs,0.0,None,None,None,['Land'],['Desert'],Common,AKH,None,None,None,"{T}: Add {C}.\n{1}, {T}: Add one mana of any color."
Irrigated Farmland,0.0,None,"['U', 'W']",None,['Land'],"['Plains', 'Island']",Rare,AKH,None,None,None,"({T}: Add {W} or {U}.)\nIrrigated Farmland enters the battlefield tapped.\nCycling {2} ({2}, Discard this card: Draw a card.)"
Bitterblade Warrior,2.0,['Green'],['G'],None,['Creature'],"['Jackal', 'Warrior']",Common,AKH,2,2,None,"You may exert Bitterblade Warrior as it attacks. When you do, it gets +1/+0 and gains deathtouch until end of turn. (An exerted creature won't untap during your next untap step.)"
Channeler Initiate,2.0,['Green'],['G'],None,['Creature'],"['Human', 'Druid']",Rare,AKH,3,4,None,"When Channeler Initiate enters the battlefield, put three -1/-1 counters on target creature you control.\n{T}, Remove a -1/-1 counter from Channeler Initiate: Add one mana of any color."
Desiccated Naga,3.0,['Black'],['B'],None,['Creature'],"['Zombie', 'Naga']",Uncommon,AKH,3,2,None,{3}{B}: Target opponent loses 2 life and you gain 2 life. Activate only if you control a Liliana planeswalker.
Mountain,0.0,None,['R'],['Basic'],['Land'],['Mountain'],Common,AKH,None,None,None,({T}: Add {R}.)
Fetid Pools,0.0,None,"['B', 'U']",None,['Land'],"['Island', 'Swamp']",Rare,AKH,None,None,None,"({T}: Add {U} or {B}.)\nFetid Pools enters the battlefield tapped.\nCycling {2} ({2}, Discard this card: Draw a card.)"
Honed Khopesh,1.0,None,None,None,['Artifact'],['Equipment'],Common,AKH,None,None,None,Equipped creature gets +1/+1.\nEquip {1} ({1}: Attach to target creature you control. Equip only as a sorcery.)
Plains,0.0,None,['W'],['Basic'],['Land'],['Plains'],Common,AKH,None,None,None,({T}: Add {W}.)
"Liliana, Death Wielder",7.0,['Black'],['B'],['Legendary'],['Planeswalker'],['Liliana'],Mythic,AKH,None,None,5,[+2]: Put a -1/-1 counter on up to one target creature.\n[−3]: Destroy target creature with a -1/-1 counter on it.\n[−10]: Return all creature cards from your graveyard to the battlefield.
Evolving Wilds,0.0,None,None,None,['Land'],None,Common,AKH,None,None,None,"{T}, Sacrifice Evolving Wilds: Search your library for a basic land card, put it onto the battlefield tapped, then shuffle."
Swamp,0.0,None,['B'],['Basic'],['Land'],['Swamp'],Common,AKH,None,None,None,({T}: Add {B}.)
Stone Quarry,0.0,None,"['R', 'W']",None,['Land'],None,Common,AKH,None,None,None,Stone Quarry enters the battlefield tapped.\n{T}: Add {R} or {W}.
Cradle of the Accursed,0.0,None,None,None,['Land'],['Desert'],Common,AKH,None,None,None,"{T}: Add {C}.\n{3}, {T}, Sacrifice Cradle of the Accursed: Create a 2/2 black Zombie creature token. Activate only as a sorcery."
Graceful Cat,3.0,['White'],['W'],None,['Creature'],['Cat'],Common,AKH,2,2,None,"Whenever Graceful Cat attacks, it gets +1/+1 until end of turn."
Cascading Cataracts,0.0,None,None,None,['Land'],None,Rare,AKH,None,None,None,"Indestructible\n{T}: Add {C}.\n{5}, {T}: Add five mana in any combination of colors."
Woodland Stream,0.0,None,"['G', 'U']",None,['Land'],None,Common,AKH,None,None,None,Woodland Stream enters the battlefield tapped.\n{T}: Add {G} or {U}.
Canyon Slough,0.0,None,"['B', 'R']",None,['Land'],"['Swamp', 'Mountain']",Rare,AKH,None,None,None,"({T}: Add {B} or {R}.)\nCanyon Slough enters the battlefield tapped.\nCycling {2} ({2}, Discard this card: Draw a card.)"
Timber Gorge,0.0,None,"['G', 'R']",None,['Land'],None,Common,AKH,None,None,None,Timber Gorge enters the battlefield tapped.\n{T}: Add {R} or {G}.
Oketra's Monument,3.0,None,None,['Legendary'],['Artifact'],None,Uncommon,AKH,None,None,None,"White creature spells you cast cost {1} less to cast.\nWhenever you cast a creature spell, create a 1/1 white Warrior creature token with vigilance."
Swamp,0.0,None,['B'],['Basic'],['Land'],['Swamp'],Common,AKH,None,None,None,({T}: Add {B}.)
Watchers of the Dead,2.0,None,None,None,"['Artifact', 'Creature']",['Cat'],Uncommon,AKH,2,2,None,Exile Watchers of the Dead: Each opponent chooses two cards in their graveyard and exiles the rest.
Gideon's Resolve,5.0,['White'],['W'],None,['Enchantment'],None,Rare,AKH,None,None,None,"When Gideon's Resolve enters the battlefield, you may search your library and/or graveyard for a card named Gideon, Martial Paragon, reveal it, and put it into your hand. If you search your library this way, shuffle.\nCreatures you control get +1/+1."
Island,0.0,None,['U'],['Basic'],['Land'],['Island'],Common,AKH,None,None,None,({T}: Add {U}.)
Submerged Boneyard,0.0,None,"['B', 'U']",None,['Land'],None,Common,AKH,None,None,None,Submerged Boneyard enters the battlefield tapped.\n{T}: Add {U} or {B}.
Hazoret's Monument,3.0,None,None,['Legendary'],['Artifact'],None,Uncommon,AKH,None,None,None,"Red creature spells you cast cost {1} less to cast.\nWhenever you cast a creature spell, you may discard a card. If you do, draw a card."
Companion of the Trials,3.0,['White'],['W'],None,['Creature'],"['Bird', 'Soldier']",Uncommon,AKH,2,2,None,Flying\n{1}{W}: Untap target creature. Activate only if you control a Gideon planeswalker.
Throne of the God-Pharaoh,2.0,None,None,['Legendary'],['Artifact'],None,Rare,AKH,None,None,None,"At the beginning of your end step, each opponent loses life equal to the number of tapped creatures you control."
Tranquil Expanse,0.0,None,"['G', 'W']",None,['Land'],None,Common,AKH,None,None,None,Tranquil Expanse enters the battlefield tapped.\n{T}: Add {G} or {W}.
Rhonas's Monument,3.0,None,None,['Legendary'],['Artifact'],None,Uncommon,AKH,None,None,None,"Green creature spells you cast cost {1} less to cast.\nWhenever you cast a creature spell, target creature you control gets +2/+2 and gains trample until end of turn."
Forest,0.0,None,['G'],['Basic'],['Land'],['Forest'],Common,AKH,None,None,None,({T}: Add {G}.)
Pyramid of the Pantheon,1.0,None,None,None,['Artifact'],None,Rare,AKH,None,None,None,"{2}, {T}: Add one mana of any color. Put a brick counter on Pyramid of the Pantheon.\n{T}: Add three mana of any one color. Activate only if there are three or more brick counters on Pyramid of the Pantheon."
Vizier of Tumbling Sands,3.0,['Blue'],['U'],None,['Creature'],"['Human', 'Cleric']",Uncommon,AKH,1,3,None,"{T}: Untap another target permanent.\nCycling {1}{U} ({1}{U}, Discard this card: Draw a card.)\nWhen you cycle Vizier of Tumbling Sands, untap target permanent."
Trial of Zeal,3.0,['Red'],['R'],None,['Enchantment'],None,Uncommon,AKH,None,None,None,"When Trial of Zeal enters the battlefield, it deals 3 damage to any target.\nWhen a Cartouche enters the battlefield under your control, return Trial of Zeal to its owner's hand."
Start // Finish,6.0,['White'],"['B', 'W']",None,['Instant'],None,Uncommon,AKH,None,None,None,Create two 1/1 white Warrior creature tokens with vigilance.
Vizier of Many Faces,4.0,['Blue'],['U'],None,['Creature'],"['Shapeshifter', 'Cleric']",Rare,AKH,0,0,None,"You may have Vizier of Many Faces enter the battlefield as a copy of any creature on the battlefield, except if Vizier of Many Faces was embalmed, the token has no mana cost, it's white, and it's a Zombie in addition to its other types.\nEmbalm {3}{U}{U}"
Tormenting Voice,2.0,['Red'],['R'],None,['Sorcery'],None,Common,AKH,None,None,None,"As an additional cost to cast this spell, discard a card.\nDraw two cards."
Highland Lake,0.0,None,"['R', 'U']",None,['Land'],None,Common,AKH,None,None,None,Highland Lake enters the battlefield tapped.\n{T}: Add {U} or {R}.
Trial of Knowledge,4.0,['Blue'],['U'],None,['Enchantment'],None,Uncommon,AKH,None,None,None,"When Trial of Knowledge enters the battlefield, draw three cards, then discard a card.\nWhen a Cartouche enters the battlefield under your control, return Trial of Knowledge to its owner's hand."
Thresher Lizard,3.0,['Red'],['R'],None,['Creature'],['Lizard'],Common,AKH,3,2,None,Thresher Lizard gets +1/+2 as long as you have one or fewer cards in hand.
Mouth // Feed,7.0,['Green'],['G'],None,['Sorcery'],None,Rare,AKH,None,None,None,Create a 3/3 green Hippo creature token.
Tah-Crop Skirmisher,2.0,['Blue'],['U'],None,['Creature'],"['Naga', 'Warrior']",Common,AKH,2,1,None,"Embalm {3}{U} ({3}{U}, Exile this card from your graveyard: Create a token that's a copy of it, except it's a white Zombie Naga Warrior with no mana cost. Embalm only as a sorcery.)"
Sweltering Suns,3.0,['Red'],['R'],None,['Sorcery'],None,Rare,AKH,None,None,None,"Sweltering Suns deals 3 damage to each creature.\nCycling {3} ({3}, Discard this card: Draw a card.)"
Oracle's Vault,4.0,None,None,None,['Artifact'],None,Rare,AKH,None,None,None,"{2}, {T}: Exile the top card of your library. Until end of turn, you may play that card. Put a brick counter on Oracle's Vault.\n{T}: Exile the top card of your library. Until end of turn, you may play that card without paying its mana cost. Activate only if there are three or more brick counters on Oracle's Vault."
Slither Blade,1.0,['Blue'],['U'],None,['Creature'],"['Naga', 'Rogue']",Common,AKH,1,2,None,Slither Blade can't be blocked.
Soul-Scar Mage,1.0,['Red'],['R'],None,['Creature'],"['Human', 'Wizard']",Rare,AKH,1,2,None,"Prowess\nIf a source you control would deal noncombat damage to a creature an opponent controls, put that many -1/-1 counters on that creature instead."
Merciless Javelineer,4.0,"['Black', 'Red']","['B', 'R']",None,['Creature'],"['Minotaur', 'Warrior']",Uncommon,AKH,4,2,None,"{2}, Discard a card: Put a -1/-1 counter on target creature. That creature can't block this turn."
Shimmerscale Drake,5.0,['Blue'],['U'],None,['Creature'],['Drake'],Common,AKH,3,4,None,"Flying\nCycling {2} ({2}, Discard this card: Draw a card.)"
Pursue Glory,4.0,['Red'],['R'],None,['Instant'],None,Common,AKH,None,None,None,"Attacking creatures get +2/+0 until end of turn.\nCycling {2} ({2}, Discard this card: Draw a card.)"
Forest,0.0,None,['G'],['Basic'],['Land'],['Forest'],Common,AKH,None,None,None,({T}: Add {G}.)
Seeker of Insight,2.0,['Blue'],['U'],None,['Creature'],"['Human', 'Wizard']",Common,AKH,1,3,None,"{T}: Draw a card, then discard a card. Activate only if you've cast a noncreature spell this turn."
Pathmaker Initiate,2.0,['Red'],['R'],None,['Creature'],"['Human', 'Wizard']",Common,AKH,2,1,None,{T}: Target creature with power 2 or less can't be blocked this turn.
Liliana's Influence,6.0,['Black'],['B'],None,['Sorcery'],None,Rare,AKH,None,None,None,"Put a -1/-1 counter on each creature you don't control. You may search your library and/or graveyard for a card named Liliana, Death Wielder, reveal it, and put it into your hand. If you search your library this way, shuffle."
Scribe of the Mindful,3.0,['Blue'],['U'],None,['Creature'],"['Human', 'Cleric']",Common,AKH,2,2,None,"{1}, {T}, Sacrifice Scribe of the Mindful: Return target instant or sorcery card from your graveyard to your hand."
Nimble-Blade Khenra,2.0,['Red'],['R'],None,['Creature'],"['Jackal', 'Warrior']",Common,AKH,1,3,None,"Prowess (Whenever you cast a noncreature spell, this creature gets +1/+1 until end of turn.)"
Insult // Injury,6.0,['Red'],['R'],None,['Sorcery'],None,Rare,AKH,None,None,None,"Damage can't be prevented this turn. If a source you control would deal damage this turn, it deals double that damage instead."
Sacred Excavation,4.0,['Blue'],['U'],None,['Sorcery'],None,Uncommon,AKH,None,None,None,Return up to two target cards with cycling from your graveyard to your hand.
Nef-Crop Entangler,2.0,['Red'],['R'],None,['Creature'],"['Human', 'Warrior']",Common,AKH,2,1,None,"Trample\nYou may exert Nef-Crop Entangler as it attacks. When you do, it gets +1/+2 until end of turn. (An exerted creature won't untap during your next untap step.)"
Never // Return,7.0,['Black'],['B'],None,['Sorcery'],None,Rare,AKH,None,None,None,Destroy target creature or planeswalker.
River Serpent,6.0,['Blue'],['U'],None,['Creature'],['Serpent'],Common,AKH,5,5,None,"River Serpent can't attack unless there are five or more cards in your graveyard.\nCycling {U} ({U}, Discard this card: Draw a card.)"
Minotaur Sureshot,3.0,['Red'],['R'],None,['Creature'],"['Minotaur', 'Archer']",Common,AKH,2,3,None,Reach (This creature can block creatures with flying.)\n{1}{R}: Minotaur Sureshot gets +1/+0 until end of turn.
Commit // Memory,10.0,['Blue'],['U'],None,['Instant'],None,Rare,AKH,None,None,None,Put target spell or nonland permanent into its owner's library second from the top.
Pull from Tomorrow,2.0,['Blue'],['U'],None,['Instant'],None,Rare,AKH,None,None,None,"Draw X cards, then discard a card."
Manticore of the Gauntlet,5.0,['Red'],['R'],None,['Creature'],['Manticore'],Common,AKH,5,4,None,"When Manticore of the Gauntlet enters the battlefield, put a -1/-1 counter on target creature you control. Manticore of the Gauntlet deals 3 damage to target opponent or planeswalker."
Gate to the Afterlife,3.0,None,None,None,['Artifact'],None,Uncommon,AKH,None,None,None,"Whenever a nontoken creature you control dies, you gain 1 life. Then you may draw a card. If you do, discard a card.\n{2}, {T}, Sacrifice Gate to the Afterlife: Search your graveyard, hand, and/or library for a card named God-Pharaoh's Gift and put it onto the battlefield. If you search your library this way, shuffle. Activate only if there are six or more creature cards in your graveyard."
Open into Wonder,2.0,['Blue'],['U'],None,['Sorcery'],None,Uncommon,AKH,None,None,None,"X target creatures can't be blocked this turn. Until end of turn, those creatures gain ""Whenever this creature deals combat damage to a player, draw a card."""
Magma Spray,1.0,['Red'],['R'],None,['Instant'],None,Common,AKH,None,None,None,"Magma Spray deals 2 damage to target creature. If that creature would die this turn, exile it instead."
Dusk // Dawn,9.0,['White'],['W'],None,['Sorcery'],None,Rare,AKH,None,None,None,Destroy all creatures with power 3 or greater.
New Perspectives,6.0,['Blue'],['U'],None,['Enchantment'],None,Rare,AKH,None,None,None,"When New Perspectives enters the battlefield, draw three cards.\nAs long as you have seven or more cards in hand, you may pay {0} rather than pay cycling costs."
Limits of Solidarity,4.0,['Red'],['R'],None,['Sorcery'],None,Uncommon,AKH,None,None,None,"Gain control of target creature until end of turn. Untap that creature. It gains haste until end of turn.\nCycling {2} ({2}, Discard this card: Draw a card.)"
"Temmet, Vizier of Naktamun",2.0,"['Blue', 'White']","['U', 'W']",['Legendary'],['Creature'],"['Human', 'Cleric']",Rare,AKH,2,2,None,"At the beginning of combat on your turn, target creature token you control gets +1/+1 until end of turn and can't be blocked this turn.\nEmbalm {3}{W}{U} ({3}{W}{U}, Exile this card from your graveyard: Create a token that's a copy of it, except it's a white Zombie Human Cleric with no mana cost. Embalm only as a sorcery.)"
Naga Oracle,4.0,['Blue'],['U'],None,['Creature'],"['Naga', 'Cleric']",Common,AKH,2,4,None,"When Naga Oracle enters the battlefield, look at the top three cards of your library. Put any number of them into your graveyard and the rest back on top of your library in any order."
Hyena Pack,4.0,['Red'],['R'],None,['Creature'],['Hyena'],Common,AKH,3,4,None,None
Weaver of Currents,3.0,"['Green', 'Blue']","['G', 'U']",None,['Creature'],"['Naga', 'Druid']",Uncommon,AKH,2,2,None,{T}: Add {C}{C}.
Lay Claim,7.0,['Blue'],['U'],None,['Enchantment'],['Aura'],Uncommon,AKH,None,None,None,"Enchant permanent\nYou control enchanted permanent.\nCycling {2} ({2}, Discard this card: Draw a card.)"
Heart-Piercer Manticore,4.0,['Red'],['R'],None,['Creature'],['Manticore'],Rare,AKH,4,3,None,"When Heart-Piercer Manticore enters the battlefield, you may sacrifice another creature. When you do, Heart-Piercer Manticore deals damage equal to that creature's power to any target.\nEmbalm {5}{R} ({5}{R}, Exile this card from your graveyard: Create a token that's a copy of it, except it's a white Zombie Manticore with no mana cost. Embalm only as a sorcery.)"
Wayward Servant,2.0,"['Black', 'White']","['B', 'W']",None,['Creature'],['Zombie'],Uncommon,AKH,2,2,None,"Whenever another Zombie enters the battlefield under your control, each opponent loses 1 life and you gain 1 life."
Labyrinth Guardian,2.0,['Blue'],['U'],None,['Creature'],"['Illusion', 'Warrior']",Uncommon,AKH,2,3,None,"When Labyrinth Guardian becomes the target of a spell, sacrifice it.\nEmbalm {3}{U} ({3}{U}, Exile this card from your graveyard: Create a token that's a copy of it, except it's a white Zombie Illusion Warrior with no mana cost. Embalm only as a sorcery.)"
Hazoret's Favor,3.0,['Red'],['R'],None,['Enchantment'],None,Rare,AKH,None,None,None,"At the beginning of combat on your turn, you may have target creature you control get +2/+0 and gain haste until end of turn. If you do, sacrifice it at the beginning of the next end step."
"Neheb, the Worthy",3.0,"['Black', 'Red']","['B', 'R']",['Legendary'],['Creature'],"['Minotaur', 'Warrior']",Rare,AKH,2,2,None,"First strike\nOther Minotaurs you control have first strike.\nAs long as you have one or fewer cards in hand, Minotaurs you control get +2/+0.\nWhenever Neheb, the Worthy deals combat damage to a player, each player discards a card."
Hazoret the Fervent,4.0,['Red'],['R'],['Legendary'],['Creature'],['God'],Mythic,AKH,5,4,None,"Indestructible, haste\nHazoret the Fervent can't attack or block unless you have one or fewer cards in hand.\n{2}{R}, Discard a card: Hazoret deals 2 damage to each opponent."
Khenra Charioteer,3.0,"['Green', 'Red']","['G', 'R']",None,['Creature'],"['Jackal', 'Warrior']",Uncommon,AKH,3,3,None,Trample\nOther creatures you control have trample.
"Gideon, Martial Paragon",5.0,['White'],['W'],['Legendary'],['Planeswalker'],['Gideon'],Mythic,AKH,None,None,5,"[+2]: Untap all creatures you control. Those creatures get +1/+1 until end of turn.\n[0]: Until end of turn, Gideon, Martial Paragon becomes a 5/5 Human Soldier creature with indestructible that's still a planeswalker. Prevent all damage that would be dealt to him this turn.\n[−10]: Creatures you control get +2/+2 until end of turn. Tap all creatures your opponents control."
Kefnet the Mindful,3.0,['Blue'],['U'],['Legendary'],['Creature'],['God'],Mythic,AKH,5,5,None,"Flying, indestructible\nKefnet the Mindful can't attack or block unless you have seven or more cards in hand.\n{3}{U}: Draw a card, then you may return a land you control to its owner's hand."
Harsh Mentor,2.0,['Red'],['R'],None,['Creature'],"['Human', 'Cleric']",Rare,AKH,2,2,None,"Whenever an opponent activates an ability of an artifact, creature, or land on the battlefield, if it isn't a mana ability, Harsh Mentor deals 2 damage to that player."
Shadowstorm Vizier,2.0,"['Black', 'Blue']","['B', 'U']",None,['Creature'],"['Human', 'Cleric']",Uncommon,AKH,1,3,None,"Flying\nWhenever you cycle or discard a card, Shadowstorm Vizier gets +1/+1 until end of turn."
Illusory Wrappings,3.0,['Blue'],['U'],None,['Enchantment'],['Aura'],Common,AKH,None,None,None,Enchant creature\nEnchanted creature has base power and toughness 0/2.
Glorybringer,5.0,['Red'],['R'],None,['Creature'],['Dragon'],Rare,AKH,4,4,None,"Flying, haste\nYou may exert Glorybringer as it attacks. When you do, it deals 4 damage to target non-Dragon creature an opponent controls. (An exerted creature won't untap during your next untap step.)"
"Samut, Voice of Dissent",5.0,"['Green', 'Red']","['G', 'R', 'W']",['Legendary'],['Creature'],"['Human', 'Warrior']",Mythic,AKH,3,4,None,"Flash\nDouble strike, vigilance, haste\nOther creatures you control have haste.\n{W}, {T}: Untap another target creature."
Hieroglyphic Illumination,4.0,['Blue'],['U'],None,['Instant'],None,Common,AKH,None,None,None,"Draw two cards.\nCycling {U} ({U}, Discard this card: Draw a card.)"
Glorious End,3.0,['Red'],['R'],None,['Instant'],None,Mythic,AKH,None,None,None,"End the turn. (Exile all spells and abilities from the stack, including this card. The player whose turn it is discards down to their maximum hand size. Damage wears off, and ""this turn"" and ""until end of turn"" effects end.)\nAt the beginning of your next end step, you lose the game."
"Nissa, Steward of Elements",2.0,"['Green', 'Blue']","['G', 'U']",['Legendary'],['Planeswalker'],['Nissa'],Mythic,AKH,None,None,X,"[+2]: Scry 2.\n[0]: Look at the top card of your library. If it's a land card or a creature card with mana value less than or equal to the number of loyalty counters on Nissa, Steward of Elements, you may put that card onto the battlefield.\n[−6]: Untap up to two target lands you control. They become 5/5 Elemental creatures with flying and haste until end of turn. They're still lands."
Hekma Sentinels,3.0,['Blue'],['U'],None,['Creature'],"['Human', 'Cleric']",Common,AKH,2,3,None,"Whenever you cycle or discard a card, Hekma Sentinels gets +1/+1 until end of turn."
Fling,2.0,['Red'],['R'],None,['Instant'],None,Common,AKH,None,None,None,"As an additional cost to cast this spell, sacrifice a creature.\nFling deals damage equal to the sacrificed creature's power to any target."
Honored Crop-Captain,2.0,"['Red', 'White']","['R', 'W']",None,['Creature'],"['Human', 'Warrior']",Uncommon,AKH,3,2,None,"Whenever Honored Crop-Captain attacks, other attacking creatures get +1/+0 until end of turn."
Glyph Keeper,5.0,['Blue'],['U'],None,['Creature'],['Sphinx'],Rare,AKH,5,3,None,"Flying\nWhenever Glyph Keeper becomes the target of a spell or ability for the first time each turn, counter that spell or ability.\nEmbalm {5}{U}{U} ({5}{U}{U}, Exile this card from your graveyard: Create a token that's a copy of it, except it's a white Zombie Sphinx with no mana cost. Embalm only as a sorcery.)"
Flameblade Adept,1.0,['Red'],['R'],None,['Creature'],"['Jackal', 'Warrior']",Uncommon,AKH,1,2,None,"Menace\nWhenever you cycle or discard a card, Flameblade Adept gets +1/+0 until end of turn."
"Hapatra, Vizier of Poisons",2.0,"['Black', 'Green']","['B', 'G']",['Legendary'],['Creature'],"['Human', 'Cleric']",Rare,AKH,2,2,None,"Whenever Hapatra, Vizier of Poisons deals combat damage to a player, you may put a -1/-1 counter on target creature.\nWhenever you put one or more -1/-1 counters on a creature, create a 1/1 green Snake creature token with deathtouch."
Galestrike,3.0,['Blue'],['U'],None,['Instant'],None,Uncommon,AKH,None,None,None,Return target tapped creature to its owner's hand.\nDraw a card.
Emberhorn Minotaur,4.0,['Red'],['R'],None,['Creature'],"['Minotaur', 'Warrior']",Common,AKH,4,3,None,"You may exert Emberhorn Minotaur as it attacks. When you do, it gets +1/+1 and gains menace until end of turn. (An exerted creature won't untap during your next untap step.)"
Enigma Drake,3.0,"['Red', 'Blue']","['R', 'U']",None,['Creature'],['Drake'],Uncommon,AKH,*,4,None,Flying\nEnigma Drake's power is equal to the number of instant and sorcery cards in your graveyard.
Floodwaters,6.0,['Blue'],['U'],None,['Sorcery'],None,Common,AKH,None,None,None,"Return up to two target creatures to their owners' hands.\nCycling {2} ({2}, Discard this card: Draw a card.)"
Electrify,4.0,['Red'],['R'],None,['Instant'],None,Common,AKH,None,None,None,Electrify deals 4 damage to target creature.
Decimator Beetle,5.0,"['Black', 'Green']","['B', 'G']",None,['Creature'],['Insect'],Uncommon,AKH,4,5,None,"When Decimator Beetle enters the battlefield, put a -1/-1 counter on target creature you control.\nWhenever Decimator Beetle attacks, remove a -1/-1 counter from target creature you control and put a -1/-1 counter on up to one target creature defending player controls."
Essence Scatter,2.0,['Blue'],['U'],None,['Instant'],None,Common,AKH,None,None,None,Counter target creature spell.
Desert Cerodon,6.0,['Red'],['R'],None,['Creature'],['Beast'],Common,AKH,6,4,None,"Cycling {R} ({R}, Discard this card: Draw a card.)"
