Name,CMC,Colors,Color identity,Supertypes,Types,Subtypes,Rarity,Set,Power,Toughness,Loyalty,Text
Bounty of the Luxa,4.0,"['Green', 'Blue']","['G', 'U']",None,['Enchantment'],None,Rare,AKH,None,None,None,"At the beginning of your precombat main phase, remove all flood counters from Bounty of the Luxa. If no counters were removed this way, put a flood counter on Bounty of the Luxa and draw a card. Otherwise, add {C}{G}{U}."
Drake Haven,3.0,['Blue'],['U'],None,['Enchantment'],None,Rare,AKH,None,None,None,"Whenever you cycle or discard a card, you may pay {1}. If you do, create a 2/2 blue Drake creature token with flying."
Deem Worthy,5.0,['Red'],['R'],None,['Instant'],None,Uncommon,AKH,None,None,None,"Deem Worthy deals 7 damage to target creature.\nCycling {3}{R} ({3}{R}, Discard this card: Draw a card.)\nWhen you cycle Deem Worthy, you may have it deal 2 damage to target creature."
Aven Wind Guide,4.0,"['Blue', 'White']","['U', 'W']",None,['Creature'],"['Bird', 'Warrior']",Uncommon,AKH,2,3,None,"Flying, vigilance\nCreature tokens you control have flying and vigilance.\nEmbalm {4}{W}{U} ({4}{W}{U}, Exile this card from your graveyard: Create a token that's a copy of it, except it's a white Zombie Bird Warrior with no mana cost. Embalm only as a sorcery.)"
Decision Paralysis,4.0,['Blue'],['U'],None,['Instant'],None,Common,AKH,None,None,None,Tap up to two target creatures. Those creatures don't untap during their controller's next untap step.
Consuming Fervor,1.0,['Red'],['R'],None,['Enchantment'],['Aura'],Uncommon,AKH,None,None,None,"Enchant creature\nEnchanted creature gets +3/+3 and has ""At the beginning of your upkeep, put a -1/-1 counter on this creature."""
Ahn-Crop Champion,4.0,"['Green', 'White']","['G', 'W']",None,['Creature'],"['Human', 'Warrior']",Uncommon,AKH,4,4,None,"You may exert Ahn-Crop Champion as it attacks. When you do, untap all other creatures you control. (An exerted creature won't untap during your next untap step.)"
Curator of Mysteries,4.0,['Blue'],['U'],None,['Creature'],['Sphinx'],Rare,AKH,4,4,None,"Flying\nWhenever you cycle or discard another card, scry 1.\nCycling {U} ({U}, Discard this card: Draw a card.)"
Combat Celebrant,3.0,['Red'],['R'],None,['Creature'],"['Human', 'Warrior']",Mythic,AKH,4,1,None,"If Combat Celebrant hasn't been exerted this turn, you may exert it as it attacks. When you do, untap all other creatures you control and after this phase, there is an additional combat phase. (An exerted creature won't untap during your next untap step.)"
Watchful Naga,3.0,['Green'],['G'],None,['Creature'],"['Naga', 'Wizard']",Uncommon,AKH,2,2,None,"You may exert Watchful Naga as it attacks. When you do, draw a card. (An exerted creature won't untap during your next untap step.)"
Cryptic Serpent,7.0,['Blue'],['U'],None,['Creature'],['Serpent'],Uncommon,AKH,6,5,None,This spell costs {1} less to cast for each instant and sorcery card in your graveyard.
Cartouche of Zeal,1.0,['Red'],['R'],None,['Enchantment'],"['Aura', 'Cartouche']",Common,AKH,None,None,None,"Enchant creature you control\nWhen Cartouche of Zeal enters the battlefield, target creature can't block this turn.\nEnchanted creature gets +1/+1 and has haste."
Vizier of the Menagerie,4.0,['Green'],['G'],None,['Creature'],"['Naga', 'Cleric']",Mythic,AKH,3,4,None,You may look at the top card of your library any time.\nYou may cast creature spells from the top of your library.\nYou may spend mana as though it were mana of any type to cast creature spells.
Compelling Argument,2.0,['Blue'],['U'],None,['Sorcery'],None,Common,AKH,None,None,None,"Target player mills five cards.\nCycling {U} ({U}, Discard this card: Draw a card.)"
By Force,1.0,['Red'],['R'],None,['Sorcery'],None,Uncommon,AKH,None,None,None,Destroy X target artifacts.
Trial of Strength,3.0,['Green'],['G'],None,['Enchantment'],None,Uncommon,AKH,None,None,None,"When Trial of Strength enters the battlefield, create a 4/2 green Beast creature token.\nWhen a Cartouche enters the battlefield under your control, return Trial of Strength to its owner's hand."
Censor,2.0,['Blue'],['U'],None,['Instant'],None,Uncommon,AKH,None,None,None,"Counter target spell unless its controller pays {1}.\nCycling {U} ({U}, Discard this card: Draw a card.)"
Brute Strength,2.0,['Red'],['R'],None,['Instant'],None,Common,AKH,None,None,None,Target creature gets +3/+1 and gains trample until end of turn.
Synchronized Strike,3.0,['Green'],['G'],None,['Instant'],None,Uncommon,AKH,None,None,None,Untap up to two target creatures. They each get +2/+2 until end of turn.
Cartouche of Knowledge,2.0,['Blue'],['U'],None,['Enchantment'],"['Aura', 'Cartouche']",Common,AKH,None,None,None,"Enchant creature you control\nWhen Cartouche of Knowledge enters the battlefield, draw a card.\nEnchanted creature gets +1/+1 and has flying."
Bloodrage Brawler,2.0,['Red'],['R'],None,['Creature'],"['Minotaur', 'Warrior']",Uncommon,AKH,4,3,None,"When Bloodrage Brawler enters the battlefield, discard a card."
Stinging Shot,1.0,['Green'],['G'],None,['Instant'],None,Common,AKH,None,None,None,"Put three -1/-1 counters on target creature with flying.\nCycling {2} ({2}, Discard this card: Draw a card.)"
Cancel,3.0,['Blue'],['U'],None,['Instant'],None,Common,AKH,None,None,None,Counter target spell.
Bloodlust Inciter,1.0,['Red'],['R'],None,['Creature'],"['Human', 'Warrior']",Common,AKH,1,1,None,{T}: Target creature gains haste until end of turn.
Spidery Grasp,3.0,['Green'],['G'],None,['Instant'],None,Common,AKH,None,None,None,Untap target creature. It gets +2/+4 and gains reach until end of turn. (It can block creatures with flying.)
Aven Initiate,4.0,['Blue'],['U'],None,['Creature'],"['Bird', 'Warrior']",Common,AKH,3,2,None,"Flying\nEmbalm {6}{U} ({6}{U}, Exile this card from your graveyard: Create a token that's a copy of it, except it's a white Zombie Bird Warrior with no mana cost. Embalm only as a sorcery.)"
Blazing Volley,1.0,['Red'],['R'],None,['Sorcery'],None,Common,AKH,None,None,None,Blazing Volley deals 1 damage to each creature your opponents control.
Sixth Sense,1.0,['Green'],['G'],None,['Enchantment'],['Aura'],Uncommon,AKH,None,None,None,"Enchant creature\nEnchanted creature has ""Whenever this creature deals combat damage to a player, you may draw a card."""
As Foretold,3.0,['Blue'],['U'],None,['Enchantment'],None,Mythic,AKH,None,None,None,"At the beginning of your upkeep, put a time counter on As Foretold.\nOnce each turn, you may pay {0} rather than pay the mana cost for a spell you cast with mana value X or less, where X is the number of time counters on As Foretold."
Battlefield Scavenger,2.0,['Red'],['R'],None,['Creature'],"['Jackal', 'Rogue']",Uncommon,AKH,2,2,None,"You may exert Battlefield Scavenger as it attacks. (It won't untap during your next untap step.)\nWhenever you exert a creature, you may discard a card. If you do, draw a card."
Shefet Monitor,6.0,['Green'],['G'],None,['Creature'],['Lizard'],Uncommon,AKH,6,5,None,"Cycling {3}{G} ({3}{G}, Discard this card: Draw a card.)\nWhen you cycle Shefet Monitor, you may search your library for a basic land card or a Desert card, put it onto the battlefield, then shuffle. (Do this before you draw.)"
Angler Drake,6.0,['Blue'],['U'],None,['Creature'],['Drake'],Uncommon,AKH,4,4,None,"Flying\nWhen Angler Drake enters the battlefield, you may return target creature to its owner's hand."
Ahn-Crop Crasher,3.0,['Red'],['R'],None,['Creature'],"['Minotaur', 'Warrior']",Uncommon,AKH,3,2,None,"Haste\nYou may exert Ahn-Crop Crasher as it attacks. When you do, target creature can't block this turn. (An exerted creature won't untap during your next untap step.)"
Shed Weakness,1.0,['Green'],['G'],None,['Instant'],None,Common,AKH,None,None,None,Target creature gets +2/+2 until end of turn. You may remove a -1/-1 counter from it.
Ancient Crab,3.0,['Blue'],['U'],None,['Creature'],['Crab'],Common,AKH,1,5,None,None
Painful Lesson,3.0,['Black'],['B'],None,['Sorcery'],None,Common,AKH,None,None,None,Target player draws two cards and loses 2 life.
Scaled Behemoth,6.0,['Green'],['G'],None,['Creature'],['Crocodile'],Uncommon,AKH,6,7,None,Hexproof (This creature can't be the target of spells or abilities your opponents control.)
Winged Shepherd,6.0,['White'],['W'],None,['Creature'],['Angel'],Common,AKH,3,3,None,"Flying, vigilance\nCycling {W} ({W}, Discard this card: Draw a card.)"
Trial of Ambition,2.0,['Black'],['B'],None,['Enchantment'],None,Uncommon,AKH,None,None,None,"When Trial of Ambition enters the battlefield, target opponent sacrifices a creature.\nWhen a Cartouche enters the battlefield under your control, return Trial of Ambition to its owner's hand."
Sandwurm Convergence,8.0,['Green'],['G'],None,['Enchantment'],None,Rare,AKH,None,None,None,"Creatures with flying can't attack you or planeswalkers you control.\nAt the beginning of your end step, create a 5/5 green Wurm creature token."
Vizier of Remedies,2.0,['White'],['W'],None,['Creature'],"['Human', 'Cleric']",Uncommon,AKH,2,1,None,"If one or more -1/-1 counters would be put on a creature you control, that many -1/-1 counters minus one are put on it instead."
Wander in Death,3.0,['Black'],['B'],None,['Sorcery'],None,Common,AKH,None,None,None,"Return up to two target creature cards from your graveyard to your hand.\nCycling {2} ({2}, Discard this card: Draw a card.)"
Rhonas the Indomitable,3.0,['Green'],['G'],['Legendary'],['Creature'],['God'],Mythic,AKH,5,5,None,"Deathtouch, indestructible\nRhonas the Indomitable can't attack or block unless you control another creature with power 4 or greater.\n{2}{G}: Another target creature gets +2/+0 and gains trample until end of turn."
Vizier of Deferment,3.0,['White'],['W'],None,['Creature'],"['Human', 'Cleric']",Uncommon,AKH,2,2,None,"Flash\nWhen Vizier of Deferment enters the battlefield, you may exile target creature if it attacked or blocked this turn. Return that card to the battlefield under its owner's control at the beginning of the next end step."
Wasteland Scorpion,3.0,['Black'],['B'],None,['Creature'],['Scorpion'],Common,AKH,2,2,None,"Deathtouch\nCycling {2} ({2}, Discard this card: Draw a card.)"
Quarry Hauler,4.0,['Green'],['G'],None,['Creature'],['Camel'],Common,AKH,4,3,None,"When Quarry Hauler enters the battlefield, for each kind of counter on target permanent, put another counter of that kind on it or remove one from it."
Unwavering Initiate,3.0,['White'],['W'],None,['Creature'],"['Human', 'Warrior']",Common,AKH,3,2,None,"Vigilance\nEmbalm {4}{W} ({4}{W}, Exile this card from your graveyard: Create a token that's a copy of it, except it's a white Zombie Human Warrior with no mana cost. Embalm only as a sorcery.)"
Unburden,3.0,['Black'],['B'],None,['Sorcery'],None,Common,AKH,None,None,None,"Target player discards two cards.\nCycling {2} ({2}, Discard this card: Draw a card.)"
Prowling Serpopard,3.0,['Green'],['G'],None,['Creature'],"['Cat', 'Snake']",Rare,AKH,4,3,None,This spell can't be countered.\nCreature spells you control can't be countered.
Trueheart Duelist,2.0,['White'],['W'],None,['Creature'],"['Human', 'Warrior']",Uncommon,AKH,2,2,None,"Trueheart Duelist can block an additional creature each combat.\nEmbalm {2}{W} ({2}{W}, Exile this card from your graveyard: Create a token that's a copy of it, except it's a white Zombie Human Warrior with no mana cost. Embalm only as a sorcery.)"
Trespasser's Curse,2.0,['Black'],['B'],None,['Enchantment'],"['Aura', 'Curse']",Common,AKH,None,None,None,"Enchant player\nWhenever a creature enters the battlefield under enchanted player's control, that player loses 1 life and you gain 1 life."
Pouncing Cheetah,3.0,['Green'],['G'],None,['Creature'],['Cat'],Common,AKH,3,2,None,Flash
Trial of Solidarity,3.0,['White'],['W'],None,['Enchantment'],None,Uncommon,AKH,None,None,None,"When Trial of Solidarity enters the battlefield, creatures you control get +2/+1 and gain vigilance until end of turn.\nWhen a Cartouche enters the battlefield under your control, return Trial of Solidarity to its owner's hand."
Supernatural Stamina,1.0,['Black'],['B'],None,['Instant'],None,Common,AKH,None,None,None,"Until end of turn, target creature gets +2/+0 and gains ""When this creature dies, return it to the battlefield tapped under its owner's control."""
Grasping Dunes,0.0,None,None,None,['Land'],['Desert'],Uncommon,AKH,None,None,None,"{T}: Add {C}.\n{1}, {T}, Sacrifice Grasping Dunes: Put a -1/-1 counter on target creature. Activate only as a sorcery."
Time to Reflect,1.0,['White'],['W'],None,['Instant'],None,Uncommon,AKH,None,None,None,Exile target creature that blocked or was blocked by a Zombie this turn.
Stir the Sands,6.0,['Black'],['B'],None,['Sorcery'],None,Uncommon,AKH,None,None,None,"Create three 2/2 black Zombie creature tokens.\nCycling {3}{B} ({3}{B}, Discard this card: Draw a card.)\nWhen you cycle Stir the Sands, create a 2/2 black Zombie creature token."
Exemplar of Strength,2.0,['Green'],['G'],None,['Creature'],"['Human', 'Warrior']",Uncommon,AKH,4,4,None,"When Exemplar of Strength enters the battlefield, put three -1/-1 counters on target creature you control.\nWhenever Exemplar of Strength attacks, remove a -1/-1 counter from it. If you do, you gain 1 life."
Those Who Serve,3.0,['White'],['W'],None,['Creature'],['Zombie'],Common,AKH,2,4,None,None
Warfire Javelineer,4.0,['Red'],['R'],None,['Creature'],"['Minotaur', 'Warrior']",Uncommon,AKH,2,3,None,"When Warfire Javelineer enters the battlefield, it deals X damage to target creature an opponent controls, where X is the number of instant and sorcery cards in your graveyard."
Manglehorn,3.0,['Green'],['G'],None,['Creature'],['Beast'],Uncommon,AKH,2,2,None,"When Manglehorn enters the battlefield, you may destroy target artifact.\nArtifacts your opponents control enter the battlefield tapped."
Tah-Crop Elite,4.0,['White'],['W'],None,['Creature'],"['Bird', 'Warrior']",Common,AKH,2,2,None,"Flying\nYou may exert Tah-Crop Elite as it attacks. When you do, creatures you control get +1/+1 until end of turn. (An exerted creature won't untap during your next untap step.)"
Shadow of the Grave,2.0,['Black'],['B'],None,['Instant'],None,Rare,AKH,None,None,None,Return to your hand all cards in your graveyard that you cycled or discarded this turn.
Oashra Cultivator,1.0,['Green'],['G'],None,['Creature'],"['Human', 'Druid']",Common,AKH,0,3,None,"{2}{G}, {T}, Sacrifice Oashra Cultivator: Search your library for a basic land card, put it onto the battlefield tapped, then shuffle."
Supply Caravan,5.0,['White'],['W'],None,['Creature'],['Camel'],Common,AKH,3,5,None,"When Supply Caravan enters the battlefield, if you control a tapped creature, create a 1/1 white Warrior creature token with vigilance."
Violent Impact,4.0,['Red'],['R'],None,['Sorcery'],None,Common,AKH,None,None,None,"Destroy target artifact or land.\nCycling {2} ({2}, Discard this card: Draw a card.)"
Ornery Kudu,3.0,['Green'],['G'],None,['Creature'],['Antelope'],Common,AKH,3,4,None,"When Ornery Kudu enters the battlefield, put a -1/-1 counter on target creature you control."
Sparring Mummy,4.0,['White'],['W'],None,['Creature'],['Zombie'],Common,AKH,3,3,None,"When Sparring Mummy enters the battlefield, untap target creature."
Splendid Agony,3.0,['Black'],['B'],None,['Instant'],None,Common,AKH,None,None,None,Distribute two -1/-1 counters among one or two target creatures.
Naga Vitalist,2.0,['Green'],['G'],None,['Creature'],"['Naga', 'Druid']",Common,AKH,1,2,None,{T}: Add one mana of any type that a land you control could produce.
Seraph of the Suns,7.0,['White'],['W'],None,['Creature'],['Angel'],Uncommon,AKH,4,4,None,"Flying\nIndestructible (Damage and effects that say ""destroy"" don't destroy this creature. If its toughness is 0 or less, it's still put into its owner's graveyard.)"
Soulstinger,4.0,['Black'],['B'],None,['Creature'],"['Scorpion', 'Demon']",Common,AKH,4,5,None,"When Soulstinger enters the battlefield, put two -1/-1 counters on target creature you control.\nWhen Soulstinger dies, you may put a -1/-1 counter on target creature for each -1/-1 counter on Soulstinger."
Initiate's Companion,2.0,['Green'],['G'],None,['Creature'],['Cat'],Common,AKH,3,1,None,"Whenever Initiate's Companion deals combat damage to a player, untap target creature or land."
Sacred Cat,1.0,['White'],['W'],None,['Creature'],['Cat'],Common,AKH,1,1,None,"Lifelink\nEmbalm {W} ({W}, Exile this card from your graveyard: Create a token that's a copy of it, except it's a white Zombie Cat with no mana cost. Embalm only as a sorcery.)"
Pitiless Vizier,4.0,['Black'],['B'],None,['Creature'],"['Minotaur', 'Cleric']",Common,AKH,4,2,None,"Whenever you cycle or discard a card, Pitiless Vizier gains indestructible until end of turn. (Damage and effects that say ""destroy"" don't destroy it. If its toughness is 0 or less, it's still put into its owner's graveyard.)"
Hooded Brawler,3.0,['Green'],['G'],None,['Creature'],"['Naga', 'Warrior']",Common,AKH,3,2,None,"You may exert Hooded Brawler as it attacks. When you do, it gets +2/+2 until end of turn. (An exerted creature won't untap during your next untap step.)"
Rhet-Crop Spearmaster,3.0,['White'],['W'],None,['Creature'],"['Human', 'Warrior']",Common,AKH,3,1,None,"You may exert Rhet-Crop Spearmaster as it attacks. When you do, it gets +1/+0 and gains first strike until end of turn. (An exerted creature won't untap during your next untap step.)"
Nest of Scarabs,3.0,['Black'],['B'],None,['Enchantment'],None,Uncommon,AKH,None,None,None,"Whenever you put one or more -1/-1 counters on a creature, create that many 1/1 black Insect creature tokens."
Honored Hydra,6.0,['Green'],['G'],None,['Creature'],"['Snake', 'Hydra']",Rare,AKH,6,6,None,"Trample\nEmbalm {3}{G} ({3}{G}, Exile this card from your graveyard: Create a token that's a copy of it, except it's a white Zombie Snake Hydra with no mana cost. Embalm only as a sorcery.)"
Renewed Faith,3.0,['White'],['W'],None,['Instant'],None,Uncommon,AKH,None,None,None,"You gain 6 life.\nCycling {1}{W} ({1}{W}, Discard this card: Draw a card.)\nWhen you cycle Renewed Faith, you may gain 2 life."
Scarab Feast,1.0,['Black'],['B'],None,['Instant'],None,Common,AKH,None,None,None,"Exile up to three target cards from a single graveyard.\nCycling {B} ({B}, Discard this card: Draw a card.)"
Hapatra's Mark,1.0,['Green'],['G'],None,['Instant'],None,Uncommon,AKH,None,None,None,Target creature you control gains hexproof until end of turn. Remove all -1/-1 counters from it. (A creature with hexproof can't be the target of spells or abilities your opponents control.)
Regal Caracal,5.0,['White'],['W'],None,['Creature'],['Cat'],Rare,AKH,3,3,None,"Other Cats you control get +1/+1 and have lifelink.\nWhen Regal Caracal enters the battlefield, create two 1/1 white Cat creature tokens with lifelink."
Ruthless Sniper,1.0,['Black'],['B'],None,['Creature'],"['Human', 'Archer']",Uncommon,AKH,1,2,None,"Whenever you cycle or discard a card, you may pay {1}. If you do, put a -1/-1 counter on target creature."
Haze of Pollen,2.0,['Green'],['G'],None,['Instant'],None,Common,AKH,None,None,None,"Prevent all combat damage that would be dealt this turn.\nCycling {3} ({3}, Discard this card: Draw a card.)"
Protection of the Hekma,5.0,['White'],['W'],None,['Enchantment'],None,Uncommon,AKH,None,None,None,"If a source an opponent controls would deal damage to you, prevent 1 of that damage."
Plague Belcher,3.0,['Black'],['B'],None,['Creature'],"['Zombie', 'Beast']",Rare,AKH,5,4,None,"Menace\nWhen Plague Belcher enters the battlefield, put two -1/-1 counters on target creature you control.\nWhenever another Zombie you control dies, each opponent loses 1 life."
Harvest Season,3.0,['Green'],['G'],None,['Sorcery'],None,Rare,AKH,None,None,None,"Search your library for up to X basic land cards, where X is the number of tapped creatures you control, put those cards onto the battlefield tapped, then shuffle."
Oketra's Attendant,5.0,['White'],['W'],None,['Creature'],"['Bird', 'Soldier']",Uncommon,AKH,3,3,None,"Flying\nCycling {2} ({2}, Discard this card: Draw a card.)\nEmbalm {3}{W}{W} ({3}{W}{W}, Exile this card from your graveyard: Create a token that's a copy of it, except it's a white Zombie Bird Soldier with no mana cost. Embalm only as a sorcery.)"
Miasmic Mummy,2.0,['Black'],['B'],None,['Creature'],"['Zombie', 'Jackal']",Common,AKH,2,2,None,"When Miasmic Mummy enters the battlefield, each player discards a card."
Giant Spider,4.0,['Green'],['G'],None,['Creature'],['Spider'],Common,AKH,2,4,None,Reach (This creature can block creatures with flying.)
Oketra the True,4.0,['White'],['W'],['Legendary'],['Creature'],['God'],Mythic,AKH,3,6,None,"Double strike, indestructible\nOketra the True can't attack or block unless you control at least three other creatures.\n{3}{W}: Create a 1/1 white Warrior creature token with vigilance."
Lord of the Accursed,3.0,['Black'],['B'],None,['Creature'],['Zombie'],Uncommon,AKH,2,3,None,"Other Zombies you control get +1/+1.\n{1}{B}, {T}: All Zombies gain menace until end of turn."
Dissenter's Deliverance,2.0,['Green'],['G'],None,['Instant'],None,Common,AKH,None,None,None,"Destroy target artifact.\nCycling {G} ({G}, Discard this card: Draw a card.)"
Mighty Leap,2.0,['White'],['W'],None,['Instant'],None,Common,AKH,None,None,None,Target creature gets +2/+2 and gains flying until end of turn.
Benefaction of Rhonas,3.0,['Green'],['G'],None,['Sorcery'],None,Common,AKH,None,None,None,Reveal the top five cards of your library. You may put a creature card and/or an enchantment card from among them into your hand. Put the rest into your graveyard.
Greater Sandwurm,7.0,['Green'],['G'],None,['Creature'],['Wurm'],Common,AKH,7,7,None,"Greater Sandwurm can't be blocked by creatures with power 2 or less.\nCycling {2} ({2}, Discard this card: Draw a card.)"
In Oketra's Name,2.0,['White'],['W'],None,['Instant'],None,Common,AKH,None,None,None,Zombies you control get +2/+1 until end of turn. Other creatures you control get +1/+1 until end of turn.
Liliana's Mastery,5.0,['Black'],['B'],None,['Enchantment'],None,Rare,AKH,None,None,None,"Zombies you control get +1/+1.\nWhen Liliana's Mastery enters the battlefield, create two 2/2 black Zombie creature tokens."
Gift of Paradise,3.0,['Green'],['G'],None,['Enchantment'],['Aura'],Common,AKH,None,None,None,"Enchant land\nWhen Gift of Paradise enters the battlefield, you gain 3 life.\nEnchanted land has ""{T}: Add two mana of any one color."""
Impeccable Timing,2.0,['White'],['W'],None,['Instant'],None,Common,AKH,None,None,None,Impeccable Timing deals 3 damage to target attacking or blocking creature.
"Liliana, Death's Majesty",5.0,['Black'],['B'],['Legendary'],['Planeswalker'],['Liliana'],Mythic,AKH,None,None,5,[+1]: Create a 2/2 black Zombie creature token. Mill two cards.\n[−3]: Return target creature card from your graveyard to the battlefield. That creature is a black Zombie in addition to its other colors and types.\n[−7]: Destroy all non-Zombie creatures.
Defiant Greatmaw,3.0,['Green'],['G'],None,['Creature'],['Hippo'],Uncommon,AKH,4,5,None,"When Defiant Greatmaw enters the battlefield, put two -1/-1 counters on target creature you control.\nWhenever you put one or more -1/-1 counters on Defiant Greatmaw, remove a -1/-1 counter from another target creature you control."
Gust Walker,2.0,['White'],['W'],None,['Creature'],"['Human', 'Wizard']",Common,AKH,2,2,None,"You may exert Gust Walker as it attacks. When you do, it gets +1/+1 and gains flying until end of turn. (An exerted creature won't untap during your next untap step.)"
Lay Bare the Heart,2.0,['Black'],['B'],None,['Sorcery'],None,Uncommon,AKH,None,None,None,"Target opponent reveals their hand. You choose a nonlegendary, nonland card from it. That player discards that card."
Embalmer's Tools,2.0,None,None,None,['Artifact'],None,Uncommon,AKH,None,None,None,Activated abilities of creature cards in your graveyard cost {1} less to activate.\nTap an untapped Zombie you control: Target player mills a card.
Anointed Procession,4.0,['White'],['W'],None,['Enchantment'],None,Rare,AKH,None,None,None,"If an effect would create one or more tokens under your control, it creates twice that many of those tokens instead."
Horror of the Broken Lands,5.0,['Black'],['B'],None,['Creature'],['Horror'],Common,AKH,4,4,None,"Whenever you cycle or discard another card, Horror of the Broken Lands gets +2/+1 until end of turn.\nCycling {B} ({B}, Discard this card: Draw a card.)"
Edifice of Authority,3.0,None,None,None,['Artifact'],None,Uncommon,AKH,None,None,None,"{1}, {T}: Target creature can't attack this turn. Put a brick counter on Edifice of Authority.\n{1}, {T}: Until your next turn, target creature can't attack or block and its activated abilities can't be activated. Activate only if there are three or more brick counters on Edifice of Authority."
Forsake the Worldly,3.0,['White'],['W'],None,['Instant'],None,Common,AKH,None,None,None,"Exile target artifact or enchantment.\nCycling {2} ({2}, Discard this card: Draw a card.)"
Grim Strider,4.0,['Black'],['B'],None,['Creature'],['Horror'],Uncommon,AKH,6,6,None,Grim Strider gets -1/-1 for each card in your hand.
Bontu's Monument,3.0,None,None,['Legendary'],['Artifact'],None,Uncommon,AKH,None,None,None,"Black creature spells you cast cost {1} less to cast.\nWhenever you cast a creature spell, each opponent loses 1 life and you gain 1 life."
Gideon's Intervention,4.0,['White'],['W'],None,['Enchantment'],None,Rare,AKH,None,None,None,"As Gideon's Intervention enters the battlefield, choose a card name.\nYour opponents can't cast spells with the chosen name.\nPrevent all damage that would be dealt to you and permanents you control by sources with the chosen name."
Gravedigger,4.0,['Black'],['B'],None,['Creature'],['Zombie'],Uncommon,AKH,2,2,None,"When Gravedigger enters the battlefield, you may return target creature card from your graveyard to your hand."
