Name,CMC,Colors,Color identity,Supertypes,Types,Subtypes,Rarity,Set,Power,Toughness,Loyalty,Text
Glory-Bound Initiate,2.0,['White'],['W'],None,['Creature'],"['Human', 'Warrior']",Rare,AKH,3,1,None,"You may exert Glory-Bound Initiate as it attacks. When you do, it gets +1/+3 and gains lifelink until end of turn. (An exerted creature won't untap during your next untap step.)"
Final Reward,5.0,['Black'],['B'],None,['Instant'],None,Common,AKH,None,None,None,Exile target creature.
Heaven // Earth,3.0,['Green'],"['G', 'R']",None,['Instant'],None,Rare,AKH,None,None,None,Heaven deals X damage to each creature with flying.
Gideon of the Trials,3.0,['White'],['W'],['Legendary'],['Planeswalker'],['Gideon'],Mythic,AKH,None,None,3,"[+1]: Until your next turn, prevent all damage target permanent would deal.\n[0]: Until end of turn, Gideon of the Trials becomes a 4/4 Human Soldier creature with indestructible that's still a planeswalker. Prevent all damage that would be dealt to him this turn.\n[0]: You get an emblem with ""As long as you control a Gideon planeswalker, you can't lose the game and your opponents can't win the game."""
Festering Mummy,1.0,['Black'],['B'],None,['Creature'],['Zombie'],Common,AKH,1,1,None,"When Festering Mummy dies, you may put a -1/-1 counter on target creature."
Plains,0.0,None,['W'],['Basic'],['Land'],['Plains'],Common,AKH,None,None,None,({T}: Add {W}.)
Fan Bearer,1.0,['White'],['W'],None,['Creature'],['Zombie'],Common,AKH,1,2,None,"{2}, {T}: Tap target creature."
Faith of the Devoted,3.0,['Black'],['B'],None,['Enchantment'],None,Uncommon,AKH,None,None,None,"Whenever you cycle or discard a card, you may pay {1}. If you do, each opponent loses 2 life and you gain 2 life."
Cut // Ribbons,4.0,['Red'],"['B', 'R']",None,['Sorcery'],None,Rare,AKH,None,None,None,Cut deals 4 damage to target creature.
Djeru's Resolve,1.0,['White'],['W'],None,['Instant'],None,Common,AKH,None,None,None,"Untap target creature. Prevent all damage that would be dealt to it this turn.\nCycling {2} ({2}, Discard this card: Draw a card.)"
Dune Beetle,2.0,['Black'],['B'],None,['Creature'],['Insect'],Common,AKH,1,4,None,None
Devoted Crop-Mate,3.0,['White'],['W'],None,['Creature'],"['Human', 'Warrior']",Uncommon,AKH,3,2,None,"You may exert Devoted Crop-Mate as it attacks. When you do, return target creature card with mana value 2 or less from your graveyard to the battlefield. (An exerted creature won't untap during your next untap step.)"
Bone Picker,4.0,['Black'],['B'],None,['Creature'],['Bird'],Uncommon,AKH,3,2,None,"This spell costs {3} less to cast if a creature died this turn.\nFlying, deathtouch"
Champion of Rhonas,4.0,['Green'],['G'],None,['Creature'],"['Jackal', 'Warrior']",Rare,AKH,3,3,None,"You may exert Champion of Rhonas as it attacks. When you do, you may put a creature card from your hand onto the battlefield. (An exerted creature won't untap during your next untap step.)"
Cartouche of Solidarity,1.0,['White'],['W'],None,['Enchantment'],"['Aura', 'Cartouche']",Common,AKH,None,None,None,"Enchant creature you control\nWhen Cartouche of Solidarity enters the battlefield, create a 1/1 white Warrior creature token with vigilance.\nEnchanted creature gets +1/+1 and has first strike."
Dread Wanderer,1.0,['Black'],['B'],None,['Creature'],"['Zombie', 'Jackal']",Rare,AKH,2,1,None,Dread Wanderer enters the battlefield tapped.\n{2}{B}: Return Dread Wanderer from your graveyard to the battlefield. Activate only as a sorcery and only if you have one or fewer cards in hand.
Rags // Riches,11.0,['Black'],"['B', 'U']",None,['Sorcery'],None,Rare,AKH,None,None,None,All creatures get -2/-2 until end of turn.
Compulsory Rest,2.0,['White'],['W'],None,['Enchantment'],['Aura'],Common,AKH,None,None,None,"Enchant creature\nEnchanted creature can't attack or block.\nEnchanted creature has ""{2}, Sacrifice this creature: You gain 2 life."""
Doomed Dissenter,2.0,['Black'],['B'],None,['Creature'],['Human'],Common,AKH,1,1,None,"When Doomed Dissenter dies, create a 2/2 black Zombie creature token."
Failure // Comply,3.0,['Blue'],"['U', 'W']",None,['Instant'],None,Rare,AKH,None,None,None,Return target spell to its owner's hand.
Cast Out,4.0,['White'],['W'],None,['Enchantment'],None,Uncommon,AKH,None,None,None,"Flash\nWhen Cast Out enters the battlefield, exile target nonland permanent an opponent controls until Cast Out leaves the battlefield.\nCycling {W} ({W}, Discard this card: Draw a card.)"
Dispossess,3.0,['Black'],['B'],None,['Sorcery'],None,Rare,AKH,None,None,None,"Choose an artifact card name. Search target opponent's graveyard, hand, and library for any number of cards with the chosen name and exile them. Then that player shuffles."
Plains,0.0,None,['W'],['Basic'],['Land'],['Plains'],Common,AKH,None,None,None,({T}: Add {W}.)
Anointer Priest,2.0,['White'],['W'],None,['Creature'],"['Human', 'Cleric']",Common,AKH,1,3,None,"Whenever a creature token enters the battlefield under your control, you gain 1 life.\nEmbalm {3}{W} ({3}{W}, Exile this card from your graveyard: Create a token that's a copy of it, except it's a white Zombie Human Cleric with no mana cost. Embalm only as a sorcery.)"
Cursed Minotaur,3.0,['Black'],['B'],None,['Creature'],"['Zombie', 'Minotaur']",Common,AKH,3,2,None,Menace (This creature can't be blocked except by two or more creatures.)
Prepare // Fight,6.0,['White'],"['G', 'W']",None,['Instant'],None,Rare,AKH,None,None,None,Untap target creature. It gets +2/+2 and gains lifelink until end of turn.
Angel of Sanctions,5.0,['White'],['W'],None,['Creature'],['Angel'],Mythic,AKH,3,4,None,"Flying\nWhen Angel of Sanctions enters the battlefield, you may exile target nonland permanent an opponent controls until Angel of Sanctions leaves the battlefield.\nEmbalm {5}{W} ({5}{W}, Exile this card from your graveyard: Create a token that's a copy of it, except it's a white Zombie Angel with no mana cost. Embalm only as a sorcery.)"
Cruel Reality,7.0,['Black'],['B'],None,['Enchantment'],"['Aura', 'Curse']",Mythic,AKH,None,None,None,"Enchant player\nAt the beginning of enchanted player's upkeep, that player sacrifices a creature or planeswalker. If the player can't, they lose 5 life."
Forest,0.0,None,['G'],['Basic'],['Land'],['Forest'],Common,AKH,None,None,None,({T}: Add {G}.)
Binding Mummy,2.0,['White'],['W'],None,['Creature'],['Zombie'],Common,AKH,2,2,None,"Whenever another Zombie enters the battlefield under your control, you may tap target artifact or creature."
Cartouche of Ambition,3.0,['Black'],['B'],None,['Enchantment'],"['Aura', 'Cartouche']",Common,AKH,None,None,None,"Enchant creature you control\nWhen Cartouche of Ambition enters the battlefield, you may put a -1/-1 counter on target creature.\nEnchanted creature gets +1/+1 and has lifelink."
Spring // Mind,9.0,['Green'],"['G', 'U']",None,['Sorcery'],None,Uncommon,AKH,None,None,None,"Search your library for a basic land card, put it onto the battlefield tapped, then shuffle."
Aven Mindcensor,3.0,['White'],['W'],None,['Creature'],"['Bird', 'Wizard']",Rare,AKH,2,1,None,"Flash\nFlying\nIf an opponent would search a library, that player searches the top four cards of that library instead."
Bontu the Glorified,3.0,['Black'],['B'],['Legendary'],['Creature'],['God'],Mythic,AKH,4,6,None,"Menace, indestructible\nBontu the Glorified can't attack or block unless a creature died under your control this turn.\n{1}{B}, Sacrifice another creature: Scry 1. Each opponent loses 1 life and you gain 1 life."
Forest,0.0,None,['G'],['Basic'],['Land'],['Forest'],Common,AKH,None,None,None,({T}: Add {G}.)
Approach of the Second Sun,7.0,['White'],['W'],None,['Sorcery'],None,Rare,AKH,None,None,None,"If this spell was cast from your hand and you've cast another spell named Approach of the Second Sun this game, you win the game. Otherwise, put Approach of the Second Sun into its owner's library seventh from the top and you gain 7 life."
Zenith Seeker,4.0,['Blue'],['U'],None,['Creature'],"['Bird', 'Wizard']",Uncommon,AKH,2,2,None,"Flying\nWhenever you cycle or discard a card, target creature gains flying until end of turn."
Onward // Victory,6.0,['Red'],"['R', 'W']",None,['Instant'],None,Uncommon,AKH,None,None,None,"Target creature gets +X/+0 until end of turn, where X is its power."
Blighted Bat,3.0,['Black'],['B'],None,['Creature'],"['Zombie', 'Bat']",Common,AKH,2,1,None,Flying\n{1}: Blighted Bat gains haste until end of turn.
Baleful Ammit,3.0,['Black'],['B'],None,['Creature'],"['Crocodile', 'Demon']",Uncommon,AKH,4,3,None,"Lifelink\nWhen Baleful Ammit enters the battlefield, put a -1/-1 counter on target creature you control."
Destined // Lead,6.0,['Black'],"['B', 'G']",None,['Instant'],None,Uncommon,AKH,None,None,None,Target creature gets +1/+0 and gains indestructible until end of turn.
Crocodile of the Crossing,4.0,['Green'],['G'],None,['Creature'],['Crocodile'],Uncommon,AKH,5,4,None,"Haste\nWhen Crocodile of the Crossing enters the battlefield, put a -1/-1 counter on target creature you control."
Mountain,0.0,None,['R'],['Basic'],['Land'],['Mountain'],Common,AKH,None,None,None,({T}: Add {R}.)
Mountain,0.0,None,['R'],['Basic'],['Land'],['Mountain'],Common,AKH,None,None,None,({T}: Add {R}.)
Archfiend of Ifnir,5.0,['Black'],['B'],None,['Creature'],['Demon'],Rare,AKH,5,4,None,"Flying\nWhenever you cycle or discard another card, put a -1/-1 counter on each creature your opponents control.\nCycling {2} ({2}, Discard this card: Draw a card.)"
Reduce // Rubble,6.0,['Blue'],"['R', 'U']",None,['Instant'],None,Uncommon,AKH,None,None,None,Counter target spell unless its controller pays {3}.
Colossapede,5.0,['Green'],['G'],None,['Creature'],['Insect'],Common,AKH,5,5,None,None
Luxa River Shrine,3.0,None,None,None,['Artifact'],None,Common,AKH,None,None,None,"{1}, {T}: You gain 1 life. Put a brick counter on Luxa River Shrine.\n{T}: You gain 2 life. Activate only if there are three or more brick counters on Luxa River Shrine."
Cartouche of Strength,3.0,['Green'],['G'],None,['Enchantment'],"['Aura', 'Cartouche']",Common,AKH,None,None,None,"Enchant creature you control\nWhen Cartouche of Strength enters the battlefield, you may have enchanted creature fight target creature an opponent controls. (Each deals damage equal to its power to the other.)\nEnchanted creature gets +1/+1 and has trample."
Trueheart Twins,5.0,['Red'],['R'],None,['Creature'],"['Jackal', 'Warrior']",Uncommon,AKH,4,4,None,"You may exert Trueheart Twins as it attacks. (It won't untap during your next untap step.)\nWhenever you exert a creature, creatures you control get +1/+0 until end of turn."
Island,0.0,None,['U'],['Basic'],['Land'],['Island'],Common,AKH,None,None,None,({T}: Add {U}.)
Winds of Rebuke,2.0,['Blue'],['U'],None,['Instant'],None,Common,AKH,None,None,None,Return target nonland permanent to its owner's hand. Each player mills two cards.
Swamp,0.0,None,['B'],['Basic'],['Land'],['Swamp'],Common,AKH,None,None,None,({T}: Add {B}.)
