Name,CMC,Colors,Color identity,Supertypes,Types,Subtypes,Rarity,Set,Power,Toughness,Loyalty,Text
Expropriate,9.0,['Blue'],['U'],None,['Sorcery'],None,Mythic,CN2,None,None,None,"Council's dilemma — Starting with you, each player votes for time or money. For each time vote, take an extra turn after this one. For each money vote, choose a permanent owned by the voter and gain control of it. Exile Expropriate."
Coveted Peacock,5.0,['Blue'],['U'],None,['Creature'],['Bird'],Uncommon,CN2,3,4,None,"Flying\nWhenever Coveted Peacock attacks, you may goad target creature defending player controls. (Until your next turn, that creature attacks each combat if able and attacks a player other than you if able.)"
Canal Courier,6.0,['Blue'],['U'],None,['Creature'],"['Human', 'Rogue']",Common,CN2,3,5,None,"When Canal Courier enters the battlefield, you become the monarch.\nWhenever Canal Courier and another creature attack different players, Canal Courier can't be blocked this combat."
Arcane Savant,5.0,['Blue'],['U'],None,['Creature'],"['Human', 'Wizard']",Rare,CN2,3,3,None,"Before you shuffle your deck to start the game, you may reveal this card from your deck and exile an instant or sorcery card you drafted that isn't in your deck.\nWhen Arcane Savant enters the battlefield, copy a card you exiled with cards named Arcane Savant. You may cast the copy without paying its mana cost."
Wings of the Guard,2.0,['White'],['W'],None,['Creature'],['Bird'],Common,CN2,1,1,None,"Flying\nMelee (Whenever this creature attacks, it gets +1/+1 until end of turn for each opponent you attacked this combat.)"
Throne Warden,2.0,['White'],['W'],None,['Creature'],"['Human', 'Soldier']",Common,CN2,2,2,None,"At the beginning of your end step, if you're the monarch, put a +1/+1 counter on Throne Warden."
Spectral Grasp,2.0,['White'],['W'],None,['Enchantment'],['Aura'],Uncommon,CN2,None,None,None,Enchant creature\nEnchanted creature can't attack you or planeswalkers you control.\nEnchanted creature can't block creatures you control.
Sanctum Prelate,3.0,['White'],['W'],None,['Creature'],"['Human', 'Cleric']",Mythic,CN2,2,2,None,"As Sanctum Prelate enters the battlefield, choose a number.\nNoncreature spells with mana value equal to the chosen number can't be cast."
Recruiter of the Guard,3.0,['White'],['W'],None,['Creature'],"['Human', 'Soldier']",Rare,CN2,1,1,None,"When Recruiter of the Guard enters the battlefield, you may search your library for a creature card with toughness 2 or less, reveal it, put it into your hand, then shuffle."
Protector of the Crown,6.0,['White'],['W'],None,['Creature'],"['Giant', 'Soldier']",Rare,CN2,2,5,None,"When Protector of the Crown enters the battlefield, you become the monarch.\nAll damage that would be dealt to you is dealt to Protector of the Crown instead."
Paliano Vanguard,2.0,['White'],['W'],None,['Creature'],"['Human', 'Soldier']",Rare,CN2,2,2,None,"Draft Paliano Vanguard face up.\nAs you draft a creature card, you may reveal it, note its creature types, then turn Paliano Vanguard face down.\nOther creatures you control of a type you noted for cards named Paliano Vanguard get +1/+1."
Palace Sentinels,4.0,['White'],['W'],None,['Creature'],"['Human', 'Soldier']",Common,CN2,2,4,None,"When Palace Sentinels enters the battlefield, you become the monarch."
Palace Jailer,4.0,['White'],['W'],None,['Creature'],"['Human', 'Soldier']",Uncommon,CN2,2,2,None,"When Palace Jailer enters the battlefield, you become the monarch.\nWhen Palace Jailer enters the battlefield, exile target creature an opponent controls until an opponent becomes the monarch."
Noble Banneret,4.0,['White'],['W'],None,['Creature'],"['Human', 'Knight']",Uncommon,CN2,3,3,None,"Draft Noble Banneret face up.\nAs you draft a creature card, you may reveal it, note its name, then turn Noble Banneret face down.\nAs long as you control one or more creatures with a name you noted for cards named Noble Banneret, Noble Banneret and those creatures get +1/+1 and have lifelink."
Assemble the Rank and Vile,0.0,None,['B'],None,['Conspiracy'],None,Common,CN2,None,None,None,"Hidden agenda (Start the game with this conspiracy face down in the command zone and secretly choose a card name. You may turn this conspiracy face up any time and reveal that name.)\nCreatures you control with the chosen name have ""When this creature dies, you may pay {B}. If you do, create a tapped 2/2 black Zombie creature token."""
Ballot Broker,3.0,['White'],['W'],None,['Creature'],"['Human', 'Advisor']",Common,CN2,2,3,None,"While voting, you may vote an additional time. (The votes can be for different choices or for the same choice.)"
Custodi Soulcaller,3.0,['White'],['W'],None,['Creature'],"['Human', 'Cleric']",Uncommon,CN2,1,2,None,"Melee (Whenever this creature attacks, it gets +1/+1 until end of turn for each opponent you attacked this combat.)\nWhenever Custodi Soulcaller attacks, return target creature card with mana value X or less from your graveyard to the battlefield, where X is the number of players you attacked this combat."
Lieutenants of the Guard,5.0,['White'],['W'],None,['Creature'],"['Human', 'Soldier']",Common,CN2,2,2,None,"Council's dilemma — When Lieutenants of the Guard enters the battlefield, starting with you, each player votes for strength or numbers. Put a +1/+1 counter on Lieutenants of the Guard for each strength vote and create a 1/1 white Soldier creature token for each numbers vote."
Custodi Peacekeeper,3.0,['White'],['W'],None,['Creature'],"['Human', 'Cleric']",Common,CN2,2,3,None,"Reveal Custodi Peacekeeper as you draft it and note how many cards you've drafted this draft round, including Custodi Peacekeeper.\n{W}, {T}: Tap target creature with power less than or equal to the highest number you noted for cards named Custodi Peacekeeper."
Weight Advantage,0.0,None,None,None,['Conspiracy'],None,Rare,CN2,None,None,None,(Start the game with this conspiracy face up in the command zone.)\nEach creature you control assigns combat damage equal to its toughness rather than its power.
Summoner's Bond,0.0,None,None,None,['Conspiracy'],None,Uncommon,CN2,None,None,None,"Double agenda (Start the game with this conspiracy face down in the command zone and secretly choose two different card names. You may turn this conspiracy face up any time and reveal those names.)\nWhenever you cast a creature spell with one of the chosen names, you may search your library for a creature card with the other chosen name, reveal it, put it into your hand, then shuffle."
Sovereign's Realm,0.0,None,None,None,['Conspiracy'],None,Mythic,CN2,None,None,None,"(Start the game with this conspiracy face up in the command zone.)\nYour starting deck can't have basic land cards and your starting hand size is five.\nExile a card from your hand: This turn, you may play basic lands from outside the game.\nBasic lands you control have ""{T}: Add one mana of any color."""
Hymn of the Wilds,0.0,None,None,None,['Conspiracy'],None,Mythic,CN2,None,None,None,(Start the game with this conspiracy face up in the command zone.)\nThe first creature spell you cast each turn costs {1} less to cast.\nYou can't cast instant or sorcery spells.
Natural Unity,0.0,None,['G'],None,['Conspiracy'],None,Common,CN2,None,None,None,"Hidden agenda (Start the game with this conspiracy face down in the command zone and secretly choose a card name. You may turn this conspiracy face up any time and reveal that name.)\nCreatures you control with the chosen name have ""At the beginning of combat on your turn, you may pay {G}. If you do, put a +1/+1 counter on this creature."""
Incendiary Dissent,0.0,None,['R'],None,['Conspiracy'],None,Common,CN2,None,None,None,"Hidden agenda (Start the game with this conspiracy face down in the command zone and secretly choose a card name. You may turn this conspiracy face up any time and reveal that name.)\nCreatures you control with the chosen name have ""{R}: This creature gets +1/+0 until end of turn."""
Echoing Boon,0.0,None,None,None,['Conspiracy'],None,Uncommon,CN2,None,None,None,"Hidden agenda (Start the game with this conspiracy face down in the command zone and secretly choose a card name. You may turn this conspiracy face up any time and reveal that name.)\nWhenever you cast an instant or sorcery spell, if it targets a creature you control with the chosen name, you may copy that spell and may choose new targets for the copy."
Adriana's Valor,0.0,None,['W'],None,['Conspiracy'],None,Common,CN2,None,None,None,"Hidden agenda (Start the game with this conspiracy face down in the command zone and secretly choose a card name. You may turn this conspiracy face up any time and reveal that name.)\nWhenever a creature you control with the chosen name attacks, you may pay {W}. If you do, that creature gains indestructible until end of turn. (Damage and effects that say ""destroy"" don't destroy it.)"
Hold the Perimeter,0.0,None,None,None,['Conspiracy'],None,Rare,CN2,None,None,None,"(Start the game with this conspiracy face up in the command zone.)\nAt the beginning of your first upkeep, create a 1/2 white Soldier creature token with defender.\nAt the beginning of each other player's first upkeep, that player creates a 1/1 red Goblin creature token with ""This creature can't block."""
Hired Heist,0.0,None,['U'],None,['Conspiracy'],None,Common,CN2,None,None,None,"Hidden agenda (Start the game with this conspiracy face down in the command zone and secretly choose a card name. You may turn this conspiracy face up any time and reveal that name.)\nWhenever a creature you control with the chosen name deals combat damage to a player, you may pay {U}. If you do, draw a card."
Emissary's Ploy,0.0,None,None,None,['Conspiracy'],None,Rare,CN2,None,None,None,"(Start the game with this conspiracy face up in the command zone.)\nBefore drawing your opening hand, choose 1, 2, or 3.\nYou may spend mana as though it were mana of any color to cast creature spells with mana value equal to the chosen number."
Faith's Reward,4.0,['White'],['W'],None,['Instant'],None,Rare,CN2,None,None,None,Return to the battlefield all permanent cards in your graveyard that were put there from the battlefield this turn.
Ember Beast,3.0,['Red'],['R'],None,['Creature'],['Beast'],Common,CN2,3,4,None,Ember Beast can't attack or block alone.
Carnage Gladiator,4.0,"['Black', 'Red']","['B', 'R']",None,['Creature'],"['Skeleton', 'Warrior']",Uncommon,CN2,4,2,None,"Whenever a creature blocks, that creature's controller loses 1 life.\n{1}{B}{R}: Regenerate Carnage Gladiator."
Doomed Traveler,1.0,['White'],['W'],None,['Creature'],"['Human', 'Soldier']",Common,CN2,1,1,None,"When Doomed Traveler dies, create a 1/1 white Spirit creature token with flying."
Coordinated Assault,1.0,['Red'],['R'],None,['Instant'],None,Uncommon,CN2,None,None,None,Up to two target creatures each get +1/+0 and gain first strike until end of turn.
Ascended Lawmage,4.0,"['Blue', 'White']","['U', 'W']",None,['Creature'],"['Vedalken', 'Wizard']",Uncommon,CN2,3,2,None,Flying\nHexproof (This creature can't be the target of spells or abilities your opponents control.)
Disenchant,2.0,['White'],['W'],None,['Instant'],None,Common,CN2,None,None,None,Destroy target artifact or enchantment.
Charmbreaker Devils,6.0,['Red'],['R'],None,['Creature'],['Devil'],Rare,CN2,4,4,None,"At the beginning of your upkeep, return an instant or sorcery card at random from your graveyard to your hand.\nWhenever you cast an instant or sorcery spell, Charmbreaker Devils gets +4/+0 until end of turn."
Akroan Hoplite,2.0,"['Red', 'White']","['R', 'W']",None,['Creature'],"['Human', 'Soldier']",Uncommon,CN2,1,2,None,"Whenever Akroan Hoplite attacks, it gets +X/+0 until end of turn, where X is the number of attacking creatures you control."
Affa Guard Hound,3.0,['White'],['W'],None,['Creature'],['Dog'],Uncommon,CN2,2,2,None,"Flash (You may cast this spell any time you could cast an instant.)\nWhen Affa Guard Hound enters the battlefield, target creature gets +0/+3 until end of turn."
Burning Wish,2.0,['Red'],['R'],None,['Sorcery'],None,Rare,CN2,None,None,None,You may reveal a sorcery card you own from outside the game and put it into your hand. Exile Burning Wish.
Wild Pair,6.0,['Green'],['G'],None,['Enchantment'],None,Rare,CN2,None,None,None,"Whenever a creature enters the battlefield, if you cast it from your hand, you may search your library for a creature card with the same total power and toughness, put it onto the battlefield, then shuffle."
Throne of the High City,0.0,None,None,None,['Land'],None,Rare,CN2,None,None,None,"{T}: Add {C}.\n{4}, {T}, Sacrifice Throne of the High City: You become the monarch."
Burn Away,5.0,['Red'],['R'],None,['Instant'],None,Uncommon,CN2,None,None,None,"Burn Away deals 6 damage to target creature. When that creature dies this turn, exile its controller's graveyard."
Voyaging Satyr,2.0,['Green'],['G'],None,['Creature'],"['Satyr', 'Druid']",Common,CN2,1,2,None,{T}: Untap target land.
Spy Kit,2.0,None,None,None,['Artifact'],['Equipment'],Uncommon,CN2,None,None,None,Equipped creature gets +1/+1 and has all names of nonlegendary creature cards in addition to its name.\nEquip {2}
Unnerve,4.0,['Black'],['B'],None,['Sorcery'],None,Common,CN2,None,None,None,Each opponent discards two cards.
Sylvan Bounty,6.0,['Green'],['G'],None,['Instant'],None,Common,CN2,None,None,None,"Target player gains 8 life.\nBasic landcycling {1}{G} ({1}{G}, Discard this card: Search your library for a basic land card, reveal it, put it into your hand, then shuffle.)"
Queen Marchesa,4.0,"['Black', 'Red', 'White']","['B', 'R', 'W']",['Legendary'],['Creature'],"['Human', 'Assassin']",Mythic,CN2,3,3,None,"Deathtouch, haste\nWhen Queen Marchesa enters the battlefield, you become the monarch.\nAt the beginning of your upkeep, if an opponent is the monarch, create a 1/1 black Assassin creature token with deathtouch and haste."
Stromkirk Patrol,5.0,['Black'],['B'],None,['Creature'],"['Vampire', 'Soldier']",Common,CN2,4,3,None,"Whenever Stromkirk Patrol deals combat damage to a player, put a +1/+1 counter on it."
Strength in Numbers,2.0,['Green'],['G'],None,['Instant'],None,Common,CN2,None,None,None,"Until end of turn, target creature gains trample and gets +X/+X, where X is the number of attacking creatures."
"Leovold, Emissary of Trest",3.0,"['Black', 'Green', 'Blue']","['B', 'G', 'U']",['Legendary'],['Creature'],"['Elf', 'Advisor']",Mythic,CN2,3,3,None,"Each opponent can't draw more than one card each turn.\nWhenever you or a permanent you control becomes the target of a spell or ability an opponent controls, you may draw a card."
Shambling Goblin,1.0,['Black'],['B'],None,['Creature'],"['Zombie', 'Goblin']",Common,CN2,1,1,None,"When Shambling Goblin dies, target creature an opponent controls gets -1/-1 until end of turn."
Ravenous Leucrocota,4.0,['Green'],['G'],None,['Creature'],['Beast'],Common,CN2,2,4,None,"Vigilance\n{6}{G}: Monstrosity 3. (If this creature isn't monstrous, put three +1/+1 counters on it and it becomes monstrous.)"
Knights of the Black Rose,5.0,"['Black', 'White']","['B', 'W']",None,['Creature'],"['Human', 'Knight']",Uncommon,CN2,4,4,None,"When Knights of the Black Rose enters the battlefield, you become the monarch.\nWhenever an opponent becomes the monarch, if you were the monarch as the turn began, that player loses 2 life and you gain 2 life."
Sangromancer,4.0,['Black'],['B'],None,['Creature'],"['Vampire', 'Shaman']",Rare,CN2,3,3,None,"Flying\nWhenever a creature an opponent controls dies, you may gain 3 life.\nWhenever an opponent discards a card, you may gain 3 life."
Prey Upon,1.0,['Green'],['G'],None,['Sorcery'],None,Common,CN2,None,None,None,Target creature you control fights target creature you don't control. (Each deals damage equal to its power to the other.)
"Kaya, Ghost Assassin",4.0,"['Black', 'White']","['B', 'W']",['Legendary'],['Planeswalker'],['Kaya'],Mythic,CN2,None,None,5,"[0]: Exile Kaya, Ghost Assassin or up to one target creature. Return that card to the battlefield under its owner's control at the beginning of your next upkeep. You lose 2 life.\n[−1]: Each opponent loses 2 life and you gain 2 life.\n[−2]: Each opponent discards a card and you draw a card."
Raise Dead,1.0,['Black'],['B'],None,['Sorcery'],None,Common,CN2,None,None,None,Return target creature card from your graveyard to your hand.
Plummet,2.0,['Green'],['G'],None,['Instant'],None,Common,CN2,None,None,None,Destroy target creature with flying.
"Daretti, Ingenious Iconoclast",3.0,"['Black', 'Red']","['B', 'R']",['Legendary'],['Planeswalker'],['Daretti'],Mythic,CN2,None,None,3,"[+1]: Create a 1/1 colorless Construct artifact creature token with defender.\n[−1]: You may sacrifice an artifact. If you do, destroy target artifact or creature.\n[−6]: Choose target artifact card in a graveyard or artifact on the battlefield. Create three tokens that are copies of it."
Public Execution,6.0,['Black'],['B'],None,['Instant'],None,Uncommon,CN2,None,None,None,Destroy target creature an opponent controls. Each other creature that player controls gets -2/-0 until end of turn.
Overrun,5.0,['Green'],['G'],None,['Sorcery'],None,Uncommon,CN2,None,None,None,Creatures you control get +3/+3 and gain trample until end of turn.
"Adriana, Captain of the Guard",5.0,"['Red', 'White']","['R', 'W']",['Legendary'],['Creature'],"['Human', 'Knight']",Rare,CN2,4,4,None,"Melee (Whenever this creature attacks, it gets +1/+1 until end of turn for each opponent you attacked this combat.)\nOther creatures you control have melee. (If a creature has multiple instances of melee, each triggers separately.)"
Phyrexian Arena,3.0,['Black'],['B'],None,['Enchantment'],None,Rare,CN2,None,None,None,"At the beginning of your upkeep, you draw a card and you lose 1 life."
Netcaster Spider,3.0,['Green'],['G'],None,['Creature'],['Spider'],Common,CN2,2,3,None,"Reach (This creature can block creatures with flying.)\nWhenever Netcaster Spider blocks a creature with flying, Netcaster Spider gets +2/+0 until end of turn."
Splitting Slime,5.0,['Green'],['G'],None,['Creature'],['Ooze'],Rare,CN2,3,3,None,"{4}{G}{G}: Monstrosity 3. (If this creature isn't monstrous, put three +1/+1 counters on it and it becomes monstrous.)\nWhen Splitting Slime becomes monstrous, create a token that's a copy of Splitting Slime. (The token has no counters and isn't monstrous.)"
Murder,3.0,['Black'],['B'],None,['Instant'],None,Common,CN2,None,None,None,Destroy target creature.
Nessian Asp,5.0,['Green'],['G'],None,['Creature'],['Snake'],Uncommon,CN2,4,5,None,"Reach\n{6}{G}: Monstrosity 4. (If this creature isn't monstrous, put four +1/+1 counters on it and it becomes monstrous.)"
Selvala's Stampede,6.0,['Green'],['G'],None,['Sorcery'],None,Rare,CN2,None,None,None,"Council's dilemma — Starting with you, each player votes for wild or free. Reveal cards from the top of your library until you reveal a creature card for each wild vote. Put those creature cards onto the battlefield, then shuffle the rest into your library. You may put a permanent card from your hand onto the battlefield for each free vote."
Mausoleum Turnkey,4.0,['Black'],['B'],None,['Creature'],"['Ogre', 'Rogue']",Uncommon,CN2,3,2,None,"When Mausoleum Turnkey enters the battlefield, return target creature card of an opponent's choice from your graveyard to your hand."
"Selvala, Heart of the Wilds",3.0,['Green'],['G'],['Legendary'],['Creature'],"['Elf', 'Scout']",Mythic,CN2,2,3,None,"Whenever another creature enters the battlefield, its controller may draw a card if its power is greater than each other creature's power.\n{G}, {T}: Add X mana in any combination of colors, where X is the greatest power among creatures you control."
Keepsake Gorgon,5.0,['Black'],['B'],None,['Creature'],['Gorgon'],Uncommon,CN2,2,5,None,"Deathtouch\n{5}{B}{B}: Monstrosity 1. (If this creature isn't monstrous, put a +1/+1 counter on it and it becomes monstrous.)\nWhen Keepsake Gorgon becomes monstrous, destroy target non-Gorgon creature an opponent controls."
Manaplasm,3.0,['Green'],['G'],None,['Creature'],['Ooze'],Uncommon,CN2,1,1,None,"Whenever you cast a spell, Manaplasm gets +X/+X until end of turn, where X is that spell's mana value."
Regal Behemoth,6.0,['Green'],['G'],None,['Creature'],['Dinosaur'],Rare,CN2,5,5,None,"Trample\nWhen Regal Behemoth enters the battlefield, you become the monarch.\nWhenever you tap a land for mana while you're the monarch, add an additional one mana of any color."
Inquisition of Kozilek,1.0,['Black'],['B'],None,['Sorcery'],None,Rare,CN2,None,None,None,Target player reveals their hand. You choose a nonland card from it with mana value 3 or less. That player discards that card.
Lay of the Land,1.0,['Green'],['G'],None,['Sorcery'],None,Common,CN2,None,None,None,"Search your library for a basic land card, reveal it, put it into your hand, then shuffle."
Orchard Elemental,6.0,['Green'],['G'],None,['Creature'],['Elemental'],Common,CN2,2,2,None,"Council's dilemma — When Orchard Elemental enters the battlefield, starting with you, each player votes for sprout or harvest. Put two +1/+1 counters on Orchard Elemental for each sprout vote. You gain 3 life for each harvest vote."
Infest,3.0,['Black'],['B'],None,['Sorcery'],None,Uncommon,CN2,None,None,None,All creatures get -2/-2 until end of turn.
Menagerie Liberator,4.0,['Green'],['G'],None,['Creature'],"['Human', 'Warrior']",Common,CN2,3,2,None,"Trample\nMelee (Whenever this creature attacks, it gets +1/+1 until end of turn for each opponent you attacked this combat.)"
Harvester of Souls,6.0,['Black'],['B'],None,['Creature'],['Demon'],Rare,CN2,5,5,None,"Deathtouch\nWhenever another nontoken creature dies, you may draw a card."
Lace with Moonglove,3.0,['Green'],['G'],None,['Instant'],None,Common,CN2,None,None,None,Target creature gains deathtouch until end of turn. (Any amount of damage it deals to a creature is enough to destroy that creature.)\nDraw a card.
Leovold's Operative,3.0,['Green'],['G'],None,['Creature'],"['Elf', 'Rogue']",Common,CN2,3,2,None,"Draft Leovold's Operative face up.\nAs you draft a card, you may draft an additional card from that booster pack. If you do, turn Leovold's Operative face down, then pass the next booster pack without drafting a card from it. (You may look at that booster pack.)"
Guul Draz Specter,4.0,['Black'],['B'],None,['Creature'],['Specter'],Rare,CN2,2,2,None,"Flying\nGuul Draz Specter gets +3/+3 as long as an opponent has no cards in hand.\nWhenever Guul Draz Specter deals combat damage to a player, that player discards a card."
Irresistible Prey,1.0,['Green'],['G'],None,['Sorcery'],None,Uncommon,CN2,None,None,None,Target creature must be blocked this turn if able.\nDraw a card.
Fang of the Pack,6.0,['Green'],['G'],None,['Creature'],['Wolf'],Uncommon,CN2,5,3,None,"Melee (Whenever this creature attacks, it gets +1/+1 until end of turn for each opponent you attacked this combat.)\nAt the beginning of combat on your turn, another target creature you control gains melee until end of turn. (If a creature has multiple instances of melee, each triggers separately.)"
Fleshbag Marauder,3.0,['Black'],['B'],None,['Creature'],"['Zombie', 'Warrior']",Uncommon,CN2,3,1,None,"When Fleshbag Marauder enters the battlefield, each player sacrifices a creature."
Forgotten Ancient,4.0,['Green'],['G'],None,['Creature'],['Elemental'],Rare,CN2,0,3,None,"Whenever a player casts a spell, you may put a +1/+1 counter on Forgotten Ancient.\nAt the beginning of your upkeep, you may move any number of +1/+1 counters from Forgotten Ancient onto other creatures."
Entourage of Trest,5.0,['Green'],['G'],None,['Creature'],"['Elf', 'Soldier']",Common,CN2,4,4,None,"When Entourage of Trest enters the battlefield, you become the monarch.\nEntourage of Trest can block an additional creature each combat as long as you're the monarch."
Festergloom,3.0,['Black'],['B'],None,['Sorcery'],None,Common,CN2,None,None,None,Nonblack creatures get -1/-1 until end of turn.
Fade into Antiquity,3.0,['Green'],['G'],None,['Sorcery'],None,Common,CN2,None,None,None,Exile target artifact or enchantment.
Domesticated Hydra,4.0,['Green'],['G'],None,['Creature'],['Hydra'],Uncommon,CN2,3,3,None,"{X}{G}{G}{G}: Monstrosity X. (If this creature isn't monstrous, put X +1/+1 counters on it and it becomes monstrous.)\nAs long as Domesticated Hydra is monstrous, it has trample."
Farbog Boneflinger,5.0,['Black'],['B'],None,['Creature'],['Zombie'],Uncommon,CN2,2,2,None,"When Farbog Boneflinger enters the battlefield, target creature gets -2/-2 until end of turn."
Explosive Vegetation,4.0,['Green'],['G'],None,['Sorcery'],None,Uncommon,CN2,None,None,None,"Search your library for up to two basic land cards, put them onto the battlefield tapped, then shuffle."
Caller of the Untamed,4.0,['Green'],['G'],None,['Creature'],"['Elf', 'Shaman']",Rare,CN2,2,4,None,"Before you shuffle your deck to start the game, you may reveal this card from your deck and exile a creature card you drafted that isn't in your deck.\n{X}, {T}: Create a token that's a copy of a card you exiled with cards named Caller of the Untamed. X is the mana value of that card."
Driver of the Dead,4.0,['Black'],['B'],None,['Creature'],['Vampire'],Common,CN2,3,2,None,"When Driver of the Dead dies, return target creature card with mana value 2 or less from your graveyard to the battlefield."
Copperhorn Scout,1.0,['Green'],['G'],None,['Creature'],"['Elf', 'Scout']",Common,CN2,1,1,None,"Whenever Copperhorn Scout attacks, untap each other creature you control."
Borderland Explorer,2.0,['Green'],['G'],None,['Creature'],"['Elf', 'Scout']",Common,CN2,3,1,None,"When Borderland Explorer enters the battlefield, each player may discard a card. Each player who discarded a card this way may search their library for a basic land card, reveal it, put it into their hand, then shuffle."
Diabolic Tutor,4.0,['Black'],['B'],None,['Sorcery'],None,Uncommon,CN2,None,None,None,"Search your library for a card, put that card into your hand, then shuffle."
