Name,CMC,Colors,Color identity,Supertypes,Types,Subtypes,Rarity,Set,Power,Toughness,Loyalty,Text
Burgeoning,1.0,['Green'],['G'],None,['Enchantment'],None,Rare,CN2,None,None,None,"Whenever an opponent plays a land, you may put a land card from your hand onto the battlefield."
Animus of Predation,5.0,['Green'],['G'],None,['Creature'],['Avatar'],Uncommon,CN2,4,4,None,"Draft Animus of Predation face up.\nAs you draft a card, you may remove it from the draft face up. (It isn't in your card pool.)\nIf you removed a creature card with flying from the draft with cards named Animus of Predation, Animus of Predation has flying. The same is true for first strike, double strike, deathtouch, haste, hexproof, indestructible, lifelink, menace, reach, and vigilance."
Death Wind,1.0,['Black'],['B'],None,['Instant'],None,Common,CN2,None,None,None,Target creature gets -X/-X until end of turn.
Brushstrider,2.0,['Green'],['G'],None,['Creature'],['Beast'],Uncommon,CN2,3,1,None,Vigilance
Volatile Chimera,3.0,['Red'],['R'],None,['Creature'],"['Elemental', 'Chimera']",Rare,CN2,3,2,None,"Before you shuffle your deck to start the game, you may reveal this card from your deck and exile three or more creature cards you drafted that aren't in your deck.\n{1}{R}: Choose a card at random you exiled with cards named Volatile Chimera. Volatile Chimera becomes a copy of that card, except it has this ability."
Child of Night,2.0,['Black'],['B'],None,['Creature'],['Vampire'],Common,CN2,2,1,None,Lifelink
Birds of Paradise,1.0,['Green'],['G'],None,['Creature'],['Bird'],Rare,CN2,0,1,None,Flying\n{T}: Add one mana of any color.
Subterranean Tremors,1.0,['Red'],['R'],None,['Sorcery'],None,Mythic,CN2,None,None,None,"Subterranean Tremors deals X damage to each creature without flying. If X is 4 or more, destroy all artifacts. If X is 8 or more, create an 8/8 red Lizard creature token."
Blood-Toll Harpy,3.0,['Black'],['B'],None,['Creature'],['Harpy'],Common,CN2,2,1,None,"Flying\nWhen Blood-Toll Harpy enters the battlefield, each player loses 1 life."
Berserk,1.0,['Green'],['G'],None,['Instant'],None,Mythic,CN2,None,None,None,"Cast this spell only before the combat damage step.\nTarget creature gains trample and gets +X/+0 until end of turn, where X is its power. At the beginning of the next end step, destroy that creature if it attacked this turn."
Skyline Despot,7.0,['Red'],['R'],None,['Creature'],['Dragon'],Rare,CN2,5,5,None,"Flying\nWhen Skyline Despot enters the battlefield, you become the monarch.\nAt the beginning of your upkeep, if you're the monarch, create a 5/5 red Dragon creature token with flying."
Avatar of Woe,8.0,['Black'],['B'],None,['Creature'],['Avatar'],Mythic,CN2,6,5,None,"If there are ten or more creature cards total in all graveyards, this spell costs {6} less to cast.\nFear (This creature can't be blocked except by artifact creatures and/or black creatures.)\n{T}: Destroy target creature. It can't be regenerated."
Beast Within,3.0,['Green'],['G'],None,['Instant'],None,Uncommon,CN2,None,None,None,Destroy target permanent. Its controller creates a 3/3 green Beast creature token.
Pyretic Hunter,5.0,['Red'],['R'],None,['Creature'],"['Elemental', 'Cat']",Uncommon,CN2,0,0,None,"Reveal Pyretic Hunter as you draft it and note how many cards you've drafted this draft round, including Pyretic Hunter.\nMenace (This creature can't be blocked except by two or more creatures.)\nPyretic Hunter enters the battlefield with X +1/+1 counters on it, where X is the highest number you noted for cards named Pyretic Hunter."
Altar's Reap,2.0,['Black'],['B'],None,['Instant'],None,Common,CN2,None,None,None,"As an additional cost to cast this spell, sacrifice a creature.\nDraw two cards."
Twin Bolt,2.0,['Red'],['R'],None,['Instant'],None,Common,CN2,None,None,None,Twin Bolt deals 2 damage divided as you choose among one or two targets.
Grenzo's Ruffians,4.0,['Red'],['R'],None,['Creature'],['Goblin'],Uncommon,CN2,2,2,None,"Melee (Whenever this creature attacks, it gets +1/+1 until end of turn for each opponent you attacked this combat.)\nWhenever Grenzo's Ruffians deals combat damage to an opponent, it deals that much damage to each other opponent."
Absorb Vis,7.0,['Black'],['B'],None,['Sorcery'],None,Common,CN2,None,None,None,"Target player loses 4 life and you gain 4 life.\nBasic landcycling {1}{B} ({1}{B}, Discard this card: Search your library for a basic land card, reveal it, put it into your hand, then shuffle.)"
Trumpet Blast,3.0,['Red'],['R'],None,['Instant'],None,Common,CN2,None,None,None,Attacking creatures get +2/+0 until end of turn.
"Grenzo, Havoc Raiser",2.0,['Red'],['R'],['Legendary'],['Creature'],"['Goblin', 'Rogue']",Rare,CN2,2,2,None,"Whenever a creature you control deals combat damage to a player, choose one —\n• Goad target creature that player controls.\n• Exile the top card of that player's library. Until end of turn, you may cast that card and you may spend mana as though it were mana of any color to cast that spell."
Vertigo Spawn,2.0,['Blue'],['U'],None,['Creature'],['Illusion'],Uncommon,CN2,0,3,None,"Defender\nWhenever Vertigo Spawn blocks a creature, tap that creature. That creature doesn't untap during its controller's next untap step."
Tormenting Voice,2.0,['Red'],['R'],None,['Sorcery'],None,Common,CN2,None,None,None,"As an additional cost to cast this spell, discard a card.\nDraw two cards."
Goblin Racketeer,4.0,['Red'],['R'],None,['Creature'],"['Goblin', 'Rogue']",Common,CN2,4,2,None,"Whenever Goblin Racketeer attacks, you may goad target creature defending player controls. (Until your next turn, that creature attacks each combat if able and attacks a player other than you if able.)"
Vaporkin,2.0,['Blue'],['U'],None,['Creature'],['Elemental'],Common,CN2,2,1,None,Flying\nVaporkin can block only creatures with flying.
Sulfurous Blast,4.0,['Red'],['R'],None,['Instant'],None,Uncommon,CN2,None,None,None,"Sulfurous Blast deals 2 damage to each creature and each player. If you cast this spell during your main phase, Sulfurous Blast deals 3 damage to each creature and each player instead."
Garbage Fire,3.0,['Red'],['R'],None,['Instant'],None,Common,CN2,None,None,None,"Reveal Garbage Fire as you draft it and note how many cards you've drafted this draft round, including Garbage Fire.\nGarbage Fire deals damage to target creature equal to the highest number you noted for cards named Garbage Fire."
Traumatic Visions,5.0,['Blue'],['U'],None,['Instant'],None,Common,CN2,None,None,None,"Counter target spell.\nBasic landcycling {1}{U} ({1}{U}, Discard this card: Search your library for a basic land card, reveal it, put it into your hand, then shuffle.)"
Stoneshock Giant,5.0,['Red'],['R'],None,['Creature'],['Giant'],Uncommon,CN2,5,4,None,"{6}{R}{R}: Monstrosity 3. (If this creature isn't monstrous, put three +1/+1 counters on it and it becomes monstrous.)\nWhen Stoneshock Giant becomes monstrous, creatures without flying your opponents control can't block this turn."
Deputized Protester,3.0,['Red'],['R'],None,['Creature'],"['Human', 'Warrior']",Common,CN2,2,1,None,"Menace (This creature can't be blocked except by two or more creatures.)\nMelee (Whenever this creature attacks, it gets +1/+1 until end of turn for each opponent you attacked this combat.)"
Sphinx of Magosi,6.0,['Blue'],['U'],None,['Creature'],['Sphinx'],Rare,CN2,6,6,None,"Flying\n{2}{U}: Draw a card, then put a +1/+1 counter on Sphinx of Magosi."
Ogre Sentry,2.0,['Red'],['R'],None,['Creature'],"['Ogre', 'Warrior']",Common,CN2,3,3,None,Defender
Crown-Hunter Hireling,5.0,['Red'],['R'],None,['Creature'],"['Ogre', 'Mercenary']",Common,CN2,4,4,None,"When Crown-Hunter Hireling enters the battlefield, you become the monarch.\nCrown-Hunter Hireling can't attack unless defending player is the monarch."
Show and Tell,3.0,['Blue'],['U'],None,['Sorcery'],None,Mythic,CN2,None,None,None,"Each player may put an artifact, creature, enchantment, or land card from their hand onto the battlefield."
Kiln Fiend,2.0,['Red'],['R'],None,['Creature'],"['Elemental', 'Beast']",Common,CN2,1,2,None,"Whenever you cast an instant or sorcery spell, Kiln Fiend gets +3/+0 until end of turn."
Besmirch,3.0,['Red'],['R'],None,['Sorcery'],None,Uncommon,CN2,None,None,None,"Until end of turn, gain control of target creature and it gains haste. Untap and goad that creature. (Until your next turn, that creature attacks each combat if able and attacks a player other than you if able.)"
Serum Visions,1.0,['Blue'],['U'],None,['Sorcery'],None,Uncommon,CN2,None,None,None,Draw a card. Scry 2.
Ill-Tempered Cyclops,4.0,['Red'],['R'],None,['Creature'],['Cyclops'],Common,CN2,3,3,None,"Trample\n{5}{R}: Monstrosity 3. (If this creature isn't monstrous, put three +1/+1 counters on it and it becomes monstrous.)"
Thorn of the Black Rose,4.0,['Black'],['B'],None,['Creature'],"['Human', 'Assassin']",Common,CN2,1,3,None,"Deathtouch\nWhen Thorn of the Black Rose enters the battlefield, you become the monarch."
Repulse,3.0,['Blue'],['U'],None,['Instant'],None,Common,CN2,None,None,None,Return target creature to its owner's hand.\nDraw a card.
Hurly-Burly,2.0,['Red'],['R'],None,['Sorcery'],None,Common,CN2,None,None,None,Choose one —\n• Hurly-Burly deals 1 damage to each creature without flying.\n• Hurly-Burly deals 1 damage to each creature with flying.
Smuggler Captain,4.0,['Black'],['B'],None,['Creature'],"['Human', 'Pirate']",Uncommon,CN2,2,2,None,"Draft Smuggler Captain face up.\nAs you draft a card, you may reveal it, note its name, then turn Smuggler Captain face down.\nWhen Smuggler Captain enters the battlefield, you may search your library for a card with a name you noted for cards named Smuggler Captain, reveal it, put it into your hand, then shuffle."
Omenspeaker,2.0,['Blue'],['U'],None,['Creature'],"['Human', 'Wizard']",Common,CN2,1,3,None,"When Omenspeaker enters the battlefield, scry 2. (Look at the top two cards of your library, then put any number of them on the bottom of your library and the rest on top in any order.)"
Havengul Vampire,4.0,['Red'],['R'],None,['Creature'],['Vampire'],Uncommon,CN2,2,2,None,"Whenever Havengul Vampire deals combat damage to a player, put a +1/+1 counter on it.\nWhenever another creature dies, put a +1/+1 counter on Havengul Vampire."
Sinuous Vermin,2.0,['Black'],['B'],None,['Creature'],"['Rat', 'Horror']",Common,CN2,2,2,None,"{3}{B}{B}: Monstrosity 3. (If this creature isn't monstrous, put three +1/+1 counters on it and it becomes monstrous.)\nAs long as Sinuous Vermin is monstrous, it has menace. (It can't be blocked except by two or more creatures.)"
Negate,2.0,['Blue'],['U'],None,['Instant'],None,Common,CN2,None,None,None,Counter target noncreature spell.
Hamletback Goliath,7.0,['Red'],['R'],None,['Creature'],"['Giant', 'Warrior']",Rare,CN2,6,6,None,"Whenever another creature enters the battlefield, you may put X +1/+1 counters on Hamletback Goliath, where X is that creature's power."
Regicide,1.0,['Black'],['B'],None,['Instant'],None,Common,CN2,None,None,None,"Reveal Regicide as you draft it. The player to your right chooses a color, you choose another color, then the player to your left chooses a third color.\nDestroy target creature that's one or more of the colors chosen as you drafted cards named Regicide."
Bonds of Quicksilver,4.0,['Blue'],['U'],None,['Enchantment'],['Aura'],Common,CN2,None,None,None,Flash (You may cast this spell any time you could cast an instant.)\nEnchant creature\nEnchanted creature doesn't untap during its controller's untap step.
Guttersnipe,3.0,['Red'],['R'],None,['Creature'],"['Goblin', 'Shaman']",Uncommon,CN2,2,2,None,"Whenever you cast an instant or sorcery spell, Guttersnipe deals 2 damage to each opponent."
Marchesa's Decree,4.0,['Black'],['B'],None,['Enchantment'],None,Uncommon,CN2,None,None,None,"When Marchesa's Decree enters the battlefield, you become the monarch.\nWhenever a creature attacks you or a planeswalker you control, that creature's controller loses 1 life."
Kami of the Crescent Moon,2.0,['Blue'],['U'],['Legendary'],['Creature'],['Spirit'],Rare,CN2,1,3,None,"At the beginning of each player's draw step, that player draws an additional card."
Gratuitous Violence,5.0,['Red'],['R'],None,['Enchantment'],None,Rare,CN2,None,None,None,"If a creature you control would deal damage to a permanent or player, it deals double that damage to that permanent or player instead."
Garrulous Sycophant,3.0,['Black'],['B'],None,['Creature'],"['Human', 'Advisor']",Common,CN2,1,4,None,"At the beginning of your end step, if you're the monarch, each opponent loses 1 life and you gain 1 life."
Merfolk Skyscout,4.0,['Blue'],['U'],None,['Creature'],"['Merfolk', 'Scout']",Uncommon,CN2,2,3,None,"Flying\nWhenever Merfolk Skyscout attacks or blocks, untap target permanent."
Goblin Tunneler,2.0,['Red'],['R'],None,['Creature'],"['Goblin', 'Rogue']",Common,CN2,1,1,None,{T}: Target creature with power 2 or less can't be blocked this turn.
Deadly Designs,2.0,['Black'],['B'],None,['Enchantment'],None,Uncommon,CN2,None,None,None,"{2}: Put a plot counter on Deadly Designs. Any player may activate this ability.\nWhen there are five or more plot counters on Deadly Designs, sacrifice it. If you do, destroy up to two target creatures."
Mnemonic Wall,5.0,['Blue'],['U'],None,['Creature'],['Wall'],Common,CN2,0,4,None,"Defender\nWhen Mnemonic Wall enters the battlefield, you may return target instant or sorcery card from your graveyard to your hand."
Goblin Balloon Brigade,1.0,['Red'],['R'],None,['Creature'],"['Goblin', 'Warrior']",Common,CN2,1,1,None,{R}: Goblin Balloon Brigade gains flying until end of turn.
Custodi Lich,5.0,['Black'],['B'],None,['Creature'],"['Zombie', 'Cleric']",Rare,CN2,4,2,None,"When Custodi Lich enters the battlefield, you become the monarch.\nWhenever you become the monarch, target player sacrifices a creature."
Merfolk Looter,2.0,['Blue'],['U'],None,['Creature'],"['Merfolk', 'Rogue']",Uncommon,CN2,1,1,None,"{T}: Draw a card, then discard a card."
Capital Punishment,6.0,['Black'],['B'],None,['Sorcery'],None,Rare,CN2,None,None,None,"Council's dilemma — Starting with you, each player votes for death or taxes. Each opponent sacrifices a creature for each death vote and discards a card for each taxes vote."
Into the Void,4.0,['Blue'],['U'],None,['Sorcery'],None,Uncommon,CN2,None,None,None,Return up to two target creatures to their owners' hands.
Archdemon of Paliano,4.0,['Black'],['B'],None,['Creature'],['Demon'],Rare,CN2,5,4,None,"Draft Archdemon of Paliano face up.\nAs long as Archdemon of Paliano is face up during the draft, you can't look at booster packs and must draft cards at random. After you draft three cards this way, turn Archdemon of Paliano face down. (You may look at cards as you draft them.)\nFlying"
Followed Footsteps,5.0,['Blue'],['U'],None,['Enchantment'],['Aura'],Rare,CN2,None,None,None,"Enchant creature\nAt the beginning of your upkeep, create a token that's a copy of enchanted creature."
Stunt Double,4.0,['Blue'],['U'],None,['Creature'],['Shapeshifter'],Rare,CN2,0,0,None,Flash\nYou may have Stunt Double enter the battlefield as a copy of any creature on the battlefield.
Fleeting Distraction,1.0,['Blue'],['U'],None,['Instant'],None,Common,CN2,None,None,None,Target creature gets -1/-0 until end of turn.\nDraw a card.
Spire Phantasm,4.0,['Blue'],['U'],None,['Creature'],"['Gargoyle', 'Illusion']",Uncommon,CN2,3,2,None,"Reveal Spire Phantasm as you draft it. The next time a player drafts a card from this booster pack, guess that card's name. Then that player reveals the drafted card.\nFlying\nWhen Spire Phantasm enters the battlefield, if you guessed correctly for a card named Spire Phantasm, draw a card."
Desertion,5.0,['Blue'],['U'],None,['Instant'],None,Rare,CN2,None,None,None,"Counter target spell. If an artifact or creature spell is countered this way, put that card onto the battlefield under your control instead of into its owner's graveyard."
Divination,3.0,['Blue'],['U'],None,['Sorcery'],None,Common,CN2,None,None,None,Draw two cards.
Skittering Crustacean,3.0,['Blue'],['U'],None,['Creature'],['Crab'],Common,CN2,2,3,None,"{6}{U}: Monstrosity 4. (If this creature isn't monstrous, put four +1/+1 counters on it and it becomes monstrous.)\nAs long as Skittering Crustacean is monstrous, it has hexproof. (It can't be the target of spells or abilities your opponents control.)"
Dismiss,4.0,['Blue'],['U'],None,['Instant'],None,Uncommon,CN2,None,None,None,Counter target spell.\nDraw a card.
Caller of Gales,1.0,['Blue'],['U'],None,['Creature'],"['Merfolk', 'Wizard']",Common,CN2,1,1,None,"{1}{U}, {T}: Target creature gains flying until end of turn."
Messenger Jays,5.0,['Blue'],['U'],None,['Creature'],['Bird'],Common,CN2,2,1,None,"Flying\nCouncil's dilemma — When Messenger Jays enters the battlefield, starting with you, each player votes for feather or quill. Put a +1/+1 counter on Messenger Jays for each feather vote and draw a card for each quill vote. For each card drawn this way, discard a card."
Zealous Strike,2.0,['White'],['W'],None,['Instant'],None,Common,CN2,None,None,None,Target creature gets +2/+2 and gains first strike until end of turn.
Deceiver Exarch,3.0,['Blue'],['U'],None,['Creature'],"['Phyrexian', 'Cleric']",Uncommon,CN2,1,4,None,"Flash (You may cast this spell any time you could cast an instant.)\nWhen Deceiver Exarch enters the battlefield, choose one —\n• Untap target permanent you control.\n• Tap target permanent an opponent controls."
Shimmering Grotto,0.0,None,None,None,['Land'],None,Uncommon,CN2,None,None,None,"{T}: Add {C}.\n{1}, {T}: Add one mana of any color."
Covenant of Minds,5.0,['Blue'],['U'],None,['Sorcery'],None,Rare,CN2,None,None,None,"Reveal the top three cards of your library. Target opponent may choose to put those cards into your hand. If they don't, put those cards into your graveyard and draw five cards."
Gang of Devils,6.0,['Red'],['R'],None,['Creature'],['Devil'],Uncommon,CN2,3,3,None,"When Gang of Devils dies, it deals 3 damage divided as you choose among one, two, or three targets."
Rogue's Passage,0.0,None,None,None,['Land'],None,Uncommon,CN2,None,None,None,"{T}: Add {C}.\n{4}, {T}: Target creature can't be blocked this turn."
Cloaked Siren,4.0,['Blue'],['U'],None,['Creature'],['Siren'],Common,CN2,3,2,None,Flash (You may cast this spell any time you could cast an instant.)\nFlying
Exotic Orchard,0.0,None,None,None,['Land'],None,Rare,CN2,None,None,None,{T}: Add one mana of any color that a land an opponent controls could produce.
Keeper of Keys,5.0,['Blue'],['U'],None,['Creature'],"['Human', 'Rogue', 'Mutant']",Rare,CN2,4,4,None,"When Keeper of Keys enters the battlefield, you become the monarch.\nAt the beginning of your upkeep, if you're the monarch, creatures you control can't be blocked this turn."
Windborne Charge,4.0,['White'],['W'],None,['Sorcery'],None,Uncommon,CN2,None,None,None,Two target creatures you control each get +2/+2 and gain flying until end of turn.
Evolving Wilds,0.0,None,None,None,['Land'],None,Common,CN2,None,None,None,"{T}, Sacrifice Evolving Wilds: Search your library for a basic land card, put it onto the battlefield tapped, then shuffle."
Wild Griffin,3.0,['White'],['W'],None,['Creature'],['Griffin'],Common,CN2,2,2,None,Flying
Dread Statuary,0.0,None,None,None,['Land'],None,Uncommon,CN2,None,None,None,{T}: Add {C}.\n{4}: Dread Statuary becomes a 4/2 Golem artifact creature until end of turn. It's still a land.
Spirit of the Hearth,6.0,['White'],['W'],None,['Creature'],"['Cat', 'Spirit']",Rare,CN2,4,5,None,Flying\nYou have hexproof. (You can't be the target of spells or abilities your opponents control.)
Jeering Homunculus,2.0,['Blue'],['U'],None,['Creature'],['Homunculus'],Common,CN2,0,4,None,"When Jeering Homunculus enters the battlefield, you may goad target creature. (Until your next turn, that creature attacks each combat if able and attacks a player other than you if able.)"
Reviving Dose,3.0,['White'],['W'],None,['Instant'],None,Common,CN2,None,None,None,You gain 3 life.\nDraw a card.
Duskmantle Seer,4.0,"['Black', 'Blue']","['B', 'U']",None,['Creature'],"['Vampire', 'Wizard']",Rare,CN2,4,4,None,"Flying\nAt the beginning of your upkeep, each player reveals the top card of their library, loses life equal to that card's mana value, then puts it into their hand."
Illusionary Informant,2.0,['Blue'],['U'],None,['Creature'],"['Bird', 'Illusion']",Common,CN2,1,3,None,"Draft Illusionary Informant face up.\nDuring the draft, you may turn Illusionary Informant face down. If you do, look at the next card drafted by a player of your choice.\nFlying"
Opaline Unicorn,3.0,None,None,None,"['Artifact', 'Creature']",['Unicorn'],Common,CN2,1,2,None,{T}: Add one mana of any color.
Illusion of Choice,1.0,['Blue'],['U'],None,['Instant'],None,Uncommon,CN2,None,None,None,You choose how each player votes this turn.\nDraw a card.
Psychosis Crawler,5.0,None,None,None,"['Artifact', 'Creature']","['Phyrexian', 'Horror']",Rare,CN2,*,*,None,"Psychosis Crawler's power and toughness are each equal to the number of cards in your hand.\nWhenever you draw a card, each opponent loses 1 life."
Runed Servitor,2.0,None,None,None,"['Artifact', 'Creature']",['Construct'],Uncommon,CN2,2,2,None,"When Runed Servitor dies, each player draws a card."
Raise the Alarm,2.0,['White'],['W'],None,['Instant'],None,Common,CN2,None,None,None,Create two 1/1 white Soldier creature tokens.
Platinum Angel,7.0,None,None,None,"['Artifact', 'Creature']",['Angel'],Mythic,CN2,4,4,None,Flying\nYou can't lose the game and your opponents can't win the game.
Pariah,3.0,['White'],['W'],None,['Enchantment'],['Aura'],Rare,CN2,None,None,None,Enchant creature\nAll damage that would be dealt to you is dealt to enchanted creature instead.
Kitesail,2.0,None,None,None,['Artifact'],['Equipment'],Common,CN2,None,None,None,Equipped creature gets +1/+0 and has flying.\nEquip {2} ({2}: Attach to target creature you control. Equip only as a sorcery.)
Flame Slash,1.0,['Red'],['R'],None,['Sorcery'],None,Common,CN2,None,None,None,Flame Slash deals 4 damage to target creature.
Horn of Greed,3.0,None,None,None,['Artifact'],None,Rare,CN2,None,None,None,"Whenever a player plays a land, that player draws a card."
Kill Shot,3.0,['White'],['W'],None,['Instant'],None,Common,CN2,None,None,None,Destroy target attacking creature.
Hexplate Golem,7.0,None,None,None,"['Artifact', 'Creature']",['Golem'],Common,CN2,5,7,None,None
Hundred-Handed One,4.0,['White'],['W'],None,['Creature'],['Giant'],Rare,CN2,3,5,None,"Vigilance\n{3}{W}{W}{W}: Monstrosity 3. (If this creature isn't monstrous, put three +1/+1 counters on it and it becomes monstrous.)\nAs long as Hundred-Handed One is monstrous, it has reach and can block an additional ninety-nine creatures each combat."
Stormchaser Chimera,4.0,"['Red', 'Blue']","['R', 'U']",None,['Creature'],['Chimera'],Uncommon,CN2,2,3,None,"Flying\n{2}{U}{R}: Scry 1, then reveal the top card of your library. Stormchaser Chimera gets +X/+0 until end of turn, where X is that card's mana value. (To scry 1, look at the top card of your library, then you may put that card on the bottom of your library.)"
Hollowhenge Spirit,4.0,['White'],['W'],None,['Creature'],['Spirit'],Uncommon,CN2,2,2,None,"Flash (You may cast this spell any time you could cast an instant.)\nFlying\nWhen Hollowhenge Spirit enters the battlefield, remove target attacking or blocking creature from combat."
Fiery Fall,6.0,['Red'],['R'],None,['Instant'],None,Common,CN2,None,None,None,"Fiery Fall deals 5 damage to target creature.\nBasic landcycling {1}{R} ({1}{R}, Discard this card: Search your library for a basic land card, reveal it, put it into your hand, then shuffle.)"
Hedron Matrix,4.0,None,None,None,['Artifact'],['Equipment'],Rare,CN2,None,None,None,"Equipped creature gets +X/+X, where X is its mana value.\nEquip {4}"
Hallowed Burial,5.0,['White'],['W'],None,['Sorcery'],None,Rare,CN2,None,None,None,Put all creatures on the bottom of their owners' libraries.
Bronze Sable,2.0,None,None,None,"['Artifact', 'Creature']",['Sable'],Common,CN2,2,1,None,None
Hail of Arrows,1.0,['White'],['W'],None,['Instant'],None,Uncommon,CN2,None,None,None,Hail of Arrows deals X damage divided as you choose among any number of target attacking creatures.
Gruul War Chant,4.0,"['Green', 'Red']","['G', 'R']",None,['Enchantment'],None,Uncommon,CN2,None,None,None,Attacking creatures you control get +1/+0 and have menace.
Guardian of the Gateless,5.0,['White'],['W'],None,['Creature'],['Angel'],Uncommon,CN2,3,3,None,"Flying\nGuardian of the Gateless can block any number of creatures.\nWhenever Guardian of the Gateless blocks, it gets +1/+1 until end of turn for each creature it's blocking."
Dragonlair Spider,6.0,"['Green', 'Red']","['G', 'R']",None,['Creature'],['Spider'],Rare,CN2,5,6,None,"Reach\nWhenever an opponent casts a spell, create a 1/1 green Insect creature token."
Gods Willing,1.0,['White'],['W'],None,['Instant'],None,Common,CN2,None,None,None,"Target creature you control gains protection from the color of your choice until end of turn. (It can't be blocked, targeted, dealt damage, enchanted, or equipped by anything of that color.)\nScry 1."
Shipwreck Singer,2.0,"['Black', 'Blue']","['B', 'U']",None,['Creature'],['Siren'],Uncommon,CN2,1,2,None,"Flying\n{1}{U}: Target creature an opponent controls attacks this turn if able.\n{1}{B}, {T}: Attacking creatures get -1/-1 until end of turn."
Pharika's Mender,5.0,"['Black', 'Green']","['B', 'G']",None,['Creature'],['Gorgon'],Uncommon,CN2,4,3,None,"When Pharika's Mender enters the battlefield, you may return target creature or enchantment card from your graveyard to your hand."
Gleam of Resistance,5.0,['White'],['W'],None,['Instant'],None,Common,CN2,None,None,None,"Creatures you control get +1/+2 until end of turn. Untap those creatures.\nBasic landcycling {1}{W} ({1}{W}, Discard this card: Search your library for a basic land card, reveal it, put it into your hand, then shuffle.)"
