Name,CMC,Colors,Color identity,Supertypes,Types,Subtypes,Rarity,Set,Power,Toughness,Loyalty,Text
Courser of Kruphix,3.0,['Green'],['G'],None,"['Enchantment', 'Creature']",['Centaur'],Rare,CP2,2,4,None,"Play with the top card of your library revealed.\nYou may play lands from the top of your library.\nWhenever a land enters the battlefield under your control, you gain 1 life."
Whip of Erebos,4.0,['Black'],['B'],['Legendary'],"['Enchantment', 'Artifact']",None,Rare,CP2,None,None,None,"Creatures you control have lifelink.\n{2}{B}{B}, {T}: Return target creature card from your graveyard to the battlefield. It gains haste. Exile it at the beginning of the next end step. If it would leave the battlefield, exile it instead of putting it anywhere else. Activate only as a sorcery."
Reaper of the Wilds,4.0,"['Black', 'Green']","['B', 'G']",None,['Creature'],['Gorgon'],Rare,CP2,4,5,None,"Whenever another creature dies, scry 1. (Look at the top card of your library. You may put that card on the bottom of your library.)\n{B}: Reaper of the Wilds gains deathtouch until end of turn.\n{1}{G}: Reaper of the Wilds gains hexproof until end of turn."
Hero's Downfall,3.0,['Black'],['B'],None,['Instant'],None,Rare,CP2,None,None,None,Destroy target creature or planeswalker.
Sultai Ascendancy,3.0,"['Black', 'Green', 'Blue']","['B', 'G', 'U']",None,['Enchantment'],None,Rare,CP2,None,None,None,"At the beginning of your upkeep, look at the top two cards of your library. Put any number of them into your graveyard and the rest back on top of your library in any order."
Necropolis Fiend,9.0,['Black'],['B'],None,['Creature'],['Demon'],Rare,CP2,4,5,None,"Delve (Each card you exile from your graveyard while casting this spell pays for {1}.)\nFlying\n{X}, {T}, Exile X cards from your graveyard: Target creature gets -X/-X until end of turn."
