Name,CMC,Colors,Color identity,Supertypes,Types,Subtypes,Rarity,Set,Power,Toughness,Loyalty,Text
Firemane Angel,6.0,"['Red', 'White']","['R', 'W']",None,['Creature'],['Angel'],Rare,DDH,4,3,None,"Flying, first strike\nAt the beginning of your upkeep, if Firemane Angel is in your graveyard or on the battlefield, you may gain 1 life.\n{6}{R}{R}{W}{W}: Return Firemane Angel from your graveyard to the battlefield. Activate only during your upkeep."
Nacatl Hunt-Pride,6.0,['White'],"['G', 'R', 'W']",None,['Creature'],"['Cat', 'Warrior']",Uncommon,DDH,5,4,None,"Vigilance\n{R}, {T}: Target creature can't block this turn.\n{G}, {T}: Target creature blocks this turn if able."
Pride of Lions,5.0,['Green'],['G'],None,['Creature'],['Cat'],Uncommon,DDH,4,4,None,You may have Pride of Lions assign its combat damage as though it weren't blocked.
Ageless Entity,5.0,['Green'],['G'],None,['Creature'],['Elemental'],Rare,DDH,4,4,None,"Whenever you gain life, put that many +1/+1 counters on Ageless Entity."
Kird Ape,1.0,['Red'],['R'],None,['Creature'],['Ape'],Uncommon,DDH,1,1,None,Kird Ape gets +1/+2 as long as you control a Forest.
Briarhorn,4.0,['Green'],['G'],None,['Creature'],['Elemental'],Uncommon,DDH,3,3,None,"Flash\nWhen Briarhorn enters the battlefield, target creature gets +3/+3 until end of turn.\nEvoke {1}{G} (You may cast this spell for its evoke cost. If you do, it's sacrificed when it enters the battlefield.)"
Spitemare,4.0,"['Red', 'White']","['R', 'W']",None,['Creature'],['Elemental'],Uncommon,DDH,3,3,None,"Whenever Spitemare is dealt damage, it deals that much damage to any target."
Marisi's Twinclaws,4.0,"['Green', 'Red', 'White']","['G', 'R', 'W']",None,['Creature'],"['Cat', 'Warrior']",Uncommon,DDH,2,4,None,Double strike
Loxodon Hierarch,4.0,"['Green', 'White']","['G', 'W']",None,['Creature'],"['Elephant', 'Cleric']",Rare,DDH,4,4,None,"When Loxodon Hierarch enters the battlefield, you gain 4 life.\n{G}{W}, Sacrifice Loxodon Hierarch: Regenerate each creature you control."
Woolly Thoctar,3.0,"['Green', 'Red', 'White']","['G', 'R', 'W']",None,['Creature'],['Beast'],Uncommon,DDH,5,4,None,None
Fleetfoot Panther,3.0,"['Green', 'White']","['G', 'W']",None,['Creature'],['Cat'],Uncommon,DDH,3,4,None,"Flash\nWhen Fleetfoot Panther enters the battlefield, return a green or white creature you control to its owner's hand."
Grazing Gladehart,3.0,['Green'],['G'],None,['Creature'],['Antelope'],Common,DDH,2,2,None,"Landfall — Whenever a land enters the battlefield under your control, you may gain 2 life."
Jade Mage,2.0,['Green'],['G'],None,['Creature'],"['Human', 'Shaman']",Uncommon,DDH,2,1,None,{2}{G}: Create a 1/1 green Saproling creature token.
Qasali Pridemage,2.0,"['Green', 'White']","['G', 'W']",None,['Creature'],"['Cat', 'Wizard']",Common,DDH,2,2,None,"Exalted (Whenever a creature you control attacks alone, that creature gets +1/+1 until end of turn.)\n{1}, Sacrifice Qasali Pridemage: Destroy target artifact or enchantment."
Ajani's Pridemate,2.0,['White'],['W'],None,['Creature'],"['Cat', 'Soldier']",Uncommon,DDH,2,2,None,"Whenever you gain life, put a +1/+1 counter on Ajani's Pridemate."
Sylvan Ranger,2.0,['Green'],['G'],None,['Creature'],"['Elf', 'Scout', 'Ranger']",Common,DDH,1,1,None,"When Sylvan Ranger enters the battlefield, you may search your library for a basic land card, reveal it, put it into your hand, then shuffle."
Essence Warden,1.0,['Green'],['G'],None,['Creature'],"['Elf', 'Shaman']",Common,DDH,1,1,None,"Whenever another creature enters the battlefield, you gain 1 life."
Ajani Vengeant,4.0,"['Red', 'White']","['R', 'W']",['Legendary'],['Planeswalker'],['Ajani'],Mythic,DDH,None,None,3,[+1]: Target permanent doesn't untap during its controller's next untap step.\n[−2]: Ajani Vengeant deals 3 damage to any target and you gain 3 life.\n[−7]: Destroy all lands target player controls.
Canyon Wildcat,2.0,['Red'],['R'],None,['Creature'],['Cat'],Common,DDH,2,1,None,Mountainwalk (This creature can't be blocked as long as defending player controls a Mountain.)
Loam Lion,1.0,['White'],['W'],None,['Creature'],['Cat'],Uncommon,DDH,1,1,None,Loam Lion gets +1/+2 as long as you control a Forest.
Wild Nacatl,1.0,['Green'],['G'],None,['Creature'],"['Cat', 'Warrior']",Common,DDH,1,1,None,Wild Nacatl gets +1/+1 as long as you control a Mountain.\nWild Nacatl gets +1/+1 as long as you control a Plains.
Island,0.0,None,['U'],['Basic'],['Land'],['Island'],Common,DDH,None,None,None,({T}: Add {U}.)
Swamp,0.0,None,['B'],['Basic'],['Land'],['Swamp'],Common,DDH,None,None,None,({T}: Add {B}.)
Swamp,0.0,None,['B'],['Basic'],['Land'],['Swamp'],Common,DDH,None,None,None,({T}: Add {B}.)
Mountain,0.0,None,['R'],['Basic'],['Land'],['Mountain'],Common,DDH,None,None,None,({T}: Add {R}.)
Terramorphic Expanse,0.0,None,None,None,['Land'],None,Common,DDH,None,None,None,"{T}, Sacrifice Terramorphic Expanse: Search your library for a basic land card, put it onto the battlefield tapped, then shuffle."
Rupture Spire,0.0,None,None,None,['Land'],None,Common,DDH,None,None,None,"Rupture Spire enters the battlefield tapped.\nWhen Rupture Spire enters the battlefield, sacrifice it unless you pay {1}.\n{T}: Add one mana of any color."
Crumbling Necropolis,0.0,None,"['B', 'R', 'U']",None,['Land'],None,Uncommon,DDH,None,None,None,"Crumbling Necropolis enters the battlefield tapped.\n{T}: Add {U}, {B}, or {R}."
Ogre Savant,5.0,['Red'],"['R', 'U']",None,['Creature'],"['Ogre', 'Wizard']",Common,DDH,3,2,None,"When Ogre Savant enters the battlefield, if {U} was spent to cast it, return target creature to its owner's hand."
Countersquall,2.0,"['Black', 'Blue']","['B', 'U']",None,['Instant'],None,Uncommon,DDH,None,None,None,Counter target noncreature spell. Its controller loses 2 life.
Rise // Fall,4.0,"['Blue', 'Black']","['B', 'R', 'U']",None,['Sorcery'],None,Uncommon,DDH,None,None,None,Return target creature card from a graveyard and target creature on the battlefield to their owners' hands.
Vapor Snag,1.0,['Blue'],['U'],None,['Instant'],None,Common,DDH,None,None,None,Return target creature to its owner's hand. Its controller loses 1 life.
Lead the Stampede,3.0,['Green'],['G'],None,['Sorcery'],None,Uncommon,DDH,None,None,None,Look at the top five cards of your library. You may reveal any number of creature cards from among them and put the revealed cards into your hand. Put the rest on the bottom of your library in any order.
Lightning Helix,2.0,"['Red', 'White']","['R', 'W']",None,['Instant'],None,Uncommon,DDH,None,None,None,Lightning Helix deals 3 damage to any target and you gain 3 life.
Pain // Suffering,5.0,['Black'],"['B', 'R']",None,['Sorcery'],None,Uncommon,DDH,None,None,None,Target player discards a card.
Igneous Pouncer,6.0,"['Black', 'Red']","['B', 'R']",None,['Creature'],['Elemental'],Common,DDH,5,1,None,"Haste\nSwampcycling {2}, mountaincycling {2} ({2}, Discard this card: Search your library for a Swamp or Mountain card, reveal it, put it into your hand, then shuffle.)"
Griffin Guide,3.0,['White'],['W'],None,['Enchantment'],['Aura'],Uncommon,DDH,None,None,None,"Enchant creature\nEnchanted creature gets +2/+2 and has flying.\nWhen enchanted creature dies, create a 2/2 white Griffin creature token with flying."
Spite // Malice,8.0,['Blue'],"['B', 'U']",None,['Instant'],None,Uncommon,DDH,None,None,None,Counter target noncreature spell.
Profane Command,2.0,['Black'],['B'],None,['Sorcery'],None,Rare,DDH,None,None,None,Choose two —\n• Target player loses X life.\n• Return target creature card with mana value X or less from your graveyard to the battlefield.\n• Target creature gets -X/-X until end of turn.\n• Up to X target creatures gain fear until end of turn. (They can't be blocked except by artifact creatures and/or black creatures.)
Cruel Ultimatum,7.0,"['Black', 'Red', 'Blue']","['B', 'R', 'U']",None,['Sorcery'],None,Rare,DDH,None,None,None,"Target opponent sacrifices a creature, discards three cards, then loses 5 life. You return a creature card from your graveyard to your hand, draw three cards, then gain 5 life."
Shriekmaw,5.0,['Black'],['B'],None,['Creature'],['Elemental'],Uncommon,DDH,3,2,None,"Fear (This creature can't be blocked except by artifact creatures and/or black creatures.)\nWhen Shriekmaw enters the battlefield, destroy target nonartifact, nonblack creature.\nEvoke {1}{B} (You may cast this spell for its evoke cost. If you do, it's sacrificed when it enters the battlefield.)"
Elder Mastery,6.0,"['Black', 'Red', 'Blue']","['B', 'R', 'U']",None,['Enchantment'],['Aura'],Uncommon,DDH,None,None,None,"Enchant creature\nEnchanted creature gets +3/+3 and has flying.\nWhenever enchanted creature deals damage to a player, that player discards two cards."
Fire-Field Ogre,4.0,"['Black', 'Red', 'Blue']","['B', 'R', 'U']",None,['Creature'],"['Ogre', 'Mutant']",Uncommon,DDH,4,2,None,First strike\nUnearth {U}{B}{R} ({U}{B}{R}: Return this card from your graveyard to the battlefield. It gains haste. Exile it at the beginning of the next end step or if it would leave the battlefield. Unearth only as a sorcery.)
Blazing Specter,4.0,"['Black', 'Red']","['B', 'R']",None,['Creature'],['Specter'],Rare,DDH,2,2,None,"Flying, haste\nWhenever Blazing Specter deals combat damage to a player, that player discards a card."
Moroii,4.0,"['Black', 'Blue']","['B', 'U']",None,['Creature'],['Vampire'],Uncommon,DDH,4,4,None,"Flying\nAt the beginning of your upkeep, you lose 1 life."
Slave of Bolas,5.0,"['Black', 'Red', 'Blue']","['B', 'R', 'U']",None,['Sorcery'],None,Uncommon,DDH,None,None,None,Gain control of target creature. Untap that creature. It gains haste until end of turn. Sacrifice it at the beginning of the next end step.
Steamcore Weird,4.0,['Blue'],"['R', 'U']",None,['Creature'],['Weird'],Common,DDH,1,3,None,"When Steamcore Weird enters the battlefield, if {R} was spent to cast it, it deals 2 damage to any target."
Dimir Cutpurse,3.0,"['Black', 'Blue']","['B', 'U']",None,['Creature'],['Spirit'],Rare,DDH,2,2,None,"Whenever Dimir Cutpurse deals combat damage to a player, that player discards a card and you draw a card."
Agonizing Demise,4.0,['Black'],"['B', 'R']",None,['Instant'],None,Common,DDH,None,None,None,"Kicker {1}{R} (You may pay an additional {1}{R} as you cast this spell.)\nDestroy target nonblack creature. It can't be regenerated. If this spell was kicked, Agonizing Demise deals damage equal to that creature's power to the creature's controller."
Hellfire Mongrel,3.0,['Red'],['R'],None,['Creature'],"['Elemental', 'Dog']",Uncommon,DDH,2,2,None,"At the beginning of each opponent's upkeep, if that player has two or fewer cards in hand, Hellfire Mongrel deals 2 damage to that player."
Deep Analysis,4.0,['Blue'],['U'],None,['Sorcery'],None,Uncommon,DDH,None,None,None,"Target player draws two cards.\nFlashback—{1}{U}, Pay 3 life. (You may cast this card from your graveyard for its flashback cost. Then exile it.)"
Morgue Toad,3.0,['Black'],"['B', 'R', 'U']",None,['Creature'],['Frog'],Common,DDH,2,2,None,Sacrifice Morgue Toad: Add {U}{R}.
Icy Manipulator,4.0,None,None,None,['Artifact'],None,Uncommon,DDH,None,None,None,"{1}, {T}: Tap target artifact, creature, or land."
Brackwater Elemental,3.0,['Blue'],['U'],None,['Creature'],['Elemental'],Common,DDH,4,4,None,"When Brackwater Elemental attacks or blocks, sacrifice it at the beginning of the next end step.\nUnearth {2}{U} ({2}{U}: Return this card from your graveyard to the battlefield. It gains haste. Exile it at the beginning of the next end step or if it would leave the battlefield. Unearth only as a sorcery.)"
Grixis Charm,3.0,"['Black', 'Red', 'Blue']","['B', 'R', 'U']",None,['Instant'],None,Uncommon,DDH,None,None,None,Choose one —\n• Return target permanent to its owner's hand.\n• Target creature gets -4/-4 until end of turn.\n• Creatures you control get +2/+0 until end of turn.
Slavering Nulls,2.0,['Red'],['R'],None,['Creature'],"['Goblin', 'Zombie']",Uncommon,DDH,2,1,None,"Whenever Slavering Nulls deals combat damage to a player, if you control a Swamp, you may have that player discard a card."
Undermine,3.0,"['Black', 'Blue']","['B', 'U']",None,['Instant'],None,Rare,DDH,None,None,None,Counter target spell. Its controller loses 3 life.
Nightscape Familiar,2.0,['Black'],['B'],None,['Creature'],['Zombie'],Common,DDH,1,1,None,Blue spells and red spells you cast cost {1} less to cast.\n{1}{B}: Regenerate Nightscape Familiar.
Surveilling Sprite,2.0,['Blue'],['U'],None,['Creature'],"['Faerie', 'Rogue']",Common,DDH,1,1,None,"Flying\nWhen Surveilling Sprite dies, you may draw a card."
"Nicol Bolas, Planeswalker",8.0,"['Black', 'Red', 'Blue']","['B', 'R', 'U']",['Legendary'],['Planeswalker'],['Bolas'],Mythic,DDH,None,None,5,"[+3]: Destroy target noncreature permanent.\n[−2]: Gain control of target creature.\n[−9]: Nicol Bolas, Planeswalker deals 7 damage to target player or planeswalker. That player or that planeswalker's controller discards seven cards, then sacrifices seven permanents."
Mountain,0.0,None,['R'],['Basic'],['Land'],['Mountain'],Common,DDH,None,None,None,({T}: Add {R}.)
Plains,0.0,None,['W'],['Basic'],['Land'],['Plains'],Common,DDH,None,None,None,({T}: Add {W}.)
Forest,0.0,None,['G'],['Basic'],['Land'],['Forest'],Common,DDH,None,None,None,({T}: Add {G}.)
Forest,0.0,None,['G'],['Basic'],['Land'],['Forest'],Common,DDH,None,None,None,({T}: Add {G}.)
"Vitu-Ghazi, the City-Tree",0.0,None,"['G', 'W']",None,['Land'],None,Uncommon,DDH,None,None,None,"{T}: Add {C}.\n{2}{G}{W}, {T}: Create a 1/1 green Saproling creature token."
Sapseep Forest,0.0,None,['G'],None,['Land'],['Forest'],Uncommon,DDH,None,None,None,"({T}: Add {G}.)\nSapseep Forest enters the battlefield tapped.\n{G}, {T}: You gain 1 life. Activate only if you control two or more green permanents."
Recoil,3.0,"['Black', 'Blue']","['B', 'U']",None,['Instant'],None,Common,DDH,None,None,None,Return target permanent to its owner's hand. Then that player discards a card.
Kazandu Refuge,0.0,None,"['G', 'R']",None,['Land'],None,Uncommon,DDH,None,None,None,"Kazandu Refuge enters the battlefield tapped.\nWhen Kazandu Refuge enters the battlefield, you gain 1 life.\n{T}: Add {R} or {G}."
Jungle Shrine,0.0,None,"['G', 'R', 'W']",None,['Land'],None,Uncommon,DDH,None,None,None,"Jungle Shrine enters the battlefield tapped.\n{T}: Add {R}, {G}, or {W}."
Graypelt Refuge,0.0,None,"['G', 'W']",None,['Land'],None,Uncommon,DDH,None,None,None,"Graypelt Refuge enters the battlefield tapped.\nWhen Graypelt Refuge enters the battlefield, you gain 1 life.\n{T}: Add {G} or {W}."
Obelisk of Grixis,3.0,None,"['B', 'R', 'U']",None,['Artifact'],None,Common,DDH,None,None,None,"{T}: Add {U}, {B}, or {R}."
Evolving Wilds,0.0,None,None,None,['Land'],None,Common,DDH,None,None,None,"{T}, Sacrifice Evolving Wilds: Search your library for a basic land card, put it onto the battlefield tapped, then shuffle."
Titanic Ultimatum,7.0,"['Green', 'Red', 'White']","['G', 'R', 'W']",None,['Sorcery'],None,Rare,DDH,None,None,None,"Until end of turn, creatures you control get +5/+5 and gain first strike, trample, and lifelink."
Sylvan Bounty,6.0,['Green'],['G'],None,['Instant'],None,Common,DDH,None,None,None,"Target player gains 8 life.\nBasic landcycling {1}{G} ({1}{G}, Discard this card: Search your library for a basic land card, reveal it, put it into your hand, then shuffle.)"
Naya Charm,3.0,"['Green', 'Red', 'White']","['G', 'R', 'W']",None,['Instant'],None,Uncommon,DDH,None,None,None,Choose one —\n• Naya Charm deals 3 damage to target creature.\n• Return target card from a graveyard to its owner's hand.\n• Tap all creatures target player controls.
Behemoth Sledge,3.0,"['Green', 'White']","['G', 'W']",None,['Artifact'],['Equipment'],Uncommon,DDH,None,None,None,Equipped creature gets +2/+2 and has trample and lifelink.\nEquip {3}
Searing Meditation,3.0,"['Red', 'White']","['R', 'W']",None,['Enchantment'],None,Rare,DDH,None,None,None,"Whenever you gain life, you may pay {2}. If you do, Searing Meditation deals 2 damage to any target."
Recumbent Bliss,3.0,['White'],['W'],None,['Enchantment'],['Aura'],Common,DDH,None,None,None,"Enchant creature\nEnchanted creature can't attack or block.\nAt the beginning of your upkeep, you may gain 1 life."
Ajani's Mantra,2.0,['White'],['W'],None,['Enchantment'],None,Common,DDH,None,None,None,"At the beginning of your upkeep, you may gain 1 life."
Jhessian Zombies,6.0,"['Black', 'Blue']","['B', 'U']",None,['Creature'],['Zombie'],Common,DDH,2,4,None,"Fear (This creature can't be blocked except by artifact creatures and/or black creatures.)\nIslandcycling {2}, swampcycling {2} ({2}, Discard this card: Search your library for an Island or Swamp card, reveal it, put it into your hand, then shuffle.)"
