Name,CMC,Colors,Color identity,Supertypes,Types,Subtypes,Rarity,Set,Power,Toughness,Loyalty,Text
Coalition Honor Guard,4.0,['White'],['W'],None,['Creature'],"['Human', 'Flagbearer']",Common,EMA,2,4,None,"While an opponent is choosing targets as part of casting a spell they control or activating an ability they control, that player must choose at least one Flagbearer on the battlefield if able."
Price of Progress,2.0,['Red'],['R'],None,['Instant'],None,Uncommon,EMA,None,None,None,Price of Progress deals damage to each player equal to twice the number of nonbasic lands that player controls.
Lys Alana Scarblade,3.0,['Black'],['B'],None,['Creature'],"['Elf', 'Assassin']",Uncommon,EMA,1,1,None,"{T}, Discard an Elf card: Target creature gets -X/-X until end of turn, where X is the number of Elves you control."
Honden of Night's Reach,4.0,['Black'],['B'],['Legendary'],['Enchantment'],['Shrine'],Uncommon,EMA,None,None,None,"At the beginning of your upkeep, target opponent discards a card for each Shrine you control."
Phyrexian Gargantua,6.0,['Black'],['B'],None,['Creature'],"['Phyrexian', 'Horror']",Uncommon,EMA,4,4,None,"When Phyrexian Gargantua enters the battlefield, you draw two cards and you lose 2 life."
Havoc Demon,7.0,['Black'],['B'],None,['Creature'],['Demon'],Uncommon,EMA,5,5,None,"Flying\nWhen Havoc Demon dies, all creatures get -5/-5 until end of turn."
Carrion Feeder,1.0,['Black'],['B'],None,['Creature'],['Zombie'],Common,EMA,1,1,None,Carrion Feeder can't block.\nSacrifice a creature: Put a +1/+1 counter on Carrion Feeder.
Orcish Oriflamme,4.0,['Red'],['R'],None,['Enchantment'],None,Common,EMA,None,None,None,Attacking creatures you control get +1/+0.
Elite Vanguard,1.0,['White'],['W'],None,['Creature'],"['Human', 'Soldier']",Common,EMA,2,1,None,None
Eight-and-a-Half-Tails,2.0,['White'],['W'],['Legendary'],['Creature'],"['Fox', 'Cleric']",Rare,EMA,2,2,None,{1}{W}: Target permanent you control gains protection from white until end of turn.\n{1}: Target spell or permanent becomes white until end of turn.
