Name,CMC,Colors,Color identity,Supertypes,Types,Subtypes,Rarity,Set,Power,Toughness,Loyalty,Text
Aven Mindcensor,3.0,['White'],['W'],None,['Creature'],"['Bird', 'Wizard']",Uncommon,FUT,2,1,None,"Flash\nFlying\nIf an opponent would search a library, that player searches the top four cards of that library instead."
Yixlid Jailer,2.0,['Black'],['B'],None,['Creature'],"['Zombie', 'Wizard']",Uncommon,FUT,2,1,None,Cards in graveyards lose all abilities.
Blade of the Sixth Pride,2.0,['White'],['W'],None,['Creature'],"['Cat', 'Rebel']",Common,FUT,3,1,None,None
Bogardan Lancer,2.0,['Red'],['R'],None,['Creature'],"['Human', 'Knight']",Common,FUT,1,1,None,"Bloodthirst 1 (If an opponent was dealt damage this turn, this creature enters the battlefield with a +1/+1 counter on it.)\nFlanking (Whenever a creature without flanking blocks this creature, the blocking creature gets -1/-1 until end of turn.)"
Arc Blade,5.0,['Red'],['R'],None,['Sorcery'],None,Uncommon,FUT,None,None,None,"Arc Blade deals 2 damage to any target. Exile Arc Blade with three time counters on it.\nSuspend 3—{2}{R} (Rather than cast this card from your hand, you may pay {2}{R} and exile it with three time counters on it. At the beginning of your upkeep, remove a time counter. When the last is removed, cast it without paying its mana cost.)"
Gift of Granite,1.0,['White'],['W'],None,['Enchantment'],['Aura'],Common,FUT,None,None,None,Flash (You may cast this spell any time you could cast an instant.)\nEnchant creature\nEnchanted creature gets +0/+2.
Lost Auramancers,4.0,['White'],['W'],None,['Creature'],"['Human', 'Wizard']",Uncommon,FUT,3,3,None,"Vanishing 3 (This creature enters the battlefield with three time counters on it. At the beginning of your upkeep, remove a time counter from it. When the last is removed, sacrifice it.)\nWhen Lost Auramancers dies, if it had no time counters on it, you may search your library for an enchantment card, put it onto the battlefield, then shuffle."
Petrified Plating,3.0,['Green'],['G'],None,['Enchantment'],['Aura'],Common,FUT,None,None,None,"Enchant creature\nEnchanted creature gets +2/+2.\nSuspend 2—{G} (Rather than cast this card from your hand, you may pay {G} and exile it with two time counters on it. At the beginning of your upkeep, remove a time counter. When the last is removed, cast it without paying its mana cost.)"
Augur il-Vec,2.0,['White'],['W'],None,['Creature'],"['Human', 'Cleric']",Common,FUT,1,3,None,Shadow (This creature can block or be blocked by only creatures with shadow.)\nSacrifice Augur il-Vec: You gain 4 life. Activate only during your upkeep.
Scout's Warning,1.0,['White'],['W'],None,['Instant'],None,Rare,FUT,None,None,None,The next creature card you play this turn can be played as though it had flash.\nDraw a card.
Sliver Legion,5.0,"['Black', 'Green', 'Red', 'Blue', 'White']","['B', 'G', 'R', 'U', 'W']",['Legendary'],['Creature'],['Sliver'],Rare,FUT,7,7,None,All Sliver creatures get +1/+1 for each other Sliver on the battlefield.
Angel of Salvation,8.0,['White'],['W'],None,['Creature'],['Angel'],Rare,FUT,5,5,None,"Flash; convoke (Your creatures can help cast this spell. Each creature you tap while casting this spell pays for {1} or one mana of that creature's color.)\nFlying\nWhen Angel of Salvation enters the battlefield, prevent the next 5 damage that would be dealt this turn to any number of targets, divided as you choose."
Saltskitter,4.0,['White'],['W'],None,['Creature'],['Wurm'],Common,FUT,3,4,None,"Whenever another creature enters the battlefield, exile Saltskitter. Return Saltskitter to the battlefield under its owner's control at the beginning of the next end step."
Jhoira of the Ghitu,3.0,"['Red', 'Blue']","['R', 'U']",['Legendary'],['Creature'],"['Human', 'Wizard']",Rare,FUT,2,2,None,"{2}, Exile a nonland card from your hand: Put four time counters on the exiled card. If it doesn't have suspend, it gains suspend. (At the beginning of your upkeep, remove a time counter from that card. When the last is removed, cast it without paying its mana cost. If it's a creature, it has haste.)"
Chronomantic Escape,6.0,['White'],['W'],None,['Sorcery'],None,Uncommon,FUT,None,None,None,"Until your next turn, creatures can't attack you. Exile Chronomantic Escape with three time counters on it.\nSuspend 3—{2}{W} (Rather than cast this card from your hand, you may pay {2}{W} and exile it with three time counters on it. At the beginning of your upkeep, remove a time counter. When the last is removed, cast it without paying its mana cost.)"
Marshaling Cry,3.0,['White'],['W'],None,['Sorcery'],None,Common,FUT,None,None,None,"Creatures you control get +1/+1 and gain vigilance until end of turn.\nCycling {2} ({2}, Discard this card: Draw a card.)\nFlashback {3}{W} (You may cast this card from your graveyard for its flashback cost. Then exile it.)"
Glittering Wish,2.0,"['Green', 'White']","['G', 'W']",None,['Sorcery'],None,Rare,FUT,None,None,None,You may reveal a multicolored card you own from outside the game and put it into your hand. Exile Glittering Wish.
Samite Censer-Bearer,1.0,['White'],['W'],None,['Creature'],"['Human', 'Rebel', 'Cleric']",Common,FUT,1,1,None,"{W}, Sacrifice Samite Censer-Bearer: Prevent the next 1 damage that would be dealt to each creature you control this turn."
Magus of the Vineyard,1.0,['Green'],['G'],None,['Creature'],"['Human', 'Wizard']",Rare,FUT,1,1,None,"At the beginning of each player's precombat main phase, that player adds {G}{G}."
Magus of the Moat,4.0,['White'],['W'],None,['Creature'],"['Human', 'Wizard']",Rare,FUT,0,3,None,Creatures without flying can't attack.
Llanowar Mentor,1.0,['Green'],['G'],None,['Creature'],"['Elf', 'Spellshaper']",Uncommon,FUT,1,1,None,"{G}, {T}, Discard a card: Create a 1/1 green Elf Druid creature token named Llanowar Elves. It has ""{T}: Add {G}."""
Llanowar Empath,4.0,['Green'],['G'],None,['Creature'],"['Elf', 'Shaman']",Common,FUT,2,2,None,"When Llanowar Empath enters the battlefield, scry 2, then reveal the top card of your library. If it's a creature card, put it into your hand. (To scry 2, look at the top two cards of your library, then put any number of them on the bottom of your library and the rest on top in any order.)"
Barren Glory,6.0,['White'],['W'],None,['Enchantment'],None,Rare,FUT,None,None,None,"At the beginning of your upkeep, if you control no permanents other than Barren Glory and have no cards in hand, you win the game."
Llanowar Augur,1.0,['Green'],['G'],None,['Creature'],"['Elf', 'Shaman']",Common,FUT,0,3,None,Sacrifice Llanowar Augur: Target creature gets +3/+3 and gains trample until end of turn. Activate only during your upkeep.
Kavu Primarch,4.0,['Green'],['G'],None,['Creature'],['Kavu'],Common,FUT,3,3,None,"Kicker {4} (You may pay an additional {4} as you cast this spell.)\nConvoke (Your creatures can help cast this spell. Each creature you tap while casting this spell pays for {1} or one mana of that creature's color.)\nIf Kavu Primarch was kicked, it enters the battlefield with four +1/+1 counters on it."
Heartwood Storyteller,3.0,['Green'],['G'],None,['Creature'],['Treefolk'],Rare,FUT,2,3,None,"Whenever a player casts a noncreature spell, each of that player's opponents may draw a card."
Virulent Sliver,1.0,['Green'],['G'],None,['Creature'],['Sliver'],Common,FUT,1,1,None,"All Sliver creatures have poisonous 1. (Whenever a Sliver deals combat damage to a player, that player gets a poison counter. A player with ten or more poison counters loses the game.)"
Thornweald Archer,2.0,['Green'],['G'],None,['Creature'],"['Elf', 'Archer']",Common,FUT,2,1,None,"Reach, deathtouch"
Tarmogoyf,2.0,['Green'],['G'],None,['Creature'],['Lhurgoyf'],Rare,FUT,*,1+*,None,Tarmogoyf's power is equal to the number of card types among cards in all graveyards and its toughness is equal to that number plus 1.
Force of Savagery,3.0,['Green'],['G'],None,['Creature'],['Elemental'],Rare,FUT,8,0,None,Trample
Cyclical Evolution,5.0,['Green'],['G'],None,['Sorcery'],None,Uncommon,FUT,None,None,None,"Target creature gets +3/+3 until end of turn. Exile Cyclical Evolution with three time counters on it.\nSuspend 3—{2}{G} (Rather than cast this card from your hand, you may pay {2}{G} and exile it with three time counters on it. At the beginning of your upkeep, remove a time counter. When the last is removed, cast it without paying its mana cost.)"
Sporoloth Ancient,5.0,['Green'],['G'],None,['Creature'],['Fungus'],Common,FUT,4,4,None,"At the beginning of your upkeep, put a spore counter on Sporoloth Ancient.\nCreatures you control have ""Remove two spore counters from this creature: Create a 1/1 green Saproling creature token."""
Spellwild Ouphe,2.0,['Green'],['G'],None,['Creature'],['Ouphe'],Uncommon,FUT,1,3,None,Spells that target Spellwild Ouphe cost {2} less to cast.
Thunderblade Charge,3.0,['Red'],['R'],None,['Sorcery'],None,Rare,FUT,None,None,None,"Thunderblade Charge deals 3 damage to any target.\nWhenever one or more creatures you control deal combat damage to a player, if Thunderblade Charge is in your graveyard, you may pay {2}{R}{R}{R}. If you do, you may cast it without paying its mana cost."
Quagnoth,6.0,['Green'],['G'],None,['Creature'],['Beast'],Rare,FUT,4,5,None,"Split second (As long as this spell is on the stack, players can't cast spells or activate abilities that aren't mana abilities.)\nShroud (This creature can't be the target of spells or abilities.)\nWhen a spell or ability an opponent controls causes you to discard Quagnoth, return it to your hand."
Tarox Bladewing,5.0,['Red'],['R'],['Legendary'],['Creature'],['Dragon'],Rare,FUT,4,3,None,"Flying, haste\nGrandeur — Discard another card named Tarox Bladewing: Tarox Bladewing gets +X/+X until end of turn, where X is its power."
Phosphorescent Feast,5.0,['Green'],['G'],None,['Sorcery'],None,Uncommon,FUT,None,None,None,Chroma — Reveal any number of cards in your hand. You gain 2 life for each green mana symbol in those cards' mana costs.
Utopia Mycon,1.0,['Green'],['G'],None,['Creature'],['Fungus'],Uncommon,FUT,0,2,None,"At the beginning of your upkeep, put a spore counter on Utopia Mycon.\nRemove three spore counters from Utopia Mycon: Create a 1/1 green Saproling creature token.\nSacrifice a Saproling: Add one mana of any color."
Storm Entity,2.0,['Red'],['R'],None,['Creature'],['Elemental'],Uncommon,FUT,1,1,None,Haste\nStorm Entity enters the battlefield with a +1/+1 counter on it for each other spell cast this turn.
Steamflogger Boss,4.0,['Red'],['R'],None,['Creature'],"['Goblin', 'Rigger']",Rare,FUT,3,3,None,"Other Riggers you control get +1/+0 and have haste.\nIf a Rigger you control would assemble a Contraption, it assembles two Contraptions instead."
Skizzik Surger,6.0,['Red'],['R'],None,['Creature'],['Elemental'],Uncommon,FUT,6,4,None,"Haste\nEcho—Sacrifice two lands. (At the beginning of your upkeep, if this came under your control since the beginning of your last upkeep, sacrifice it unless you pay its echo cost.)"
Nacatl War-Pride,6.0,['Green'],['G'],None,['Creature'],"['Cat', 'Warrior']",Uncommon,FUT,3,3,None,"Nacatl War-Pride must be blocked by exactly one creature if able.\nWhenever Nacatl War-Pride attacks, create X tokens that are copies of Nacatl War-Pride and that are tapped and attacking, where X is the number of creatures defending player controls. Exile the tokens at the beginning of the next end step."
Nessian Courser,3.0,['Green'],['G'],None,['Creature'],"['Centaur', 'Warrior']",Common,FUT,3,3,None,None
Shah of Naar Isle,4.0,['Red'],['R'],None,['Creature'],['Efreet'],Rare,FUT,6,6,None,"Trample\nEcho {0} (At the beginning of your upkeep, if this came under your control since the beginning of your last upkeep, sacrifice it unless you pay its echo cost.)\nWhen Shah of Naar Isle's echo cost is paid, each opponent may draw up to three cards."
Homing Sliver,3.0,['Red'],['R'],None,['Creature'],['Sliver'],Common,FUT,2,2,None,"Each Sliver card in each player's hand has slivercycling {3}.\nSlivercycling {3} ({3}, Discard this card: Search your library for a Sliver card, reveal it, put it into your hand, then shuffle.)"
Henchfiend of Ukor,4.0,['Red'],"['B', 'R']",None,['Creature'],['Ogre'],Common,FUT,3,2,None,"Haste\nEcho {1}{B} (At the beginning of your upkeep, if this came under your control since the beginning of your last upkeep, sacrifice it unless you pay its echo cost.)\n{B/R}: Henchfiend of Ukor gets +1/+0 until end of turn."
Muraganda Petroglyphs,4.0,['Green'],['G'],None,['Enchantment'],None,Rare,FUT,None,None,None,Creatures with no abilities get +2/+2.
Molten Disaster,2.0,['Red'],['R'],None,['Sorcery'],None,Rare,FUT,None,None,None,"Kicker {R} (You may pay an additional {R} as you cast this spell.)\nIf this spell was kicked, it has split second. (As long as this spell is on the stack, players can't cast spells or activate abilities that aren't mana abilities.)\nMolten Disaster deals X damage to each creature without flying and each player."
Imperiosaur,4.0,['Green'],['G'],None,['Creature'],['Dinosaur'],Uncommon,FUT,5,5,None,Spend only mana produced by basic lands to cast this spell.
Flowstone Embrace,2.0,['Red'],['R'],None,['Enchantment'],['Aura'],Common,FUT,None,None,None,Enchant creature\n{T}: Enchanted creature gets +2/-2 until end of turn.
Dust of Moments,3.0,['White'],['W'],None,['Instant'],None,Uncommon,FUT,None,None,None,Choose one —\n• Remove two time counters from each permanent and each suspended card.\n• Put two time counters on each permanent with a time counter on it and each suspended card.
Ghostfire,3.0,None,['R'],None,['Instant'],None,Common,FUT,None,None,None,Ghostfire is colorless.\nGhostfire deals 3 damage to any target.
Grinning Ignus,3.0,['Red'],['R'],None,['Creature'],['Elemental'],Common,FUT,2,2,None,"{R}, Return Grinning Ignus to its owner's hand: Add {C}{C}{R}. Activate only as a sorcery."
Fomori Nomad,5.0,['Red'],['R'],None,['Creature'],"['Nomad', 'Giant']",Common,FUT,4,4,None,None
Emblem of the Warmind,2.0,['Red'],['R'],None,['Enchantment'],['Aura'],Uncommon,FUT,None,None,None,Enchant creature you control\nCreatures you control have haste.
Boldwyr Intimidator,7.0,['Red'],['R'],None,['Creature'],"['Giant', 'Warrior']",Uncommon,FUT,5,5,None,Cowards can't block Warriors.\n{R}: Target creature becomes a Coward until end of turn.\n{2}{R}: Target creature becomes a Warrior until end of turn.
Bloodshot Trainee,4.0,['Red'],['R'],None,['Creature'],"['Goblin', 'Warrior']",Uncommon,FUT,2,3,None,{T}: Bloodshot Trainee deals 4 damage to target creature. Activate only if Bloodshot Trainee's power is 4 or greater.
Scourge of Kher Ridges,8.0,['Red'],['R'],None,['Creature'],['Dragon'],Rare,FUT,6,6,None,Flying\n{1}{R}: Scourge of Kher Ridges deals 2 damage to each creature without flying.\n{5}{R}: Scourge of Kher Ridges deals 6 damage to each other creature with flying.
Sparkspitter,3.0,['Red'],['R'],None,['Creature'],"['Elemental', 'Spellshaper']",Uncommon,FUT,1,3,None,"{R}, {T}, Discard a card: Create a 3/1 red Elemental creature token named Spark Elemental. It has trample, haste, and ""At the beginning of the end step, sacrifice Spark Elemental."""
Shivan Sand-Mage,4.0,['Red'],['R'],None,['Creature'],"['Viashino', 'Shaman']",Uncommon,FUT,3,2,None,"When Shivan Sand-Mage enters the battlefield, choose one —\n• Remove two time counters from target permanent or suspended card.\n• Put two time counters on target permanent with a time counter on it or suspended card.\nSuspend 4—{R}"
Edge of Autumn,2.0,['Green'],['G'],None,['Sorcery'],None,Common,FUT,None,None,None,"If you control four or fewer lands, search your library for a basic land card, put it onto the battlefield tapped, then shuffle.\nCycling—Sacrifice a land. (Sacrifice a land, Discard this card: Draw a card.)"
Pact of the Titan,0.0,['Red'],['R'],None,['Instant'],None,Rare,FUT,None,None,None,"Create a 4/4 red Giant creature token.\nAt the beginning of your next upkeep, pay {4}{R}. If you don't, you lose the game."
Magus of the Moon,3.0,['Red'],['R'],None,['Creature'],"['Human', 'Wizard']",Rare,FUT,2,2,None,Nonbasic lands are Mountains.
Rift Elemental,1.0,['Red'],['R'],None,['Creature'],['Elemental'],Common,FUT,1,1,None,"{1}{R}, Remove a time counter from a permanent you control or suspended card you own: Rift Elemental gets +2/+0 until end of turn."
Summoner's Pact,0.0,['Green'],['G'],None,['Instant'],None,Rare,FUT,None,None,None,"Search your library for a green creature card, reveal it, put it into your hand, then shuffle.\nAt the beginning of your next upkeep, pay {2}{G}{G}. If you don't, you lose the game."
Centaur Omenreader,4.0,['Green'],['G'],['Snow'],['Creature'],"['Centaur', 'Shaman']",Uncommon,FUT,3,3,None,"As long as Centaur Omenreader is tapped, creature spells you cast cost {2} less to cast."
"Baru, Fist of Krosa",5.0,['Green'],['G'],['Legendary'],['Creature'],"['Human', 'Druid']",Rare,FUT,4,4,None,"Whenever a Forest enters the battlefield, green creatures you control get +1/+1 and gain trample until end of turn.\nGrandeur — Discard another card named Baru, Fist of Krosa: Create an X/X green Wurm creature token, where X is the number of lands you control."
Wrap in Vigor,2.0,['Green'],['G'],None,['Instant'],None,Common,FUT,None,None,None,Regenerate each creature you control.
Sprout Swarm,2.0,['Green'],['G'],None,['Instant'],None,Common,FUT,None,None,None,"Convoke (Your creatures can help cast this spell. Each creature you tap while casting this spell pays for {1} or one mana of that creature's color.)\nBuyback {3} (You may pay an additional {3} as you cast this spell. If you do, put this card into your hand as it resolves.)\nCreate a 1/1 green Saproling creature token."
Riddle of Lightning,5.0,['Red'],['R'],None,['Instant'],None,Common,FUT,None,None,None,"Choose any target. Scry 3, then reveal the top card of your library. Riddle of Lightning deals damage equal to that card's mana value to that permanent or player."
Pyromancer's Swath,3.0,['Red'],['R'],None,['Enchantment'],None,Rare,FUT,None,None,None,"If an instant or sorcery source you control would deal damage to a permanent or player, it deals that much damage plus 2 to that permanent or player instead.\nAt the beginning of each end step, discard your hand."
Knight of Sursi,4.0,['White'],['W'],None,['Creature'],"['Human', 'Knight']",Common,FUT,2,2,None,"Flying; flanking (Whenever a creature without flanking blocks this creature, the blocking creature gets -1/-1 until end of turn.)\nSuspend 3—{W} (Rather than cast this card from your hand, you may pay {W} and exile it with three time counters on it. At the beginning of your upkeep, remove a time counter. When the last is removed, cast it without paying its mana cost. It has haste.)"
Rites of Flourishing,3.0,['Green'],['G'],None,['Enchantment'],None,Rare,FUT,None,None,None,"At the beginning of each player's draw step, that player draws an additional card.\nEach player may play an additional land on each of their turns."
Judge Unworthy,2.0,['White'],['W'],None,['Instant'],None,Common,FUT,None,None,None,"Choose target attacking or blocking creature. Scry 3, then reveal the top card of your library. Judge Unworthy deals damage equal to that card's mana value to that creature."
Haze of Rage,2.0,['Red'],['R'],None,['Sorcery'],None,Uncommon,FUT,None,None,None,"Buyback {2} (You may pay an additional {2} as you cast this spell. If you do, put this card into your hand as it resolves.)\nCreatures you control get +1/+0 until end of turn.\nStorm (When you cast this spell, copy it for each spell cast before it this turn.)"
Gathan Raiders,5.0,['Red'],['R'],None,['Creature'],"['Human', 'Warrior']",Common,FUT,3,3,None,Hellbent — Gathan Raiders gets +2/+2 as long as you have no cards in hand.\nMorph—Discard a card. (You may cast this card face down as a 2/2 creature for {3}. Turn it face up any time for its morph cost.)
Fatal Attraction,3.0,['Red'],['R'],None,['Enchantment'],['Aura'],Common,FUT,None,None,None,"Enchant creature\nWhen Fatal Attraction enters the battlefield, it deals 2 damage to enchanted creature.\nAt the beginning of your upkeep, Fatal Attraction deals 4 damage to enchanted creature."
Emberwilde Augur,2.0,['Red'],['R'],None,['Creature'],"['Goblin', 'Shaman']",Common,FUT,2,1,None,Sacrifice Emberwilde Augur: It deals 3 damage to target player or planeswalker. Activate only during your upkeep.
Riftsweeper,2.0,['Green'],['G'],None,['Creature'],"['Elf', 'Shaman']",Uncommon,FUT,2,2,None,"When Riftsweeper enters the battlefield, choose target face-up exiled card. Its owner shuffles it into their library."
Char-Rumbler,4.0,['Red'],['R'],None,['Creature'],['Elemental'],Uncommon,FUT,-1,3,None,Double strike\n{R}: Char-Rumbler gets +1/+0 until end of turn.
Intervention Pact,0.0,['White'],['W'],None,['Instant'],None,Rare,FUT,None,None,None,"The next time a source of your choice would deal damage to you this turn, prevent that damage. You gain life equal to the damage prevented this way.\nAt the beginning of your next upkeep, pay {1}{W}{W}. If you don't, you lose the game."
Ravaging Riftwurm,3.0,['Green'],['G'],None,['Creature'],['Wurm'],Uncommon,FUT,6,6,None,"Kicker {4} (You may pay an additional {4} as you cast this spell.)\nVanishing 2 (This creature enters the battlefield with two time counters on it. At the beginning of your upkeep, remove a time counter from it. When the last is removed, sacrifice it.)\nIf Ravaging Riftwurm was kicked, it enters the battlefield with three additional time counters on it."
Even the Odds,3.0,['White'],['W'],None,['Instant'],None,Uncommon,FUT,None,None,None,Cast this spell only if you control fewer creatures than each opponent.\nCreate three 1/1 white Soldier creature tokens.
Quiet Disrepair,2.0,['Green'],['G'],None,['Enchantment'],['Aura'],Common,FUT,None,None,None,"Enchant artifact or enchantment\nAt the beginning of your upkeep, choose one —\n• Destroy enchanted permanent.\n• You gain 2 life."
