Name,CMC,Colors,Color identity,Supertypes,Types,Subtypes,Rarity,Set,Power,Toughness,Loyalty,Text
Frenzy Sliver,2.0,['Black'],['B'],None,['Creature'],['Sliver'],Common,FUT,1,1,None,"All Sliver creatures have frenzy 1. (Whenever a Sliver attacks and isn't blocked, it gets +1/+0 until end of turn.)"
Witch's Mist,3.0,['Black'],['B'],None,['Enchantment'],None,Uncommon,FUT,None,None,None,"{2}{B}, {T}: Destroy target creature that was dealt damage this turn."
Imperial Mask,5.0,['White'],['W'],None,['Enchantment'],None,Rare,FUT,None,None,None,"When Imperial Mask enters the battlefield, if it's not a token, each of your teammates creates a token that's a copy of Imperial Mask.\nYou have hexproof. (You can't be the target of spells or abilities your opponents control.)"
Fleshwrither,4.0,['Black'],['B'],None,['Creature'],['Horror'],Uncommon,FUT,3,3,None,"Transfigure {1}{B}{B} ({1}{B}{B}, Sacrifice this creature: Search your library for a creature card with the same mana value as this creature, put that card onto the battlefield, then shuffle. Transfigure only as a sorcery.)"
Tombstalker,8.0,['Black'],['B'],None,['Creature'],['Demon'],Rare,FUT,5,5,None,Flying\nDelve (Each card you exile from your graveyard while casting this spell pays for {1}.)
Street Wraith,5.0,['Black'],['B'],None,['Creature'],['Wraith'],Uncommon,FUT,3,4,None,"Swampwalk (This creature can't be blocked as long as defending player controls a Swamp.)\nCycling—Pay 2 life. (Pay 2 life, Discard this card: Draw a card.)"
Snake Cult Initiation,4.0,['Black'],['B'],None,['Enchantment'],['Aura'],Uncommon,FUT,None,None,None,"Enchant creature\nEnchanted creature has poisonous 3. (Whenever it deals combat damage to a player, that player gets three poison counters. A player with ten or more poison counters loses the game.)"
Death Rattle,6.0,['Black'],['B'],None,['Instant'],None,Common,FUT,None,None,None,Delve (Each card you exile from your graveyard while casting this spell pays for {1}.)\nDestroy target nongreen creature. It can't be regenerated.
Grave Scrabbler,4.0,['Black'],['B'],None,['Creature'],['Zombie'],Common,FUT,2,2,None,"Madness {1}{B} (If you discard this card, discard it into exile. When you do, cast it for its madness cost or put it into your graveyard.)\nWhen Grave Scrabbler enters the battlefield, if its madness cost was paid, you may return target creature card from a graveyard to its owner's hand."
Lumithread Field,2.0,['White'],['W'],None,['Enchantment'],None,Common,FUT,None,None,None,Creatures you control get +0/+1.\nMorph {1}{W} (You may cast this card face down as a 2/2 creature for {3}. Turn it face up any time for its morph cost.)
Mass of Ghouls,5.0,['Black'],['B'],None,['Creature'],"['Zombie', 'Warrior']",Common,FUT,5,3,None,None
Lymph Sliver,5.0,['White'],['W'],None,['Creature'],['Sliver'],Common,FUT,3,3,None,"All Sliver creatures have absorb 1. (If a source would deal damage to a Sliver, prevent 1 of that damage.)"
Deepcavern Imp,3.0,['Black'],['B'],None,['Creature'],"['Imp', 'Rebel']",Common,FUT,2,2,None,"Flying, haste\nEcho—Discard a card. (At the beginning of your upkeep, if this came under your control since the beginning of your last upkeep, sacrifice it unless you pay its echo cost.)"
Lucent Liminid,5.0,['White'],['W'],None,"['Enchantment', 'Creature']",['Elemental'],Common,FUT,3,3,None,Flying
"Korlash, Heir to Blackblade",4.0,['Black'],['B'],['Legendary'],['Creature'],"['Zombie', 'Warrior']",Rare,FUT,*,*,None,"Korlash, Heir to Blackblade's power and toughness are each equal to the number of Swamps you control.\n{1}{B}: Regenerate Korlash.\nGrandeur — Discard another card named Korlash, Heir to Blackblade: Search your library for up to two Swamp cards, put them onto the battlefield tapped, then shuffle."
Bridge from Below,3.0,['Black'],['B'],None,['Enchantment'],None,Rare,FUT,None,None,None,"Whenever a nontoken creature is put into your graveyard from the battlefield, if Bridge from Below is in your graveyard, create a 2/2 black Zombie creature token.\nWhen a creature is put into an opponent's graveyard from the battlefield, if Bridge from Below is in your graveyard, exile Bridge from Below."
Goldmeadow Lookout,4.0,['White'],['W'],None,['Creature'],"['Kithkin', 'Spellshaper']",Uncommon,FUT,2,2,None,"{W}, {T}, Discard a card: Create a 1/1 white Kithkin Soldier creature token named Goldmeadow Harrier. It has ""{W}, {T}: Tap target creature."""
Spirit en-Dal,3.0,['White'],['W'],None,['Creature'],['Spirit'],Uncommon,FUT,2,1,None,"Shadow (This creature can block or be blocked by only creatures with shadow.)\nForecast — {1}{W}, Reveal Spirit en-Dal from your hand: Target creature gains shadow until end of turn. (Activate only during your upkeep and only once each turn.)"
Bitter Ordeal,3.0,['Black'],['B'],None,['Sorcery'],None,Rare,FUT,None,None,None,"Search target player's library for a card and exile it. Then that player shuffles.\nGravestorm (When you cast this spell, copy it for each permanent put into a graveyard this turn. You may choose new targets for the copies.)"
Stronghold Rats,3.0,['Black'],['B'],None,['Creature'],['Rat'],Uncommon,FUT,2,1,None,"Shadow (This creature can block or be blocked by only creatures with shadow.)\nWhenever Stronghold Rats deals combat damage to a player, each player discards a card."
Slaughter Pact,0.0,['Black'],['B'],None,['Instant'],None,Rare,FUT,None,None,None,"Destroy target nonblack creature.\nAt the beginning of your next upkeep, pay {2}{B}. If you don't, you lose the game."
Skirk Ridge Exhumer,2.0,['Black'],['B'],None,['Creature'],"['Zombie', 'Spellshaper']",Uncommon,FUT,1,1,None,"{B}, {T}, Discard a card: Create a 1/1 black Zombie Goblin creature token named Festering Goblin. It has ""When Festering Goblin dies, target creature gets -1/-1 until end of turn."""
Shimian Specter,4.0,['Black'],['B'],None,['Creature'],['Specter'],Rare,FUT,2,2,None,"Flying\nWhenever Shimian Specter deals combat damage to a player, that player reveals their hand. You choose a nonland card from it. Search that player's graveyard, hand, and library for all cards with the same name as that card and exile them. Then that player shuffles."
Putrid Cyclops,3.0,['Black'],['B'],None,['Creature'],"['Zombie', 'Cyclops']",Common,FUT,3,3,None,"When Putrid Cyclops enters the battlefield, scry 1, then reveal the top card of your library. Putrid Cyclops gets -X/-X until end of turn, where X is that card's mana value. (To scry 1, look at the top card of your library, then you may put that card on the bottom of your library.)"
Pooling Venom,2.0,['Black'],['B'],None,['Enchantment'],['Aura'],Uncommon,FUT,None,None,None,"Enchant land\nWhenever enchanted land becomes tapped, its controller loses 2 life.\n{3}{B}: Destroy enchanted land."
Oblivion Crown,2.0,['Black'],['B'],None,['Enchantment'],['Aura'],Common,FUT,None,None,None,"Flash (You may cast this spell any time you could cast an instant.)\nEnchant creature\nEnchanted creature has ""Discard a card: This creature gets +1/+1 until end of turn."""
Nihilith,6.0,['Black'],['B'],None,['Creature'],['Horror'],Rare,FUT,4,4,None,"Fear (This creature can't be blocked except by artifact creatures and/or black creatures.)\nSuspend 7—{1}{B} (Rather than cast this card from your hand, you may pay {1}{B} and exile it with seven time counters on it. At the beginning of your upkeep, remove a time counter. When the last is removed, cast it without paying its mana cost. It has haste.)\nWhenever a card is put into an opponent's graveyard from anywhere, if Nihilith is suspended, you may remove a time counter from Nihilith."
Minions' Murmurs,4.0,['Black'],['B'],None,['Sorcery'],None,Uncommon,FUT,None,None,None,"You draw X cards and you lose X life, where X is the number of creatures you control."
Magus of the Abyss,4.0,['Black'],['B'],None,['Creature'],"['Human', 'Wizard']",Rare,FUT,4,3,None,"At the beginning of each player's upkeep, destroy target nonartifact creature that player controls of their choice. It can't be regenerated."
Lost Hours,2.0,['Black'],['B'],None,['Sorcery'],None,Common,FUT,None,None,None,Target player reveals their hand. You choose a nonland card from it. That player puts that card into their library third from the top.
Keldon Megaliths,0.0,None,['R'],None,['Land'],None,Uncommon,FUT,None,None,None,"Keldon Megaliths enters the battlefield tapped.\n{T}: Add {R}.\nHellbent — {1}{R}, {T}: Keldon Megaliths deals 1 damage to any target. Activate only if you have no cards in hand."
Ichor Slick,3.0,['Black'],['B'],None,['Sorcery'],None,Common,FUT,None,None,None,"Target creature gets -3/-3 until end of turn.\nCycling {2} ({2}, Discard this card: Draw a card.)\nMadness {3}{B} (If you discard this card, discard it into exile. When you do, cast it for its madness cost or put it into your graveyard.)"
Dakmor Salvage,0.0,None,['B'],None,['Land'],None,Uncommon,FUT,None,None,None,"Dakmor Salvage enters the battlefield tapped.\n{T}: Add {B}.\nDredge 2 (If you would draw a card, you may mill two cards instead. If you do, return this card from your graveyard to your hand.)"
Grave Peril,2.0,['Black'],['B'],None,['Enchantment'],None,Common,FUT,None,None,None,"When a nonblack creature enters the battlefield, sacrifice Grave Peril. If you do, destroy that creature."
Whetwheel,4.0,None,None,None,['Artifact'],None,Rare,FUT,None,None,None,"{X}{X}, {T}: Target player mills X cards.\nMorph {3} (You may cast this card face down as a 2/2 creature for {3}. Turn it face up any time for its morph cost.)"
Gibbering Descent,6.0,['Black'],['B'],None,['Enchantment'],None,Rare,FUT,None,None,None,"At the beginning of each player's upkeep, that player loses 1 life and discards a card.\nHellbent — Skip your upkeep step if you have no cards in hand.\nMadness {2}{B}{B} (If you discard this card, discard it into exile. When you do, cast it for its madness cost or put it into your graveyard.)"
Festering March,5.0,['Black'],['B'],None,['Sorcery'],None,Uncommon,FUT,None,None,None,"Creatures your opponents control get -1/-1 until end of turn. Exile Festering March with three time counters on it.\nSuspend 3—{2}{B} (Rather than cast this card from your hand, you may pay {2}{B} and exile it with three time counters on it. At the beginning of your upkeep, remove a time counter. When the last is removed, cast it without paying its mana cost.)"
Cutthroat il-Dal,4.0,['Black'],['B'],None,['Creature'],"['Human', 'Rogue']",Common,FUT,4,1,None,Hellbent — Cutthroat il-Dal has shadow as long as you have no cards in hand. (It can block or be blocked by only creatures with shadow.)
Augur of Skulls,2.0,['Black'],['B'],None,['Creature'],"['Skeleton', 'Wizard']",Common,FUT,1,1,None,{1}{B}: Regenerate Augur of Skulls.\nSacrifice Augur of Skulls: Target player discards two cards. Activate only during your upkeep.
Whip-Spine Drake,5.0,['Blue'],"['U', 'W']",None,['Creature'],['Drake'],Common,FUT,3,3,None,Flying\nMorph {2}{W} (You may cast this card face down as a 2/2 creature for {3}. Turn it face up any time for its morph cost.)
Vedalken Aethermage,2.0,['Blue'],['U'],None,['Creature'],"['Vedalken', 'Wizard']",Common,FUT,1,2,None,"Flash (You may cast this spell any time you could cast an instant.)\nWhen Vedalken Aethermage enters the battlefield, return target Sliver to its owner's hand.\nWizardcycling {3} ({3}, Discard this card: Search your library for a Wizard card, reveal it, put it into your hand, then shuffle.)"
Spin into Myth,5.0,['Blue'],['U'],None,['Instant'],None,Uncommon,FUT,None,None,None,"Put target creature on top of its owner's library, then fateseal 2. (To fateseal 2, look at the top two cards of an opponent's library, then put any number of them on the bottom of that player's library and the rest on top in any order.)"
Darksteel Garrison,2.0,None,None,None,['Artifact'],['Fortification'],Rare,FUT,None,None,None,"Fortified land has indestructible.\nWhenever fortified land becomes tapped, target creature gets +1/+1 until end of turn.\nFortify {3} ({3}: Attach to target land you control. Fortify only as a sorcery. This card enters the battlefield unattached and stays on the battlefield if the land leaves.)"
Spellweaver Volute,5.0,['Blue'],['U'],None,['Enchantment'],['Aura'],Rare,FUT,None,None,None,"Enchant instant card in a graveyard\nWhenever you cast a sorcery spell, copy the enchanted instant card. You may cast the copy without paying its mana cost. If you do, exile the enchanted card and attach Spellweaver Volute to another instant card in a graveyard."
Shapeshifter's Marrow,4.0,['Blue'],['U'],None,['Enchantment'],None,Rare,FUT,None,None,None,"At the beginning of each opponent's upkeep, that player reveals the top card of their library. If it's a creature card, the player puts the card into their graveyard and Shapeshifter's Marrow becomes a copy of that card. (If it does, it loses this ability.)"
Veilstone Amulet,3.0,None,None,None,['Artifact'],None,Rare,FUT,None,None,None,"Whenever you cast a spell, creatures you control can't be the targets of spells or abilities your opponents control this turn."
Second Wind,3.0,['Blue'],['U'],None,['Enchantment'],['Aura'],Uncommon,FUT,None,None,None,Enchant creature\n{T}: Tap enchanted creature.\n{T}: Untap enchanted creature.
Sarcomite Myr,3.0,['Blue'],['U'],None,"['Artifact', 'Creature']","['Phyrexian', 'Myr']",Common,FUT,2,1,None,"{2}: Sarcomite Myr gains flying until end of turn.\n{2}, Sacrifice Sarcomite Myr: Draw a card."
Zoetic Cavern,0.0,None,None,None,['Land'],None,Uncommon,FUT,None,None,None,{T}: Add {C}.\nMorph {2} (You may cast this card face down as a 2/2 creature for {3}. Turn it face up any time for its morph cost.)
Nix,1.0,['Blue'],['U'],None,['Instant'],None,Rare,FUT,None,None,None,Counter target spell if no mana was spent to cast it.
Sword of the Meek,2.0,None,None,None,['Artifact'],['Equipment'],Uncommon,FUT,None,None,None,"Equipped creature gets +1/+2.\nEquip {2}\nWhenever a 1/1 creature enters the battlefield under your control, you may return Sword of the Meek from your graveyard to the battlefield, then attach it to that creature."
Narcomoeba,2.0,['Blue'],['U'],None,['Creature'],['Illusion'],Uncommon,FUT,1,1,None,"Flying\nWhen Narcomoeba is put into your graveyard from your library, you may put it onto the battlefield."
Nimbus Maze,0.0,None,"['U', 'W']",None,['Land'],None,Rare,FUT,None,None,None,{T}: Add {C}.\n{T}: Add {W}. Activate only if you control an Island.\n{T}: Add {U}. Activate only if you control a Plains.
Mesmeric Sliver,4.0,['Blue'],['U'],None,['Creature'],['Sliver'],Common,FUT,2,2,None,"All Slivers have ""When this permanent enters the battlefield, you may fateseal 1."" (To fateseal 1, its controller looks at the top card of an opponent's library, then they may put that card on the bottom of that library.)"
Soultether Golem,2.0,None,None,None,"['Artifact', 'Creature']",['Golem'],Uncommon,FUT,3,3,None,"Vanishing 1 (This creature enters the battlefield with a time counter on it. At the beginning of your upkeep, remove a time counter from it. When the last is removed, sacrifice it.)\nWhenever another creature enters the battlefield under your control, put a time counter on Soultether Golem."
Logic Knot,2.0,['Blue'],['U'],None,['Instant'],None,Common,FUT,None,None,None,Delve (Each card you exile from your graveyard while casting this spell pays for {1}.)\nCounter target spell unless its controller pays {X}.
"Linessa, Zephyr Mage",4.0,['Blue'],['U'],['Legendary'],['Creature'],"['Human', 'Wizard']",Rare,FUT,3,3,None,"{X}{U}{U}, {T}: Return target creature with mana value X to its owner's hand.\nGrandeur — Discard another card named Linessa, Zephyr Mage: Target player returns a creature they control to its owner's hand, then repeats this process for an artifact, an enchantment, and a land."
River of Tears,0.0,None,"['B', 'U']",None,['Land'],None,Rare,FUT,None,None,None,"{T}: Add {U}. If you played a land this turn, add {B} instead."
Bonded Fetch,3.0,['Blue'],['U'],None,['Creature'],['Homunculus'],Uncommon,FUT,0,2,None,"Defender, haste\n{T}: Draw a card, then discard a card."
Sliversmith,2.0,None,None,None,"['Artifact', 'Creature']",['Spellshaper'],Uncommon,FUT,1,1,None,"{1}, {T}, Discard a card: Create a 1/1 colorless Sliver artifact creature token named Metallic Sliver."
Blind Phantasm,3.0,['Blue'],['U'],None,['Creature'],['Illusion'],Common,FUT,2,3,None,None
Horizon Canopy,0.0,None,"['G', 'W']",None,['Land'],None,Rare,FUT,None,None,None,"{T}, Pay 1 life: Add {G} or {W}.\n{1}, {T}, Sacrifice Horizon Canopy: Draw a card."
Grove of the Burnwillows,0.0,None,"['G', 'R']",None,['Land'],None,Rare,FUT,None,None,None,{T}: Add {C}.\n{T}: Add {R} or {G}. Each opponent gains 1 life.
Arcanum Wings,2.0,['Blue'],['U'],None,['Enchantment'],['Aura'],Uncommon,FUT,None,None,None,Enchant creature\nEnchanted creature has flying.\nAura swap {2}{U} ({2}{U}: Exchange this Aura with an Aura card in your hand.)
Epochrasite,2.0,None,None,None,"['Artifact', 'Creature']",['Construct'],Rare,FUT,1,1,None,"Epochrasite enters the battlefield with three +1/+1 counters on it if you didn't cast it from your hand.\nWhen Epochrasite dies, exile it with three time counters on it and it gains suspend. (At the beginning of your upkeep, remove a time counter. When the last is removed, cast this card without paying its mana cost. It has haste.)"
Venser's Diffusion,3.0,['Blue'],['U'],None,['Instant'],None,Common,FUT,None,None,None,Return target nonland permanent or suspended card to its owner's hand.
Graven Cairns,0.0,None,"['B', 'R']",None,['Land'],None,Rare,FUT,None,None,None,"{T}: Add {C}.\n{B/R}, {T}: Add {B}{B}, {B}{R}, or {R}{R}."
"Venser, Shaper Savant",4.0,['Blue'],['U'],['Legendary'],['Creature'],"['Human', 'Wizard']",Rare,FUT,2,2,None,"Flash\nWhen Venser, Shaper Savant enters the battlefield, return target spell or permanent to its owner's hand."
Coalition Relic,3.0,None,None,None,['Artifact'],None,Rare,FUT,None,None,None,"{T}: Add one mana of any color.\n{T}: Put a charge counter on Coalition Relic.\nAt the beginning of your precombat main phase, remove all charge counters from Coalition Relic. Add one mana of any color for each charge counter removed this way."
Unblinking Bleb,4.0,['Blue'],['U'],None,['Creature'],['Illusion'],Common,FUT,1,3,None,"Morph {2}{U} (You may cast this card face down as a 2/2 creature for {3}. Turn it face up any time for its morph cost.)\nWhenever Unblinking Bleb or another permanent is turned face up, you may scry 2. (Look at the top two cards of your library, then put any number of them on the bottom of your library and the rest on top in any order.)"
Take Possession,7.0,['Blue'],['U'],None,['Enchantment'],['Aura'],Rare,FUT,None,None,None,"Split second (As long as this spell is on the stack, players can't cast spells or activate abilities that aren't mana abilities.)\nEnchant permanent\nYou control enchanted permanent."
Dryad Arbor,0.0,['Green'],['G'],None,"['Land', 'Creature']","['Forest', 'Dryad']",Uncommon,FUT,1,1,None,"(Dryad Arbor isn't a spell, it's affected by summoning sickness, and it has ""{T}: Add {G}."")"
Reality Strobe,6.0,['Blue'],['U'],None,['Sorcery'],None,Uncommon,FUT,None,None,None,"Return target permanent to its owner's hand. Exile Reality Strobe with three time counters on it.\nSuspend 3—{2}{U} (Rather than cast this card from your hand, you may pay {2}{U} and exile it with three time counters on it. At the beginning of your upkeep, remove a time counter. When the last is removed, cast it without paying its mana cost.)"
Tolaria West,0.0,None,['U'],None,['Land'],None,Uncommon,FUT,None,None,None,"Tolaria West enters the battlefield tapped.\n{T}: Add {U}.\nTransmute {1}{U}{U} ({1}{U}{U}, Discard this card: Search your library for a card with mana value 0, reveal it, put it into your hand, then shuffle. Transmute only as a sorcery.)"
Pact of Negation,0.0,['Blue'],['U'],None,['Instant'],None,Rare,FUT,None,None,None,"Counter target spell.\nAt the beginning of your next upkeep, pay {3}{U}{U}. If you don't, you lose the game."
New Benalia,0.0,None,['W'],None,['Land'],None,Uncommon,FUT,None,None,None,"New Benalia enters the battlefield tapped.\nWhen New Benalia enters the battlefield, scry 1. (Look at the top card of your library. You may put that card on the bottom of your library.)\n{T}: Add {W}."
Mystic Speculation,1.0,['Blue'],['U'],None,['Sorcery'],None,Uncommon,FUT,None,None,None,"Buyback {2} (You may pay an additional {2} as you cast this spell. If you do, put this card into your hand as it resolves.)\nScry 3. (Look at the top three cards of your library, then put any number of them on the bottom of your library and the rest on top in any order.)"
Llanowar Reborn,0.0,None,['G'],None,['Land'],None,Uncommon,FUT,None,None,None,"Llanowar Reborn enters the battlefield tapped.\n{T}: Add {G}.\nGraft 1 (This land enters the battlefield with a +1/+1 counter on it. Whenever a creature enters the battlefield, you may move a +1/+1 counter from this land onto it.)"
Magus of the Future,5.0,['Blue'],['U'],None,['Creature'],"['Human', 'Wizard']",Rare,FUT,2,3,None,Play with the top card of your library revealed.\nYou may play lands and cast spells from the top of your library.
Cloud Key,3.0,None,None,None,['Artifact'],None,Rare,FUT,None,None,None,"As Cloud Key enters the battlefield, choose artifact, creature, enchantment, instant, or sorcery.\nSpells you cast of the chosen type cost {1} less to cast."
Maelstrom Djinn,8.0,['Blue'],['U'],None,['Creature'],['Djinn'],Rare,FUT,5,6,None,"Flying\nMorph {2}{U} (You may cast this card face down as a 2/2 creature for {3}. Turn it face up any time for its morph cost.)\nWhen Maelstrom Djinn is turned face up, put two time counters on it and it gains vanishing. (At the beginning of your upkeep, remove a time counter from it. When the last is removed, sacrifice it.)"
Akroma's Memorial,7.0,None,None,['Legendary'],['Artifact'],None,Rare,FUT,None,None,None,"Creatures you control have flying, first strike, vigilance, trample, haste, and protection from black and from red."
Leaden Fists,3.0,['Blue'],['U'],None,['Enchantment'],['Aura'],Common,FUT,None,None,None,Flash (You may cast this spell any time you could cast an instant.)\nEnchant creature\nEnchanted creature gets +3/+3 and doesn't untap during its controller's untap step.
Infiltrator il-Kor,5.0,['Blue'],['U'],None,['Creature'],"['Kor', 'Rogue']",Common,FUT,3,1,None,"Shadow (This creature can block or be blocked by only creatures with shadow.)\nSuspend 2—{1}{U} (Rather than cast this card from your hand, you may pay {1}{U} and exile it with two time counters on it. At the beginning of your upkeep, remove a time counter. When the last is removed, cast it without paying its mana cost. It has haste.)"
Foresee,4.0,['Blue'],['U'],None,['Sorcery'],None,Common,FUT,None,None,None,"Scry 4, then draw two cards."
Delay,2.0,['Blue'],['U'],None,['Instant'],None,Uncommon,FUT,None,None,None,"Counter target spell. If the spell is countered this way, exile it with three time counters on it instead of putting it into its owner's graveyard. If it doesn't have suspend, it gains suspend. (At the beginning of its owner's upkeep, remove a time counter from that card. When the last is removed, the player plays it without paying its mana cost. If it's a creature, it has haste.)"
Cryptic Annelid,4.0,['Blue'],['U'],None,['Creature'],"['Worm', 'Beast']",Uncommon,FUT,1,4,None,"When Cryptic Annelid enters the battlefield, scry 1, then scry 2, then scry 3. (To scry X, look at the top X cards of your library, then put any number of them on the bottom of your library and the rest on top in any order.)"
Cloudseeder,2.0,['Blue'],['U'],None,['Creature'],"['Faerie', 'Spellshaper']",Uncommon,FUT,1,1,None,"Flying\n{U}, {T}, Discard a card: Create a 1/1 blue Faerie creature token named Cloud Sprite. It has flying and ""Cloud Sprite can block only creatures with flying."""
Aven Augur,4.0,['Blue'],['U'],None,['Creature'],"['Bird', 'Wizard']",Common,FUT,2,2,None,Flying\nSacrifice Aven Augur: Return up to two target creatures to their owners' hands. Activate only during your upkeep.
Seht's Tiger,4.0,['White'],['W'],None,['Creature'],['Cat'],Rare,FUT,3,3,None,"Flash (You may cast this spell any time you could cast an instant.)\nWhen Seht's Tiger enters the battlefield, you gain protection from the color of your choice until end of turn. (You can't be targeted, dealt damage, or enchanted by anything of the chosen color.)"
Ramosian Revivalist,4.0,['White'],['W'],None,['Creature'],"['Human', 'Rebel', 'Cleric']",Uncommon,FUT,2,2,None,"{6}, {T}: Return target Rebel permanent card with mana value 5 or less from your graveyard to the battlefield."
Patrician's Scorn,4.0,['White'],['W'],None,['Instant'],None,Common,FUT,None,None,None,"If you've cast another white spell this turn, you may cast this spell without paying its mana cost.\nDestroy all enchantments."
"Oriss, Samite Guardian",3.0,['White'],['W'],['Legendary'],['Creature'],"['Human', 'Cleric']",Rare,FUT,1,3,None,"{T}: Prevent all damage that would be dealt to target creature this turn.\nGrandeur — Discard another card named Oriss, Samite Guardian: Target player can't cast spells this turn, and creatures that player controls can't attack this turn."
Mistmeadow Skulk,2.0,['White'],['W'],None,['Creature'],"['Kithkin', 'Rogue']",Uncommon,FUT,1,1,None,"Lifelink, protection from mana value 3 or greater"
Daybreak Coronet,2.0,['White'],['W'],None,['Enchantment'],['Aura'],Rare,FUT,None,None,None,"Enchant creature with another Aura attached to it\nEnchanted creature gets +3/+3 and has first strike, vigilance, and lifelink. (Damage dealt by the creature also causes its controller to gain that much life.)"
Bound in Silence,3.0,['White'],['W'],None,"['Tribal', 'Enchantment']","['Rebel', 'Aura']",Uncommon,FUT,None,None,None,Enchant creature\nEnchanted creature can't attack or block.
