Name,CMC,Colors,Color identity,Supertypes,Types,Subtypes,Rarity,Set,Power,Toughness,Loyalty,Text
Dramatic Reversal,2.0,['Blue'],['U'],None,['Instant'],None,Common,KLD,None,None,None,Untap all nonland permanents you control.
Peema Outrider,4.0,['Green'],['G'],None,['Creature'],"['Elf', 'Artificer']",Common,KLD,3,3,None,"Trample\nFabricate 1 (When this creature enters the battlefield, put a +1/+1 counter on it or create a 1/1 colorless Servo artifact creature token.)"
Whirler Virtuoso,3.0,"['Red', 'Blue']","['R', 'U']",None,['Creature'],"['Vedalken', 'Artificer']",Uncommon,KLD,2,3,None,"When Whirler Virtuoso enters the battlefield, you get {E}{E}{E} (three energy counters).\nPay {E}{E}{E}: Create a 1/1 colorless Thopter artifact creature token with flying."
Era of Innovation,2.0,['Blue'],['U'],None,['Enchantment'],None,Uncommon,KLD,None,None,None,"Whenever an artifact or Artificer enters the battlefield under your control, you may pay {1}. If you do, you get {E}{E} (two energy counters).\nPay {E}{E}{E}{E}{E}{E}, Sacrifice Era of Innovation: Draw three cards."
Ornamental Courage,1.0,['Green'],['G'],None,['Instant'],None,Common,KLD,None,None,None,Untap target creature. It gets +1/+3 until end of turn.
Torch Gauntlet,2.0,None,None,None,['Artifact'],['Equipment'],Common,KLD,None,None,None,Equipped creature gets +2/+0.\nEquip {2} ({2}: Attach to target creature you control. Equip only as a sorcery.)
Sage of Shaila's Claim,2.0,['Green'],['G'],None,['Creature'],"['Elf', 'Druid']",Common,KLD,2,1,None,"When Sage of Shaila's Claim enters the battlefield, you get {E}{E}{E} (three energy counters)."
Guardian of the Great Conduit,4.0,['Green'],['G'],None,['Creature'],['Elemental'],Uncommon,KLD,2,4,None,"Reach (This creature can block creatures with flying.)\nAs long as you control a Nissa planeswalker, Guardian of the Great Conduit gets +2/+0 and has vigilance. (Attacking doesn't cause it to tap.)"
Terrain Elemental,2.0,['Green'],['G'],None,['Creature'],['Elemental'],Common,KLD,3,2,None,None
Verdant Crescendo,4.0,['Green'],['G'],None,['Sorcery'],None,Rare,KLD,None,None,None,"Search your library for a basic land card and put it onto the battlefield tapped. Search your library and graveyard for a card named Nissa, Nature's Artisan, reveal it, put it into your hand, then shuffle."
Larger Than Life,2.0,['Green'],['G'],None,['Sorcery'],None,Common,KLD,None,None,None,Target creature gets +4/+4 and gains trample until end of turn.
Sky Skiff,2.0,None,None,None,['Artifact'],['Vehicle'],Common,KLD,2,3,None,Flying\nCrew 1 (Tap any number of creatures you control with total power 1 or more: This Vehicle becomes an artifact creature until end of turn.)
Woodland Stream,0.0,None,"['G', 'U']",None,['Land'],None,Common,KLD,None,None,None,Woodland Stream enters the battlefield tapped.\n{T}: Add {G} or {U}.
Kujar Seedsculptor,2.0,['Green'],['G'],None,['Creature'],"['Elf', 'Druid']",Common,KLD,1,2,None,"When Kujar Seedsculptor enters the battlefield, put a +1/+1 counter on target creature you control."
"Nissa, Vital Force",5.0,['Green'],['G'],['Legendary'],['Planeswalker'],['Nissa'],Mythic,KLD,None,None,5,"[+1]: Untap target land you control. Until your next turn, it becomes a 5/5 Elemental creature with haste. It's still a land.\n[−3]: Return target permanent card from your graveyard to your hand.\n[−6]: You get an emblem with ""Whenever a land enters the battlefield under your control, you may draw a card."""
Self-Assembler,5.0,None,None,None,"['Artifact', 'Creature']",['Assembly-Worker'],Common,KLD,4,4,None,"When Self-Assembler enters the battlefield, you may search your library for an Assembly-Worker creature card, reveal it, put it into your hand, then shuffle."
Nature's Way,2.0,['Green'],['G'],None,['Sorcery'],None,Uncommon,KLD,None,None,None,Target creature you control gains vigilance and trample until end of turn. It deals damage equal to its power to target creature you don't control.
Scrapheap Scrounger,2.0,None,['B'],None,"['Artifact', 'Creature']",['Construct'],Rare,KLD,3,2,None,"Scrapheap Scrounger can't block.\n{1}{B}, Exile another creature card from your graveyard: Return Scrapheap Scrounger from your graveyard to the battlefield."
Longtusk Cub,2.0,['Green'],['G'],None,['Creature'],['Cat'],Uncommon,KLD,2,2,None,"Whenever Longtusk Cub deals combat damage to a player, you get {E}{E} (two energy counters).\nPay {E}{E}: Put a +1/+1 counter on Longtusk Cub."
Renegade Freighter,3.0,None,None,None,['Artifact'],['Vehicle'],Common,KLD,4,3,None,"Whenever Renegade Freighter attacks, it gets +1/+1 and gains trample until end of turn.\nCrew 2 (Tap any number of creatures you control with total power 2 or more: This Vehicle becomes an artifact creature until end of turn.)"
Hunt the Weak,4.0,['Green'],['G'],None,['Sorcery'],None,Common,KLD,None,None,None,Put a +1/+1 counter on target creature you control. Then that creature fights target creature you don't control. (Each deals damage equal to its power to the other.)
Prophetic Prism,2.0,None,None,None,['Artifact'],None,Common,KLD,None,None,None,"When Prophetic Prism enters the battlefield, draw a card.\n{1}, {T}: Add one mana of any color."
Highspire Artisan,3.0,['Green'],['G'],None,['Creature'],"['Elf', 'Artificer']",Common,KLD,0,3,None,"Reach (This creature can block creatures with flying.)\nFabricate 1 (When this creature enters the battlefield, put a +1/+1 counter on it or create a 1/1 colorless Servo artifact creature token.)"
Key to the City,2.0,None,None,None,['Artifact'],None,Rare,KLD,None,None,None,"{T}, Discard a card: Up to one target creature can't be blocked this turn.\nWhenever Key to the City becomes untapped, you may pay {2}. If you do, draw a card."
Prakhata Pillar-Bug,3.0,None,['B'],None,"['Artifact', 'Creature']",['Insect'],Common,KLD,2,3,None,{B}: Prakhata Pillar-Bug gains lifelink until end of turn. (Damage dealt by this creature also causes you to gain that much life.)
Ghirapur Guide,3.0,['Green'],['G'],None,['Creature'],"['Elf', 'Scout']",Uncommon,KLD,3,2,None,{2}{G}: Target creature you control can't be blocked by creatures with power 2 or less this turn.
Perpetual Timepiece,2.0,None,None,None,['Artifact'],None,Uncommon,KLD,None,None,None,"{T}: Mill two cards.\n{2}, Exile Perpetual Timepiece: Shuffle any number of target cards from your graveyard into your library."
Fairgrounds Trumpeter,3.0,['Green'],['G'],None,['Creature'],['Elephant'],Uncommon,KLD,2,2,None,"At the beginning of each end step, if a +1/+1 counter was put on a permanent under your control this turn, put a +1/+1 counter on Fairgrounds Trumpeter."
Panharmonicon,4.0,None,None,None,['Artifact'],None,Rare,KLD,None,None,None,"If an artifact or creature entering the battlefield causes a triggered ability of a permanent you control to trigger, that ability triggers an additional time."
Elegant Edgecrafters,6.0,['Green'],['G'],None,['Creature'],"['Elf', 'Artificer']",Uncommon,KLD,3,4,None,"Elegant Edgecrafters can't be blocked by creatures with power 2 or less.\nFabricate 2 (When this creature enters the battlefield, put two +1/+1 counters on it or create two 1/1 colorless Servo artifact creature tokens.)"
Ovalchase Dragster,4.0,None,None,None,['Artifact'],['Vehicle'],Uncommon,KLD,6,1,None,"Trample, haste\nCrew 1 (Tap any number of creatures you control with total power 1 or more: This Vehicle becomes an artifact creature until end of turn.)"
Durable Handicraft,2.0,['Green'],['G'],None,['Enchantment'],None,Uncommon,KLD,None,None,None,"Whenever a creature enters the battlefield under your control, you may pay {1}. If you do, put a +1/+1 counter on that creature.\n{5}{G}, Sacrifice Durable Handicraft: Put a +1/+1 counter on each creature you control."
Narnam Cobra,2.0,None,['G'],None,"['Artifact', 'Creature']",['Snake'],Common,KLD,2,1,None,{G}: Narnam Cobra gains deathtouch until end of turn. (Any amount of damage it deals to a creature is enough to destroy it.)
Dubious Challenge,4.0,['Green'],['G'],None,['Sorcery'],None,Rare,KLD,None,None,None,"Look at the top ten cards of your library, exile up to two creature cards from among them, then shuffle. Target opponent may choose one of the exiled cards and put it onto the battlefield under their control. Put the rest onto the battlefield under your control."
Multiform Wonder,5.0,None,None,None,"['Artifact', 'Creature']",['Construct'],Rare,KLD,3,3,None,"When Multiform Wonder enters the battlefield, you get {E}{E}{E} (three energy counters).\nPay {E}: Multiform Wonder gains your choice of flying, vigilance, or lifelink until end of turn.\nPay {E}: Multiform Wonder gets +2/-2 or -2/+2 until end of turn."
Disappearing Act,3.0,['Blue'],['U'],None,['Instant'],None,Uncommon,KLD,None,None,None,"As an additional cost to cast this spell, return a permanent you control to its owner's hand.\nCounter target spell."
Cultivator of Blades,5.0,['Green'],['G'],None,['Creature'],"['Elf', 'Artificer']",Rare,KLD,1,1,None,"Fabricate 2 (When this creature enters the battlefield, put two +1/+1 counters on it or create two 1/1 colorless Servo artifact creature tokens.)\nWhenever Cultivator of Blades attacks, you may have other attacking creatures get +X/+X until end of turn, where X is Cultivator of Blades's power."
Metalwork Colossus,11.0,None,None,None,"['Artifact', 'Creature']",['Construct'],Rare,KLD,10,10,None,"This spell costs {X} less to cast, where X is the total mana value of noncreature artifacts you control.\nSacrifice two artifacts: Return Metalwork Colossus from your graveyard to your hand."
Curio Vendor,2.0,['Blue'],['U'],None,['Creature'],['Vedalken'],Common,KLD,2,1,None,None
Creeping Mold,4.0,['Green'],['G'],None,['Sorcery'],None,Uncommon,KLD,None,None,None,"Destroy target artifact, enchantment, or land."
Confiscation Coup,5.0,['Blue'],['U'],None,['Sorcery'],None,Rare,KLD,None,None,None,"Choose target artifact or creature. You get {E}{E}{E}{E} (four energy counters), then you may pay an amount of {E} equal to that permanent's mana value. If you do, gain control of it."
Cowl Prowler,6.0,['Green'],['G'],None,['Creature'],['Wurm'],Common,KLD,6,6,None,None
Metalspinner's Puzzleknot,2.0,None,['B'],None,['Artifact'],None,Common,KLD,None,None,None,"When Metalspinner's Puzzleknot enters the battlefield, you draw a card and you lose 1 life.\n{2}{B}, Sacrifice Metalspinner's Puzzleknot: You draw a card and you lose 1 life."
Ceremonious Rejection,1.0,['Blue'],['U'],None,['Instant'],None,Uncommon,KLD,None,None,None,Counter target colorless spell.
Hightide Hermit,5.0,['Blue'],['U'],None,['Creature'],['Crab'],Common,KLD,4,4,None,"Defender\nWhen Hightide Hermit enters the battlefield, you get {E}{E}{E}{E} (four energy counters).\nPay {E}{E}: Hightide Hermit can attack this turn as though it didn't have defender."
Commencement of Festivities,2.0,['Green'],['G'],None,['Instant'],None,Common,KLD,None,None,None,Prevent all combat damage that would be dealt to players this turn.
Aethersquall Ancient,7.0,['Blue'],['U'],None,['Creature'],['Leviathan'],Rare,KLD,6,6,None,"Flying\nAt the beginning of your upkeep, you get {E}{E}{E} (three energy counters).\nPay {E}{E}{E}{E}{E}{E}{E}{E}: Return all other creatures to their owners' hands. Activate only as a sorcery."
Bristling Hydra,4.0,['Green'],['G'],None,['Creature'],['Hydra'],Rare,KLD,4,3,None,"When Bristling Hydra enters the battlefield, you get {E}{E}{E} (three energy counters).\nPay {E}{E}{E}: Put a +1/+1 counter on Bristling Hydra. It gains hexproof until end of turn."
Iron League Steed,4.0,None,None,None,"['Artifact', 'Creature']",['Construct'],Uncommon,KLD,2,2,None,"Haste\nFabricate 1 (When this creature enters the battlefield, put a +1/+1 counter on it or create a 1/1 colorless Servo artifact creature token.)"
Aether Tradewinds,3.0,['Blue'],['U'],None,['Instant'],None,Common,KLD,None,None,None,Return target permanent you control and target permanent you don't control to their owners' hands.
Blossoming Defense,1.0,['Green'],['G'],None,['Instant'],None,Uncommon,KLD,None,None,None,Target creature you control gets +2/+2 and gains hexproof until end of turn.
Inventor's Goggles,1.0,None,None,None,['Artifact'],['Equipment'],Common,KLD,None,None,None,"Equipped creature gets +1/+2.\nWhenever an Artificer enters the battlefield under your control, you may attach Inventor's Goggles to it.\nEquip {2} ({2}: Attach to target creature you control. Equip only as a sorcery.)"
Aether Theorist,2.0,['Blue'],['U'],None,['Creature'],"['Vedalken', 'Rogue']",Common,KLD,1,3,None,"When Aether Theorist enters the battlefield, you get {E}{E}{E} (three energy counters).\n{T}, Pay {E}: Scry 1. (Look at the top card of your library. You may put that card on the bottom of your library.)"
Attune with Aether,1.0,['Green'],['G'],None,['Sorcery'],None,Common,KLD,None,None,None,"Search your library for a basic land card, reveal it, put it into your hand, then shuffle. You get {E}{E} (two energy counters)."
Glassblower's Puzzleknot,2.0,None,['U'],None,['Artifact'],None,Common,KLD,None,None,None,"When Glassblower's Puzzleknot enters the battlefield, scry 2, then you get {E}{E}. (You get two energy counters. To scry 2, look at the top two cards of your library, then put any number of them on the bottom of your library and the rest on top in any order.)\n{2}{U}, Sacrifice Glassblower's Puzzleknot: Scry 2, then you get {E}{E}."
Aether Meltdown,2.0,['Blue'],['U'],None,['Enchantment'],['Aura'],Uncommon,KLD,None,None,None,"Flash (You may cast this spell any time you could cast an instant.)\nEnchant creature or Vehicle\nWhen Aether Meltdown enters the battlefield, you get {E}{E} (two energy counters).\nEnchanted creature gets -4/-0."
Armorcraft Judge,4.0,['Green'],['G'],None,['Creature'],"['Elf', 'Artificer']",Uncommon,KLD,3,3,None,"When Armorcraft Judge enters the battlefield, draw a card for each creature you control with a +1/+1 counter on it."
Ghirapur Orrery,4.0,None,None,None,['Artifact'],None,Rare,KLD,None,None,None,"Each player may play an additional land on each of their turns.\nAt the beginning of each player's upkeep, if that player has no cards in hand, that player draws three cards."
Wispweaver Angel,6.0,['White'],['W'],None,['Creature'],['Angel'],Uncommon,KLD,4,4,None,"Flying\nWhen Wispweaver Angel enters the battlefield, you may exile another target creature you control, then return that card to the battlefield under its owner's control."
Architect of the Untamed,3.0,['Green'],['G'],None,['Creature'],"['Elf', 'Artificer', 'Druid']",Rare,KLD,2,3,None,"Whenever a land enters the battlefield under your control, you get {E} (an energy counter).\nPay {E}{E}{E}{E}{E}{E}{E}{E}: Create a 6/6 colorless Beast artifact creature token."
Foundry Inspector,3.0,None,None,None,"['Artifact', 'Creature']",['Construct'],Uncommon,KLD,3,2,None,Artifact spells you cast cost {1} less to cast.
Visionary Augmenter,4.0,['White'],['W'],None,['Creature'],"['Dwarf', 'Artificer']",Uncommon,KLD,2,1,None,"Fabricate 2 (When this creature enters the battlefield, put two +1/+1 counters on it or create two 1/1 colorless Servo artifact creature tokens.)"
Chief of the Foundry,3.0,None,None,None,"['Artifact', 'Creature']",['Construct'],Uncommon,KLD,2,3,None,Other artifact creatures you control get +1/+1.
Trusty Companion,2.0,['White'],['W'],None,['Creature'],['Hyena'],Uncommon,KLD,3,2,None,Vigilance\nTrusty Companion can't attack alone.
Appetite for the Unnatural,3.0,['Green'],['G'],None,['Instant'],None,Common,KLD,None,None,None,Destroy target artifact or enchantment. You gain 2 life.
Fabrication Module,3.0,None,None,None,['Artifact'],None,Uncommon,KLD,None,None,None,"Whenever you get one or more {E} (energy counters), put a +1/+1 counter on target creature you control.\n{4}, {T}: You get {E}."
Toolcraft Exemplar,1.0,['White'],['W'],None,['Creature'],"['Dwarf', 'Artificer']",Rare,KLD,1,1,None,"At the beginning of combat on your turn, if you control an artifact, Toolcraft Exemplar gets +2/+1 until end of turn. If you control three or more artifacts, it also gains first strike until end of turn."
Welding Sparks,3.0,['Red'],['R'],None,['Instant'],None,Common,KLD,None,None,None,"Welding Sparks deals X damage to target creature, where X is 3 plus the number of artifacts you control."
Fireforger's Puzzleknot,2.0,None,['R'],None,['Artifact'],None,Common,KLD,None,None,None,"When Fireforger's Puzzleknot enters the battlefield, it deals 1 damage to any target.\n{2}{R}, Sacrifice Fireforger's Puzzleknot: It deals 1 damage to any target."
Thriving Ibex,4.0,['White'],['W'],None,['Creature'],['Goat'],Common,KLD,2,4,None,"When Thriving Ibex enters the battlefield, you get {E}{E} (two energy counters).\nWhenever Thriving Ibex attacks, you may pay {E}{E}. If you do, put a +1/+1 counter on it."
Wayward Giant,5.0,['Red'],['R'],None,['Creature'],['Giant'],Common,KLD,4,5,None,Menace
Fleetwheel Cruiser,4.0,None,None,None,['Artifact'],['Vehicle'],Rare,KLD,5,3,None,"Trample, haste\nWhen Fleetwheel Cruiser enters the battlefield, it becomes an artifact creature until end of turn.\nCrew 2 (Tap any number of creatures you control with total power 2 or more: This Vehicle becomes an artifact creature until end of turn.)"
Tasseled Dromedary,1.0,['White'],['W'],None,['Creature'],['Camel'],Common,KLD,0,4,None,None
Glint-Nest Crane,2.0,['Blue'],['U'],None,['Creature'],['Bird'],Uncommon,KLD,1,3,None,"Flying\nWhen Glint-Nest Crane enters the battlefield, look at the top four cards of your library. You may reveal an artifact card from among them and put it into your hand. Put the rest on the bottom of your library in any order."
Thriving Grubs,2.0,['Red'],['R'],None,['Creature'],['Gremlin'],Common,KLD,2,1,None,"When Thriving Grubs enters the battlefield, you get {E}{E} (two energy counters).\nWhenever Thriving Grubs attacks, you may pay {E}{E}. If you do, put a +1/+1 counter on it."
Skywhaler's Shot,3.0,['White'],['W'],None,['Instant'],None,Uncommon,KLD,None,None,None,Destroy target creature with power 3 or greater. Scry 1. (Look at the top card of your library. You may put that card on the bottom of your library.)
Terror of the Fairgrounds,4.0,['Red'],['R'],None,['Creature'],['Gremlin'],Common,KLD,5,2,None,None
Electrostatic Pummeler,3.0,None,None,None,"['Artifact', 'Creature']",['Construct'],Rare,KLD,1,1,None,"When Electrostatic Pummeler enters the battlefield, you get {E}{E}{E} (three energy counters).\nPay {E}{E}{E}: Electrostatic Pummeler gets +X/+X until end of turn, where X is its power."
Skyswirl Harrier,5.0,['White'],['W'],None,['Creature'],['Bird'],Common,KLD,3,4,None,Flying
Territorial Gorger,4.0,['Red'],['R'],None,['Creature'],['Gremlin'],Rare,KLD,2,2,None,"Trample\nWhenever you get one or more {E} (energy counters), Territorial Gorger gets +2/+2 until end of turn."
Eager Construct,2.0,None,None,None,"['Artifact', 'Creature']",['Construct'],Common,KLD,2,2,None,"When Eager Construct enters the battlefield, each player may scry 1. (To scry 1, look at the top card of your library, then you may put that card on the bottom of your library.)"
Servo Exhibition,2.0,['White'],['W'],None,['Sorcery'],None,Uncommon,KLD,None,None,None,Create two 1/1 colorless Servo artifact creature tokens.
Glimmer of Genius,4.0,['Blue'],['U'],None,['Instant'],None,Uncommon,KLD,None,None,None,"Scry 2, then draw two cards. You get {E}{E} (two energy counters)."
Start Your Engines,4.0,['Red'],['R'],None,['Sorcery'],None,Uncommon,KLD,None,None,None,Vehicles you control become artifact creatures until end of turn. Creatures you control get +2/+0 until end of turn.
Revoke Privileges,3.0,['White'],['W'],None,['Enchantment'],['Aura'],Common,KLD,None,None,None,"Enchant creature\nEnchanted creature can't attack, block, or crew Vehicles."
Dynavolt Tower,3.0,None,None,None,['Artifact'],None,Rare,KLD,None,None,None,"Whenever you cast an instant or sorcery spell, you get {E}{E} (two energy counters).\n{T}, Pay {E}{E}{E}{E}{E}: Dynavolt Tower deals 3 damage to any target."
Refurbish,4.0,['White'],['W'],None,['Sorcery'],None,Uncommon,KLD,None,None,None,Return target artifact card from your graveyard to the battlefield.
Spontaneous Artist,4.0,['Red'],['R'],None,['Creature'],"['Human', 'Rogue']",Common,KLD,3,3,None,"When Spontaneous Artist enters the battlefield, you get {E} (an energy counter).\nPay {E}: Target creature gains haste until end of turn."
Decoction Module,2.0,None,None,None,['Artifact'],None,Uncommon,KLD,None,None,None,"Whenever a creature enters the battlefield under your control, you get {E} (an energy counter).\n{4}, {T}: Return target creature you control to its owner's hand."
Propeller Pioneer,4.0,['White'],['W'],None,['Creature'],"['Human', 'Artificer']",Common,KLD,2,1,None,"Flying\nFabricate 1 (When this creature enters the battlefield, put a +1/+1 counter on it or create a 1/1 colorless Servo artifact creature token.)"
Spireside Infiltrator,3.0,['Red'],['R'],None,['Creature'],"['Human', 'Rogue']",Common,KLD,3,2,None,"Whenever Spireside Infiltrator becomes tapped, it deals 1 damage to each opponent."
Dukhara Peafowl,4.0,None,['U'],None,"['Artifact', 'Creature']",['Bird'],Common,KLD,2,4,None,{U}: Dukhara Peafowl gains flying until end of turn.
Pressure Point,2.0,['White'],['W'],None,['Instant'],None,Common,KLD,None,None,None,Tap target creature.\nDraw a card.
Speedway Fanatic,2.0,['Red'],['R'],None,['Creature'],"['Human', 'Pilot']",Uncommon,KLD,2,1,None,"Haste\nWhenever Speedway Fanatic crews a Vehicle, that Vehicle gains haste until end of turn."
Demolition Stomper,6.0,None,None,None,['Artifact'],['Vehicle'],Uncommon,KLD,10,7,None,Demolition Stomper can't be blocked by creatures with power 2 or less.\nCrew 5 (Tap any number of creatures you control with total power 5 or more: This Vehicle becomes an artifact creature until end of turn.)
Ninth Bridge Patrol,2.0,['White'],['W'],None,['Creature'],"['Dwarf', 'Soldier']",Common,KLD,1,1,None,"Whenever another creature you control leaves the battlefield, put a +1/+1 counter on Ninth Bridge Patrol."
Spark of Creativity,1.0,['Red'],['R'],None,['Sorcery'],None,Uncommon,KLD,None,None,None,"Choose target creature. Exile the top card of your library. You may have Spark of Creativity deal damage to that creature equal to the exiled card's mana value. If you don't, you may play that card until end of turn."
Cogworker's Puzzleknot,2.0,None,['W'],None,['Artifact'],None,Common,KLD,None,None,None,"When Cogworker's Puzzleknot enters the battlefield, create a 1/1 colorless Servo artifact creature token.\n{1}{W}, Sacrifice Cogworker's Puzzleknot: Create a 1/1 colorless Servo artifact creature token."
Master Trinketeer,3.0,['White'],['W'],None,['Creature'],"['Dwarf', 'Artificer']",Rare,KLD,3,2,None,Servos and Thopters you control get +1/+1.\n{3}{W}: Create a 1/1 colorless Servo artifact creature token.
Skyship Stalker,4.0,['Red'],['R'],None,['Creature'],['Dragon'],Rare,KLD,3,3,None,Flying\n{R}: Skyship Stalker gets +1/+0 until end of turn.\n{R}: Skyship Stalker gains first strike until end of turn.\n{R}: Skyship Stalker gains haste until end of turn.
Bomat Courier,1.0,None,['R'],None,"['Artifact', 'Creature']",['Construct'],Rare,KLD,1,1,None,"Haste\nWhenever Bomat Courier attacks, exile the top card of your library face down. (You can't look at it.)\n{R}, Discard your hand, Sacrifice Bomat Courier: Put all cards exiled with Bomat Courier into their owners' hands."
Inspired Charge,4.0,['White'],['W'],None,['Instant'],None,Common,KLD,None,None,None,Creatures you control get +2/+1 until end of turn.
Salivating Gremlins,3.0,['Red'],['R'],None,['Creature'],['Gremlin'],Common,KLD,2,3,None,"Whenever an artifact enters the battlefield under your control, Salivating Gremlins gets +2/+0 and gains trample until end of turn."
Deadlock Trap,3.0,None,None,None,['Artifact'],None,Rare,KLD,None,None,None,"Deadlock Trap enters the battlefield tapped.\nWhen Deadlock Trap enters the battlefield, you get {E}{E} (two energy counters).\n{T}, Pay {E}: Tap target creature or planeswalker. Its activated abilities can't be activated this turn."
Impeccable Timing,2.0,['White'],['W'],None,['Instant'],None,Common,KLD,None,None,None,Impeccable Timing deals 3 damage to target attacking or blocking creature.
Herald of the Fair,3.0,['White'],['W'],None,['Creature'],['Human'],Common,KLD,3,2,None,"When Herald of the Fair enters the battlefield, target creature you control gets +1/+1 until end of turn."
Ruinous Gremlin,1.0,['Red'],['R'],None,['Creature'],['Gremlin'],Common,KLD,1,1,None,"{2}{R}, Sacrifice Ruinous Gremlin: Destroy target artifact."
Cultivator's Caravan,3.0,None,None,None,['Artifact'],['Vehicle'],Rare,KLD,5,5,None,{T}: Add one mana of any color.\nCrew 3 (Tap any number of creatures you control with total power 3 or more: This Vehicle becomes an artifact creature until end of turn.)
Glint-Sleeve Artisan,3.0,['White'],['W'],None,['Creature'],"['Dwarf', 'Artificer']",Common,KLD,2,2,None,"Fabricate 1 (When this creature enters the battlefield, put a +1/+1 counter on it or create a 1/1 colorless Servo artifact creature token.)"
Renegade Tactics,1.0,['Red'],['R'],None,['Sorcery'],None,Common,KLD,None,None,None,Target creature can't block this turn.\nDraw a card.
Consulate Skygate,2.0,None,None,None,"['Artifact', 'Creature']",['Wall'],Common,KLD,0,4,None,Defender\nReach (This creature can block creatures with flying.)
Gearshift Ace,2.0,['White'],['W'],None,['Creature'],"['Dwarf', 'Pilot']",Uncommon,KLD,2,1,None,"First strike\nWhenever Gearshift Ace crews a Vehicle, that Vehicle gains first strike until end of turn."
Reckless Fireweaver,2.0,['Red'],['R'],None,['Creature'],"['Human', 'Artificer']",Common,KLD,1,3,None,"Whenever an artifact enters the battlefield under your control, Reckless Fireweaver deals 1 damage to each opponent."
Bomat Bazaar Barge,4.0,None,None,None,['Artifact'],['Vehicle'],Uncommon,KLD,5,5,None,"When Bomat Bazaar Barge enters the battlefield, draw a card.\nCrew 3 (Tap any number of creatures you control with total power 3 or more: This Vehicle becomes an artifact creature until end of turn.)"
