Name,CMC,Colors,Color identity,Supertypes,Types,Subtypes,Rarity,Set,Power,Toughness,Loyalty,Text
Fumigate,5.0,['White'],['W'],None,['Sorcery'],None,Rare,KLD,None,None,None,Destroy all creatures. You gain 1 life for each creature destroyed this way.
Quicksmith Genius,3.0,['Red'],['R'],None,['Creature'],"['Human', 'Artificer']",Uncommon,KLD,3,2,None,"Whenever an artifact enters the battlefield under your control, you may discard a card. If you do, draw a card."
Bastion Mastodon,5.0,None,['W'],None,"['Artifact', 'Creature']",['Elephant'],Common,KLD,4,5,None,{W}: Bastion Mastodon gains vigilance until end of turn.
Brazen Scourge,3.0,['Red'],['R'],None,['Creature'],['Gremlin'],Uncommon,KLD,3,3,None,Haste
Pia Nalaar,3.0,['Red'],['R'],['Legendary'],['Creature'],"['Human', 'Artificer']",Rare,KLD,2,2,None,"When Pia Nalaar enters the battlefield, create a 1/1 colorless Thopter artifact creature token with flying.\n{1}{R}: Target artifact creature gets +1/+0 until end of turn.\n{1}, Sacrifice an artifact: Target creature can't block this turn."
Ballista Charger,5.0,None,None,None,['Artifact'],['Vehicle'],Uncommon,KLD,6,6,None,"Whenever Ballista Charger attacks, it deals 1 damage to any target.\nCrew 3 (Tap any number of creatures you control with total power 3 or more: This Vehicle becomes an artifact creature until end of turn.)"
Consul's Shieldguard,4.0,['White'],['W'],None,['Creature'],"['Dwarf', 'Soldier']",Uncommon,KLD,3,4,None,"When Consul's Shieldguard enters the battlefield, you get {E}{E} (two energy counters).\nWhenever Consul's Shieldguard attacks, you may pay {E}. If you do, another target attacking creature gains indestructible until end of turn."
Maulfist Doorbuster,4.0,['Red'],['R'],None,['Creature'],"['Human', 'Warrior']",Uncommon,KLD,4,2,None,"When Maulfist Doorbuster enters the battlefield, you get {E}{E} (two energy counters).\nWhenever Maulfist Doorbuster attacks, you may pay {E}. If you do, target creature can't block this turn."
Aradara Express,5.0,None,None,None,['Artifact'],['Vehicle'],Common,KLD,8,6,None,Menace\nCrew 4 (Tap any number of creatures you control with total power 4 or more: This Vehicle becomes an artifact creature until end of turn.)
Fairgrounds Warden,3.0,['White'],['W'],None,['Creature'],"['Dwarf', 'Soldier']",Uncommon,KLD,1,3,None,"When Fairgrounds Warden enters the battlefield, exile target creature an opponent controls until Fairgrounds Warden leaves the battlefield."
Madcap Experiment,4.0,['Red'],['R'],None,['Sorcery'],None,Rare,KLD,None,None,None,Reveal cards from the top of your library until you reveal an artifact card. Put that card onto the battlefield and the rest on the bottom of your library in a random order. Madcap Experiment deals damage to you equal to the number of cards revealed this way.
Animation Module,1.0,None,None,None,['Artifact'],None,Rare,KLD,None,None,None,"Whenever one or more +1/+1 counters are put on a permanent you control, you may pay {1}. If you do, create a 1/1 colorless Servo artifact creature token.\n{3}, {T}: Choose a counter on target permanent or player. Give that permanent or player another counter of that kind."
Fragmentize,1.0,['White'],['W'],None,['Sorcery'],None,Common,KLD,None,None,None,Destroy target artifact or enchantment with mana value 4 or less.
Lathnu Hellion,3.0,['Red'],['R'],None,['Creature'],['Hellion'],Rare,KLD,4,4,None,"Haste\nWhen Lathnu Hellion enters the battlefield, you get {E}{E} (two energy counters).\nAt the beginning of your end step, sacrifice Lathnu Hellion unless you pay {E}{E}."
Aetherworks Marvel,4.0,None,None,['Legendary'],['Artifact'],None,Mythic,KLD,None,None,None,"Whenever a permanent you control is put into a graveyard, you get {E} (an energy counter).\n{T}, Pay {E}{E}{E}{E}{E}{E}: Look at the top six cards of your library. You may cast a spell from among them without paying its mana cost. Put the rest on the bottom of your library in a random order."
Eddytrail Hawk,2.0,['White'],['W'],None,['Creature'],['Bird'],Common,KLD,1,2,None,"Flying\nWhen Eddytrail Hawk enters the battlefield, you get {E}{E} (two energy counters).\nWhenever Eddytrail Hawk attacks, you may pay {E}. If you do, another target attacking creature gains flying until end of turn."
Inventor's Apprentice,1.0,['Red'],['R'],None,['Creature'],"['Human', 'Artificer']",Uncommon,KLD,1,2,None,Inventor's Apprentice gets +1/+1 as long as you control an artifact.
Aetherflux Reservoir,4.0,None,None,None,['Artifact'],None,Rare,KLD,None,None,None,"Whenever you cast a spell, you gain 1 life for each spell you've cast this turn.\nPay 50 life: Aetherflux Reservoir deals 50 damage to any target."
Consulate Surveillance,4.0,['White'],['W'],None,['Enchantment'],None,Uncommon,KLD,None,None,None,"When Consulate Surveillance enters the battlefield, you get {E}{E}{E}{E} (four energy counters).\nPay {E}{E}: Prevent all damage that would be dealt to you this turn by a source of your choice."
Incendiary Sabotage,4.0,['Red'],['R'],None,['Instant'],None,Uncommon,KLD,None,None,None,"As an additional cost to cast this spell, sacrifice an artifact.\nIncendiary Sabotage deals 3 damage to each creature."
Accomplished Automaton,7.0,None,None,None,"['Artifact', 'Creature']",['Construct'],Common,KLD,5,7,None,"Fabricate 1 (When this creature enters the battlefield, put a +1/+1 counter on it or create a 1/1 colorless Servo artifact creature token.)"
Cataclysmic Gearhulk,5.0,['White'],['W'],None,"['Artifact', 'Creature']",['Construct'],Mythic,KLD,4,5,None,"Vigilance\nWhen Cataclysmic Gearhulk enters the battlefield, each player chooses an artifact, a creature, an enchantment, and a planeswalker from among the nonland permanents they control, then sacrifices the rest."
Gearseeker Serpent,7.0,['Blue'],['U'],None,['Creature'],['Serpent'],Common,KLD,5,6,None,This spell costs {1} less to cast for each artifact you control.\n{5}{U}: Gearseeker Serpent can't be blocked this turn.
Hijack,3.0,['Red'],['R'],None,['Sorcery'],None,Common,KLD,None,None,None,Gain control of target artifact or creature until end of turn. Untap it. It gains haste until end of turn.
Captured by the Consulate,4.0,['White'],['W'],None,['Enchantment'],['Aura'],Rare,KLD,None,None,None,"Enchant creature you don't control\nEnchanted creature can't attack.\nWhenever an opponent casts a spell, if it has a single target, change the target to enchanted creature if able."
Harnessed Lightning,2.0,['Red'],['R'],None,['Instant'],None,Uncommon,KLD,None,None,None,"Choose target creature. You get {E}{E}{E} (three energy counters), then you may pay any amount of {E}. Harnessed Lightning deals that much damage to that creature."
Voltaic Brawler,2.0,"['Green', 'Red']","['G', 'R']",None,['Creature'],"['Human', 'Warrior']",Uncommon,KLD,3,2,None,"When Voltaic Brawler enters the battlefield, you get {E}{E} (two energy counters).\nWhenever Voltaic Brawler attacks, you may pay {E}. If you do, it gets +1/+1 and gains trample until end of turn."
Authority of the Consuls,1.0,['White'],['W'],None,['Enchantment'],None,Rare,KLD,None,None,None,"Creatures your opponents control enter the battlefield tapped.\nWhenever a creature enters the battlefield under an opponent's control, you gain 1 life."
Giant Spectacle,2.0,['Red'],['R'],None,['Enchantment'],['Aura'],Common,KLD,None,None,None,Enchant creature\nEnchanted creature gets +2/+1 and has menace.
Veteran Motorist,2.0,"['Red', 'White']","['R', 'W']",None,['Creature'],"['Dwarf', 'Pilot']",Uncommon,KLD,3,1,None,"When Veteran Motorist enters the battlefield, scry 2.\nWhenever Veteran Motorist crews a Vehicle, that Vehicle gets +1/+1 until end of turn."
Built to Last,1.0,['White'],['W'],None,['Instant'],None,Common,KLD,None,None,None,"Target creature gets +2/+2 until end of turn. If it's an artifact creature, it gains indestructible until end of turn. (Damage and effects that say ""destroy"" don't destroy it.)"
Furious Reprisal,4.0,['Red'],['R'],None,['Sorcery'],None,Uncommon,KLD,None,None,None,Furious Reprisal deals 2 damage to each of two targets.
Aviary Mechanic,2.0,['White'],['W'],None,['Creature'],"['Dwarf', 'Artificer']",Common,KLD,2,2,None,"When Aviary Mechanic enters the battlefield, you may return another permanent you control to its owner's hand."
Subtle Strike,2.0,['Black'],['B'],None,['Instant'],None,Common,KLD,None,None,None,Choose one or both —\n• Target creature gets -1/-1 until end of turn.\n• Put a +1/+1 counter on target creature.
Unlicensed Disintegration,3.0,"['Black', 'Red']","['B', 'R']",None,['Instant'],None,Uncommon,KLD,None,None,None,"Destroy target creature. If you control an artifact, Unlicensed Disintegration deals 3 damage to that creature's controller."
Arborback Stomper,5.0,['Green'],['G'],None,['Creature'],['Beast'],Uncommon,KLD,5,4,None,"Trample\nWhen Arborback Stomper enters the battlefield, you gain 5 life."
Chandra's Pyrohelix,2.0,['Red'],['R'],None,['Instant'],None,Common,KLD,None,None,None,Chandra's Pyrohelix deals 2 damage divided as you choose among one or two targets.
Saheeli Rai,3.0,"['Red', 'Blue']","['R', 'U']",['Legendary'],['Planeswalker'],['Saheeli'],Mythic,KLD,None,None,3,"[+1]: Scry 1. Saheeli Rai deals 1 damage to each opponent.\n[−2]: Create a token that's a copy of target artifact or creature you control, except it's an artifact in addition to its other types. That token gains haste. Exile it at the beginning of the next end step.\n[−7]: Search your library for up to three artifact cards with different names, put them onto the battlefield, then shuffle."
Acrobatic Maneuver,3.0,['White'],['W'],None,['Instant'],None,Common,KLD,None,None,None,"Exile target creature you control, then return that card to the battlefield under its owner's control.\nDraw a card."
Demolish,4.0,['Red'],['R'],None,['Sorcery'],None,Common,KLD,None,None,None,Destroy target artifact or land.
Restoration Gearsmith,4.0,"['Black', 'White']","['B', 'W']",None,['Creature'],"['Human', 'Artificer']",Uncommon,KLD,3,3,None,"When Restoration Gearsmith enters the battlefield, return target artifact or creature card from your graveyard to your hand."
Angel of Invention,5.0,['White'],['W'],None,['Creature'],['Angel'],Mythic,KLD,2,1,None,"Flying, vigilance, lifelink\nFabricate 2 (When this creature enters the battlefield, put two +1/+1 counters on it or create two 1/1 colorless Servo artifact creature tokens.)\nOther creatures you control get +1/+1."
Fateful Showdown,4.0,['Red'],['R'],None,['Instant'],None,Rare,KLD,None,None,None,"Fateful Showdown deals damage to any target equal to the number of cards in your hand. Discard all the cards in your hand, then draw that many cards."
"Rashmi, Eternities Crafter",4.0,"['Green', 'Blue']","['G', 'U']",['Legendary'],['Creature'],"['Elf', 'Druid']",Mythic,KLD,2,3,None,"Whenever you cast your first spell each turn, reveal the top card of your library. You may cast it without paying its mana cost if it's a spell with lesser mana value. If you don't cast it, put it into your hand."
Aetherstorm Roc,4.0,['White'],['W'],None,['Creature'],['Bird'],Rare,KLD,3,3,None,"Flying\nWhenever Aetherstorm Roc or another creature enters the battlefield under your control, you get {E} (an energy counter).\nWhenever Aetherstorm Roc attacks, you may pay {E}{E}. If you do, put a +1/+1 counter on it and tap up to one target creature defending player controls."
Combustible Gearhulk,6.0,['Red'],['R'],None,"['Artifact', 'Creature']",['Construct'],Mythic,KLD,6,6,None,"First strike\nWhen Combustible Gearhulk enters the battlefield, target opponent may have you draw three cards. If the player doesn't, you mill three cards, then Combustible Gearhulk deals damage to that player equal to the total mana value of those cards."
"Kambal, Consul of Allocation",3.0,"['Black', 'White']","['B', 'W']",['Legendary'],['Creature'],"['Human', 'Advisor']",Rare,KLD,2,3,None,"Whenever an opponent casts a noncreature spell, that player loses 2 life and you gain 2 life."
Aerial Responder,3.0,['White'],['W'],None,['Creature'],"['Dwarf', 'Soldier']",Uncommon,KLD,2,3,None,"Flying, vigilance, lifelink"
"Chandra, Torch of Defiance",4.0,['Red'],['R'],['Legendary'],['Planeswalker'],['Chandra'],Mythic,KLD,None,None,4,"[+1]: Exile the top card of your library. You may cast that card. If you don't, Chandra, Torch of Defiance deals 2 damage to each opponent.\n[+1]: Add {R}{R}.\n[−3]: Chandra, Torch of Defiance deals 4 damage to target creature.\n[−7]: You get an emblem with ""Whenever you cast a spell, this emblem deals 5 damage to any target."""
Hazardous Conditions,4.0,"['Black', 'Green']","['B', 'G']",None,['Sorcery'],None,Uncommon,KLD,None,None,None,Creatures with no counters on them get -2/-2 until end of turn.
Cathartic Reunion,2.0,['Red'],['R'],None,['Sorcery'],None,Common,KLD,None,None,None,"As an additional cost to cast this spell, discard two cards.\nDraw three cards."
Engineered Might,5.0,"['Green', 'White']","['G', 'W']",None,['Sorcery'],None,Uncommon,KLD,None,None,None,Choose one —\n• Target creature gets +5/+5 and gains trample until end of turn.\n• Creatures you control get +2/+2 and gain vigilance until end of turn.
Filigree Familiar,3.0,None,None,None,"['Artifact', 'Creature']",['Fox'],Uncommon,KLD,2,2,None,"When Filigree Familiar enters the battlefield, you gain 2 life.\nWhen Filigree Familiar dies, draw a card."
Built to Smash,1.0,['Red'],['R'],None,['Instant'],None,Common,KLD,None,None,None,"Target attacking creature gets +3/+3 until end of turn. If it's an artifact creature, it gains trample until end of turn."
Empyreal Voyager,3.0,"['Green', 'Blue']","['G', 'U']",None,['Creature'],"['Vedalken', 'Scout']",Uncommon,KLD,2,3,None,"Flying, trample\nWhenever Empyreal Voyager deals combat damage to a player, you get that many {E} (energy counters)."
Weaponcraft Enthusiast,3.0,['Black'],['B'],None,['Creature'],"['Aetherborn', 'Artificer']",Uncommon,KLD,0,1,None,"Fabricate 2 (When this creature enters the battlefield, put two +1/+1 counters on it or create two 1/1 colorless Servo artifact creature tokens.)"
Dovin Baan,4.0,"['Blue', 'White']","['U', 'W']",['Legendary'],['Planeswalker'],['Dovin'],Mythic,KLD,None,None,3,"[+1]: Until your next turn, up to one target creature gets -3/-0 and its activated abilities can't be activated.\n[−1]: You gain 2 life and draw a card.\n[−7]: You get an emblem with ""Your opponents can't untap more than two permanents during their untap steps."""
"Depala, Pilot Exemplar",3.0,"['Red', 'White']","['R', 'W']",['Legendary'],['Creature'],"['Dwarf', 'Pilot']",Rare,KLD,3,3,None,"Other Dwarves you control get +1/+1.\nEach Vehicle you control gets +1/+1 as long as it's a creature.\nWhenever Depala, Pilot Exemplar becomes tapped, you may pay {X}. If you do, reveal the top X cards of your library, put all Dwarf and Vehicle cards from among them into your hand, then put the rest on the bottom of your library in a random order."
Aethertorch Renegade,3.0,['Red'],['R'],None,['Creature'],"['Human', 'Rogue']",Uncommon,KLD,1,2,None,"When Aethertorch Renegade enters the battlefield, you get {E}{E}{E}{E} (four energy counters).\n{T}, Pay {E}{E}: Aethertorch Renegade deals 1 damage to target creature.\n{T}, Pay {E}{E}{E}{E}{E}{E}{E}{E}: Aethertorch Renegade deals 6 damage to target player or planeswalker."
Contraband Kingpin,2.0,"['Black', 'Blue']","['B', 'U']",None,['Creature'],"['Aetherborn', 'Rogue']",Uncommon,KLD,1,4,None,"Lifelink\nWhenever an artifact enters the battlefield under your control, scry 1."
Syndicate Trafficker,2.0,['Black'],['B'],None,['Creature'],"['Aetherborn', 'Rogue']",Rare,KLD,3,1,None,"{1}, Sacrifice an artifact: Put a +1/+1 counter on Syndicate Trafficker. It gains indestructible until end of turn."
Cloudblazer,5.0,"['Blue', 'White']","['U', 'W']",None,['Creature'],"['Human', 'Scout']",Uncommon,KLD,2,2,None,"Flying\nWhen Cloudblazer enters the battlefield, you gain 2 life and draw two cards."
Rush of Vitality,2.0,['Black'],['B'],None,['Instant'],None,Common,KLD,None,None,None,"Target creature gets +1/+0 and gains lifelink and indestructible until end of turn. (Damage dealt by that creature also causes its controller to gain that much life, and it can't be destroyed by damage or effects that say ""destroy."")"
Wily Bandar,1.0,['Green'],['G'],None,['Creature'],"['Cat', 'Monkey']",Common,KLD,1,1,None,"{2}{G}: Wily Bandar gains indestructible until end of turn. (Damage and effects that say ""destroy"" don't destroy it.)"
Underhanded Designs,2.0,['Black'],['B'],None,['Enchantment'],None,Uncommon,KLD,None,None,None,"Whenever an artifact enters the battlefield under your control, you may pay {1}. If you do, each opponent loses 1 life and you gain 1 life.\n{1}{B}, Sacrifice Underhanded Designs: Destroy target creature. Activate only if you control two or more artifacts."
Wildest Dreams,1.0,['Green'],['G'],None,['Sorcery'],None,Rare,KLD,None,None,None,Return X target cards from your graveyard to your hand. Exile Wildest Dreams.
Tidy Conclusion,5.0,['Black'],['B'],None,['Instant'],None,Common,KLD,None,None,None,Destroy target creature. You gain 1 life for each artifact you control.
Wild Wanderer,4.0,['Green'],['G'],None,['Creature'],"['Elf', 'Druid']",Common,KLD,3,2,None,"When Wild Wanderer enters the battlefield, you may search your library for a basic land card, put it onto the battlefield tapped, then shuffle."
Thriving Rats,2.0,['Black'],['B'],None,['Creature'],['Rat'],Common,KLD,1,2,None,"When Thriving Rats enters the battlefield, you get {E}{E} (two energy counters).\nWhenever Thriving Rats attacks, you may pay {E}{E}. If you do, put a +1/+1 counter on it."
Verdurous Gearhulk,5.0,['Green'],['G'],None,"['Artifact', 'Creature']",['Construct'],Mythic,KLD,4,4,None,"Trample\nWhen Verdurous Gearhulk enters the battlefield, distribute four +1/+1 counters among any number of target creatures you control."
Prakhata Club Security,4.0,['Black'],['B'],None,['Creature'],"['Aetherborn', 'Warrior']",Common,KLD,3,4,None,None
Thriving Rhino,3.0,['Green'],['G'],None,['Creature'],['Rhino'],Common,KLD,2,3,None,"When Thriving Rhino enters the battlefield, you get {E}{E} (two energy counters).\nWhenever Thriving Rhino attacks, you may pay {E}{E}. If you do, put a +1/+1 counter on it."
Ovalchase Daredevil,4.0,['Black'],['B'],None,['Creature'],"['Human', 'Pilot']",Uncommon,KLD,4,2,None,"Whenever an artifact enters the battlefield under your control, you may return Ovalchase Daredevil from your graveyard to your hand."
Take Down,1.0,['Green'],['G'],None,['Sorcery'],None,Common,KLD,None,None,None,Choose one —\n• Take Down deals 4 damage to target creature with flying.\n• Take Down deals 1 damage to each creature with flying.
Noxious Gearhulk,6.0,['Black'],['B'],None,"['Artifact', 'Creature']",['Construct'],Mythic,KLD,5,4,None,"Menace\nWhen Noxious Gearhulk enters the battlefield, you may destroy another target creature. If a creature is destroyed this way, you gain life equal to its toughness."
Servant of the Conduit,2.0,['Green'],['G'],None,['Creature'],"['Elf', 'Druid']",Uncommon,KLD,2,2,None,"When Servant of the Conduit enters the battlefield, you get {E}{E} (two energy counters).\n{T}, Pay {E}: Add one mana of any color."
Night Market Lookout,1.0,['Black'],['B'],None,['Creature'],"['Human', 'Rogue']",Common,KLD,1,1,None,"Whenever Night Market Lookout becomes tapped, each opponent loses 1 life and you gain 1 life."
"Oviya Pashiri, Sage Lifecrafter",1.0,['Green'],['G'],['Legendary'],['Creature'],"['Human', 'Artificer']",Rare,KLD,1,2,None,"{2}{G}, {T}: Create a 1/1 colorless Servo artifact creature token.\n{4}{G}, {T}: Create an X/X colorless Construct artifact creature token, where X is the number of creatures you control."
Morbid Curiosity,3.0,['Black'],['B'],None,['Sorcery'],None,Uncommon,KLD,None,None,None,"As an additional cost to cast this spell, sacrifice an artifact or creature.\nDraw cards equal to the mana value of the sacrificed permanent."
Mind Rot,3.0,['Black'],['B'],None,['Sorcery'],None,Common,KLD,None,None,None,Target player discards two cards.
Midnight Oil,4.0,['Black'],['B'],None,['Enchantment'],None,Rare,KLD,None,None,None,"Midnight Oil enters the battlefield with seven hour counters on it.\nAt the beginning of your draw step, draw an additional card and remove two hour counters from Midnight Oil.\nYour maximum hand size is equal to the number of hour counters on Midnight Oil.\nWhenever you discard a card, you lose 1 life."
"Skysovereign, Consul Flagship",5.0,None,None,['Legendary'],['Artifact'],['Vehicle'],Mythic,KLD,6,5,None,"Flying\nWhenever Skysovereign, Consul Flagship enters the battlefield or attacks, it deals 3 damage to target creature or planeswalker an opponent controls.\nCrew 3 (Tap any number of creatures you control with total power 3 or more: This Vehicle becomes an artifact creature until end of turn.)"
Maulfist Squad,4.0,['Black'],['B'],None,['Creature'],"['Human', 'Artificer']",Common,KLD,3,1,None,"Menace\nFabricate 1 (When this creature enters the battlefield, put a +1/+1 counter on it or create a 1/1 colorless Servo artifact creature token.)"
Marionette Master,6.0,['Black'],['B'],None,['Creature'],"['Human', 'Artificer']",Rare,KLD,1,3,None,"Fabricate 3 (When this creature enters the battlefield, put three +1/+1 counters on it or create three 1/1 colorless Servo artifact creature tokens.)\nWhenever an artifact you control is put into a graveyard from the battlefield, target opponent loses life equal to Marionette Master's power."
Smuggler's Copter,2.0,None,None,None,['Artifact'],['Vehicle'],Rare,KLD,3,3,None,"Flying\nWhenever Smuggler's Copter attacks or blocks, you may draw a card. If you do, discard a card.\nCrew 1 (Tap any number of creatures you control with total power 1 or more: This Vehicle becomes an artifact creature until end of turn.)"
Make Obsolete,3.0,['Black'],['B'],None,['Instant'],None,Uncommon,KLD,None,None,None,Creatures your opponents control get -1/-1 until end of turn.
Snare Thopter,4.0,None,None,None,"['Artifact', 'Creature']",['Thopter'],Uncommon,KLD,3,2,None,"Flying, haste"
Lost Legacy,3.0,['Black'],['B'],None,['Sorcery'],None,Rare,KLD,None,None,None,"Choose a nonartifact, nonland card name. Search target player's graveyard, hand, and library for any number of cards with that name and exile them. That player shuffles, then draws a card for each card exiled from their hand this way."
Riparian Tiger,5.0,['Green'],['G'],None,['Creature'],['Cat'],Common,KLD,4,4,None,"Trample\nWhen Riparian Tiger enters the battlefield, you get {E}{E} (two energy counters).\nWhenever Riparian Tiger attacks, you may pay {E}{E}. If you do, it gets +2/+2 until end of turn."
"Padeem, Consul of Innovation",4.0,['Blue'],['U'],['Legendary'],['Creature'],"['Vedalken', 'Artificer']",Rare,KLD,1,4,None,"Artifacts you control have hexproof.\nAt the beginning of your upkeep, if you control the artifact with the highest mana value or tied for the highest mana value, draw a card."
Live Fast,3.0,['Black'],['B'],None,['Sorcery'],None,Common,KLD,None,None,None,"You draw two cards, lose 2 life, and get {E}{E} (two energy counters)."
Liberating Combustion,5.0,['Red'],['R'],None,['Sorcery'],None,Rare,KLD,None,None,None,"Liberating Combustion deals 6 damage to target creature. You may search your library and/or graveyard for a card named Chandra, Pyrogenius, reveal it, and put it into your hand. If you search your library this way, shuffle."
Lawless Broker,3.0,['Black'],['B'],None,['Creature'],"['Aetherborn', 'Rogue']",Common,KLD,3,2,None,"When Lawless Broker dies, put a +1/+1 counter on target creature you control."
Flame Lash,4.0,['Red'],['R'],None,['Instant'],None,Common,KLD,None,None,None,Flame Lash deals 4 damage to any target.
"Chandra, Pyrogenius",6.0,['Red'],['R'],['Legendary'],['Planeswalker'],['Chandra'],Mythic,KLD,None,None,5,"[+2]: Chandra, Pyrogenius deals 2 damage to each opponent.\n[−3]: Chandra, Pyrogenius deals 4 damage to target creature.\n[−10]: Chandra, Pyrogenius deals 6 damage to target player or planeswalker and each creature that player or that planeswalker's controller controls."
Harsh Scrutiny,1.0,['Black'],['B'],None,['Sorcery'],None,Uncommon,KLD,None,None,None,Target opponent reveals their hand. You choose a creature card from it. That player discards that card. Scry 1.
Forest,0.0,None,['G'],['Basic'],['Land'],['Forest'],Common,KLD,None,None,None,({T}: Add {G}.)
"Gonti, Lord of Luxury",4.0,['Black'],['B'],['Legendary'],['Creature'],"['Aetherborn', 'Rogue']",Rare,KLD,2,3,None,"Deathtouch\nWhen Gonti, Lord of Luxury enters the battlefield, look at the top four cards of target opponent's library, exile one of them face down, then put the rest on the bottom of that library in a random order. You may look at and cast that card for as long as it remains exiled, and you may spend mana as though it were mana of any type to cast that spell."
Forest,0.0,None,['G'],['Basic'],['Land'],['Forest'],Common,KLD,None,None,None,({T}: Add {G}.)
Fretwork Colony,2.0,['Black'],['B'],None,['Creature'],['Insect'],Uncommon,KLD,1,1,None,"Fretwork Colony can't block.\nAt the beginning of your upkeep, put a +1/+1 counter on Fretwork Colony and you lose 1 life."
Forest,0.0,None,['G'],['Basic'],['Land'],['Forest'],Common,KLD,None,None,None,({T}: Add {G}.)
Foundry Screecher,3.0,['Black'],['B'],None,['Creature'],['Bat'],Common,KLD,2,1,None,Flying\nFoundry Screecher gets +1/+0 as long as you control an artifact.
Mountain,0.0,None,['R'],['Basic'],['Land'],['Mountain'],Common,KLD,None,None,None,({T}: Add {R}.)
Fortuitous Find,3.0,['Black'],['B'],None,['Sorcery'],None,Common,KLD,None,None,None,Choose one or both —\n• Return target artifact card from your graveyard to your hand.\n• Return target creature card from your graveyard to your hand.
