Name,CMC,Colors,Color identity,Supertypes,Types,Subtypes,Rarity,Set,Power,Toughness,Loyalty,Text
Inventors' Fair,0.0,None,None,['Legendary'],['Land'],None,Rare,KLD,None,None,None,"At the beginning of your upkeep, if you control three or more artifacts, you gain 1 life.\n{T}: Add {C}.\n{4}, {T}, Sacrifice Inventors' Fair: Search your library for an artifact card, reveal it, put it into your hand, then shuffle. Activate only if you control three or more artifacts."
Essence Extraction,3.0,['Black'],['B'],None,['Instant'],None,Uncommon,KLD,None,None,None,Essence Extraction deals 3 damage to target creature and you gain 3 life.
Swamp,0.0,None,['B'],['Basic'],['Land'],['Swamp'],Common,KLD,None,None,None,({T}: Add {B}.)
Malfunction,4.0,['Blue'],['U'],None,['Enchantment'],['Aura'],Common,KLD,None,None,None,"Enchant artifact or creature\nWhen Malfunction enters the battlefield, tap enchanted permanent.\nEnchanted permanent doesn't untap during its controller's untap step."
Nimble Innovator,4.0,['Blue'],['U'],None,['Creature'],"['Vedalken', 'Artificer']",Common,KLD,2,2,None,"When Nimble Innovator enters the battlefield, draw a card."
Embraal Bruiser,2.0,['Black'],['B'],None,['Creature'],"['Human', 'Warrior']",Uncommon,KLD,3,1,None,Embraal Bruiser enters the battlefield tapped.\nEmbraal Bruiser has menace as long as you control an artifact.
Eliminate the Competition,5.0,['Black'],['B'],None,['Sorcery'],None,Rare,KLD,None,None,None,"As an additional cost to cast this spell, sacrifice X creatures.\nDestroy X target creatures."
Mountain,0.0,None,['R'],['Basic'],['Land'],['Mountain'],Common,KLD,None,None,None,({T}: Add {R}.)
Mountain,0.0,None,['R'],['Basic'],['Land'],['Mountain'],Common,KLD,None,None,None,({T}: Add {R}.)
Dukhara Scavenger,6.0,['Black'],['B'],None,['Creature'],['Crocodile'],Common,KLD,4,6,None,"When Dukhara Scavenger enters the battlefield, you may put target artifact or creature card from your graveyard on top of your library."
Swamp,0.0,None,['B'],['Basic'],['Land'],['Swamp'],Common,KLD,None,None,None,({T}: Add {B}.)
Long-Finned Skywhale,4.0,['Blue'],['U'],None,['Creature'],['Whale'],Uncommon,KLD,4,3,None,Flying\nLong-Finned Skywhale can block only creatures with flying.
Minister of Inquiries,1.0,['Blue'],['U'],None,['Creature'],"['Vedalken', 'Advisor']",Uncommon,KLD,1,2,None,"When Minister of Inquiries enters the battlefield, you get {E}{E} (two energy counters).\n{T}, Pay {E}: Target player mills three cards."
Die Young,2.0,['Black'],['B'],None,['Sorcery'],None,Common,KLD,None,None,None,"Choose target creature. You get {E}{E} (two energy counters), then you may pay any amount of {E}. The creature gets -1/-1 until end of turn for each {E} paid this way."
Diabolic Tutor,4.0,['Black'],['B'],None,['Sorcery'],None,Uncommon,KLD,None,None,None,"Search your library for a card, put that card into your hand, then shuffle."
Island,0.0,None,['U'],['Basic'],['Land'],['Island'],Common,KLD,None,None,None,({T}: Add {U}.)
Swamp,0.0,None,['B'],['Basic'],['Land'],['Swamp'],Common,KLD,None,None,None,({T}: Add {B}.)
Experimental Aviator,5.0,['Blue'],['U'],None,['Creature'],"['Human', 'Artificer']",Uncommon,KLD,0,3,None,"Flying\nWhen Experimental Aviator enters the battlefield, create two 1/1 colorless Thopter artifact creature tokens with flying."
Metallurgic Summonings,5.0,['Blue'],['U'],None,['Enchantment'],None,Mythic,KLD,None,None,None,"Whenever you cast an instant or sorcery spell, create an X/X colorless Construct artifact creature token, where X is that spell's mana value.\n{3}{U}{U}, Exile Metallurgic Summonings: Return all instant and sorcery cards from your graveyard to your hand. Activate only if you control six or more artifacts."
Paradoxical Outcome,4.0,['Blue'],['U'],None,['Instant'],None,Rare,KLD,None,None,None,"Return any number of target nonland, nontoken permanents you control to their owners' hands. Draw a card for each card returned to your hand this way."
Aetherborn Marauder,4.0,['Black'],['B'],None,['Creature'],"['Aetherborn', 'Rogue']",Uncommon,KLD,2,2,None,"Flying, lifelink\nWhen Aetherborn Marauder enters the battlefield, move any number of +1/+1 counters from other permanents you control onto Aetherborn Marauder."
Plains,0.0,None,['W'],['Basic'],['Land'],['Plains'],Common,KLD,None,None,None,({T}: Add {W}.)
Island,0.0,None,['U'],['Basic'],['Land'],['Island'],Common,KLD,None,None,None,({T}: Add {U}.)
Island,0.0,None,['U'],['Basic'],['Land'],['Island'],Common,KLD,None,None,None,({T}: Add {U}.)
Plains,0.0,None,['W'],['Basic'],['Land'],['Plains'],Common,KLD,None,None,None,({T}: Add {W}.)
Demon of Dark Schemes,6.0,['Black'],['B'],None,['Creature'],['Demon'],Mythic,KLD,5,5,None,"Flying\nWhen Demon of Dark Schemes enters the battlefield, all other creatures get -2/-2 until end of turn.\nWhenever another creature dies, you get {E} (an energy counter).\n{2}{B}, Pay {E}{E}{E}{E}: Put target creature card from a graveyard onto the battlefield under your control tapped."
Sequestered Stash,0.0,None,None,None,['Land'],None,Uncommon,KLD,None,None,None,"{T}: Add {C}.\n{4}, {T}, Sacrifice Sequestered Stash: Mill five cards. Then you may put an artifact card from your graveyard on top of your library."
Inspiring Vantage,0.0,None,"['R', 'W']",None,['Land'],None,Rare,KLD,None,None,None,Inspiring Vantage enters the battlefield tapped unless you control two or fewer other lands.\n{T}: Add {R} or {W}.
Dhund Operative,2.0,['Black'],['B'],None,['Creature'],"['Human', 'Rogue']",Common,KLD,2,2,None,"As long as you control an artifact, Dhund Operative gets +1/+0 and has deathtouch."
Plains,0.0,None,['W'],['Basic'],['Land'],['Plains'],Common,KLD,None,None,None,({T}: Add {W}.)
Ambitious Aetherborn,5.0,['Black'],['B'],None,['Creature'],"['Aetherborn', 'Artificer']",Common,KLD,4,3,None,"Fabricate 1 (When this creature enters the battlefield, put a +1/+1 counter on it or create a 1/1 colorless Servo artifact creature token.)"
Spirebluff Canal,0.0,None,"['R', 'U']",None,['Land'],None,Rare,KLD,None,None,None,Spirebluff Canal enters the battlefield tapped unless you control two or fewer other lands.\n{T}: Add {U} or {R}.
Wind Drake,3.0,['Blue'],['U'],None,['Creature'],['Drake'],Common,KLD,2,2,None,Flying
Concealed Courtyard,0.0,None,"['B', 'W']",None,['Land'],None,Rare,KLD,None,None,None,Concealed Courtyard enters the battlefield tapped unless you control two or fewer other lands.\n{T}: Add {W} or {B}.
Weldfast Wingsmith,4.0,['Blue'],['U'],None,['Creature'],"['Human', 'Artificer']",Common,KLD,3,3,None,"Whenever an artifact enters the battlefield under your control, Weldfast Wingsmith gains flying until end of turn."
Vedalken Blademaster,3.0,['Blue'],['U'],None,['Creature'],"['Vedalken', 'Soldier']",Common,KLD,2,3,None,"Prowess (Whenever you cast a noncreature spell, this creature gets +1/+1 until end of turn.)"
Tezzeret's Ambition,5.0,['Blue'],['U'],None,['Sorcery'],None,Common,KLD,None,None,None,"Draw three cards. If you control no artifacts, discard a card."
Janjeet Sentry,3.0,['Blue'],['U'],None,['Creature'],"['Vedalken', 'Soldier']",Uncommon,KLD,2,3,None,"When Janjeet Sentry enters the battlefield, you get {E}{E} (two energy counters).\n{T}, Pay {E}{E}: You may tap or untap target artifact or creature."
Torrential Gearhulk,6.0,['Blue'],['U'],None,"['Artifact', 'Creature']",['Construct'],Mythic,KLD,5,6,None,"Flash\nWhen Torrential Gearhulk enters the battlefield, you may cast target instant card from your graveyard without paying its mana cost. If that spell would be put into your graveyard this turn, exile it instead."
Thriving Turtle,1.0,['Blue'],['U'],None,['Creature'],['Turtle'],Common,KLD,0,3,None,"When Thriving Turtle enters the battlefield, you get {E}{E} (two energy counters).\nWhenever Thriving Turtle attacks, you may pay {E}{E}. If you do, put a +1/+1 counter on it."
Revolutionary Rebuff,2.0,['Blue'],['U'],None,['Instant'],None,Common,KLD,None,None,None,Counter target nonartifact spell unless its controller pays {2}.
Shrewd Negotiation,5.0,['Blue'],['U'],None,['Sorcery'],None,Uncommon,KLD,None,None,None,Exchange control of target artifact you control and target artifact or creature you don't control.
Botanical Sanctum,0.0,None,"['G', 'U']",None,['Land'],None,Rare,KLD,None,None,None,Botanical Sanctum enters the battlefield tapped unless you control two or fewer other lands.\n{T}: Add {G} or {U}.
Select for Inspection,1.0,['Blue'],['U'],None,['Instant'],None,Common,KLD,None,None,None,Return target tapped creature to its owner's hand. Scry 1. (Look at the top card of your library. You may put that card on the bottom of your library.)
Saheeli's Artistry,6.0,['Blue'],['U'],None,['Sorcery'],None,Rare,KLD,None,None,None,"Choose one or both —\n• Create a token that's a copy of target artifact.\n• Create a token that's a copy of target creature, except it's an artifact in addition to its other types."
Blooming Marsh,0.0,None,"['B', 'G']",None,['Land'],None,Rare,KLD,None,None,None,Blooming Marsh enters the battlefield tapped unless you control two or fewer other lands.\n{T}: Add {B} or {G}.
Aether Hub,0.0,None,None,None,['Land'],None,Uncommon,KLD,None,None,None,"When Aether Hub enters the battlefield, you get {E} (an energy counter).\n{T}: Add {C}.\n{T}, Pay {E}: Add one mana of any color."
Workshop Assistant,3.0,None,None,None,"['Artifact', 'Creature']",['Construct'],Common,KLD,1,2,None,"When Workshop Assistant dies, return another target artifact card from your graveyard to your hand."
Insidious Will,4.0,['Blue'],['U'],None,['Instant'],None,Rare,KLD,None,None,None,Choose one —\n• Counter target spell.\n• You may choose new targets for target spell.\n• Copy target instant or sorcery spell. You may choose new targets for the copy.
Woodweaver's Puzzleknot,2.0,None,['G'],None,['Artifact'],None,Common,KLD,None,None,None,"When Woodweaver's Puzzleknot enters the battlefield, you gain 3 life and get {E}{E}{E} (three energy counters).\n{2}{G}, Sacrifice Woodweaver's Puzzleknot: You gain 3 life and get {E}{E}{E}."
Whirlermaker,3.0,None,None,None,['Artifact'],None,Uncommon,KLD,None,None,None,"{4}, {T}: Create a 1/1 colorless Thopter artifact creature token with flying."
Weldfast Monitor,3.0,None,['R'],None,"['Artifact', 'Creature']",['Lizard'],Common,KLD,3,2,None,{R}: Weldfast Monitor gains menace until end of turn.
Failed Inspection,4.0,['Blue'],['U'],None,['Instant'],None,Common,KLD,None,None,None,"Counter target spell. Draw a card, then discard a card."
Stone Quarry,0.0,None,"['R', 'W']",None,['Land'],None,Common,KLD,None,None,None,Stone Quarry enters the battlefield tapped.\n{T}: Add {R} or {W}.
Renegade Firebrand,3.0,['Red'],['R'],None,['Creature'],"['Human', 'Warrior']",Uncommon,KLD,3,2,None,"As long as you control a Chandra planeswalker, Renegade Firebrand gets +1/+0 and has first strike. (It deals combat damage before creatures without first strike.)"
"Nissa, Nature's Artisan",6.0,['Green'],['G'],['Legendary'],['Planeswalker'],['Nissa'],Mythic,KLD,None,None,5,[+3]: You gain 3 life.\n[−4]: Reveal the top two cards of your library. Put all land cards from among them onto the battlefield and the rest into your hand.\n[−12]: Creatures you control get +5/+5 and gain trample until end of turn.
