Name,CMC,Colors,Color identity,Supertypes,Types,Subtypes,Rarity,Set,Power,Toughness,Loyalty,Text
Beacon of Destiny,2.0,['White'],['W'],None,['Creature'],"['Human', 'Cleric']",Rare,LGN,1,3,None,"{T}: The next time a source of your choice would deal damage to you this turn, that damage is dealt to Beacon of Destiny instead."
Dripping Dead,6.0,['Black'],['B'],None,['Creature'],['Zombie'],Common,LGN,4,1,None,"Dripping Dead can't block.\nWhenever Dripping Dead deals combat damage to a creature, destroy that creature. It can't be regenerated."
Aven Warhawk,5.0,['White'],['W'],None,['Creature'],"['Bird', 'Soldier']",Uncommon,LGN,2,2,None,"Amplify 1 (As this creature enters the battlefield, put a +1/+1 counter on it for each Bird and/or Soldier card you reveal in your hand.)\nFlying"
Drinker of Sorrow,3.0,['Black'],['B'],None,['Creature'],['Horror'],Rare,LGN,5,3,None,"Drinker of Sorrow can't block.\nWhenever Drinker of Sorrow deals combat damage, sacrifice a permanent."
Deathmark Prelate,4.0,['Black'],['B'],None,['Creature'],"['Human', 'Cleric']",Uncommon,LGN,2,3,None,"{2}{B}, {T}, Sacrifice a Zombie: Destroy target non-Zombie creature. It can't be regenerated. Activate only as a sorcery."
Dark Supplicant,1.0,['Black'],['B'],None,['Creature'],"['Human', 'Cleric']",Uncommon,LGN,1,1,None,"{T}, Sacrifice three Clerics: Search your graveyard, hand, and/or library for a card named Scion of Darkness and put it onto the battlefield. If you search your library this way, shuffle."
Crypt Sliver,2.0,['Black'],['B'],None,['Creature'],['Sliver'],Common,LGN,1,1,None,"All Slivers have ""{T}: Regenerate target Sliver."""
Corpse Harvester,5.0,['Black'],['B'],None,['Creature'],"['Zombie', 'Wizard']",Uncommon,LGN,3,3,None,"{1}{B}, {T}, Sacrifice a creature: Search your library for a Zombie card and a Swamp card, reveal them, put them into your hand, then shuffle."
Blood Celebrant,1.0,['Black'],['B'],None,['Creature'],"['Human', 'Cleric']",Common,LGN,1,1,None,"{B}, Pay 1 life: Add one mana of any color."
Bane of the Living,4.0,['Black'],['B'],None,['Creature'],['Insect'],Rare,LGN,4,3,None,"Morph {X}{B}{B} (You may cast this card face down as a 2/2 creature for {3}. Turn it face up any time for its morph cost.)\nWhen Bane of the Living is turned face up, all creatures get -X/-X until end of turn."
Aphetto Exterminator,3.0,['Black'],['B'],None,['Creature'],"['Human', 'Wizard']",Uncommon,LGN,3,1,None,"Morph {3}{B} (You may cast this card face down as a 2/2 creature for {3}. Turn it face up any time for its morph cost.)\nWhen Aphetto Exterminator is turned face up, target creature gets -3/-3 until end of turn."
Willbender,2.0,['Blue'],['U'],None,['Creature'],"['Human', 'Wizard']",Uncommon,LGN,1,2,None,"Morph {1}{U} (You may cast this card face down as a 2/2 creature for {3}. Turn it face up any time for its morph cost.)\nWhen Willbender is turned face up, change the target of target spell or ability with a single target."
Weaver of Lies,7.0,['Blue'],['U'],None,['Creature'],['Beast'],Rare,LGN,4,4,None,"Morph {4}{U} (You may cast this card face down as a 2/2 creature for {3}. Turn it face up any time for its morph cost.)\nWhen Weaver of Lies is turned face up, turn any number of target creatures with morph abilities other than Weaver of Lies face down."
Warped Researcher,5.0,['Blue'],['U'],None,['Creature'],"['Human', 'Wizard', 'Mutant']",Uncommon,LGN,3,4,None,"Whenever a player cycles a card, Warped Researcher gains flying and shroud until end of turn. (It can't be the target of spells or abilities.)"
Wall of Deceit,2.0,['Blue'],['U'],None,['Creature'],['Wall'],Uncommon,LGN,0,5,None,Defender (This creature can't attack.)\n{3}: Turn Wall of Deceit face down.\nMorph {U} (You may cast this card face down as a 2/2 creature for {3}. Turn it face up any time for its morph cost.)
Voidmage Apprentice,2.0,['Blue'],['U'],None,['Creature'],"['Human', 'Wizard']",Common,LGN,1,1,None,"Morph {2}{U}{U} (You may cast this card face down as a 2/2 creature for {3}. Turn it face up any time for its morph cost.)\nWhen Voidmage Apprentice is turned face up, counter target spell."
Synapse Sliver,5.0,['Blue'],['U'],None,['Creature'],['Sliver'],Rare,LGN,3,3,None,"Whenever a Sliver deals combat damage to a player, its controller may draw a card."
Shifting Sliver,4.0,['Blue'],['U'],None,['Creature'],['Sliver'],Uncommon,LGN,2,2,None,Slivers can't be blocked except by Slivers.
Riptide Mangler,2.0,['Blue'],['U'],None,['Creature'],['Beast'],Rare,LGN,0,3,None,{1}{U}: Change Riptide Mangler's base power to target creature's power. (This effect lasts indefinitely.)
Riptide Director,4.0,['Blue'],['U'],None,['Creature'],"['Human', 'Wizard']",Rare,LGN,2,3,None,"{2}{U}{U}, {T}: Draw a card for each Wizard you control."
Primoc Escapee,7.0,['Blue'],['U'],None,['Creature'],"['Bird', 'Beast']",Uncommon,LGN,4,4,None,"Flying\nCycling {2} ({2}, Discard this card: Draw a card.)"
Mistform Wakecaster,5.0,['Blue'],['U'],None,['Creature'],['Illusion'],Uncommon,LGN,2,3,None,"Flying\n{1}: Mistform Wakecaster becomes the creature type of your choice until end of turn.\n{2}{U}{U}, {T}: Choose a creature type. Each creature you control becomes that type until end of turn."
Mistform Ultimus,4.0,['Blue'],['U'],['Legendary'],['Creature'],['Illusion'],Rare,LGN,3,3,None,Mistform Ultimus is every creature type (even if this card isn't on the battlefield).
Mistform Sliver,2.0,['Blue'],['U'],None,['Creature'],"['Illusion', 'Sliver']",Common,LGN,1,1,None,"All Slivers have ""{1}: This permanent becomes the creature type of your choice in addition to its other types until end of turn."""
Mistform Seaswift,4.0,['Blue'],['U'],None,['Creature'],['Illusion'],Common,LGN,3,1,None,Flying\n{1}: Mistform Seaswift becomes the creature type of your choice until end of turn.\nMorph {1}{U} (You may cast this card face down as a 2/2 creature for {3}. Turn it face up any time for its morph cost.)
Merchant of Secrets,3.0,['Blue'],['U'],None,['Creature'],"['Human', 'Wizard']",Common,LGN,1,1,None,"When Merchant of Secrets enters the battlefield, draw a card."
Master of the Veil,4.0,['Blue'],['U'],None,['Creature'],"['Human', 'Wizard']",Uncommon,LGN,2,3,None,"Morph {2}{U} (You may cast this card face down as a 2/2 creature for {3}. Turn it face up any time for its morph cost.)\nWhen Master of the Veil is turned face up, you may turn target creature with a morph ability face down."
Keeper of the Nine Gales,3.0,['Blue'],['U'],None,['Creature'],"['Bird', 'Wizard']",Rare,LGN,1,2,None,"Flying\n{T}, Tap two untapped Birds you control: Return target permanent to its owner's hand."
Keeneye Aven,4.0,['Blue'],['U'],None,['Creature'],"['Bird', 'Soldier']",Common,LGN,2,3,None,"Flying\nCycling {2} ({2}, Discard this card: Draw a card.)"
Glintwing Invoker,5.0,['Blue'],['U'],None,['Creature'],"['Human', 'Wizard', 'Mutant']",Common,LGN,3,3,None,{7}{U}: Glintwing Invoker gets +3/+3 and gains flying until end of turn.
Gempalm Sorcerer,3.0,['Blue'],['U'],None,['Creature'],"['Human', 'Wizard']",Uncommon,LGN,2,2,None,"Cycling {2}{U} ({2}{U}, Discard this card: Draw a card.)\nWhen you cycle Gempalm Sorcerer, Wizard creatures gain flying until end of turn."
Fugitive Wizard,1.0,['Blue'],['U'],None,['Creature'],"['Human', 'Wizard']",Common,LGN,1,1,None,None
