Name,CMC,Colors,Color identity,Supertypes,Types,Subtypes,Rarity,Set,Power,Toughness,Loyalty,Text
Wirewood Hivemaster,2.0,['Green'],['G'],None,['Creature'],['Elf'],Uncommon,LGN,1,1,None,"Whenever another nontoken Elf enters the battlefield, you may create a 1/1 green Insect creature token."
Wirewood Channeler,4.0,['Green'],['G'],None,['Creature'],"['Elf', 'Druid']",Uncommon,LGN,2,2,None,"{T}: Add X mana of any one color, where X is the number of Elves on the battlefield."
Vexing Beetle,5.0,['Green'],['G'],None,['Creature'],['Insect'],Rare,LGN,3,3,None,This spell can't be countered.\nVexing Beetle gets +3/+3 as long as no opponent controls a creature.
Tribal Forcemage,2.0,['Green'],['G'],None,['Creature'],"['Elf', 'Wizard']",Rare,LGN,1,1,None,"Morph {1}{G} (You may cast this card face down as a 2/2 creature for {3}. Turn it face up any time for its morph cost.)\nWhen Tribal Forcemage is turned face up, creatures of the creature type of your choice get +2/+2 and gain trample until end of turn."
Totem Speaker,5.0,['Green'],['G'],None,['Creature'],"['Elf', 'Druid']",Uncommon,LGN,3,3,None,"Whenever a Beast enters the battlefield, you may gain 3 life."
Timberwatch Elf,3.0,['Green'],['G'],None,['Creature'],['Elf'],Common,LGN,1,2,None,"{T}: Target creature gets +X/+X until end of turn, where X is the number of Elves on the battlefield."
Stonewood Invoker,2.0,['Green'],['G'],None,['Creature'],"['Elf', 'Mutant']",Common,LGN,2,2,None,{7}{G}: Stonewood Invoker gets +5/+5 until end of turn.
Seedborn Muse,5.0,['Green'],['G'],None,['Creature'],['Spirit'],Rare,LGN,2,4,None,Untap all permanents you control during each other player's untap step.
Root Sliver,4.0,['Green'],['G'],None,['Creature'],['Sliver'],Uncommon,LGN,2,2,None,This spell can't be countered.\nSliver spells can't be countered.
Quick Sliver,2.0,['Green'],['G'],None,['Creature'],['Sliver'],Common,LGN,1,1,None,Flash\nAny player may cast Sliver spells as though they had flash.
Primal Whisperer,5.0,['Green'],['G'],None,['Creature'],"['Elf', 'Soldier']",Rare,LGN,2,2,None,Primal Whisperer gets +2/+2 for each face-down creature on the battlefield.\nMorph {3}{G} (You may cast this card face down as a 2/2 creature for {3}. Turn it face up any time for its morph cost.)
Patron of the Wild,1.0,['Green'],['G'],None,['Creature'],['Elf'],Common,LGN,1,1,None,"Morph {2}{G} (You may cast this card face down as a 2/2 creature for {3}. Turn it face up any time for its morph cost.)\nWhen Patron of the Wild is turned face up, target creature gets +3/+3 until end of turn."
Needleshot Gourna,6.0,['Green'],['G'],None,['Creature'],['Beast'],Common,LGN,3,6,None,Reach (This creature can block creatures with flying.)
Nantuko Vigilante,4.0,['Green'],['G'],None,['Creature'],"['Insect', 'Druid', 'Mutant']",Common,LGN,3,2,None,"Morph {1}{G} (You may cast this card face down as a 2/2 creature for {3}. Turn it face up any time for its morph cost.)\nWhen Nantuko Vigilante is turned face up, destroy target artifact or enchantment."
Krosan Vorine,4.0,['Green'],['G'],None,['Creature'],"['Cat', 'Beast']",Common,LGN,3,2,None,"Provoke (Whenever this creature attacks, you may have target creature defending player controls untap and block it if able.)\nKrosan Vorine can't be blocked by more than one creature."
Krosan Cloudscraper,10.0,['Green'],['G'],None,['Creature'],"['Beast', 'Mutant']",Rare,LGN,13,13,None,"At the beginning of your upkeep, sacrifice Krosan Cloudscraper unless you pay {G}{G}.\nMorph {7}{G}{G} (You may cast this card face down as a 2/2 creature for {3}. Turn it face up any time for its morph cost.)"
Hundroog,7.0,['Green'],['G'],None,['Creature'],['Beast'],Common,LGN,4,7,None,"Cycling {3} ({3}, Discard this card: Draw a card.)"
Glowering Rogon,6.0,['Green'],['G'],None,['Creature'],['Beast'],Common,LGN,4,4,None,"Amplify 1 (As this creature enters the battlefield, put a +1/+1 counter on it for each Beast card you reveal in your hand.)"
Gempalm Strider,2.0,['Green'],['G'],None,['Creature'],['Elf'],Uncommon,LGN,2,2,None,"Cycling {2}{G}{G} ({2}{G}{G}, Discard this card: Draw a card.)\nWhen you cycle Gempalm Strider, Elf creatures get +2/+2 until end of turn."
Feral Throwback,6.0,['Green'],['G'],None,['Creature'],['Beast'],Rare,LGN,3,3,None,"Amplify 2 (As this creature enters the battlefield, put two +1/+1 counters on it for each Beast card you reveal in your hand.)\nProvoke (Whenever this creature attacks, you may have target creature defending player controls untap and block it if able.)"
Enormous Baloth,7.0,['Green'],['G'],None,['Creature'],['Beast'],Uncommon,LGN,7,7,None,None
Elvish Soultiller,5.0,['Green'],['G'],None,['Creature'],"['Elf', 'Mutant']",Rare,LGN,5,4,None,"When Elvish Soultiller dies, choose a creature type. Shuffle all creature cards of that type from your graveyard into your library."
Defiant Elf,1.0,['Green'],['G'],None,['Creature'],['Elf'],Common,LGN,1,1,None,Trample
Canopy Crawler,4.0,['Green'],['G'],None,['Creature'],['Beast'],Uncommon,LGN,2,2,None,"Amplify 1 (As this creature enters the battlefield, put a +1/+1 counter on it for each Beast card you reveal in your hand.)\n{T}: Target creature gets +1/+1 until end of turn for each +1/+1 counter on Canopy Crawler."
Caller of the Claw,3.0,['Green'],['G'],None,['Creature'],['Elf'],Rare,LGN,2,2,None,"Flash\nWhen Caller of the Claw enters the battlefield, create a 2/2 green Bear creature token for each nontoken creature put into your graveyard from the battlefield this turn."
Brood Sliver,5.0,['Green'],['G'],None,['Creature'],['Sliver'],Rare,LGN,3,3,None,"Whenever a Sliver deals combat damage to a player, its controller may create a 1/1 colorless Sliver creature token."
Brontotherium,6.0,['Green'],['G'],None,['Creature'],['Beast'],Uncommon,LGN,5,3,None,"Trample\nProvoke (Whenever this creature attacks, you may have target creature defending player controls untap and block it if able.)"
Branchsnap Lorian,3.0,['Green'],['G'],None,['Creature'],['Beast'],Uncommon,LGN,4,1,None,Trample\nMorph {G} (You may cast this card face down as a 2/2 creature for {3}. Turn it face up any time for its morph cost.)
Berserk Murlodont,5.0,['Green'],['G'],None,['Creature'],['Beast'],Common,LGN,3,3,None,"Whenever a Beast becomes blocked, it gets +1/+1 until end of turn for each creature blocking it."
Skirk Marauder,2.0,['Red'],['R'],None,['Creature'],['Goblin'],Common,LGN,2,1,None,"Morph {2}{R} (You may cast this card face down as a 2/2 creature for {3}. Turn it face up any time for its morph cost.)\nWhen Skirk Marauder is turned face up, it deals 2 damage to any target."
Skirk Outrider,4.0,['Red'],['R'],None,['Creature'],['Goblin'],Common,LGN,2,2,None,"As long as you control a Beast, Skirk Outrider gets +2/+2 and has trample."
Unstable Hulk,3.0,['Red'],['R'],None,['Creature'],"['Goblin', 'Mutant']",Rare,LGN,2,2,None,"Morph {3}{R}{R} (You may cast this card face down as a 2/2 creature for {3}. Turn it face up any time for its morph cost.)\nWhen Unstable Hulk is turned face up, it gets +6/+6 and gains trample until end of turn. You skip your next turn."
Warbreak Trumpeter,1.0,['Red'],['R'],None,['Creature'],['Goblin'],Uncommon,LGN,1,1,None,"Morph {X}{X}{R} (You may cast this card face down as a 2/2 creature for {3}. Turn it face up any time for its morph cost.)\nWhen Warbreak Trumpeter is turned face up, create X 1/1 red Goblin creature tokens."
Echo Tracer,3.0,['Blue'],['U'],None,['Creature'],"['Human', 'Wizard']",Common,LGN,2,2,None,"Morph {2}{U} (You may cast this card face down as a 2/2 creature for {3}. Turn it face up any time for its morph cost.)\nWhen Echo Tracer is turned face up, return target creature to its owner's hand."
Skirk Drill Sergeant,2.0,['Red'],['R'],None,['Creature'],['Goblin'],Uncommon,LGN,2,1,None,"Whenever Skirk Drill Sergeant or another Goblin dies, you may pay {2}{R}. If you do, reveal the top card of your library. If it's a Goblin permanent card, put it onto the battlefield. Otherwise, put it into your graveyard."
Dreamborn Muse,4.0,['Blue'],['U'],None,['Creature'],['Spirit'],Rare,LGN,2,2,None,"At the beginning of each player's upkeep, that player mills X cards, where X is the number of cards in their hand."
Skirk Alarmist,2.0,['Red'],['R'],None,['Creature'],"['Human', 'Wizard']",Rare,LGN,1,2,None,"Haste\n{T}: Turn target face-down creature you control face up. At the beginning of the next end step, sacrifice it."
Dermoplasm,3.0,['Blue'],['U'],None,['Creature'],['Shapeshifter'],Rare,LGN,1,1,None,"Flying\nMorph {2}{U}{U} (You may cast this card face down as a 2/2 creature for {3}. Turn it face up any time for its morph cost.)\nWhen Dermoplasm is turned face up, you may put a creature card with a morph ability from your hand onto the battlefield face up. If you do, return Dermoplasm to its owner's hand."
Shaleskin Plower,4.0,['Red'],['R'],None,['Creature'],['Beast'],Common,LGN,3,2,None,"Morph {4}{R} (You may cast this card face down as a 2/2 creature for {3}. Turn it face up any time for its morph cost.)\nWhen Shaleskin Plower is turned face up, destroy target land."
Crookclaw Elder,6.0,['Blue'],['U'],None,['Creature'],"['Bird', 'Wizard']",Uncommon,LGN,3,2,None,Flying\nTap two untapped Birds you control: Draw a card.\nTap two untapped Wizards you control: Target creature gains flying until end of turn.
Rockshard Elemental,7.0,['Red'],['R'],None,['Creature'],['Elemental'],Rare,LGN,4,3,None,Double strike (This creature deals both first-strike and regular combat damage.)\nMorph {4}{R}{R} (You may cast this card face down as a 2/2 creature for {3}. Turn it face up any time for its morph cost.)
Covert Operative,5.0,['Blue'],['U'],None,['Creature'],"['Human', 'Wizard']",Common,LGN,3,2,None,Covert Operative can't be blocked.
Macetail Hystrodon,7.0,['Red'],['R'],None,['Creature'],['Beast'],Common,LGN,4,4,None,"First strike, haste\nCycling {3} ({3}, Discard this card: Draw a card.)"
Chromeshell Crab,5.0,['Blue'],['U'],None,['Creature'],"['Crab', 'Beast']",Rare,LGN,3,3,None,"Morph {4}{U} (You may cast this card face down as a 2/2 creature for {3}. Turn it face up any time for its morph cost.)\nWhen Chromeshell Crab is turned face up, you may exchange control of target creature you control and target creature an opponent controls."
Ridgetop Raptor,4.0,['Red'],['R'],None,['Creature'],"['Dinosaur', 'Beast']",Uncommon,LGN,2,1,None,Double strike (This creature deals both first-strike and regular combat damage.)
Cephalid Pathmage,3.0,['Blue'],['U'],None,['Creature'],"['Cephalid', 'Wizard']",Common,LGN,1,2,None,"Cephalid Pathmage can't be blocked.\n{T}, Sacrifice Cephalid Pathmage: Target creature can't be blocked this turn."
Magma Sliver,4.0,['Red'],['R'],None,['Creature'],['Sliver'],Rare,LGN,3,3,None,"All Slivers have ""{T}: Target Sliver creature gets +X/+0 until end of turn, where X is the number of Slivers on the battlefield."""
Aven Envoy,1.0,['Blue'],['U'],None,['Creature'],"['Bird', 'Soldier']",Common,LGN,0,2,None,Flying
Hunter Sliver,2.0,['Red'],['R'],None,['Creature'],['Sliver'],Common,LGN,1,1,None,"All Sliver creatures have provoke. (Whenever a Sliver attacks, its controller may have target creature defending player controls untap and block it if able.)"
Wingbeat Warrior,3.0,['White'],['W'],None,['Creature'],"['Bird', 'Soldier', 'Warrior']",Common,LGN,2,1,None,"Flying\nMorph {2}{W} (You may cast this card face down as a 2/2 creature for {3}. Turn it face up any time for its morph cost.)\nWhen Wingbeat Warrior is turned face up, target creature gains first strike until end of turn."
Goblin Lookout,2.0,['Red'],['R'],None,['Creature'],['Goblin'],Common,LGN,1,2,None,"{T}, Sacrifice a Goblin: Goblin creatures get +2/+0 until end of turn."
Windborn Muse,4.0,['White'],['W'],None,['Creature'],['Spirit'],Rare,LGN,2,3,None,Flying\nCreatures can't attack you unless their controller pays {2} for each creature they control that's attacking you.
Lavaborn Muse,4.0,['Red'],['R'],None,['Creature'],['Spirit'],Rare,LGN,3,3,None,"At the beginning of each opponent's upkeep, if that player has two or fewer cards in hand, Lavaborn Muse deals 3 damage to that player."
White Knight,2.0,['White'],['W'],None,['Creature'],"['Human', 'Knight']",Uncommon,LGN,2,2,None,"First strike (This creature deals combat damage before creatures without first strike.)\nProtection from black (This creature can't be blocked, targeted, dealt damage, or enchanted by anything black.)"
Kilnmouth Dragon,7.0,['Red'],['R'],None,['Creature'],['Dragon'],Rare,LGN,5,5,None,"Amplify 3 (As this creature enters the battlefield, put three +1/+1 counters on it for each Dragon card you reveal in your hand.)\nFlying\n{T}: Kilnmouth Dragon deals damage equal to the number of +1/+1 counters on it to any target."
Whipgrass Entangler,3.0,['White'],['W'],None,['Creature'],"['Human', 'Cleric']",Common,LGN,1,3,None,"{1}{W}: Until end of turn, target creature gains ""This creature can't attack or block unless its controller pays {1} for each Cleric on the battlefield."""
Imperial Hellkite,7.0,['Red'],['R'],None,['Creature'],['Dragon'],Rare,LGN,6,6,None,"Flying\nMorph {6}{R}{R} (You may cast this card face down as a 2/2 creature for {3}. Turn it face up any time for its morph cost.)\nWhen Imperial Hellkite is turned face up, you may search your library for a Dragon card, reveal it, put it into your hand, then shuffle."
Ward Sliver,5.0,['White'],['W'],None,['Creature'],['Sliver'],Uncommon,LGN,2,2,None,"As Ward Sliver enters the battlefield, choose a color.\nAll Slivers have protection from the chosen color."
Goblin Grappler,1.0,['Red'],['R'],None,['Creature'],['Goblin'],Common,LGN,1,1,None,"Provoke (Whenever this creature attacks, you may have target creature defending player controls untap and block it if able.)"
Wall of Hope,1.0,['White'],['W'],None,['Creature'],['Wall'],Common,LGN,0,3,None,"Defender (This creature can't attack.)\nWhenever Wall of Hope is dealt damage, you gain that much life."
Goblin Goon,4.0,['Red'],['R'],None,['Creature'],"['Goblin', 'Mutant']",Rare,LGN,6,6,None,Goblin Goon can't attack unless you control more creatures than defending player.\nGoblin Goon can't block unless you control more creatures than attacking player.
Swooping Talon,6.0,['White'],['W'],None,['Creature'],"['Bird', 'Soldier']",Uncommon,LGN,2,6,None,"Flying\n{1}: Swooping Talon loses flying until end of turn.\nProvoke (Whenever this creature attacks, you may have target creature defending player controls untap and block it if able.)"
Goblin Firebug,2.0,['Red'],['R'],None,['Creature'],['Goblin'],Common,LGN,2,2,None,"When Goblin Firebug leaves the battlefield, sacrifice a land."
Sunstrike Legionnaire,2.0,['White'],['W'],None,['Creature'],"['Human', 'Soldier']",Rare,LGN,1,2,None,"Sunstrike Legionnaire doesn't untap during your untap step.\nWhenever another creature enters the battlefield, untap Sunstrike Legionnaire.\n{T}: Tap target creature with mana value 3 or less."
Goblin Dynamo,7.0,['Red'],['R'],None,['Creature'],"['Goblin', 'Mutant']",Uncommon,LGN,4,4,None,"{T}: Goblin Dynamo deals 1 damage to any target.\n{X}{R}, {T}, Sacrifice Goblin Dynamo: It deals X damage to any target."
Stoic Champion,2.0,['White'],['W'],None,['Creature'],"['Human', 'Soldier']",Uncommon,LGN,2,2,None,"Whenever a player cycles a card, Stoic Champion gets +2/+2 until end of turn."
Goblin Clearcutter,4.0,['Red'],"['G', 'R']",None,['Creature'],['Goblin'],Uncommon,LGN,3,3,None,"{T}, Sacrifice a Forest: Add three mana in any combination of {R} and/or {G}."
Starlight Invoker,2.0,['White'],['W'],None,['Creature'],"['Human', 'Cleric', 'Mutant']",Common,LGN,1,3,None,{7}{W}: You gain 5 life.
Goblin Assassin,5.0,['Red'],['R'],None,['Creature'],"['Goblin', 'Assassin']",Uncommon,LGN,2,2,None,"Whenever Goblin Assassin or another Goblin enters the battlefield, each player flips a coin. Each player whose coin comes up tails sacrifices a creature."
Plated Sliver,1.0,['White'],['W'],None,['Creature'],['Sliver'],Common,LGN,1,1,None,All Sliver creatures get +0/+1.
Gempalm Incinerator,3.0,['Red'],['R'],None,['Creature'],['Goblin'],Uncommon,LGN,2,1,None,"Cycling {1}{R} ({1}{R}, Discard this card: Draw a card.)\nWhen you cycle Gempalm Incinerator, you may have it deal X damage to target creature, where X is the number of Goblins on the battlefield."
Planar Guide,1.0,['White'],['W'],None,['Creature'],"['Human', 'Cleric']",Rare,LGN,1,1,None,"{3}{W}, Exile Planar Guide: Exile all creatures. At the beginning of the next end step, return those cards to the battlefield under their owners' control."
Frenetic Raptor,6.0,['Red'],['R'],None,['Creature'],"['Dinosaur', 'Beast']",Uncommon,LGN,6,6,None,Beasts can't block.
Lowland Tracker,5.0,['White'],['W'],None,['Creature'],"['Human', 'Soldier']",Common,LGN,2,2,None,"First strike\nProvoke (Whenever this creature attacks, you may have target creature defending player controls untap and block it if able.)"
Flamewave Invoker,3.0,['Red'],['R'],None,['Creature'],"['Goblin', 'Mutant']",Common,LGN,2,2,None,{7}{R}: Flamewave Invoker deals 5 damage to target player or planeswalker.
Akroma's Devoted,4.0,['White'],['W'],None,['Creature'],"['Human', 'Cleric']",Uncommon,LGN,2,4,None,Cleric creatures have vigilance.
Crested Craghorn,5.0,['Red'],['R'],None,['Creature'],"['Goat', 'Beast']",Common,LGN,4,1,None,"Haste\nProvoke (Whenever this creature attacks, you may have target creature defending player controls untap and block it if able.)"
Essence Sliver,4.0,['White'],['W'],None,['Creature'],['Sliver'],Rare,LGN,3,3,None,"Whenever a Sliver deals damage, its controller gains that much life."
Clickslither,4.0,['Red'],['R'],None,['Creature'],['Insect'],Rare,LGN,3,3,None,Haste\nSacrifice a Goblin: Clickslither gets +2/+2 and gains trample until end of turn.
Glowrider,3.0,['White'],['W'],None,['Creature'],"['Human', 'Cleric']",Rare,LGN,2,1,None,Noncreature spells cost {1} more to cast.
Bloodstoke Howler,6.0,['Red'],['R'],None,['Creature'],['Beast'],Common,LGN,3,4,None,"Morph {6}{R} (You may cast this card face down as a 2/2 creature for {3}. Turn it face up any time for its morph cost.)\nWhen Bloodstoke Howler is turned face up, Beast creatures you control get +3/+0 until end of turn."
Blade Sliver,3.0,['Red'],['R'],None,['Creature'],['Sliver'],Uncommon,LGN,2,2,None,All Sliver creatures get +1/+0.
Liege of the Axe,4.0,['White'],['W'],None,['Creature'],"['Human', 'Soldier']",Uncommon,LGN,2,3,None,"Vigilance\nMorph {1}{W} (You may cast this card face down as a 2/2 creature for {3}. Turn it face up any time for its morph cost.)\nWhen Liege of the Axe is turned face up, untap it."
Zombie Brute,7.0,['Black'],['B'],None,['Creature'],['Zombie'],Uncommon,LGN,5,4,None,"Amplify 1 (As this creature enters the battlefield, put a +1/+1 counter on it for each Zombie card you reveal in your hand.)\nTrample"
Gempalm Avenger,6.0,['White'],['W'],None,['Creature'],"['Human', 'Soldier']",Common,LGN,3,5,None,"Cycling {2}{W} ({2}{W}, Discard this card: Draw a card.)\nWhen you cycle Gempalm Avenger, Soldier creatures get +1/+1 and gain first strike until end of turn."
Withered Wretch,2.0,['Black'],['B'],None,['Creature'],"['Zombie', 'Cleric']",Uncommon,LGN,2,2,None,{1}: Exile target card from a graveyard.
Vile Deacon,4.0,['Black'],['B'],None,['Creature'],"['Human', 'Cleric']",Common,LGN,2,2,None,"Whenever Vile Deacon attacks, it gets +X/+X until end of turn, where X is the number of Clerics on the battlefield."
Toxin Sliver,4.0,['Black'],['B'],None,['Creature'],['Sliver'],Rare,LGN,3,3,None,"Whenever a Sliver deals combat damage to a creature, destroy that creature. It can't be regenerated."
Deftblade Elite,1.0,['White'],['W'],None,['Creature'],"['Human', 'Soldier']",Common,LGN,1,1,None,"Provoke (Whenever this creature attacks, you may have target creature defending player controls untap and block it if able.)\n{1}{W}: Prevent all combat damage that would be dealt to and dealt by Deftblade Elite this turn."
Spectral Sliver,3.0,['Black'],['B'],None,['Creature'],"['Sliver', 'Spirit']",Uncommon,LGN,2,2,None,"All Sliver creatures have ""{2}: This creature gets +1/+1 until end of turn."""
Defender of the Order,4.0,['White'],['W'],None,['Creature'],"['Human', 'Cleric']",Rare,LGN,2,4,None,"Morph {W}{W} (You may cast this card face down as a 2/2 creature for {3}. Turn it face up any time for its morph cost.)\nWhen Defender of the Order is turned face up, creatures you control get +0/+2 until end of turn."
Sootfeather Flock,5.0,['Black'],['B'],None,['Creature'],['Bird'],Common,LGN,3,2,None,Flying\nMorph {3}{B} (You may cast this card face down as a 2/2 creature for {3}. Turn it face up any time for its morph cost.)
Daru Stinger,4.0,['White'],['W'],None,['Creature'],['Soldier'],Common,LGN,1,1,None,"Amplify 1 (As this creature enters the battlefield, put a +1/+1 counter on it for each Soldier card you reveal in your hand.)\n{T}: Daru Stinger deals damage equal to the number of +1/+1 counters on it to target attacking or blocking creature."
Smokespew Invoker,3.0,['Black'],['B'],None,['Creature'],"['Zombie', 'Mutant']",Common,LGN,3,1,None,{7}{B}: Target creature gets -3/-3 until end of turn.
Skinthinner,2.0,['Black'],['B'],None,['Creature'],['Zombie'],Common,LGN,2,1,None,"Morph {3}{B}{B} (You may cast this card face down as a 2/2 creature for {3}. Turn it face up any time for its morph cost.)\nWhen Skinthinner is turned face up, destroy target nonblack creature. It can't be regenerated."
Cloudreach Cavalry,2.0,['White'],['W'],None,['Creature'],"['Human', 'Soldier']",Uncommon,LGN,1,1,None,"As long as you control a Bird, Cloudreach Cavalry gets +2/+2 and has flying."
Scion of Darkness,8.0,['Black'],['B'],None,['Creature'],['Avatar'],Rare,LGN,6,6,None,"Trample\nWhenever Scion of Darkness deals combat damage to a player, you may put target creature card from that player's graveyard onto the battlefield under your control.\nCycling {3} ({3}, Discard this card: Draw a card.)"
Phage the Untouchable,7.0,['Black'],['B'],['Legendary'],['Creature'],"['Avatar', 'Minion']",Rare,LGN,4,4,None,"When Phage the Untouchable enters the battlefield, if you didn't cast it from your hand, you lose the game.\nWhenever Phage deals combat damage to a creature, destroy that creature. It can't be regenerated.\nWhenever Phage deals combat damage to a player, that player loses the game."
Noxious Ghoul,5.0,['Black'],['B'],None,['Creature'],['Zombie'],Uncommon,LGN,3,3,None,"Whenever Noxious Ghoul or another Zombie enters the battlefield, all non-Zombie creatures get -1/-1 until end of turn."
Infernal Caretaker,4.0,['Black'],['B'],None,['Creature'],"['Human', 'Cleric']",Common,LGN,2,2,None,"Morph {3}{B} (You may cast this card face down as a 2/2 creature for {3}. Turn it face up any time for its morph cost.)\nWhen Infernal Caretaker is turned face up, return all Zombie cards from all graveyards to their owners' hands."
Hollow Specter,3.0,['Black'],['B'],None,['Creature'],['Specter'],Rare,LGN,2,2,None,"Flying\nWhenever Hollow Specter deals combat damage to a player, you may pay {X}. If you do, that player reveals X cards from their hand and you choose one of them. That player discards that card."
Havoc Demon,7.0,['Black'],['B'],None,['Creature'],['Demon'],Rare,LGN,5,5,None,"Flying\nWhen Havoc Demon dies, all creatures get -5/-5 until end of turn."
Graveborn Muse,4.0,['Black'],['B'],None,['Creature'],"['Zombie', 'Spirit']",Rare,LGN,3,3,None,"At the beginning of your upkeep, you draw X cards and you lose X life, where X is the number of Zombies you control."
Goblin Turncoat,2.0,['Black'],['B'],None,['Creature'],"['Goblin', 'Mercenary']",Common,LGN,2,1,None,Sacrifice a Goblin: Regenerate Goblin Turncoat.
Daru Sanctifier,4.0,['White'],['W'],None,['Creature'],"['Human', 'Cleric']",Common,LGN,1,4,None,"Morph {1}{W} (You may cast this card face down as a 2/2 creature for {3}. Turn it face up any time for its morph cost.)\nWhen Daru Sanctifier is turned face up, destroy target enchantment."
Daru Mender,1.0,['White'],['W'],None,['Creature'],"['Human', 'Cleric']",Uncommon,LGN,1,1,None,"Morph {W} (You may cast this card face down as a 2/2 creature for {3}. Turn it face up any time for its morph cost.)\nWhen Daru Mender is turned face up, regenerate target creature."
Ghastly Remains,3.0,['Black'],['B'],None,['Creature'],['Zombie'],Rare,LGN,0,0,None,"Amplify 1 (As this creature enters the battlefield, put a +1/+1 counter on it for each Zombie card you reveal in your hand.)\nAt the beginning of your upkeep, if Ghastly Remains is in your graveyard, you may pay {B}{B}{B}. If you do, return Ghastly Remains to your hand."
Aven Redeemer,4.0,['White'],['W'],None,['Creature'],"['Bird', 'Cleric']",Common,LGN,2,2,None,Flying\n{T}: Prevent the next 2 damage that would be dealt to any target this turn.
Gempalm Polluter,6.0,['Black'],['B'],None,['Creature'],['Zombie'],Common,LGN,4,3,None,"Cycling {B}{B} ({B}{B}, Discard this card: Draw a card.)\nWhen you cycle Gempalm Polluter, you may have target player lose life equal to the number of Zombies on the battlefield."
"Akroma, Angel of Wrath",8.0,['White'],['W'],['Legendary'],['Creature'],['Angel'],Rare,LGN,6,6,None,"Flying, first strike, vigilance, trample, haste, protection from black and from red"
Embalmed Brawler,3.0,['Black'],['B'],None,['Creature'],['Zombie'],Common,LGN,2,2,None,"Amplify 1 (As this creature enters the battlefield, put a +1/+1 counter on it for each Zombie card you reveal in your hand.)\nWhenever Embalmed Brawler attacks or blocks, you lose 1 life for each +1/+1 counter on it."
Celestial Gatekeeper,5.0,['White'],['W'],None,['Creature'],"['Bird', 'Cleric']",Rare,LGN,2,2,None,"Flying\nWhen Celestial Gatekeeper dies, exile it, then return up to two target Bird and/or Cleric permanent cards from your graveyard to the battlefield."
Earthblighter,2.0,['Black'],['B'],None,['Creature'],"['Human', 'Cleric']",Uncommon,LGN,1,1,None,"{2}{B}, {T}, Sacrifice a Goblin: Destroy target land."
