Name,CMC,Colors,Color identity,Supertypes,Types,Subtypes,Rarity,Set,Power,Toughness,Loyalty,Text
Rhystic Syphon,5.0,['Black'],['B'],None,['Sorcery'],None,Uncommon,PCY,None,None,None,"Unless target player pays {3}, that player loses 5 life and you gain 5 life."
Rebel Informer,3.0,['Black'],['B'],None,['Creature'],"['Human', 'Mercenary', 'Rebel']",Rare,PCY,1,2,None,Rebel Informer can't be the target of white spells or abilities from white sources.\n{3}: Put target nontoken Rebel on the bottom of its owner's library.
Diving Griffin,3.0,['White'],['W'],None,['Creature'],['Griffin'],Common,PCY,2,2,None,"Flying, vigilance"
Plague Wind,9.0,['Black'],['B'],None,['Sorcery'],None,Rare,PCY,None,None,None,Destroy all creatures you don't control. They can't be regenerated.
Plague Fiend,2.0,['Black'],['B'],None,['Creature'],['Insect'],Common,PCY,1,1,None,"Whenever Plague Fiend deals combat damage to a creature, destroy that creature unless its controller pays {2}."
Pit Raptor,4.0,['Black'],['B'],None,['Creature'],"['Bird', 'Mercenary']",Uncommon,PCY,4,3,None,"Flying, first strike\nAt the beginning of your upkeep, sacrifice Pit Raptor unless you pay {2}{B}{B}."
Barbed Field,4.0,['Red'],['R'],None,['Enchantment'],['Aura'],Uncommon,PCY,None,None,None,"Enchant land\nEnchanted land has ""{T}: This land deals 1 damage to any target."""
Avatar of Fury,8.0,['Red'],['R'],None,['Creature'],['Avatar'],Rare,PCY,6,6,None,"If an opponent controls seven or more lands, this spell costs {6} less to cast.\nFlying\n{R}: Avatar of Fury gets +1/+0 until end of turn."
Whipstitched Zombie,2.0,['Black'],['B'],None,['Creature'],['Zombie'],Common,PCY,2,2,None,"At the beginning of your upkeep, sacrifice Whipstitched Zombie unless you pay {B}."
Soul Strings,1.0,['Black'],['B'],None,['Sorcery'],None,Common,PCY,None,None,None,Return two target creature cards from your graveyard to your hand unless any player pays {X}.
Rhystic Tutor,3.0,['Black'],['B'],None,['Sorcery'],None,Rare,PCY,None,None,None,"Unless any player pays {2}, search your library for a card, put that card into your hand, then shuffle."
Wall of Vipers,3.0,['Black'],['B'],None,['Creature'],"['Snake', 'Wall']",Uncommon,PCY,2,4,None,Defender (This creature can't attack.)\n{3}: Destroy Wall of Vipers and target creature it's blocking. Any player may activate this ability.
Steal Strength,2.0,['Black'],['B'],None,['Instant'],None,Common,PCY,None,None,None,Target creature gets +1/+1 until end of turn. Another target creature gets -1/-1 until end of turn.
