Name,CMC,Colors,Color identity,Supertypes,Types,Subtypes,Rarity,Set,Power,Toughness,Loyalty,Text
Nakaya Shade,2.0,['Black'],['B'],None,['Creature'],['Shade'],Uncommon,PCY,1,1,None,{B}: Nakaya Shade gets +1/+1 until end of turn unless any player pays {2}.
Infernal Genesis,6.0,['Black'],['B'],None,['Enchantment'],None,Rare,PCY,None,None,None,"At the beginning of each player's upkeep, that player mills a card. Then they create X 1/1 black Minion creature tokens, where X is the milled card's mana value."
Greel's Caress,2.0,['Black'],['B'],None,['Enchantment'],['Aura'],Common,PCY,None,None,None,Flash\nEnchant creature\nEnchanted creature gets -3/-0.
"Greel, Mind Raker",5.0,['Black'],['B'],['Legendary'],['Creature'],"['Horror', 'Spellshaper']",Rare,PCY,3,3,None,"{X}{B}, {T}, Discard two cards: Target player discards X cards at random."
Flay,4.0,['Black'],['B'],None,['Sorcery'],None,Common,PCY,None,None,None,Target player discards a card at random. Then that player discards another card at random unless they pay {1}.
Fen Stalker,4.0,['Black'],['B'],None,['Creature'],['Nightstalker'],Common,PCY,3,2,None,Fen Stalker has fear as long as you control no untapped lands. (It can't be blocked except by artifact creatures and/or black creatures.)
Endbringer's Revel,3.0,['Black'],['B'],None,['Enchantment'],None,Uncommon,PCY,None,None,None,{4}: Return target creature card from a graveyard to its owner's hand. Any player may activate this ability but only as a sorcery.
Despoil,4.0,['Black'],['B'],None,['Sorcery'],None,Common,PCY,None,None,None,Destroy target land. Its controller loses 2 life.
Death Charmer,3.0,['Black'],['B'],None,['Creature'],"['Worm', 'Mercenary']",Common,PCY,2,2,None,"Whenever Death Charmer deals combat damage to a creature, that creature's controller loses 2 life unless they pay {2}."
Entangler,4.0,['White'],['W'],None,['Enchantment'],['Aura'],Uncommon,PCY,None,None,None,Enchant creature\nEnchanted creature can block any number of creatures.
Coffin Puppets,5.0,['Black'],['B'],None,['Creature'],['Zombie'],Rare,PCY,3,3,None,Sacrifice two lands: Return Coffin Puppets from your graveyard to the battlefield. Activate only during your upkeep and only if you control a Swamp.
Chilling Apparition,3.0,['Black'],['B'],None,['Creature'],['Spirit'],Uncommon,PCY,1,1,None,"{B}: Regenerate Chilling Apparition.\nWhenever Chilling Apparition deals combat damage to a player, that player discards a card."
Bog Glider,3.0,['Black'],['B'],None,['Creature'],"['Human', 'Mercenary']",Common,PCY,1,1,None,"Flying\n{T}, Sacrifice a land: Search your library for a Mercenary permanent card with mana value 2 or less, put it onto the battlefield, then shuffle."
Bog Elemental,5.0,['Black'],['B'],None,['Creature'],['Elemental'],Rare,PCY,5,4,None,"Protection from white\nAt the beginning of your upkeep, sacrifice Bog Elemental unless you sacrifice a land."
Avatar of Woe,8.0,['Black'],['B'],None,['Creature'],['Avatar'],Rare,PCY,6,5,None,"If there are ten or more creature cards total in all graveyards, this spell costs {6} less to cast.\nFear (This creature can't be blocked except by artifact creatures and/or black creatures.)\n{T}: Destroy target creature. It can't be regenerated."
Agent of Shauku,2.0,['Black'],['B'],None,['Creature'],"['Human', 'Mercenary']",Common,PCY,1,1,None,"{1}{B}, Sacrifice a land: Target creature gets +2/+0 until end of turn."
Withdraw,2.0,['Blue'],['U'],None,['Instant'],None,Common,PCY,None,None,None,Return target creature to its owner's hand. Then return another target creature to its owner's hand unless its controller pays {1}.
Windscouter,4.0,['Blue'],['U'],None,['Creature'],"['Human', 'Scout']",Uncommon,PCY,3,3,None,"Flying\nWhen Windscouter attacks or blocks, return it to its owner's hand at end of combat. (Return it only if it's on the battlefield.)"
Troublesome Spirit,4.0,['Blue'],['U'],None,['Creature'],['Spirit'],Rare,PCY,3,4,None,"Flying\nAt the beginning of your end step, tap all lands you control."
Sunken Field,2.0,['Blue'],['U'],None,['Enchantment'],['Aura'],Uncommon,PCY,None,None,None,"Enchant land\nEnchanted land has ""{T}: Counter target spell unless its controller pays {1}."""
Wintermoon Mesa,0.0,None,None,None,['Land'],None,Rare,PCY,None,None,None,"Wintermoon Mesa enters the battlefield tapped.\n{T}: Add {C}.\n{2}, {T}, Sacrifice Wintermoon Mesa: Tap two target lands."
Stormwatch Eagle,4.0,['Blue'],['U'],None,['Creature'],['Bird'],Common,PCY,2,1,None,Flying\nSacrifice a land: Return Stormwatch Eagle to its owner's hand.
Spiketail Hatchling,2.0,['Blue'],['U'],None,['Creature'],['Drake'],Common,PCY,1,1,None,Flying (This creature can't be blocked except by creatures with flying or reach.)\nSacrifice Spiketail Hatchling: Counter target spell unless its controller pays {1}.
Spiketail Drake,5.0,['Blue'],['U'],None,['Creature'],['Drake'],Uncommon,PCY,3,3,None,Flying\nSacrifice Spiketail Drake: Counter target spell unless its controller pays {3}.
Shrouded Serpent,7.0,['Blue'],['U'],None,['Creature'],['Serpent'],Rare,PCY,4,4,None,"Whenever Shrouded Serpent attacks, defending player may pay {4}. If that player doesn't, Shrouded Serpent can't be blocked this turn."
Ribbon Snake,3.0,['Blue'],['U'],None,['Creature'],['Snake'],Common,PCY,2,3,None,Flying\n{2}: Ribbon Snake loses flying until end of turn. Any player may activate this ability.
Rhystic Study,3.0,['Blue'],['U'],None,['Enchantment'],None,Common,PCY,None,None,None,"Whenever an opponent casts a spell, you may draw a card unless that player pays {1}."
Rhystic Scrying,4.0,['Blue'],['U'],None,['Sorcery'],None,Uncommon,PCY,None,None,None,"Draw three cards. Then if any player pays {2}, discard three cards."
Rhystic Deluge,3.0,['Blue'],['U'],None,['Enchantment'],None,Common,PCY,None,None,None,{U}: Tap target creature unless its controller pays {1}.
Rethink,3.0,['Blue'],['U'],None,['Instant'],None,Common,PCY,None,None,None,"Counter target spell unless its controller pays {X}, where X is its mana value."
Rhystic Cave,0.0,None,None,None,['Land'],None,Uncommon,PCY,None,None,None,{T}: Choose a color. Add one mana of that color unless any player pays {1}. Activate only as an instant.
Quicksilver Wall,3.0,['Blue'],['U'],None,['Creature'],['Wall'],Uncommon,PCY,1,6,None,Defender (This creature can't attack.)\n{4}: Return Quicksilver Wall to its owner's hand. Any player may activate this ability.
Well of Life,4.0,None,None,None,['Artifact'],None,Uncommon,PCY,None,None,None,"At the beginning of your end step, if you control no untapped lands, you gain 2 life."
Psychic Theft,2.0,['Blue'],['U'],None,['Sorcery'],None,Rare,PCY,None,None,None,"Target player reveals their hand. You choose an instant or sorcery card from it and exile that card. You may cast that card for as long as it remains exiled. At the beginning of the next end step, if you haven't cast the card, return it to its owner's hand."
Well of Discovery,6.0,None,None,None,['Artifact'],None,Rare,PCY,None,None,None,"At the beginning of your end step, if you control no untapped lands, draw a card."
Overburden,2.0,['Blue'],['U'],None,['Enchantment'],None,Rare,PCY,None,None,None,"Whenever a player puts a nontoken creature onto the battlefield, that player returns a land they control to its owner's hand."
Keldon Battlewagon,5.0,None,None,None,"['Artifact', 'Creature']",['Juggernaut'],Rare,PCY,0,3,None,"Trample\nKeldon Battlewagon can't block.\nWhen Keldon Battlewagon attacks, sacrifice it at end of combat.\nTap an untapped creature you control: Keldon Battlewagon gets +X/+0 until end of turn, where X is the power of the creature tapped this way."
Mana Vapors,2.0,['Blue'],['U'],None,['Sorcery'],None,Uncommon,PCY,None,None,None,Lands target player controls don't untap during their next untap step.
Hollow Warrior,4.0,None,None,None,"['Artifact', 'Creature']","['Golem', 'Warrior']",Uncommon,PCY,4,4,None,Hollow Warrior can't attack or block unless you tap an untapped creature you control not declared as an attacking or blocking creature this combat. (This cost is paid as attackers or blockers are declared.)
Heightened Awareness,5.0,['Blue'],['U'],None,['Enchantment'],None,Rare,PCY,None,None,None,"As Heightened Awareness enters the battlefield, discard your hand.\nAt the beginning of your draw step, draw an additional card."
Copper-Leaf Angel,5.0,None,None,None,"['Artifact', 'Creature']",['Angel'],Rare,PCY,2,2,None,"Flying\n{T}, Sacrifice X lands: Put X +1/+1 counters on Copper-Leaf Angel."
Hazy Homunculus,2.0,['Blue'],['U'],None,['Creature'],"['Homunculus', 'Illusion']",Common,PCY,1,1,None,Hazy Homunculus can't be blocked as long as defending player controls an untapped land.
Chimeric Idol,3.0,None,None,None,['Artifact'],None,Uncommon,PCY,None,None,None,{0}: Tap all lands you control. Chimeric Idol becomes a 3/3 Turtle artifact creature until end of turn.
Gulf Squid,4.0,['Blue'],['U'],None,['Creature'],"['Squid', 'Beast']",Common,PCY,2,2,None,"When Gulf Squid enters the battlefield, tap all lands target player controls."
Wing Storm,3.0,['Green'],['G'],None,['Sorcery'],None,Uncommon,PCY,None,None,None,Wing Storm deals damage to each player equal to twice the number of creatures with flying that player controls.
Wild Might,2.0,['Green'],['G'],None,['Instant'],None,Common,PCY,None,None,None,Target creature gets +1/+1 until end of turn. That creature gets an additional +4/+4 until end of turn unless any player pays {2}.
Foil,4.0,['Blue'],['U'],None,['Instant'],None,Uncommon,PCY,None,None,None,You may discard an Island card and another card rather than pay this spell's mana cost.\nCounter target spell.
Vitalizing Wind,9.0,['Green'],['G'],None,['Instant'],None,Rare,PCY,None,None,None,Creatures you control get +7/+7 until end of turn.
Excavation,2.0,['Blue'],['U'],None,['Enchantment'],None,Uncommon,PCY,None,None,None,"{1}, Sacrifice a land: Draw a card. Any player may activate this ability."
Vintara Snapper,2.0,['Green'],['G'],None,['Creature'],['Turtle'],Uncommon,PCY,2,2,None,Vintara Snapper has shroud as long as you control no untapped lands. (It can't be the target of spells or abilities.)
Denying Wind,9.0,['Blue'],['U'],None,['Sorcery'],None,Rare,PCY,None,None,None,Search target player's library for up to seven cards and exile them. Then that player shuffles.
Coastal Hornclaw,5.0,['Blue'],['U'],None,['Creature'],['Bird'],Common,PCY,3,3,None,Sacrifice a land: Coastal Hornclaw gains flying until end of turn.
Vintara Elephant,5.0,['Green'],['G'],None,['Creature'],['Elephant'],Common,PCY,4,3,None,Trample\n{3}: Vintara Elephant loses trample until end of turn. Any player may activate this ability.
Avatar of Will,8.0,['Blue'],['U'],None,['Creature'],['Avatar'],Rare,PCY,5,6,None,"If an opponent has no cards in hand, this spell costs {6} less to cast.\nFlying"
Verdant Field,3.0,['Green'],['G'],None,['Enchantment'],['Aura'],Uncommon,PCY,None,None,None,"Enchant land\nEnchanted land has ""{T}: Target creature gets +1/+1 until end of turn."""
Avatar of Hope,8.0,['White'],['W'],None,['Creature'],['Avatar'],Rare,PCY,4,9,None,"If you have 3 or less life, this spell costs {6} less to cast.\nFlying\nAvatar of Hope can block any number of creatures."
Thrive,1.0,['Green'],['G'],None,['Sorcery'],None,Common,PCY,None,None,None,Put a +1/+1 counter on each of X target creatures.
Mageta's Boon,2.0,['White'],['W'],None,['Enchantment'],['Aura'],Common,PCY,None,None,None,Flash\nEnchant creature\nEnchanted creature gets +1/+2.
Thresher Beast,5.0,['Green'],['G'],None,['Creature'],['Beast'],Common,PCY,4,4,None,"Whenever Thresher Beast becomes blocked, defending player sacrifices a land."
"Alexi, Zephyr Mage",5.0,['Blue'],['U'],['Legendary'],['Creature'],"['Human', 'Spellshaper']",Rare,PCY,3,3,None,"{X}{U}, {T}, Discard two cards: Return X target creatures to their owners' hands."
Squirrel Wrangler,4.0,['Green'],['G'],None,['Creature'],"['Human', 'Druid']",Rare,PCY,2,2,None,"{1}{G}, Sacrifice a land: Create two 1/1 green Squirrel creature tokens.\n{1}{G}, Sacrifice a land: Squirrel creatures get +1/+1 until end of turn."
Alexi's Cloak,2.0,['Blue'],['U'],None,['Enchantment'],['Aura'],Common,PCY,None,None,None,Flash\nEnchant creature\nEnchanted creature has shroud. (It can't be the target of spells or abilities.)
Spore Frog,1.0,['Green'],['G'],None,['Creature'],['Frog'],Common,PCY,1,1,None,Sacrifice Spore Frog: Prevent all combat damage that would be dealt this turn.
Troubled Healer,3.0,['White'],['W'],None,['Creature'],"['Human', 'Cleric']",Common,PCY,1,2,None,Sacrifice a land: Prevent the next 2 damage that would be dealt to any target this turn.
Spitting Spider,5.0,['Green'],['G'],None,['Creature'],['Spider'],Uncommon,PCY,3,5,None,Reach (This creature can block creatures with flying.)\nSacrifice a land: Spitting Spider deals 1 damage to each creature with flying.
Snag,4.0,['Green'],['G'],None,['Instant'],None,Uncommon,PCY,None,None,None,You may discard a Forest card rather than pay this spell's mana cost.\nPrevent all combat damage that would be dealt by unblocked creatures this turn.
Trenching Steed,4.0,['White'],['W'],None,['Creature'],"['Horse', 'Rebel']",Common,PCY,2,3,None,Sacrifice a land: Trenching Steed gets +0/+3 until end of turn.
Silt Crawler,3.0,['Green'],['G'],None,['Creature'],['Beast'],Common,PCY,3,3,None,"When Silt Crawler enters the battlefield, tap all lands you control."
Shield Dancer,3.0,['White'],['W'],None,['Creature'],"['Human', 'Rebel']",Uncommon,PCY,1,3,None,"{2}{W}: The next time target attacking creature would deal combat damage to Shield Dancer this turn, that creature deals that damage to itself instead."
Root Cage,2.0,['Green'],['G'],None,['Enchantment'],None,Uncommon,PCY,None,None,None,Mercenaries don't untap during their controllers' untap steps.
Aura Fracture,3.0,['White'],['W'],None,['Enchantment'],None,Common,PCY,None,None,None,Sacrifice a land: Destroy target enchantment.
Rib Cage Spider,3.0,['Green'],['G'],None,['Creature'],['Spider'],Common,PCY,1,4,None,Reach (This creature can block creatures with flying.)
Sheltering Prayers,1.0,['White'],['W'],None,['Enchantment'],None,Rare,PCY,None,None,None,Basic lands each player controls have shroud as long as that player controls three or fewer lands. (They can't be the targets of spells or abilities.)
Pygmy Razorback,2.0,['Green'],['G'],None,['Creature'],['Boar'],Common,PCY,2,1,None,Trample
Sword Dancer,2.0,['White'],['W'],None,['Creature'],"['Human', 'Rebel']",Uncommon,PCY,1,2,None,{W}{W}: Target attacking creature gets -1/-0 until end of turn.
Mungha Wurm,4.0,['Green'],['G'],None,['Creature'],['Wurm'],Rare,PCY,6,5,None,You can't untap more than one land during your untap step.
Soul Charmer,3.0,['White'],['W'],None,['Creature'],"['Human', 'Rebel']",Common,PCY,2,2,None,"Whenever Soul Charmer deals combat damage to a creature, you gain 2 life unless that creature's controller pays {2}."
Marsh Boa,1.0,['Green'],['G'],None,['Creature'],['Snake'],Common,PCY,1,1,None,Swampwalk (This creature can't be blocked as long as defending player controls a Swamp.)
Living Terrain,4.0,['Green'],['G'],None,['Enchantment'],['Aura'],Uncommon,PCY,None,None,None,Enchant land\nEnchanted land is a 5/6 green Treefolk creature that's still a land.
Jolrael's Favor,2.0,['Green'],['G'],None,['Enchantment'],['Aura'],Common,PCY,None,None,None,Flash\nEnchant creature\n{1}{G}: Regenerate enchanted creature.
Scoria Cat,5.0,['Red'],['R'],None,['Creature'],['Cat'],Uncommon,PCY,3,3,None,Scoria Cat gets +3/+3 as long as you control no untapped lands.
Dual Nature,6.0,['Green'],['G'],None,['Enchantment'],None,Rare,PCY,None,None,None,"Whenever a nontoken creature enters the battlefield, its controller creates a token that's a copy of that creature.\nWhenever a nontoken creature leaves the battlefield, exile all tokens with the same name as that creature.\nWhen Dual Nature leaves the battlefield, exile all tokens created with Dual Nature."
Forgotten Harvest,2.0,['Green'],['G'],None,['Enchantment'],None,Rare,PCY,None,None,None,"At the beginning of your upkeep, you may exile a land card from your graveyard. If you do, put a +1/+1 counter on target creature."
Mageta the Lion,5.0,['White'],['W'],['Legendary'],['Creature'],"['Human', 'Spellshaper']",Rare,PCY,3,3,None,"{2}{W}{W}, {T}, Discard two cards: Destroy all creatures except for Mageta the Lion. Those creatures can't be regenerated."
"Jolrael, Empress of Beasts",5.0,['Green'],['G'],['Legendary'],['Creature'],"['Human', 'Spellshaper']",Rare,PCY,3,3,None,"{2}{G}, {T}, Discard two cards: All lands target player controls become 3/3 creatures until end of turn. They're still lands."
Samite Sanctuary,3.0,['White'],['W'],None,['Enchantment'],None,Rare,PCY,None,None,None,{2}: Prevent the next 1 damage that would be dealt to target creature this turn. Any player may activate this ability.
Elephant Resurgence,2.0,['Green'],['G'],None,['Sorcery'],None,Rare,PCY,None,None,None,"Each player creates a green Elephant creature token. Those creatures have ""This creature's power and toughness are each equal to the number of creature cards in its controller's graveyard."""
Rhystic Circle,4.0,['White'],['W'],None,['Enchantment'],None,Common,PCY,None,None,None,"{1}: Any player may pay {1}. If no one does, the next time a source of your choice would deal damage to you this turn, prevent that damage."
Darba,4.0,['Green'],['G'],None,['Creature'],"['Bird', 'Beast']",Uncommon,PCY,5,4,None,"At the beginning of your upkeep, sacrifice Darba unless you pay {G}{G}."
Celestial Convergence,4.0,['White'],['W'],None,['Enchantment'],None,Rare,PCY,None,None,None,"Celestial Convergence enters the battlefield with seven omen counters on it.\nAt the beginning of your upkeep, remove an omen counter from Celestial Convergence. If there are no omen counters on Celestial Convergence, the player with the highest life total wins the game. If two or more players are tied for highest life total, the game is a draw."
Calming Verse,4.0,['Green'],['G'],None,['Sorcery'],None,Common,PCY,None,None,None,"Destroy all enchantments you don't control. Then if you control an untapped land, destroy all enchantments you control."
Avatar of Might,8.0,['Green'],['G'],None,['Creature'],['Avatar'],Rare,PCY,8,8,None,"If an opponent controls at least four more creatures than you, this spell costs {6} less to cast.\nTrample (This creature can deal excess combat damage to the player or planeswalker it's attacking.)"
Veteran Brawlers,2.0,['Red'],['R'],None,['Creature'],"['Human', 'Soldier']",Rare,PCY,4,4,None,Veteran Brawlers can't attack if defending player controls an untapped land.\nVeteran Brawlers can't block if you control an untapped land.
Zerapa Minotaur,4.0,['Red'],['R'],None,['Creature'],['Minotaur'],Common,PCY,3,3,None,First strike\n{2}: Zerapa Minotaur loses first strike until end of turn. Any player may activate this ability.
Whip Sergeant,3.0,['Red'],['R'],None,['Creature'],"['Human', 'Soldier']",Uncommon,PCY,2,1,None,{R}: Target creature gains haste until end of turn. (It can attack this turn.)
Search for Survivors,3.0,['Red'],['R'],None,['Sorcery'],None,Rare,PCY,None,None,None,"Reorder your graveyard at random. An opponent chooses a card at random in your graveyard. If it's a creature card, put it onto the battlefield. Otherwise, exile it."
Ridgeline Rager,3.0,['Red'],['R'],None,['Creature'],['Beast'],Common,PCY,1,2,None,{R}: Ridgeline Rager gets +1/+0 until end of turn.
Mine Bearer,3.0,['White'],['W'],None,['Creature'],"['Human', 'Soldier']",Common,PCY,1,1,None,"{T}, Sacrifice Mine Bearer: Destroy target attacking creature."
Task Mage Assembly,3.0,['Red'],['R'],None,['Enchantment'],None,Rare,PCY,None,None,None,"When there are no creatures on the battlefield, sacrifice Task Mage Assembly.\n{2}: Task Mage Assembly deals 1 damage to target creature. Any player may activate this ability but only as a sorcery."
Abolish,3.0,['White'],['W'],None,['Instant'],None,Uncommon,PCY,None,None,None,You may discard a Plains card rather than pay this spell's mana cost.\nDestroy target artifact or enchantment.
Spur Grappler,3.0,['Red'],['R'],None,['Creature'],['Beast'],Common,PCY,2,1,None,Spur Grappler gets +2/+1 as long as you control no untapped lands.
Searing Wind,9.0,['Red'],['R'],None,['Instant'],None,Rare,PCY,None,None,None,Searing Wind deals 10 damage to any target.
Citadel of Pain,3.0,['Red'],['R'],None,['Enchantment'],None,Uncommon,PCY,None,None,None,"At the beginning of each player's end step, Citadel of Pain deals X damage to that player, where X is the number of untapped lands they control."
Latulla's Orders,2.0,['Red'],['R'],None,['Enchantment'],['Aura'],Common,PCY,None,None,None,"Flash\nEnchant creature\nWhenever enchanted creature deals combat damage to defending player, you may destroy target artifact that player controls."
Rhystic Shield,2.0,['White'],['W'],None,['Instant'],None,Common,PCY,None,None,None,Creatures you control get +0/+1 until end of turn. They get an additional +0/+2 until end of turn unless any player pays {2}.
Panic Attack,3.0,['Red'],['R'],None,['Sorcery'],None,Common,PCY,None,None,None,Up to three target creatures can't block this turn.
Jeweled Spirit,5.0,['White'],['W'],None,['Creature'],['Spirit'],Rare,PCY,3,3,None,Flying\nSacrifice two lands: Jeweled Spirit gains protection from artifacts or from the color of your choice until end of turn.
Rhystic Lightning,3.0,['Red'],['R'],None,['Instant'],None,Common,PCY,None,None,None,"Rhystic Lightning deals 4 damage to any target unless that permanent's controller or that player pays {2}. If they do, Rhystic Lightning deals 2 damage to the permanent or player."
Blessed Wind,9.0,['White'],['W'],None,['Sorcery'],None,Rare,PCY,None,None,None,Target player's life total becomes 20.
Lesser Gargadon,4.0,['Red'],['R'],None,['Creature'],['Beast'],Uncommon,PCY,6,4,None,"Whenever Lesser Gargadon attacks or blocks, sacrifice a land."
Flowering Field,2.0,['White'],['W'],None,['Enchantment'],['Aura'],Uncommon,PCY,None,None,None,"Enchant land\nEnchanted land has ""{T}: Prevent the next 1 damage that would be dealt to any target this turn."""
"Latulla, Keldon Overseer",5.0,['Red'],['R'],['Legendary'],['Creature'],"['Human', 'Spellshaper']",Rare,PCY,3,3,None,"{X}{R}, {T}, Discard two cards: Latulla, Keldon Overseer deals X damage to any target."
Noxious Field,3.0,['Black'],['B'],None,['Enchantment'],['Aura'],Uncommon,PCY,None,None,None,"Enchant land\nEnchanted land has ""{T}: This land deals 1 damage to each creature and each player."""
Keldon Arsonist,3.0,['Red'],['R'],None,['Creature'],"['Human', 'Soldier']",Uncommon,PCY,1,1,None,"{1}, Sacrifice two lands: Destroy target land."
Glittering Lynx,1.0,['White'],['W'],None,['Creature'],['Cat'],Common,PCY,1,1,None,"Prevent all damage that would be dealt to Glittering Lynx.\n{2}: Until end of turn, Glittering Lynx loses ""Prevent all damage that would be dealt to Glittering Lynx."" Any player may activate this ability."
Keldon Berserker,4.0,['Red'],['R'],None,['Creature'],"['Human', 'Soldier', 'Berserker']",Common,PCY,2,3,None,"Whenever Keldon Berserker attacks, if you control no untapped lands, it gets +3/+0 until end of turn."
Keldon Firebombers,5.0,['Red'],['R'],None,['Creature'],"['Human', 'Soldier']",Rare,PCY,3,3,None,"When Keldon Firebombers enters the battlefield, each player sacrifices all lands they control except for three."
Flameshot,4.0,['Red'],['R'],None,['Sorcery'],None,Uncommon,PCY,None,None,None,"You may discard a Mountain card rather than pay this spell's mana cost.\nFlameshot deals 3 damage divided as you choose among one, two, or three target creatures."
Reveille Squad,4.0,['White'],['W'],None,['Creature'],"['Human', 'Rebel']",Uncommon,PCY,3,3,None,"Whenever one or more creatures attack you, if Reveille Squad is untapped, you may untap all creatures you control."
Inflame,1.0,['Red'],['R'],None,['Instant'],None,Common,PCY,None,None,None,Inflame deals 2 damage to each creature dealt damage this turn.
Mercenary Informer,3.0,['White'],['W'],None,['Creature'],"['Human', 'Rebel', 'Mercenary']",Rare,PCY,2,1,None,Mercenary Informer can't be the target of black spells or abilities from black sources.\n{2}{W}: Put target nontoken Mercenary on the bottom of its owner's library.
Devastate,5.0,['Red'],['R'],None,['Sorcery'],None,Common,PCY,None,None,None,Destroy target land. Devastate deals 1 damage to each creature and each player.
Brutal Suppression,1.0,['Red'],['R'],None,['Enchantment'],None,Uncommon,PCY,None,None,None,"Activated abilities of nontoken Rebels cost an additional ""Sacrifice a land"" to activate."
Outbreak,4.0,['Black'],['B'],None,['Sorcery'],None,Uncommon,PCY,None,None,None,You may discard a Swamp card rather than pay this spell's mana cost.\nChoose a creature type. All creatures of that type get -1/-1 until end of turn.
Excise,1.0,['White'],['W'],None,['Instant'],None,Common,PCY,None,None,None,Exile target attacking creature unless its controller pays {X}.
Fickle Efreet,4.0,['Red'],['R'],None,['Creature'],['Efreet'],Rare,PCY,5,2,None,"Whenever Fickle Efreet attacks or blocks, flip a coin at end of combat. If you lose the flip, an opponent gains control of Fickle Efreet."
Glittering Lion,3.0,['White'],['W'],None,['Creature'],['Cat'],Uncommon,PCY,2,2,None,"Prevent all damage that would be dealt to Glittering Lion.\n{3}: Until end of turn, Glittering Lion loses ""Prevent all damage that would be dealt to Glittering Lion."" Any player may activate this ability."
Fault Riders,3.0,['Red'],['R'],None,['Creature'],"['Human', 'Soldier']",Common,PCY,2,2,None,Sacrifice a land: Fault Riders gets +2/+0 and gains first strike until end of turn. Activate only once each turn.
Branded Brawlers,1.0,['Red'],['R'],None,['Creature'],"['Human', 'Soldier']",Common,PCY,2,2,None,Branded Brawlers can't attack if defending player controls an untapped land.\nBranded Brawlers can't block if you control an untapped land.
Mirror Strike,4.0,['White'],['W'],None,['Instant'],None,Uncommon,PCY,None,None,None,All combat damage that would be dealt to you this turn by target unblocked creature is dealt to its controller instead.
