Name,CMC,Colors,Color identity,Supertypes,Types,Subtypes,Rarity,Set,Power,Toughness,Loyalty,Text
Overwhelming Intellect,6.0,['Blue'],['U'],None,['Instant'],None,Uncommon,TD0,None,None,None,Counter target creature spell. Draw cards equal to that spell's mana value.
Karakas,0.0,None,['W'],['Legendary'],['Land'],None,Rare,TD0,None,None,None,{T}: Add {W}.\n{T}: Return target legendary creature to its owner's hand.
Mulldrifter,5.0,['Blue'],['U'],None,['Creature'],['Elemental'],Common,TD0,2,2,None,"Flying\nWhen Mulldrifter enters the battlefield, draw two cards.\nEvoke {2}{U} (You may cast this spell for its evoke cost. If you do, it's sacrificed when it enters the battlefield.)"
Elvish Visionary,2.0,['Green'],['G'],None,['Creature'],"['Elf', 'Shaman']",Common,TD0,1,1,None,"When Elvish Visionary enters the battlefield, draw a card."
Merfolk Looter,2.0,['Blue'],['U'],None,['Creature'],"['Merfolk', 'Rogue']",Common,TD0,1,1,None,"{T}: Draw a card, then discard a card."
Man-o'-War,3.0,['Blue'],['U'],None,['Creature'],['Jellyfish'],Common,TD0,2,2,None,"When Man-o'-War enters the battlefield, return target creature to its owner's hand."
Flagstones of Trokair,0.0,None,['W'],['Legendary'],['Land'],None,Rare,TD0,None,None,None,"{T}: Add {W}.\nWhen Flagstones of Trokair is put into a graveyard from the battlefield, you may search your library for a Plains card, put it onto the battlefield tapped, then shuffle."
Looter il-Kor,2.0,['Blue'],['U'],None,['Creature'],"['Kor', 'Rogue']",Common,TD0,1,1,None,"Shadow (This creature can block or be blocked by only creatures with shadow.)\nWhenever Looter il-Kor deals damage to an opponent, draw a card, then discard a card."
Recollect,3.0,['Green'],['G'],None,['Sorcery'],None,Uncommon,TD0,None,None,None,Return target card from your graveyard to your hand.
Hinder,3.0,['Blue'],['U'],None,['Instant'],None,Uncommon,TD0,None,None,None,"Counter target spell. If that spell is countered this way, put that card on the top or bottom of its owner's library instead of into that player's graveyard."
Rampant Growth,2.0,['Green'],['G'],None,['Sorcery'],None,Common,TD0,None,None,None,"Search your library for a basic land card, put that card onto the battlefield tapped, then shuffle."
Fact or Fiction,4.0,['Blue'],['U'],None,['Instant'],None,Uncommon,TD0,None,None,None,Reveal the top five cards of your library. An opponent separates those cards into two piles. Put one pile into your hand and the other into your graveyard.
Elven Cache,4.0,['Green'],['G'],None,['Sorcery'],None,Common,TD0,None,None,None,Return target card from your graveyard to your hand.
Court Hussar,3.0,['Blue'],"['U', 'W']",None,['Creature'],"['Vedalken', 'Knight']",Uncommon,TD0,1,3,None,"Vigilance\nWhen Court Hussar enters the battlefield, look at the top three cards of your library, then put one of them into your hand and the rest on the bottom of your library in any order.\nWhen Court Hussar enters the battlefield, sacrifice it unless {W} was spent to cast it."
Copy Enchantment,3.0,['Blue'],['U'],None,['Enchantment'],None,Rare,TD0,None,None,None,You may have Copy Enchantment enter the battlefield as a copy of any enchantment on the battlefield.
Confiscate,6.0,['Blue'],['U'],None,['Enchantment'],['Aura'],Uncommon,TD0,None,None,None,Enchant permanent\nYou control enchanted permanent.
Phantom Centaur,4.0,['Green'],['G'],None,['Creature'],"['Centaur', 'Spirit']",Uncommon,TD0,2,0,None,"Protection from black\nPhantom Centaur enters the battlefield with three +1/+1 counters on it.\nIf damage would be dealt to Phantom Centaur, prevent that damage. Remove a +1/+1 counter from Phantom Centaur."
Condemn,1.0,['White'],['W'],None,['Instant'],None,Uncommon,TD0,None,None,None,Put target attacking creature on the bottom of its owner's library. Its controller gains life equal to its toughness.
Edge of Autumn,2.0,['Green'],['G'],None,['Sorcery'],None,Common,TD0,None,None,None,"If you control four or fewer lands, search your library for a basic land card, put it onto the battlefield tapped, then shuffle.\nCycling—Sacrifice a land. (Sacrifice a land, Discard this card: Draw a card.)"
Penumbra Bobcat,3.0,['Green'],['G'],None,['Creature'],['Cat'],Common,TD0,2,1,None,"When Penumbra Bobcat dies, create a 2/1 black Cat creature token."
Compulsive Research,3.0,['Blue'],['U'],None,['Sorcery'],None,Common,TD0,None,None,None,Target player draws three cards. Then that player discards two cards unless they discard a land card.
Umezawa's Jitte,2.0,None,None,['Legendary'],['Artifact'],['Equipment'],Rare,TD0,None,None,None,"Whenever equipped creature deals combat damage, put two charge counters on Umezawa's Jitte.\nRemove a charge counter from Umezawa's Jitte: Choose one —\n• Equipped creature gets +2/+2 until end of turn.\n• Target creature gets -1/-1 until end of turn.\n• You gain 2 life.\nEquip {2}"
Capsize,3.0,['Blue'],['U'],None,['Instant'],None,Common,TD0,None,None,None,"Buyback {3} (You may pay an additional {3} as you cast this spell. If you do, put this card into your hand as it resolves.)\nReturn target permanent to its owner's hand."
Constant Mists,2.0,['Green'],['G'],None,['Instant'],None,Uncommon,TD0,None,None,None,"Buyback—Sacrifice a land. (You may sacrifice a land in addition to any other costs as you cast this spell. If you do, put this card into your hand as it resolves.)\nPrevent all combat damage that would be dealt this turn."
Ethersworn Canonist,2.0,['White'],['W'],None,"['Artifact', 'Creature']","['Human', 'Cleric']",Rare,TD0,2,2,None,Each player who has cast a nonartifact spell this turn can't cast additional nonartifact spells.
Swords to Plowshares,1.0,['White'],['W'],None,['Instant'],None,Uncommon,TD0,None,None,None,Exile target creature. Its controller gains life equal to its power.
Moment's Peace,2.0,['Green'],['G'],None,['Instant'],None,Common,TD0,None,None,None,Prevent all combat damage that would be dealt this turn.\nFlashback {2}{G} (You may cast this card from your graveyard for its flashback cost. Then exile it.)
Stonecloaker,3.0,['White'],['W'],None,['Creature'],['Gargoyle'],Uncommon,TD0,3,2,None,"Flash\nFlying\nWhen Stonecloaker enters the battlefield, return a creature you control to its owner's hand.\nWhen Stonecloaker enters the battlefield, exile target card from a graveyard."
Concordant Crossroads,1.0,['Green'],['G'],['World'],['Enchantment'],None,Uncommon,TD0,None,None,None,All creatures have haste.
Plains,0.0,None,['W'],['Basic'],['Land'],['Plains'],Common,TD0,None,None,None,({T}: Add {W}.)
Ghostly Prison,3.0,['White'],['W'],None,['Enchantment'],None,Uncommon,TD0,None,None,None,Creatures can't attack you unless their controller pays {2} for each creature they control that's attacking you.
Mountain,0.0,None,['R'],['Basic'],['Land'],['Mountain'],Common,TD0,None,None,None,({T}: Add {R}.)
Civic Wayfinder,3.0,['Green'],['G'],None,['Creature'],"['Elf', 'Druid', 'Warrior']",Common,TD0,2,2,None,"When Civic Wayfinder enters the battlefield, you may search your library for a basic land card, reveal it, put it into your hand, then shuffle."
Serra Avenger,2.0,['White'],['W'],None,['Creature'],['Angel'],Rare,TD0,3,3,None,"You can't cast this spell during your first, second, or third turns of the game.\nFlying, vigilance"
Forest,0.0,None,['G'],['Basic'],['Land'],['Forest'],Common,TD0,None,None,None,({T}: Add {G}.)
Life from the Loam,2.0,['Green'],['G'],None,['Sorcery'],None,Rare,TD0,None,None,None,"Return up to three target land cards from your graveyard to your hand.\nDredge 3 (If you would draw a card, you may mill three cards instead. If you do, return this card from your graveyard to your hand.)"
Forest,0.0,None,['G'],['Basic'],['Land'],['Forest'],Common,TD0,None,None,None,({T}: Add {G}.)
Forest,0.0,None,['G'],['Basic'],['Land'],['Forest'],Common,TD0,None,None,None,({T}: Add {G}.)
Brawn,4.0,['Green'],['G'],None,['Creature'],['Incarnation'],Uncommon,TD0,3,3,None,"Trample\nAs long as Brawn is in your graveyard and you control a Forest, creatures you control have trample."
Mountain,0.0,None,['R'],['Basic'],['Land'],['Mountain'],Common,TD0,None,None,None,({T}: Add {R}.)
Krosan Tusker,7.0,['Green'],['G'],None,['Creature'],"['Boar', 'Beast']",Common,TD0,6,5,None,"Cycling {2}{G} ({2}{G}, Discard this card: Draw a card.)\nWhen you cycle Krosan Tusker, you may search your library for a basic land card, reveal that card, put it into your hand, then shuffle. (Do this before you draw.)"
Bonesplitter,1.0,None,None,None,['Artifact'],['Equipment'],Common,TD0,None,None,None,Equipped creature gets +2/+0.\nEquip {1}
Kodama's Reach,3.0,['Green'],['G'],None,['Sorcery'],['Arcane'],Common,TD0,None,None,None,"Search your library for up to two basic land cards, reveal those cards, put one onto the battlefield tapped and the other into your hand, then shuffle."
Aether Vial,1.0,None,None,None,['Artifact'],None,Uncommon,TD0,None,None,None,"At the beginning of your upkeep, you may put a charge counter on Aether Vial.\n{T}: You may put a creature card with mana value equal to the number of charge counters on Aether Vial from your hand onto the battlefield."
Mountain,0.0,None,['R'],['Basic'],['Land'],['Mountain'],Common,TD0,None,None,None,({T}: Add {R}.)
Borderland Ranger,3.0,['Green'],['G'],None,['Creature'],"['Human', 'Scout', 'Ranger']",Common,TD0,2,2,None,"When Borderland Ranger enters the battlefield, you may search your library for a basic land card, reveal it, put it into your hand, then shuffle."
Mangara of Corondor,3.0,['White'],['W'],['Legendary'],['Creature'],"['Human', 'Wizard']",Rare,TD0,1,1,None,{T}: Exile Mangara of Corondor and target permanent.
Swamp,0.0,None,['B'],['Basic'],['Land'],['Swamp'],Common,TD0,None,None,None,({T}: Add {B}.)
Jungle Lion,1.0,['Green'],['G'],None,['Creature'],['Cat'],Common,TD0,2,1,None,Jungle Lion can't block.
Kor Firewalker,2.0,['White'],['W'],None,['Creature'],"['Kor', 'Soldier']",Uncommon,TD0,2,2,None,"Protection from red\nWhenever a player casts a red spell, you may gain 1 life."
Swamp,0.0,None,['B'],['Basic'],['Land'],['Swamp'],Common,TD0,None,None,None,({T}: Add {B}.)
Seal of Cleansing,2.0,['White'],['W'],None,['Enchantment'],None,Common,TD0,None,None,None,Sacrifice Seal of Cleansing: Destroy target artifact or enchantment.
Harmonize,4.0,['Green'],['G'],None,['Sorcery'],None,Uncommon,TD0,None,None,None,Draw three cards.
Jötun Grunt,2.0,['White'],['W'],None,['Creature'],"['Giant', 'Soldier']",Uncommon,TD0,4,4,None,"Cumulative upkeep—Put two cards from a single graveyard on the bottom of their owner's library. (At the beginning of your upkeep, put an age counter on this permanent, then sacrifice it unless you pay its upkeep cost for each age counter on it.)"
Swamp,0.0,None,['B'],['Basic'],['Land'],['Swamp'],Common,TD0,None,None,None,({T}: Add {B}.)
Mountain,0.0,None,['R'],['Basic'],['Land'],['Mountain'],Common,TD0,None,None,None,({T}: Add {R}.)
Island,0.0,None,['U'],['Basic'],['Land'],['Island'],Common,TD0,None,None,None,({T}: Add {U}.)
Plains,0.0,None,['W'],['Basic'],['Land'],['Plains'],Common,TD0,None,None,None,({T}: Add {W}.)
Rift Bolt,3.0,['Red'],['R'],None,['Sorcery'],None,Common,TD0,None,None,None,"Rift Bolt deals 3 damage to any target.\nSuspend 1—{R} (Rather than cast this card from your hand, you may pay {R} and exile it with a time counter on it. At the beginning of your upkeep, remove a time counter. When the last is removed, cast it without paying its mana cost.)"
Island,0.0,None,['U'],['Basic'],['Land'],['Island'],Common,TD0,None,None,None,({T}: Add {U}.)
Golgari Grave-Troll,5.0,['Green'],['G'],None,['Creature'],"['Troll', 'Skeleton']",Rare,TD0,0,0,None,"Golgari Grave-Troll enters the battlefield with a +1/+1 counter on it for each creature card in your graveyard.\n{1}, Remove a +1/+1 counter from Golgari Grave-Troll: Regenerate Golgari Grave-Troll.\nDredge 6 (If you would draw a card, you may mill six cards instead. If you do, return this card from your graveyard to your hand.)"
Island,0.0,None,['U'],['Basic'],['Land'],['Island'],Common,TD0,None,None,None,({T}: Add {U}.)
Pyrostatic Pillar,2.0,['Red'],['R'],None,['Enchantment'],None,Uncommon,TD0,None,None,None,"Whenever a player casts a spell with mana value 3 or less, Pyrostatic Pillar deals 2 damage to that player."
Plains,0.0,None,['W'],['Basic'],['Land'],['Plains'],Common,TD0,None,None,None,({T}: Add {W}.)
Resounding Thunder,3.0,['Red'],"['B', 'G', 'R']",None,['Instant'],None,Common,TD0,None,None,None,"Resounding Thunder deals 3 damage to any target.\nCycling {5}{B}{R}{G} ({5}{B}{R}{G}, Discard this card: Draw a card.)\nWhen you cycle Resounding Thunder, it deals 6 damage to any target."
Genesis,5.0,['Green'],['G'],None,['Creature'],['Incarnation'],Rare,TD0,4,4,None,"At the beginning of your upkeep, if Genesis is in your graveyard, you may pay {2}{G}. If you do, return target creature card from your graveyard to your hand."
Mountain,0.0,None,['R'],['Basic'],['Land'],['Mountain'],Common,TD0,None,None,None,({T}: Add {R}.)
Flickerwisp,3.0,['White'],['W'],None,['Creature'],['Elemental'],Uncommon,TD0,3,1,None,"Flying\nWhen Flickerwisp enters the battlefield, exile another target permanent. Return that card to the battlefield under its owner's control at the beginning of the next end step."
Treva's Ruins,0.0,None,"['G', 'U', 'W']",None,['Land'],['Lair'],Uncommon,TD0,None,None,None,"When Treva's Ruins enters the battlefield, sacrifice it unless you return a non-Lair land you control to its owner's hand.\n{T}: Add {G}, {W}, or {U}."
Fertile Ground,2.0,['Green'],['G'],None,['Enchantment'],['Aura'],Common,TD0,None,None,None,"Enchant land\nWhenever enchanted land is tapped for mana, its controller adds an additional one mana of any color."
Tranquil Thicket,0.0,None,['G'],None,['Land'],None,Common,TD0,None,None,None,"Tranquil Thicket enters the battlefield tapped.\n{T}: Add {G}.\nCycling {G} ({G}, Discard this card: Draw a card.)"
Explosive Vegetation,4.0,['Green'],['G'],None,['Sorcery'],None,Uncommon,TD0,None,None,None,"Search your library for up to two basic land cards, put them onto the battlefield tapped, then shuffle."
Mountain,0.0,None,['R'],['Basic'],['Land'],['Mountain'],Common,TD0,None,None,None,({T}: Add {R}.)
Selesnya Sanctuary,0.0,None,"['G', 'W']",None,['Land'],None,Uncommon,TD0,None,None,None,"Selesnya Sanctuary enters the battlefield tapped.\nWhen Selesnya Sanctuary enters the battlefield, return a land you control to its owner's hand.\n{T}: Add {G}{W}."
Mountain,0.0,None,['R'],['Basic'],['Land'],['Mountain'],Common,TD0,None,None,None,({T}: Add {R}.)
Seaside Citadel,0.0,None,"['G', 'U', 'W']",None,['Land'],None,Uncommon,TD0,None,None,None,"Seaside Citadel enters the battlefield tapped.\n{T}: Add {G}, {W}, or {U}."
Pyroblast,1.0,['Red'],['R'],None,['Instant'],None,Common,TD0,None,None,None,Choose one —\n• Counter target spell if it's blue.\n• Destroy target permanent if it's blue.
Savage Lands,0.0,None,"['B', 'G', 'R']",None,['Land'],None,Uncommon,TD0,None,None,None,"Savage Lands enters the battlefield tapped.\n{T}: Add {B}, {R}, or {G}."
Resurrection,4.0,['White'],['W'],None,['Sorcery'],None,Uncommon,TD0,None,None,None,Return target creature card from your graveyard to the battlefield.
Price of Progress,2.0,['Red'],['R'],None,['Instant'],None,Uncommon,TD0,None,None,None,Price of Progress deals damage to each player equal to twice the number of nonbasic lands that player controls.
Simic Growth Chamber,0.0,None,"['G', 'U']",None,['Land'],None,Uncommon,TD0,None,None,None,"Simic Growth Chamber enters the battlefield tapped.\nWhen Simic Growth Chamber enters the battlefield, return a land you control to its owner's hand.\n{T}: Add {G}{U}."
Terramorphic Expanse,0.0,None,None,None,['Land'],None,Common,TD0,None,None,None,"{T}, Sacrifice Terramorphic Expanse: Search your library for a basic land card, put it onto the battlefield tapped, then shuffle."
