Name,CMC,Colors,Color identity,Supertypes,Types,Subtypes,Rarity,Set,Power,Toughness,Loyalty,Text
Rupture Spire,0.0,None,None,None,['Land'],None,Common,TD0,None,None,None,"Rupture Spire enters the battlefield tapped.\nWhen Rupture Spire enters the battlefield, sacrifice it unless you pay {1}.\n{T}: Add one mana of any color."
Rakdos Carnarium,0.0,None,"['B', 'R']",None,['Land'],None,Common,TD0,None,None,None,"Rakdos Carnarium enters the battlefield tapped.\nWhen Rakdos Carnarium enters the battlefield, return a land you control to its owner's hand.\n{T}: Add {B}{R}."
"Miren, the Moaning Well",0.0,None,None,['Legendary'],['Land'],None,Rare,TD0,None,None,None,"{T}: Add {C}.\n{3}, {T}, Sacrifice a creature: You gain life equal to the sacrificed creature's toughness."
Jund Panorama,0.0,None,None,None,['Land'],None,Common,TD0,None,None,None,"{T}: Add {C}.\n{1}, {T}, Sacrifice Jund Panorama: Search your library for a basic Swamp, Mountain, or Forest card, put it onto the battlefield tapped, then shuffle."
Gruul Turf,0.0,None,"['G', 'R']",None,['Land'],None,Common,TD0,None,None,None,"Gruul Turf enters the battlefield tapped.\nWhen Gruul Turf enters the battlefield, return a land you control to its owner's hand.\n{T}: Add {R}{G}."
Prison Term,3.0,['White'],['W'],None,['Enchantment'],['Aura'],Uncommon,TD0,None,None,None,"Enchant creature\nEnchanted creature can't attack or block, and its activated abilities can't be activated.\nWhenever a creature enters the battlefield under an opponent's control, you may attach Prison Term to that creature."
Golgari Rot Farm,0.0,None,"['B', 'G']",None,['Land'],None,Common,TD0,None,None,None,"Golgari Rot Farm enters the battlefield tapped.\nWhen Golgari Rot Farm enters the battlefield, return a land you control to its owner's hand.\n{T}: Add {B}{G}."
Ghost Quarter,0.0,None,None,None,['Land'],None,Uncommon,TD0,None,None,None,"{T}: Add {C}.\n{T}, Sacrifice Ghost Quarter: Destroy target land. Its controller may search their library for a basic land card, put it onto the battlefield, then shuffle."
Forgotten Cave,0.0,None,['R'],None,['Land'],None,Common,TD0,None,None,None,"Forgotten Cave enters the battlefield tapped.\n{T}: Add {R}.\nCycling {R} ({R}, Discard this card: Draw a card.)"
Elfhame Palace,0.0,None,"['G', 'W']",None,['Land'],None,Uncommon,TD0,None,None,None,Elfhame Palace enters the battlefield tapped.\n{T}: Add {G} or {W}.
Darigaaz's Caldera,0.0,None,"['B', 'G', 'R']",None,['Land'],['Lair'],Uncommon,TD0,None,None,None,"When Darigaaz's Caldera enters the battlefield, sacrifice it unless you return a non-Lair land you control to its owner's hand.\n{T}: Add {B}, {R}, or {G}."
Coastal Tower,0.0,None,"['U', 'W']",None,['Land'],None,Uncommon,TD0,None,None,None,Coastal Tower enters the battlefield tapped.\n{T}: Add {W} or {U}.
Barren Moor,0.0,None,['B'],None,['Land'],None,Common,TD0,None,None,None,"Barren Moor enters the battlefield tapped.\n{T}: Add {B}.\nCycling {B} ({B}, Discard this card: Draw a card.)"
Bant Panorama,0.0,None,None,None,['Land'],None,Common,TD0,None,None,None,"{T}: Add {C}.\n{1}, {T}, Sacrifice Bant Panorama: Search your library for a basic Forest, Plains, or Island card, put it onto the battlefield tapped, then shuffle."
Azorius Chancery,0.0,None,"['U', 'W']",None,['Land'],None,Uncommon,TD0,None,None,None,"Azorius Chancery enters the battlefield tapped.\nWhen Azorius Chancery enters the battlefield, return a land you control to its owner's hand.\n{T}: Add {W}{U}."
Skullclamp,1.0,None,None,None,['Artifact'],['Equipment'],Uncommon,TD0,None,None,None,"Equipped creature gets +1/-1.\nWhenever equipped creature dies, draw two cards.\nEquip {1}"
Oblivion Ring,3.0,['White'],['W'],None,['Enchantment'],None,Common,TD0,None,None,None,"When Oblivion Ring enters the battlefield, exile another target nonland permanent.\nWhen Oblivion Ring leaves the battlefield, return the exiled card to the battlefield under its owner's control."
Simic Signet,2.0,None,"['G', 'U']",None,['Artifact'],None,Common,TD0,None,None,None,"{1}, {T}: Add {G}{U}."
Selesnya Signet,2.0,None,"['G', 'W']",None,['Artifact'],None,Common,TD0,None,None,None,"{1}, {T}: Add {G}{W}."
Relic of Progenitus,1.0,None,None,None,['Artifact'],None,Uncommon,TD0,None,None,None,"{T}: Target player exiles a card from their graveyard.\n{1}, Exile Relic of Progenitus: Exile all graveyards. Draw a card."
Rakdos Signet,2.0,None,"['B', 'R']",None,['Artifact'],None,Common,TD0,None,None,None,"{1}, {T}: Add {B}{R}."
Lightning Greaves,2.0,None,None,None,['Artifact'],['Equipment'],Uncommon,TD0,None,None,None,Equipped creature has haste and shroud. (It can't be the target of spells or abilities.)\nEquip {0}
Illusionary Mask,2.0,None,None,None,['Artifact'],None,Rare,TD0,None,None,None,"{X}: You may choose a creature card in your hand whose mana cost could be paid by some amount of, or all of, the mana you spent on {X}. If you do, you may cast that card face down as a 2/2 creature spell without paying its mana cost. If the creature that spell becomes as it resolves has not been turned face up and would assign or deal damage, be dealt damage, or become tapped, instead it's turned face up and assigns or deals damage, is dealt damage, or becomes tapped. Activate only as a sorcery."
Gruul Signet,2.0,None,"['G', 'R']",None,['Artifact'],None,Common,TD0,None,None,None,"{1}, {T}: Add {R}{G}."
Momentary Blink,2.0,['White'],"['U', 'W']",None,['Instant'],None,Common,TD0,None,None,None,"Exile target creature you control, then return it to the battlefield under its owner's control.\nFlashback {3}{U} (You may cast this card from your graveyard for its flashback cost. Then exile it.)"
Putrefy,3.0,"['Black', 'Green']","['B', 'G']",None,['Instant'],None,Uncommon,TD0,None,None,None,Destroy target artifact or creature. It can't be regenerated.
Xira Arien,3.0,"['Black', 'Green', 'Red']","['B', 'G', 'R']",['Legendary'],['Creature'],"['Insect', 'Wizard']",Rare,TD0,1,2,None,"Flying\n{B}{R}{G}, {T}: Target player draws a card."
Azorius Signet,2.0,None,"['U', 'W']",None,['Artifact'],None,Common,TD0,None,None,None,"{1}, {T}: Add {W}{U}."
Noble Templar,6.0,['White'],['W'],None,['Creature'],"['Human', 'Cleric', 'Soldier']",Common,TD0,3,6,None,"Vigilance\nPlainscycling {2} ({2}, Discard this card: Search your library for a Plains card, reveal it, put it into your hand, then shuffle.)"
Golgari Signet,2.0,None,"['B', 'G']",None,['Artifact'],None,Common,TD0,None,None,None,"{1}, {T}: Add {B}{G}."
Vampiric Dragon,8.0,"['Black', 'Red']","['B', 'R']",None,['Creature'],"['Vampire', 'Dragon']",Rare,TD0,5,5,None,"Flying\nWhenever a creature dealt damage by Vampiric Dragon this turn dies, put a +1/+1 counter on Vampiric Dragon.\n{1}{R}: Vampiric Dragon deals 1 damage to target creature."
Terminate,2.0,"['Black', 'Red']","['B', 'R']",None,['Instant'],None,Common,TD0,None,None,None,Destroy target creature. It can't be regenerated.
Temporal Spring,3.0,"['Green', 'Blue']","['G', 'U']",None,['Sorcery'],None,Common,TD0,None,None,None,Put target permanent on top of its owner's library.
Shambling Shell,3.0,"['Black', 'Green']","['B', 'G']",None,['Creature'],"['Plant', 'Zombie']",Common,TD0,3,1,None,"Sacrifice Shambling Shell: Put a +1/+1 counter on target creature.\nDredge 3 (If you would draw a card, you may mill three cards instead. If you do, return this card from your graveyard to your hand.)"
Mistmeadow Witch,2.0,"['Blue', 'White']","['U', 'W']",None,['Creature'],"['Kithkin', 'Wizard']",Uncommon,TD0,1,1,None,{2}{W}{U}: Exile target creature. Return that card to the battlefield under its owner's control at the beginning of the next end step.
Mirari's Wake,5.0,"['Green', 'White']","['G', 'W']",None,['Enchantment'],None,Rare,TD0,None,None,None,"Creatures you control get +1/+1.\nWhenever you tap a land for mana, add one mana of any type that land produced."
Rubinia Soulsinger,5.0,"['Green', 'Blue', 'White']","['G', 'U', 'W']",['Legendary'],['Creature'],['Faerie'],Rare,TD0,2,3,None,You may choose not to untap Rubinia Soulsinger during your untap step.\n{T}: Gain control of target creature for as long as you control Rubinia and Rubinia remains tapped.
Sterling Grove,2.0,"['Green', 'White']","['G', 'W']",None,['Enchantment'],None,Uncommon,TD0,None,None,None,"Other enchantments you control have shroud. (They can't be the targets of spells or abilities.)\n{1}, Sacrifice Sterling Grove: Search your library for an enchantment card, reveal it, then shuffle and put that card on top."
Questing Phelddagrif,4.0,"['Green', 'Blue', 'White']","['G', 'U', 'W']",None,['Creature'],['Phelddagrif'],Rare,TD0,4,4,None,{G}: Questing Phelddagrif gets +1/+1 until end of turn. Target opponent creates a 1/1 green Hippo creature token.\n{W}: Questing Phelddagrif gains protection from black and from red until end of turn. Target opponent gains 2 life.\n{U}: Questing Phelddagrif gains flying until end of turn. Target opponent may draw a card.
Auramancer,3.0,['White'],['W'],None,['Creature'],"['Human', 'Wizard']",Common,TD0,2,2,None,"When Auramancer enters the battlefield, you may return target enchantment card from your graveyard to your hand."
Hissing Iguanar,3.0,['Red'],['R'],None,['Creature'],['Lizard'],Common,TD0,3,1,None,"Whenever another creature dies, you may have Hissing Iguanar deal 1 damage to target player or planeswalker."
Magma Jet,2.0,['Red'],['R'],None,['Instant'],None,Uncommon,TD0,None,None,None,Magma Jet deals 2 damage to any target. Scry 2.
Enlightened Tutor,1.0,['White'],['W'],None,['Instant'],None,Rare,TD0,None,None,None,"Search your library for an artifact or enchantment card, reveal it, then shuffle and put that card on top."
Lightning Bolt,1.0,['Red'],['R'],None,['Instant'],None,Common,TD0,None,None,None,Lightning Bolt deals 3 damage to any target.
Lava Spike,1.0,['Red'],['R'],None,['Sorcery'],['Arcane'],Common,TD0,None,None,None,Lava Spike deals 3 damage to target player or planeswalker.
Keldon Vandals,3.0,['Red'],['R'],None,['Creature'],"['Human', 'Rogue']",Common,TD0,4,1,None,"Echo {2}{R} (At the beginning of your upkeep, if this came under your control since the beginning of your last upkeep, sacrifice it unless you pay its echo cost.)\nWhen Keldon Vandals enters the battlefield, destroy target artifact."
Benevolent Bodyguard,1.0,['White'],['W'],None,['Creature'],"['Human', 'Cleric']",Common,TD0,1,1,None,Sacrifice Benevolent Bodyguard: Target creature you control gains protection from the color of your choice until end of turn.
Flametongue Kavu,4.0,['Red'],['R'],None,['Creature'],['Kavu'],Uncommon,TD0,4,2,None,"When Flametongue Kavu enters the battlefield, it deals 4 damage to target creature."
Keldon Marauders,2.0,['Red'],['R'],None,['Creature'],"['Human', 'Warrior']",Common,TD0,3,3,None,"Vanishing 2 (This creature enters the battlefield with two time counters on it. At the beginning of your upkeep, remove a time counter from it. When the last is removed, sacrifice it.)\nWhen Keldon Marauders enters or leaves the battlefield, it deals 1 damage to target player or planeswalker."
Chartooth Cougar,6.0,['Red'],['R'],None,['Creature'],"['Cat', 'Beast']",Common,TD0,4,4,None,"{R}: Chartooth Cougar gets +1/+0 until end of turn.\nMountaincycling {2} ({2}, Discard this card: Search your library for a Mountain card, reveal it, put it into your hand, then shuffle.)"
Hellspark Elemental,2.0,['Red'],['R'],None,['Creature'],['Elemental'],Uncommon,TD0,3,1,None,"Trample, haste\nAt the beginning of the end step, sacrifice Hellspark Elemental.\nUnearth {1}{R} ({1}{R}: Return this card from your graveyard to the battlefield. It gains haste. Exile it at the beginning of the next end step or if it would leave the battlefield. Unearth only as a sorcery.)"
Chain Lightning,1.0,['Red'],['R'],None,['Sorcery'],None,Common,TD0,None,None,None,"Chain Lightning deals 3 damage to any target. Then that player or that permanent's controller may pay {R}{R}. If the player does, they may copy this spell and may choose a new target for that copy."
Anarchist,5.0,['Red'],['R'],None,['Creature'],"['Human', 'Wizard']",Common,TD0,2,2,None,"When Anarchist enters the battlefield, you may return target sorcery card from your graveyard to your hand."
Goblin Guide,1.0,['Red'],['R'],None,['Creature'],"['Goblin', 'Scout']",Rare,TD0,2,2,None,"Haste\nWhenever Goblin Guide attacks, defending player reveals the top card of their library. If it's a land card, that player puts it into their hand."
Anger,4.0,['Red'],['R'],None,['Creature'],['Incarnation'],Uncommon,TD0,2,2,None,"Haste\nAs long as Anger is in your graveyard and you control a Mountain, creatures you control have haste."
Flames of the Blood Hand,3.0,['Red'],['R'],None,['Instant'],None,Uncommon,TD0,None,None,None,"Flames of the Blood Hand deals 4 damage to target player or planeswalker. The damage can't be prevented. If that player would gain life this turn, that player gains no life instead."
Ancient Grudge,2.0,['Red'],"['G', 'R']",None,['Instant'],None,Common,TD0,None,None,None,Destroy target artifact.\nFlashback {G} (You may cast this card from your graveyard for its flashback cost. Then exile it.)
Eternal Witness,3.0,['Green'],['G'],None,['Creature'],"['Human', 'Shaman']",Uncommon,TD0,2,1,None,"When Eternal Witness enters the battlefield, you may return target card from your graveyard to your hand."
Stinkweed Imp,3.0,['Black'],['B'],None,['Creature'],['Imp'],Uncommon,TD0,1,2,None,"Flying\nWhenever Stinkweed Imp deals combat damage to a creature, destroy that creature.\nDredge 5 (If you would draw a card, you may mill five cards instead. If you do, return this card from your graveyard to your hand.)"
Shriekmaw,5.0,['Black'],['B'],None,['Creature'],['Elemental'],Uncommon,TD0,3,2,None,"Fear (This creature can't be blocked except by artifact creatures and/or black creatures.)\nWhen Shriekmaw enters the battlefield, destroy target nonartifact, nonblack creature.\nEvoke {1}{B} (You may cast this spell for its evoke cost. If you do, it's sacrificed when it enters the battlefield.)"
Fireblast,6.0,['Red'],['R'],None,['Instant'],None,Common,TD0,None,None,None,You may sacrifice two Mountains rather than pay this spell's mana cost.\nFireblast deals 4 damage to any target.
Twisted Abomination,6.0,['Black'],['B'],None,['Creature'],"['Zombie', 'Mutant']",Common,TD0,5,3,None,"{B}: Regenerate Twisted Abomination.\nSwampcycling {2} ({2}, Discard this card: Search your library for a Swamp card, reveal it, put it into your hand, then shuffle.)"
Terror,2.0,['Black'],['B'],None,['Instant'],None,Common,TD0,None,None,None,"Destroy target nonartifact, nonblack creature. It can't be regenerated."
Weathered Wayfarer,1.0,['White'],['W'],None,['Creature'],"['Human', 'Nomad', 'Cleric']",Rare,TD0,1,1,None,"{W}, {T}: Search your library for a land card, reveal it, put it into your hand, then shuffle. Activate only if an opponent controls more lands than you."
Empyrial Armor,3.0,['White'],['W'],None,['Enchantment'],['Aura'],Uncommon,TD0,None,None,None,Enchant creature\nEnchanted creature gets +1/+1 for each card in your hand.
Reaping the Graves,3.0,['Black'],['B'],None,['Instant'],None,Common,TD0,None,None,None,"Return target creature card from your graveyard to your hand.\nStorm (When you cast this spell, copy it for each spell cast before it this turn. You may choose new targets for the copies.)"
Stoneforge Mystic,2.0,['White'],['W'],None,['Creature'],"['Kor', 'Artificer']",Rare,TD0,1,2,None,"When Stoneforge Mystic enters the battlefield, you may search your library for an Equipment card, reveal it, put it into your hand, then shuffle.\n{1}{W}, {T}: You may put an Equipment card from your hand onto the battlefield."
Silence,1.0,['White'],['W'],None,['Instant'],None,Rare,TD0,None,None,None,Your opponents can't cast spells this turn.
Phyrexian Arena,3.0,['Black'],['B'],None,['Enchantment'],None,Rare,TD0,None,None,None,"At the beginning of your upkeep, you draw a card and you lose 1 life."
Aura of Silence,3.0,['White'],['W'],None,['Enchantment'],None,Uncommon,TD0,None,None,None,Artifact and enchantment spells your opponents cast cost {2} more to cast.\nSacrifice Aura of Silence: Destroy target artifact or enchantment.
Jungle Barrier,4.0,"['Green', 'Blue']","['G', 'U']",None,['Creature'],"['Plant', 'Wall']",Uncommon,TD0,2,6,None,"Defender (This creature can't attack.)\nWhen Jungle Barrier enters the battlefield, draw a card."
Nezumi Graverobber // Nighteyes the Desecrator,2.0,['Black'],['B'],['Legendary'],['Creature'],"['Rat', 'Wizard']",Uncommon,TD0,4,2,None,{4}{B}: Put target creature card from a graveyard onto the battlefield under your control.
Fires of Yavimaya,3.0,"['Green', 'Red']","['G', 'R']",None,['Enchantment'],None,Uncommon,TD0,None,None,None,Creatures you control have haste.\nSacrifice Fires of Yavimaya: Target creature gets +2/+2 until end of turn.
Massacre,4.0,['Black'],['B'],None,['Sorcery'],None,Uncommon,TD0,None,None,None,"If an opponent controls a Plains and you control a Swamp, you may cast this spell without paying its mana cost.\nAll creatures get -2/-2 until end of turn."
Coiling Oracle,2.0,"['Green', 'Blue']","['G', 'U']",None,['Creature'],"['Snake', 'Elf', 'Druid']",Uncommon,TD0,1,1,None,"When Coiling Oracle enters the battlefield, reveal the top card of your library. If it's a land card, put it onto the battlefield. Otherwise, put that card into your hand."
Grim Harvest,2.0,['Black'],['B'],None,['Instant'],None,Common,TD0,None,None,None,"Return target creature card from your graveyard to your hand.\nRecover {2}{B} (When a creature is put into your graveyard from the battlefield, you may pay {2}{B}. If you do, return this card from your graveyard to your hand. Otherwise, exile this card.)"
Cauldron Dance,6.0,"['Black', 'Red']","['B', 'R']",None,['Instant'],None,Uncommon,TD0,None,None,None,Cast this spell only during combat.\nReturn target creature card from your graveyard to the battlefield. That creature gains haste. Return it to your hand at the beginning of the next end step.\nYou may put a creature card from your hand onto the battlefield. That creature gains haste. Its controller sacrifices it at the beginning of the next end step.
Golgari Thug,2.0,['Black'],['B'],None,['Creature'],"['Human', 'Warrior']",Uncommon,TD0,1,1,None,"When Golgari Thug dies, put target creature card from your graveyard on top of your library.\nDredge 4 (If you would draw a card, you may mill four cards instead. If you do, return this card from your graveyard to your hand.)"
Azorius Guildmage,2.0,"['Blue', 'White']","['U', 'W']",None,['Creature'],"['Vedalken', 'Wizard']",Uncommon,TD0,2,2,None,{2}{W}: Tap target creature.\n{2}{U}: Counter target activated ability. (Mana abilities can't be targeted.)
Dread Return,4.0,['Black'],['B'],None,['Sorcery'],None,Uncommon,TD0,None,None,None,Return target creature card from your graveyard to the battlefield.\nFlashback—Sacrifice three creatures. (You may cast this card from your graveyard for its flashback cost. Then exile it.)
Armadillo Cloak,3.0,"['Green', 'White']","['G', 'W']",None,['Enchantment'],['Aura'],Uncommon,TD0,None,None,None,"Enchant creature\nEnchanted creature gets +2/+2 and has trample.\nWhenever enchanted creature deals damage, you gain that much life."
Carrion Feeder,1.0,['Black'],['B'],None,['Creature'],['Zombie'],Common,TD0,1,1,None,Carrion Feeder can't block.\nSacrifice a creature: Put a +1/+1 counter on Carrion Feeder.
Yavimaya Enchantress,3.0,['Green'],['G'],None,['Creature'],"['Human', 'Druid']",Uncommon,TD0,2,2,None,Yavimaya Enchantress gets +1/+1 for each enchantment on the battlefield.
Dismantling Blow,3.0,['White'],"['U', 'W']",None,['Instant'],None,Common,TD0,None,None,None,"Kicker {2}{U} (You may pay an additional {2}{U} as you cast this spell.)\nDestroy target artifact or enchantment. If this spell was kicked, draw two cards."
Yavimaya Elder,3.0,['Green'],['G'],None,['Creature'],"['Human', 'Druid']",Common,TD0,2,1,None,"When Yavimaya Elder dies, you may search your library for up to two basic land cards, reveal them, put them into your hand, then shuffle.\n{2}, Sacrifice Yavimaya Elder: Draw a card."
Buried Alive,3.0,['Black'],['B'],None,['Sorcery'],None,Uncommon,TD0,None,None,None,"Search your library for up to three creature cards, put them into your graveyard, then shuffle."
Wood Elves,3.0,['Green'],['G'],None,['Creature'],"['Elf', 'Scout']",Uncommon,TD0,1,1,None,"When Wood Elves enters the battlefield, search your library for a Forest card, put that card onto the battlefield, then shuffle."
Avatar of Woe,8.0,['Black'],['B'],None,['Creature'],['Avatar'],Rare,TD0,6,5,None,"If there are ten or more creature cards total in all graveyards, this spell costs {6} less to cast.\nFear (This creature can't be blocked except by artifact creatures and/or black creatures.)\n{T}: Destroy target creature. It can't be regenerated."
Wirewood Guardian,7.0,['Green'],['G'],None,['Creature'],"['Elf', 'Mutant']",Common,TD0,6,6,None,"Forestcycling {2} ({2}, Discard this card: Search your library for a Forest card, reveal it, put it into your hand, then shuffle.)"
Ashes to Ashes,3.0,['Black'],['B'],None,['Sorcery'],None,Uncommon,TD0,None,None,None,Exile two target nonartifact creatures. Ashes to Ashes deals 5 damage to you.
Kami of Ancient Law,2.0,['White'],['W'],None,['Creature'],['Spirit'],Common,TD0,2,2,None,Sacrifice Kami of Ancient Law: Destroy target enchantment.
Plains,0.0,None,['W'],['Basic'],['Land'],['Plains'],Common,TD0,None,None,None,({T}: Add {W}.)
Animate Dead,2.0,['Black'],['B'],None,['Enchantment'],['Aura'],Uncommon,TD0,None,None,None,"Enchant creature card in a graveyard\nWhen Animate Dead enters the battlefield, if it's on the battlefield, it loses ""enchant creature card in a graveyard"" and gains ""enchant creature put onto the battlefield with Animate Dead."" Return enchanted creature card to the battlefield under your control and attach Animate Dead to it. When Animate Dead leaves the battlefield, that creature's controller sacrifices it.\nEnchanted creature gets -1/-0."
Wild Mongrel,2.0,['Green'],['G'],None,['Creature'],['Dog'],Common,TD0,2,2,None,Discard a card: Wild Mongrel gets +1/+1 and becomes the color of your choice until end of turn.
All Hallow's Eve,4.0,['Black'],['B'],None,['Sorcery'],None,Rare,TD0,None,None,None,"Exile All Hallow's Eve with two scream counters on it.\nAt the beginning of your upkeep, if All Hallow's Eve is exiled with a scream counter on it, remove a scream counter from it. If there are no more scream counters on it, put it into your graveyard and each player returns all creature cards from their graveyard to the battlefield."
Wickerbough Elder,4.0,['Green'],['G'],None,['Creature'],"['Treefolk', 'Shaman']",Common,TD0,4,4,None,"Wickerbough Elder enters the battlefield with a -1/-1 counter on it.\n{G}, Remove a -1/-1 counter from Wickerbough Elder: Destroy target artifact or enchantment."
Abyssal Gatekeeper,2.0,['Black'],['B'],None,['Creature'],['Horror'],Common,TD0,1,1,None,"When Abyssal Gatekeeper dies, each player sacrifices a creature."
Werebear,2.0,['Green'],['G'],None,['Creature'],"['Human', 'Bear', 'Druid']",Common,TD0,1,1,None,{T}: Add {G}.\nThreshold — Werebear gets +3/+3 as long as seven or more cards are in your graveyard.
Willbender,2.0,['Blue'],['U'],None,['Creature'],"['Human', 'Wizard']",Uncommon,TD0,1,2,None,"Morph {1}{U} (You may cast this card face down as a 2/2 creature for {3}. Turn it face up any time for its morph cost.)\nWhen Willbender is turned face up, change the target of target spell or ability with a single target."
Sakura-Tribe Elder,2.0,['Green'],['G'],None,['Creature'],"['Snake', 'Shaman']",Common,TD0,1,1,None,"Sacrifice Sakura-Tribe Elder: Search your library for a basic land card, put that card onto the battlefield tapped, then shuffle."
Shoreline Ranger,6.0,['Blue'],['U'],None,['Creature'],"['Bird', 'Soldier', 'Ranger']",Common,TD0,3,4,None,"Flying\nIslandcycling {2} ({2}, Discard this card: Search your library for an Island card, reveal it, put it into your hand, then shuffle.)"
Faith's Fetters,4.0,['White'],['W'],None,['Enchantment'],['Aura'],Uncommon,TD0,None,None,None,"Enchant permanent\nWhen Faith's Fetters enters the battlefield, you gain 4 life.\nEnchanted permanent can't attack or block, and its activated abilities can't be activated unless they're mana abilities."
Plains,0.0,None,['W'],['Basic'],['Land'],['Plains'],Common,TD0,None,None,None,({T}: Add {W}.)
Rhystic Study,3.0,['Blue'],['U'],None,['Enchantment'],None,Common,TD0,None,None,None,"Whenever an opponent casts a spell, you may draw a card unless that player pays {1}."
Rootbreaker Wurm,7.0,['Green'],['G'],None,['Creature'],['Wurm'],Common,TD0,6,6,None,Trample (This creature can deal excess combat damage to the player or planeswalker it's attacking.)
Plains,0.0,None,['W'],['Basic'],['Land'],['Plains'],Common,TD0,None,None,None,({T}: Add {W}.)
Raven Familiar,3.0,['Blue'],['U'],None,['Creature'],['Bird'],Uncommon,TD0,1,2,None,"Flying\nEcho {2}{U} (At the beginning of your upkeep, if this came under your control since the beginning of your last upkeep, sacrifice it unless you pay its echo cost.)\nWhen Raven Familiar enters the battlefield, look at the top three cards of your library. Put one of them into your hand and the rest on the bottom of your library in any order."
Plains,0.0,None,['W'],['Basic'],['Land'],['Plains'],Common,TD0,None,None,None,({T}: Add {W}.)
Decree of Justice,4.0,['White'],['W'],None,['Sorcery'],None,Rare,TD0,None,None,None,"Create X 4/4 white Angel creature tokens with flying.\nCycling {2}{W} ({2}{W}, Discard this card: Draw a card.)\nWhen you cycle Decree of Justice, you may pay {X}. If you do, create X 1/1 white Soldier creature tokens."
Mishra's Factory,0.0,None,None,None,['Land'],None,Uncommon,TD0,None,None,None,{T}: Add {C}.\n{1}: Mishra's Factory becomes a 2/2 Assembly-Worker artifact creature until end of turn. It's still a land.\n{T}: Target Assembly-Worker creature gets +1/+1 until end of turn.
