Name,CMC,Colors,Color identity,Supertypes,Types,Subtypes,Rarity,Set,Power,Toughness,Loyalty,Text
Canyon Wildcat,2.0,['Red'],['R'],None,['Creature'],['Cat'],Common,TMP,2,1,None,Mountainwalk (This creature can't be blocked as long as defending player controls a Mountain.)
Chaotic Goo,4.0,['Red'],['R'],None,['Creature'],['Ooze'],Rare,TMP,0,0,None,"Chaotic Goo enters the battlefield with three +1/+1 counters on it.\nAt the beginning of your upkeep, you may flip a coin. If you win the flip, put a +1/+1 counter on Chaotic Goo. If you lose the flip, remove a +1/+1 counter from Chaotic Goo."
Crown of Flames,1.0,['Red'],['R'],None,['Enchantment'],['Aura'],Common,TMP,None,None,None,Enchant creature\n{R}: Enchanted creature gets +1/+0 until end of turn.\n{R}: Return Crown of Flames to its owner's hand.
Deadshot,4.0,['Red'],['R'],None,['Sorcery'],None,Rare,TMP,None,None,None,Tap target creature. It deals damage equal to its power to another target creature.
Enraging Licid,2.0,['Red'],['R'],None,['Creature'],['Licid'],Uncommon,TMP,1,1,None,"{R}, {T}: Enraging Licid loses this ability and becomes an Aura enchantment with enchant creature. Attach it to target creature. You may pay {R} to end this effect.\nEnchanted creature has haste."
Firefly,4.0,['Red'],['R'],None,['Creature'],['Insect'],Uncommon,TMP,1,1,None,Flying\n{R}: Firefly gets +1/+0 until end of turn.
Fireslinger,2.0,['Red'],['R'],None,['Creature'],"['Human', 'Wizard']",Common,TMP,1,1,None,{T}: Fireslinger deals 1 damage to any target and 1 damage to you.
Flowstone Giant,4.0,['Red'],['R'],None,['Creature'],['Giant'],Common,TMP,3,3,None,{R}: Flowstone Giant gets +2/-2 until end of turn.
Flowstone Salamander,5.0,['Red'],['R'],None,['Creature'],['Salamander'],Uncommon,TMP,3,4,None,{R}: Flowstone Salamander deals 1 damage to target creature blocking it.
Flowstone Wyvern,5.0,['Red'],['R'],None,['Creature'],['Drake'],Rare,TMP,3,3,None,Flying\n{R}: Flowstone Wyvern gets +2/-2 until end of turn.
Furnace of Rath,4.0,['Red'],['R'],None,['Enchantment'],None,Rare,TMP,None,None,None,"If a source would deal damage to a permanent or player, it deals double that damage to that permanent or player instead."
Giant Strength,2.0,['Red'],['R'],None,['Enchantment'],['Aura'],Common,TMP,None,None,None,Enchant creature\nEnchanted creature gets +2/+2.
Goblin Bombardment,2.0,['Red'],['R'],None,['Enchantment'],None,Uncommon,TMP,None,None,None,Sacrifice a creature: Goblin Bombardment deals 1 damage to any target.
Hand to Hand,3.0,['Red'],['R'],None,['Enchantment'],None,Rare,TMP,None,None,None,"During combat, players can't cast instant spells or activate abilities that aren't mana abilities."
Havoc,2.0,['Red'],['R'],None,['Enchantment'],None,Uncommon,TMP,None,None,None,"Whenever an opponent casts a white spell, they lose 2 life."
Heart Sliver,2.0,['Red'],['R'],None,['Creature'],['Sliver'],Common,TMP,1,1,None,All Sliver creatures have haste.
Jackal Pup,1.0,['Red'],['R'],None,['Creature'],['Jackal'],Uncommon,TMP,2,1,None,"Whenever Jackal Pup is dealt damage, it deals that much damage to you."
Kindle,2.0,['Red'],['R'],None,['Instant'],None,Common,TMP,None,None,None,"Kindle deals X damage to any target, where X is 2 plus the number of cards named Kindle in all graveyards."
Lightning Blast,4.0,['Red'],['R'],None,['Instant'],None,Common,TMP,None,None,None,Lightning Blast deals 4 damage to any target.
Lightning Elemental,4.0,['Red'],['R'],None,['Creature'],['Elemental'],Common,TMP,4,1,None,Haste (This creature can attack and {T} as soon as it comes under your control.)
Lowland Giant,4.0,['Red'],['R'],None,['Creature'],['Giant'],Common,TMP,4,3,None,None
Magmasaur,5.0,['Red'],['R'],None,['Creature'],"['Elemental', 'Dinosaur']",Rare,TMP,0,0,None,"Magmasaur enters the battlefield with five +1/+1 counters on it.\nAt the beginning of your upkeep, you may remove a +1/+1 counter from Magmasaur. If you don't, sacrifice Magmasaur and it deals damage equal to the number of +1/+1 counters on it to each creature without flying and each player."
Mogg Conscripts,1.0,['Red'],['R'],None,['Creature'],['Goblin'],Common,TMP,2,2,None,Mogg Conscripts can't attack unless you've cast a creature spell this turn.
Mogg Fanatic,1.0,['Red'],['R'],None,['Creature'],['Goblin'],Common,TMP,1,1,None,Sacrifice Mogg Fanatic: It deals 1 damage to any target.
Mogg Raider,1.0,['Red'],['R'],None,['Creature'],['Goblin'],Common,TMP,1,1,None,Sacrifice a Goblin: Target creature gets +1/+1 until end of turn.
Mogg Squad,2.0,['Red'],['R'],None,['Creature'],['Goblin'],Uncommon,TMP,3,3,None,Mogg Squad gets -1/-1 for each other creature on the battlefield.
No Quarter,4.0,['Red'],['R'],None,['Enchantment'],None,Rare,TMP,None,None,None,"Whenever a creature becomes blocked by a creature with lesser power, destroy the blocking creature.\nWhenever a creature blocks a creature with lesser power, destroy the attacking creature."
Opportunist,3.0,['Red'],['R'],None,['Creature'],"['Human', 'Soldier']",Uncommon,TMP,2,2,None,{T}: Opportunist deals 1 damage to target creature that was dealt damage this turn.
Pallimud,3.0,['Red'],['R'],None,['Creature'],['Beast'],Rare,TMP,*,3,None,"As Pallimud enters the battlefield, choose an opponent.\nPallimud's power is equal to the number of tapped lands the chosen player controls."
Rathi Dragon,4.0,['Red'],['R'],None,['Creature'],['Dragon'],Rare,TMP,5,5,None,"Flying (This creature can't be blocked except by creatures with flying or reach.)\nWhen Rathi Dragon enters the battlefield, sacrifice it unless you sacrifice two Mountains."
Renegade Warlord,5.0,['Red'],['R'],None,['Creature'],"['Human', 'Soldier']",Uncommon,TMP,3,3,None,"First strike\nWhenever Renegade Warlord attacks, each other attacking creature gets +1/+0 until end of turn."
Rolling Thunder,2.0,['Red'],['R'],None,['Sorcery'],None,Common,TMP,None,None,None,Rolling Thunder deals X damage divided as you choose among any number of targets.
Sandstone Warrior,4.0,['Red'],['R'],None,['Creature'],"['Human', 'Soldier', 'Warrior']",Common,TMP,1,3,None,First strike (This creature deals combat damage before creatures without first strike.)\n{R}: Sandstone Warrior gets +1/+0 until end of turn.
Scorched Earth,1.0,['Red'],['R'],None,['Sorcery'],None,Rare,TMP,None,None,None,"As an additional cost to cast this spell, discard X land cards.\nDestroy X target lands."
Shocker,2.0,['Red'],['R'],None,['Creature'],['Insect'],Rare,TMP,1,1,None,"Whenever Shocker deals damage to a player, that player discards all the cards in their hand, then draws that many cards."
Starke of Rath,3.0,['Red'],['R'],['Legendary'],['Creature'],"['Human', 'Rogue']",Rare,TMP,2,2,None,{T}: Destroy target artifact or creature. That permanent's controller gains control of Starke of Rath. (This effect lasts indefinitely.)
Stone Rain,3.0,['Red'],['R'],None,['Sorcery'],None,Common,TMP,None,None,None,Destroy target land.
Searing Touch,1.0,['Red'],['R'],None,['Instant'],None,Uncommon,TMP,None,None,None,"Buyback {4} (You may pay an additional {4} as you cast this spell. If you do, put this card into your hand as it resolves.)\nSearing Touch deals 1 damage to any target."
Shatter,2.0,['Red'],['R'],None,['Instant'],None,Common,TMP,None,None,None,Destroy target artifact.
Sudden Impact,4.0,['Red'],['R'],None,['Instant'],None,Uncommon,TMP,None,None,None,Sudden Impact deals damage to target player equal to the number of cards in that player's hand.
Tahngarth's Rage,1.0,['Red'],['R'],None,['Enchantment'],['Aura'],Uncommon,TMP,None,None,None,"Enchant creature\nEnchanted creature gets +3/+0 as long as it's attacking. Otherwise, it gets -2/-1."
Stun,2.0,['Red'],['R'],None,['Instant'],None,Common,TMP,None,None,None,Target creature can't block this turn.\nDraw a card.
Tooth and Claw,4.0,['Red'],['R'],None,['Enchantment'],None,Rare,TMP,None,None,None,Sacrifice two creatures: Create a 3/1 red Beast creature token named Carnivore.
Wall of Diffusion,2.0,['Red'],['R'],None,['Creature'],['Wall'],Common,TMP,0,5,None,Defender (This creature can't attack.)\nWall of Diffusion can block creatures with shadow as though Wall of Diffusion had shadow.
Wild Wurm,4.0,['Red'],['R'],None,['Creature'],['Wurm'],Uncommon,TMP,5,4,None,"When Wild Wurm enters the battlefield, flip a coin. If you lose the flip, return Wild Wurm to its owner's hand."
Apes of Rath,4.0,['Green'],['G'],None,['Creature'],['Ape'],Uncommon,TMP,5,4,None,"Whenever Apes of Rath attacks, it doesn't untap during its controller's next untap step."
Broken Fall,3.0,['Green'],['G'],None,['Enchantment'],None,Common,TMP,None,None,None,Return Broken Fall to its owner's hand: Regenerate target creature.
Bayou Dragonfly,2.0,['Green'],['G'],None,['Creature'],['Insect'],Common,TMP,1,1,None,Flying; swampwalk (This creature can't be blocked as long as defending player controls a Swamp.)
Aluren,4.0,['Green'],['G'],None,['Enchantment'],None,Rare,TMP,None,None,None,Any player may cast creature spells with mana value 3 or less without paying their mana costs and as though they had flash.
Shadowstorm,1.0,['Red'],['R'],None,['Sorcery'],None,Uncommon,TMP,None,None,None,Shadowstorm deals 2 damage to each creature with shadow.
Canopy Spider,2.0,['Green'],['G'],None,['Creature'],['Spider'],Common,TMP,1,3,None,Reach (This creature can block creatures with flying.)
Charging Rhino,5.0,['Green'],['G'],None,['Creature'],['Rhino'],Uncommon,TMP,4,4,None,Charging Rhino can't be blocked by more than one creature.
Choke,3.0,['Green'],['G'],None,['Enchantment'],None,Uncommon,TMP,None,None,None,Islands don't untap during their controllers' untap steps.
Crazed Armodon,4.0,['Green'],['G'],None,['Creature'],['Elephant'],Rare,TMP,3,3,None,{G}: Crazed Armodon gets +3/+0 and gains trample until end of turn. Destroy Crazed Armodon at the beginning of the next end step. Activate only once each turn.
Dirtcowl Wurm,5.0,['Green'],['G'],None,['Creature'],['Wurm'],Rare,TMP,3,4,None,"Whenever an opponent plays a land, put a +1/+1 counter on Dirtcowl Wurm."
Earthcraft,2.0,['Green'],['G'],None,['Enchantment'],None,Rare,TMP,None,None,None,Tap an untapped creature you control: Untap target basic land.
Eladamri's Vineyard,1.0,['Green'],['G'],None,['Enchantment'],None,Rare,TMP,None,None,None,"At the beginning of each player's precombat main phase, that player adds {G}{G}."
"Eladamri, Lord of Leaves",2.0,['Green'],['G'],['Legendary'],['Creature'],"['Elf', 'Warrior']",Rare,TMP,2,2,None,Other Elf creatures have forestwalk. (They can't be blocked as long as defending player controls a Forest.)\nOther Elves have shroud. (They can't be the targets of spells or abilities.)
Elven Warhounds,4.0,['Green'],['G'],None,['Creature'],['Dog'],Rare,TMP,2,2,None,"Whenever Elven Warhounds becomes blocked by a creature, put that creature on top of its owner's library."
Elvish Fury,1.0,['Green'],['G'],None,['Instant'],None,Common,TMP,None,None,None,"Buyback {4} (You may pay an additional {4} as you cast this spell. If you do, put this card into your hand as it resolves.)\nTarget creature gets +2/+2 until end of turn."
Flailing Drake,4.0,['Green'],['G'],None,['Creature'],['Drake'],Uncommon,TMP,2,3,None,"Flying\nWhenever Flailing Drake blocks or becomes blocked by a creature, that creature gets +1/+1 until end of turn."
Frog Tongue,1.0,['Green'],['G'],None,['Enchantment'],['Aura'],Common,TMP,None,None,None,"Enchant creature\nWhen Frog Tongue enters the battlefield, draw a card.\nEnchanted creature has reach. (It can block creatures with flying.)"
Fugitive Druid,4.0,['Green'],['G'],None,['Creature'],"['Human', 'Druid']",Rare,TMP,3,2,None,"Whenever Fugitive Druid becomes the target of an Aura spell, you draw a card."
Harrow,3.0,['Green'],['G'],None,['Instant'],None,Uncommon,TMP,None,None,None,"As an additional cost to cast this spell, sacrifice a land.\nSearch your library for up to two basic land cards, put them onto the battlefield, then shuffle."
Heartwood Dryad,2.0,['Green'],['G'],None,['Creature'],['Dryad'],Common,TMP,2,1,None,Heartwood Dryad can block creatures with shadow as though Heartwood Dryad had shadow.
Heartwood Giant,5.0,['Green'],['G'],None,['Creature'],['Giant'],Rare,TMP,4,4,None,"{T}, Sacrifice a Forest: Heartwood Giant deals 2 damage to target player or planeswalker."
Heartwood Treefolk,4.0,['Green'],['G'],None,['Creature'],['Treefolk'],Uncommon,TMP,3,4,None,Forestwalk (This creature can't be blocked as long as defending player controls a Forest.)
Horned Sliver,3.0,['Green'],['G'],None,['Creature'],['Sliver'],Uncommon,TMP,2,2,None,All Sliver creatures have trample.
Krakilin,2.0,['Green'],['G'],None,['Creature'],['Beast'],Uncommon,TMP,0,0,None,Krakilin enters the battlefield with X +1/+1 counters on it.\n{1}{G}: Regenerate Krakilin.
Mirri's Guile,1.0,['Green'],['G'],None,['Enchantment'],None,Rare,TMP,None,None,None,"At the beginning of your upkeep, you may look at the top three cards of your library, then put them back in any order."
Mongrel Pack,4.0,['Green'],['G'],None,['Creature'],['Dog'],Rare,TMP,4,1,None,"When Mongrel Pack dies during combat, create four 1/1 green Dog creature tokens."
Muscle Sliver,2.0,['Green'],['G'],None,['Creature'],['Sliver'],Common,TMP,1,1,None,All Sliver creatures get +1/+1.
Natural Spring,5.0,['Green'],['G'],None,['Sorcery'],None,Common,TMP,None,None,None,Target player gains 8 life.
Nature's Revolt,5.0,['Green'],['G'],None,['Enchantment'],None,Rare,TMP,None,None,None,All lands are 2/2 creatures that are still lands.
Needle Storm,3.0,['Green'],['G'],None,['Sorcery'],None,Uncommon,TMP,None,None,None,Needle Storm deals 4 damage to each creature with flying.
Nurturing Licid,2.0,['Green'],['G'],None,['Creature'],['Licid'],Uncommon,TMP,1,1,None,"{G}, {T}: Nurturing Licid loses this ability and becomes an Aura enchantment with enchant creature. Attach it to target creature. You may pay {G} to end this effect.\n{G}: Regenerate enchanted creature."
Overrun,5.0,['Green'],['G'],None,['Sorcery'],None,Uncommon,TMP,None,None,None,Creatures you control get +3/+3 and gain trample until end of turn.
Pincher Beetles,3.0,['Green'],['G'],None,['Creature'],['Insect'],Common,TMP,3,1,None,Shroud (This creature can't be the target of spells or abilities.)
Rampant Growth,2.0,['Green'],['G'],None,['Sorcery'],None,Common,TMP,None,None,None,"Search your library for a basic land card, put that card onto the battlefield tapped, then shuffle."
Reality Anchor,2.0,['Green'],['G'],None,['Instant'],None,Common,TMP,None,None,None,Target creature loses shadow until end of turn.\nDraw a card.
Reap,2.0,['Green'],['G'],None,['Instant'],None,Uncommon,TMP,None,None,None,"Return up to X target cards from your graveyard to your hand, where X is the number of black permanents target opponent controls as you cast this spell."
Recycle,6.0,['Green'],['G'],None,['Enchantment'],None,Rare,TMP,None,None,None,"Skip your draw step.\nWhenever you play a card, draw a card.\nYour maximum hand size is two."
Respite,2.0,['Green'],['G'],None,['Instant'],None,Common,TMP,None,None,None,Prevent all combat damage that would be dealt this turn. You gain 1 life for each attacking creature.
Root Maze,1.0,['Green'],['G'],None,['Enchantment'],None,Rare,TMP,None,None,None,Artifacts and lands enter the battlefield tapped.
Armor Sliver,3.0,['White'],['W'],None,['Creature'],['Sliver'],Uncommon,TMP,2,2,None,"All Sliver creatures have ""{2}: This creature gets +0/+1 until end of turn."""
Armored Pegasus,2.0,['White'],['W'],None,['Creature'],['Pegasus'],Common,TMP,1,2,None,Flying
Advance Scout,2.0,['White'],['W'],None,['Creature'],"['Human', 'Soldier', 'Scout']",Common,TMP,1,1,None,First strike\n{W}: Target creature gains first strike until end of turn.
Anoint,1.0,['White'],['W'],None,['Instant'],None,Common,TMP,None,None,None,"Buyback {3} (You may pay an additional {3} as you cast this spell. If you do, put this card into your hand as it resolves.)\nPrevent the next 3 damage that would be dealt to target creature this turn."
Angelic Protector,4.0,['White'],['W'],None,['Creature'],['Angel'],Uncommon,TMP,2,2,None,"Flying\nWhenever Angelic Protector becomes the target of a spell or ability, Angelic Protector gets +0/+3 until end of turn."
Repentance,3.0,['White'],['W'],None,['Sorcery'],None,Uncommon,TMP,None,None,None,Target creature deals damage to itself equal to its power.
Quickening Licid,2.0,['White'],['W'],None,['Creature'],['Licid'],Uncommon,TMP,1,1,None,"{1}{W}, {T}: Quickening Licid loses this ability and becomes an Aura enchantment with enchant creature. Attach it to target creature. You may pay {W} to end this effect.\nEnchanted creature has first strike."
Pegasus Refuge,4.0,['White'],['W'],None,['Enchantment'],None,Rare,TMP,None,None,None,"{2}, Discard a card: Create a 1/1 white Pegasus creature token with flying."
Pacifism,2.0,['White'],['W'],None,['Enchantment'],['Aura'],Common,TMP,None,None,None,Enchant creature\nEnchanted creature can't attack or block.
"Orim, Samite Healer",3.0,['White'],['W'],['Legendary'],['Creature'],"['Human', 'Cleric']",Rare,TMP,1,3,None,{T}: Prevent the next 3 damage that would be dealt to any target this turn.
Orim's Prayer,3.0,['White'],['W'],None,['Enchantment'],None,Uncommon,TMP,None,None,None,"Whenever one or more creatures attack you, you gain 1 life for each attacking creature."
Oracle en-Vec,2.0,['White'],['W'],None,['Creature'],"['Human', 'Wizard']",Rare,TMP,1,1,None,"{T}: Target opponent chooses any number of creatures they control. During that player's next turn, the chosen creatures attack if able, and other creatures can't attack. At the beginning of that turn's end step, destroy each of the chosen creatures that didn't attack this turn. Activate only during your turn."
Mounted Archers,4.0,['White'],['W'],None,['Creature'],"['Human', 'Soldier', 'Archer']",Common,TMP,2,3,None,Reach (This creature can block creatures with flying.)\n{W}: Mounted Archers can block an additional creature this turn.
Master Decoy,2.0,['White'],['W'],None,['Creature'],"['Human', 'Soldier']",Common,TMP,1,2,None,"{W}, {T}: Tap target creature."
Marble Titan,4.0,['White'],['W'],None,['Creature'],['Giant'],Rare,TMP,3,3,None,Creatures with power 3 or greater don't untap during their controllers' untap steps.
Light of Day,4.0,['White'],['W'],None,['Enchantment'],None,Uncommon,TMP,None,None,None,Black creatures can't attack or block.
Soltari Monk,2.0,['White'],['W'],None,['Creature'],"['Soltari', 'Monk', 'Cleric']",Uncommon,TMP,2,1,None,Protection from black\nShadow (This creature can block or be blocked by only creatures with shadow.)
Knight of Dawn,3.0,['White'],['W'],None,['Creature'],"['Human', 'Knight']",Uncommon,TMP,2,2,None,First strike\n{W}{W}: Knight of Dawn gains protection from the color of your choice until end of turn.
Invulnerability,2.0,['White'],['W'],None,['Instant'],None,Uncommon,TMP,None,None,None,"Buyback {3} (You may pay an additional {3} as you cast this spell. If you do, put this card into your hand as it resolves.)\nThe next time a source of your choice would deal damage to you this turn, prevent that damage."
Humility,4.0,['White'],['W'],None,['Enchantment'],None,Rare,TMP,None,None,None,All creatures lose all abilities and have base power and toughness 1/1.
Hero's Resolve,2.0,['White'],['W'],None,['Enchantment'],['Aura'],Common,TMP,None,None,None,Enchant creature\nEnchanted creature gets +1/+5.
Hanna's Custody,3.0,['White'],['W'],None,['Enchantment'],None,Rare,TMP,None,None,None,All artifacts have shroud. (They can't be the targets of spells or abilities.)
Avenging Angel,5.0,['White'],['W'],None,['Creature'],['Angel'],Rare,TMP,3,3,None,"Flying\nWhen Avenging Angel dies, you may put it on top of its owner's library."
Field of Souls,4.0,['White'],['W'],None,['Enchantment'],None,Rare,TMP,None,None,None,"Whenever a nontoken creature is put into your graveyard from the battlefield, create a 1/1 white Spirit creature token with flying."
Gallantry,2.0,['White'],['W'],None,['Instant'],None,Uncommon,TMP,None,None,None,Target blocking creature gets +4/+4 until end of turn.\nDraw a card.
Soltari Priest,2.0,['White'],['W'],None,['Creature'],"['Soltari', 'Cleric']",Uncommon,TMP,2,1,None,Protection from red\nShadow (This creature can block or be blocked by only creatures with shadow.)
Sacred Guide,1.0,['White'],['W'],None,['Creature'],"['Human', 'Cleric']",Rare,TMP,1,1,None,"{1}{W}, Sacrifice Sacred Guide: Reveal cards from the top of your library until you reveal a white card. Put that card into your hand and exile all other cards revealed this way."
Spirit Mirror,4.0,['White'],['W'],None,['Enchantment'],None,Rare,TMP,None,None,None,"At the beginning of your upkeep, if there are no Reflection tokens on the battlefield, create a 2/2 white Reflection creature token.\n{0}: Destroy target Reflection."
Warmth,2.0,['White'],['W'],None,['Enchantment'],None,Uncommon,TMP,None,None,None,"Whenever an opponent casts a red spell, you gain 2 life."
Gerrard's Battle Cry,1.0,['White'],['W'],None,['Enchantment'],None,Rare,TMP,None,None,None,{2}{W}: Creatures you control get +1/+1 until end of turn.
Flickering Ward,1.0,['White'],['W'],None,['Enchantment'],['Aura'],Uncommon,TMP,None,None,None,"Enchant creature\nAs Flickering Ward enters the battlefield, choose a color.\nEnchanted creature has protection from the chosen color. This effect doesn't remove Flickering Ward.\n{W}: Return Flickering Ward to its owner's hand."
Elite Javelineer,3.0,['White'],['W'],None,['Creature'],"['Human', 'Soldier']",Common,TMP,2,2,None,"Whenever Elite Javelineer blocks, it deals 1 damage to target attacking creature."
Auratog,2.0,['White'],['W'],None,['Creature'],['Atog'],Rare,TMP,1,2,None,Sacrifice an enchantment: Auratog gets +2/+2 until end of turn.
Circle of Protection: White,2.0,['White'],['W'],None,['Enchantment'],None,Common,TMP,None,None,None,"{1}: The next time a white source of your choice would deal damage to you this turn, prevent that damage."
Clergy en-Vec,2.0,['White'],['W'],None,['Creature'],"['Human', 'Cleric']",Common,TMP,1,1,None,{T}: Prevent the next 1 damage that would be dealt to any target this turn.
Talon Sliver,2.0,['White'],['W'],None,['Creature'],['Sliver'],Common,TMP,1,1,None,All Sliver creatures have first strike.
Staunch Defenders,5.0,['White'],['W'],None,['Creature'],"['Human', 'Soldier']",Uncommon,TMP,3,4,None,"When Staunch Defenders enters the battlefield, you gain 4 life."
Soltari Trooper,2.0,['White'],['W'],None,['Creature'],"['Soltari', 'Soldier']",Common,TMP,1,1,None,"Shadow (This creature can block or be blocked by only creatures with shadow.)\nWhenever Soltari Trooper attacks, it gets +1/+1 until end of turn."
Soltari Crusader,3.0,['White'],['W'],None,['Creature'],"['Soltari', 'Knight']",Uncommon,TMP,2,1,None,Shadow (This creature can block or be blocked by only creatures with shadow.)\n{1}{W}: Soltari Crusader gets +1/+0 until end of turn.
Worthy Cause,1.0,['White'],['W'],None,['Instant'],None,Uncommon,TMP,None,None,None,"Buyback {2} (You may pay an additional {2} as you cast this spell. If you do, put this card into your hand as it resolves.)\nAs an additional cost to cast this spell, sacrifice a creature.\nYou gain life equal to the sacrificed creature's toughness."
Winds of Rath,5.0,['White'],['W'],None,['Sorcery'],None,Rare,TMP,None,None,None,Destroy all creatures that aren't enchanted. They can't be regenerated.
Soltari Lancer,3.0,['White'],['W'],None,['Creature'],"['Soltari', 'Knight']",Common,TMP,2,2,None,Shadow (This creature can block or be blocked by only creatures with shadow.)\nSoltari Lancer has first strike as long as it's attacking.
Soltari Emissary,2.0,['White'],['W'],None,['Creature'],"['Soltari', 'Soldier']",Rare,TMP,2,1,None,{W}: Soltari Emissary gains shadow until end of turn. (It can block or be blocked by only creatures with shadow.)
Cloudchaser Eagle,4.0,['White'],['W'],None,['Creature'],['Bird'],Common,TMP,2,2,None,"Flying\nWhen Cloudchaser Eagle enters the battlefield, destroy target enchantment."
Benthic Behemoth,8.0,['Blue'],['U'],None,['Creature'],['Serpent'],Rare,TMP,7,6,None,Islandwalk (This creature can't be blocked as long as defending player controls an Island.)
Soltari Foot Soldier,1.0,['White'],['W'],None,['Creature'],"['Soltari', 'Soldier']",Common,TMP,1,1,None,Shadow (This creature can block or be blocked by only creatures with shadow.)
Disenchant,2.0,['White'],['W'],None,['Instant'],None,Common,TMP,None,None,None,Destroy target artifact or enchantment.
Serene Offering,2.0,['White'],['W'],None,['Instant'],None,Uncommon,TMP,None,None,None,Destroy target enchantment. You gain life equal to its mana value.
Circle of Protection: Green,2.0,['White'],['W'],None,['Enchantment'],None,Common,TMP,None,None,None,"{1}: The next time a green source of your choice would deal damage to you this turn, prevent that damage."
Safeguard,5.0,['White'],['W'],None,['Enchantment'],None,Rare,TMP,None,None,None,{2}{W}: Prevent all combat damage that would be dealt by target creature this turn.
Circle of Protection: Blue,2.0,['White'],['W'],None,['Enchantment'],None,Common,TMP,None,None,None,"{1}: The next time a blue source of your choice would deal damage to you this turn, prevent that damage."
Circle of Protection: Shadow,2.0,['White'],['W'],None,['Enchantment'],None,Common,TMP,None,None,None,"{1}: The next time a creature of your choice with shadow would deal damage to you this turn, prevent that damage."
Circle of Protection: Red,2.0,['White'],['W'],None,['Enchantment'],None,Common,TMP,None,None,None,"{1}: The next time a red source of your choice would deal damage to you this turn, prevent that damage."
Circle of Protection: Black,2.0,['White'],['W'],None,['Enchantment'],None,Common,TMP,None,None,None,"{1}: The next time a black source of your choice would deal damage to you this turn, prevent that damage."
Dauthi Mercenary,3.0,['Black'],['B'],None,['Creature'],"['Dauthi', 'Knight', 'Mercenary']",Uncommon,TMP,2,1,None,Shadow (This creature can block or be blocked by only creatures with shadow.)\n{1}{B}: Dauthi Mercenary gets +1/+0 until end of turn.
