Name,CMC,Colors,Color identity,Supertypes,Types,Subtypes,Rarity,Set,Power,Toughness,Loyalty,Text
Dauthi Slayer,2.0,['Black'],['B'],None,['Creature'],"['Dauthi', 'Soldier']",Common,TMP,2,2,None,Shadow (This creature can block or be blocked by only creatures with shadow.)\nDauthi Slayer attacks each combat if able.
Death Pits of Rath,5.0,['Black'],['B'],None,['Enchantment'],None,Rare,TMP,None,None,None,"Whenever a creature is dealt damage, destroy it. It can't be regenerated."
Dauthi Mindripper,4.0,['Black'],['B'],None,['Creature'],"['Dauthi', 'Minion']",Uncommon,TMP,2,1,None,"Shadow (This creature can block or be blocked by only creatures with shadow.)\nWhenever Dauthi Mindripper attacks and isn't blocked, you may sacrifice it. If you do, defending player discards three cards."
Dauthi Marauder,3.0,['Black'],['B'],None,['Creature'],"['Dauthi', 'Minion']",Common,TMP,3,1,None,Shadow (This creature can block or be blocked by only creatures with shadow.)
Dauthi Horror,2.0,['Black'],['B'],None,['Creature'],"['Dauthi', 'Horror']",Common,TMP,2,1,None,Shadow (This creature can block or be blocked by only creatures with shadow.)\nDauthi Horror can't be blocked by white creatures.
Dauthi Ghoul,2.0,['Black'],['B'],None,['Creature'],"['Dauthi', 'Zombie']",Uncommon,TMP,1,1,None,"Shadow (This creature can block or be blocked by only creatures with shadow.)\nWhenever a creature with shadow dies, put a +1/+1 counter on Dauthi Ghoul."
Dark Ritual,1.0,['Black'],['B'],None,['Instant'],None,Common,TMP,None,None,None,Add {B}{B}{B}.
Dauthi Embrace,3.0,['Black'],['B'],None,['Enchantment'],None,Uncommon,TMP,None,None,None,{B}{B}: Target creature gains shadow until end of turn. (It can block or be blocked by only creatures with shadow.)
Darkling Stalker,4.0,['Black'],['B'],None,['Creature'],"['Shade', 'Spirit']",Common,TMP,1,1,None,{B}: Regenerate Darkling Stalker.\n{B}: Darkling Stalker gets +1/+1 until end of turn.
Coercion,3.0,['Black'],['B'],None,['Sorcery'],None,Common,TMP,None,None,None,Target opponent reveals their hand. You choose a card from it. That player discards that card.
Commander Greven il-Vec,6.0,['Black'],['B'],['Legendary'],['Creature'],"['Phyrexian', 'Human', 'Warrior']",Rare,TMP,7,5,None,"Fear (This creature can't be blocked except by artifact creatures and/or black creatures.)\nWhen Commander Greven il-Vec enters the battlefield, sacrifice a creature."
Dark Banishing,3.0,['Black'],['B'],None,['Instant'],None,Common,TMP,None,None,None,Destroy target nonblack creature. It can't be regenerated.
Whim of Volrath,1.0,['Blue'],['U'],None,['Instant'],None,Rare,TMP,None,None,None,"Buyback {2} (You may pay an additional {2} as you cast this spell. If you do, put this card into your hand as it resolves.)\nChange the text of target permanent by replacing all instances of one color word with another or one basic land type with another until end of turn. (For example, you may change ""nonred creature"" to ""nongreen creature"" or ""plainswalk"" to ""swampwalk."")"
Corpse Dance,3.0,['Black'],['B'],None,['Instant'],None,Rare,TMP,None,None,None,"Buyback {2} (You may pay an additional {2} as you cast this spell. If you do, put this card into your hand as it resolves.)\nReturn the top creature card of your graveyard to the battlefield. That creature gains haste until end of turn. Exile it at the beginning of the next end step."
Capsize,3.0,['Blue'],['U'],None,['Instant'],None,Common,TMP,None,None,None,"Buyback {3} (You may pay an additional {3} as you cast this spell. If you do, put this card into your hand as it resolves.)\nReturn target permanent to its owner's hand."
Coffin Queen,3.0,['Black'],['B'],None,['Creature'],"['Zombie', 'Wizard']",Rare,TMP,1,1,None,"You may choose not to untap Coffin Queen during your untap step.\n{2}{B}, {T}: Put target creature card from a graveyard onto the battlefield under your control. When Coffin Queen becomes untapped or you lose control of Coffin Queen, exile that creature."
Clot Sliver,2.0,['Black'],['B'],None,['Creature'],['Sliver'],Common,TMP,1,1,None,"All Slivers have ""{2}: Regenerate this permanent."""
Carrionette,2.0,['Black'],['B'],None,['Creature'],['Skeleton'],Rare,TMP,1,1,None,{2}{B}{B}: Exile Carrionette and target creature unless that creature's controller pays {2}. Activate only if Carrionette is in your graveyard.
Bounty Hunter,4.0,['Black'],['B'],None,['Creature'],"['Human', 'Archer', 'Minion']",Rare,TMP,2,2,None,{T}: Put a bounty counter on target nonblack creature.\n{T}: Destroy target creature with a bounty counter on it.
Abandon Hope,2.0,['Black'],['B'],None,['Sorcery'],None,Uncommon,TMP,None,None,None,"As an additional cost to cast this spell, discard X cards.\nLook at target opponent's hand and choose X cards from it. That player discards those cards."
Blood Pet,1.0,['Black'],['B'],None,['Creature'],['Thrull'],Common,TMP,1,1,None,Sacrifice Blood Pet: Add {B}.
Bellowing Fiend,5.0,['Black'],['B'],None,['Creature'],['Spirit'],Rare,TMP,3,3,None,"Flying\nWhenever Bellowing Fiend deals damage to a creature, Bellowing Fiend deals 3 damage to that creature's controller and 3 damage to you."
Whispers of the Muse,1.0,['Blue'],['U'],None,['Instant'],None,Uncommon,TMP,None,None,None,"Buyback {5} (You may pay an additional {5} as you cast this spell. If you do, put this card into your hand as it resolves.)\nDraw a card."
Volrath's Curse,2.0,['Blue'],['U'],None,['Enchantment'],['Aura'],Common,TMP,None,None,None,"Enchant creature\nEnchanted creature can't attack or block, and its activated abilities can't be activated. That creature's controller may sacrifice a permanent for that player to ignore this effect until end of turn.\n{1}{U}: Return Volrath's Curse to its owner's hand."
Winged Sliver,2.0,['Blue'],['U'],None,['Creature'],['Sliver'],Common,TMP,1,1,None,All Sliver creatures have flying.
Wind Drake,3.0,['Blue'],['U'],None,['Creature'],['Drake'],Common,TMP,2,2,None,Flying
Wind Dancer,2.0,['Blue'],['U'],None,['Creature'],['Faerie'],Uncommon,TMP,1,1,None,Flying\n{T}: Target creature gains flying until end of turn.
Unstable Shapeshifter,4.0,['Blue'],['U'],None,['Creature'],['Shapeshifter'],Rare,TMP,0,1,None,"Whenever another creature enters the battlefield, Unstable Shapeshifter becomes a copy of that creature, except it has this ability."
Twitch,3.0,['Blue'],['U'],None,['Instant'],None,Common,TMP,None,None,None,"You may tap or untap target artifact, creature, or land.\nDraw a card."
Tradewind Rider,4.0,['Blue'],['U'],None,['Creature'],['Spirit'],Rare,TMP,1,4,None,"Flying\n{T}, Tap two untapped creatures you control: Return target permanent to its owner's hand."
Time Warp,5.0,['Blue'],['U'],None,['Sorcery'],None,Rare,TMP,None,None,None,Target player takes an extra turn after this one.
Time Ebb,3.0,['Blue'],['U'],None,['Sorcery'],None,Common,TMP,None,None,None,Put target creature on top of its owner's library.
Thalakos Sentry,2.0,['Blue'],['U'],None,['Creature'],"['Thalakos', 'Soldier']",Common,TMP,1,2,None,Shadow (This creature can block or be blocked by only creatures with shadow.)
Thalakos Seer,2.0,['Blue'],['U'],None,['Creature'],"['Thalakos', 'Wizard']",Common,TMP,1,1,None,"Shadow (This creature can block or be blocked by only creatures with shadow.)\nWhen Thalakos Seer leaves the battlefield, draw a card."
Thalakos Mistfolk,3.0,['Blue'],['U'],None,['Creature'],"['Thalakos', 'Illusion']",Common,TMP,2,1,None,Shadow (This creature can block or be blocked by only creatures with shadow.)\n{U}: Put Thalakos Mistfolk on top of its owner's library.
Thalakos Dreamsower,3.0,['Blue'],['U'],None,['Creature'],"['Thalakos', 'Wizard']",Uncommon,TMP,1,1,None,"Shadow (This creature can block or be blocked by only creatures with shadow.)\nYou may choose not to untap Thalakos Dreamsower during your untap step.\nWhenever Thalakos Dreamsower deals damage to an opponent, tap target creature. That creature doesn't untap during its controller's untap step for as long as Thalakos Dreamsower remains tapped."
Stinging Licid,2.0,['Blue'],['U'],None,['Creature'],['Licid'],Uncommon,TMP,1,1,None,"{1}{U}, {T}: Stinging Licid loses this ability and becomes an Aura enchantment with enchant creature. Attach it to target creature. You may pay {U} to end this effect.\nWhenever enchanted creature becomes tapped, Stinging Licid deals 2 damage to that creature's controller."
Steal Enchantment,2.0,['Blue'],['U'],None,['Enchantment'],['Aura'],Uncommon,TMP,None,None,None,Enchant enchantment\nYou control enchanted enchantment.
Spell Blast,1.0,['Blue'],['U'],None,['Instant'],None,Common,TMP,None,None,None,"Counter target spell with mana value X. (For example, if that spell's mana cost is {3}{U}{U}, X is 5.)"
Skyshroud Condor,2.0,['Blue'],['U'],None,['Creature'],['Bird'],Uncommon,TMP,2,2,None,Cast this spell only if you've cast another spell this turn.\nFlying
Shimmering Wings,1.0,['Blue'],['U'],None,['Enchantment'],['Aura'],Common,TMP,None,None,None,Enchant creature (Target a creature as you cast this. This card enters the battlefield attached to that creature.)\nEnchanted creature has flying. (It can't be blocked except by creatures with flying or reach.)\n{U}: Return Shimmering Wings to its owner's hand.
Shadow Rift,1.0,['Blue'],['U'],None,['Instant'],None,Common,TMP,None,None,None,Target creature gains shadow until end of turn. (It can block or be blocked by only creatures with shadow.)\nDraw a card.
Sea Monster,6.0,['Blue'],['U'],None,['Creature'],['Serpent'],Common,TMP,6,6,None,Sea Monster can't attack unless defending player controls an Island.
Rootwater Shaman,3.0,['Blue'],['U'],None,['Creature'],"['Merfolk', 'Shaman']",Rare,TMP,2,2,None,You may cast Aura spells with enchant creature as though they had flash.
Rootwater Matriarch,4.0,['Blue'],['U'],None,['Creature'],['Merfolk'],Rare,TMP,2,3,None,{T}: Gain control of target creature for as long as that creature is enchanted.
Rootwater Hunter,3.0,['Blue'],['U'],None,['Creature'],['Merfolk'],Common,TMP,1,1,None,{T}: Rootwater Hunter deals 1 damage to any target.
Rootwater Diver,1.0,['Blue'],['U'],None,['Creature'],['Merfolk'],Uncommon,TMP,1,1,None,"{T}, Sacrifice Rootwater Diver: Return target artifact card from your graveyard to your hand."
Propaganda,3.0,['Blue'],['U'],None,['Enchantment'],None,Uncommon,TMP,None,None,None,Creatures can't attack you unless their controller pays {2} for each creature they control that's attacking you.
Precognition,5.0,['Blue'],['U'],None,['Enchantment'],None,Rare,TMP,None,None,None,"At the beginning of your upkeep, you may look at the top card of target opponent's library. If you do, you may put that card on the bottom of that player's library."
Power Sink,1.0,['Blue'],['U'],None,['Instant'],None,Common,TMP,None,None,None,"Counter target spell unless its controller pays {X}. If that player doesn't, they tap all lands with mana abilities they control and lose all unspent mana."
Mnemonic Sliver,3.0,['Blue'],['U'],None,['Creature'],['Sliver'],Uncommon,TMP,2,2,None,"All Slivers have ""{2}, Sacrifice this permanent: Draw a card."""
Meditate,3.0,['Blue'],['U'],None,['Instant'],None,Rare,TMP,None,None,None,Draw four cards. You skip your next turn.
Mawcor,5.0,['Blue'],['U'],None,['Creature'],['Beast'],Rare,TMP,3,3,None,Flying\n{T}: Mawcor deals 1 damage to any target.
Manta Riders,1.0,['Blue'],['U'],None,['Creature'],['Merfolk'],Common,TMP,1,1,None,{U}: Manta Riders gains flying until end of turn.
Mana Severance,2.0,['Blue'],['U'],None,['Sorcery'],None,Rare,TMP,None,None,None,"Search your library for any number of land cards, exile them, then shuffle."
Legerdemain,4.0,['Blue'],['U'],None,['Sorcery'],None,Uncommon,TMP,None,None,None,Exchange control of target artifact or creature and another target permanent that shares one of those types with it. (This effect lasts indefinitely.)
Counterspell,2.0,['Blue'],['U'],None,['Instant'],None,Common,TMP,None,None,None,Counter target spell.
Insight,3.0,['Blue'],['U'],None,['Enchantment'],None,Uncommon,TMP,None,None,None,"Whenever an opponent casts a green spell, you draw a card."
Intuition,3.0,['Blue'],['U'],None,['Instant'],None,Rare,TMP,None,None,None,Search your library for three cards and reveal them. Target opponent chooses one. Put that card into your hand and the rest into your graveyard. Then shuffle.
Legacy's Allure,2.0,['Blue'],['U'],None,['Enchantment'],None,Uncommon,TMP,None,None,None,"At the beginning of your upkeep, you may put a treasure counter on Legacy's Allure.\nSacrifice Legacy's Allure: Gain control of target creature with power less than or equal to the number of treasure counters on Legacy's Allure. (This effect lasts indefinitely.)"
Interdict,2.0,['Blue'],['U'],None,['Instant'],None,Uncommon,TMP,None,None,None,"Counter target activated ability from an artifact, creature, enchantment, or land. That permanent's activated abilities can't be activated this turn. (Mana abilities can't be targeted.)\nDraw a card."
Horned Turtle,3.0,['Blue'],['U'],None,['Creature'],['Turtle'],Common,TMP,1,4,None,None
Giant Crab,5.0,['Blue'],['U'],None,['Creature'],['Crab'],Common,TMP,3,3,None,{U}: Giant Crab gains shroud until end of turn. (It can't be the target of spells or abilities.)
Gaseous Form,3.0,['Blue'],['U'],None,['Enchantment'],['Aura'],Common,TMP,None,None,None,Enchant creature\nPrevent all combat damage that would be dealt to and dealt by enchanted creature.
Escaped Shapeshifter,5.0,['Blue'],['U'],None,['Creature'],['Shapeshifter'],Rare,TMP,3,4,None,"As long as an opponent controls a creature with flying not named Escaped Shapeshifter, Escaped Shapeshifter has flying. The same is true for first strike, trample, and protection from any color."
Fylamarid,3.0,['Blue'],['U'],None,['Creature'],"['Squid', 'Beast']",Uncommon,TMP,1,3,None,Flying\nFylamarid can't be blocked by blue creatures.\n{U}: Target creature becomes blue until end of turn.
Fighting Drake,4.0,['Blue'],['U'],None,['Creature'],['Drake'],Uncommon,TMP,2,4,None,Flying
Dismiss,4.0,['Blue'],['U'],None,['Instant'],None,Uncommon,TMP,None,None,None,Counter target spell.\nDraw a card.
Chill,2.0,['Blue'],['U'],None,['Enchantment'],None,Uncommon,TMP,None,None,None,Red spells cost {2} more to cast.
Ertai's Meddling,1.0,['Blue'],['U'],None,['Instant'],None,Rare,TMP,None,None,None,"X can't be 0.\nTarget spell's controller exiles it with X delay counters on it.\nAt the beginning of each of that player's upkeeps, if that card is exiled, remove a delay counter from it. If the card has no delay counters on it, the player puts it onto the stack as a copy of the original spell."
Duplicity,5.0,['Blue'],['U'],None,['Enchantment'],None,Rare,TMP,None,None,None,"When Duplicity enters the battlefield, exile the top five cards of your library face down.\nAt the beginning of your upkeep, you may exile all cards from your hand face down. If you do, put all other cards you own exiled with Duplicity into your hand.\nAt the beginning of your end step, discard a card.\nWhen you lose control of Duplicity, put all cards exiled with Duplicity into their owner's graveyard."
Dream Cache,3.0,['Blue'],['U'],None,['Sorcery'],None,Common,TMP,None,None,None,"Draw three cards, then put two cards from your hand both on top of your library or both on the bottom of your library."
Rootbreaker Wurm,7.0,['Green'],['G'],None,['Creature'],['Wurm'],Common,TMP,6,6,None,Trample (This creature can deal excess combat damage to the player or planeswalker it's attacking.)
Rootwalla,3.0,['Green'],['G'],None,['Creature'],['Lizard'],Common,TMP,2,2,None,{1}{G}: Rootwalla gets +2/+2 until end of turn. Activate only once each turn.
Scragnoth,5.0,['Green'],['G'],None,['Creature'],['Beast'],Uncommon,TMP,3,4,None,This spell can't be countered.\nProtection from blue
Seeker of Skybreak,2.0,['Green'],['G'],None,['Creature'],['Elf'],Common,TMP,2,1,None,{T}: Untap target creature.
Skyshroud Elf,2.0,['Green'],"['G', 'R', 'W']",None,['Creature'],"['Elf', 'Druid']",Common,TMP,1,1,None,{T}: Add {G}.\n{1}: Add {R} or {W}.
Skyshroud Ranger,1.0,['Green'],['G'],None,['Creature'],"['Elf', 'Ranger']",Common,TMP,1,1,None,{T}: You may put a land card from your hand onto the battlefield. Activate only as a sorcery.
Skyshroud Troll,4.0,['Green'],['G'],None,['Creature'],"['Troll', 'Giant']",Common,TMP,3,3,None,{1}{G}: Regenerate Skyshroud Troll.
Spike Drone,1.0,['Green'],['G'],None,['Creature'],"['Spike', 'Drone']",Common,TMP,0,0,None,"Spike Drone enters the battlefield with a +1/+1 counter on it.\n{2}, Remove a +1/+1 counter from Spike Drone: Put a +1/+1 counter on target creature."
Storm Front,1.0,['Green'],['G'],None,['Enchantment'],None,Uncommon,TMP,None,None,None,{G}{G}: Tap target creature with flying.
Trained Armodon,3.0,['Green'],['G'],None,['Creature'],['Elephant'],Common,TMP,3,3,None,None
Tranquility,3.0,['Green'],['G'],None,['Sorcery'],None,Common,TMP,None,None,None,Destroy all enchantments.
Trumpeting Armodon,4.0,['Green'],['G'],None,['Creature'],['Elephant'],Uncommon,TMP,3,3,None,{1}{G}: Target creature blocks Trumpeting Armodon this turn if able.
Verdant Force,8.0,['Green'],['G'],None,['Creature'],['Elemental'],Rare,TMP,7,7,None,"At the beginning of each upkeep, create a 1/1 green Saproling creature token."
Verdigris,3.0,['Green'],['G'],None,['Instant'],None,Uncommon,TMP,None,None,None,Destroy target artifact.
Winter's Grasp,3.0,['Green'],['G'],None,['Sorcery'],None,Uncommon,TMP,None,None,None,Destroy target land.
Dracoplasm,2.0,"['Red', 'Blue']","['R', 'U']",None,['Creature'],['Shapeshifter'],Rare,TMP,0,0,None,"Flying\nAs Dracoplasm enters the battlefield, sacrifice any number of creatures. Dracoplasm's power becomes the total power of those creatures and its toughness becomes their total toughness.\n{R}: Dracoplasm gets +1/+0 until end of turn."
Lobotomy,4.0,"['Black', 'Blue']","['B', 'U']",None,['Sorcery'],None,Uncommon,TMP,None,None,None,"Target player reveals their hand, then you choose a card other than a basic land card from it. Search that player's graveyard, hand, and library for all cards with the same name as the chosen card and exile them. Then that player shuffles."
Ranger en-Vec,3.0,"['Green', 'White']","['G', 'W']",None,['Creature'],"['Human', 'Soldier', 'Archer', 'Ranger']",Uncommon,TMP,2,2,None,First strike\n{G}: Regenerate Ranger en-Vec.
Segmented Wurm,5.0,"['Green', 'Red']","['G', 'R']",None,['Creature'],['Wurm'],Uncommon,TMP,5,5,None,"Whenever Segmented Wurm becomes the target of a spell or ability, put a -1/-1 counter on it."
"Selenia, Dark Angel",5.0,"['Black', 'White']","['B', 'W']",['Legendary'],['Creature'],"['Phyrexian', 'Angel']",Rare,TMP,3,3,None,"Flying\nPay 2 life: Return Selenia, Dark Angel to its owner's hand."
Sky Spirit,3.0,"['Blue', 'White']","['U', 'W']",None,['Creature'],['Spirit'],Uncommon,TMP,2,2,None,"Flying, first strike"
Soltari Guerrillas,4.0,"['Red', 'White']","['R', 'W']",None,['Creature'],"['Soltari', 'Soldier']",Rare,TMP,3,2,None,"Shadow (This creature can block or be blocked by only creatures with shadow.)\n{0}: The next time Soltari Guerrillas would deal combat damage to an opponent this turn, it deals that damage to target creature instead."
Spontaneous Combustion,3.0,"['Black', 'Red']","['B', 'R']",None,['Instant'],None,Uncommon,TMP,None,None,None,"As an additional cost to cast this spell, sacrifice a creature.\nSpontaneous Combustion deals 3 damage to each creature."
Vhati il-Dal,4.0,"['Black', 'Green']","['B', 'G']",['Legendary'],['Creature'],"['Human', 'Warrior']",Rare,TMP,3,3,None,"{T}: Until end of turn, target creature has base power 1 or base toughness 1."
Wood Sage,2.0,"['Green', 'Blue']","['G', 'U']",None,['Creature'],"['Human', 'Druid']",Rare,TMP,1,1,None,{T}: Choose a creature card name. Reveal the top four cards of your library and put all of them with that name into your hand. Put the rest into your graveyard.
Altar of Dementia,2.0,None,None,None,['Artifact'],None,Rare,TMP,None,None,None,Sacrifice a creature: Target player mills cards equal to the sacrificed creature's power.
Booby Trap,6.0,None,None,None,['Artifact'],None,Rare,TMP,None,None,None,"As Booby Trap enters the battlefield, choose an opponent and a card name other than a basic land card name.\nThe chosen player reveals each card they draw.\nWhen the chosen player draws a card with the chosen name, sacrifice Booby Trap. If you do, Booby Trap deals 10 damage to that player."
Bottle Gnomes,3.0,None,None,None,"['Artifact', 'Creature']",['Gnome'],Uncommon,TMP,1,3,None,Sacrifice Bottle Gnomes: You gain 3 life.
Coiled Tinviper,3.0,None,None,None,"['Artifact', 'Creature']",['Snake'],Common,TMP,2,1,None,First strike
Cold Storage,4.0,None,None,None,['Artifact'],None,Rare,TMP,None,None,None,{3}: Exile target creature you control.\nSacrifice Cold Storage: Return each creature card exiled with Cold Storage to the battlefield under your control.
Cursed Scroll,1.0,None,None,None,['Artifact'],None,Rare,TMP,None,None,None,"{3}, {T}: Choose a card name, then reveal a card at random from your hand. If that card has the chosen name, Cursed Scroll deals 2 damage to any target."
Echo Chamber,4.0,None,None,None,['Artifact'],None,Rare,TMP,None,None,None,"{4}, {T}: An opponent chooses target creature they control. Create a token that's a copy of that creature. That token gains haste until end of turn. Exile the token at the beginning of the next end step. Activate only as a sorcery."
Emerald Medallion,2.0,None,None,None,['Artifact'],None,Rare,TMP,None,None,None,Green spells you cast cost {1} less to cast.
Emmessi Tome,4.0,None,None,None,['Artifact'],None,Rare,TMP,None,None,None,"{5}, {T}: Draw two cards, then discard a card."
Energizer,4.0,None,None,None,"['Artifact', 'Creature']",['Juggernaut'],Rare,TMP,2,2,None,"{2}, {T}: Put a +1/+1 counter on Energizer."
Essence Bottle,2.0,None,None,None,['Artifact'],None,Uncommon,TMP,None,None,None,"{3}, {T}: Put an elixir counter on Essence Bottle.\n{T}, Remove all elixir counters from Essence Bottle: You gain 2 life for each elixir counter removed this way."
Excavator,2.0,None,None,None,['Artifact'],None,Uncommon,TMP,None,None,None,"{T}, Sacrifice a basic land: Target creature gains landwalk of each of the land types of the sacrificed land until end of turn. (It can't be blocked as long as defending player controls a land of any of those types.)"
Flowstone Sculpture,6.0,None,None,None,"['Artifact', 'Creature']",['Shapeshifter'],Rare,TMP,4,4,None,"{2}, Discard a card: Put a +1/+1 counter on Flowstone Sculpture or Flowstone Sculpture gains flying, first strike, or trample. (This effect lasts indefinitely.)"
Fool's Tome,4.0,None,None,None,['Artifact'],None,Rare,TMP,None,None,None,"{2}, {T}: Draw a card. Activate only if you have no cards in hand."
Grindstone,1.0,None,None,None,['Artifact'],None,Rare,TMP,None,None,None,"{3}, {T}: Target player mills two cards. If two cards that share a color were milled this way, repeat this process."
Helm of Possession,4.0,None,None,None,['Artifact'],None,Rare,TMP,None,None,None,"You may choose not to untap Helm of Possession during your untap step.\n{2}, {T}, Sacrifice a creature: Gain control of target creature for as long as you control Helm of Possession and Helm of Possession remains tapped."
Jet Medallion,2.0,None,None,None,['Artifact'],None,Rare,TMP,None,None,None,Black spells you cast cost {1} less to cast.
Jinxed Idol,2.0,None,None,None,['Artifact'],None,Rare,TMP,None,None,None,"At the beginning of your upkeep, Jinxed Idol deals 2 damage to you.\nSacrifice a creature: Target opponent gains control of Jinxed Idol."
Lotus Petal,0.0,None,None,None,['Artifact'],None,Common,TMP,None,None,None,"{T}, Sacrifice Lotus Petal: Add one mana of any color."
Magnetic Web,2.0,None,None,None,['Artifact'],None,Rare,TMP,None,None,None,"If a creature with a magnet counter on it attacks, all creatures with magnet counters on them attack if able.\nWhenever a creature with a magnet counter on it attacks, all creatures with magnet counters on them block that creature this turn if able.\n{1}, {T}: Put a magnet counter on target creature."
Manakin,2.0,None,None,None,"['Artifact', 'Creature']",['Construct'],Common,TMP,1,1,None,{T}: Add {C}.
Metallic Sliver,1.0,None,None,None,"['Artifact', 'Creature']",['Sliver'],Common,TMP,1,1,None,None
Mogg Cannon,2.0,None,None,None,['Artifact'],None,Uncommon,TMP,None,None,None,{T}: Target creature you control gets +1/+0 and gains flying until end of turn. Destroy that creature at the beginning of the next end step.
Patchwork Gnomes,3.0,None,None,None,"['Artifact', 'Creature']",['Gnome'],Uncommon,TMP,2,1,None,"Discard a card: Regenerate Patchwork Gnomes. (The next time this creature would be destroyed, instead tap it, remove it from combat, and heal all damage on it.)"
Pearl Medallion,2.0,None,None,None,['Artifact'],None,Rare,TMP,None,None,None,White spells you cast cost {1} less to cast.
Puppet Strings,3.0,None,None,None,['Artifact'],None,Uncommon,TMP,None,None,None,"{2}, {T}: You may tap or untap target creature."
Ruby Medallion,2.0,None,None,None,['Artifact'],None,Rare,TMP,None,None,None,Red spells you cast cost {1} less to cast.
Sapphire Medallion,2.0,None,None,None,['Artifact'],None,Rare,TMP,None,None,None,Blue spells you cast cost {1} less to cast.
Phyrexian Grimoire,3.0,None,None,None,['Artifact'],None,Rare,TMP,None,None,None,"{4}, {T}: Target opponent chooses one of the top two cards of your graveyard. Exile that card and put the other one into your hand."
Phyrexian Splicer,2.0,None,None,None,['Artifact'],None,Uncommon,TMP,None,None,None,"{2}, {T}, Choose flying, first strike, trample, or shadow: Until end of turn, target creature with the chosen ability loses it and another target creature gains it."
Scroll Rack,2.0,None,None,None,['Artifact'],None,Rare,TMP,None,None,None,"{1}, {T}: Exile any number of cards from your hand face down. Put that many cards from the top of your library into your hand. Then look at the exiled cards and put them on top of your library in any order."
