Name,CMC,Colors,Color identity,Supertypes,Types,Subtypes,Rarity,Set,Power,Toughness,Loyalty,Text
Death's Duet,3.0,['Black'],['B'],None,['Sorcery'],None,Common,TPR,None,None,None,Return two target creature cards from your graveyard to your hand.
Starke of Rath,3.0,['Red'],['R'],['Legendary'],['Creature'],"['Human', 'Rogue']",Mythic,TPR,2,2,None,{T}: Destroy target artifact or creature. That permanent's controller gains control of Starke of Rath. (This effect lasts indefinitely.)
Coiled Tinviper,3.0,None,None,None,"['Artifact', 'Creature']",['Snake'],Common,TPR,2,1,None,First strike
Evincar's Justice,4.0,['Black'],['B'],None,['Sorcery'],None,Uncommon,TPR,None,None,None,"Buyback {3} (You may pay an additional {3} as you cast this spell. If you do, put this card into your hand as it resolves.)\nEvincar's Justice deals 2 damage to each creature and each player."
Spitting Hydra,5.0,['Red'],['R'],None,['Creature'],['Hydra'],Rare,TPR,0,0,None,"Spitting Hydra enters the battlefield with four +1/+1 counters on it.\n{1}{R}, Remove a +1/+1 counter from Spitting Hydra: It deals 1 damage to target creature."
Coat of Arms,5.0,None,None,None,['Artifact'],None,Rare,TPR,None,None,None,"Each creature gets +1/+1 for each other creature on the battlefield that shares at least one creature type with it. (For example, if two Goblin Warriors and a Goblin Shaman are on the battlefield, each gets +2/+2.)"
Dungeon Shade,4.0,['Black'],['B'],None,['Creature'],"['Shade', 'Spirit']",Common,TPR,1,1,None,Flying\n{B}: Dungeon Shade gets +1/+1 until end of turn.
Bottle Gnomes,3.0,None,None,None,"['Artifact', 'Creature']",['Gnome'],Common,TPR,1,3,None,Sacrifice Bottle Gnomes: You gain 3 life.
Diabolic Edict,2.0,['Black'],['B'],None,['Instant'],None,Common,TPR,None,None,None,Target player sacrifices a creature.
Verdant Force,8.0,['Green'],['G'],None,['Creature'],['Elemental'],Rare,TPR,7,7,None,"At the beginning of each upkeep, create a 1/1 green Saproling creature token."
Death Stroke,2.0,['Black'],['B'],None,['Sorcery'],None,Common,TPR,None,None,None,Destroy target tapped creature.
Spined Sliver,2.0,"['Green', 'Red']","['G', 'R']",None,['Creature'],['Sliver'],Uncommon,TPR,2,2,None,"Whenever a Sliver becomes blocked, that Sliver gets +1/+1 until end of turn for each creature blocking it."
Victual Sliver,2.0,"['Green', 'White']","['G', 'W']",None,['Creature'],['Sliver'],Uncommon,TPR,2,2,None,"All Slivers have ""{2}, Sacrifice this permanent: You gain 4 life."""
Death Pits of Rath,5.0,['Black'],['B'],None,['Enchantment'],None,Rare,TPR,None,None,None,"Whenever a creature is dealt damage, destroy it. It can't be regenerated."
Dauthi Warlord,2.0,['Black'],['B'],None,['Creature'],"['Dauthi', 'Soldier']",Uncommon,TPR,*,1,None,Shadow (This creature can block or be blocked by only creatures with shadow.)\nDauthi Warlord's power is equal to the number of creatures with shadow on the battlefield.
Wood Sage,2.0,"['Green', 'Blue']","['G', 'U']",None,['Creature'],"['Human', 'Druid']",Rare,TPR,1,1,None,{T}: Choose a creature card name. Reveal the top four cards of your library and put all of them with that name into your hand. Put the rest into your graveyard.
Dauthi Slayer,2.0,['Black'],['B'],None,['Creature'],"['Dauthi', 'Soldier']",Uncommon,TPR,2,2,None,Shadow (This creature can block or be blocked by only creatures with shadow.)\nDauthi Slayer attacks each combat if able.
Vhati il-Dal,4.0,"['Black', 'Green']","['B', 'G']",['Legendary'],['Creature'],"['Human', 'Warrior']",Rare,TPR,3,3,None,"{T}: Until end of turn, target creature has base power 1 or base toughness 1."
Dauthi Marauder,3.0,['Black'],['B'],None,['Creature'],"['Dauthi', 'Minion']",Uncommon,TPR,3,1,None,Shadow (This creature can block or be blocked by only creatures with shadow.)
Soltari Guerrillas,4.0,"['Red', 'White']","['R', 'W']",None,['Creature'],"['Soltari', 'Soldier']",Rare,TPR,3,2,None,"Shadow (This creature can block or be blocked by only creatures with shadow.)\n{0}: The next time Soltari Guerrillas would deal combat damage to an opponent this turn, it deals that damage to target creature instead."
Dauthi Jackal,3.0,['Black'],['B'],None,['Creature'],"['Dauthi', 'Jackal']",Common,TPR,2,1,None,"Shadow (This creature can block or be blocked by only creatures with shadow.)\n{B}{B}, Sacrifice Dauthi Jackal: Destroy target blocking creature."
Sliver Queen,5.0,"['Black', 'Green', 'Red', 'Blue', 'White']","['B', 'G', 'R', 'U', 'W']",['Legendary'],['Creature'],['Sliver'],Mythic,TPR,7,7,None,{2}: Create a 1/1 colorless Sliver creature token.
Dauthi Horror,2.0,['Black'],['B'],None,['Creature'],"['Dauthi', 'Horror']",Common,TPR,2,1,None,Shadow (This creature can block or be blocked by only creatures with shadow.)\nDauthi Horror can't be blocked by white creatures.
"Selenia, Dark Angel",5.0,"['Black', 'White']","['B', 'W']",['Legendary'],['Creature'],"['Phyrexian', 'Angel']",Rare,TPR,3,3,None,"Flying\nPay 2 life: Return Selenia, Dark Angel to its owner's hand."
Dark Ritual,1.0,['Black'],['B'],None,['Instant'],None,Common,TPR,None,None,None,Add {B}{B}{B}.
Crystalline Sliver,2.0,"['Blue', 'White']","['U', 'W']",None,['Creature'],['Sliver'],Uncommon,TPR,2,2,None,All Slivers have shroud. (They can't be the targets of spells or abilities.)
Dark Banishing,3.0,['Black'],['B'],None,['Instant'],None,Common,TPR,None,None,None,Destroy target nonblack creature. It can't be regenerated.
Hibernation Sliver,2.0,"['Black', 'Blue']","['B', 'U']",None,['Creature'],['Sliver'],Uncommon,TPR,2,2,None,"All Slivers have ""Pay 2 life: Return this permanent to its owner's hand."""
Cursed Flesh,1.0,['Black'],['B'],None,['Enchantment'],['Aura'],Common,TPR,None,None,None,Enchant creature\nEnchanted creature gets -1/-1 and has fear. (It can't be blocked except by artifact creatures and/or black creatures.)
Dracoplasm,2.0,"['Red', 'Blue']","['R', 'U']",None,['Creature'],['Shapeshifter'],Rare,TPR,0,0,None,"Flying\nAs Dracoplasm enters the battlefield, sacrifice any number of creatures. Dracoplasm's power becomes the total power of those creatures and its toughness becomes their total toughness.\n{R}: Dracoplasm gets +1/+0 until end of turn."
Crovax the Cursed,4.0,['Black'],['B'],['Legendary'],['Creature'],"['Vampire', 'Noble']",Rare,TPR,0,0,None,"Crovax the Cursed enters the battlefield with four +1/+1 counters on it.\nAt the beginning of your upkeep, you may sacrifice a creature. If you do, put a +1/+1 counter on Crovax. If you don't, remove a +1/+1 counter from Crovax.\n{B}: Crovax gains flying until end of turn."
Verdant Touch,2.0,['Green'],['G'],None,['Sorcery'],None,Uncommon,TPR,None,None,None,"Buyback {3} (You may pay an additional {3} as you cast this spell. If you do, put this card into your hand as it resolves.)\nTarget land becomes a 2/2 creature that's still a land. (This effect lasts indefinitely.)"
Corpse Dance,3.0,['Black'],['B'],None,['Instant'],None,Rare,TPR,None,None,None,"Buyback {2} (You may pay an additional {2} as you cast this spell. If you do, put this card into your hand as it resolves.)\nReturn the top creature card of your graveyard to the battlefield. That creature gains haste until end of turn. Exile it at the beginning of the next end step."
Tranquility,3.0,['Green'],['G'],None,['Sorcery'],None,Uncommon,TPR,None,None,None,Destroy all enchantments.
Commander Greven il-Vec,6.0,['Black'],['B'],['Legendary'],['Creature'],"['Phyrexian', 'Human', 'Warrior']",Rare,TPR,7,5,None,"Fear (This creature can't be blocked except by artifact creatures and/or black creatures.)\nWhen Commander Greven il-Vec enters the battlefield, sacrifice a creature."
Acidic Sliver,2.0,"['Black', 'Red']","['B', 'R']",None,['Creature'],['Sliver'],Uncommon,TPR,2,2,None,"All Slivers have ""{2}, Sacrifice this permanent: This permanent deals 2 damage to any target."""
Coffin Queen,3.0,['Black'],['B'],None,['Creature'],"['Zombie', 'Wizard']",Rare,TPR,1,1,None,"You may choose not to untap Coffin Queen during your untap step.\n{2}{B}, {T}: Put target creature card from a graveyard onto the battlefield under your control. When Coffin Queen becomes untapped or you lose control of Coffin Queen, exile that creature."
Wall of Blossoms,2.0,['Green'],['G'],None,['Creature'],"['Plant', 'Wall']",Uncommon,TPR,0,4,None,"Defender\nWhen Wall of Blossoms enters the battlefield, draw a card."
Coercion,3.0,['Black'],['B'],None,['Sorcery'],None,Common,TPR,None,None,None,Target opponent reveals their hand. You choose a card from it. That player discards that card.
Verdigris,3.0,['Green'],['G'],None,['Instant'],None,Common,TPR,None,None,None,Destroy target artifact.
Clot Sliver,2.0,['Black'],['B'],None,['Creature'],['Sliver'],Common,TPR,1,1,None,"All Slivers have ""{2}: Regenerate this permanent."""
Trained Armodon,3.0,['Green'],['G'],None,['Creature'],['Elephant'],Common,TPR,3,3,None,None
Carnophage,1.0,['Black'],['B'],None,['Creature'],['Zombie'],Common,TPR,2,2,None,"At the beginning of your upkeep, tap Carnophage unless you pay 1 life."
Survival of the Fittest,2.0,['Green'],['G'],None,['Enchantment'],None,Mythic,TPR,None,None,None,"{G}, Discard a creature card: Search your library for a creature card, reveal that card, put it into your hand, then shuffle."
Spined Wurm,5.0,['Green'],['G'],None,['Creature'],['Wurm'],Common,TPR,5,4,None,None
Cannibalize,2.0,['Black'],['B'],None,['Sorcery'],None,Uncommon,TPR,None,None,None,Choose two target creatures controlled by the same player. Exile one of those creatures and put two +1/+1 counters on the other.
Spike Hatcher,7.0,['Green'],['G'],None,['Creature'],['Spike'],Rare,TPR,0,0,None,"Spike Hatcher enters the battlefield with six +1/+1 counters on it.\n{2}, Remove a +1/+1 counter from Spike Hatcher: Put a +1/+1 counter on target creature.\n{1}, Remove a +1/+1 counter from Spike Hatcher: Regenerate Spike Hatcher."
Winged Sliver,2.0,['Blue'],['U'],None,['Creature'],['Sliver'],Common,TPR,1,1,None,All Sliver creatures have flying.
Spike Feeder,3.0,['Green'],['G'],None,['Creature'],['Spike'],Uncommon,TPR,0,0,None,"Spike Feeder enters the battlefield with two +1/+1 counters on it.\n{2}, Remove a +1/+1 counter from Spike Feeder: Put a +1/+1 counter on target creature.\nRemove a +1/+1 counter from Spike Feeder: You gain 2 life."
Wind Drake,3.0,['Blue'],['U'],None,['Creature'],['Drake'],Common,TPR,2,2,None,Flying
Spike Colony,5.0,['Green'],['G'],None,['Creature'],['Spike'],Common,TPR,0,0,None,"Spike Colony enters the battlefield with four +1/+1 counters on it.\n{2}, Remove a +1/+1 counter from Spike Colony: Put a +1/+1 counter on target creature."
Wind Dancer,2.0,['Blue'],['U'],None,['Creature'],['Faerie'],Uncommon,TPR,1,1,None,Flying\n{T}: Target creature gains flying until end of turn.
Spike Breeder,4.0,['Green'],['G'],None,['Creature'],['Spike'],Uncommon,TPR,0,0,None,"Spike Breeder enters the battlefield with three +1/+1 counters on it.\n{2}, Remove a +1/+1 counter from Spike Breeder: Put a +1/+1 counter on target creature.\n{2}, Remove a +1/+1 counter from Spike Breeder: Create a 1/1 green Spike creature token."
Whispers of the Muse,1.0,['Blue'],['U'],None,['Instant'],None,Common,TPR,None,None,None,"Buyback {5} (You may pay an additional {5} as you cast this spell. If you do, put this card into your hand as it resolves.)\nDraw a card."
Skyshroud Troll,4.0,['Green'],['G'],None,['Creature'],"['Troll', 'Giant']",Common,TPR,3,3,None,{1}{G}: Regenerate Skyshroud Troll.
Wayward Soul,4.0,['Blue'],['U'],None,['Creature'],['Spirit'],Common,TPR,3,2,None,Flying\n{U}: Put Wayward Soul on top of its owner's library.
Skyshroud Elf,2.0,['Green'],"['G', 'R', 'W']",None,['Creature'],"['Elf', 'Druid']",Common,TPR,1,1,None,{T}: Add {G}.\n{1}: Add {R} or {W}.
Volrath's Curse,2.0,['Blue'],['U'],None,['Enchantment'],['Aura'],Uncommon,TPR,None,None,None,"Enchant creature\nEnchanted creature can't attack or block, and its activated abilities can't be activated. That creature's controller may sacrifice a permanent for that player to ignore this effect until end of turn.\n{1}{U}: Return Volrath's Curse to its owner's hand."
Rootwalla,3.0,['Green'],['G'],None,['Creature'],['Lizard'],Common,TPR,2,2,None,{1}{G}: Rootwalla gets +2/+2 until end of turn. Activate only once each turn.
Twitch,3.0,['Blue'],['U'],None,['Instant'],None,Common,TPR,None,None,None,"You may tap or untap target artifact, creature, or land.\nDraw a card."
Tradewind Rider,4.0,['Blue'],['U'],None,['Creature'],['Spirit'],Rare,TPR,1,4,None,"Flying\n{T}, Tap two untapped creatures you control: Return target permanent to its owner's hand."
Rootbreaker Wurm,7.0,['Green'],['G'],None,['Creature'],['Wurm'],Uncommon,TPR,6,6,None,Trample (This creature can deal excess combat damage to the player or planeswalker it's attacking.)
Soltari Monk,2.0,['White'],['W'],None,['Creature'],"['Soltari', 'Monk', 'Cleric']",Uncommon,TPR,2,1,None,Protection from black\nShadow (This creature can block or be blocked by only creatures with shadow.)
Time Warp,5.0,['Blue'],['U'],None,['Sorcery'],None,Mythic,TPR,None,None,None,Target player takes an extra turn after this one.
Recycle,6.0,['Green'],['G'],None,['Enchantment'],None,Rare,TPR,None,None,None,"Skip your draw step.\nWhenever you play a card, draw a card.\nYour maximum hand size is two."
Soltari Lancer,3.0,['White'],['W'],None,['Creature'],"['Soltari', 'Knight']",Common,TPR,2,2,None,Shadow (This creature can block or be blocked by only creatures with shadow.)\nSoltari Lancer has first strike as long as it's attacking.
Time Ebb,3.0,['Blue'],['U'],None,['Sorcery'],None,Common,TPR,None,None,None,Put target creature on top of its owner's library.
Soltari Champion,3.0,['White'],['W'],None,['Creature'],"['Soltari', 'Soldier']",Uncommon,TPR,2,2,None,"Shadow (This creature can block or be blocked by only creatures with shadow.)\nWhenever Soltari Champion attacks, other creatures you control get +1/+1 until end of turn."
Thalakos Seer,2.0,['Blue'],['U'],None,['Creature'],"['Thalakos', 'Wizard']",Common,TPR,1,1,None,"Shadow (This creature can block or be blocked by only creatures with shadow.)\nWhen Thalakos Seer leaves the battlefield, draw a card."
Reality Anchor,2.0,['Green'],['G'],None,['Instant'],None,Common,TPR,None,None,None,Target creature loses shadow until end of turn.\nDraw a card.
Smite,1.0,['White'],['W'],None,['Instant'],None,Common,TPR,None,None,None,Destroy target blocked creature.
Thalakos Scout,3.0,['Blue'],['U'],None,['Creature'],"['Thalakos', 'Soldier', 'Scout']",Common,TPR,2,1,None,Shadow (This creature can block or be blocked by only creatures with shadow.)\nDiscard a card: Return Thalakos Scout to its owner's hand.
Rampant Growth,2.0,['Green'],['G'],None,['Sorcery'],None,Common,TPR,None,None,None,"Search your library for a basic land card, put that card onto the battlefield tapped, then shuffle."
Shaman en-Kor,2.0,['White'],['W'],None,['Creature'],"['Kor', 'Cleric', 'Shaman']",Rare,TPR,1,2,None,"{0}: The next 1 damage that would be dealt to Shaman en-Kor this turn is dealt to target creature you control instead.\n{1}{W}: The next time a source of your choice would deal damage to target creature this turn, that damage is dealt to Shaman en-Kor instead."
Thalakos Drifters,4.0,['Blue'],['U'],None,['Creature'],['Thalakos'],Uncommon,TPR,3,3,None,Discard a card: Thalakos Drifters gains shadow until end of turn. (It can block or be blocked by only creatures with shadow.)
Provoke,2.0,['Green'],['G'],None,['Instant'],None,Common,TPR,None,None,None,Untap target creature you don't control. That creature blocks this turn if able.\nDraw a card.
Shackles,3.0,['White'],['W'],None,['Enchantment'],['Aura'],Common,TPR,None,None,None,Enchant creature\nEnchanted creature doesn't untap during its controller's untap step.\n{W}: Return Shackles to its owner's hand.
Spell Blast,1.0,['Blue'],['U'],None,['Instant'],None,Common,TPR,None,None,None,"Counter target spell with mana value X. (For example, if that spell's mana cost is {3}{U}{U}, X is 5.)"
Overrun,5.0,['Green'],['G'],None,['Sorcery'],None,Uncommon,TPR,None,None,None,Creatures you control get +3/+3 and gain trample until end of turn.
Repentance,3.0,['White'],['W'],None,['Sorcery'],None,Uncommon,TPR,None,None,None,Target creature deals damage to itself equal to its power.
Silver Wyvern,5.0,['Blue'],['U'],None,['Creature'],['Drake'],Rare,TPR,4,3,None,Flying\n{U}: Change the target of target spell or ability that targets only Silver Wyvern. The new target must be a creature.
Oath of Druids,2.0,['Green'],['G'],None,['Enchantment'],None,Mythic,TPR,None,None,None,"At the beginning of each player's upkeep, that player chooses target player who controls more creatures than they do and is their opponent. The first player may reveal cards from the top of their library until they reveal a creature card. If the first player does, that player puts that card onto the battlefield and all other cards revealed this way into their graveyard."
Sift,4.0,['Blue'],['U'],None,['Sorcery'],None,Common,TPR,None,None,None,"Draw three cards, then discard a card."
Pegasus Stampede,2.0,['White'],['W'],None,['Sorcery'],None,Uncommon,TPR,None,None,None,"Buyback—Sacrifice a land. (You may sacrifice a land in addition to any other costs as you cast this spell. If you do, put this card into your hand as it resolves.)\nCreate a 1/1 white Pegasus creature token with flying."
Shadow Rift,1.0,['Blue'],['U'],None,['Instant'],None,Common,TPR,None,None,None,Target creature gains shadow until end of turn. (It can block or be blocked by only creatures with shadow.)\nDraw a card.
Paladin en-Vec,3.0,['White'],['W'],None,['Creature'],"['Human', 'Knight']",Rare,TPR,2,2,None,"First strike, protection from black and from red (This creature deals combat damage before creatures without first strike. It can't be blocked, targeted, dealt damage, or enchanted by anything black or red.)"
Needle Storm,3.0,['Green'],['G'],None,['Sorcery'],None,Uncommon,TPR,None,None,None,Needle Storm deals 4 damage to each creature with flying.
Sea Monster,6.0,['Blue'],['U'],None,['Creature'],['Serpent'],Common,TPR,6,6,None,Sea Monster can't attack unless defending player controls an Island.
Pacifism,2.0,['White'],['W'],None,['Enchantment'],['Aura'],Uncommon,TPR,None,None,None,Enchant creature\nEnchanted creature can't attack or block.
Muscle Sliver,2.0,['Green'],['G'],None,['Creature'],['Sliver'],Common,TPR,1,1,None,All Sliver creatures get +1/+1.
"Orim, Samite Healer",3.0,['White'],['W'],['Legendary'],['Creature'],"['Human', 'Cleric']",Rare,TPR,1,3,None,{T}: Prevent the next 3 damage that would be dealt to any target this turn.
Scrivener,5.0,['Blue'],['U'],None,['Creature'],"['Human', 'Wizard']",Common,TPR,2,2,None,"When Scrivener enters the battlefield, you may return target instant card from your graveyard to your hand."
Mulch,2.0,['Green'],['G'],None,['Sorcery'],None,Common,TPR,None,None,None,Reveal the top four cards of your library. Put all land cards revealed this way into your hand and the rest into your graveyard.
Nomads en-Kor,1.0,['White'],['W'],None,['Creature'],"['Kor', 'Nomad', 'Soldier']",Common,TPR,1,1,None,{0}: The next 1 damage that would be dealt to Nomads en-Kor this turn is dealt to target creature you control instead.
Rootwater Hunter,3.0,['Blue'],['U'],None,['Creature'],['Merfolk'],Uncommon,TPR,1,1,None,{T}: Rootwater Hunter deals 1 damage to any target.
"Mirri, Cat Warrior",3.0,['Green'],['G'],['Legendary'],['Creature'],"['Cat', 'Warrior']",Rare,TPR,2,3,None,"First strike, forestwalk, vigilance (This creature deals combat damage before creatures without first strike, it can't be blocked as long as defending player controls a Forest, and attacking doesn't cause this creature to tap.)"
Mounted Archers,4.0,['White'],['W'],None,['Creature'],"['Human', 'Soldier', 'Archer']",Common,TPR,2,3,None,Reach (This creature can block creatures with flying.)\n{W}: Mounted Archers can block an additional creature this turn.
Mnemonic Sliver,3.0,['Blue'],['U'],None,['Creature'],['Sliver'],Common,TPR,2,2,None,"All Slivers have ""{2}, Sacrifice this permanent: Draw a card."""
Manabond,1.0,['Green'],['G'],None,['Enchantment'],None,Rare,TPR,None,None,None,"At the beginning of your end step, you may reveal your hand and put all land cards from it onto the battlefield. If you do, discard your hand."
Master Decoy,2.0,['White'],['W'],None,['Creature'],"['Human', 'Soldier']",Common,TPR,1,2,None,"{W}, {T}: Tap target creature."
Merfolk Looter,2.0,['Blue'],['U'],None,['Creature'],"['Merfolk', 'Rogue']",Common,TPR,1,1,None,"{T}: Draw a card, then discard a card."
Lowland Basilisk,3.0,['Green'],['G'],None,['Creature'],['Basilisk'],Uncommon,TPR,1,3,None,"Whenever Lowland Basilisk deals damage to a creature, destroy that creature at end of combat."
Kor Chant,3.0,['White'],['W'],None,['Instant'],None,Uncommon,TPR,None,None,None,All damage that would be dealt this turn to target creature you control by a source of your choice is dealt to another target creature instead.
Meditate,3.0,['Blue'],['U'],None,['Instant'],None,Rare,TPR,None,None,None,Draw four cards. You skip your next turn.
Krakilin,2.0,['Green'],['G'],None,['Creature'],['Beast'],Rare,TPR,0,0,None,Krakilin enters the battlefield with X +1/+1 counters on it.\n{1}{G}: Regenerate Krakilin.
Angelic Protector,4.0,['White'],['W'],None,['Creature'],['Angel'],Uncommon,TPR,2,2,None,"Flying\nWhenever Angelic Protector becomes the target of a spell or ability, Angelic Protector gets +0/+3 until end of turn."
Mawcor,5.0,['Blue'],['U'],None,['Creature'],['Beast'],Rare,TPR,3,3,None,Flying\n{T}: Mawcor deals 1 damage to any target.
Wall of Diffusion,2.0,['Red'],['R'],None,['Creature'],['Wall'],Common,TPR,0,5,None,Defender (This creature can't attack.)\nWall of Diffusion can block creatures with shadow as though Wall of Diffusion had shadow.
Field of Souls,4.0,['White'],['W'],None,['Enchantment'],None,Rare,TPR,None,None,None,"Whenever a nontoken creature is put into your graveyard from the battlefield, create a 1/1 white Spirit creature token with flying."
Mana Leak,2.0,['Blue'],['U'],None,['Instant'],None,Common,TPR,None,None,None,Counter target spell unless its controller pays {3}.
Heartwood Dryad,2.0,['Green'],['G'],None,['Creature'],['Dryad'],Common,TPR,2,1,None,Heartwood Dryad can block creatures with shadow as though Heartwood Dryad had shadow.
Gerrard's Battle Cry,1.0,['White'],['W'],None,['Enchantment'],None,Rare,TPR,None,None,None,{2}{W}: Creatures you control get +1/+1 until end of turn.
Legerdemain,4.0,['Blue'],['U'],None,['Sorcery'],None,Uncommon,TPR,None,None,None,Exchange control of target artifact or creature and another target permanent that shares one of those types with it. (This effect lasts indefinitely.)
Hermit Druid,2.0,['Green'],['G'],None,['Creature'],"['Human', 'Druid']",Uncommon,TPR,1,1,None,"{G}, {T}: Reveal cards from the top of your library until you reveal a basic land card. Put that card into your hand and all other cards revealed this way into your graveyard."
Humility,4.0,['White'],['W'],None,['Enchantment'],None,Mythic,TPR,None,None,None,All creatures lose all abilities and have base power and toughness 1/1.
Legacy's Allure,2.0,['Blue'],['U'],None,['Enchantment'],None,Rare,TPR,None,None,None,"At the beginning of your upkeep, you may put a treasure counter on Legacy's Allure.\nSacrifice Legacy's Allure: Gain control of target creature with power less than or equal to the number of treasure counters on Legacy's Allure. (This effect lasts indefinitely.)"
Gallantry,2.0,['White'],['W'],None,['Instant'],None,Uncommon,TPR,None,None,None,Target blocking creature gets +4/+4 until end of turn.\nDraw a card.
Killer Whale,5.0,['Blue'],['U'],None,['Creature'],['Whale'],Uncommon,TPR,3,5,None,{U}: Killer Whale gains flying until end of turn.
Horned Sliver,3.0,['Green'],['G'],None,['Creature'],['Sliver'],Common,TPR,2,2,None,All Sliver creatures have trample.
Exalted Dragon,6.0,['White'],['W'],None,['Creature'],['Dragon'],Rare,TPR,5,5,None,Flying\nExalted Dragon can't attack unless you sacrifice a land. (This cost is paid as attackers are declared.)
Intuition,3.0,['Blue'],['U'],None,['Instant'],None,Rare,TPR,None,None,None,Search your library for three cards and reveal them. Target opponent chooses one. Put that card into your hand and the rest into your graveyard. Then shuffle.
Heartwood Giant,5.0,['Green'],['G'],None,['Creature'],['Giant'],Rare,TPR,4,4,None,"{T}, Sacrifice a Forest: Heartwood Giant deals 2 damage to target player or planeswalker."
Disenchant,2.0,['White'],['W'],None,['Instant'],None,Common,TPR,None,None,None,Destroy target artifact or enchantment.
Horned Turtle,3.0,['Blue'],['U'],None,['Creature'],['Turtle'],Common,TPR,1,4,None,None
Hammerhead Shark,2.0,['Blue'],['U'],None,['Creature'],['Shark'],Common,TPR,2,3,None,Hammerhead Shark can't attack unless defending player controls an Island.
Harrow,3.0,['Green'],['G'],None,['Instant'],None,Common,TPR,None,None,None,"As an additional cost to cast this spell, sacrifice a land.\nSearch your library for up to two basic land cards, put them onto the battlefield, then shuffle."
Conviction,2.0,['White'],['W'],None,['Enchantment'],['Aura'],Common,TPR,None,None,None,Enchant creature\nEnchanted creature gets +1/+3.\n{W}: Return Conviction to its owner's hand.
Gaseous Form,3.0,['Blue'],['U'],None,['Enchantment'],['Aura'],Common,TPR,None,None,None,Enchant creature\nPrevent all combat damage that would be dealt to and dealt by enchanted creature.
Endangered Armodon,4.0,['Green'],['G'],None,['Creature'],['Elephant'],Common,TPR,4,5,None,"When you control a creature with toughness 2 or less, sacrifice Endangered Armodon."
Bandage,1.0,['White'],['W'],None,['Instant'],None,Common,TPR,None,None,None,Prevent the next 1 damage that would be dealt to any target this turn.\nDraw a card.
Forbid,3.0,['Blue'],['U'],None,['Instant'],None,Rare,TPR,None,None,None,"Buyback—Discard two cards. (You may discard two cards in addition to any other costs as you cast this spell. If you do, put this card into your hand as it resolves.)\nCounter target spell."
