Name,CMC,Colors,Color identity,Supertypes,Types,Subtypes,Rarity,Set,Power,Toughness,Loyalty,Text
Academy Rector,4.0,['White'],['W'],None,['Creature'],"['Human', 'Cleric']",Rare,UDS,1,2,None,"When Academy Rector dies, you may exile it. If you do, search your library for an enchantment card, put that card onto the battlefield, then shuffle."
False Prophet,4.0,['White'],['W'],None,['Creature'],"['Human', 'Cleric']",Rare,UDS,2,2,None,"When False Prophet dies, exile all creatures."
Body Snatcher,4.0,['Black'],['B'],None,['Creature'],"['Phyrexian', 'Minion']",Rare,UDS,2,2,None,"When Body Snatcher enters the battlefield, exile it unless you discard a creature card.\nWhen Body Snatcher dies, exile Body Snatcher and return target creature card from your graveyard to the battlefield."
Capashen Templar,3.0,['White'],['W'],None,['Creature'],"['Human', 'Knight']",Common,UDS,2,2,None,{W}: Capashen Templar gets +0/+1 until end of turn.
Attrition,3.0,['Black'],['B'],None,['Enchantment'],None,Rare,UDS,None,None,None,"{B}, Sacrifice a creature: Destroy target nonblack creature."
Capashen Standard,1.0,['White'],['W'],None,['Enchantment'],['Aura'],Common,UDS,None,None,None,"Enchant creature\nEnchanted creature gets +1/+1.\n{2}, Sacrifice Capashen Standard: Draw a card."
Apprentice Necromancer,2.0,['Black'],['B'],None,['Creature'],"['Zombie', 'Wizard']",Rare,UDS,1,1,None,"{B}, {T}, Sacrifice Apprentice Necromancer: Return target creature card from your graveyard to the battlefield. That creature gains haste. At the beginning of the next end step, sacrifice it."
Treachery,5.0,['Blue'],['U'],None,['Enchantment'],['Aura'],Rare,UDS,None,None,None,"Enchant creature\nWhen Treachery enters the battlefield, untap up to five lands.\nYou control enchanted creature."
Thieving Magpie,4.0,['Blue'],['U'],None,['Creature'],['Bird'],Uncommon,UDS,1,3,None,"Flying (This creature can't be blocked except by creatures with flying or reach.)\nWhenever Thieving Magpie deals damage to an opponent, draw a card."
Temporal Adept,3.0,['Blue'],['U'],None,['Creature'],"['Human', 'Wizard']",Rare,UDS,1,1,None,"{U}{U}{U}, {T}: Return target permanent to its owner's hand."
